query,relevant_pages,contexts,answer
Какое действие считается моментом Активации ПВЗ?,['1'],"['ОФЕРТАоб оказании услуг в ПВЗ\n1. Термины и определения\n1.1. Активация ПВЗ — процесс, в результате которого ПВЗ Исполнителя становится действующим, моментом\nАктивации ПВЗ признается получение Исполнителем подтверждения от Заказчика о возможной Активации в\nсоответствии с п. 3.2 Договора.\n1.2. Аудит ПВЗ — действия, совершаемые различными способами Заказчиком по проверке соответствия ПВЗ\nИсполнителя в части соблюдения Регламента состояния ПВЗ.\n1.3. Баланс — сведения, отраженные в Личном кабинете Исполнителя о начисленном Исполнителю\nвознаграждении за оказанные Услуги, с учетом сумм неустоек (штрафов) и возмещаемых Исполнителем\nзадолженностей, а также с учетом суммы иных обязательств Исполнителя перед Заказчиком.\n1.4. Блокировка ПВЗ — частичное ограничение функционала Портала в отношении ПВЗ, применяемое в порядке,\nпредусмотренном Договором.', 'ОФЕРТАоб оказании услуг в ПВЗ\n1. Термины и определения\n1.1. Активация ПВЗ — процесс, в результате которого ПВЗ Исполнителя становится действующим, моментом\nАктивации ПВЗ признается получение Исполнителем подтверждения от Заказчика о возможной Активации в\nсоответствии с п. 3.2 Договора.\n1.2. Аудит ПВЗ — действия, совершаемые различными способами Заказчиком по проверке соответствия ПВЗ\nИсполнителя в части соблюдения Регламента состояния ПВЗ.\n1.3.', 'Активация ПВЗ происходит с момента\nполучения Исполнителем сообщения об активации, и ПВЗ считается действующим с такого момента.\n\n• Заявка отклоняется с указанием причин отказа и рекомендаций по их устранению.\n3.2.2. В случае получения Исполнителем отказа в Активации ПВЗ, Исполнитель вправе повторно подать заявку\nна Активацию ПВЗ в установленном Договором порядке.\n3.2.3. Основанием для отклонения заявок на открытие и Активацию ПВЗ в том числе могут являться:\n3.2.3.1. несоблюдение требований, указанных в Регламенте состояния ПВЗ;\n3.2.3.2. предоставление ложных (недостоверных) сведений; сведений, содержащих противоречивую,\nнеполную информацию; не предоставление документов или предоставление документов в нечитаемых форматах,\nвключая случаи, когда документ(ы) не открываются на ЭВМ, либо открываются с ошибками, не позволяющими\nознакомиться с содержащейся в них информацией, а также информацию, находящуюся в документах с низким\nкачеством изображения, не позволяющим изучить такую информацию.\n3.2.4.', 'ОФЕРТАоб оказании услуг в ПВЗ\n1. Термины и определения\n1.1. Активация ПВЗ — процесс, в результате которого ПВЗ Исполнителя становится действующим, моментом\nАктивации ПВЗ признается получение Исполнителем подтверждения от Заказчика о возможной Активации в\nсоответствии с п.', 'Активация ПВЗ происходит с момента\nполучения Исполнителем сообщения об активации, и ПВЗ считается действующим с такого момента.\n\n• Заявка отклоняется с указанием причин отказа и рекомендаций по их устранению.\n3.2.2. В случае получения Исполнителем отказа в Активации ПВЗ, Исполнитель вправе повторно подать заявку\nна Активацию ПВЗ в установленном Договором порядке.\n3.2.3. Основанием для отклонения заявок на открытие и Активацию ПВЗ в том числе могут являться:\n3.2.3.1. несоблюдение требований, указанных в Регламенте состояния ПВЗ;\n3.2.3.', 'Активация ПВЗ происходит с момента\nполучения Исполнителем сообщения об активации, и ПВЗ считается действующим с такого момента.\n\n• Заявка отклоняется с указанием причин отказа и рекомендаций по их устранению.\n3.2.2.', '3.1.4. Исполнитель обязан при подготовке к открытию ПВЗ выполнить все условия и требования к состоянию\nПВЗ, указанные в Договоре и Регламенте состояния ПВЗ, в течение 30 (тридцати) календарных дней с даты\nодобрения заявки на открытие ПВЗ.\n3.1.5. Заказчиком устанавливаются зоны открытия ПВЗ в соответствии с Тепловой картой, которая учитывает\nнагрузку на действующие в данной зоне ПВЗ и плотность населения в конкретном районе. Размещение в одном\nстроении/здании более одного ПВЗ не допускается, за исключением случаев, согласованных с Заказчиком.\n3.2. Активация ПВЗ\n3.2.1. С момента одобрения Заказчиком заявки Исполнителя на открытие ПВЗ и выполнения Исполнителем\nусловий п. 3.1.4 Договора Исполнитель вправе подать заявку на Активацию ПВЗ через Портал. Заявка на Активацию\nПВЗ должна соответствовать требованиям и содержать документацию, указанную в Регламенте состояния ПВЗ.\nПосле окончания проверки Заказчиком принимается одно из следующих решений:\n• Заявка Исполнителя на Активацию ПВЗ считается одобренной.', 'Размещение в одном\nстроении/здании более одного ПВЗ не допускается, за исключением случаев, согласованных с Заказчиком.\n3.2. Активация ПВЗ\n3.2.1. С момента одобрения Заказчиком заявки Исполнителя на открытие ПВЗ и выполнения Исполнителем\nусловий п. 3.1.4 Договора Исполнитель вправе подать заявку на Активацию ПВЗ через Портал. Заявка на Активацию\nПВЗ должна соответствовать требованиям и содержать документацию, указанную в Регламенте состояния ПВЗ.', 'После окончания проверки Заказчиком принимается одно из следующих решений:\n• Заявка Исполнителя на Активацию ПВЗ считается одобренной.', '2. Правила Активации ПВЗ\nПредоставьте видеообзор ПВЗ для подтверждения брендирования, в котором необходимо\nпродемонстрировать:\n• адресную табличку дома;\n• панорамный вид окрестности;\n• фасад с вывеской и режимом работы;\n• клиентскую зону (зону выдачи/приемки Товаров, примерки Товаров Клиентами) полностью;\n• складскую зону (зону местонахождения Товаров) полностью.\n3. Требования, предъявляемые к ПВЗ Исполнителя\n3.1. ПВЗ – помещение или часть помещения, здания, дома, находящееся у Исполнителя в собственности или во\nвладении и пользовании или на ином законном основании, в котором Исполнитель непосредственно оказывает\nУслуги.\n3.2. При Активации ПВЗ Исполнитель обязан предоставить правоустанавливающие документы на помещение\nЗаказчику, выписку из ЕГРН или технический план БТИ или иные документы. При этом выписка из ЕГРН должна быть\nполучена Исполнителем в срок, не превышающий 1 (один) месяц до даты Активации ПВЗ. Заказчик оставляет за\nсобой право запросить дополнительные документы.\n3.3.']",Моментом Активации ПВЗ считается **получение Исполнителем подтверждения от Заказчика о возможной Активации**.
Что понимается под Блокировкой ПВЗ согласно оферте?,['1'],"['ОФЕРТАоб оказании услуг в ПВЗ\n1. Термины и определения\n1.1. Активация ПВЗ — процесс, в результате которого ПВЗ Исполнителя становится действующим, моментом\nАктивации ПВЗ признается получение Исполнителем подтверждения от Заказчика о возможной Активации в\nсоответствии с п. 3.2 Договора.\n1.2. Аудит ПВЗ — действия, совершаемые различными способами Заказчиком по проверке соответствия ПВЗ\nИсполнителя в части соблюдения Регламента состояния ПВЗ.\n1.3. Баланс — сведения, отраженные в Личном кабинете Исполнителя о начисленном Исполнителю\nвознаграждении за оказанные Услуги, с учетом сумм неустоек (штрафов) и возмещаемых Исполнителем\nзадолженностей, а также с учетом суммы иных обязательств Исполнителя перед Заказчиком.\n1.4. Блокировка ПВЗ — частичное ограничение функционала Портала в отношении ПВЗ, применяемое в порядке,\nпредусмотренном Договором.', '1.4. Блокировка ПВЗ — частичное ограничение функционала Портала в отношении ПВЗ, применяемое в порядке,\nпредусмотренном Договором.', '– 8.5.5. Договора.\nБлокировка выплат ПВЗ вводится с даты направления Исполнителю уведомления о Блокировке выплат ПВЗ и до\nдаты прекращения проводимой Заказчиком проверки и/или устранения, допущенного Исполнителем нарушения.', 'В случае подтверждения обстоятельств, указанных в обращении\nИсполнителя, Блокировка ПВЗ прекращается Заказчиком.\n13.4. Заказчик вправе осуществить Блокировку ПВЗ Исполнителя по инициативе Исполнителя в случаях, если у\nИсполнителя возникли или могут возникнуть обстоятельства, препятствующие исполнению Договора в полном\nобъеме или частично, в том числе: у Исполнителя возникли проблемы с использованием ПВЗ (аренда или иное),\nИсполнитель готовится к переезду в другой ПВЗ или осуществляет ремонт в текущем ПВЗ, либо по иной причине.\n13.5. Заказчик вправе применить к Исполнителю Блокировку выплат ПВЗ, в случаях проведения Заказчиком\nпроверки Исполнителя на предмет нарушения Договора и/или выявления Заказчиком нарушений Исполнителем\nтаких условий Договора, как снижение Рейтинга ПВЗ до Минимального значения рейтинга ПВЗ, не предоставления\nнеобходимых документов в соответствии с п. 8.5, включая п. 8.5.1. – 8.5.5. Договора.\nБлокировка выплат ПВЗ вводится с даты направления Исполнителю уведомления о Блокировке выплат ПВЗ и до\nдаты прекращения проводимой Заказчиком проверки и/или устранения, допущенного Исполнителем нарушения.', 'за исключением случаев\nвыполнения Исполнителем направленных ему до Блокировки ПВЗ Поручений по приему и выдаче Товаров.\n1.5. Блокировка выплат ПВЗ — частичное ограничение в отношении ПВЗ Исполнителя, применяемое в порядке,\nпредусмотренном Договором.', 'Под частичным ограничением функционала понимаются в том числе временные\nограничения на объем доступных операций и функциональные возможности Портала, не позволяющие Исполнителю\nпринимать Товары в ПВЗ, а Клиентам выбирать ПВЗ Исполнителя для получения Товаров, за исключением случаев\nвыполнения Исполнителем направленных ему до Блокировки ПВЗ Поручений по приему и выдаче Товаров.\n1.5. Блокировка выплат ПВЗ — частичное ограничение в отношении ПВЗ Исполнителя, применяемое в порядке,\nпредусмотренном Договором. Под частичным ограничением понимаются, в том числе, приостановка возможности\nполучения Вознаграждения с Баланса Исполнителя или временное неперечисление Вознаграждения Исполнителю.\n1.6. Возвратные коробки — коробки для складирования Товара, предназначенные для направления на Склад.\n1.7. Группа компаний Вайлдберриз — любое юридическое лицо, входящее в группу компаний в том числе,\nнаходящееся под прямым или косвенным контролем Общества с ограниченной ответственностью «РВБ»,\nзарегистрированное в соответствии с законодательством Российской Федерации, ОГРН 1247700471919 (далее –\nООО «РВБ»).\n1.8.', '13. Блокировка ПВЗ\n13.1. Независимо от применения штрафов в соответствии с Приложением № 4 к Договору Заказчик в целях\nпресечения нарушения Исполнителем обязательств по Договору, в том числе на будущий период и/или длящихся\nнарушений и/или защиты прав третьих лиц, осуществляет Блокировку ПВЗ в нижеследующих случаях.', 'Исполнитель обязан оказывать Услуги в ПВЗ, независимо от применения Блокировки выплат ПВЗ. Блокировка\nвыплат ПВЗ, применяемая к Исполнителю в соответствии с настоящим пунктом, не ограничивает иные\nфункциональные возможности, предоставляемые Заказчиком Исполнителю в целях исполнения Договора.\nБлокировка выплат ПВЗ не изменяет какие-либо условия Договора, которые продолжают действовать для обеих\nСторон без исключений.\n14. Деактивация и расторжение Договора\n14.1. Заказчик вправе отказаться от исполнения Договора в одностороннем внесудебном порядке полностью или\nв части определенного ПВЗ Исполнителя, при наличии у Исполнителя более 1 (одного) ПВЗ, то есть осуществить\nпроцесс Деактивации ПВЗ.\n14.2. Заказчик инициирует процесс Деактивации ПВЗ в указанных ниже случаях:\nОснования и порядок Деактивации Прекращение процессаДеактивации (еслиприменимо)\n1 Если Доля Подмен за последние 30 (тридцать) календарных дней подрядоказания Услуг Исполнителем в ПВЗ будет составлять более 1% (одногопроцента).', '7.1., 7.1.1., 7.1.2. и 7.2 Договора, если в течение 12 (двенадцати) календарных месяцев или, если в течение 18\n(восемнадцати) календарных месяцев, при получении от одной до девяти Дополнительных выплат согласно п. 7.2.\nДоговора, после Активации ПВЗ произойдет любое из нижеследующих событий:\n• Деактивация ПВЗ Исполнителя в результате прекращения оказания Услуг в ПВЗ Исполнителем по\nоснованиям, предусмотренным Договором;\n• Смена Исполнителя. Под сменой Исполнителя понимается замена Стороны Исполнителя по Договору, при\nкоторой изначальный Исполнитель передаёт все права и обязанности по Договору новому Исполнителю.\nИсполнитель обязан возвратить Заказчику суммы Дополнительных поддерживающих выплат:\n• в течение 5 (пяти) календарных дней до даты Деактивации ПВЗ Исполнителя;\n• не позднее 5 (пяти) календарных дней до даты смены Исполнителя.', 'Под сменой Исполнителя понимается замена Стороны Исполнителя по Договору, при\nкоторой изначальный Исполнитель передаёт все права и обязанности по Договору новому Исполнителю.\nИсполнитель обязан возвратить Заказчику суммы Дополнительных поддерживающих выплат:\n• в течение 5 (пяти) календарных дней до даты Деактивации ПВЗ Исполнителя;\n• не позднее 5 (пяти) календарных дней до даты смены Исполнителя.']","Под Блокировкой ПВЗ согласно оферте понимается **частичное ограничение функционала Портала в отношении ПВЗ Исполнителя**, применяемое в порядке, предусмотренном Договором.  

Оно включает в себя:

- временные ограничения на объем доступных операций и функциональные возможности Портала,  
- невозможность Исполнителю принимать Товары в ПВЗ,  
- невозможность Клиентам выбирать ПВЗ Исполнителя для получения Товаров (за исключением случаев выполнения Поручений по приему и выдаче Товаров до Блокировки),  
- приостановку возможности получения Вознаграждения с Баланса Исполнителя или временное неперечисление Вознаграждения Исполнителю.  

Блокировка выплат ПВЗ вводится с даты направления уведомления Исполнителю и продолжается до даты прекращения проверки и/или устранения нарушения.  

Блокировка не ограничивает обязанность Исполнителя оказывать Услуги в ПВЗ и не изменяет действующие условия Договора."
"Какие действия могут привести к удержанию Товаров в качестве Подмен, и в течение какого срока Исполнитель может оспорить факт подмены?",['1'],"['12.2. Исполнитель посредством функционала Портала вправе оспорить произведенное Заказчиком удержание\nстоимости подготовки Товаров к возврату на Склад, утраченных, утерянных, Зависших Товаров, Товаров с\nнедостатком, или Подмен в течение 7 (семи) календарных дней с момента информирования Исполнителя путём\nразмещения соответствующих сведений об удержании на Портале с помощью обращения, поданного через Личный\nкабинет, с приложением подтверждающих документов, в том числе видеоматериалов, подтверждающих\nнеобоснованность примененной ответственности.', 'Максимальный срок рассмотрения в любом случае не\nможет превышать 30 (тридцать) календарных дней.\n12.2. Исполнитель посредством функционала Портала вправе оспорить произведенное Заказчиком удержание\nстоимости подготовки Товаров к возврату на Склад, утраченных, утерянных, Зависших Товаров, Товаров с\nнедостатком, или Подмен в течение 7 (семи) календарных дней с момента информирования Исполнителя путём\nразмещения соответствующих сведений об удержании на Портале с помощью обращения, поданного через Личный\nкабинет, с приложением подтверждающих документов, в том числе видеоматериалов, подтверждающих\nнеобоснованность примененной ответственности. После истечения указанного срока Исполнитель утрачивает право\nна оспаривание удержанной Заказчиком суммы. Обращение Исполнителя рассматривается в срок, необходимый для\nполного и всестороннего рассмотрения всех обстоятельств, а также получения дополнительной информации и\n\nдокументов от Исполнителя при необходимости, о чем Заказчик уведомляет Исполнителя. Максимальный срок\nрассмотрения в любом случае не может превышать 30 (тридцать) календарных дней.\n12.3.', 'В\nсовокупную Стоимость Товаров, удержанных в качестве Подмен, включаются Подмены, по которым Исполнителем\nне был оспорен факт подмены Товара в период его нахождения в ПВЗ Исполнителя в течение 7 (семи) календарных\nдней с момента обнаружения Заказчиком Подмены', 'В\nсовокупную Стоимость Товаров, удержанных в качестве Подмен, включаются Подмены, по которым Исполнителем\nне был оспорен факт подмены Товара в период его нахождения в ПВЗ Исполнителя в течение 7 (семи) календарных\nдней с момента обнаружения Заказчиком Подмены и/или Исполнителем не было предоставлено Заказчику\n\nдоказательств отсутствия подмены Товара в период его нахождения в ПВЗ Исполнителя.', 'В\nсовокупную Стоимость Товаров, удержанных в качестве Подмен, включаются Подмены, по которым Исполнителем\nне был оспорен факт подмены Товара в период его нахождения в ПВЗ Исполнителя в течение 7 (семи) календарных\nдней с момента обнаружения Заказчиком Подмены и/или Исполнителем не было предоставлено Заказчику\n\nдоказательств отсутствия подмены Товара в период его нахождения в ПВЗ Исполнителя. Заказчик предоставляет\nИсполнителю через Личный кабинет всю необходимую информацию о Доле Подмен Исполнителя, ее снижении или\nувеличении в течение периода оказания услуг Исполнителем в ПВЗ.\n1.12. Зависшие Товары — Товары, которые не приняты Исполнителем, или не выданы Получателю согласно\nПоручению, или не возращены на Склад в Возвратных коробках.\n1.13. Заказчик — одно из перечисленных в настоящей Оферте об оказании услуг в ПВЗ юридических лиц Группы\nкомпаний Вайлдберриз, зарегистрированное в юрисдикции страны по месту государственной регистрации Заказчика:\n1.13.1.', 'Товаров с\nнедостатком, или Подмен в течение 7 (семи) календарных дней с момента информирования Исполнителя путём\nразмещения соответствующих сведений об удержании на Портале с помощью обращения, поданного через Личный\nкабинет, с приложением подтверждающих документов,', 'В случае поступления по указанному Заказчиком адресу\nТоваров с недостатками (включая, но не ограничиваясь: частичное повреждение, неверное вложение) и/или Подмен,\nИсполнитель обязуется возместить Стоимость Товаров с недостатками и/или замененных на Подмены.\nВзаиморасчеты по недостачам и недостаткам Товаров производятся Сторонами в соответствии с условиями\nДоговора.\n14.10. Утвержденная Заказчиком заявка Исполнителя на осуществление процесса Деактивации ПВЗ не может\nбыть отозвана Исполнителем. Данное условие не лишает Исполнителя возможности осуществить Активацию нового\nПВЗ.\n14.11. При расторжении Договора по любому основанию Исполнитель обязан передать Заказчику Товары,\nнаходящиеся в ПВЗ, по первому требованию Заказчика в течение 3 (трех) календарных дней с даты получения\nсоответствующего требования, а также предоставить доступ представителям Заказчика к Товарам в ПВЗ для\nпроведения инвентаризации. В указанном случае Стороны проводят сверку по взаимным обязательствам и на\nосновании сверки осуществляют итоговые взаиморасчеты в течение 60 (шестидесяти) календарных дней с даты\nрасторжения Договора.', 'В случае поступления по указанному Заказчиком адресу\nТоваров с недостатками (включая, но не ограничиваясь: частичное повреждение, неверное вложение) и/или Подмен,\nИсполнитель обязуется возместить Стоимость Товаров с недостатками и/или замененных на Подмены.\nВзаиморасчеты по недостачам и недостаткам Товаров производятся Сторонами в соответствии с условиями\nДоговора.\n14.10. Утвержденная Заказчиком заявка Исполнителя на осуществление процесса Деактивации ПВЗ не может\nбыть отозвана Исполнителем.', '1.11. Доля Подмен — процентное соотношение совокупной Стоимости Товаров, удержанных в качестве Подмен, к\nОбороту ПВЗ Исполнителя за период времени, определенный в соответствующем положении Договора.', '1.29. Подмена — направленный Исполнителем Заказчику Товар, который не соответствует Товару, указанному в\nсоответствующем Поручении Исполнителю (Заказчиком было зафиксировано несоответствие вложенного Товара в\nупаковке/таре/товарной упаковке Товару, указанному в Поручении).\n1.30. Получатель — физическое или юридическое лицо, или индивидуальный предприниматель, указываемые в\nПоручении в качестве адресата, получающего Товар. В качестве Получателя могут выступать Клиент, Продавец,\nЗаказчик, Перевозчик, Курьер, а также иные лица, привлеченные Заказчиком.']","Действия, которые могут привести к удержанию Товаров в качестве Подмены:

- Исполнитель направлен Заказчику Товар, который не соответствует Товару, указанному в соответствующем Поручении (т.е. произошла Подмена).  
- Подмена определяется как несоответствие вложенного Товара в упаковке/таре/товарной упаковке Товару, указанному в Поручении (согласно определению в 1.29).

Срок, в течение которого Исполнитель может оспорить факт подмены:

- Исполнитель может оспорить факт подмены в течение **7 (семи) календарных дней** с момента обнаружения Заказчиком Подмены.

После истечения этого срока Исполнитель утрачивает право на оспаривание удержанной суммы."
Какое определение дается термину «Зависшие Товары» в оферте?,['2'],"['В\nсовокупную Стоимость Товаров, удержанных в качестве Подмен, включаются Подмены, по которым Исполнителем\nне был оспорен факт подмены Товара в период его нахождения в ПВЗ Исполнителя в течение 7 (семи) календарных\nдней с момента обнаружения Заказчиком Подмены и/или Исполнителем не было предоставлено Заказчику\n\nдоказательств отсутствия подмены Товара в период его нахождения в ПВЗ Исполнителя. Заказчик предоставляет\nИсполнителю через Личный кабинет всю необходимую информацию о Доле Подмен Исполнителя, ее снижении или\nувеличении в течение периода оказания услуг Исполнителем в ПВЗ.\n1.12. Зависшие Товары — Товары, которые не приняты Исполнителем, или не выданы Получателю согласно\nПоручению, или не возращены на Склад в Возвратных коробках.\n1.13. Заказчик — одно из перечисленных в настоящей Оферте об оказании услуг в ПВЗ юридических лиц Группы\nкомпаний Вайлдберриз, зарегистрированное в юрисдикции страны по месту государственной регистрации Заказчика:\n1.13.1.', '1.12. Зависшие Товары — Товары, которые не приняты Исполнителем, или не выданы Получателю согласно\nПоручению, или не возращены на Склад в Возвратных коробках.\n1.13.', 'Заказчик предоставляет\nИсполнителю через Личный кабинет всю необходимую информацию о Доле Подмен Исполнителя, ее снижении или\nувеличении в течение периода оказания услуг Исполнителем в ПВЗ.\n1.12. Зависшие Товары — Товары, которые не приняты Исполнителем, или не выданы Получателю согласно\nПоручению, или не возращены на Склад в Возвратных коробках.\n1.13.', 'В отношении Зависших Товаров - совокупная Стоимость Зависших Товаров удерживается Заказчиком в\nслучае, если Исполнителем не был оспорен факт утери Товара в период его нахождения в ПВЗ Исполнителя в\nтечение 7 (семи) календарных дней с момента обнаружения Заказчиком Зависших Товаров и/или Исполнителем не\nбыло предоставлено Заказчику доказательств наличия Товара в период его нахождения в ПВЗ Исполнителя и\nвозврата на Склад.\n11.6.', 'внутри\nвскрытого, подготовленного и упакованного или имеющего следы стороннего скотча (в том числе скотча\nИсполнителя) Товара;\n7) выдача Исполнителем Товаров третьему лицу без подтверждения полномочий от Клиента и/или\nПеревозчика и/или Заказчика и/или Курьера.\nВ отношении Зависших Товаров - совокупная Стоимость Зависших Товаров удерживается Заказчиком в\nслучае, если Исполнителем не был оспорен факт утери Товара в период его нахождения в ПВЗ Исполнителя в\nтечение 7 (семи) календарных дней с момента обнаружения Заказчиком Зависших Товаров и/или Исполнителем не\nбыло предоставлено Заказчику доказательств наличия Товара в период его нахождения в ПВЗ Исполнителя и\nвозврата на Склад.\n11.6. Возмещение Исполнителем убытков и/или уплата неустойки (пени, штрафы) не освобождает его от\nустранения допущенных нарушений.\n12. Меры по урегулированию споров\nОспаривание штрафов и удержаний Исполнителем.\n12.1.', 'В отношении Зависших Товаров - совокупная Стоимость Зависших Товаров удерживается Заказчиком в\nслучае, если Исполнителем не был оспорен факт утери Товара в период его нахождения в ПВЗ Исполнителя в\nтечение 7 (семи) календарных дней с момента обнаружения Заказчиком', '1.27. Оферта — условия настоящей оферты об оказании услуг в ПВЗ, которая содержит все существенные\nусловия и принятие которой влечет заключение Договора на указанных в Оферте условиях.\n1.28. Перевозчик — лицо, осуществляющее перевозку Товаров по указанию Заказчика на основании договора\nтранспортной экспедиции / договора перевозки / договора оказания курьерских услуг или любого иного договора,\n\nпредусматривающего перевозку Товара.\n1.29. Подмена — направленный Исполнителем Заказчику Товар, который не соответствует Товару, указанному в\nсоответствующем Поручении Исполнителю (Заказчиком было зафиксировано несоответствие вложенного Товара в\nупаковке/таре/товарной упаковке Товару, указанному в Поручении).\n1.30. Получатель — физическое или юридическое лицо, или индивидуальный предприниматель, указываемые в\nПоручении в качестве адресата, получающего Товар. В качестве Получателя могут выступать Клиент, Продавец,\nЗаказчик, Перевозчик, Курьер, а также иные лица, привлеченные Заказчиком.\n1.31. Пользовательское соглашение — условия использования Портала и входящих в него сервисов.', 'Раздел 1. Термины и определения Оферты:\nРаздел Термины и определения Оферты об оказании услуг в ПВЗ дополняется следующими терминами и\nопределениями:\n1. Рекламные материалы — статический или динамический видеоряд, содержащий в себе рекламную\nинформацию от третьих лиц и предназначенный для трансляции на оборудовании. Исполнитель не является\nрекламораспространителем в рамках настоящего Приложения и не несет ответственности за распространение\nРекламных материалов. Все действия, связанные с трансляцией, размещением и распространением Рекламных\nматериалов, осуществляются исключительно Заказчиком или третьими лицами, привлеченными Заказчиком.\nИсполнитель не принимает на себя обязательств по контролю, проверке или модерации Рекламных материалов и не\nнесет ответственности за любые последствия, связанные с их распространением.\n2. Самореклама  — продвижение собственных продуктов, услуг, правил пользования, условий приобретения,\nхозяйственной деятельности, цен и скидок, акций и мероприятий Заказчика на оборудовании.\n3.', '1.43. Товар — товар(ы), предназначенный для передачи Заказчиком Продавцу, Продавцом Заказчику,\nПродавцом Клиенту, либо приобретённый Клиентом у Продавца по договору розничной купли-продажи,\nзаключенному дистанционным способом,', 'за Услуги,\nпредусмотренные Договором или в качестве оплаты за Товары по Договору или любые другие товары;\n2.']","Термин «Зависшие Товары» определяется в оферте следующим образом:

**Зависшие Товары — Товары, которые не приняты Исполнителем, или не выданы Получателю согласно Поручению, или не возращены на Склад в Возвратных коробках.**"
Какие юридические лица могут быть Заказчиками в зависимости от места государственной регистрации Исполнителя?,['2'],"['1.15. Инструкции — информация, размещаемая Заказчиком через Портал в различном виде, содержащая\nправила, указания или руководства, устанавливающие порядок и способ оказания Услуг, использования Портала.\nИнструкции являются обязательными для ознакомления и соблюдения Исполнителем и иными лицами,\nпривлеченными Исполнителем для оказания Услуг в ПВЗ.\n1.16. Исполнитель — коммерческая организация, или индивидуальный предприниматель, или иное лицо, в\nзависимости от места государственной регистрации Исполнителя, заключившие Договор на условиях Оферты об\nоказании услуг в ПВЗ.\n1.17.', '1.16. Исполнитель — коммерческая организация, или индивидуальный предприниматель, или иное лицо, в\nзависимости от места государственной регистрации Исполнителя, заключившие Договор на условиях Оферты об\nоказании услуг в ПВЗ.\n1.17.', '17.4. Права и обязанности Заказчика в полном объеме или в части, включая уступку только прав по Оферте,\nмогут быть переданы и/или уступлены Заказчиком любому лицу из Группы компаний Вайлдберриз. Требования\nЗаказчика к Исполнителю по Оферте, в том числе требования об уплате неустоек и возмещении убытков, могут быть\nуступлены Заказчиком третьим лицам без получения предварительного согласия Исполнителя. Исполнитель\nпризнается выразившим согласие на такую передачу с момента совершения им действий, свидетельствующих о\nсогласии с настоящим условием. Права и обязанности по Оферте переходят к третьему лицу с момента\nуведомления Исполнителя о состоявшемся переходе или истечения срока, указанного в таком уведомлении, путем\nопубликования соответствующего сообщения на Портале. Права и обязанности Заказчика переходят к такому\nтретьему лицу в полном объеме и в том составе, в котором они существуют на момент перехода.\n17.5. К отношениям сторон по настоящему Договору применяется право государства — места регистрации\nЗаказчика, за исключением случаев, прямо предусмотренных Договором.', 'Общество с ограниченной ответственностью «РВБ» (ОГРН 1247700471919, ИНН 9714053621),\nзарегистрированное и действующее по законодательству Российской Федерации, адрес юридического лица: 142181,\nМосковская область, г.о. Подольск, д. Коледино, тер. Индустриальный Парк Коледино, д. 6, строение 1 — если\nИсполнитель по месту государственной регистрации находится на территории Российской Федерации;\n1.13.2. Товарищество с ограниченной ответственностью «ИМВБКЗ» (БИН 220240020422), зарегистрированное и\nдействующее по законодательству Республики Казахстан, адрес юридического лица: 050040, РК, г. Алматы,\nБостандыкский район, проспект Аль-Фараби 77/8, 3 этаж, офис 3В – если Исполнитель по месту государственной\nрегистрации находится на территории Республики Казахстан;\n1.13.3. Общество с ограниченной ответственностью «ИМВБАМ» (ИНН 02899159), зарегистрированное и\nдействующее по законодательству Республики Армения, адрес юридического лица: Республика Армения, г. Ереван,\nЦентр, ул. А. Манукяна, д. 17, стр.', 'А. Манукяна, д. 17, стр. 41 – если Исполнитель по месту государственной регистрации находится на\nтерритории Республики Армения;\n1.13.4. Общество с ограниченной ответственностью «ИМВБРБ» (ИНН 193630204), зарегистрированное и\nдействующее по законодательству Республики Беларусь, адрес юридического лица: Республика Беларусь, 220036, г.\nМинск, ул. Грушевская, д. 21, пом. 217 — если Исполнитель по месту государственной регистрации находится на\nтерритории Республики Беларусь;\n1.13.5. Общество с ограниченной ответственностью «ВБ КейДжи» (ИНН 01506202210353), зарегистрированное и\nдействующее по законодательству Республики Кыргызстан, адрес юридического лица: Кыргызская Республика, г.\nБишкек, Первомайский район, ул. Табалдиева, д. 45, 2-Этаж 2 Офис – если Исполнитель по месту государственной\nрегистрации находится на территории Республики Кыргызстан;\n1.13.6.', 'А. Манукяна, д. 17, стр. 41 – если Исполнитель по месту государственной регистрации находится на\nтерритории Республики Армения;\n1.13.4. Общество с ограниченной ответственностью «ИМВБРБ» (ИНН 193630204), зарегистрированное и\nдействующее по законодательству Республики Беларусь, адрес юридического лица: Республика Беларусь, 220036, г.\nМинск, ул. Грушевская, д. 21, пом. 217 — если Исполнитель по месту государственной регистрации находится на\nтерритории Республики Беларусь;\n1.13.5.', 'направляются по адресу\nместа нахождения Стороны-получателя: для Заказчика — указанному в ЕГРЮЛ, а для Исполнителя — по адресу,\nуказанному на Портале или по месту нахождения ПВЗ;\n• на адрес электронной почты Исполнителя,', '8.9. Стороны пришли к соглашению, что в целях исполнения обязательств Исполнителя, зарегистрированного на\nтерритории Российской Федерации, перед Заказчиком в рамках настоящего Договора, в том числе, но не\nограничиваясь в целях погашения любой задолженности по Договору,', 'А. Манукяна, д. 17, стр. 41 – если Исполнитель по месту государственной регистрации находится на\nтерритории Республики Армения;\n1.13.4.', 'Махтумкули, д. 1, БЦ «Kayan» – если Исполнитель по\nместу государственной регистрации находится на территории Республики Узбекистан.\n1.14.']","Из предоставленного контекста **не указано**, какие юридические лица могут быть **Заказчиками** в зависимости от места государственной регистрации Исполнителя.

Контекст содержит информацию о **местах государственной регистрации Исполнителя** и указывает, какие юридические лица могут быть **Исполнителями** в зависимости от места их регистрации (например, «РВБ», «ИМВБКЗ», «ИМВБАМ» и др.).

Однако **никакой информации** нет о том, какие юридические лица могут быть **Заказчиками** и как они зависят от места государственной регистрации Исполнителя.

**Ответ: информация недостаточна.**"
"Какие нормативные правовые акты регулируют обработку персональных данных в зависимости от страны, где находится Исполнитель?",['2'],"['Общество с ограниченной ответственностью «WB INT EXPORT» (ИНН 309278905), зарегистрированное и\nдействующее по законодательству Республики Узбекистан, адрес юридического лица: Республика Узбекистан,\n1726277, г. Ташкент, Яшнабадский район, МСГ «Чулпон», ул. Махтумкули, д. 1, БЦ «Kayan» – если Исполнитель по\nместу государственной регистрации находится на территории Республики Узбекистан.\n1.14. Законодательство в области персональных данных — совокупность нормативных правовых актов,\nприменимых к обработке персональных данных, осуществляемой Сторонами, в зависимости от региона, в котором\nосуществляет деятельность Исполнитель:\n1.14.1. для Российской Федерации — Федеральный закон от 27.07.2006 № 152-ФЗ «О персональных данных»;\n1.14.2. для Республики Казахстан — Закон Республики Казахстан от 21.05.2013 № 94-V «О персональных\nданных и их защите»;\n1.14.3. для Республики Армения — Закон Республики Армения от 13.06.2015 № ЗР-49 «О защите личных\nданных»;\n1.14.4. для Республики Беларусь — Закон Республики Беларусь от 07.05.', 'осуществляемой Сторонами, в зависимости от региона, в котором\nосуществляет деятельность Исполнитель:\n1.14.1. для Российской Федерации — Федеральный закон от 27.07.2006 № 152-ФЗ «О персональных данных»;\n1.14.2. для Республики Казахстан — Закон Республики Казахстан от 21.05.2013 № 94-V «О персональных\nданных и их защите»;\n1.14.3. для Республики Армения — Закон Республики Армения от 13.06.2015 № ЗР-49 «О защите личных\nданных»;\n1.14.4. для Республики Беларусь — Закон Республики Беларусь от 07.05.', '05.2021 № 99-З «О защите\nперсональных данных»;\n1.14.5. для Республики Кыргызстан — Цифровой Кодекс Кыргызской Республики от 31 июля 2025 года № 178;\n1.14.6. для Республики Узбекистан — Закон Республики Узбекистан от 02.07.2019 № ЗРУ-547 «О\nперсональных данных»;\n\n1.14.7. для Республики Азербайджан — Закон Республики Азербайджан от 11 мая 2010 года № 998-IIIQ «О\nперсональных данных», а также иные принятые в соответствии с ними акты.\n1.15. Инструкции — информация, размещаемая Заказчиком через Портал в различном виде, содержащая\nправила, указания или руководства, устанавливающие порядок и способ оказания Услуг, использования Портала.\nИнструкции являются обязательными для ознакомления и соблюдения Исполнителем и иными лицами,\nпривлеченными Исполнителем для оказания Услуг в ПВЗ.\n1.16. Исполнитель — коммерческая организация, или индивидуальный предприниматель, или иное лицо, в\nзависимости от места государственной регистрации Исполнителя, заключившие Договор на условиях Оферты об\nоказании услуг в ПВЗ.\n1.17.', 'Обработка персональных данных Исполнителя и / или\nсотрудников Исполнителя осуществляется Заказчиком в соответствии с применимым законодательством и\nдокументом, определяющим политику Заказчика в отношении обработки персональных данных.\n10.3. В случае если Исполнитель направляет Заказчику уведомление о расторжении Договора в порядке,\nпредусмотренном Договором, обработка персональных данных, необходимая для предоставления Исполнителю\nфункциональных возможностей Портала, прекращается в порядке и в сроки, предусмотренные применимым\nзаконодательством.\n10.4.', 'Исполнитель гарантирует защиту и обеспечивает конфиденциальность персональных данных сотрудников\nЗаказчика, лиц, являющихся исполнителями Заказчика по договору гражданско-правового характера, и иных лиц,\nдействующих на стороне Заказчика, персональных данных Получателей , и персональных данных иных третьих лиц,\nкоторые стали известны Исполнителю в связи с исполнением Договора, а также обязуется осуществлять обработку\nэтих данных исключительно в целях, предусмотренных Договором, и с соблюдением Законодательства в области\nПерсональных данных.\n10.2. Для достижения целей, предусмотренных Договором, требуется обработка персональных данных\nИсполнителя в статусе индивидуального предпринимателя, а также, если применимо, представителей Исполнителя,\nсотрудников Исполнителя и иных третьих лиц, привлекаемых Исполнителем для исполнения Договора.', 'Исполнитель обязуется в случае поступления запросов и\nобращений от Физических лиц или государственных органов по вопросам, связанным с обработкой персональных\nданных в рамках настоящего Приложения, рассмотреть такие запросы и обращения самостоятельно.\n2.5. Заказчик обязуется обеспечивать конфиденциальность персональных данных и безопасность их обработки в\nсоответствии с требованиями Федерального закона от 27.07.2006 № 152-ФЗ «О персональных данных». Заказчик\nимеет право осуществлять обработку персональных данных Физических лиц самостоятельно, либо привлечь к\nобработке персональных данных третьих лиц.', 'Исполнитель обязуется в случае поступления запросов и\nобращений от Физических лиц или государственных органов по вопросам, связанным с обработкой персональных\nданных в рамках настоящего Приложения, рассмотреть такие запросы и обращения самостоятельно.\n2.5. Заказчик обязуется обеспечивать конфиденциальность персональных данных и безопасность их обработки в\nсоответствии с требованиями Федерального закона от 27.07.2006 № 152-ФЗ «О персональных данных». Заказчик\nимеет право осуществлять обработку персональных данных Физических лиц самостоятельно, либо привлечь к\nобработке персональных данных третьих лиц.\n2.6. Стоимость Услуги WB Проверка учитывается при определении Вознаграждения и отражается на Балансе\nИсполнителя. Стоимость Услуги включает в себя НДС по ставке, установленной действующим законодательством\nРФ.\n2.7. Заказчик предоставит Исполнителю полностью соответствующие действующему законодательству Российской\nФедерации первичные документы: акт, счет-фактуру или УПД со статусом «1» в отношении оказанной Услуги, в сроки\nсогласно действующему законодательству.', '10.6. В отношении обработки персональных данных , осуществляемой Заказчиком в целях исполнения\nДоговора, а именно выполнения условий, указанных в разделе 4 Договора, Исполнитель является оператором\nперсональных данных в отношении представителей Исполнителя, сотрудников Исполнителя и иных третьих лиц,\nпривлекаемых Исполнителем для исполнения Договора, а также – в отношении Получателей, в том числе для целей\nвыполнения условий, указанных в разделе 9 Договора и поручает Заказчику осуществлять их обработку в\nнеобходимом для этого объёме, при этом:\n10.6.1.', '10.5. Исполнитель уведомлен и понимает, что в целях оформления транспортных документов (в том числе\nтоварно-транспортных накладных) для организации перевозки Товаров, Заказчик вправе обрабатывать\nперсональные данные Исполнителя, сотрудников, и / или представителей Исполнителя, в том числе передавать\nуказанные персональные данные Перевозчикам.\n10.6. В отношении обработки персональных данных , осуществляемой Заказчиком в целях исполнения\nДоговора, а именно выполнения условий, указанных в разделе 4 Договора, Исполнитель является оператором\nперсональных данных в отношении представителей Исполнителя, сотрудников Исполнителя и иных третьих лиц,\nпривлекаемых Исполнителем для исполнения Договора, а также – в отношении Получателей, в том числе для целей\nвыполнения условий, указанных в разделе 9 Договора и поручает Заказчику осуществлять их обработку в\nнеобходимом для этого объёме, при этом:\n10.6.1. Исполнитель предоставляет заверения, имеющие существенное значение для заключения и\nдальнейшего исполнения Договора, о том, что Исполнителем обеспечены правовые основания для обработки\nперсональных данных субъектов, указанных в п.', '05.2021 № 99-З «О защите\nперсональных данных»;\n1.14.5. для Республики Кыргызстан — Цифровой Кодекс Кыргызской Республики от 31 июля 2025 года № 178;\n1.14.6. для Республики Узбекистан — Закон Республики Узбекистан от 02.07.2019 № ЗРУ-547 «О\nперсональных данных»;\n\n1.14.7. для Республики Азербайджан — Закон Республики Азербайджан от 11 мая 2010 года № 998-IIIQ «О\nперсональных данных», а также иные принятые в соответствии с ними акты.\n1.15.']","Нормативные правовые акты, регулирующие обработку персональных данных в зависимости от страны, где находится Исполнитель, согласно контексту:

- **для Российской Федерации** — Федеральный закон от 27.07.2006 № 152-ФЗ «О персональных данных»;  
- **для Республики Казахстан** — Закон Республики Казахстан от 21.05.2013 № 94-V «О персональных данных и их защите»;  
- **для Республики Армения** — Закон Республики Армения от 13.06.2015 № ЗР-49 «О защите личных данных»;  
- **для Республики Беларусь** — Закон Республики Беларусь от 07.05.2021 № 99-З «О защите персональных данных»;  
- **для Республики Кыргызстан** — Цифровой Кодекс Кыргызской Республики от 31 июля 2025 года № 178;  
- **для Республики Узбекистан** — Закон Республики Узбекистан от 02.07.2019 № ЗРУ-547 «О персональных данных»;  
- **для Республики Азербайджан** — Закон Республики Азербайджан от 11 мая 2010 года № 998-IIIQ «О персональных данных», а также иные принятые в соответствии с ними акты."
Как определяется Оборот ПВЗ в оферте?,['3'],"['3.1.4 Договора.\n1.24. Оборот ПВЗ — это сумма указанных в Поручениях Стоимостей Товаров, выданных в ПВЗ Клиентам и\nКурьерам (для доставки Клиентам), за вычетом суммы розничных цен Клиентских возвратов, выдача которых\nосуществлялась в этом ПВЗ, за период времени,', '3.1.4 Договора.\n1.24. Оборот ПВЗ — это сумма указанных в Поручениях Стоимостей Товаров, выданных в ПВЗ Клиентам и\nКурьерам (для доставки Клиентам), за вычетом суммы розничных цен Клиентских возвратов, выдача которых\nосуществлялась в этом ПВЗ, за период времени, определенный в соответствующем положении Договора.\nВознаграждение Исполнителя рассчитывается за Услуги, оказанные в отношении оплаченного Клиентом Товара.\n1.25.', '3.1.4 Договора.\n1.24. Оборот ПВЗ — это сумма указанных в Поручениях Стоимостей Товаров, выданных в ПВЗ Клиентам и\nКурьерам (для доставки Клиентам), за вычетом суммы розничных цен Клиентских возвратов, выдача которых\nосуществлялась в этом ПВЗ, за период времени, определенный в соответствующем положении Договора.\nВознаграждение Исполнителя рассчитывается за Услуги, оказанные в отношении оплаченного Клиентом Товара.\n1.25. Обязательные условия — обязательные условия при заключении и исполнении договоров с лицом из\nГруппы компаний Вайлдберриз, опубликованные по адресу: https://legal.wildberries.ru/mandatory-\nconditions/country/ru/lang/ru/ являющиеся неотъемлемой частью Договора, если Исполнитель по месту\nгосударственной регистрации находится на территории Российской Федерации.\n1.26. Отчетный период — период, за который рассчитывается вознаграждение, равный одной календарной\nнеделе. Первый Отчётный период отсчитывается с даты Активации ПВЗ по последний день недели. Последний\nОтчётный период отсчитывается с первого дня календарной недели по день расторжения Договора включительно.\n1.27.', 'При определении Базового или Дифференцированного тарифа учитываются такие характеристики ПВЗ Исполнителя,\nкак регион и зона расположения на Тепловой карте, площадь помещения, цена аренды, количество сотрудников\nИсполнителя и размер оплаты им, прогнозируемый Оборот ПВЗ за 30 (тридцать) календарных дней. При изменении\nлюбой из указанных характеристик, используемых для расчета тарифа, он может измениться, что также отражается\nна Тепловой карте.', 'ОФЕРТАоб оказании услуг в ПВЗ\n1. Термины и определения\n1.1. Активация ПВЗ — процесс, в результате которого ПВЗ Исполнителя становится действующим, моментом\nАктивации ПВЗ признается получение Исполнителем подтверждения от Заказчика о возможной Активации в\nсоответствии с п. 3.2 Договора.\n1.2. Аудит ПВЗ — действия, совершаемые различными способами Заказчиком по проверке соответствия ПВЗ\nИсполнителя в части соблюдения Регламента состояния ПВЗ.\n1.3. Баланс — сведения, отраженные в Личном кабинете Исполнителя о начисленном Исполнителю\nвознаграждении за оказанные Услуги, с учетом сумм неустоек (штрафов) и возмещаемых Исполнителем\nзадолженностей, а также с учетом суммы иных обязательств Исполнителя перед Заказчиком.\n1.4. Блокировка ПВЗ — частичное ограничение функционала Портала в отношении ПВЗ, применяемое в порядке,\nпредусмотренном Договором.', '7.1. Договора Оборота ПВЗ Исполнителя или в течение 30 (тридцати) календарных дней\nсогласно п. 7.1.1. и 7.1.2. с даты начала оказания Услуг (выдачи Товара Клиенту).\nВознаграждение в размере Дополнительной выплаты и иных выплат согласно п. 7.2. Договора отражается на\nБалансе Исполнителя в качестве авансового платежа и является дополнительным вознаграждением Исполнителя\nПВЗ по Договору за 12 (двенадцатый) Отчетный и последующие периоды оказания Услуг, в зависимости от периода\nполучения Дополнительных выплат.\nДополнительная выплата отражается на Балансе Исполнителя в течение 7 (семи) календарных дней после\nзавершения каждого тридцатидневного периода оказания Услуг, начиная с даты начала оказания Услуг (выдачи\nТовара Клиенту).\n8. Порядок определения размера вознаграждения Исполнителя и порядок расчетов между Сторонами\n8.1. Вознаграждение за оказанные Исполнителем Услуги за Отчетный период рассчитывается на основании\nотчетов, формируемых еженедельно в ЛК Исполнителя по Тарифам, указанным в Приложении №1 к Договору, и\nотражается на Балансе Исполнителя в его ЛК.', '1.27. Оферта — условия настоящей оферты об оказании услуг в ПВЗ, которая содержит все существенные\nусловия и принятие которой влечет заключение Договора на указанных в Оферте условиях.\n1.28. Перевозчик — лицо, осуществляющее перевозку Товаров по указанию Заказчика на основании договора\nтранспортной экспедиции / договора перевозки / договора оказания курьерских услуг или любого иного договора,\n\nпредусматривающего перевозку Товара.\n1.29. Подмена — направленный Исполнителем Заказчику Товар, который не соответствует Товару, указанному в\nсоответствующем Поручении Исполнителю (Заказчиком было зафиксировано несоответствие вложенного Товара в\nупаковке/таре/товарной упаковке Товару, указанному в Поручении).\n1.30. Получатель — физическое или юридическое лицо, или индивидуальный предприниматель, указываемые в\nПоручении в качестве адресата, получающего Товар. В качестве Получателя могут выступать Клиент, Продавец,\nЗаказчик, Перевозчик, Курьер, а также иные лица, привлеченные Заказчиком.\n1.31. Пользовательское соглашение — условия использования Портала и входящих в него сервисов.', '1.27. Оферта — условия настоящей оферты об оказании услуг в ПВЗ, которая содержит все существенные\nусловия и принятие которой влечет заключение Договора на указанных в Оферте условиях.\n1.28. Перевозчик — лицо, осуществляющее перевозку Товаров по указанию Заказчика на основании договора\nтранспортной экспедиции / договора перевозки / договора оказания курьерских услуг или любого иного договора,\n\nпредусматривающего перевозку Товара.\n1.29.', '1.27. Оферта — условия настоящей оферты об оказании услуг в ПВЗ, которая содержит все существенные\nусловия и принятие которой влечет заключение Договора на указанных в Оферте условиях.\n1.28.', 'В случае проставления\nклиентом Оценок (2 и 1), свидетельствующих о неудовлетворительном качестве оказания Услуг в ПВЗ Исполнителем,\nразмер неустойки определяется на основании вышеуказанной формулы при значении Р<0.']","Оборот ПВЗ определяется как сумма указанных в Поручениях Стоимостей Товаров, выданных в ПВЗ Клиентам и Курьерам (для доставки Клиентам), за вычетом суммы розничных цен Клиентских возвратов, выдача которых осуществлялась в этом ПВЗ, за период времени, определенный в соответствующем положении Договора."
"Какой документ является неотъемлемой частью Договора, если Исполнитель зарегистрирован в Российской Федерации?",['3'],"['3.1.4 Договора.\n1.24. Оборот ПВЗ — это сумма указанных в Поручениях Стоимостей Товаров, выданных в ПВЗ Клиентам и\nКурьерам (для доставки Клиентам), за вычетом суммы розничных цен Клиентских возвратов, выдача которых\nосуществлялась в этом ПВЗ, за период времени, определенный в соответствующем положении Договора.\nВознаграждение Исполнителя рассчитывается за Услуги, оказанные в отношении оплаченного Клиентом Товара.\n1.25. Обязательные условия — обязательные условия при заключении и исполнении договоров с лицом из\nГруппы компаний Вайлдберриз, опубликованные по адресу: https://legal.wildberries.ru/mandatory-\nconditions/country/ru/lang/ru/ являющиеся неотъемлемой частью Договора, если Исполнитель по месту\nгосударственной регистрации находится на территории Российской Федерации.\n1.26. Отчетный период — период, за который рассчитывается вознаграждение, равный одной календарной\nнеделе. Первый Отчётный период отсчитывается с даты Активации ПВЗ по последний день недели. Последний\nОтчётный период отсчитывается с первого дня календарной недели по день расторжения Договора включительно.\n1.27.', '1.8. Деактивация — полное прекращение деятельности Исполнителя в ПВЗ, применяется в порядке,\nпредусмотренном Договором. При Деактивации техническая возможность оказания Услуг в определенном ПВЗ в\nЛичном кабинете Исполнителя прекращается.\n1.9. Договор — договор, заключенный Сторонами на условиях, указанных в Оферте и в Приложениях, включая\nОбязательные условия, которые являются неотъемлемой частью Договора, все вместе именуемые «Договор».\n1.10. Документ, подтверждающий оказание Услуг, — документ(ы) в зависимости от страны регистрации\nИсполнителя, оказывающего Услуги, подтверждающий(ие) факт оказания Услуг Исполнителем, подписываемый(ые)\nобеими Сторонами по окончании оказания Услуг в соответствии с условиями Договора, указанными в разделе 8\nДоговора.\n1.11. Доля Подмен — процентное соотношение совокупной Стоимости Товаров, удержанных в качестве Подмен, к\nОбороту ПВЗ Исполнителя за период времени, определенный в соответствующем положении Договора.', '1.25. Обязательные условия — обязательные условия при заключении и исполнении договоров с лицом из\nГруппы компаний Вайлдберриз, опубликованные по адресу: https://legal.wildberries.ru/mandatory-\nconditions/country/ru/lang/ru/ являющиеся неотъемлемой частью Договора, если Исполнитель по месту\nгосударственной регистрации находится на территории Российской Федерации.\n1.26. Отчетный период — период, за который рассчитывается вознаграждение, равный одной календарной\nнеделе. Первый Отчётный период отсчитывается с даты Активации ПВЗ по последний день недели.', '8.9. Стороны пришли к соглашению, что в целях исполнения обязательств Исполнителя, зарегистрированного на\nтерритории Российской Федерации, перед Заказчиком в рамках настоящего Договора, в том числе, но не\nограничиваясь в целях погашения любой задолженности по Договору, Исполнителю может быть предоставлена\nвозможность через Портал с использованием сервисов и функционала ПАО Сбербанк и/или АО «ТБанк»\nпредоставить по своему выбору указанным банкам заявление (поручение и/или иное распоряжение) на списание без\nдополнительных распоряжений Исполнителя (согласия/акцепта) денежных средств в любой сумме в рамках одного\nплатежного требования Заказчика с расчетного счета Исполнителя, открытого в ПАО Сбербанк и/или АО «ТБанк»,\nсоответственно.', '8.9. Стороны пришли к соглашению, что в целях исполнения обязательств Исполнителя, зарегистрированного на\nтерритории Российской Федерации, перед Заказчиком в рамках настоящего Договора, в том числе, но не\nограничиваясь в целях погашения любой задолженности по Договору,', '1.9. Договор — договор, заключенный Сторонами на условиях, указанных в Оферте и в Приложениях, включая\nОбязательные условия, которые являются неотъемлемой частью Договора, все вместе именуемые «Договор».\n1.10.', 'Суммы, указываемые в согласованных и/или подписанных\nСторонами по настоящему Договору документах, как они определены в разделе 8 Договора, включают в себя суммы\nвсех применимых налогов и сборов, в том числе НДС. Никакие иные суммы налогов, сборов, в т.ч. НДС, не подлежат\nоплате Заказчиком сверх сумм, указанных в документах, подтверждающих оказание Услуг.\nВознаграждение для Исполнителя рассчитывается и выплачивается в национальной валюте страны государственной\nрегистрации Исполнителя.', '8.5. Исполнитель, в случае, если является плательщиком НДС (кроме Исполнителей, указанных в п. 8.5.1. –\n8.5.5. Договора), еженедельно, не позднее 3 (трех) календарных дней с даты окончания Отчётного периода, обязан\nна основании размещенных на Портале сведений о совершенных операциях с Товарами сформировать и направить\nЗаказчику следующие Документы, подтверждающие оказание услуг в электронной форме и подписать их\nнадлежащим образом посредством Системы ЭДО:\n• Акт оказанных Услуг, счёт-фактуру или УПД. Закрывающие документы должны быть датированы последним днём\nотчётного периода, за который они формируются и направляются.\nДля Исполнителей, не являющихся плательщиками НДС (кроме Исполнителей, указанных в п. 8.5.1. – 8.5.5.', '8.5. Исполнитель, в случае, если является плательщиком НДС (кроме Исполнителей, указанных в п. 8.5.1. –\n8.5.5. Договора), еженедельно, не позднее 3 (трех) календарных дней с даты окончания Отчётного периода, обязан\nна основании размещенных на Портале сведений о совершенных операциях с Товарами сформировать и направить\nЗаказчику следующие Документы, подтверждающие оказание услуг в электронной форме и подписать их\nнадлежащим образом посредством Системы ЭДО:\n• Акт оказанных Услуг, счёт-фактуру или УПД.', '4. Предмет Договора\n4.1. По Договору Исполнитель обязуется оказывать Заказчику Услуги на территории Российской Федерации и\nиных стран, в соответствии с применимым законодательством, правами, обязанностями и ответственностью,\nпредусмотренными Договором и Приложениями,']","Обязательные условия, опубликованные по адресу https://legal.wildberries.ru/mandatory-conditions/country/ru/lang/ru/, являются неотъемлемой частью Договора, если Исполнитель по месту государственной регистрации находится на территории Российской Федерации."
"Какие последствия наступают, если Рейтинг ПВЗ Исполнителя снижается ниже Минимального значения рейтинга ПВЗ?",['3'],"['В случае снижения\nРейтинга ПВЗ Исполнителя ниже указанного Минимального значения рейтинга ПВЗ, Заказчик уведомляет\nИсполнителя через Личный кабинет об этом, а кроме того, наступают последствия, предусмотренные настоящим\nДоговором.\n1.23.', 'В случае снижения\nРейтинга ПВЗ Исполнителя ниже указанного Минимального значения рейтинга ПВЗ, Заказчик уведомляет\nИсполнителя через Личный кабинет об этом, а кроме того, наступают последствия, предусмотренные настоящим\nДоговором.\n1.23. Обеспечительный платеж — это единовременный платеж Исполнителя Заказчику в определенном\nДоговоре размере, который оплачивается Исполнителем во время подачи Исполнителем заявки на открытие ПВЗ.\nОбеспечительный платеж является гарантией выполнения Исполнителем обязательств п. 3.1.4 Договора.\n1.24.', '1.21. Маркетплейс Товар или Маркетплейс-короб — Товар или короб с Товарами, передаваемый в ПВЗ\nПродавцом, предназначенный для последующей передачи Исполнителем Перевозчику для доставки Заказчику или\nлицу, указанному Заказчиком или Получателю.\n1.22. Минимальное значение рейтинга ПВЗ — отображаемое в ЛК значение Рейтинга ПВЗ. В случае снижения\nРейтинга ПВЗ Исполнителя ниже указанного Минимального значения рейтинга ПВЗ, Заказчик уведомляет\nИсполнителя через Личный кабинет об этом, а кроме того, наступают последствия, предусмотренные настоящим\nДоговором.\n1.23. Обеспечительный платеж — это единовременный платеж Исполнителя Заказчику в определенном\nДоговоре размере, который оплачивается Исполнителем во время подачи Исполнителем заявки на открытие ПВЗ.\nОбеспечительный платеж является гарантией выполнения Исполнителем обязательств п. 3.1.4 Договора.\n1.24.', 'Если Рейтинг ПВЗ снижался три и более раза нижеМинимального значения рейтинга ПВЗ Исполнителяв течение 1 (одного) календарного года оказанияУслуг Исполнителем с даты Активации ПВЗ попричине нарушений, послуживших основанием дляснижения Рейтинга и приведших к Блокировке ПВЗ,то прекращение применения Блокировки ПВЗ, приусловии устранения нарушений, Заказчиком неприменяется.', 'если значение Рейтинга ПВЗИсполнителя менее Минимального значениярейтинга ПВЗ, но Исполнитель прикладывает усилиядля улучшения качества оказания Услуг по Договору,устраняет все нарушения, послужившие основаниемдля снижения Рейтинга и приведшие к БлокировкеПВЗ,', 'Если Рейтинг ПВЗ Исполнителя становится равнымили больше Минимального значения рейтинга ПВЗ,Заказчик незамедлительно прекращает БлокировкуПВЗ и направляет соответствующее уведомление вЛК.Заказчик вправе прекратить Блокировку ПВЗИсполнителя, если значение Рейтинга ПВЗИсполнителя менее Минимального значениярейтинга ПВЗ, но Исполнитель прикладывает усилиядля улучшения качества оказания Услуг по Договору,устраняет все нарушения, послужившие основаниемдля снижения Рейтинга и приведшие к БлокировкеПВЗ, а также продолжает соблюдать полностью идобросовестно Договор.Если Рейтинг ПВЗ снижался три и более раза нижеМинимального значения рейтинга ПВЗ Исполнителяв течение 1 (одного) календарного года оказанияУслуг Исполнителем с даты Активации ПВЗ попричине нарушений, послуживших основанием дляснижения Рейтинга и приведших к Блокировке ПВЗ,то прекращение применения Блокировки ПВЗ, приусловии устранения нарушений, Заказчиком неприменяется.', 'Если Рейтинг ПВЗ Исполнителя становится равнымили больше Минимального значения рейтинга ПВЗ,Заказчик незамедлительно прекращает БлокировкуПВЗ и направляет соответствующее уведомление вЛК.Заказчик вправе прекратить Блокировку ПВЗИсполнителя, если значение Рейтинга ПВЗИсполнителя менее Минимального значениярейтинга ПВЗ, но Исполнитель прикладывает усилиядля улучшения качества оказания Услуг по Договору,устраняет все нарушения, послужившие основаниемдля снижения Рейтинга и приведшие к БлокировкеПВЗ, а также продолжает соблюдать полностью идобросовестно Договор.', 'Если Рейтинг ПВЗ снижался три и более раза нижеМинимального значения рейтинга ПВЗ Исполнителяв течение 1 (одного) календарного года оказанияУслуг Исполнителем с даты Активации ПВЗ попричине нарушений,', '7 Если в течение 21 (двадцати одного) календарного дня подряд после полученияуведомления в ЛК Рейтинг ПВЗ Исполнителя будет составлять значение нижеМинимального значения рейтинга ПВЗ, то на 22-й (двадцать второй)календарный день Заказчик производит Деактивацию ПВЗ.\n14.3.', 'Основания и Порядок Блокировки Условия снятия Блокировки\n1 Если значение Рейтинга ПВЗ Исполнителя становитсяменьше Минимального значения рейтинга ПВЗ, Заказчикосуществляет Блокировку ПВЗ Исполнителя.']","Если Рейтинг ПВЗ Исполнителя снижается ниже Минимального значения рейтинга ПВЗ, то:

1. Заказчик уведомляет Исполнителя через Личный кабинет об этом.  
2. Наступают последствия, предусмотренные настоящим Договором, которые включают:

- Блокировку ПВЗ Исполнителя (если значение рейтинга становится ниже минимального значения);  
- При снижении рейтинга три и более раз в течение одного календарного года с даты активации ПВЗ по причине нарушений, приведших к блокировке, **прекращение применения блокировки при устранении нарушений не применяется**;  
- Если рейтинг становится равным или больше минимального значения, Заказчик **незамедлительно прекращает блокировку ПВЗ** и направляет уведомление в Личный кабинет;  
- Если рейтинг остаётся ниже минимального значения в течение 21 календарного дня подряд после получения уведомления, то с 22-го дня Заказчик производит **Деактивацию ПВЗ**.

Таким образом, основные последствия — **блокировка ПВЗ**, возможная **деактивация ПВЗ** при длительном снижении рейтинга, а также **устранение нарушений** как условие для восстановления доступа к ПВЗ."
Какое определение дается Пункту выдачи заказов (ПВЗ) в оферте?,['4'],"['которое осуществляет деятельность на\nТорговой площадке и с которым Клиент заключил договор розничной купли-продажи Товаров.\n1.35. Пункт выдачи заказов (ПВЗ) — помещение или часть помещения, здания, дома Исполнителя,\nсоответствующее условиям Договора.', '1.34. Продавец — Заказчик или иное лицо (коммерческая организация, индивидуальный предприниматель, или\nгражданин, признанный в установленном законом порядке самозанятым), которое осуществляет деятельность на\nТорговой площадке и с которым Клиент заключил договор розничной купли-продажи Товаров.\n1.35. Пункт выдачи заказов (ПВЗ) — помещение или часть помещения, здания, дома Исполнителя,\nсоответствующее условиям Договора.', '1.34. Продавец — Заказчик или иное лицо (коммерческая организация, индивидуальный предприниматель, или\nгражданин, признанный в установленном законом порядке самозанятым), которое осуществляет деятельность на\nТорговой площадке и с которым Клиент заключил договор розничной купли-продажи Товаров.\n1.35. Пункт выдачи заказов (ПВЗ) — помещение или часть помещения, здания, дома Исполнителя,\nсоответствующее условиям Договора. ПВЗ является объектом логистической инфраструктуры, в котором\nИсполнитель непосредственно оказывает комплекс Услуг в соответствии с настоящим Договором.\n1.36. ПЭП — электронная подпись, которая посредством использования кодов, паролей или иных средств\nподтверждает факт подписания электронной подписью электронных документов, иной информации в электронной\nформе определенным лицом, является аналогом собственноручной подписи.\n1.37. Регламент состояния ПВЗ — документ (Приложение № 3 к Договору), размещенный на Портале, который\nсодержит требования к состоянию ПВЗ.\n1.38.', 'ОФЕРТАоб оказании услуг в ПВЗ\n1. Термины и определения\n1.1. Активация ПВЗ — процесс, в результате которого ПВЗ Исполнителя становится действующим, моментом\nАктивации ПВЗ признается получение Исполнителем подтверждения от Заказчика о возможной Активации в\nсоответствии с п. 3.2 Договора.\n1.2. Аудит ПВЗ — действия, совершаемые различными способами Заказчиком по проверке соответствия ПВЗ\nИсполнителя в части соблюдения Регламента состояния ПВЗ.\n1.3. Баланс — сведения, отраженные в Личном кабинете Исполнителя о начисленном Исполнителю\nвознаграждении за оказанные Услуги, с учетом сумм неустоек (штрафов) и возмещаемых Исполнителем\nзадолженностей, а также с учетом суммы иных обязательств Исполнителя перед Заказчиком.\n1.4. Блокировка ПВЗ — частичное ограничение функционала Портала в отношении ПВЗ, применяемое в порядке,\nпредусмотренном Договором.', 'ОФЕРТАоб оказании услуг в ПВЗ\n1. Термины и определения\n1.1. Активация ПВЗ — процесс, в результате которого ПВЗ Исполнителя становится действующим, моментом\nАктивации ПВЗ признается получение Исполнителем подтверждения от Заказчика о возможной Активации в\nсоответствии с п.', '1.27. Оферта — условия настоящей оферты об оказании услуг в ПВЗ, которая содержит все существенные\nусловия и принятие которой влечет заключение Договора на указанных в Оферте условиях.\n1.28. Перевозчик — лицо, осуществляющее перевозку Товаров по указанию Заказчика на основании договора\nтранспортной экспедиции / договора перевозки / договора оказания курьерских услуг или любого иного договора,\n\nпредусматривающего перевозку Товара.\n1.29. Подмена — направленный Исполнителем Заказчику Товар, который не соответствует Товару, указанному в\nсоответствующем Поручении Исполнителю (Заказчиком было зафиксировано несоответствие вложенного Товара в\nупаковке/таре/товарной упаковке Товару, указанному в Поручении).\n1.30. Получатель — физическое или юридическое лицо, или индивидуальный предприниматель, указываемые в\nПоручении в качестве адресата, получающего Товар. В качестве Получателя могут выступать Клиент, Продавец,\nЗаказчик, Перевозчик, Курьер, а также иные лица, привлеченные Заказчиком.\n1.31. Пользовательское соглашение — условия использования Портала и входящих в него сервисов.', '1.27. Оферта — условия настоящей оферты об оказании услуг в ПВЗ, которая содержит все существенные\nусловия и принятие которой влечет заключение Договора на указанных в Оферте условиях.\n1.28. Перевозчик — лицо, осуществляющее перевозку Товаров по указанию Заказчика на основании договора\nтранспортной экспедиции / договора перевозки / договора оказания курьерских услуг или любого иного договора,\n\nпредусматривающего перевозку Товара.\n1.29.', '1.27. Оферта — условия настоящей оферты об оказании услуг в ПВЗ, которая содержит все существенные\nусловия и принятие которой влечет заключение Договора на указанных в Оферте условиях.\n1.28.', '1.38. Рейтинг ПВЗ Исполнителя — единица оценки ПВЗ Исполнителя и качества оказываемых им Услуг в ПВЗ,\nопределяемая на основании анализа 150 (ста пятидесяти) последних уникальных отзывов и оценок Клиентов о ПВЗ\nна Торговой площадке, включая, но не ограничиваясь, в отношении: состояния ПВЗ, качества обслуживания\nКлиентов, а также иных факторов, влияющих на качество оказания Услуг Исполнителем.\n1.39. Склад — помещение Заказчика или лица, привлеченного Заказчиком, в котором осуществляется хранение,\nобработка и упаковка Товаров.\n1.40. Стоимость Товара — розничная цена, по которой Товар был или может быть заказан Клиентом на\nТорговой площадке, указанная в Поручении.\n1.41. Сторона/Стороны — отдельное/совместное упоминание Заказчика или/и Исполнителя.\n1.42. Тепловая карта — карта, доступная по ссылке https://pvz-stat-map.wildberries.ru/#2/62/56\nопределяющая возможные зоны для открытия ПВЗ, формы поддержки ПВЗ, тарифы, вознаграждение, оценку\nпредполагаемого дохода Исполнителя в ПВЗ и иные данные при указанных на карте параметрах.\n\n1.43.', '№ 3\nк Оферте об оказании услуг в ПВЗ\nРегламент состояния ПВЗ\n1.']","Пункт выдачи заказов (ПВЗ) — помещение или часть помещения, здания, дома Исполнителя, соответствующее условиям Договора. ПВЗ является объектом логистической инфраструктуры, в котором Исполнитель непосредственно оказывает комплекс Услуг в соответствии с настоящим Договором."
Какие факторы учитываются при определении Рейтинга ПВЗ Исполнителя?,['4'],"['1.38. Рейтинг ПВЗ Исполнителя — единица оценки ПВЗ Исполнителя и качества оказываемых им Услуг в ПВЗ,\nопределяемая на основании анализа 150 (ста пятидесяти) последних уникальных отзывов и оценок Клиентов о ПВЗ\nна Торговой площадке, включая, но не ограничиваясь, в отношении: состояния ПВЗ, качества обслуживания\nКлиентов, а также иных факторов, влияющих на качество оказания Услуг Исполнителем.\n1.39. Склад — помещение Заказчика или лица, привлеченного Заказчиком, в котором осуществляется хранение,\nобработка и упаковка Товаров.', '1.38. Рейтинг ПВЗ Исполнителя — единица оценки ПВЗ Исполнителя и качества оказываемых им Услуг в ПВЗ,\nопределяемая на основании анализа 150 (ста пятидесяти) последних уникальных отзывов и оценок Клиентов о ПВЗ\nна Торговой площадке, включая, но не ограничиваясь, в отношении: состояния ПВЗ, качества обслуживания\nКлиентов, а также иных факторов, влияющих на качество оказания Услуг Исполнителем.\n1.39. Склад — помещение Заказчика или лица, привлеченного Заказчиком, в котором осуществляется хранение,\nобработка и упаковка Товаров.\n1.40. Стоимость Товара — розничная цена, по которой Товар был или может быть заказан Клиентом на\nТорговой площадке, указанная в Поручении.\n1.41. Сторона/Стороны — отдельное/совместное упоминание Заказчика или/и Исполнителя.\n1.42. Тепловая карта — карта, доступная по ссылке https://pvz-stat-map.wildberries.ru/#2/62/56\nопределяющая возможные зоны для открытия ПВЗ, формы поддержки ПВЗ, тарифы, вознаграждение, оценку\nпредполагаемого дохода Исполнителя в ПВЗ и иные данные при указанных на карте параметрах.\n\n1.43.', '1.38. Рейтинг ПВЗ Исполнителя — единица оценки ПВЗ Исполнителя и качества оказываемых им Услуг в ПВЗ,\nопределяемая на основании анализа 150 (ста пятидесяти) последних уникальных отзывов и оценок Клиентов о ПВЗ\nна Торговой площадке, включая,', '2.2. Рейтинг ПВЗ Исполнителя\nПремия за Рейтинг ПВЗ Исполнителя рассчитывается за каждую оценку Клиента от 1 до 5 для ПВЗ Исполнителя,\nкоторая может оценивать качество оказания Услуг в ПВЗ, требования к обслуживанию Клиентов и исполнение иных\nправил оказания Услуг (далее — Оценка) по формуле:\n\nР = Стоимость Оценки * Вес Оценки / Коэффициент премирования, где Р — Премия за Рейтинг ПВЗ\nИсполнителя, выплачивается Исполнителю только в результате проставления Оценок (4 и 5).\nСтоимость Оценки — индивидуальный показатель, указанный в ЛК Исполнителя.\nВес Оценки — индивидуальный вес каждой Оценки Клиента, указанный в ЛК Исполнителя.\nКоэффициент премирования — показатель, публикуемый на Портале, означающий среднее значение Веса всех\nОценок всех ПВЗ за определенный период времени, который может быть изменен Заказчиком в одностороннем\nпорядке в случае динамики соответствующего среднего значения. Новое значение Коэффициента премирования\nприменяется для расчета с 00 часов 00 минут дня, следующего за днем, в котором новое значение было\nопубликовано на Портале.\nПремия за Рейтинг ПВЗ отражается на Балансе Исполнителя на дату выставления Оценки.', '2.2. Рейтинг ПВЗ Исполнителя\nПремия за Рейтинг ПВЗ Исполнителя рассчитывается за каждую оценку Клиента от 1 до 5 для ПВЗ Исполнителя,\nкоторая может оценивать качество оказания Услуг в ПВЗ, требования к обслуживанию Клиентов и исполнение иных\nправил оказания Услуг (далее — Оценка) по формуле:\n\nР = Стоимость Оценки * Вес Оценки / Коэффициент премирования, где Р — Премия за Рейтинг ПВЗ\nИсполнителя, выплачивается Исполнителю только в результате проставления Оценок (4 и 5).\nСтоимость Оценки — индивидуальный показатель, указанный в ЛК Исполнителя.', '2.2. Рейтинг ПВЗ Исполнителя\nПремия за Рейтинг ПВЗ Исполнителя рассчитывается за каждую оценку Клиента от 1 до 5 для ПВЗ Исполнителя,\nкоторая может оценивать качество оказания Услуг в ПВЗ,', 'При определении Базового или Дифференцированного тарифа учитываются такие характеристики ПВЗ Исполнителя,\nкак регион и зона расположения на Тепловой карте, площадь помещения, цена аренды, количество сотрудников\nИсполнителя и размер оплаты им,', 'При определении Базового или Дифференцированного тарифа учитываются такие характеристики ПВЗ Исполнителя,\nкак регион и зона расположения на Тепловой карте, площадь помещения, цена аренды, количество сотрудников\nИсполнителя и размер оплаты им, прогнозируемый Оборот ПВЗ за 30 (тридцать) календарных дней. При изменении\nлюбой из указанных характеристик, используемых для расчета тарифа, он может измениться, что также отражается\nна Тепловой карте.', 'Если Рейтинг ПВЗ Исполнителя становится равнымили больше Минимального значения рейтинга ПВЗ,Заказчик незамедлительно прекращает БлокировкуПВЗ и направляет соответствующее уведомление вЛК.Заказчик вправе прекратить Блокировку ПВЗИсполнителя, если значение Рейтинга ПВЗИсполнителя менее Минимального значениярейтинга ПВЗ, но Исполнитель прикладывает усилиядля улучшения качества оказания Услуг по Договору,устраняет все нарушения, послужившие основаниемдля снижения Рейтинга и приведшие к БлокировкеПВЗ, а также продолжает соблюдать полностью идобросовестно Договор.Если Рейтинг ПВЗ снижался три и более раза нижеМинимального значения рейтинга ПВЗ Исполнителяв течение 1 (одного) календарного года оказанияУслуг Исполнителем с даты Активации ПВЗ попричине нарушений, послуживших основанием дляснижения Рейтинга и приведших к Блокировке ПВЗ,то прекращение применения Блокировки ПВЗ, приусловии устранения нарушений, Заказчиком неприменяется.', 'если значение Рейтинга ПВЗИсполнителя менее Минимального значениярейтинга ПВЗ, но Исполнитель прикладывает усилиядля улучшения качества оказания Услуг по Договору,устраняет все нарушения, послужившие основаниемдля снижения Рейтинга и приведшие к БлокировкеПВЗ,']","Факторы, учитывающиеся при определении Рейтинга ПВЗ Исполнителя, — это:

- состояние ПВЗ,  
- качество обслуживания Клиентов,  
- иные факторы, влияющие на качество оказания Услуг Исполнителем.

Эти факторы оцениваются на основе анализа 150 последних уникальных отзывов и оценок Клиентов о ПВЗ на Торговой площадке."
Какие действия совершают Стороны при совершении юридически значимых действий в рамках Договора?,['4'],"['Стороны совершают\nюридически значимые действия только с использованием Портала.\n1.33. Поручение — задание Заказчика, содержащее совокупность сведений в электронной форме,\nнаправленное Исполнителю посредством Личного кабинета и содержащее в том числе сведения о наименованиях и\nколичестве Товаров, данные о Продавце, о Клиенте, заключившем договор розничной купли-продажи с Продавцом, и\nиную информацию, необходимую для выполнения Поручения Исполнителем. Указанное поручение не считается\nпоручением на обработку персональных данных.\n1.34.', 'Стороны совершают\nюридически значимые действия только с использованием Портала.\n1.33. Поручение — задание Заказчика, содержащее совокупность сведений в электронной форме,', 'Пользовательское соглашение расположено по адресу и доступно для ознакомления по ссылке и действует в части,\nне противоречащей настоящему Договору.\n1.32. Портал — интегрированная автоматизированная электронная система Заказчика, использование которой\nпроисходит на условиях простой (неисключительной) лицензии на срок действия Договора, предоставленной\nЗаказчиком Исполнителю в целях исполнения Договора, и включающая, но не ограничивающаяся веб-сервисом,\nдоступным через браузер или мобильные устройства (смартфоны, планшеты и т.д.). Стороны совершают\nюридически значимые действия только с использованием Портала.\n1.33. Поручение — задание Заказчика, содержащее совокупность сведений в электронной форме,\nнаправленное Исполнителю посредством Личного кабинета и содержащее в том числе сведения о наименованиях и\nколичестве Товаров, данные о Продавце, о Клиенте, заключившем договор розничной купли-продажи с Продавцом, и\nиную информацию, необходимую для выполнения Поручения Исполнителем. Указанное поручение не считается\nпоручением на обработку персональных данных.\n1.34.', '10.6. Договора , Стороны являются самостоятельными\nоператорами персональных данных, при этом каждая из Сторон обеспечивает конфиденциальность персональных\nданных, полученных от другой Стороны, соблюдение требований к обработке персональных данных, установленных\nЗаконодательством в области персональных данных и принятыми в его исполнение нормативными правовыми\nактами, и несет ответственность за принятие всех необходимых правовых, организационных и технических мер\nзащиты персональных данных от неправомерного или случайного доступа к ним, уничтожения, изменения,\nблокирования, копирования, распространения персональных данных, а также от иных неправомерных действий в\nотношении них\n11. Ответственность\n11.1. Стороны несут ответственность за неисполнение или ненадлежащее исполнение своих обязательств в\nсоответствии с условиями Договора и Приложениями к нему. Никакие иные меры ответственности, не\nпредусмотренные в Договоре и Приложениях к нему, не могут быть применены к отношениям Сторон.\n11.2.', '17.3 Договора, с которыми закон или Договор связывают наступление\n\nгражданско-правовых последствий для другой стороны, должны направляться только одним из следующих способов:\n• нарочным (курьерской доставкой), заказным письмом или ценным с описью вложений, направляются по адресу\nместа нахождения Стороны-получателя: для Заказчика — указанному в ЕГРЮЛ, а для Исполнителя — по адресу,\nуказанному на Портале или по месту нахождения ПВЗ;\n• на адрес электронной почты Исполнителя, указанной им при регистрации на Портале или в любом исходящем от\nИсполнителя документе или сообщении;\n• посредством Портала / Личного кабинета.\n17.2.2. Юридически значимые сообщения направляются исключительно предусмотренными Договором\nспособами. Направление сообщения иным способом не считается надлежащим, а сообщения считаются\nнедоставленными.\n17.2.3. Юридически значимые сообщения, направленные Исполнителю через Портал или на электронную\nпочту, считаются доставленными в дату отправки Заказчиком соответствующего юридически значимого сообщения.\n17.2.4.', '4.2. Каждая из Сторон вправе исполнять условия Договора как самостоятельно, так и с привлечением любых\nтретьих лиц, отвечая при этом перед другой Стороной за действия привлеченных третьих лиц, как за свои\nсобственные.\n5.', '16.5. Заказчик рассматривает заявку Исполнителя в течение 30 (тридцати) календарных дней и проверяет\nпредоставленные данные о новом Исполнителе, а также проверяет наличие задолженности Исполнителя и нового\nИсполнителя перед Заказчиком. Заказчик вправе отказать в согласовании заявки Исполнителя.\n17. Заключительные положения\n17.1. Отношения сторон по Договору, заключение, прекращение и исполнение Договора регулируются\nдействующим законодательством Российской Федерации.\n17.2. Направление юридически значимых сообщений:\n17.2.1. Заявления, уведомления, извещения, требования или любые иные юридически значимые сообщения, в\nтом числе составленные в соответствии с п.', '4.2. Каждая из Сторон вправе исполнять условия Договора как самостоятельно, так и с привлечением любых\nтретьих лиц, отвечая при этом перед другой Стороной за действия привлеченных третьих лиц, как за свои\nсобственные.\n5. Права и обязательства Исполнителя\nОбмен информацией между Сторонами\n5.1.', '10.6. Договора , Стороны являются самостоятельными\nоператорами персональных данных, при этом каждая из Сторон обеспечивает конфиденциальность персональных\nданных, полученных от другой Стороны, соблюдение требований к обработке персональных данных, установленных\nЗаконодательством в области персональных данных и принятыми в его исполнение нормативными правовыми\nактами, и несет ответственность за принятие всех необходимых правовых, организационных и технических мер\nзащиты персональных данных от неправомерного или случайного доступа к ним, уничтожения, изменения,\nблокирования, копирования, распространения персональных данных,', '16.5. Заказчик рассматривает заявку Исполнителя в течение 30 (тридцати) календарных дней и проверяет\nпредоставленные данные о новом Исполнителе, а также проверяет наличие задолженности Исполнителя и нового\nИсполнителя перед Заказчиком. Заказчик вправе отказать в согласовании заявки Исполнителя.\n17. Заключительные положения\n17.1. Отношения сторон по Договору, заключение, прекращение и исполнение Договора регулируются\nдействующим законодательством Российской Федерации.\n17.2. Направление юридически значимых сообщений:\n17.2.1.']",Стороны совершают юридически значимые действия только с использованием Портала.
"Какие услуги входят в комплекс услуг, оказываемых Исполнителем по Договору в ПВЗ?",['5'],"['1.46. Услуги – комплекс услуг, оказываемых Исполнителем по Договору в ПВЗ, неотъемлемой частью которого\nявляются такие Услуги, как приемка Товаров от Заказчика/Перевозчика/Продавца/Курьера, выдача Товара\nПолучателям, в том числе Курьерам,', '1.46. Услуги – комплекс услуг, оказываемых Исполнителем по Договору в ПВЗ, неотъемлемой частью которого\nявляются такие Услуги, как приемка Товаров от Заказчика/Перевозчика/Продавца/Курьера, выдача Товара\nПолучателям, в том числе Курьерам, получение Клиентских возвратов, подготовка Товара к возврату, Услуга WB\nTrack, Услуга WB Рекламные экраны и иные услуги, для оказания которых Исполнитель использует Портал и\nдействует в соответствии с Инструкциями и иными документами Заказчика, размещенными на Портале.\n1.47.', '1.46. Услуги – комплекс услуг, оказываемых Исполнителем по Договору в ПВЗ, неотъемлемой частью которого\nявляются такие Услуги, как приемка Товаров от Заказчика/Перевозчика/Продавца/Курьера, выдача Товара\nПолучателям, в том числе Курьерам, получение Клиентских возвратов, подготовка Товара к возврату, Услуга WB\nTrack, Услуга WB Рекламные экраны и иные услуги, для оказания которых Исполнитель использует Портал и\nдействует в соответствии с Инструкциями и иными документами Заказчика, размещенными на Портале.\n1.47. Услуга WB Track — услуга, оказываемая Исполнителем по Договору, в том числе приемка Отправлений\nWB Track от Отправителя, выдача Получателю Отправления WB Track, подготовка Отправления WB Track к отправке\nи иные действия, для которых Исполнитель использует Портал и действует в соответствии с Приложением № 5,\nИнструкциями и иными документами Заказчика, размещенными на Портале.\n1.48. Услуга WB Рекламные экраны — услуга, оказываемая Исполнителем, в соответствии с правилами и\nусловиями Приложения № 7 к Договору, заключается в предоставлении доступа Заказчику к Оборудованию для\nтрансляции Рекламных материалов Заказчиком.\n1.49.', 'ПВЗ является объектом логистической инфраструктуры, в котором\nИсполнитель непосредственно оказывает комплекс Услуг в соответствии с настоящим Договором.\n1.36.', '1.19. Курьер — привлекаемое Заказчиком или Исполнителем лицо, оказывающее услуги по доставке Товаров\nКлиенту или доставке невостребованных Товаров, Клиентских возвратов от Клиента до ПВЗ Исполнителя.\n1.20. Личный кабинет (ЛК) — персональная страница Исполнителя на Портале Заказчика, необходимая\nИсполнителю для оказания Услуг по Договору, доступ к которой осуществляется с помощью ввода Исполнителем\nлогина (номер телефона, указанный при регистрации на Портале) и пароля (код, получаемый посредством push-\nуведомления или смс).\n1.21.', 'ПРИЛОЖЕНИЯ к Договору, являющиеся его неотъемлемой частью:\n• Приложение № 1 — Тарифы;\n• Приложение № 2 — Правила оказания услуг в ПВЗ;\n• Приложение № 3 — Регламент состояния ПВЗ;\n• Приложение № 4 — Ответственность;\n\n• Приложение № 5 — Услуга WB Track;\n• Приложение № 6 — Услуга WB Проверка сотрудников;\n• Приложение № 7 — Услуга WB Рекламные экран.\n\nПриложение № 2\nк Оферте об оказании услуг в ПВЗ\nПравила оказания услуг в ПВЗ\nПриложение содержит общие требования и правила оказания услуг в ПВЗ, которые распространяются на\nИсполнителей по Договору.\n1. Требования к осуществлению видов деятельности в ПВЗ\n1.1. Исполнитель вправе без согласования с Заказчиком осуществлять в ПВЗ следующие действия:\n• размещать вендинговые автоматы для продажи товаров;\n• размещать терминалы, предназначенные для оплаты услуг, реализация которых не связана с деятельностью\nИсполнителя, осуществляемой в ПВЗ по Договору;\n• размещать постаматы, но только при условии, если площадь ПВЗ составляет более 70 (семидесяти) кв.', '1.38. Рейтинг ПВЗ Исполнителя — единица оценки ПВЗ Исполнителя и качества оказываемых им Услуг в ПВЗ,\nопределяемая на основании анализа 150 (ста пятидесяти) последних уникальных отзывов и оценок Клиентов о ПВЗ\nна Торговой площадке, включая, но не ограничиваясь, в отношении: состояния ПВЗ, качества обслуживания\nКлиентов, а также иных факторов, влияющих на качество оказания Услуг Исполнителем.\n1.39. Склад — помещение Заказчика или лица, привлеченного Заказчиком, в котором осуществляется хранение,\nобработка и упаковка Товаров.', 'ОФЕРТАоб оказании услуг в ПВЗ\n1. Термины и определения\n1.1. Активация ПВЗ — процесс, в результате которого ПВЗ Исполнителя становится действующим, моментом\nАктивации ПВЗ признается получение Исполнителем подтверждения от Заказчика о возможной Активации в\nсоответствии с п. 3.2 Договора.\n1.2. Аудит ПВЗ — действия, совершаемые различными способами Заказчиком по проверке соответствия ПВЗ\nИсполнителя в части соблюдения Регламента состояния ПВЗ.\n1.3. Баланс — сведения, отраженные в Личном кабинете Исполнителя о начисленном Исполнителю\nвознаграждении за оказанные Услуги, с учетом сумм неустоек (штрафов) и возмещаемых Исполнителем\nзадолженностей, а также с учетом суммы иных обязательств Исполнителя перед Заказчиком.\n1.4. Блокировка ПВЗ — частичное ограничение функционала Портала в отношении ПВЗ, применяемое в порядке,\nпредусмотренном Договором.', 'ОФЕРТАоб оказании услуг в ПВЗ\n1. Термины и определения\n1.1. Активация ПВЗ — процесс, в результате которого ПВЗ Исполнителя становится действующим, моментом\nАктивации ПВЗ признается получение Исполнителем подтверждения от Заказчика о возможной Активации в\nсоответствии с п. 3.2 Договора.\n1.2. Аудит ПВЗ — действия, совершаемые различными способами Заказчиком по проверке соответствия ПВЗ\nИсполнителя в части соблюдения Регламента состояния ПВЗ.\n1.3.', 'ПВЗ – помещение или часть помещения, здания, дома, находящееся у Исполнителя в собственности или во\nвладении и пользовании или на ином законном основании, в котором Исполнитель непосредственно оказывает\nУслуги.\n3.2. При Активации ПВЗ Исполнитель обязан предоставить правоустанавливающие документы на помещение\nЗаказчику, выписку из ЕГРН или технический план БТИ или иные документы. При этом выписка из ЕГРН должна быть\nполучена Исполнителем в срок, не превышающий 1 (один) месяц до даты Активации ПВЗ. Заказчик оставляет за\nсобой право запросить дополнительные документы.']","В комплекс услуг, оказываемых Исполнителем по Договору в ПВЗ, входят следующие услуги:

- приемка Товаров от Заказчика/Перевозчика/Продавца/Курьера;  
- выдача Товара Получателям, в том числе Курьерам;  
- получение Клиентских возвратов;  
- подготовка Товара к возврату;  
- Услуга WB Track;  
- Услуга WB Рекламные экраны;  
- иные услуги, для оказания которых Исполнитель использует Портал и действует в соответствии с Инструкциями и иными документами Заказчика, размещенными на Портале."
"Какие действия включает в себя Услуга WB Track, оказываемая Исполнителем?",['5'],"['1.53. Услуга WB Track – услуга, оказываемая Исполнителем по Договору, в том числе приемка Отправлений WB\nTrack от Отправителя, выдача Получателю Отправления WB Track, подготовка Отправления WB Track к отправке и\nиные действия, для которых Исполнитель использует Портал и действует в соответствии с Инструкциями и иными\nдокументами Заказчика, размещенными на Портале.\n1.55.', '1.47. Услуга WB Track — услуга, оказываемая Исполнителем по Договору, в том числе приемка Отправлений\nWB Track от Отправителя, выдача Получателю Отправления WB Track, подготовка Отправления WB Track к отправке\nи иные действия, для которых Исполнитель использует Портал и действует в соответствии с Приложением № 5,', '1.47. Услуга WB Track — услуга, оказываемая Исполнителем по Договору, в том числе приемка Отправлений\nWB Track от Отправителя, выдача Получателю Отправления WB Track, подготовка Отправления WB Track к отправке\nи иные действия, для которых Исполнитель использует Портал и действует в соответствии с Приложением № 5,\nИнструкциями и иными документами Заказчика, размещенными на Портале.\n1.48.', '1.53. Услуга WB Track – услуга, оказываемая Исполнителем по Договору, в том числе приемка Отправлений WB\nTrack от Отправителя, выдача Получателю Отправления WB Track, подготовка Отправления WB Track к отправке и\nиные действия,', '1.53. Услуга WB Track – услуга, оказываемая Исполнителем по Договору, в том числе приемка Отправлений WB\nTrack от Отправителя, выдача Получателю Отправления WB Track, подготовка Отправления WB Track к отправке и\nиные действия, для которых Исполнитель использует Портал и действует в соответствии с Инструкциями и иными\nдокументами Заказчика, размещенными на Портале.\n1.55. Push-уведомление — уведомление, направляемое в личный кабинет Отправителя на Торговой площадке,\nсодержащее информацию об Отправителе, Получателе Отправления WB Track, адресе пункта назначения,\nгабаритах, характере, Объявленной ценности Отправления WB Track, стоимости доставки и иную информацию, а\nтакже содержащее модальное окно с возможностью согласиться с условиями доставки Отправления WB Track. Push-\nуведомление сохраняется в личном кабинете Отправителя до момента получения Отправления WB Track\nПолучателем или до момента истечения срока хранения Отправления WB Track в случае, если Получатель его не\nзабрал или отказался от его получения.\n1.56.', '1.46. Услуги – комплекс услуг, оказываемых Исполнителем по Договору в ПВЗ, неотъемлемой частью которого\nявляются такие Услуги, как приемка Товаров от Заказчика/Перевозчика/Продавца/Курьера, выдача Товара\nПолучателям, в том числе Курьерам, получение Клиентских возвратов, подготовка Товара к возврату, Услуга WB\nTrack, Услуга WB Рекламные экраны и иные услуги, для оказания которых Исполнитель использует Портал и\nдействует в соответствии с Инструкциями и иными документами Заказчика, размещенными на Портале.\n1.47. Услуга WB Track — услуга, оказываемая Исполнителем по Договору, в том числе приемка Отправлений\nWB Track от Отправителя, выдача Получателю Отправления WB Track, подготовка Отправления WB Track к отправке\nи иные действия, для которых Исполнитель использует Портал и действует в соответствии с Приложением № 5,\nИнструкциями и иными документами Заказчика, размещенными на Портале.\n1.48. Услуга WB Рекламные экраны — услуга, оказываемая Исполнителем, в соответствии с правилами и\nусловиями Приложения № 7 к Договору, заключается в предоставлении доступа Заказчику к Оборудованию для\nтрансляции Рекламных материалов Заказчиком.\n1.49.', 'При этом Исполнители обязаны:\nПри этом Исполнители обязаны:\n• оформлять документы, связанные с приёмкой/отправкой Товаров;\n• проставлять подписи с расшифровкой и печать (при её наличии) грузополучателя/грузоотправителя;\n• делать отметки о расхождениях (как излишек, так и недостаток), при их фактическом выявлении;\nИсполнитель не вправе принимать от Продавцов в ПВЗ Маркетплейс-короба или Маркетплейс Товары,\nнесоответствующие требуемым габаритам. Вознаграждение Исполнителя за приемку Маркетплейс Товаров, и также\nМаркетплейс-коробов с дальнейшей передачей их для доставки на Склад, рассчитывается за каждую единицу\nТовара, принятого на ПВЗ, согласно Тарифам (Приложение №1 к Договору).\n2.6. Оказание Услуги WB Track по доставке Отправлений WB Track осуществляется при условии предоставления и\nподтверждения Отправителем всей необходимой информации, указанной в п. 2.1 настоящего Приложения., в том\nчисле об Объявленной ценности Отправления WB Track.\n\n2.6.1.', 'Порядок оказания Услуги WB Track\n2.1. Отправление WB Track оформляется путем предоставления Исполнителю информации об Отправителе,\nПолучателе, адресе пункта назначения, габаритах, характере, Объявленной ценности Отправления WB Track и иной\nнеобходимой информации.\n2.2. При приеме и оформлении Отправления WB Track Исполнитель запрашивает у Отправителя QR-код из\nмобильного приложения Торговой площадки. При непредъявлении Отправителем и/или невозможности считать\nуказанный QR-код Услуга WB Track не может быть оказана Исполнителем.\n2.3.', '2.4. Исполнитель вправе не принимать к доставке Отправления WB Track, которые по его усмотрению являются\nопасными и/или могут причинить вред Отправлениям WB Track/Товарам других Отправителей /Клиентов, а также\nОтправления WB Track, содержащие запрещенные законодательством предметы или не соответствующие видам/\nтипам Отправлений WB Track.\n2.5. При принятии Отправления WB Track для доставки Исполнитель не обязан осуществлять досмотр и\nпроверку содержимого Отправления WB Track на предмет работоспособности, внутренней комплектации,\n\nколичества, наличия явных или скрытых дефектов, чувствительности к температурному воздействию и иных\nкачественных характеристик и пр. Однако Исполнитель обязан провести проверку внутритарного содержимого\nОтправления WB Track на предмет соответствия информации, предоставленной и подтвержденной Отправителем\nпри передаче Отправления WB Track для доставки, а также на предмет отсутствия запрещенных вложений (список\nзапрещенных вложений –Дополнение № 1 к Приложению № 5 к Договору).\n2.6. Оказание Услуги WB Track по доставке Отправлений WB Track осуществляется при условии предоставления\nи подтверждения Отправителем всей необходимой информации, указанной в п.', 'Однако Исполнитель обязан провести проверку внутритарного содержимого\nОтправления WB Track на предмет соответствия информации, предоставленной и подтвержденной Отправителем\nпри передаче Отправления WB Track для доставки, а также на предмет отсутствия запрещенных вложений (список\nзапрещенных вложений –Дополнение № 1 к Приложению № 5 к Договору).\n2.6. Оказание Услуги WB Track по доставке Отправлений WB Track осуществляется при условии предоставления\nи подтверждения Отправителем всей необходимой информации, указанной в п.']","Услуга WB Track включает в себя следующие действия, оказываемые Исполнителем:

- приемка Отправлений WB Track от Отправителя;  
- выдача Получателю Отправления WB Track;  
- подготовка Отправления WB Track к отправке;  
- иные действия, для которых Исполнитель использует Портал и действует в соответствии с Инструкциями и иными документами Заказчика, размещенными на Портале.  

Кроме того, при оказании услуги Исполнитель:

- запрашивает у Отправителя QR-код из мобильного приложения Торговой площадки (при его непредъявлении или невозможности считать — услуга не может быть оказана);  
- вправе не принимать к доставке Отправления WB Track, если они опасны, могут причинить вред другим Отправлениям или содержат запрещенные предметы;  
- обязан провести проверку внутритарного содержимого на соответствие информации, предоставленной Отправителем, и на отсутствие запрещённых вложений (список — Дополнение № 1 к Приложению № 5 к Договору).  

Оказание услуги возможно только при предоставлении и подтверждении Отправителем всей необходимой информации (об Отправителе, Получателе, адресе, габаритах, характере, объявленной ценности и др.)."
"Какие документы и инструменты Исполнитель использует для оказания Услуг, включая Услугу WB Track и Услугу WB Рекламные экраны?",['5'],"['1.46. Услуги – комплекс услуг, оказываемых Исполнителем по Договору в ПВЗ, неотъемлемой частью которого\nявляются такие Услуги, как приемка Товаров от Заказчика/Перевозчика/Продавца/Курьера, выдача Товара\nПолучателям, в том числе Курьерам, получение Клиентских возвратов, подготовка Товара к возврату, Услуга WB\nTrack, Услуга WB Рекламные экраны и иные услуги, для оказания которых Исполнитель использует Портал и\nдействует в соответствии с Инструкциями и иными документами Заказчика, размещенными на Портале.\n1.47. Услуга WB Track — услуга, оказываемая Исполнителем по Договору, в том числе приемка Отправлений\nWB Track от Отправителя, выдача Получателю Отправления WB Track, подготовка Отправления WB Track к отправке\nи иные действия, для которых Исполнитель использует Портал и действует в соответствии с Приложением № 5,\nИнструкциями и иными документами Заказчика, размещенными на Портале.\n1.48. Услуга WB Рекламные экраны — услуга, оказываемая Исполнителем, в соответствии с правилами и\nусловиями Приложения № 7 к Договору, заключается в предоставлении доступа Заказчику к Оборудованию для\nтрансляции Рекламных материалов Заказчиком.\n1.49.', 'в том числе Курьерам, получение Клиентских возвратов, подготовка Товара к возврату, Услуга WB\nTrack, Услуга WB Рекламные экраны и иные услуги, для оказания которых Исполнитель использует Портал и\nдействует в соответствии с Инструкциями и иными документами Заказчика, размещенными на Портале.', '1.46. Услуги – комплекс услуг, оказываемых Исполнителем по Договору в ПВЗ, неотъемлемой частью которого\nявляются такие Услуги, как приемка Товаров от Заказчика/Перевозчика/Продавца/Курьера, выдача Товара\nПолучателям, в том числе Курьерам, получение Клиентских возвратов, подготовка Товара к возврату, Услуга WB\nTrack, Услуга WB Рекламные экраны и иные услуги, для оказания которых Исполнитель использует Портал и\nдействует в соответствии с Инструкциями и иными документами Заказчика, размещенными на Портале.\n1.47.', '1.47. Услуга WB Track — услуга, оказываемая Исполнителем по Договору, в том числе приемка Отправлений\nWB Track от Отправителя, выдача Получателю Отправления WB Track, подготовка Отправления WB Track к отправке\nи иные действия, для которых Исполнитель использует Портал и действует в соответствии с Приложением № 5,\nИнструкциями и иными документами Заказчика, размещенными на Портале.\n1.48.', '1.53. Услуга WB Track – услуга, оказываемая Исполнителем по Договору, в том числе приемка Отправлений WB\nTrack от Отправителя, выдача Получателю Отправления WB Track, подготовка Отправления WB Track к отправке и\nиные действия, для которых Исполнитель использует Портал и действует в соответствии с Инструкциями и иными\nдокументами Заказчика, размещенными на Портале.\n1.55.', '1.53. Услуга WB Track – услуга, оказываемая Исполнителем по Договору, в том числе приемка Отправлений WB\nTrack от Отправителя, выдача Получателю Отправления WB Track, подготовка Отправления WB Track к отправке и\nиные действия, для которых Исполнитель использует Портал и действует в соответствии с Инструкциями и иными\nдокументами Заказчика, размещенными на Портале.\n1.55. Push-уведомление — уведомление, направляемое в личный кабинет Отправителя на Торговой площадке,\nсодержащее информацию об Отправителе, Получателе Отправления WB Track, адресе пункта назначения,\nгабаритах, характере, Объявленной ценности Отправления WB Track, стоимости доставки и иную информацию, а\nтакже содержащее модальное окно с возможностью согласиться с условиями доставки Отправления WB Track. Push-\nуведомление сохраняется в личном кабинете Отправителя до момента получения Отправления WB Track\nПолучателем или до момента истечения срока хранения Отправления WB Track в случае, если Получатель его не\nзабрал или отказался от его получения.\n1.56.', '1.47. Услуга WB Track — услуга, оказываемая Исполнителем по Договору, в том числе приемка Отправлений\nWB Track от Отправителя, выдача Получателю Отправления WB Track, подготовка Отправления WB Track к отправке\nи иные действия, для которых Исполнитель использует Портал и действует в соответствии с Приложением № 5,', 'При этом Исполнители обязаны:\nПри этом Исполнители обязаны:\n• оформлять документы, связанные с приёмкой/отправкой Товаров;\n• проставлять подписи с расшифровкой и печать (при её наличии) грузополучателя/грузоотправителя;\n• делать отметки о расхождениях (как излишек, так и недостаток), при их фактическом выявлении;\nИсполнитель не вправе принимать от Продавцов в ПВЗ Маркетплейс-короба или Маркетплейс Товары,\nнесоответствующие требуемым габаритам. Вознаграждение Исполнителя за приемку Маркетплейс Товаров, и также\nМаркетплейс-коробов с дальнейшей передачей их для доставки на Склад, рассчитывается за каждую единицу\nТовара, принятого на ПВЗ, согласно Тарифам (Приложение №1 к Договору).\n2.6. Оказание Услуги WB Track по доставке Отправлений WB Track осуществляется при условии предоставления и\nподтверждения Отправителем всей необходимой информации, указанной в п. 2.1 настоящего Приложения., в том\nчисле об Объявленной ценности Отправления WB Track.\n\n2.6.1.', 'Приложение № 5\nк Оферте об оказании услуг в ПВЗ\nУслуга WB Track\n\nПриложение № 5 содержит порядок и условия оказания Услуги WB Track, дополняет Оферту об оказании услуг в ПВЗ\nв части, необходимой для Услуги WB Track, и является обязательным для Исполнителей, оказывающих такую Услугу.\nРаздел 1. Термины и определения Оферты\n1.50. Объявленная ценность – сумма, от 1 000 (одной тысячи) до 50 000 (пятидесяти тысяч) российских\nрублей, которую сообщает Отправитель Исполнителю при оформлении Отправления, определяемая им\nсамостоятельно.\n1.51. Отправитель WB Track или Отправитель — физическое лицо, Клиент Торговой площадки, который\nпередал Исполнителю отправление WB Track для оформления доставки в соответствии с правилами и инструкциями\nи оплатил услугу WB Track.\n1.52. Отправление WB Track — вложения документарного и недокументарного характера, принимаемые в\nиндивидуальных транспортировочных упаковках и пересылаемые в одной оформленной доставке от одного Клиента/\nПолучателя к другому.\n1.53. Получатель Отправления WB Track, или Получатель, — физическое лицо, Клиент Торговой площадки,\nкоторому Отправитель направляет для получения Отправление WB Track.\n1.53.', '3.6. Исполнитель обязуется оказывать Услуги WB Track в полном объеме, согласно настоящему Приложению №5\nи Договору.\n4. Требования к обслуживанию Клиентов\n4.1.']","Исполнитель использует Портал и действует в соответствии с Инструкциями и иными документами Заказчика, размещенными на Портале, для оказания Услуг, включая Услугу WB Track и Услугу WB Рекламные экраны.  

Кроме того, для Услуги WB Track используется Приложение № 5 к Договору, которое содержит порядок и условия оказания этой услуги.  

Таким образом, основные документы и инструменты — это:  
- Портал;  
- Инструкции и иные документы Заказчика, размещённые на Портале;  
- Приложение № 5 к Договору (для Услуги WB Track)."
Какой размер Обеспечительного платежа установлен для Условий открытия стандартных ПВЗ в Российской Федерации?,['6'],"['Для подачи заявки на открытие ПВЗ Исполнитель:\n• в течение срока, определенного правилами в момента подачи заявки оплачивает Обеспечительный платёж\nпосредством перечисления денежных средств на расчетный счет Заказчика способом, указанным при подаче Заявки,\nи в определенном размере, что также будет отражено в момент подачи заявки Исполнителем для определенных зон\nна Тепловой карте:\nРоссийская Федерация:\n• Условия открытия стандартные – 50 000 (пятьдесят тысяч) российских рублей;\n• Условия открытия упрощенные – 5 000 (пять тысяч) российских рублей;', 'Для подачи заявки на открытие ПВЗ Исполнитель:\n• в течение срока, определенного правилами в момента подачи заявки оплачивает Обеспечительный платёж\nпосредством перечисления денежных средств на расчетный счет Заказчика способом, указанным при подаче Заявки,\nи в определенном размере, что также будет отражено в момент подачи заявки Исполнителем для определенных зон\nна Тепловой карте:\nРоссийская Федерация:\n• Условия открытия стандартные – 50 000 (пятьдесят тысяч) российских рублей;\n• Условия открытия упрощенные – 5 000 (пять тысяч) российских рублей;\nРеспублика Казахстан:\n\n• 270 000 (двести семьдесят тысяч) казахстанских тенге (KZT) — оплачивается только после согласования\nс Заказчиком;\nРеспублика Армения:\n• Условия открытия стандартные – 175 000 (сто семьдесят пять тысяч) Армянских драм (AMD);\nУсловия открытия упрощенные – 40 000 (сорок тысяч) Армянских драм (AMD);\nРеспублика Беларусь:\n• Условия открытия стандартные — 1 300 (одна тысяча триста) Белорусских рублей (BYN);\nЕсли страна регистрации Исполнителя и/или условия открытия не указаны в п.', '3.2.4. После Активации ПВЗ сумма Обеспечительного платежа, если была оплачена Исполнителем, будет\nвозвращена Исполнителю тем же способом, которым была оплачена, также сумма Обеспечительного платежа может\nбыть отражена на Балансе Исполнителя в связи с выполнением Исполнителем обязательства согласно п. 3.1.4\nДоговора и Активации ПВЗ. В случае если Исполнитель после одобрения заявки на открытие ПВЗ не подал заявку на\nАктивацию ПВЗ, или удалил заявку на открытие ПВЗ или не выполнил все необходимые условия по Активации ПВЗ,\nто сумма Обеспечительного платежа удерживается Заказчиком в полном объеме в качестве неустойки.\n4. Предмет Договора\n4.1. По Договору Исполнитель обязуется оказывать Заказчику Услуги на территории Российской Федерации и\nиных стран, в соответствии с применимым законодательством, правами, обязанностями и ответственностью,\nпредусмотренными Договором и Приложениями, в том числе в соответствии с Поручениями Заказчика в Личном\nкабинете и Инструкциями, а Заказчик обязуется принять и оплатить оказанные Услуги в сроки и на условиях,\nуказанных в Договоре.\n4.2.', 'Для подачи заявки на открытие ПВЗ Исполнитель:\n• в течение срока, определенного правилами в момента подачи заявки оплачивает Обеспечительный платёж\nпосредством перечисления денежных средств на расчетный счет Заказчика способом, указанным при подаче Заявки,\nи в определенном размере,', '— до 6 000 000 (шести миллионов) российских рублей для ПВЗ во всех остальных странах и регионах РФ, кроме\nгорода Москва, Московской области, города Санкт-Петербург, Тюменской области, Сахалинской области,', '— от 6 000 000 (шести миллионов) российских рублей для ПВЗ во всех остальных странах и регионах РФ, кроме\nгорода Москва, Московской области, города Санкт-Петербург, Тюменской области, Сахалинской области,', 'Базовый тариф применяется при нижеследующем Обороте ПВЗ Исполнителя:\n— до 4 000 000 (четырех миллионов) российских рублей для ПВЗ в Республике Казахстан;\n— до 6 000 000 (шести миллионов) российских рублей для ПВЗ во всех остальных странах и регионах РФ, кроме\nгорода Москва, Московской области, города Санкт-Петербург, Тюменской области, Сахалинской области, Ямало-\nНенецкого автономного округа и города Минск РБ;\n— до 8 000 000 (восьми миллионов) российских рублей для ПВЗ,', 'Базовый тариф применяется при нижеследующем Обороте ПВЗ Исполнителя:\n— до 4 000 000 (четырех миллионов) российских рублей для ПВЗ в Республике Казахстан;\n— до 6 000 000 (шести миллионов) российских рублей для ПВЗ во всех остальных странах и регионах РФ, кроме\nгорода Москва, Московской области, города Санкт-Петербург, Тюменской области, Сахалинской области, Ямало-\nНенецкого автономного округа и города Минск РБ;\n— до 8 000 000 (восьми миллионов) российских рублей для ПВЗ, расположенных в городе Москва, Московской\nобласти, города Санкт-Петербург, Тюменской области, Сахалинской области, Ямало-Ненецком автономном округе и\nгороде Минск РБ.', 'Дифференцированный тариф применяется при нижеследующем обороте ПВЗ Исполнителя:\n\n— от 4 000 000 (четырех миллионов) российских рублей для ПВЗ в Республике Казахстан;\n— от 6 000 000 (шести миллионов) российских рублей для ПВЗ во всех остальных странах и регионах РФ, кроме\nгорода Москва, Московской области, города Санкт-Петербург, Тюменской области, Сахалинской области, Ямало-\nНенецкого автономного округа и города Минск РБ;', '3.2.4. После Активации ПВЗ сумма Обеспечительного платежа, если была оплачена Исполнителем, будет\nвозвращена Исполнителю тем же способом, которым была оплачена, также сумма Обеспечительного платежа может\nбыть отражена на Балансе Исполнителя в связи с выполнением Исполнителем обязательства согласно п. 3.1.4\nДоговора и Активации ПВЗ.']",Размер Обеспечительного платежа для Условий открытия стандартных ПВЗ в Российской Федерации составляет **50 000 российских рублей**.
Как Исполнитель подтверждает свое согласие на обработку персональных данных при подаче заявки на открытие ПВЗ?,['6'],"['Уполномоченный\n\nпредставитель Исполнителя, заполняющий заявку, также обязуется предоставить согласие на сбор и дальнейшую\nобработку персональных данных в целях рассмотрения заявки, заключения и исполнения настоящей Оферты.\n2.5. Заказчик уведомляет об акцепте заявки Исполнителя в порядке и в сроки, предусмотренные Офертой.\nДоговор считается заключенным Сторонами с даты одобрения Заказчиком заявки на открытие ПВЗ. Такое одобрение\nпризнается акцептом предложения Исполнителя заключить Договор.\n2.6. По запросу Заказчика Исполнитель обязуется предоставить дополнительное подтверждение о заключении\nДоговора в указанной Заказчиком форме, например, в форме подписанного Исполнителем заявления о\nприсоединении к Оферте или текста Оферты.\n2.7. Исполнитель признает, что использование им логина и пароля является надлежащей и достаточной\nидентификацией Исполнителя на Портале, подтверждением права совершать действия на Портале и является\nаналогом собственноручной подписи Исполнителя. Действия, совершенные с использованием логина и пароля\nИсполнителя, считаются совершенными самим Исполнителем.\n2.8.', 'Уполномоченный\n\nпредставитель Исполнителя, заполняющий заявку, также обязуется предоставить согласие на сбор и дальнейшую\nобработку персональных данных в целях рассмотрения заявки, заключения и исполнения настоящей Оферты.\n2.5. Заказчик уведомляет об акцепте заявки Исполнителя в порядке и в сроки, предусмотренные Офертой.\nДоговор считается заключенным Сторонами с даты одобрения Заказчиком заявки на открытие ПВЗ. Такое одобрение\nпризнается акцептом предложения Исполнителя заключить Договор.\n2.6.', '3.1.1. Договора, то Исполнитель\nподает заявку на открытие ПВЗ без выполнения необходимых условий, указанных в первом абзаце этого пункта.\n• указывает в заявке информацию и прикладывает (загружает) документацию согласно требованиям,\nуказанным в Регламенте состояния ПВЗ. Исполнитель обязан предоставить Заказчику документы, подтверждающие\nналичие у Исполнителя права пользования помещением ПВЗ (собственности, аренды или на ином основании),\nоформленные или подписанные надлежащим образом;\n• Исполнитель заверяет, что Обеспечительный платеж будет произведен им лично или лицом,\nуполномоченным на совершение указанного платежа (участник, единоличный исполнительный орган, работник или\nиное). Настоящее заверение для Заказчика является заверением, имеющим существенное значение.\n3.1.2. Заказчик изучает и проверяет полученные в заявке от Исполнителя информацию и документы, а также\nинформирует Исполнителя о принятом решении в течение 5 (пяти) календарных дней с даты получения заявки на\nоткрытие ПВЗ. После окончания проверки Заказчиком принимается одно из следующих решений:\n• заявка Исполнителя на открытие ПВЗ одобряется Заказчиком, и Исполнитель обязан выполнить условия п.', 'Исполнитель на Портале проходит авторизацию с использованием им логина (номер телефона, указанный\nпри регистрации) и пароля (код, получаемый посредством push-уведомления, которое приходит через приложение\nТорговой площадки или смс), что является надлежащей и достаточной идентификацией Исполнителя на Портале.\n2.2. Исполнитель на Портале подает заявку и/или заявки на открытие ПВЗ по предусмотренной Заказчиком\nформе. Заполнение и отправка Исполнителем такой заявки и оплата Обеспечительного платежа, если он\nпредусмотрен, признаются направлением Исполнителем Заказчику предложения заключить Договор на условиях,\nпредусмотренных Офертой и документами, которые являются ее неотъемлемой частью.\n2.3. Исполнитель заполняет на Портале сведения и загружает документы, необходимые для заключения\nДоговора с Заказчиком, соответствующие требованиям, изложенным на Портале, и совершает действия,\nпредусмотренные соответствующей страницей Портала.\n2.4. Исполнитель обязан внимательно ознакомиться с Офертой, Обязательными условиями и Правилами,\nопубликованными на Портале, и принять на себя безусловное обязательство следовать им.', 'Исполнитель на Портале проходит авторизацию с использованием им логина (номер телефона, указанный\nпри регистрации) и пароля (код, получаемый посредством push-уведомления, которое приходит через приложение\nТорговой площадки или смс), что является надлежащей и достаточной идентификацией Исполнителя на Портале.\n2.2. Исполнитель на Портале подает заявку и/или заявки на открытие ПВЗ по предусмотренной Заказчиком\nформе.', '3.12. Исполнитель после одобрения Заказчиком заявки на открытие ПВЗ, до момента подачи заявки на Активацию\nПВЗ, должен оборудовать ПВЗ системой видеонаблюдения и подключить такую систему к одному из сервисов\nвидеонаблюдения, соответствующему различным техническим требованиям, параметры которых размещены на\nсайте https://pvz.wb.ru/video-connection\nИсполнитель обязан предоставить Заказчику доступ в Личный кабинет путем входа через токен и/или путем ввода\nлогина и пароля Исполнителя, с возможностью обрабатывать, копировать и сохранять видеозаписи с камер\nвидеонаблюдения в ПВЗ. В случае если Исполнитель не подключится к сервисам видеонаблюдения и не\nпредоставит доступ в Личный кабинет путем входа через токен и/или путем ввода логина и пароля Исполнителя,\nсогласно условиям настоящего пункта, Заказчик вправе отказать Исполнителю в одобрении заявки на Активацию\nПВЗ.\n\n3.13.', 'Уполномоченный\n\nпредставитель Исполнителя, заполняющий заявку, также обязуется предоставить согласие на сбор и дальнейшую\nобработку персональных данных в целях рассмотрения заявки, заключения и исполнения настоящей Оферты.\n2.5.', 'Для подачи заявки на открытие ПВЗ Исполнитель:\n• в течение срока, определенного правилами в момента подачи заявки оплачивает Обеспечительный платёж\nпосредством перечисления денежных средств на расчетный счет Заказчика способом, указанным при подаче Заявки,\nи в определенном размере, что также будет отражено в момент подачи заявки Исполнителем для определенных зон\nна Тепловой карте:\nРоссийская Федерация:\n• Условия открытия стандартные – 50 000 (пятьдесят тысяч) российских рублей;\n• Условия открытия упрощенные – 5 000 (пять тысяч) российских рублей;', '3.1.1. Договора, то Исполнитель\nподает заявку на открытие ПВЗ без выполнения необходимых условий, указанных в первом абзаце этого пункта.\n• указывает в заявке информацию и прикладывает (загружает) документацию согласно требованиям,\nуказанным в Регламенте состояния ПВЗ.', 'Для подачи заявки на открытие ПВЗ Исполнитель:\n• в течение срока, определенного правилами в момента подачи заявки оплачивает Обеспечительный платёж\nпосредством перечисления денежных средств на расчетный счет Заказчика способом, указанным при подаче Заявки,\nи в определенном размере,']","Исполнитель подтверждает своё согласие на сбор и дальнейшую обработку персональных данных при подаче заявки на открытие ПВЗ **своим уполномоченным представителем**, который заполняет заявку.  

Таким образом, согласие предоставляется **уполномоченным представителем Исполнителя**, заполняющим заявку, и оно включено в процесс подачи заявки.  

В тексте указано:  
> «Уполномоченный представитель Исполнителя, заполняющий заявку, также обязуется предоставить согласие на сбор и дальнейшую обработку персональных данных в целях рассмотрения заявки, заключения и исполнения настоящей Оферты.»  

**Ответ:** Уполномоченный представитель Исполнителя, заполняющий заявку, предоставляет согласие на сбор и дальнейшую обработку персональных данных."
"Какие действия Исполнителя могут быть признаны действиями самого Исполнителя, согласно положениям о логине, пароле и электронной подписи?",['6'],"['Действия, совершенные с использованием логина и пароля\nИсполнителя, считаются совершенными самим Исполнителем.\n2.8.', '2.8. Исполнитель обязан обеспечить безопасное и конфиденциальное хранение логина и пароля, используемых\nдля входа на Портал. В случае их утраты, в том числе в результате получения к ним доступа третьими лицами,\nИсполнитель обязан не использовать такие данные и незамедлительно уведомить об этом Заказчика.\n2.9. В случае если Исполнитель предоставит третьим лицам доступ к Личному кабинету на Портале с\nиспользованием своих логина и пароля, Исполнитель в полном объеме отвечает за любые действия и бездействие\nтаких лиц, совершенные (допущенные) ими при использовании такого Личного кабинета, как за свои собственные.\n2.10. Порядок ведения электронного документооборота между Сторонами.\n2.10.1. Стороны договорились при взаимодействии, обмене документами и иной информацией в электронной\nформе использовать систему электронного оборота между Сторонами, Исполнитель подключен и зарегистрирован в\nсистеме электронного документооборота (далее – Система ЭДО), с зарегистрированной усиленной\nквалифицированной электронной подписью согласно установленным нормам и правилам в стране регистрации\nИсполнителя.', 'Электронные документы, иная информация в электронной форме,\nподписанные ПЭП с использованием системы Заказчика, в которой Исполнитель авторизуется с использованием\nследующих данных (логина и пароля) Исполнителя, считаются подписанными самим Исполнителем.\n8.5.1.', '8.5.1. – 8.5.5.\nДоговора), по окончании Отчетного периода формируются следующие Документы, подтверждающие оказание Услуг,\nкоторые могут быть подписаны между Сторонами согласованным способом, в том числе, посредством ПЭП (простой\nэлектронной подписью, которая посредством использования кодов, паролей или иных средств подтверждает факт\nподписания электронной подписью электронных документов, иной информации в электронной форме определенным\nлицом. Электронная подпись, является аналогом собственноручной подписи в соответствии с законодательством\nРФ):\n• Акт оказанных Услуг за Отчётный период;\nВ случае, если Исполнитель не подписал, сформированный Акт оказанных услуг, в том числе, ПЭП в течение 5 (пяти)\nкалендарных дней с даты его формирования или не предоставил мотивированные возражения, то Акт оказанных\nУслуг считается принятым между Сторонами. Электронные документы, иная информация в электронной форме,\nподписанные ПЭП с использованием системы Заказчика, в которой Исполнитель авторизуется с использованием\nследующих данных (логина и пароля) Исполнителя, считаются подписанными самим Исполнителем.\n8.5.1.', '2.7. Исполнитель признает, что использование им логина и пароля является надлежащей и достаточной\nидентификацией Исполнителя на Портале, подтверждением права совершать действия на Портале и является\nаналогом собственноручной подписи Исполнителя.', 'В случае если Исполнитель предоставит третьим лицам доступ к\nиспользованию своей электронной подписи, Исполнитель в полном объеме отвечает за любые действия и\nбездействие таких лиц, совершенные (допущенные) ими при использовании электронной подписи, как за свои\nсобственные.\n3.', '2.6. По запросу Заказчика Исполнитель обязуется предоставить дополнительное подтверждение о заключении\nДоговора в указанной Заказчиком форме, например, в форме подписанного Исполнителем заявления о\nприсоединении к Оферте или текста Оферты.\n2.7. Исполнитель признает, что использование им логина и пароля является надлежащей и достаточной\nидентификацией Исполнителя на Портале, подтверждением права совершать действия на Портале и является\nаналогом собственноручной подписи Исполнителя.', '2.9. В случае если Исполнитель предоставит третьим лицам доступ к Личному кабинету на Портале с\nиспользованием своих логина и пароля, Исполнитель в полном объеме отвечает за любые действия и бездействие\nтаких лиц, совершенные (допущенные) ими при использовании такого Личного кабинета, как за свои собственные.\n2.10. Порядок ведения электронного документооборота между Сторонами.\n2.10.1.', '2.9. В случае если Исполнитель предоставит третьим лицам доступ к Личному кабинету на Портале с\nиспользованием своих логина и пароля, Исполнитель в полном объеме отвечает за любые действия и бездействие\nтаких лиц, совершенные (допущенные) ими при использовании такого Личного кабинета,', 'В случае если Исполнитель предоставит третьим лицам доступ к\nиспользованию своей электронной подписи, Исполнитель в полном объеме отвечает за любые действия и\nбездействие таких лиц, совершенные (допущенные) ими при использовании электронной подписи, как за свои\nсобственные.\n3. Подача заявок на открытие и активацию ПВЗ\n3.1. Открытие нового ПВЗ\n3.1.1.']","Согласно положениям контекста, следующие действия Исполнителя могут быть признаны действиями самого Исполнителя:

1. **Действия, совершенные с использованием логина и пароля** на Портале, считаются совершенными самим Исполнителем (пункт 2.8).

2. **Использование логина и пароля** для авторизации в системе электронного документооборота (Система ЭДО) признаётся надлежащей и достаточной идентификацией Исполнителя, подтверждением права совершать действия на Портале и является **аналогом собственноручной подписи** (пункт 2.7).

3. **Электронные документы и иная информация в электронной форме**, подписанные простой электронной подписью (ПЭП) с использованием системы Заказчика, в которой Исполнитель авторизуется с использованием своих логина и пароля, **считаются подписанными самим Исполнителем** (пункт 8.5.1).

4. **В случае предоставления третьим лицам доступа к Личному кабинету на Портале с использованием логина и пароля**, Исполнитель **в полном объёме отвечает за любые действия и бездействие таких лиц**, как за свои собственные (пункт 2.9).

5. **В случае предоставления третьим лицам доступа к использованию электронной подписи**, Исполнитель также **в полном объёме отвечает за любые действия и бездействие таких лиц**, как за свои собственные (пункт 3).

**Итоговый ответ:**

Действия Исполнителя, совершенные с использованием его логина и пароля на Портале или при авторизации в системе электронного документооборота, включая подписание электронных документов простой электронной подписью (ПЭП), считаются действиями самого Исполнителя. Кроме того, Исполнитель несёт полную ответственность за действия третьих лиц, получивших доступ к его личному кабинету или электронной подписи с использованием его логина и пароля."
Какой срок установлен для выполнения условий подготовки к открытию ПВЗ после одобрения заявки?,['7'],"['3.1.4. Исполнитель обязан при подготовке к открытию ПВЗ выполнить все условия и требования к состоянию\nПВЗ, указанные в Договоре и Регламенте состояния ПВЗ, в течение 30 (тридцати) календарных дней с даты\nодобрения заявки на открытие ПВЗ.\n3.1.5. Заказчиком устанавливаются зоны открытия ПВЗ в соответствии с Тепловой картой, которая учитывает\nнагрузку на действующие в данной зоне ПВЗ и плотность населения в конкретном районе.', '3.1.4. Исполнитель обязан при подготовке к открытию ПВЗ выполнить все условия и требования к состоянию\nПВЗ, указанные в Договоре и Регламенте состояния ПВЗ, в течение 30 (тридцати) календарных дней с даты\nодобрения заявки на открытие ПВЗ.\n3.1.5.', '3.1.4. Исполнитель обязан при подготовке к открытию ПВЗ выполнить все условия и требования к состоянию\nПВЗ, указанные в Договоре и Регламенте состояния ПВЗ, в течение 30 (тридцати) календарных дней с даты\nодобрения заявки на открытие ПВЗ.\n3.1.5. Заказчиком устанавливаются зоны открытия ПВЗ в соответствии с Тепловой картой, которая учитывает\nнагрузку на действующие в данной зоне ПВЗ и плотность населения в конкретном районе. Размещение в одном\nстроении/здании более одного ПВЗ не допускается, за исключением случаев, согласованных с Заказчиком.\n3.2. Активация ПВЗ\n3.2.1. С момента одобрения Заказчиком заявки Исполнителя на открытие ПВЗ и выполнения Исполнителем\nусловий п. 3.1.4 Договора Исполнитель вправе подать заявку на Активацию ПВЗ через Портал. Заявка на Активацию\nПВЗ должна соответствовать требованиям и содержать документацию, указанную в Регламенте состояния ПВЗ.\nПосле окончания проверки Заказчиком принимается одно из следующих решений:\n• Заявка Исполнителя на Активацию ПВЗ считается одобренной.', '3.17.3.1. В целях исполнения указанного обязательства Исполнитель вправе привлекать третьих лиц.\n3.17.3.2. Исполнитель обязан по требованию Заказчика устранить нарушения требований к Активации ПВЗ в\nустановленный Заказчиком срок, но не позднее 30 (тридцати) дней с момента выявления указанных нарушений. В\nпротивном случае Исполнитель лишается права активировать указанный ПВЗ. В качестве подтверждения\nвыполнения указанных требований Исполнитель обязан предоставить Заказчику фото- и видеоматериалы в\nдостаточном объеме, для объективной оценки надлежащего исполнения обязательств.\n3.17.4. Заказчик по запросу Исполнителя может давать консультации последнему по вопросам установки, монтажа,\nналадки работы, правильной эксплуатации и обслуживания Системы WB-LOCK.\n3.17.5. Исполнитель после одобрения Заказчиком заявки на открытие ПВЗ, до момента подачи заявки на\nАктивацию ПВЗ, должен оборудовать ПВЗ Системой WB-LOCK.\n3.17.6. Исполнители действующих ПВЗ устанавливают Систему WB-LOCK в течение 10 (десяти) календарных дней\nс момента её передачи Заказчиком согласно акту приема-передачи.', '3.1.1. Договора, то Исполнитель\nподает заявку на открытие ПВЗ без выполнения необходимых условий, указанных в первом абзаце этого пункта.\n• указывает в заявке информацию и прикладывает (загружает) документацию согласно требованиям,\nуказанным в Регламенте состояния ПВЗ. Исполнитель обязан предоставить Заказчику документы, подтверждающие\nналичие у Исполнителя права пользования помещением ПВЗ (собственности, аренды или на ином основании),\nоформленные или подписанные надлежащим образом;\n• Исполнитель заверяет, что Обеспечительный платеж будет произведен им лично или лицом,\nуполномоченным на совершение указанного платежа (участник, единоличный исполнительный орган, работник или\nиное). Настоящее заверение для Заказчика является заверением, имеющим существенное значение.\n3.1.2. Заказчик изучает и проверяет полученные в заявке от Исполнителя информацию и документы, а также\nинформирует Исполнителя о принятом решении в течение 5 (пяти) календарных дней с даты получения заявки на\nоткрытие ПВЗ. После окончания проверки Заказчиком принимается одно из следующих решений:\n• заявка Исполнителя на открытие ПВЗ одобряется Заказчиком, и Исполнитель обязан выполнить условия п.', '3.1.2. Заказчик изучает и проверяет полученные в заявке от Исполнителя информацию и документы, а также\nинформирует Исполнителя о принятом решении в течение 5 (пяти) календарных дней с даты получения заявки на\nоткрытие ПВЗ. После окончания проверки Заказчиком принимается одно из следующих решений:\n• заявка Исполнителя на открытие ПВЗ одобряется Заказчиком, и Исполнитель обязан выполнить условия п.', 'отказа\nИсполнителя открывать и активировать ПВЗ в течение 7 (семи) календарных дней после одобрения заявки на\nоткрытие ПВЗ, то Заказчик возвращает Исполнителю сумму Обеспечительного платежа, если он был оплачен\nИсполнителем в течение 3 (трех) рабочих дней,', 'Для подачи заявки на открытие ПВЗ Исполнитель:\n• в течение срока, определенного правилами в момента подачи заявки оплачивает Обеспечительный платёж\nпосредством перечисления денежных средств на расчетный счет Заказчика способом, указанным при подаче Заявки,\nи в определенном размере, что также будет отражено в момент подачи заявки Исполнителем для определенных зон\nна Тепловой карте:\nРоссийская Федерация:\n• Условия открытия стандартные – 50 000 (пятьдесят тысяч) российских рублей;\n• Условия открытия упрощенные – 5 000 (пять тысяч) российских рублей;\nРеспублика Казахстан:\n\n• 270 000 (двести семьдесят тысяч) казахстанских тенге (KZT) — оплачивается только после согласования\nс Заказчиком;\nРеспублика Армения:\n• Условия открытия стандартные – 175 000 (сто семьдесят пять тысяч) Армянских драм (AMD);\nУсловия открытия упрощенные – 40 000 (сорок тысяч) Армянских драм (AMD);\nРеспублика Беларусь:\n• Условия открытия стандартные — 1 300 (одна тысяча триста) Белорусских рублей (BYN);\nЕсли страна регистрации Исполнителя и/или условия открытия не указаны в п.', 'Для подачи заявки на открытие ПВЗ Исполнитель:\n• в течение срока, определенного правилами в момента подачи заявки оплачивает Обеспечительный платёж\nпосредством перечисления денежных средств на расчетный счет Заказчика способом, указанным при подаче Заявки,\nи в определенном размере, что также будет отражено в момент подачи заявки Исполнителем для определенных зон\nна Тепловой карте:\nРоссийская Федерация:\n• Условия открытия стандартные – 50 000 (пятьдесят тысяч) российских рублей;\n• Условия открытия упрощенные – 5 000 (пять тысяч) российских рублей;', '3.12. Исполнитель после одобрения Заказчиком заявки на открытие ПВЗ, до момента подачи заявки на Активацию\nПВЗ, должен оборудовать ПВЗ системой видеонаблюдения и подключить такую систему к одному из сервисов\nвидеонаблюдения, соответствующему различным техническим требованиям,']","Срок, установленный для выполнения условий подготовки к открытию ПВЗ после одобрения заявки, — **30 (тридцати) календарных дней**.

Это указано в пункте 3.1.4 контекста:  
«Исполнитель обязан при подготовке к открытию ПВЗ выполнить все условия и требования к состоянию ПВЗ, указанные в Договоре и Регламенте состояния ПВЗ, в течение 30 (тридцати) календарных дней с даты одобрения заявки на открытие ПВЗ»."
Какие документы должен предоставить Исполнитель для подтверждения права пользования помещением ПВЗ?,['7'],"['Исполнитель обязан предоставить Заказчику документы, подтверждающие\nналичие у Исполнителя права пользования помещением ПВЗ (собственности, аренды или на ином основании),\nоформленные или подписанные надлежащим образом;\n• Исполнитель заверяет, что Обеспечительный платеж будет произведен им лично или лицом,', 'ПВЗ – помещение или часть помещения, здания, дома, находящееся у Исполнителя в собственности или во\nвладении и пользовании или на ином законном основании, в котором Исполнитель непосредственно оказывает\nУслуги.\n3.2. При Активации ПВЗ Исполнитель обязан предоставить правоустанавливающие документы на помещение\nЗаказчику, выписку из ЕГРН или технический план БТИ или иные документы. При этом выписка из ЕГРН должна быть\nполучена Исполнителем в срок, не превышающий 1 (один) месяц до даты Активации ПВЗ. Заказчик оставляет за\nсобой право запросить дополнительные документы.', 'Исполнитель обязан предоставить Заказчику документы, подтверждающие\nналичие у Исполнителя права пользования помещением ПВЗ (собственности, аренды или на ином основании),\nоформленные или подписанные надлежащим образом;\n• Исполнитель заверяет, что Обеспечительный платеж будет произведен им лично или лицом,\nуполномоченным на совершение указанного платежа (участник, единоличный исполнительный орган, работник или\nиное). Настоящее заверение для Заказчика является заверением, имеющим существенное значение.\n3.1.2.', '3.2. При Активации ПВЗ Исполнитель обязан предоставить правоустанавливающие документы на помещение\nЗаказчику, выписку из ЕГРН или технический план БТИ или иные документы.', '3.1.1. Договора, то Исполнитель\nподает заявку на открытие ПВЗ без выполнения необходимых условий, указанных в первом абзаце этого пункта.\n• указывает в заявке информацию и прикладывает (загружает) документацию согласно требованиям,\nуказанным в Регламенте состояния ПВЗ. Исполнитель обязан предоставить Заказчику документы, подтверждающие\nналичие у Исполнителя права пользования помещением ПВЗ (собственности, аренды или на ином основании),\nоформленные или подписанные надлежащим образом;\n• Исполнитель заверяет, что Обеспечительный платеж будет произведен им лично или лицом,\nуполномоченным на совершение указанного платежа (участник, единоличный исполнительный орган, работник или\nиное). Настоящее заверение для Заказчика является заверением, имеющим существенное значение.\n3.1.2. Заказчик изучает и проверяет полученные в заявке от Исполнителя информацию и документы, а также\nинформирует Исполнителя о принятом решении в течение 5 (пяти) календарных дней с даты получения заявки на\nоткрытие ПВЗ. После окончания проверки Заказчиком принимается одно из следующих решений:\n• заявка Исполнителя на открытие ПВЗ одобряется Заказчиком, и Исполнитель обязан выполнить условия п.', '2. Правила Активации ПВЗ\nПредоставьте видеообзор ПВЗ для подтверждения брендирования, в котором необходимо\nпродемонстрировать:\n• адресную табличку дома;\n• панорамный вид окрестности;\n• фасад с вывеской и режимом работы;\n• клиентскую зону (зону выдачи/приемки Товаров, примерки Товаров Клиентами) полностью;\n• складскую зону (зону местонахождения Товаров) полностью.\n3. Требования, предъявляемые к ПВЗ Исполнителя\n3.1. ПВЗ – помещение или часть помещения, здания, дома, находящееся у Исполнителя в собственности или во\nвладении и пользовании или на ином законном основании, в котором Исполнитель непосредственно оказывает\nУслуги.\n3.2. При Активации ПВЗ Исполнитель обязан предоставить правоустанавливающие документы на помещение\nЗаказчику, выписку из ЕГРН или технический план БТИ или иные документы. При этом выписка из ЕГРН должна быть\nполучена Исполнителем в срок, не превышающий 1 (один) месяц до даты Активации ПВЗ. Заказчик оставляет за\nсобой право запросить дополнительные документы.\n3.3.', '2. 5.2. Исполнитель обязуется предоставлять в Личномкабинете достоверные данные о характеристиках ПВЗ:адрес, площадь помещения, в которомнепосредственно оказываются Услуги, количествосотрудников Исполнителя в ПВЗ и др. Данные охарактеристиках ПВЗ должны подтверждатьсядокументами в соответствии с п. 3.2. Приложения № 3Договора.\nЗа первое нарушение – 10 000(десять тысяч) российских рублей;за каждое следующее выявленноенарушение – 100 000 (сто тысяч)российских рублей.\n3. 5.7. Исполнитель обязуется на протяжении срока действияДоговора поддерживать состояние ПВЗ в соответствиис требованиями, указанными в Регламенте состоянияПВЗ, в том числе в соответствии с требованиямиБрендбука, проводить за свой счет ремонт внутри ПВЗ.В случае обнаружения Заказчиком несоответствиясостояния ПВЗ указанным требованиям Заказчикпосредством Портала направляет Исполнителютребование о необходимости приведения ПВЗ всостояние, соответствующее требованиям, указанным вРегламенте состояния ПВЗ.', 'В\nпротивном случае Исполнитель лишается права активировать указанный ПВЗ. В качестве подтверждения\nвыполнения указанных требований Исполнитель обязан предоставить Заказчику фото- и видеоматериалы в\nдостаточном объеме для объективной оценки надлежащего исполнения обязательств по Активации Исполнителем\nПВЗ.\n3.12.', 'Исполнитель обязан своими силами и за свой счет осуществить подготовку, получение и согласование со всеми\nнеобходимыми уполномоченными государственными и муниципальными органами, организациями, а также иными\nлицами в случаях, предусмотренных действующим законодательством, всех документов, требуемых федеральным,\nрегиональным или муниципальным законодательством для размещения и эксплуатации Фирменной вывески,\nвключая, но не ограничиваясь: дизайн-проектами, концепциями, фасадными схемами, паспортами фасадов,\nпаспортами входных групп, в зависимости от требований, применимых к месту нахождения ПВЗ.\nПо запросу Заказчика Исполнитель обязуется представить заверенные надлежащим образом копии документов,\nподтверждающих выполнение Исполнителем обязанности, предусмотренной настоящим пунктом, в течение 5 (Пяти)\nрабочих дней с даты получения указанного запроса.\n3.9. Заказчик предоставляет Исполнителю Фирменную вывеску либо компенсирует расходы Исполнителя на ее\nприобретение.\nПри Активации Исполнителем ПВЗ в любой зоне, указанной Заказчиком на Тепловой карте, Заказчик вправе:\n(i) для ПВЗ,', '3.17.3.1. В целях исполнения указанного обязательства Исполнитель вправе привлекать третьих лиц.\n3.17.3.2. Исполнитель обязан по требованию Заказчика устранить нарушения требований к Активации ПВЗ в\nустановленный Заказчиком срок, но не позднее 30 (тридцати) дней с момента выявления указанных нарушений. В\nпротивном случае Исполнитель лишается права активировать указанный ПВЗ. В качестве подтверждения\nвыполнения указанных требований Исполнитель обязан предоставить Заказчику фото- и видеоматериалы в\nдостаточном объеме, для объективной оценки надлежащего исполнения обязательств.\n3.17.4. Заказчик по запросу Исполнителя может давать консультации последнему по вопросам установки, монтажа,\nналадки работы, правильной эксплуатации и обслуживания Системы WB-LOCK.\n3.17.5. Исполнитель после одобрения Заказчиком заявки на открытие ПВЗ, до момента подачи заявки на\nАктивацию ПВЗ, должен оборудовать ПВЗ Системой WB-LOCK.\n3.17.6. Исполнители действующих ПВЗ устанавливают Систему WB-LOCK в течение 10 (десяти) календарных дней\nс момента её передачи Заказчиком согласно акту приема-передачи.']","Исполнитель должен предоставить Заказчику документы, подтверждающие наличие у него права пользования помещением ПВЗ (собственности, аренды или на ином законном основании), оформленные или подписанные надлежащим образом. К таким документам относятся:

- выписка из ЕГРН (должна быть получена не позднее 1 месяца до даты Активации ПВЗ);  
- технический план БТИ;  
- иные правоустанавливающие документы.

Также при Активации ПВЗ Исполнитель обязан предоставить выписку из ЕГРН или технический план БТИ или иные документы, подтверждающие право пользования помещением."
"Какие последствия наступают, если Исполнитель не активирует ПВЗ в течение 7 календарных дней после одобрения заявки на открытие?",['7'],"['отказа\nИсполнителя открывать и активировать ПВЗ в течение 7 (семи) календарных дней после одобрения заявки на\nоткрытие ПВЗ, то Заказчик возвращает Исполнителю сумму Обеспечительного платежа, если он был оплачен\nИсполнителем в течение 3 (трех) рабочих дней,', '3.1.3. Если заявка Исполнителя на открытие нового ПВЗ была отклонена Заказчиком, удалена по причине\nотсутствия доработки Исполнителем в течение 5 (пяти) рабочих дней после получения такого статуса, отказа\nИсполнителя открывать и активировать ПВЗ в течение 7 (семи) календарных дней после одобрения заявки на\nоткрытие ПВЗ, то Заказчик возвращает Исполнителю сумму Обеспечительного платежа, если он был оплачен\nИсполнителем в течение 3 (трех) рабочих дней, с момента отклонения указанной заявки.', 'В случае если Исполнитель после одобрения заявки на открытие ПВЗ не подал заявку на\nАктивацию ПВЗ, или удалил заявку на открытие ПВЗ или не выполнил все необходимые условия по Активации ПВЗ,\nто сумма Обеспечительного платежа удерживается Заказчиком в полном объеме в качестве неустойки.\n4. Предмет Договора\n4.1.', 'В случае если Исполнитель после одобрения заявки на открытие ПВЗ не подал заявку на\nАктивацию ПВЗ, или удалил заявку на открытие ПВЗ или не выполнил все необходимые условия по Активации ПВЗ,\nто сумма Обеспечительного платежа удерживается Заказчиком в полном объеме в качестве неустойки.\n4.', '3.1.4 Договора;\n• заявка Исполнителя на открытие ПВЗ отклоняется Заказчиком с указанием причин отказа в соответствии с\nп. 3.2.3 Договора и рекомендациями по их устранению в соответствии с Регламентом состояния ПВЗ.\n3.1.3. Если заявка Исполнителя на открытие нового ПВЗ была отклонена Заказчиком, удалена по причине\nотсутствия доработки Исполнителем в течение 5 (пяти) рабочих дней после получения такого статуса, отказа\nИсполнителя открывать и активировать ПВЗ в течение 7 (семи) календарных дней после одобрения заявки на\nоткрытие ПВЗ, то Заказчик возвращает Исполнителю сумму Обеспечительного платежа, если он был оплачен\nИсполнителем в течение 3 (трех) рабочих дней, с момента отклонения указанной заявки. Моментом возврата суммы\nОбеспечительного платежа Исполнителю является дата списания соответствующих денежных средств с расчётного\nсчёта банка, в котором обслуживается Заказчик.\n3.1.4.', '3.17.3.1. В целях исполнения указанного обязательства Исполнитель вправе привлекать третьих лиц.\n3.17.3.2. Исполнитель обязан по требованию Заказчика устранить нарушения требований к Активации ПВЗ в\nустановленный Заказчиком срок, но не позднее 30 (тридцати) дней с момента выявления указанных нарушений. В\nпротивном случае Исполнитель лишается права активировать указанный ПВЗ. В качестве подтверждения\nвыполнения указанных требований Исполнитель обязан предоставить Заказчику фото- и видеоматериалы в\nдостаточном объеме, для объективной оценки надлежащего исполнения обязательств.\n3.17.4. Заказчик по запросу Исполнителя может давать консультации последнему по вопросам установки, монтажа,\nналадки работы, правильной эксплуатации и обслуживания Системы WB-LOCK.\n3.17.5. Исполнитель после одобрения Заказчиком заявки на открытие ПВЗ, до момента подачи заявки на\nАктивацию ПВЗ, должен оборудовать ПВЗ Системой WB-LOCK.\n3.17.6. Исполнители действующих ПВЗ устанавливают Систему WB-LOCK в течение 10 (десяти) календарных дней\nс момента её передачи Заказчиком согласно акту приема-передачи.', '3.17.3.1. В целях исполнения указанного обязательства Исполнитель вправе привлекать третьих лиц.\n3.17.3.2. Исполнитель обязан по требованию Заказчика устранить нарушения требований к Активации ПВЗ в\nустановленный Заказчиком срок, но не позднее 30 (тридцати) дней с момента выявления указанных нарушений. В\nпротивном случае Исполнитель лишается права активировать указанный ПВЗ.', '3.1.4. Исполнитель обязан при подготовке к открытию ПВЗ выполнить все условия и требования к состоянию\nПВЗ, указанные в Договоре и Регламенте состояния ПВЗ, в течение 30 (тридцати) календарных дней с даты\nодобрения заявки на открытие ПВЗ.\n3.1.5. Заказчиком устанавливаются зоны открытия ПВЗ в соответствии с Тепловой картой, которая учитывает\nнагрузку на действующие в данной зоне ПВЗ и плотность населения в конкретном районе. Размещение в одном\nстроении/здании более одного ПВЗ не допускается, за исключением случаев, согласованных с Заказчиком.\n3.2. Активация ПВЗ\n3.2.1. С момента одобрения Заказчиком заявки Исполнителя на открытие ПВЗ и выполнения Исполнителем\nусловий п. 3.1.4 Договора Исполнитель вправе подать заявку на Активацию ПВЗ через Портал. Заявка на Активацию\nПВЗ должна соответствовать требованиям и содержать документацию, указанную в Регламенте состояния ПВЗ.\nПосле окончания проверки Заказчиком принимается одно из следующих решений:\n• Заявка Исполнителя на Активацию ПВЗ считается одобренной.', 'Активация ПВЗ происходит с момента\nполучения Исполнителем сообщения об активации, и ПВЗ считается действующим с такого момента.\n\n• Заявка отклоняется с указанием причин отказа и рекомендаций по их устранению.\n3.2.2. В случае получения Исполнителем отказа в Активации ПВЗ, Исполнитель вправе повторно подать заявку\nна Активацию ПВЗ в установленном Договором порядке.\n3.2.3. Основанием для отклонения заявок на открытие и Активацию ПВЗ в том числе могут являться:\n3.2.3.1. несоблюдение требований, указанных в Регламенте состояния ПВЗ;\n3.2.3.2. предоставление ложных (недостоверных) сведений; сведений, содержащих противоречивую,\nнеполную информацию; не предоставление документов или предоставление документов в нечитаемых форматах,\nвключая случаи, когда документ(ы) не открываются на ЭВМ, либо открываются с ошибками, не позволяющими\nознакомиться с содержащейся в них информацией, а также информацию, находящуюся в документах с низким\nкачеством изображения, не позволяющим изучить такую информацию.\n3.2.4.', '3.17.5. Исполнитель после одобрения Заказчиком заявки на открытие ПВЗ, до момента подачи заявки на\nАктивацию ПВЗ, должен оборудовать ПВЗ Системой WB-LOCK.\n3.17.6.']","Если Исполнитель не активирует ПВЗ в течение 7 календарных дней после одобрения заявки на открытие, то **Заказчик возвращает Исполнителю сумму Обеспечительного платежа**, если он был оплачен Исполнителем в течение 3 рабочих дней с момента отклонения заявки.

Однако важно отметить, что в тексте указано, что **отказ Исполнителя открывать и активировать ПВЗ в течение 7 календарных дней после одобрения заявки на открытие ПВЗ** — это условие, при котором **Заказчик возвращает Обеспечительный платеж**.

Таким образом, **последствия** такого нарушения — **возврат Обеспечительного платежа Заказчиком Исполнителю** (при условии, что он был оплачен в течение 3 рабочих дней с момента отклонения заявки).

**Ответ:**  
Если Исполнитель не активирует ПВЗ в течение 7 календарных дней после одобрения заявки на открытие, Заказчик возвращает Исполнителю сумму Обеспечительного платежа, если он был оплачен в течение 3 рабочих дней с момента отклонения заявки."
"Какой штраф налагается на Исполнителя, если он не подаст заявку на Активацию ПВЗ после одобрения заявки на открытие ПВЗ?",['8'],"['В случае если Исполнитель после одобрения заявки на открытие ПВЗ не подал заявку на\nАктивацию ПВЗ, или удалил заявку на открытие ПВЗ или не выполнил все необходимые условия по Активации ПВЗ,\nто сумма Обеспечительного платежа удерживается Заказчиком в полном объеме в качестве неустойки.\n4.', 'В случае если Исполнитель после одобрения заявки на открытие ПВЗ не подал заявку на\nАктивацию ПВЗ, или удалил заявку на открытие ПВЗ или не выполнил все необходимые условия по Активации ПВЗ,\nто сумма Обеспечительного платежа удерживается Заказчиком в полном объеме в качестве неустойки.\n4. Предмет Договора\n4.1.', '3.2.4. После Активации ПВЗ сумма Обеспечительного платежа, если была оплачена Исполнителем, будет\nвозвращена Исполнителю тем же способом, которым была оплачена, также сумма Обеспечительного платежа может\nбыть отражена на Балансе Исполнителя в связи с выполнением Исполнителем обязательства согласно п. 3.1.4\nДоговора и Активации ПВЗ. В случае если Исполнитель после одобрения заявки на открытие ПВЗ не подал заявку на\nАктивацию ПВЗ, или удалил заявку на открытие ПВЗ или не выполнил все необходимые условия по Активации ПВЗ,\nто сумма Обеспечительного платежа удерживается Заказчиком в полном объеме в качестве неустойки.\n4. Предмет Договора\n4.1. По Договору Исполнитель обязуется оказывать Заказчику Услуги на территории Российской Федерации и\nиных стран, в соответствии с применимым законодательством, правами, обязанностями и ответственностью,\nпредусмотренными Договором и Приложениями, в том числе в соответствии с Поручениями Заказчика в Личном\nкабинете и Инструкциями, а Заказчик обязуется принять и оплатить оказанные Услуги в сроки и на условиях,\nуказанных в Договоре.\n4.2.', '3.17.3.1. В целях исполнения указанного обязательства Исполнитель вправе привлекать третьих лиц.\n3.17.3.2. Исполнитель обязан по требованию Заказчика устранить нарушения требований к Активации ПВЗ в\nустановленный Заказчиком срок, но не позднее 30 (тридцати) дней с момента выявления указанных нарушений. В\nпротивном случае Исполнитель лишается права активировать указанный ПВЗ. В качестве подтверждения\nвыполнения указанных требований Исполнитель обязан предоставить Заказчику фото- и видеоматериалы в\nдостаточном объеме, для объективной оценки надлежащего исполнения обязательств.\n3.17.4. Заказчик по запросу Исполнителя может давать консультации последнему по вопросам установки, монтажа,\nналадки работы, правильной эксплуатации и обслуживания Системы WB-LOCK.\n3.17.5. Исполнитель после одобрения Заказчиком заявки на открытие ПВЗ, до момента подачи заявки на\nАктивацию ПВЗ, должен оборудовать ПВЗ Системой WB-LOCK.\n3.17.6. Исполнители действующих ПВЗ устанавливают Систему WB-LOCK в течение 10 (десяти) календарных дней\nс момента её передачи Заказчиком согласно акту приема-передачи.', '3.1.3. Если заявка Исполнителя на открытие нового ПВЗ была отклонена Заказчиком, удалена по причине\nотсутствия доработки Исполнителем в течение 5 (пяти) рабочих дней после получения такого статуса, отказа\nИсполнителя открывать и активировать ПВЗ в течение 7 (семи) календарных дней после одобрения заявки на\nоткрытие ПВЗ, то Заказчик возвращает Исполнителю сумму Обеспечительного платежа, если он был оплачен\nИсполнителем в течение 3 (трех) рабочих дней, с момента отклонения указанной заявки.', 'отказа\nИсполнителя открывать и активировать ПВЗ в течение 7 (семи) календарных дней после одобрения заявки на\nоткрытие ПВЗ, то Заказчик возвращает Исполнителю сумму Обеспечительного платежа, если он был оплачен\nИсполнителем в течение 3 (трех) рабочих дней,', '3.1.4. Исполнитель обязан при подготовке к открытию ПВЗ выполнить все условия и требования к состоянию\nПВЗ, указанные в Договоре и Регламенте состояния ПВЗ, в течение 30 (тридцати) календарных дней с даты\nодобрения заявки на открытие ПВЗ.\n3.1.5. Заказчиком устанавливаются зоны открытия ПВЗ в соответствии с Тепловой картой, которая учитывает\nнагрузку на действующие в данной зоне ПВЗ и плотность населения в конкретном районе. Размещение в одном\nстроении/здании более одного ПВЗ не допускается, за исключением случаев, согласованных с Заказчиком.\n3.2. Активация ПВЗ\n3.2.1. С момента одобрения Заказчиком заявки Исполнителя на открытие ПВЗ и выполнения Исполнителем\nусловий п. 3.1.4 Договора Исполнитель вправе подать заявку на Активацию ПВЗ через Портал. Заявка на Активацию\nПВЗ должна соответствовать требованиям и содержать документацию, указанную в Регламенте состояния ПВЗ.\nПосле окончания проверки Заказчиком принимается одно из следующих решений:\n• Заявка Исполнителя на Активацию ПВЗ считается одобренной.', '3.17.5. Исполнитель после одобрения Заказчиком заявки на открытие ПВЗ, до момента подачи заявки на\nАктивацию ПВЗ, должен оборудовать ПВЗ Системой WB-LOCK.\n3.17.6.', '3.12. Исполнитель после одобрения Заказчиком заявки на открытие ПВЗ, до момента подачи заявки на Активацию\nПВЗ, должен оборудовать ПВЗ системой видеонаблюдения и подключить такую систему к одному из сервисов\nвидеонаблюдения, соответствующему различным техническим требованиям,', '3.1.4 Договора;\n• заявка Исполнителя на открытие ПВЗ отклоняется Заказчиком с указанием причин отказа в соответствии с\nп. 3.2.3 Договора и рекомендациями по их устранению в соответствии с Регламентом состояния ПВЗ.\n3.1.3. Если заявка Исполнителя на открытие нового ПВЗ была отклонена Заказчиком, удалена по причине\nотсутствия доработки Исполнителем в течение 5 (пяти) рабочих дней после получения такого статуса, отказа\nИсполнителя открывать и активировать ПВЗ в течение 7 (семи) календарных дней после одобрения заявки на\nоткрытие ПВЗ, то Заказчик возвращает Исполнителю сумму Обеспечительного платежа, если он был оплачен\nИсполнителем в течение 3 (трех) рабочих дней, с момента отклонения указанной заявки. Моментом возврата суммы\nОбеспечительного платежа Исполнителю является дата списания соответствующих денежных средств с расчётного\nсчёта банка, в котором обслуживается Заказчик.\n3.1.4.']","Штраф, который налагается на Исполнителя, если он не подаст заявку на Активацию ПВЗ после одобрения заявки на открытие ПВЗ, — **удержание суммы Обеспечительного платежа в полном объеме в качестве неустойки**.

Это указано в нескольких местах контекста:  
> «В случае если Исполнитель после одобрения заявки на открытие ПВЗ не подал заявку на Активацию ПВЗ, или удалил заявку на открытие ПВЗ или не выполнил все необходимые условия по Активации ПВЗ, то сумма Обеспечительного платежа удерживается Заказчиком в полном объеме в качестве неустойки.»"
"Какие основания могут быть для отклонения заявки на открытие или Активацию ПВЗ, согласно пункту 3.2.3?",['8'],"['Активация ПВЗ происходит с момента\nполучения Исполнителем сообщения об активации, и ПВЗ считается действующим с такого момента.\n\n• Заявка отклоняется с указанием причин отказа и рекомендаций по их устранению.\n3.2.2. В случае получения Исполнителем отказа в Активации ПВЗ, Исполнитель вправе повторно подать заявку\nна Активацию ПВЗ в установленном Договором порядке.\n3.2.3. Основанием для отклонения заявок на открытие и Активацию ПВЗ в том числе могут являться:\n3.2.3.1. несоблюдение требований, указанных в Регламенте состояния ПВЗ;\n3.2.3.2. предоставление ложных (недостоверных) сведений; сведений, содержащих противоречивую,\nнеполную информацию; не предоставление документов или предоставление документов в нечитаемых форматах,\nвключая случаи, когда документ(ы) не открываются на ЭВМ, либо открываются с ошибками, не позволяющими\nознакомиться с содержащейся в них информацией, а также информацию, находящуюся в документах с низким\nкачеством изображения, не позволяющим изучить такую информацию.\n3.2.4.', 'Активация ПВЗ происходит с момента\nполучения Исполнителем сообщения об активации, и ПВЗ считается действующим с такого момента.\n\n• Заявка отклоняется с указанием причин отказа и рекомендаций по их устранению.\n3.2.2. В случае получения Исполнителем отказа в Активации ПВЗ, Исполнитель вправе повторно подать заявку\nна Активацию ПВЗ в установленном Договором порядке.\n3.2.3. Основанием для отклонения заявок на открытие и Активацию ПВЗ в том числе могут являться:\n3.2.3.1. несоблюдение требований, указанных в Регламенте состояния ПВЗ;\n3.2.3.', '3.2.3. Основанием для отклонения заявок на открытие и Активацию ПВЗ в том числе могут являться:\n3.2.3.1. несоблюдение требований, указанных в Регламенте состояния ПВЗ;\n3.2.3.', '3.1.4 Договора;\n• заявка Исполнителя на открытие ПВЗ отклоняется Заказчиком с указанием причин отказа в соответствии с\nп. 3.2.3 Договора и рекомендациями по их устранению в соответствии с Регламентом состояния ПВЗ.\n3.1.3. Если заявка Исполнителя на открытие нового ПВЗ была отклонена Заказчиком, удалена по причине\nотсутствия доработки Исполнителем в течение 5 (пяти) рабочих дней после получения такого статуса, отказа\nИсполнителя открывать и активировать ПВЗ в течение 7 (семи) календарных дней после одобрения заявки на\nоткрытие ПВЗ, то Заказчик возвращает Исполнителю сумму Обеспечительного платежа, если он был оплачен\nИсполнителем в течение 3 (трех) рабочих дней, с момента отклонения указанной заявки. Моментом возврата суммы\nОбеспечительного платежа Исполнителю является дата списания соответствующих денежных средств с расчётного\nсчёта банка, в котором обслуживается Заказчик.\n3.1.4.', '3.1.4 Договора;\n• заявка Исполнителя на открытие ПВЗ отклоняется Заказчиком с указанием причин отказа в соответствии с\nп. 3.2.3 Договора и рекомендациями по их устранению в соответствии с Регламентом состояния ПВЗ.\n3.1.3.', '3.1.3. Если заявка Исполнителя на открытие нового ПВЗ была отклонена Заказчиком, удалена по причине\nотсутствия доработки Исполнителем в течение 5 (пяти) рабочих дней после получения такого статуса, отказа\nИсполнителя открывать и активировать ПВЗ в течение 7 (семи) календарных дней после одобрения заявки на\nоткрытие ПВЗ, то Заказчик возвращает Исполнителю сумму Обеспечительного платежа, если он был оплачен\nИсполнителем в течение 3 (трех) рабочих дней, с момента отклонения указанной заявки.', '3.2.2. В случае получения Исполнителем отказа в Активации ПВЗ, Исполнитель вправе повторно подать заявку\nна Активацию ПВЗ в установленном Договором порядке.\n3.2.3.', '3.1.4. Исполнитель обязан при подготовке к открытию ПВЗ выполнить все условия и требования к состоянию\nПВЗ, указанные в Договоре и Регламенте состояния ПВЗ, в течение 30 (тридцати) календарных дней с даты\nодобрения заявки на открытие ПВЗ.\n3.1.5. Заказчиком устанавливаются зоны открытия ПВЗ в соответствии с Тепловой картой, которая учитывает\nнагрузку на действующие в данной зоне ПВЗ и плотность населения в конкретном районе. Размещение в одном\nстроении/здании более одного ПВЗ не допускается, за исключением случаев, согласованных с Заказчиком.\n3.2. Активация ПВЗ\n3.2.1. С момента одобрения Заказчиком заявки Исполнителя на открытие ПВЗ и выполнения Исполнителем\nусловий п. 3.1.4 Договора Исполнитель вправе подать заявку на Активацию ПВЗ через Портал. Заявка на Активацию\nПВЗ должна соответствовать требованиям и содержать документацию, указанную в Регламенте состояния ПВЗ.\nПосле окончания проверки Заказчиком принимается одно из следующих решений:\n• Заявка Исполнителя на Активацию ПВЗ считается одобренной.', 'согласно условиям настоящего пункта, Заказчик вправе отказать Исполнителю в одобрении заявки на Активацию\nПВЗ.\n\n3.13.', 'Размещение в одном\nстроении/здании более одного ПВЗ не допускается, за исключением случаев, согласованных с Заказчиком.\n3.2. Активация ПВЗ\n3.2.1. С момента одобрения Заказчиком заявки Исполнителя на открытие ПВЗ и выполнения Исполнителем\nусловий п. 3.1.4 Договора Исполнитель вправе подать заявку на Активацию ПВЗ через Портал. Заявка на Активацию\nПВЗ должна соответствовать требованиям и содержать документацию, указанную в Регламенте состояния ПВЗ.']","Согласно пункту 3.2.3, основаниями для отклонения заявок на открытие и активацию ПВЗ могут быть:

- несоблюдение требований, указанных в Регламенте состояния ПВЗ;  
- предоставление ложных (недостоверных) сведений; сведений, содержащих противоречивую, неполную информацию;  
- не предоставление документов или предоставление документов в нечитаемых форматах, включая случаи, когда документ(ы) не открываются на ЭВМ, либо открываются с ошибками, не позволяющими ознакомиться с содержащейся в них информацией, а также информация, находящаяся в документах с низким качеством изображения, не позволяющим изучить такую информацию."
"Какие действия Исполнителя могут привести к удержанию Обеспечительного платежа в полном объеме, согласно пункту 3.2.4?",['8'],"['В случае если Исполнитель после одобрения заявки на открытие ПВЗ не подал заявку на\nАктивацию ПВЗ, или удалил заявку на открытие ПВЗ или не выполнил все необходимые условия по Активации ПВЗ,\nто сумма Обеспечительного платежа удерживается Заказчиком в полном объеме в качестве неустойки.\n4.', 'В случае если Исполнитель после одобрения заявки на открытие ПВЗ не подал заявку на\nАктивацию ПВЗ, или удалил заявку на открытие ПВЗ или не выполнил все необходимые условия по Активации ПВЗ,\nто сумма Обеспечительного платежа удерживается Заказчиком в полном объеме в качестве неустойки.\n4. Предмет Договора\n4.1.', '3.2.4. После Активации ПВЗ сумма Обеспечительного платежа, если была оплачена Исполнителем, будет\nвозвращена Исполнителю тем же способом, которым была оплачена, также сумма Обеспечительного платежа может\nбыть отражена на Балансе Исполнителя в связи с выполнением Исполнителем обязательства согласно п. 3.1.4\nДоговора и Активации ПВЗ. В случае если Исполнитель после одобрения заявки на открытие ПВЗ не подал заявку на\nАктивацию ПВЗ, или удалил заявку на открытие ПВЗ или не выполнил все необходимые условия по Активации ПВЗ,\nто сумма Обеспечительного платежа удерживается Заказчиком в полном объеме в качестве неустойки.\n4. Предмет Договора\n4.1. По Договору Исполнитель обязуется оказывать Заказчику Услуги на территории Российской Федерации и\nиных стран, в соответствии с применимым законодательством, правами, обязанностями и ответственностью,\nпредусмотренными Договором и Приложениями, в том числе в соответствии с Поручениями Заказчика в Личном\nкабинете и Инструкциями, а Заказчик обязуется принять и оплатить оказанные Услуги в сроки и на условиях,\nуказанных в Договоре.\n4.2.', '3.2.4. После Активации ПВЗ сумма Обеспечительного платежа, если была оплачена Исполнителем, будет\nвозвращена Исполнителю тем же способом, которым была оплачена, также сумма Обеспечительного платежа может\nбыть отражена на Балансе Исполнителя в связи с выполнением Исполнителем обязательства согласно п. 3.1.4\nДоговора и Активации ПВЗ.', 'которым была оплачена, также сумма Обеспечительного платежа может\nбыть отражена на Балансе Исполнителя в связи с выполнением Исполнителем обязательства согласно п. 3.1.4\nДоговора и Активации ПВЗ.', '3.1.4 Договора;\n• заявка Исполнителя на открытие ПВЗ отклоняется Заказчиком с указанием причин отказа в соответствии с\nп. 3.2.3 Договора и рекомендациями по их устранению в соответствии с Регламентом состояния ПВЗ.\n3.1.3. Если заявка Исполнителя на открытие нового ПВЗ была отклонена Заказчиком, удалена по причине\nотсутствия доработки Исполнителем в течение 5 (пяти) рабочих дней после получения такого статуса, отказа\nИсполнителя открывать и активировать ПВЗ в течение 7 (семи) календарных дней после одобрения заявки на\nоткрытие ПВЗ, то Заказчик возвращает Исполнителю сумму Обеспечительного платежа, если он был оплачен\nИсполнителем в течение 3 (трех) рабочих дней, с момента отклонения указанной заявки. Моментом возврата суммы\nОбеспечительного платежа Исполнителю является дата списания соответствующих денежных средств с расчётного\nсчёта банка, в котором обслуживается Заказчик.\n3.1.4.', 'Исполнитель обязан предоставить Заказчику документы, подтверждающие\nналичие у Исполнителя права пользования помещением ПВЗ (собственности, аренды или на ином основании),\nоформленные или подписанные надлежащим образом;\n• Исполнитель заверяет, что Обеспечительный платеж будет произведен им лично или лицом,\nуполномоченным на совершение указанного платежа (участник, единоличный исполнительный орган, работник или\nиное). Настоящее заверение для Заказчика является заверением, имеющим существенное значение.\n3.1.2.', 'В случае если Исполнитель предоставит третьим лицам доступ к\nиспользованию своей электронной подписи, Исполнитель в полном объеме отвечает за любые действия и\nбездействие таких лиц, совершенные (допущенные) ими при использовании электронной подписи, как за свои\nсобственные.\n3.', '3.2.4. После Активации ПВЗ сумма Обеспечительного платежа, если была оплачена Исполнителем, будет\nвозвращена Исполнителю тем же способом, которым была оплачена,', 'Заказчик вправе в одностороннем порядке удержать указанные суммы Дополнительных поддерживающих\nвыплат Исполнителя из вознаграждения Исполнителя по истечении срока, указанного выше для возврата\nДополнительных поддерживающих выплат Исполнителем, но не позднее дня наступления Деактивации или смены\nИсполнителя.\n7.4.']","Согласно пункту 3.2.4 контекста, действия Исполнителя, которые могут привести к удержанию Обеспечительного платежа в полном объеме, — это:

- не подача заявки на Активацию ПВЗ после одобрения заявки на открытие ПВЗ,  
- удаление заявки на открытие ПВЗ,  
- не выполнение всех необходимых условий по Активации ПВЗ.

Такие действия приводят к тому, что сумма Обеспечительного платежа удерживается Заказчиком в полном объеме в качестве неустойки."
"Какой документ определяет требования к состоянию ПВЗ, на которые должен ориентироваться Исполнитель?",['9'],"['2. 5.2. Исполнитель обязуется предоставлять в Личномкабинете достоверные данные о характеристиках ПВЗ:адрес, площадь помещения, в которомнепосредственно оказываются Услуги, количествосотрудников Исполнителя в ПВЗ и др. Данные охарактеристиках ПВЗ должны подтверждатьсядокументами в соответствии с п. 3.2. Приложения № 3Договора.\nЗа первое нарушение – 10 000(десять тысяч) российских рублей;за каждое следующее выявленноенарушение – 100 000 (сто тысяч)российских рублей.\n3. 5.7. Исполнитель обязуется на протяжении срока действияДоговора поддерживать состояние ПВЗ в соответствиис требованиями, указанными в Регламенте состоянияПВЗ, в том числе в соответствии с требованиямиБрендбука, проводить за свой счет ремонт внутри ПВЗ.В случае обнаружения Заказчиком несоответствиясостояния ПВЗ указанным требованиям Заказчикпосредством Портала направляет Исполнителютребование о необходимости приведения ПВЗ всостояние, соответствующее требованиям, указанным вРегламенте состояния ПВЗ.', 'Исполнитель обязуется на протяжении срока действия Договора поддерживать состояние ПВЗ в\nсоответствии с требованиями, указанными в Регламенте состояния ПВЗ, в том числе в соответствии с требованиями\nБрендбука, проводить за свой счет ремонт внутри ПВЗ.', 'ПВЗ является объектом логистической инфраструктуры, в котором\nИсполнитель непосредственно оказывает комплекс Услуг в соответствии с настоящим Договором.\n1.36. ПЭП — электронная подпись, которая посредством использования кодов, паролей или иных средств\nподтверждает факт подписания электронной подписью электронных документов, иной информации в электронной\nформе определенным лицом, является аналогом собственноручной подписи.\n1.37. Регламент состояния ПВЗ — документ (Приложение № 3 к Договору), размещенный на Портале, который\nсодержит требования к состоянию ПВЗ.\n1.38.', '3.1.4. Исполнитель обязан при подготовке к открытию ПВЗ выполнить все условия и требования к состоянию\nПВЗ, указанные в Договоре и Регламенте состояния ПВЗ, в течение 30 (тридцати) календарных дней с даты\nодобрения заявки на открытие ПВЗ.\n3.1.5. Заказчиком устанавливаются зоны открытия ПВЗ в соответствии с Тепловой картой, которая учитывает\nнагрузку на действующие в данной зоне ПВЗ и плотность населения в конкретном районе.', '3. 5.7. Исполнитель обязуется на протяжении срока действияДоговора поддерживать состояние ПВЗ в соответствиис требованиями, указанными в Регламенте состоянияПВЗ, в том числе в соответствии с требованиямиБрендбука, проводить за свой счет ремонт внутри ПВЗ.В случае обнаружения Заказчиком несоответствиясостояния ПВЗ указанным требованиям Заказчикпосредством Портала направляет Исполнителютребование о необходимости приведения ПВЗ всостояние, соответствующее требованиям, указанным вРегламенте состояния ПВЗ.', '3.1.4. Исполнитель обязан при подготовке к открытию ПВЗ выполнить все условия и требования к состоянию\nПВЗ, указанные в Договоре и Регламенте состояния ПВЗ, в течение 30 (тридцати) календарных дней с даты\nодобрения заявки на открытие ПВЗ.\n3.1.5.', '1.34. Продавец — Заказчик или иное лицо (коммерческая организация, индивидуальный предприниматель, или\nгражданин, признанный в установленном законом порядке самозанятым), которое осуществляет деятельность на\nТорговой площадке и с которым Клиент заключил договор розничной купли-продажи Товаров.\n1.35. Пункт выдачи заказов (ПВЗ) — помещение или часть помещения, здания, дома Исполнителя,\nсоответствующее условиям Договора. ПВЗ является объектом логистической инфраструктуры, в котором\nИсполнитель непосредственно оказывает комплекс Услуг в соответствии с настоящим Договором.\n1.36. ПЭП — электронная подпись, которая посредством использования кодов, паролей или иных средств\nподтверждает факт подписания электронной подписью электронных документов, иной информации в электронной\nформе определенным лицом, является аналогом собственноручной подписи.\n1.37. Регламент состояния ПВЗ — документ (Приложение № 3 к Договору), размещенный на Портале, который\nсодержит требования к состоянию ПВЗ.\n1.38.', '5.6. Исполнитель обязан информировать своих работников, а также привлеченных им третьих лиц, об условиях и\nпорядке оказания Услуг по Договору, Инструкциях, которым они должны следовать в целях надлежащего исполнения\nобязательств по Договору. Исполнитель вправе обеспечить сотрудника Исполнителя корпоративным номером\nтелефона для целей выполнения обязательств сотрудника перед Исполнителем в рамках трудовых или иных\nотношений сотрудника и Исполнителя, а в случае невозможности обеспечения корпоративным номером телефона\nИсполнитель обеспечивает наличие правовых оснований использования сотрудником Исполнителя личного номера\nтелефона для указанных целей.\nКачество оказания Услуг и состояние ПВЗ\n5.7. Исполнитель обязуется на протяжении срока действия Договора поддерживать состояние ПВЗ в\nсоответствии с требованиями, указанными в Регламенте состояния ПВЗ, в том числе в соответствии с требованиями\nБрендбука, проводить за свой счет ремонт внутри ПВЗ.', 'В случае обнаружения Заказчиком несоответствия состояния\nПВЗ указанным требованиям, Заказчик посредством Портала направляет Исполнителю требование о необходимости\nприведения ПВЗ в состояние, соответствующее требованиям, указанным в Регламенте состояния ПВЗ.\n5.8. Исполнитель обязуется использовать рекламно-информационные материалы, содержащие допустимые\nЗаказчиком для таких целей фирменные наименование, знак, логотип, шрифты, цвета и их сочетания, изображения,\nиллюстрации, исключительный перечень и дизайн-макеты, которые размещены на сайте: https://pvz.wb.ru/ для\nцелей оказания Услуг в ПВЗ.\n5.9. Исполнитель обязуется при оказании Услуг не использовать в отношении Товара (в том числе при передаче\nПолучателю) расходные материалы с логотипами и товарными знаками, отличными от тех, правообладателем\nкоторых является Заказчик.\n5.10.', '3.1.1. Договора, то Исполнитель\nподает заявку на открытие ПВЗ без выполнения необходимых условий, указанных в первом абзаце этого пункта.\n• указывает в заявке информацию и прикладывает (загружает) документацию согласно требованиям,\nуказанным в Регламенте состояния ПВЗ. Исполнитель обязан предоставить Заказчику документы, подтверждающие\nналичие у Исполнителя права пользования помещением ПВЗ (собственности, аренды или на ином основании),\nоформленные или подписанные надлежащим образом;\n• Исполнитель заверяет, что Обеспечительный платеж будет произведен им лично или лицом,\nуполномоченным на совершение указанного платежа (участник, единоличный исполнительный орган, работник или\nиное). Настоящее заверение для Заказчика является заверением, имеющим существенное значение.\n3.1.2. Заказчик изучает и проверяет полученные в заявке от Исполнителя информацию и документы, а также\nинформирует Исполнителя о принятом решении в течение 5 (пяти) календарных дней с даты получения заявки на\nоткрытие ПВЗ. После окончания проверки Заказчиком принимается одно из следующих решений:\n• заявка Исполнителя на открытие ПВЗ одобряется Заказчиком, и Исполнитель обязан выполнить условия п.']","Документом, определяющим требования к состоянию ПВЗ, на которые должен ориентироваться Исполнитель, является **Регламент состояния ПВЗ** (Приложение № 3 к Договору)."
Какие действия со стороны Исполнителя могут привести к искусственному понижению рейтинга других Исполнителей?,['9'],"['включая, но не ограничиваясь, в том числесистематическое:• намеренное оставление негативных отзывов и/илипроставление низких оценок иным Исполнителям сцелью понижения их рейтинга,• осуществление ложных (фейковых) заказов в ПВЗиных Исполнителей с целями, не связанными среальным намерением приобрести Товар,• и иных действий, результатом которых может явитьсяискусственное понижение Рейтинга иного Исполнителя,невозможность заказа товаров в ПВЗ иногоИсполнителя и другие негативные последствия.', '5.10. Исполнитель обязуется не совершать недобросовестных действий, а также не следовать\nнедобросовестному поведению (ни сам, ни через третьих лиц), которое может причинить убытки или иным образом\nпричинить вред иным Исполнителям, включая, но не ограничиваясь, в том числе систематическое:\n• намеренное оставление негативных отзывов и/или проставление низких оценок иным Исполнителям с целью\nпонижения их рейтинга;\n• осуществление ложных (фейковых) заказов в ПВЗ иных Исполнителей с целями, не связанными с реальным\nнамерением приобрести Товар,\n• а также совершение иных действий, результатом которых могут явиться искусственное понижение Рейтинга\nиного Исполнителя, невозможность заказа товаров в ПВЗ иного Исполнителя и другие негативные последствия.\n5.11. Исполнитель обязуется не допускать несогласованное с Заказчиком прекращение оказания Услуг в ПВЗ, в\nтом числе без предупреждения Заказчика или с нарушением сроков, согласованных Сторонами при расторжении\nДоговора.\n5.12.', 'не связанными среальным намерением приобрести Товар,• и иных действий, результатом которых может явитьсяискусственное понижение Рейтинга иного Исполнителя,невозможность заказа товаров в ПВЗ иногоИсполнителя и другие негативные последствия.', '• а также совершение иных действий, результатом которых могут явиться искусственное понижение Рейтинга\nиного Исполнителя, невозможность заказа товаров в ПВЗ иного Исполнителя и другие негативные последствия.\n5.11. Исполнитель обязуется не допускать несогласованное с Заказчиком прекращение оказания Услуг в ПВЗ, в\nтом числе без предупреждения Заказчика или с нарушением сроков, согласованных Сторонами при расторжении\nДоговора.\n5.12.', '• а также совершение иных действий, результатом которых могут явиться искусственное понижение Рейтинга\nиного Исполнителя, невозможность заказа товаров в ПВЗ иного Исполнителя и другие негативные последствия.\n5.11.', '5.10. Исполнитель обязуется не совершатьнедобросовестных действий, а также не следоватьнедобросовестному поведению (ни сам, ни через\nЗа первое выявленное нарушение –предупреждение;за каждое второе выявленное\n\n№строки №разделаили пп.Договора\nДоговор ОТВЕТСТВЕННОСТЬ / РАЗМЕРШТРАФОВ\nтретьих лиц), которое может причинить убытки илииным образом причинить вред иным Исполнителям,включая, но не ограничиваясь, в том числесистематическое:• намеренное оставление негативных отзывов и/илипроставление низких оценок иным Исполнителям сцелью понижения их рейтинга,• осуществление ложных (фейковых) заказов в ПВЗиных Исполнителей с целями, не связанными среальным намерением приобрести Товар,• и иных действий, результатом которых может явитьсяискусственное понижение Рейтинга иного Исполнителя,невозможность заказа товаров в ПВЗ иногоИсполнителя и другие негативные последствия.\nнарушение – 50 000 (пятьдесяттысяч) российских рублей;за каждое следующее выявленноенарушение – 100 000 (сто тысяч)российских рублей.\n7.', '5.10. Исполнитель обязуется не совершать недобросовестных действий, а также не следовать\nнедобросовестному поведению (ни сам, ни через третьих лиц), которое может причинить убытки или иным образом\nпричинить вред иным Исполнителям, включая, но не ограничиваясь, в том числе систематическое:\n• намеренное оставление негативных отзывов и/или проставление низких оценок иным Исполнителям с целью\nпонижения их рейтинга;\n• осуществление ложных (фейковых) заказов в ПВЗ иных Исполнителей с целями, не связанными с реальным\nнамерением приобрести Товар,', 'включая, но не ограничиваясь, в том числе систематическое:\n• намеренное оставление негативных отзывов и/или проставление низких оценок иным Исполнителям с целью\nпонижения их рейтинга;\n• осуществление ложных (фейковых) заказов в ПВЗ иных Исполнителей с целями,', 'включая, но не ограничиваясь, в том числесистематическое:• намеренное оставление негативных отзывов и/илипроставление низких оценок иным Исполнителям сцелью понижения их рейтинга,• осуществление ложных (фейковых) заказов в ПВЗиных Исполнителей с целями,', 'Если Рейтинг ПВЗ снижался три и более раза нижеМинимального значения рейтинга ПВЗ Исполнителяв течение 1 (одного) календарного года оказанияУслуг Исполнителем с даты Активации ПВЗ попричине нарушений,']","Действия со стороны Исполнителя, которые могут привести к искусственному понижению рейтинга других Исполнителей, включают:

- намеренное оставление негативных отзывов и/или проставление низких оценок иным Исполнителям с целью понижения их рейтинга;  
- осуществление ложных (фейковых) заказов в ПВЗ иных Исполнителей с целями, не связанными с реальным намерением приобрести товар.  

Также к таким действиям относятся и другие действия, результатом которых может быть искусственное понижение рейтинга иного Исполнителя, невозможность заказа товаров в ПВЗ иного Исполнителя и другие негативные последствия."
"Какие два условия должны быть выполнены Исполнителем, если он хочет осуществлять в ПВЗ деятельность, не указанную в Договоре?",['9'],"['5.12. Исполнитель обязуется не осуществлять в ПВЗ те виды деятельности, которые не указаны в Договоре и/\nили не согласованы с Заказчиком в порядке, установленном на Портале.', '5.12. Исполнитель обязуется не осуществлять в ПВЗ те виды деятельности, которые не указаны в Договоре и/\nили не согласованы с Заказчиком в порядке, установленном на Портале. При осуществлении в ПВЗ иной,\nсогласованной с Заказчиком деятельности, не допускается использование рекламных, маркетинговых материалов,\nфирменных вывесок, логотипов, отличных от тех, правообладателем которых является Заказчик.\n5.13.', '5.12. Исполнитель обязуется не осуществлять в ПВЗ те виды деятельности, которые не указаны в Договоре и/\nили не согласованы с Заказчиком в порядке, установленном на Портале. При осуществлении в ПВЗ иной,\nсогласованной с Заказчиком деятельности, не допускается использование рекламных, маркетинговых материалов,\nфирменных вывесок, логотипов, отличных от тех, правообладателем которых является Заказчик.\n5.13. Исполнитель обязуется производить возврат поступающих в ПВЗ от Заказчика материалов повторного\nпроизводства (картон и иное), принадлежащих Заказчику.\n\n5.14. Исполнитель обязуется в случае получения уведомления от Заказчика в ЛК об Аудите ПВЗ предоставить\nЗаказчику качественные фото и видео материалы внешнего вида ПВЗ (в соответствии с требованиями и указаниями\nЗаказчика, представленными в инструкции в данном разделе ЛК) путем их размещения и загрузки на Портале в\nразделе Аудит ПВЗ или иным определенным Заказчиком способом.\nЗаказчик вправе после проверки всех необходимых материалов и информации, запросить Исполнителя исправить\nзамечания, выявленные в процессе Аудита ПВЗ посредством направления уведомления в ЛК.', '8. 5.12. Исполнитель обязуется не осуществлять в ПВЗ те видыдеятельности, которые не указаны в Договоре и/или несогласованы с Заказчиком в порядке, установленном наПортале.', 'Исполнитель вправе без согласования с Заказчиком осуществлять в ПВЗ следующие действия:\n• размещать вендинговые автоматы для продажи товаров;\n• размещать терминалы, предназначенные для оплаты услуг, реализация которых не связана с деятельностью\nИсполнителя, осуществляемой в ПВЗ по Договору;', '3.1.1. Договора, то Исполнитель\nподает заявку на открытие ПВЗ без выполнения необходимых условий, указанных в первом абзаце этого пункта.\n• указывает в заявке информацию и прикладывает (загружает) документацию согласно требованиям,\nуказанным в Регламенте состояния ПВЗ. Исполнитель обязан предоставить Заказчику документы, подтверждающие\nналичие у Исполнителя права пользования помещением ПВЗ (собственности, аренды или на ином основании),\nоформленные или подписанные надлежащим образом;\n• Исполнитель заверяет, что Обеспечительный платеж будет произведен им лично или лицом,\nуполномоченным на совершение указанного платежа (участник, единоличный исполнительный орган, работник или\nиное). Настоящее заверение для Заказчика является заверением, имеющим существенное значение.\n3.1.2. Заказчик изучает и проверяет полученные в заявке от Исполнителя информацию и документы, а также\nинформирует Исполнителя о принятом решении в течение 5 (пяти) календарных дней с даты получения заявки на\nоткрытие ПВЗ. После окончания проверки Заказчиком принимается одно из следующих решений:\n• заявка Исполнителя на открытие ПВЗ одобряется Заказчиком, и Исполнитель обязан выполнить условия п.', '3.1.4. Исполнитель обязан при подготовке к открытию ПВЗ выполнить все условия и требования к состоянию\nПВЗ, указанные в Договоре и Регламенте состояния ПВЗ, в течение 30 (тридцати) календарных дней с даты\nодобрения заявки на открытие ПВЗ.\n3.1.5. Заказчиком устанавливаются зоны открытия ПВЗ в соответствии с Тепловой картой, которая учитывает\nнагрузку на действующие в данной зоне ПВЗ и плотность населения в конкретном районе. Размещение в одном\nстроении/здании более одного ПВЗ не допускается, за исключением случаев, согласованных с Заказчиком.\n3.2. Активация ПВЗ\n3.2.1. С момента одобрения Заказчиком заявки Исполнителя на открытие ПВЗ и выполнения Исполнителем\nусловий п. 3.1.4 Договора Исполнитель вправе подать заявку на Активацию ПВЗ через Портал. Заявка на Активацию\nПВЗ должна соответствовать требованиям и содержать документацию, указанную в Регламенте состояния ПВЗ.\nПосле окончания проверки Заказчиком принимается одно из следующих решений:\n• Заявка Исполнителя на Активацию ПВЗ считается одобренной.', '3.1.1. Договора, то Исполнитель\nподает заявку на открытие ПВЗ без выполнения необходимых условий, указанных в первом абзаце этого пункта.\n• указывает в заявке информацию и прикладывает (загружает) документацию согласно требованиям,\nуказанным в Регламенте состояния ПВЗ.', 'Исполнитель обязан оказывать Услуги в ПВЗ, независимо от применения Блокировки выплат ПВЗ. Блокировка\nвыплат ПВЗ, применяемая к Исполнителю в соответствии с настоящим пунктом, не ограничивает иные\nфункциональные возможности, предоставляемые Заказчиком Исполнителю в целях исполнения Договора.\nБлокировка выплат ПВЗ не изменяет какие-либо условия Договора, которые продолжают действовать для обеих\nСторон без исключений.\n14. Деактивация и расторжение Договора\n14.1. Заказчик вправе отказаться от исполнения Договора в одностороннем внесудебном порядке полностью или\nв части определенного ПВЗ Исполнителя, при наличии у Исполнителя более 1 (одного) ПВЗ, то есть осуществить\nпроцесс Деактивации ПВЗ.\n14.2. Заказчик инициирует процесс Деактивации ПВЗ в указанных ниже случаях:\nОснования и порядок Деактивации Прекращение процессаДеактивации (еслиприменимо)\n1 Если Доля Подмен за последние 30 (тридцать) календарных дней подрядоказания Услуг Исполнителем в ПВЗ будет составлять более 1% (одногопроцента).', 'Приложение № 6\nк Оферте об оказании услуг в ПВЗ\nУслуга WB Проверка\nПриложение № 6 содержит порядок и условия оказания Услуги WB Проверка, дополняет Оферту об оказании услуг в\nПВЗ в части, необходимой для Услуги WB Проверка, и является обязательным для Исполнителей, использующих\nтакую услугу. В случае если Исполнитель хочет воспользоваться Услугой WB Проверка, то он получает доступ к\nданной услуге посредством Портала.\nРаздел 1. Термины и определения\nРаздел 1 «Термины и определения Оферты об оказании услуг в ПВЗ» дополняется следующими терминами и\nопределениями:\n1.1.1.']","Из контекста следует, что Исполнитель **не может осуществлять в ПВЗ виды деятельности, которые не указаны в Договоре и/или не согласованы с Заказчиком в порядке, установленном на Портале**.

Однако в тексте **указано**, что **Исполнитель вправе без согласования с Заказчиком осуществлять в ПВЗ следующие действия**:
- размещать вендинговые автоматы для продажи товаров;
- размещать терминалы, предназначенные для оплаты услуг, реализация которых не связана с деятельностью Исполнителя, осуществляемой в ПВЗ по Договору.

Это означает, что **для осуществления деятельности, не указанной в Договоре**, Исполнитель **должен**:
1. **Согласовать** эту деятельность с Заказчиком в порядке, установленном на Портале;
2. **Использовать только рекламные, маркетинговые материалы, фирменные вывески, логотипы, отличные от тех, правообладателем которых является Заказчик** — **не допускается** использование иных материалов.

Однако вопрос: *«Какие два условия должны быть выполнены Исполнителем, если он хочет осуществлять в ПВЗ деятельность, не указанную в Договоре?»*

На основании текста, **условия, при которых деятельность может быть осуществлена**, — это:

1. **Деятельность должна быть согласована с Заказчиком в порядке, установленном на Портале**.  
2. **Не допускается использование рекламных, маркетинговых материалов, фирменных вывесок, логотипов, отличных от тех, правообладателем которых является Заказчик**.

Таким образом, ответ:

**1. Деятельность должна быть согласована с Заказчиком в порядке, установленном на Портале.**  
**2. Исполнитель не может использовать рекламные, маркетинговые материалы, фирменные вывески, логотипы, отличные от тех, правообладателем которых является Заказчик.** ✅

Это — два условия, при выполнении которых Исполнитель может осуществлять в ПВЗ деятельность, не указанную в Договоре."
Какой срок установлен для прохождения Аудита ПВЗ с момента получения уведомления?,['10'],"['Общий срок прохождения Аудита ПВЗ не может превышать 7 (семи) календарных дней с даты получения\nуведомления об Аудите ПВЗ в ЛК Исполнителя. Исполнитель обязуется предоставлять материалы и информацию, а\nтакже исправлять замечания в течение этого срока.\n5.15. Исполнитель несет ответственность за повреждение, утрату, утерю, уничтожение, продажу, безвозмездную\nпередачу третьим лицам принадлежащих Заказчику и находящихся в ПВЗ оборудования, материалов (картон и иное)\nпредназначенных для обработки Товаров. Исполнитель не вправе использовать получаемые/приобретаемые в\nсоответствии с условиями Договора оборудование, материалы (картон и иное) для собственных\nпредпринимательских целей и в своих интересах.\n5.16. Исполнитель несет ответственность за надлежащую эксплуатацию и содержание ПВЗ и обязуется отвечать\nпо претензиям физических лиц и административным санкциям государственных органов, связанным с\nнесоблюдением применимого в месте нахождения ПВЗ законодательства в отношении ПВЗ.', 'Общий срок прохождения Аудита ПВЗ не может превышать 7 (семи) календарных дней с даты получения\nуведомления об Аудите ПВЗ в ЛК Исполнителя. Исполнитель обязуется предоставлять материалы и информацию, а\nтакже исправлять замечания в течение этого срока.\n5.15. Исполнитель несет ответственность за повреждение, утрату, утерю, уничтожение, продажу, безвозмездную\nпередачу третьим лицам принадлежащих Заказчику и находящихся в ПВЗ оборудования, материалов (картон и иное)\nпредназначенных для обработки Товаров.', 'Общий срок прохождения Аудита ПВЗ не может превышать 7 (семи) календарных дней с даты получения\nуведомления об Аудите ПВЗ в ЛК Исполнителя. Исполнитель обязуется предоставлять материалы и информацию, а\nтакже исправлять замечания в течение этого срока.\n5.15.', 'посредством направления уведомления в ЛК.Общий срок прохождения Аудита ПВЗ не можетпревышать 7 (семи) календарных дней с датыполучения уведомления об Аудите ПВЗ в ЛКИсполнителя. Исполнитель обязуется предоставлять\nЗа невыполнение обязанности,предусмотренной п. 5.14. илинарушении сроков предоставленияматериалов и информации:выявленное впервые —предупреждение;за каждое следующее выявленноенарушение — штраф в размере 10000 (Десять тысяч) российскихрублей.', 'посредством направления уведомления в ЛК.Общий срок прохождения Аудита ПВЗ не можетпревышать 7 (семи) календарных дней с датыполучения уведомления об Аудите ПВЗ в ЛКИсполнителя. Исполнитель обязуется предоставлять\nЗа невыполнение обязанности,предусмотренной п.', '10. 5.14. Исполнитель обязуется в случае полученияуведомления от Заказчика в ЛК об Аудите ПВЗпредоставить Заказчику качественные фото- ивидеоматериалы внешнего вида ПВЗ (в соответствии стребованиями и указаниями Заказчика,представленными в инструкции в данном разделе ЛК)путем их размещения и загрузки на Портале в разделеАудит ПВЗ или иным определенным Заказчикомспособом.Заказчик вправе после проверки всех необходимыхматериалов и информации запросить Исполнителяисправить замечания, выявленные в процессе АудитаПВЗ, посредством направления уведомления в ЛК.Общий срок прохождения Аудита ПВЗ не можетпревышать 7 (семи) календарных дней с датыполучения уведомления об Аудите ПВЗ в ЛКИсполнителя. Исполнитель обязуется предоставлять\nЗа невыполнение обязанности,предусмотренной п. 5.14. илинарушении сроков предоставленияматериалов и информации:выявленное впервые —предупреждение;за каждое следующее выявленноенарушение — штраф в размере 10000 (Десять тысяч) российскихрублей.', 'Уведомление\nнаправляется посредством Портала не позднее чем за 3 (три) календарных дня до увеличения времени ежедневного\nоказания Услуг в ПВЗ.\n6.', 'Нормативнаяпродолжительность времени проведенияинвентаризации составляет 24 (двадцать четыре)часа с момента начала инвентаризации.В случае если Исполнитель не проводитинвентаризацию Товаров в ПВЗ в установленныенастоящим пунктом сроки, Товары, числящиеся вПВЗ,', 'Если Исполнитель в течение 7 (семи) календарныхдней с даты Блокировки возмещает Заказчику суммузадолженности по реквизитам Заказчика сприложением подтверждающих документов, тоЗаказчик снимает Блокировку и направляетсоответствующее уведомление в ЛК.\n13.2. Заказчик через Портал уведомляет Исполнителя об осуществлении Блокировки ПВЗ Исполнителя с\nуказанием оснований для Блокировки ПВЗ, срока и/или условий для снятия Блокировки согласно п. 13.1 Договора.\n13.3. Исполнитель вправе с использованием Портала направить Заказчику обращение об отмене Блокировки\nПВЗ или о том, что его ПВЗ заблокировали необоснованно, при условии устранения им указанных в уведомлении\nнарушений или предоставления подтверждений необоснованной Блокировки ПВЗ. Обращение Исполнителя\nрассматривается в срок не позднее 3 (трех) календарных дней с момента получения Заказчиком обращения.\nУказанный срок может быть продлен на срок не более 7 (семи) календарных дней в случае необходимости\nполучения дополнительной информации для принятия решения без учета времени, требуемого Исполнителю для\nпредоставления соответствующей информации.', '14.6. Исполнитель обязуется в течение 14 (четырнадцати) календарных дней с даты утверждения Заказчиком\nзаявки Исполнителя на Деактивацию ПВЗ:\n• надлежащим образом оказывать Услуги на таком ПВЗ;\n• или собственными силами осуществить перемещение находящихся в ПВЗ Товаров в альтернативный ПВЗ,\nинформация о котором направляется Заказчиком после утверждения заявки Исполнителя о начале процесса\nДеактивации ПВЗ.\nПеремещение Товаров в альтернативный ПВЗ допускается исключительно после проведения Исполнителем\nинвентаризации Товаров в ПВЗ, находящемся в процессе Деактивации.\n14.7. Инвентаризация Товаров в ПВЗ, находящемся в процессе Деактивации, осуществляется Исполнителем\nпосредством использования Портала в Возвратные коробки с обязательной фиксацией проводимой инвентаризации\nна камеры видеонаблюдения.\nИсполнитель обязан осуществить инвентаризацию Товаров в ПВЗ, находящемся в процессе Деактивации, в\nтечение 24 (двадцати четырех) часов с момента начала инвентаризации, указанного в уведомлении,\nзаблаговременно направляемом Заказчиком в Личный кабинет Исполнителя.\n14.8.']",Срок для прохождения Аудита ПВЗ с момента получения уведомления не может превышать **7 (семи) календарных дней**.
Какие действия должен предпринять Исполнитель при обнаружении недостатка в Товаре в ходе его обработки?,['10'],"['5.18. В ходе обработки или сортировки поступившего на ПВЗ Товара, или подготовки Товара к возврату, в случае\nобнаружения в Товаре недостатка Исполнитель обязуется действовать в соответствии с настоящим Договором и\nИнструкциями и предоставить достоверную информацию о недостатке Товара Заказчику, проставив\nсоответствующую отметку с выбором типа выявленного недостатка, посредством Личного кабинета с приложением\nподтверждающих фото- и/или видео доказательств. Предоставленные фото- и/или видео доказательства не должны\nсодержать персональные данные третьих лиц.\n5.19.', '13. 5.18. В ходе обработки или сортировки поступившего на ПВЗТовара, или подготовки Товара к возврату, в случаеобнаружения в Товаре недостатка Исполнительобязуется действовать в соответствии с настоящимДоговором и Инструкциями и предоставитьдостоверную информацию о недостатке ТовараЗаказчику, проставив соответствующую отметку свыбором типа выявленного недостатка, посредствомЛичного кабинета с приложением подтверждающихфото- и/или видео доказательств. Предоставленныефото- и/или видео доказательства не должнысодержать персональные данные третьих лиц.', 'При получении\nпретензий Заказчик вправе переадресовать их в адрес Исполнителя и/или сообщить данные об Исполнителе\nгосударственным органам.\nОперации с Товаром\n5.17. При приёмке Товара в ПВЗ Исполнитель обязуется отражать в Личном кабинете достоверные сведения о\nналичии или отсутствии недостатка в принятом Товаре (делать соответствующую отметку в ЛК на Портале только\nпри действительном наличии недостатка Товара).\n5.18. В ходе обработки или сортировки поступившего на ПВЗ Товара, или подготовки Товара к возврату, в случае\nобнаружения в Товаре недостатка Исполнитель обязуется действовать в соответствии с настоящим Договором и\nИнструкциями и предоставить достоверную информацию о недостатке Товара Заказчику, проставив\nсоответствующую отметку с выбором типа выявленного недостатка, посредством Личного кабинета с приложением\nподтверждающих фото- и/или видео доказательств. Предоставленные фото- и/или видео доказательства не должны\nсодержать персональные данные третьих лиц.\n5.19. Исполнитель обязуется обеспечить сохранность Товаров, находящихся в ПВЗ.', '12. 5.17. При приемке Товара в ПВЗ Исполнитель обязуетсяотражать в Личном кабинете достоверные сведения оналичии или отсутствии недостатка в принятом Товаре(делать соответствующую отметку в ЛК на Порталетолько при действительном наличии недостаткаТовара).\nПроставление Исполнителемотметки о наличии недостатка вТоваре, который не былподтверждён на Складе: штраф вразмере 30 (тридцати) рублей закаждую неподтвержденную отметкуо наличии недостатка в Товаре. отстоимости обратной доставкиТовара; Тарифы и стоимостьдоставки указываются на Портале.\n13. 5.18. В ходе обработки или сортировки поступившего на ПВЗТовара, или подготовки Товара к возврату, в случаеобнаружения в Товаре недостатка Исполнительобязуется действовать в соответствии с настоящимДоговором и Инструкциями и предоставитьдостоверную информацию о недостатке ТовараЗаказчику, проставив соответствующую отметку свыбором типа выявленного недостатка, посредствомЛичного кабинета с приложением подтверждающихфото- и/или видео доказательств. Предоставленныефото- и/или видео доказательства не должнысодержать персональные данные третьих лиц.', 'или подготовки Товара к возврату, в случае\nобнаружения в Товаре недостатка Исполнитель обязуется действовать в соответствии с настоящим Договором и\nИнструкциями и предоставить достоверную информацию о недостатке Товара Заказчику,', 'или подготовки Товара к возврату, в случаеобнаружения в Товаре недостатка Исполнительобязуется действовать в соответствии с настоящимДоговором и Инструкциями и предоставитьдостоверную информацию о недостатке ТовараЗаказчику,', 'При подготовке Товара к возврату Исполнитель обязуется проверить Товар на наличие недостатка, а также\nобращаться с Товаром с должной осмотрительностью, характерной для разумного и добросовестного участника\nгражданского оборота.', '12. 5.17. При приемке Товара в ПВЗ Исполнитель обязуетсяотражать в Личном кабинете достоверные сведения оналичии или отсутствии недостатка в принятом Товаре(делать соответствующую отметку в ЛК на Порталетолько при действительном наличии недостаткаТовара).\nПроставление Исполнителемотметки о наличии недостатка вТоваре, который не былподтверждён на Складе: штраф вразмере 30 (тридцати) рублей закаждую неподтвержденную отметкуо наличии недостатка в Товаре. отстоимости обратной доставкиТовара; Тарифы и стоимостьдоставки указываются на Портале.\n13.', '12. 5.17. При приемке Товара в ПВЗ Исполнитель обязуетсяотражать в Личном кабинете достоверные сведения оналичии или отсутствии недостатка в принятом Товаре(делать соответствующую отметку в ЛК на Порталетолько при действительном наличии недостаткаТовара).', 'В случае поступления по указанному Заказчиком адресу\nТоваров с недостатками (включая, но не ограничиваясь: частичное повреждение, неверное вложение) и/или Подмен,\nИсполнитель обязуется возместить Стоимость Товаров с недостатками и/или замененных на Подмены.\nВзаиморасчеты по недостачам и недостаткам Товаров производятся Сторонами в соответствии с условиями\nДоговора.\n14.10. Утвержденная Заказчиком заявка Исполнителя на осуществление процесса Деактивации ПВЗ не может\nбыть отозвана Исполнителем. Данное условие не лишает Исполнителя возможности осуществить Активацию нового\nПВЗ.\n14.11. При расторжении Договора по любому основанию Исполнитель обязан передать Заказчику Товары,\nнаходящиеся в ПВЗ, по первому требованию Заказчика в течение 3 (трех) календарных дней с даты получения\nсоответствующего требования, а также предоставить доступ представителям Заказчика к Товарам в ПВЗ для\nпроведения инвентаризации. В указанном случае Стороны проводят сверку по взаимным обязательствам и на\nосновании сверки осуществляют итоговые взаиморасчеты в течение 60 (шестидесяти) календарных дней с даты\nрасторжения Договора.']","При обнаружении недостатка в Товаре в ходе его обработки, сортировки или подготовки к возврату Исполнитель должен:

1. Действовать в соответствии с настоящим Договором и Инструкциями.  
2. Предоставить Заказчику достоверную информацию о недостатке Товара.  
3. Проставить соответствующую отметку в Личном кабинете с выбором типа выявленного недостатка.  
4. Приложить подтверждающие фото- и/или видео доказательства, которые не должны содержать персональные данные третьих лиц.  

Также Исполнитель обязан проверять Товар на наличие недостатка при подготовке к возврату с должной осмотрительностью, характерной для разумного и добросовестного участника гражданского оборота."
"Какие обязательства возлагаются на Исполнителя в случае получения претензий от физических лиц или государственных органов, связанных с нарушением законодательства в месте нахождения ПВЗ?",['10'],"['Исполнитель несет ответственность за надлежащую эксплуатацию и содержание ПВЗ и обязуется отвечать\nпо претензиям физических лиц и административным санкциям государственных органов, связанным с\nнесоблюдением применимого в месте нахождения ПВЗ законодательства в отношении ПВЗ.', 'Общий срок прохождения Аудита ПВЗ не может превышать 7 (семи) календарных дней с даты получения\nуведомления об Аудите ПВЗ в ЛК Исполнителя. Исполнитель обязуется предоставлять материалы и информацию, а\nтакже исправлять замечания в течение этого срока.\n5.15. Исполнитель несет ответственность за повреждение, утрату, утерю, уничтожение, продажу, безвозмездную\nпередачу третьим лицам принадлежащих Заказчику и находящихся в ПВЗ оборудования, материалов (картон и иное)\nпредназначенных для обработки Товаров. Исполнитель не вправе использовать получаемые/приобретаемые в\nсоответствии с условиями Договора оборудование, материалы (картон и иное) для собственных\nпредпринимательских целей и в своих интересах.\n5.16. Исполнитель несет ответственность за надлежащую эксплуатацию и содержание ПВЗ и обязуется отвечать\nпо претензиям физических лиц и административным санкциям государственных органов, связанным с\nнесоблюдением применимого в месте нахождения ПВЗ законодательства в отношении ПВЗ.', 'Исполнитель не вправе использовать получаемые/приобретаемые в\nсоответствии с условиями Договора оборудование, материалы (картон и иное) для собственных\nпредпринимательских целей и в своих интересах.\n5.16. Исполнитель несет ответственность за надлежащую эксплуатацию и содержание ПВЗ и обязуется отвечать\nпо претензиям физических лиц и административным санкциям государственных органов, связанным с\nнесоблюдением применимого в месте нахождения ПВЗ законодательства в отношении ПВЗ.', 'При получении\nпретензий Заказчик вправе переадресовать их в адрес Исполнителя и/или сообщить данные об Исполнителе\nгосударственным органам.\nОперации с Товаром\n5.17. При приёмке Товара в ПВЗ Исполнитель обязуется отражать в Личном кабинете достоверные сведения о\nналичии или отсутствии недостатка в принятом Товаре (делать соответствующую отметку в ЛК на Портале только\nпри действительном наличии недостатка Товара).\n5.18. В ходе обработки или сортировки поступившего на ПВЗ Товара, или подготовки Товара к возврату, в случае\nобнаружения в Товаре недостатка Исполнитель обязуется действовать в соответствии с настоящим Договором и\nИнструкциями и предоставить достоверную информацию о недостатке Товара Заказчику, проставив\nсоответствующую отметку с выбором типа выявленного недостатка, посредством Личного кабинета с приложением\nподтверждающих фото- и/или видео доказательств. Предоставленные фото- и/или видео доказательства не должны\nсодержать персональные данные третьих лиц.\n5.19. Исполнитель обязуется обеспечить сохранность Товаров, находящихся в ПВЗ.', '2. 5.2. Исполнитель обязуется предоставлять в Личномкабинете достоверные данные о характеристиках ПВЗ:адрес, площадь помещения, в которомнепосредственно оказываются Услуги, количествосотрудников Исполнителя в ПВЗ и др. Данные охарактеристиках ПВЗ должны подтверждатьсядокументами в соответствии с п. 3.2. Приложения № 3Договора.\nЗа первое нарушение – 10 000(десять тысяч) российских рублей;за каждое следующее выявленноенарушение – 100 000 (сто тысяч)российских рублей.\n3. 5.7. Исполнитель обязуется на протяжении срока действияДоговора поддерживать состояние ПВЗ в соответствиис требованиями, указанными в Регламенте состоянияПВЗ, в том числе в соответствии с требованиямиБрендбука, проводить за свой счет ремонт внутри ПВЗ.В случае обнаружения Заказчиком несоответствиясостояния ПВЗ указанным требованиям Заказчикпосредством Портала направляет Исполнителютребование о необходимости приведения ПВЗ всостояние, соответствующее требованиям, указанным вРегламенте состояния ПВЗ.', 'Исполнитель принимает на\nсебя обязательство принимать все разумные и доступные меры для обеспечения сохранности, предотвращения\nпорчи или повреждения Товара.\n5.20. Исполнитель обязуется выдать поступивший в ПВЗ Товар Получателям в количестве, ассортименте и\nкомплектации в соответствии с положениями п. 5.3 Договора и требованиями, указанными в Поручениях Заказчика.\n5.21. Исполнитель обязуется принимать Товар от Продавца и выдавать Товар Продавцу исключительно в\nприсутствии Продавца либо лица, документально уполномоченного Продавцом на передачу или приемку такого\nТовара, под камерами видеонаблюдения, установленными в ПВЗ.\n5.22. Исполнитель обязуется в любое время прибытия транспортного средства с Товаром к ПВЗ в часы работы\nПВЗ принимать от Заказчика/Перевозчика/Продавца и передавать Товар Заказчику/Перевозчику/Продавцу.\n5.23. Исполнитель не вправе перемещать Товар, Маркетплейс-короба, Маркетплейс Товары, Клиентские\nвозвраты на другие ПВЗ, выносить Товар за территорию ПВЗ, если это прямо не предусмотрено Поручением\nЗаказчика.\n6. Права и обязательства Заказчика\n\n6.1.', 'Исполнитель самостоятельно, с учетом сезонности и текущей нагрузки на ПВЗ, определяет\nнеобходимое количество лиц, действующих на стороне Исполнителя, задействованных в ПВЗ, для целей\nсвоевременного и качественного обслуживания Клиентов/Продавцов.\n4.2.1. В случае получения Заказчиком от Клиентов/Продавцов двух и более жалоб/обращений о наличии\nочередей в ПВЗ, а также при выявлении очередей в ПВЗ в ходе проведенных Заказчиком контрольных мероприятий,\nв том числе путем просмотра видеозаписей с камер видеонаблюдения в ПВЗ, Заказчик направляет Исполнителю\nуведомление о необходимости улучшения качества оказания Услуг в ПВЗ.\n4.3. Все взаиморасчеты между Заказчиком и Клиентом должны производиться Исполнителем исключительно\nдистанционным способом через Портал.\n\n4.4. Исполнитель обязуется при выдаче Товаров Клиентам в ПВЗ и путем курьерской доставки по требованию\nКлиента предоставить последнему полиэтиленовый пакет, дизайн, цвет и изображение которого соответствует\nуказанным Заказчиком характеристикам, в количестве, соответствующем указанному в Инструкциях, сделав об этом\nотметку на Портале.', 'Исполнитель обязуется в случае поступления запросов и\nобращений от Физических лиц или государственных органов по вопросам, связанным с обработкой персональных\nданных в рамках настоящего Приложения, рассмотреть такие запросы и обращения самостоятельно.\n2.5.', '8. 5.12. Исполнитель обязуется не осуществлять в ПВЗ те видыдеятельности, которые не указаны в Договоре и/или несогласованы с Заказчиком в порядке, установленном наПортале. При осуществлении в ПВЗ инойсогласованной с Заказчиком деятельности недопускается использование рекламных, маркетинговыхматериалов, фирменных вывесок, логотипов, отличныхот тех, правообладателем которых является Заказчик.\nЗа первое нарушение –предупреждение;за каждое следующее выявленноенарушение – 50 000 (пятьдесяттысяч) российских рублей.\n9. 5.13.', '2. 5.2. Исполнитель обязуется предоставлять в Личномкабинете достоверные данные о характеристиках ПВЗ:адрес, площадь помещения, в которомнепосредственно оказываются Услуги, количествосотрудников Исполнителя в ПВЗ и др. Данные охарактеристиках ПВЗ должны подтверждатьсядокументами в соответствии с п. 3.2. Приложения № 3Договора.\nЗа первое нарушение – 10 000(десять тысяч) российских рублей;за каждое следующее выявленноенарушение – 100 000 (сто тысяч)российских рублей.\n3. 5.7.']","Исполнитель несет ответственность за надлежащую эксплуатацию и содержание ПВЗ и обязуется отвечать по претензиям физических лиц и административным санкциям государственных органов, связанным с нарушением применимого в месте нахождения ПВЗ законодательства в отношении ПВЗ."
"Какой срок установлен для ответа на запросы Исполнителя, поступившие через электронную почту или Личный кабинет?",['11'],"['6.6. Заказчик обязуется предоставить Исполнителю инструкции по работе с Порталом и информационные\nматериалы о процессе оказания Услуг, а также своевременно вносить в них изменения и уведомлять о них\nИсполнителя.\n6.7. Заказчик обязуется отвечать на запросы Исполнителя (за исключением письменных претензий), касающиеся\nработы ПВЗ, полученные посредством электронной почты или путем размещения в Личном кабинете, в срок, не\nпревышающий 14 (четырнадцать) календарных дней с даты получения такого запроса. При этом срок рассмотрения\nможет быть продлен по инициативе Заказчика для полного и всестороннего рассмотрения всех обстоятельств\nзапроса, а также получения дополнительной информации и документов от Исполнителя, о чем Заказчик уведомляет\nИсполнителя. Максимальный срок такого ответа на запрос Исполнителя в любом случае не может превышать 30\n(тридцать) календарных дней.\n7.', '6.7. Заказчик обязуется отвечать на запросы Исполнителя (за исключением письменных претензий), касающиеся\nработы ПВЗ, полученные посредством электронной почты или путем размещения в Личном кабинете, в срок,', 'Максимальный срок такого ответа на запрос Исполнителя в любом случае не может превышать 30\n(тридцать) календарных дней.\n7.', 'При этом срок рассмотрения\nможет быть продлен по инициативе Заказчика для полного и всестороннего рассмотрения всех обстоятельств\nзапроса, а также получения дополнительной информации и документов от Исполнителя, о чем Заказчик уведомляет\nИсполнителя. Максимальный срок такого ответа на запрос Исполнителя в любом случае не может превышать 30\n(тридцать) календарных дней.\n7.', 'Максимальный срок рассмотрения в любом случае не\nможет превышать 30 (тридцать) календарных дней.\n12.2. Исполнитель посредством функционала Портала вправе оспорить произведенное Заказчиком удержание\nстоимости подготовки Товаров к возврату на Склад, утраченных, утерянных, Зависших Товаров, Товаров с\nнедостатком, или Подмен в течение 7 (семи) календарных дней с момента информирования Исполнителя путём\nразмещения соответствующих сведений об удержании на Портале с помощью обращения, поданного через Личный\nкабинет, с приложением подтверждающих документов, в том числе видеоматериалов, подтверждающих\nнеобоснованность примененной ответственности. После истечения указанного срока Исполнитель утрачивает право\nна оспаривание удержанной Заказчиком суммы. Обращение Исполнителя рассматривается в срок, необходимый для\nполного и всестороннего рассмотрения всех обстоятельств, а также получения дополнительной информации и\n\nдокументов от Исполнителя при необходимости, о чем Заказчик уведомляет Исполнителя. Максимальный срок\nрассмотрения в любом случае не может превышать 30 (тридцать) календарных дней.\n12.3.', 'Обращение Исполнителя\nрассматривается в срок не позднее 3 (трех) календарных дней с момента получения Заказчиком обращения.', 'После истечения указанного срока Исполнитель утрачивает право\nна оспаривание удержанной Заказчиком суммы. Обращение Исполнителя рассматривается в срок, необходимый для\nполного и всестороннего рассмотрения всех обстоятельств, а также получения дополнительной информации и\n\nдокументов от Исполнителя при необходимости, о чем Заказчик уведомляет Исполнителя. Максимальный срок\nрассмотрения в любом случае не может превышать 30 (тридцать) календарных дней.\n12.3.', '• посредством Портала / Личного кабинета.\n17.2.2. Юридически значимые сообщения направляются исключительно предусмотренными Договором\nспособами. Направление сообщения иным способом не считается надлежащим, а сообщения считаются\nнедоставленными.\n17.2.3. Юридически значимые сообщения, направленные Исполнителю через Портал или на электронную\nпочту, считаются доставленными в дату отправки Заказчиком соответствующего юридически значимого сообщения.\n17.2.4.', '17.2.4. Юридически значимые сообщения, направленные Исполнителю почтовым отправлением, считаются\nдоставленными в дату доставки или в дату первой неудачной попытки вручения письма, если оно поступило\nадресату, которому оно направлено, но по обстоятельствам, зависящим от адресата, не было ему вручено или\nадресат не ознакомился с ним.\n17.3. Все споры и разногласия, возникающие между Сторонами по Договору или в связи с ним, подлежат\nурегулированию в претензионном порядке. Срок ответа на претензию составляет 30 (тридцать) календарных дней со\nдня ее получения.\nВ случае недостижения согласия спор подлежит разрешению соответственно: в случае, если Заказчик является\nроссийским юридическим лицом, — в Арбитражном суде г. Москвы (или в Тимирязевском районном суде г. Москвы,\nесли Исполнитель-резидент РФ утратил статус индивидуального предпринимателя).\nВ остальных случаях спор передается на рассмотрение в суд по месту регистрации Заказчика-нерезидента РФ в\nсоответствии с национальным процессуальным законодательством Заказчика-нерезидента.\n17.4.', 'Товаров с\nнедостатком, или Подмен в течение 7 (семи) календарных дней с момента информирования Исполнителя путём\nразмещения соответствующих сведений об удержании на Портале с помощью обращения, поданного через Личный\nкабинет, с приложением подтверждающих документов,']","Срок, установленный для ответа на запросы Исполнителя, поступившие через электронную почту или Личный кабинет, составляет **14 календарных дней** с даты получения запроса.  

Однако **максимальный срок рассмотрения** в любом случае не может превышать **30 календарных дней**, и он может быть продлен по инициативе Заказчика.  

**Ответ:** 14 календарных дней (с возможным продлением до 30 календарных дней)."
Какие действия вправе осуществлять Заказчик по проверке качества оказания Услуг Исполнителем?,['11'],"['Права и обязательства Заказчика\n\n6.1. Заказчик вправе по своему усмотрению и без согласования с Исполнителем вносить изменения в\nсодержание, функциональные возможности и пользовательский интерфейс Портала.\n6.2. Заказчик вправе осуществлять любые действия по проверке качества оказания Исполнителем Услуг.\nЗаказчик самостоятельно определяет способы, периодичность и основания проведения таких проверок.\n6.3. Заказчик вправе проводить оценку качества исполнения Договора Сторонами, включая оказание Услуг\nКлиенту, как во взаимодействии, так и без взаимодействия с Исполнителем, в том числе с привлечением третьих\nлиц, без дополнительного согласия Исполнителя.\n6.4. Заказчик обязуется оплачивать оказанные Исполнителем Услуги в порядке и сроки, установленные\nДоговором.\n6.5. Заказчик обязуется предоставлять Исполнителю информацию, необходимую для целей оказания Услуг по\nДоговору посредством Личного кабинета на Портале, которая включает в себя в том числе: информацию о Клиенте,\nкод получения и адрес Клиента в случае осуществления доставки Курьером.\n6.6.', 'Права и обязательства Заказчика\n\n6.1. Заказчик вправе по своему усмотрению и без согласования с Исполнителем вносить изменения в\nсодержание, функциональные возможности и пользовательский интерфейс Портала.\n6.2. Заказчик вправе осуществлять любые действия по проверке качества оказания Исполнителем Услуг.\nЗаказчик самостоятельно определяет способы, периодичность и основания проведения таких проверок.\n6.3.', 'Права и обязательства Заказчика\n\n6.1. Заказчик вправе по своему усмотрению и без согласования с Исполнителем вносить изменения в\nсодержание, функциональные возможности и пользовательский интерфейс Портала.\n6.2. Заказчик вправе осуществлять любые действия по проверке качества оказания Исполнителем Услуг.', '6.3. Заказчик вправе проводить оценку качества исполнения Договора Сторонами, включая оказание Услуг\nКлиенту, как во взаимодействии, так и без взаимодействия с Исполнителем, в том числе с привлечением третьих\nлиц, без дополнительного согласия Исполнителя.\n6.4. Заказчик обязуется оплачивать оказанные Исполнителем Услуги в порядке и сроки, установленные\nДоговором.\n6.5.', '6.3. Заказчик вправе проводить оценку качества исполнения Договора Сторонами, включая оказание Услуг\nКлиенту, как во взаимодействии, так и без взаимодействия с Исполнителем, в том числе с привлечением третьих\nлиц, без дополнительного согласия Исполнителя.\n6.4.', 'Контроль качества оказания Услуг\n6.1. Исполнитель, заключая Договор, подтверждает предоставление Заказчику (его представителям) права на\nпроведение проверок качества оказания Услуг, в том числе права на беспрепятственный доступ в ПВЗ, включая, но\nне ограничиваясь: в целях проведения инвентаризации Товаров и (или) проверки их наличия в местах хранения (в\nПВЗ), а также в целях изъятия Товаров и их вывоза Заказчиком в случаях, предусмотренных Договором.\n6.2.', 'Контроль качества оказания Услуг\n6.1. Исполнитель, заключая Договор, подтверждает предоставление Заказчику (его представителям) права на\nпроведение проверок качества оказания Услуг, в том числе права на беспрепятственный доступ в ПВЗ, включая, но\nне ограничиваясь: в целях проведения инвентаризации Товаров и (или) проверки их наличия в местах хранения (в\nПВЗ), а также в целях изъятия Товаров и их вывоза Заказчиком в случаях, предусмотренных Договором.\n6.2. Исполнитель обязан не реже 1 (одного) раза в 30 (тридцать) календарных дней проводить инвентаризацию\nТоваров в ПВЗ посредством Портала с обязательной фиксацией проводимой инвентаризации на камеры\nвидеонаблюдения. При проведении инвентаризации должны быть отсканированы (обработаны) штрихкоды всех\nчислящихся в ПВЗ Товаров, а статусы Товаров должны быть отражены на Портале. Нормативная продолжительность\nвремени проведения инвентаризации составляет 24 (двадцать четыре) часа с момента начала инвентаризации.', 'Порядок подписания и обмена первичными документами регулируется\nсоответствующими пунктами Оферты об оказании услуг в ПВЗ.\n2.8. Один Исполнитель может сделать не более 15 (пятнадцати) Заявок на Услугу WB Проверка в течение 30\n(тридцати) календарных дней. В случае превышения количества Заявок Заказчик информирует Исполнителя о\nпревышении посредством Портала. Следующие заявки Исполнителя могут быть приняты в работу Заказчиком в\nследующем периоде оказания Услуги.\n2.9. Заказчик не обязан раскрывать ни Исполнителю, ни Физическому лицу, ни какому-либо третьему лицу правила\nработы алгоритма и источники данных, а также давать какие-либо пояснения в отношении Итога проверки. Заказчик\nобязуется не распространять и не предоставлять кому-либо Итоги проверки Физического лица после оказания Услуги\nИсполнителю.\n3. Ограничение ответственности\n3.1. Заказчик не несет ответственности за действия или бездействия Исполнителя, которые основываются на\nинформации, содержащейся в предоставленных Итогах проверки.', 'Контроль качества оказания Услуг\n6.1. Исполнитель, заключая Договор, подтверждает предоставление Заказчику (его представителям) права на\nпроведение проверок качества оказания Услуг, в том числе права на беспрепятственный доступ в ПВЗ, включая,', 'Исполнитель обязан оказывать Услуги в каждом ПВЗ ежедневно и в согласованный с Заказчиком период\nвремени, продолжительность которого составляет не менее 12 (двенадцати) часов в сутки. Для ПВЗ, открытых по\nупрощенным условиям, продолжительность составляет не менее 9 (часов) в сутки. Период времени должен\nсоответствовать началу каждого часа по местному времени, к примеру: с 08:00, либо с 09:00, либо с 10:00 утра и т.д.\nИсполнитель не вправе начинать оказание Услуг с нарушением этого временного периода.\n5.1.2. Исполнитель вправе по согласованию с Заказчиком увеличить или уменьшить период ежедневного\nоказания Услуг, но не более, чем на 3 (три) часа от минимально установленного на Портале периода работы ПВЗ.\n5.1.3. Заказчик вправе уведомить Исполнителя о необходимости увеличения времени ежедневного оказания\nУслуг в ПВЗ (не более чем на 3 (три) часа) на определенный Заказчиком периодом времени. Уведомление\nнаправляется посредством Портала не позднее чем за 3 (три) календарных дня до увеличения времени ежедневного\nоказания Услуг в ПВЗ.\n6. Контроль качества оказания Услуг\n6.1.']","Заказчик вправе осуществлять любые действия по проверке качества оказания Исполнителем Услуг. Он самостоятельно определяет способы, периодичность и основания проведения таких проверок. Также Заказчик вправе проводить оценку качества исполнения Договора Сторонами, включая оказание Услуг Клиенту, как во взаимодействии, так и без взаимодействия с Исполнителем, в том числе с привлечением третьих лиц, без дополнительного согласия Исполнителя."
"Какие условия должны быть выполнены Исполнителем для получения Единоразовой выплаты, и от каких факторов зависит её размер?",['11'],"['Единоразовая выплата (далее – Единоразовая выплата) подлежит выплате при условии достижения\nИсполнителем за последние 30 (тридцать) дней работы ПВЗ следующего Оборота ПВЗ Исполнителя в зависимости\nот страны, в которой находится ПВЗ:\n• Российская Федерация — 3 000 000 (три миллиона) российских рублей;\n• Республика Узбекистан – 83 832 000 (восемьдесят три миллиона восемьсот тридцать две тысячи) Узбекских\nсум (UZS);\n• Республика Кыргызстан – 1 010 000 (один миллион десять тысяч) Киргизских сом (KGS);\n• Республика Казахстан – 15 350 000 (пятнадцать миллионов триста пятьдесят тысяч) Казахстанских тенге\n(KZT);\n• Республика Армения – 9 420 000 (девять миллионов четыреста двадцать тысяч) Армянских драм (AMD);\n• Республика Беларусь – 108 000 (сто восемь тысяч) Белорусских рублей (BYN);\nРазмер Единоразовой выплаты определяется в соответствии с данными, указанными на Тепловой карте в\nзависимости от области, в которой такой Исполнитель открывает новое ПВЗ, на момент подачи Исполнителем заявки\nна открытие ПВЗ.', 'Единоразовая выплата (далее – Единоразовая выплата) подлежит выплате при условии достижения\nИсполнителем за последние 30 (тридцать) дней работы ПВЗ следующего Оборота ПВЗ Исполнителя в зависимости\nот страны,', 'Единоразовая выплата (далее – Единоразовая выплата) подлежит выплате при условии достижения\nИсполнителем за последние 30 (тридцать) дней работы ПВЗ следующего Оборота ПВЗ Исполнителя в зависимости\nот страны, в которой находится ПВЗ:\n• Российская Федерация — 3 000 000 (три миллиона) российских рублей;\n• Республика Узбекистан – 83 832 000 (восемьдесят три миллиона восемьсот тридцать две тысячи) Узбекских\nсум (UZS);\n• Республика Кыргызстан – 1 010 000 (один миллион десять тысяч) Киргизских сом (KGS);', '7.1.1. Единоразовая выплата для Исполнителя при Активации определенного количества ПВЗ подлежит\nвыплате, если такие меры поддержки предлагаются в населенном пункте, городе, регионе, стране в соответствии с\n\nданными, условиями и в размере,', '7.1.1. Единоразовая выплата для Исполнителя при Активации определенного количества ПВЗ подлежит\nвыплате, если такие меры поддержки предлагаются в населенном пункте, городе, регионе, стране в соответствии с\n\nданными, условиями и в размере, указанными на Тепловой карте на момент подачи заявки на открытие ПВЗ.\n7.1.2. Единоразовая выплата для Исполнителя при открытии ПВЗ на упрощенных условиях, подлежит выплате,\nесли такие меры поддержки предлагаются в населенном пункте, городе, регионе, стране в соответствии с данными и\nв размере, указанными на Тепловой карте в момент подачи заявки в месте открытие ПВЗ.\n7.2. Дополнительная выплата (далее – Дополнительная выплата) может составлять:\n• от одной до трех,\n• от одной до шести,\n• от одной до девяти Дополнительных выплат в соответствии с формулой:\nВыплата = Од - Ви\nВыплата – величина, рассчитываемая по истечении каждого из трех последовательных периодов оказания\nУслуг Исполнителем в ПВЗ равных 30 (тридцати) календарным дням с даты начала оказания Услуг (выдачи Товара\nКлиенту). Выплата может быть только положительной величиной.', '7.1.2. Единоразовая выплата для Исполнителя при открытии ПВЗ на упрощенных условиях, подлежит выплате,\nесли такие меры поддержки предлагаются в населенном пункте, городе, регионе, стране в соответствии с данными и\nв размере,', 'Единоразовая выплата отражается на Балансе Исполнителя в течение 30 (тридцати) календарных дней с момента\nдостижения, указанного в п. 7.1.', '• Республика Казахстан – 15 350 000 (пятнадцать миллионов триста пятьдесят тысяч) Казахстанских тенге\n(KZT);\n• Республика Армения – 9 420 000 (девять миллионов четыреста двадцать тысяч) Армянских драм (AMD);\n• Республика Беларусь – 108 000 (сто восемь тысяч) Белорусских рублей (BYN);\nРазмер Единоразовой выплаты определяется в соответствии с данными, указанными на Тепловой карте в\nзависимости от области, в которой такой Исполнитель открывает новое ПВЗ,', 'Заказчик вправе в одностороннем порядке удержать указанные суммы Дополнительных поддерживающих\nвыплат Исполнителя из вознаграждения Исполнителя по истечении срока, указанного выше для возврата\nДополнительных поддерживающих выплат Исполнителем, но не позднее дня наступления Деактивации или смены\nИсполнителя.\n7.4. Заказчик оставляет за собой право устанавливать и осуществлять иные дополнительные\nподдерживающие выплаты или меры поддержки для Исполнителей, порядок, основания, критерии и размеры\nкоторых будут определяться Заказчиком дополнительно, в том числе на Тепловой карте. Действие п. 7.3. Договора\nна такие выплаты не распространяется.\n7.5. Вознаграждение в размере Единоразовой выплаты согласно п. 7.1., 7.1.1. и 7.1.2. Договора отражается на\nБалансе Исполнителя в качестве авансового платежа и является дополнительным вознаграждением Исполнителя по\n\nДоговору за 12 (двенадцатый) Отчетный и последующие периоды оказания Услуг.\nЕдиноразовая выплата отражается на Балансе Исполнителя в течение 30 (тридцати) календарных дней с момента\nдостижения, указанного в п. 7.1.', '• Республика Беларусь – 108 000 (сто восемь тысяч) Белорусских рублей (BYN);\nРазмер Единоразовой выплаты определяется в соответствии с данными, указанными на Тепловой карте в\nзависимости от области, в которой такой Исполнитель открывает новое ПВЗ,']","Для получения Единоразовой выплаты Исполнителю необходимо:

1. **Достижение определённого Оборота ПВЗ** за последние 30 дней работы в ПВЗ.  
2. **Достижение этого Оборота в зависимости от страны, в которой находится ПВЗ**, согласно следующим минимальным значениям:
   - Российская Федерация — 3 000 000 российских рублей;
   - Республика Узбекистан — 83 832 000 Узбекских сум (UZS);
   - Республика Кыргызстан — 1 010 000 Киргизских сом (KGS);
   - Республика Казахстан — 15 350 000 Казахстанских тенге (KZT);
   - Республика Армения — 9 420 000 Армянских драм (AMD);
   - Республика Беларусь — 108 000 Белорусских рублей (BYN).

**Размер Единоразовой выплаты зависит от:**
- Страны, в которой находится ПВЗ;
- Области (региона), в которой открывается новое ПВЗ, поскольку размер выплаты определяется **данными, указанными на Тепловой карте** в зависимости от этой области.

Таким образом, условия получения Единоразовой выплаты — достижение указанного оборота в ПВЗ в соответствующей стране, а её размер — зависит от страны и региона (области) открытия ПВЗ, как указано на Тепловой карте."
Какой срок установлен для возврата Дополнительных поддерживающих выплат Исполнителем в случае Деактивации ПВЗ?,['12'],"['Исполнитель обязан возвратить Заказчику суммы Дополнительных поддерживающих выплат:\n• в течение 5 (пяти) календарных дней до даты Деактивации ПВЗ Исполнителя;\n• не позднее 5 (пяти) календарных дней до даты смены Исполнителя.', 'Под сменой Исполнителя понимается замена Стороны Исполнителя по Договору, при\nкоторой изначальный Исполнитель передаёт все права и обязанности по Договору новому Исполнителю.\nИсполнитель обязан возвратить Заказчику суммы Дополнительных поддерживающих выплат:\n• в течение 5 (пяти) календарных дней до даты Деактивации ПВЗ Исполнителя;\n• не позднее 5 (пяти) календарных дней до даты смены Исполнителя.', '7.1., 7.1.1., 7.1.2. и 7.2 Договора, если в течение 12 (двенадцати) календарных месяцев или, если в течение 18\n(восемнадцати) календарных месяцев, при получении от одной до девяти Дополнительных выплат согласно п. 7.2.\nДоговора, после Активации ПВЗ произойдет любое из нижеследующих событий:\n• Деактивация ПВЗ Исполнителя в результате прекращения оказания Услуг в ПВЗ Исполнителем по\nоснованиям, предусмотренным Договором;\n• Смена Исполнителя. Под сменой Исполнителя понимается замена Стороны Исполнителя по Договору, при\nкоторой изначальный Исполнитель передаёт все права и обязанности по Договору новому Исполнителю.\nИсполнитель обязан возвратить Заказчику суммы Дополнительных поддерживающих выплат:\n• в течение 5 (пяти) календарных дней до даты Деактивации ПВЗ Исполнителя;\n• не позднее 5 (пяти) календарных дней до даты смены Исполнителя.', 'Заказчик вправе в одностороннем порядке удержать указанные суммы Дополнительных поддерживающих\nвыплат Исполнителя из вознаграждения Исполнителя по истечении срока, указанного выше для возврата\nДополнительных поддерживающих выплат Исполнителем, но не позднее дня наступления Деактивации или смены\nИсполнителя.\n7.4.', 'Заказчик вправе в одностороннем порядке удержать указанные суммы Дополнительных поддерживающих\nвыплат Исполнителя из вознаграждения Исполнителя по истечении срока, указанного выше для возврата\nДополнительных поддерживающих выплат Исполнителем, но не позднее дня наступления Деактивации или смены\nИсполнителя.\n7.4. Заказчик оставляет за собой право устанавливать и осуществлять иные дополнительные\nподдерживающие выплаты или меры поддержки для Исполнителей, порядок, основания, критерии и размеры\nкоторых будут определяться Заказчиком дополнительно, в том числе на Тепловой карте. Действие п. 7.3. Договора\nна такие выплаты не распространяется.\n7.5. Вознаграждение в размере Единоразовой выплаты согласно п. 7.1., 7.1.1. и 7.1.2. Договора отражается на\nБалансе Исполнителя в качестве авансового платежа и является дополнительным вознаграждением Исполнителя по\n\nДоговору за 12 (двенадцатый) Отчетный и последующие периоды оказания Услуг.\nЕдиноразовая выплата отражается на Балансе Исполнителя в течение 30 (тридцати) календарных дней с момента\nдостижения, указанного в п. 7.1.', '7.1., 7.1.1., 7.1.2. и 7.2 Договора, если в течение 12 (двенадцати) календарных месяцев или, если в течение 18\n(восемнадцати) календарных месяцев, при получении от одной до девяти Дополнительных выплат согласно п. 7.2.\nДоговора, после Активации ПВЗ произойдет любое из нижеследующих событий:\n• Деактивация ПВЗ Исполнителя в результате прекращения оказания Услуг в ПВЗ Исполнителем по\nоснованиям, предусмотренным Договором;\n• Смена Исполнителя.', '7.2.1. В случае если при получении от одной до девяти Дополнительных выплат оборот ПВЗ на 90 (девяностый)\nи/или 180 (сто восьмидесятый) день будет ниже оборота, указанного на сайте https://pvz.wb.ru и на Тепловой карте,\nза последние 30 (тридцать) календарных дней оказания Услуг в ПВЗ, Исполнитель утрачивает право на дальнейшее\nполучение Дополнительных выплат согласно настоящему пункту.\n7.3. Исполнитель обязан возвратить Заказчику суммы Дополнительных поддерживающих выплат, указанных в\nпп.', 'Выплата может быть только положительной величиной.\nОд – размер возможного предполагаемого дохода Исполнителя за 30 (тридцать) календарных дней оказания\nУслуг в ПВЗ, определяется в соответствии с данными, указанными на Тепловой карте в зависимости от области, в\nкоторой такой Исполнитель открывает новое ПВЗ на момент подачи Исполнителем заявки на открытие ПВЗ.\nВи – размер вознаграждения Исполнителя за аналогичные 30 (тридцать) календарных дней оказания Услуг в\nПВЗ.\n7.2.1. В случае если при получении от одной до девяти Дополнительных выплат оборот ПВЗ на 90 (девяностый)\nи/или 180 (сто восьмидесятый) день будет ниже оборота, указанного на сайте https://pvz.wb.ru и на Тепловой карте,\nза последние 30 (тридцать) календарных дней оказания Услуг в ПВЗ, Исполнитель утрачивает право на дальнейшее\nполучение Дополнительных выплат согласно настоящему пункту.\n7.3. Исполнитель обязан возвратить Заказчику суммы Дополнительных поддерживающих выплат, указанных в\nпп.', '14.6. Исполнитель обязуется в течение 14 (четырнадцати) календарных дней с даты утверждения Заказчиком\nзаявки Исполнителя на Деактивацию ПВЗ:\n• надлежащим образом оказывать Услуги на таком ПВЗ;\n• или собственными силами осуществить перемещение находящихся в ПВЗ Товаров в альтернативный ПВЗ,\nинформация о котором направляется Заказчиком после утверждения заявки Исполнителя о начале процесса\nДеактивации ПВЗ.\nПеремещение Товаров в альтернативный ПВЗ допускается исключительно после проведения Исполнителем\nинвентаризации Товаров в ПВЗ, находящемся в процессе Деактивации.\n14.7. Инвентаризация Товаров в ПВЗ, находящемся в процессе Деактивации, осуществляется Исполнителем\nпосредством использования Портала в Возвратные коробки с обязательной фиксацией проводимой инвентаризации\nна камеры видеонаблюдения.\nИсполнитель обязан осуществить инвентаризацию Товаров в ПВЗ, находящемся в процессе Деактивации, в\nтечение 24 (двадцати четырех) часов с момента начала инвентаризации, указанного в уведомлении,\nзаблаговременно направляемом Заказчиком в Личный кабинет Исполнителя.\n14.8.', '14.6. Исполнитель обязуется в течение 14 (четырнадцати) календарных дней с даты утверждения Заказчиком\nзаявки Исполнителя на Деактивацию ПВЗ:\n• надлежащим образом оказывать Услуги на таком ПВЗ;\n• или собственными силами осуществить перемещение находящихся в ПВЗ Товаров в альтернативный ПВЗ,\nинформация о котором направляется Заказчиком после утверждения заявки Исполнителя о начале процесса\nДеактивации ПВЗ.']",Срок для возврата Дополнительных поддерживающих выплат Исполнителем в случае Деактивации ПВЗ — **в течение 5 (пяти) календарных дней до даты Деактивации ПВЗ**.
"Как рассчитывается размер Дополнительной выплаты, предусмотренной в п. 7.2 оферты?",['12'],"['7.2. Дополнительная выплата (далее – Дополнительная выплата) может составлять:\n• от одной до трех,\n• от одной до шести,\n• от одной до девяти Дополнительных выплат в соответствии с формулой:\nВыплата = Од - Ви\nВыплата – величина, рассчитываемая по истечении каждого из трех последовательных периодов оказания\nУслуг Исполнителем в ПВЗ равных 30 (тридцати) календарным дням с даты начала оказания Услуг (выдачи Товара\nКлиенту). Выплата может быть только положительной величиной.', '7.2. Дополнительная выплата (далее – Дополнительная выплата) может составлять:\n• от одной до трех,\n• от одной до шести,\n• от одной до девяти Дополнительных выплат в соответствии с формулой:\nВыплата = Од - Ви\nВыплата – величина,', '7.1.1. Единоразовая выплата для Исполнителя при Активации определенного количества ПВЗ подлежит\nвыплате, если такие меры поддержки предлагаются в населенном пункте, городе, регионе, стране в соответствии с\n\nданными, условиями и в размере, указанными на Тепловой карте на момент подачи заявки на открытие ПВЗ.\n7.1.2. Единоразовая выплата для Исполнителя при открытии ПВЗ на упрощенных условиях, подлежит выплате,\nесли такие меры поддержки предлагаются в населенном пункте, городе, регионе, стране в соответствии с данными и\nв размере, указанными на Тепловой карте в момент подачи заявки в месте открытие ПВЗ.\n7.2. Дополнительная выплата (далее – Дополнительная выплата) может составлять:\n• от одной до трех,\n• от одной до шести,\n• от одной до девяти Дополнительных выплат в соответствии с формулой:\nВыплата = Од - Ви\nВыплата – величина, рассчитываемая по истечении каждого из трех последовательных периодов оказания\nУслуг Исполнителем в ПВЗ равных 30 (тридцати) календарным дням с даты начала оказания Услуг (выдачи Товара\nКлиенту). Выплата может быть только положительной величиной.', '7.1. Договора Оборота ПВЗ Исполнителя или в течение 30 (тридцати) календарных дней\nсогласно п. 7.1.1. и 7.1.2. с даты начала оказания Услуг (выдачи Товара Клиенту).\nВознаграждение в размере Дополнительной выплаты и иных выплат согласно п. 7.2. Договора отражается на\nБалансе Исполнителя в качестве авансового платежа и является дополнительным вознаграждением Исполнителя\nПВЗ по Договору за 12 (двенадцатый) Отчетный и последующие периоды оказания Услуг, в зависимости от периода\nполучения Дополнительных выплат.\nДополнительная выплата отражается на Балансе Исполнителя в течение 7 (семи) календарных дней после\nзавершения каждого тридцатидневного периода оказания Услуг, начиная с даты начала оказания Услуг (выдачи\nТовара Клиенту).\n8. Порядок определения размера вознаграждения Исполнителя и порядок расчетов между Сторонами\n8.1. Вознаграждение за оказанные Исполнителем Услуги за Отчетный период рассчитывается на основании\nотчетов, формируемых еженедельно в ЛК Исполнителя по Тарифам, указанным в Приложении №1 к Договору, и\nотражается на Балансе Исполнителя в его ЛК.', '7.1. Договора Оборота ПВЗ Исполнителя или в течение 30 (тридцати) календарных дней\nсогласно п. 7.1.1. и 7.1.2. с даты начала оказания Услуг (выдачи Товара Клиенту).\nВознаграждение в размере Дополнительной выплаты и иных выплат согласно п. 7.2. Договора отражается на\nБалансе Исполнителя в качестве авансового платежа и является дополнительным вознаграждением Исполнителя\nПВЗ по Договору за 12 (двенадцатый) Отчетный и последующие периоды оказания Услуг, в зависимости от периода\nполучения Дополнительных выплат.', '7.2. Договора отражается на\nБалансе Исполнителя в качестве авансового платежа и является дополнительным вознаграждением Исполнителя\nПВЗ по Договору за 12 (двенадцатый) Отчетный и последующие периоды оказания Услуг, в зависимости от периода\nполучения Дополнительных выплат.', '7.1., 7.1.1., 7.1.2. и 7.2 Договора, если в течение 12 (двенадцати) календарных месяцев или, если в течение 18\n(восемнадцати) календарных месяцев, при получении от одной до девяти Дополнительных выплат согласно п. 7.2.', '7.2.1. В случае если при получении от одной до девяти Дополнительных выплат оборот ПВЗ на 90 (девяностый)\nи/или 180 (сто восьмидесятый) день будет ниже оборота, указанного на сайте https://pvz.wb.ru и на Тепловой карте,', '7.1. Договора Оборота ПВЗ Исполнителя или в течение 30 (тридцати) календарных дней\nсогласно п. 7.1.1. и 7.1.2. с даты начала оказания Услуг (выдачи Товара Клиенту).\nВознаграждение в размере Дополнительной выплаты и иных выплат согласно п.', '7.4. Заказчик оставляет за собой право устанавливать и осуществлять иные дополнительные\nподдерживающие выплаты или меры поддержки для Исполнителей, порядок, основания, критерии и размеры\nкоторых будут определяться Заказчиком дополнительно, в том числе на Тепловой карте. Действие п. 7.3. Договора\nна такие выплаты не распространяется.\n7.5. Вознаграждение в размере Единоразовой выплаты согласно п. 7.1., 7.1.1. и 7.1.2.']","Размер Дополнительной выплаты, предусмотренной в п. 7.2 оферты, рассчитывается по формуле:  
**Выплата = Од - Ви**  

Где:  
- **Од** — определённая величина (не указана в предоставленном контексте),  
- **Ви** — другая величина (также не указана в контексте).  

Выплата рассчитывается по истечении каждого из трёх последовательных периодов оказания Услуг Исполнителем в ПВЗ, равных 30 календарным дням с даты начала оказания Услуг (выдачи Товара Клиенту).  

Выплата может быть только положительной величиной.  

Кроме того, Дополнительная выплата может составлять от одной до трёх, от одной до шести или от одной до девяти выплат в зависимости от условий."
Какие условия могут привести к утрате права на дальнейшее получение Дополнительных выплат согласно п. 7.2.1 оферты?,['12'],"['7.2.1. В случае если при получении от одной до девяти Дополнительных выплат оборот ПВЗ на 90 (девяностый)\nи/или 180 (сто восьмидесятый) день будет ниже оборота, указанного на сайте https://pvz.wb.ru и на Тепловой карте,\nза последние 30 (тридцать) календарных дней оказания Услуг в ПВЗ, Исполнитель утрачивает право на дальнейшее\nполучение Дополнительных выплат согласно настоящему пункту.\n7.3. Исполнитель обязан возвратить Заказчику суммы Дополнительных поддерживающих выплат, указанных в\nпп.', 'Выплата может быть только положительной величиной.\nОд – размер возможного предполагаемого дохода Исполнителя за 30 (тридцать) календарных дней оказания\nУслуг в ПВЗ, определяется в соответствии с данными, указанными на Тепловой карте в зависимости от области, в\nкоторой такой Исполнитель открывает новое ПВЗ на момент подачи Исполнителем заявки на открытие ПВЗ.\nВи – размер вознаграждения Исполнителя за аналогичные 30 (тридцать) календарных дней оказания Услуг в\nПВЗ.\n7.2.1. В случае если при получении от одной до девяти Дополнительных выплат оборот ПВЗ на 90 (девяностый)\nи/или 180 (сто восьмидесятый) день будет ниже оборота, указанного на сайте https://pvz.wb.ru и на Тепловой карте,\nза последние 30 (тридцать) календарных дней оказания Услуг в ПВЗ, Исполнитель утрачивает право на дальнейшее\nполучение Дополнительных выплат согласно настоящему пункту.\n7.3. Исполнитель обязан возвратить Заказчику суммы Дополнительных поддерживающих выплат, указанных в\nпп.', 'wb.ru и на Тепловой карте,\nза последние 30 (тридцать) календарных дней оказания Услуг в ПВЗ, Исполнитель утрачивает право на дальнейшее\nполучение Дополнительных выплат согласно настоящему пункту.\n7.3.', '7.1., 7.1.1., 7.1.2. и 7.2 Договора, если в течение 12 (двенадцати) календарных месяцев или, если в течение 18\n(восемнадцати) календарных месяцев, при получении от одной до девяти Дополнительных выплат согласно п. 7.2.\nДоговора, после Активации ПВЗ произойдет любое из нижеследующих событий:\n• Деактивация ПВЗ Исполнителя в результате прекращения оказания Услуг в ПВЗ Исполнителем по\nоснованиям, предусмотренным Договором;\n• Смена Исполнителя. Под сменой Исполнителя понимается замена Стороны Исполнителя по Договору, при\nкоторой изначальный Исполнитель передаёт все права и обязанности по Договору новому Исполнителю.\nИсполнитель обязан возвратить Заказчику суммы Дополнительных поддерживающих выплат:\n• в течение 5 (пяти) календарных дней до даты Деактивации ПВЗ Исполнителя;\n• не позднее 5 (пяти) календарных дней до даты смены Исполнителя.', '7.1., 7.1.1., 7.1.2. и 7.2 Договора, если в течение 12 (двенадцати) календарных месяцев или, если в течение 18\n(восемнадцати) календарных месяцев, при получении от одной до девяти Дополнительных выплат согласно п. 7.2.\nДоговора, после Активации ПВЗ произойдет любое из нижеследующих событий:\n• Деактивация ПВЗ Исполнителя в результате прекращения оказания Услуг в ПВЗ Исполнителем по\nоснованиям, предусмотренным Договором;\n• Смена Исполнителя.', '7.1., 7.1.1., 7.1.2. и 7.2 Договора, если в течение 12 (двенадцати) календарных месяцев или, если в течение 18\n(восемнадцати) календарных месяцев, при получении от одной до девяти Дополнительных выплат согласно п. 7.2.', '7.2.1. В случае если при получении от одной до девяти Дополнительных выплат оборот ПВЗ на 90 (девяностый)\nи/или 180 (сто восьмидесятый) день будет ниже оборота, указанного на сайте https://pvz.wb.ru и на Тепловой карте,', '7.1.1. Единоразовая выплата для Исполнителя при Активации определенного количества ПВЗ подлежит\nвыплате, если такие меры поддержки предлагаются в населенном пункте, городе, регионе, стране в соответствии с\n\nданными, условиями и в размере, указанными на Тепловой карте на момент подачи заявки на открытие ПВЗ.\n7.1.2. Единоразовая выплата для Исполнителя при открытии ПВЗ на упрощенных условиях, подлежит выплате,\nесли такие меры поддержки предлагаются в населенном пункте, городе, регионе, стране в соответствии с данными и\nв размере, указанными на Тепловой карте в момент подачи заявки в месте открытие ПВЗ.\n7.2. Дополнительная выплата (далее – Дополнительная выплата) может составлять:\n• от одной до трех,\n• от одной до шести,\n• от одной до девяти Дополнительных выплат в соответствии с формулой:\nВыплата = Од - Ви\nВыплата – величина, рассчитываемая по истечении каждого из трех последовательных периодов оказания\nУслуг Исполнителем в ПВЗ равных 30 (тридцати) календарным дням с даты начала оказания Услуг (выдачи Товара\nКлиенту). Выплата может быть только положительной величиной.', 'Заказчик вправе в одностороннем порядке удержать указанные суммы Дополнительных поддерживающих\nвыплат Исполнителя из вознаграждения Исполнителя по истечении срока, указанного выше для возврата\nДополнительных поддерживающих выплат Исполнителем, но не позднее дня наступления Деактивации или смены\nИсполнителя.\n7.4. Заказчик оставляет за собой право устанавливать и осуществлять иные дополнительные\nподдерживающие выплаты или меры поддержки для Исполнителей, порядок, основания, критерии и размеры\nкоторых будут определяться Заказчиком дополнительно, в том числе на Тепловой карте. Действие п. 7.3. Договора\nна такие выплаты не распространяется.\n7.5. Вознаграждение в размере Единоразовой выплаты согласно п. 7.1., 7.1.1. и 7.1.2. Договора отражается на\nБалансе Исполнителя в качестве авансового платежа и является дополнительным вознаграждением Исполнителя по\n\nДоговору за 12 (двенадцатый) Отчетный и последующие периоды оказания Услуг.\nЕдиноразовая выплата отражается на Балансе Исполнителя в течение 30 (тридцати) календарных дней с момента\nдостижения, указанного в п. 7.1.', '7.1. Договора Оборота ПВЗ Исполнителя или в течение 30 (тридцати) календарных дней\nсогласно п. 7.1.1. и 7.1.2. с даты начала оказания Услуг (выдачи Товара Клиенту).\nВознаграждение в размере Дополнительной выплаты и иных выплат согласно п. 7.2. Договора отражается на\nБалансе Исполнителя в качестве авансового платежа и является дополнительным вознаграждением Исполнителя\nПВЗ по Договору за 12 (двенадцатый) Отчетный и последующие периоды оказания Услуг, в зависимости от периода\nполучения Дополнительных выплат.']","Условие, которое может привести к утрате права на дальнейшее получение Дополнительных выплат согласно п. 7.2.1 оферты, — **если оборот ПВЗ на 90-й и/или 180-й день оказания Услуг будет ниже оборота, указанного на сайте https://pvz.wb.ru и на Тепловой карте, за последние 30 календарных дней оказания Услуг в ПВЗ**."
Какой срок составляет максимальный период для отражения дополнительной выплаты на Балансе Исполнителя?,['13'],"['Дополнительная выплата отражается на Балансе Исполнителя в течение 7 (семи) календарных дней после\nзавершения каждого тридцатидневного периода оказания Услуг, начиная с даты начала оказания Услуг (выдачи\nТовара Клиенту).\n8.', 'Дополнительная выплата отражается на Балансе Исполнителя в течение 7 (семи) календарных дней после\nзавершения каждого тридцатидневного периода оказания Услуг, начиная с даты начала оказания Услуг (выдачи\nТовара Клиенту).\n8. Порядок определения размера вознаграждения Исполнителя и порядок расчетов между Сторонами\n8.1.', 'Заказчик вправе в одностороннем порядке удержать указанные суммы Дополнительных поддерживающих\nвыплат Исполнителя из вознаграждения Исполнителя по истечении срока, указанного выше для возврата\nДополнительных поддерживающих выплат Исполнителем, но не позднее дня наступления Деактивации или смены\nИсполнителя.\n7.4. Заказчик оставляет за собой право устанавливать и осуществлять иные дополнительные\nподдерживающие выплаты или меры поддержки для Исполнителей, порядок, основания, критерии и размеры\nкоторых будут определяться Заказчиком дополнительно, в том числе на Тепловой карте. Действие п. 7.3. Договора\nна такие выплаты не распространяется.\n7.5. Вознаграждение в размере Единоразовой выплаты согласно п. 7.1., 7.1.1. и 7.1.2. Договора отражается на\nБалансе Исполнителя в качестве авансового платежа и является дополнительным вознаграждением Исполнителя по\n\nДоговору за 12 (двенадцатый) Отчетный и последующие периоды оказания Услуг.\nЕдиноразовая выплата отражается на Балансе Исполнителя в течение 30 (тридцати) календарных дней с момента\nдостижения, указанного в п. 7.1.', '7.1., 7.1.1. и 7.1.2. Договора отражается на\nБалансе Исполнителя в качестве авансового платежа и является дополнительным вознаграждением Исполнителя по\n\nДоговору за 12 (двенадцатый) Отчетный и последующие периоды оказания Услуг.\nЕдиноразовая выплата отражается на Балансе Исполнителя в течение 30 (тридцати) календарных дней с момента\nдостижения, указанного в п. 7.1.', '7.1. Договора Оборота ПВЗ Исполнителя или в течение 30 (тридцати) календарных дней\nсогласно п. 7.1.1. и 7.1.2. с даты начала оказания Услуг (выдачи Товара Клиенту).\nВознаграждение в размере Дополнительной выплаты и иных выплат согласно п. 7.2. Договора отражается на\nБалансе Исполнителя в качестве авансового платежа и является дополнительным вознаграждением Исполнителя\nПВЗ по Договору за 12 (двенадцатый) Отчетный и последующие периоды оказания Услуг, в зависимости от периода\nполучения Дополнительных выплат.\nДополнительная выплата отражается на Балансе Исполнителя в течение 7 (семи) календарных дней после\nзавершения каждого тридцатидневного периода оказания Услуг, начиная с даты начала оказания Услуг (выдачи\nТовара Клиенту).\n8. Порядок определения размера вознаграждения Исполнителя и порядок расчетов между Сторонами\n8.1. Вознаграждение за оказанные Исполнителем Услуги за Отчетный период рассчитывается на основании\nотчетов, формируемых еженедельно в ЛК Исполнителя по Тарифам, указанным в Приложении №1 к Договору, и\nотражается на Балансе Исполнителя в его ЛК.', 'Единоразовая выплата отражается на Балансе Исполнителя в течение 30 (тридцати) календарных дней с момента\nдостижения, указанного в п. 7.1.', 'Исполнитель обязан возвратить Заказчику суммы Дополнительных поддерживающих выплат:\n• в течение 5 (пяти) календарных дней до даты Деактивации ПВЗ Исполнителя;\n• не позднее 5 (пяти) календарных дней до даты смены Исполнителя.', 'После истечения указанного срока Исполнитель утрачивает право\nна оспаривание удержанной Заказчиком суммы. Обращение Исполнителя рассматривается в срок, необходимый для\nполного и всестороннего рассмотрения всех обстоятельств, а также получения дополнительной информации и\n\nдокументов от Исполнителя при необходимости, о чем Заказчик уведомляет Исполнителя. Максимальный срок\nрассмотрения в любом случае не может превышать 30 (тридцать) календарных дней.\n12.3.', 'Под сменой Исполнителя понимается замена Стороны Исполнителя по Договору, при\nкоторой изначальный Исполнитель передаёт все права и обязанности по Договору новому Исполнителю.\nИсполнитель обязан возвратить Заказчику суммы Дополнительных поддерживающих выплат:\n• в течение 5 (пяти) календарных дней до даты Деактивации ПВЗ Исполнителя;\n• не позднее 5 (пяти) календарных дней до даты смены Исполнителя.', 'Максимальный срок такого ответа на запрос Исполнителя в любом случае не может превышать 30\n(тридцать) календарных дней.\n7.']","Максимальный период для отражения дополнительной выплаты на Балансе Исполнителя составляет **7 календарных дней** после завершения каждого тридцатидневного периода оказания Услуг.

**Ответ: 7 календарных дней.**"
В каком случае Заказчик может переносить оплату услуг Исполнителя на следующий период?,['13'],"['В случае, если за Отчетный период Исполнителем оказаны Услуги на сумму менее 500 (пятисот) российских рублей\nили эквивалента указанной суммы в национальной валюте страны государственной регистрации сторон по курсу ЦБ\nРФ на дату расчета, Заказчик переносит оплату таких Услуг пока сумма вознаграждения будет более 500 (пятисот)\nроссийских рублей.\n8.2.', 'В случае, если за Отчетный период Исполнителем оказаны Услуги на сумму менее 500 (пятисот) российских рублей\nили эквивалента указанной суммы в национальной валюте страны государственной регистрации сторон по курсу ЦБ\nРФ на дату расчета, Заказчик переносит оплату таких Услуг пока сумма вознаграждения будет более 500 (пятисот)\nроссийских рублей.\n8.2. При расчёте вознаграждения Исполнителя Заказчик исключает из расчёта операции, размещённые\nИсполнителем на Портале, в отношении которых было выявлено любое из следующих обстоятельств:\n• от Получателя поступило обращение о том, что им не был получен Товар, относительно которого\nИсполнитель разместил в Личном кабинете информацию о выдаче (вручении) Получателю;\n• Товары, указанные Исполнителем как возвращенные Клиентами или не востребованные Клиентами, не были\nпереданы Исполнителем Заказчику/Перевозчику.\n8.2.1.', 'Заказчик переносит оплату таких Услуг пока сумма вознаграждения будет более 500 (пятисот)\nроссийских рублей.\n8.2.', '8.2.1. В случае, если указанные выше обстоятельства выявлены Заказчиком за Отчётный период, Заказчик\nучитывает данные обстоятельства при расчёте вознаграждения за Услуги за любой последующий Отчётный период,\nв течение которого были выявлены указанные обстоятельства и на соответствующую сумму уменьшает размер\nвознаграждения Исполнителя за такой Отчётный период.\n\n8.2.2.', 'Заказчик вправе в одностороннем порядке удержать указанные суммы Дополнительных поддерживающих\nвыплат Исполнителя из вознаграждения Исполнителя по истечении срока, указанного выше для возврата\nДополнительных поддерживающих выплат Исполнителем, но не позднее дня наступления Деактивации или смены\nИсполнителя.\n7.4. Заказчик оставляет за собой право устанавливать и осуществлять иные дополнительные\nподдерживающие выплаты или меры поддержки для Исполнителей, порядок, основания, критерии и размеры\nкоторых будут определяться Заказчиком дополнительно, в том числе на Тепловой карте. Действие п. 7.3. Договора\nна такие выплаты не распространяется.\n7.5. Вознаграждение в размере Единоразовой выплаты согласно п. 7.1., 7.1.1. и 7.1.2. Договора отражается на\nБалансе Исполнителя в качестве авансового платежа и является дополнительным вознаграждением Исполнителя по\n\nДоговору за 12 (двенадцатый) Отчетный и последующие периоды оказания Услуг.\nЕдиноразовая выплата отражается на Балансе Исполнителя в течение 30 (тридцати) календарных дней с момента\nдостижения, указанного в п. 7.1.', 'Заказчик вправе в одностороннем порядке удержать указанные суммы Дополнительных поддерживающих\nвыплат Исполнителя из вознаграждения Исполнителя по истечении срока, указанного выше для возврата\nДополнительных поддерживающих выплат Исполнителем, но не позднее дня наступления Деактивации или смены\nИсполнителя.\n7.4.', 'По итогам проведенной проверки Заказчиком принимается одно\nиз решений:\n• при подтверждении факта передачи Товара, который считался утерянным, данная операция учитывается\nЗаказчиком, при расчете Вознаграждения Исполнителя за следующий Отчетный период;\n• при признании предоставленных Исполнителем доказательств необоснованными Заказчик направляет\nИсполнителю соответствующее уведомление.\n8.3.', '16.5. Договора.\nЗаказчик вправе обусловить выдачу согласия на замену Исполнителя выплатой Исполнителем денежной суммы,\nкоторая устанавливается на усмотрение Заказчика и доступна для ознакомления Исполнителю до совершения\nдействий по смене на другое лицо.\n16.2. После получения согласования от Заказчика о смене Исполнителя в Договоре:\n• действующий Исполнитель полностью погашает свою задолженность перед Заказчиком до того, как он сам\nбудет заменен новым Исполнителем в Договоре, или\n• новый Исполнитель, принимая на себя все права и обязанности по Договору, также принимает на себя\nполностью задолженность текущего Исполнителя по Договору (перевод долга).\n16.3. При смене Исполнителя по Договору расчеты между Исполнителем и новым Исполнителем\nосуществляются на основании отдельных договоренностей, достигнутых между сторонами, и Заказчик не является\nучастником таких взаиморасчетов.\n16.4. В случае необходимости сменить Исполнителя по Договору, Исполнитель направляет Заказчику\nсоответствующую заявку через Личный кабинет. В заявке на смену Исполнителя указываются контактные данные\nнового Исполнителя.\n16.5.', '16.2. После получения согласования от Заказчика о смене Исполнителя в Договоре:\n• действующий Исполнитель полностью погашает свою задолженность перед Заказчиком до того, как он сам\nбудет заменен новым Исполнителем в Договоре, или\n• новый Исполнитель, принимая на себя все права и обязанности по Договору, также принимает на себя\nполностью задолженность текущего Исполнителя по Договору (перевод долга).\n16.3.', '6.6. Заказчик обязуется предоставить Исполнителю инструкции по работе с Порталом и информационные\nматериалы о процессе оказания Услуг, а также своевременно вносить в них изменения и уведомлять о них\nИсполнителя.\n6.7. Заказчик обязуется отвечать на запросы Исполнителя (за исключением письменных претензий), касающиеся\nработы ПВЗ, полученные посредством электронной почты или путем размещения в Личном кабинете, в срок, не\nпревышающий 14 (четырнадцать) календарных дней с даты получения такого запроса. При этом срок рассмотрения\nможет быть продлен по инициативе Заказчика для полного и всестороннего рассмотрения всех обстоятельств\nзапроса, а также получения дополнительной информации и документов от Исполнителя, о чем Заказчик уведомляет\nИсполнителя. Максимальный срок такого ответа на запрос Исполнителя в любом случае не может превышать 30\n(тридцать) календарных дней.\n7.']","Заказчик может переносить оплату услуг Исполнителя на следующий период, если за Отчетный период Исполнителем оказаны Услуги на сумму менее 500 (пятисот) российских рублей или эквивалента указанной суммы в национальной валюте страны государственной регистрации сторон по курсу ЦБ РФ на дату расчета."
"Какие операции исключаются из расчёта вознаграждения Исполнителя, если Заказчик выявил соответствующие обстоятельства?",['13'],"['8.2. При расчёте вознаграждения Исполнителя Заказчик исключает из расчёта операции, размещённые\nИсполнителем на Портале, в отношении которых было выявлено любое из следующих обстоятельств:\n• от Получателя поступило обращение о том, что им не был получен Товар, относительно которого\nИсполнитель разместил в Личном кабинете информацию о выдаче (вручении) Получателю;\n• Товары, указанные Исполнителем как возвращенные Клиентами или не востребованные Клиентами, не были\nпереданы Исполнителем Заказчику/Перевозчику.\n8.2.1.', '8.2. При расчёте вознаграждения Исполнителя Заказчик исключает из расчёта операции, размещённые\nИсполнителем на Портале, в отношении которых было выявлено любое из следующих обстоятельств:\n• от Получателя поступило обращение о том, что им не был получен Товар,', 'В случае, если за Отчетный период Исполнителем оказаны Услуги на сумму менее 500 (пятисот) российских рублей\nили эквивалента указанной суммы в национальной валюте страны государственной регистрации сторон по курсу ЦБ\nРФ на дату расчета, Заказчик переносит оплату таких Услуг пока сумма вознаграждения будет более 500 (пятисот)\nроссийских рублей.\n8.2. При расчёте вознаграждения Исполнителя Заказчик исключает из расчёта операции, размещённые\nИсполнителем на Портале, в отношении которых было выявлено любое из следующих обстоятельств:\n• от Получателя поступило обращение о том, что им не был получен Товар, относительно которого\nИсполнитель разместил в Личном кабинете информацию о выдаче (вручении) Получателю;\n• Товары, указанные Исполнителем как возвращенные Клиентами или не востребованные Клиентами, не были\nпереданы Исполнителем Заказчику/Перевозчику.\n8.2.1.', '8.2.1. В случае, если указанные выше обстоятельства выявлены Заказчиком за Отчётный период, Заказчик\nучитывает данные обстоятельства при расчёте вознаграждения за Услуги за любой последующий Отчётный период,\nв течение которого были выявлены указанные обстоятельства и на соответствующую сумму уменьшает размер\nвознаграждения Исполнителя за такой Отчётный период.\n\n8.2.2. Исполнитель вправе предоставить Заказчику доказательства передачи Товаров Получателю в течение 5\n(пяти) календарных дней с момента получения извещения от Заказчика посредством Портала, либо электронной\nпочты, о выявленных в п. 8.2 Договора обстоятельствах. Исполнитель направляет доказательства Заказчику через\nЛичный кабинет.\n8.2.3. В случае направления Исполнителем Заказчику доказательств, указанных в пп. 8.2.2 Договора, Заказчик\nпроводит проверку представленных доказательств.', '8.2.1. В случае, если указанные выше обстоятельства выявлены Заказчиком за Отчётный период, Заказчик\nучитывает данные обстоятельства при расчёте вознаграждения за Услуги за любой последующий Отчётный период,\nв течение которого были выявлены указанные обстоятельства и на соответствующую сумму уменьшает размер\nвознаграждения Исполнителя за такой Отчётный период.\n\n8.2.2.', 'в течение которого были выявлены указанные обстоятельства и на соответствующую сумму уменьшает размер\nвознаграждения Исполнителя за такой Отчётный период.\n\n8.2.2.', 'Тарифы\n1.1. Вознаграждение – это сумма, рассчитываемая для каждого ПВЗ Исполнителя в соответствии с Базовым,\nДифференцированным или Фиксированным тарифом (если применимо), указанными для соответствующего ПВЗ в\nЛК Исполнителя, исходя из количества оказанных Исполнителем Услуг за Отчетный период, а также с учетом\nвозможных премий и иных выплат, неустоек согласно настоящему Приложению № 1. Размер Вознаграждения\nИсполнителя, не включает в себя налог на добавленную стоимость, если Исполнитель по месту регистрации\nнаходится за пределами Российской Федерации. Суммы, указываемые в согласованных и/или подписанных\nСторонами по настоящему Договору документах, как они определены в разделе 8 Договора, включают в себя суммы\nвсех применимых налогов и сборов, в том числе НДС. Никакие иные суммы налогов, сборов, в т.ч. НДС, не подлежат\nоплате Заказчиком сверх сумм, указанных в документах, подтверждающих оказание Услуг.\nВознаграждение для Исполнителя рассчитывается и выплачивается в национальной валюте страны государственной\nрегистрации Исполнителя.', '8.2.1. В случае, если указанные выше обстоятельства выявлены Заказчиком за Отчётный период, Заказчик\nучитывает данные обстоятельства при расчёте вознаграждения за Услуги за любой последующий Отчётный период,', 'В случае подтверждения обстоятельств, указанных в обращении\nИсполнителя, Блокировка ПВЗ прекращается Заказчиком.\n13.4. Заказчик вправе осуществить Блокировку ПВЗ Исполнителя по инициативе Исполнителя в случаях, если у\nИсполнителя возникли или могут возникнуть обстоятельства,', '13.5. Заказчик вправе применить к Исполнителю Блокировку выплат ПВЗ, в случаях проведения Заказчиком\nпроверки Исполнителя на предмет нарушения Договора и/или выявления Заказчиком нарушений Исполнителем\nтаких условий Договора, как снижение Рейтинга ПВЗ до Минимального значения рейтинга ПВЗ, не предоставления\nнеобходимых документов в соответствии с п. 8.5, включая п. 8.5.1. – 8.5.5. Договора.']","Операции исключаются из расчёта вознаграждения Исполнителя, если Заказчик выявил одно из следующих обстоятельств:

1. От Получателя поступило обращение о том, что им не был получен Товар, относительно которого Исполнитель разместил в Личном кабинете информацию о выдаче (вручении) Получателю;  
2. Товары, указанные Исполнителем как возвращенные Клиентами или не востребованные Клиентами, не были переданы Исполнителем Заказчику/Перевозчику.

При выявлении таких обстоятельств Заказчик учитывает их при расчёте вознаграждения за любой последующий Отчётный период и уменьшает размер вознаграждения на соответствующую сумму."
Какой срок установлен для предоставления Исполнителем доказательств передачи Товара Получателю после получения извещения от Заказчика?,['14'],"['8.2.2. Исполнитель вправе предоставить Заказчику доказательства передачи Товаров Получателю в течение 5\n(пяти) календарных дней с момента получения извещения от Заказчика посредством Портала, либо электронной\nпочты, о выявленных в п. 8.2 Договора обстоятельствах. Исполнитель направляет доказательства Заказчику через\nЛичный кабинет.\n8.2.3. В случае направления Исполнителем Заказчику доказательств, указанных в пп. 8.2.2 Договора, Заказчик\nпроводит проверку представленных доказательств.', '8.2.2. Исполнитель вправе предоставить Заказчику доказательства передачи Товаров Получателю в течение 5\n(пяти) календарных дней с момента получения извещения от Заказчика посредством Портала, либо электронной\nпочты, о выявленных в п. 8.2 Договора обстоятельствах.', '8.2.1. В случае, если указанные выше обстоятельства выявлены Заказчиком за Отчётный период, Заказчик\nучитывает данные обстоятельства при расчёте вознаграждения за Услуги за любой последующий Отчётный период,\nв течение которого были выявлены указанные обстоятельства и на соответствующую сумму уменьшает размер\nвознаграждения Исполнителя за такой Отчётный период.\n\n8.2.2. Исполнитель вправе предоставить Заказчику доказательства передачи Товаров Получателю в течение 5\n(пяти) календарных дней с момента получения извещения от Заказчика посредством Портала, либо электронной\nпочты, о выявленных в п. 8.2 Договора обстоятельствах. Исполнитель направляет доказательства Заказчику через\nЛичный кабинет.\n8.2.3. В случае направления Исполнителем Заказчику доказательств, указанных в пп. 8.2.2 Договора, Заказчик\nпроводит проверку представленных доказательств.', 'По запросу Заказчика Исполнитель обязуется представить заверенные надлежащим образом копии документов,\nподтверждающих выполнение Исполнителем обязанности, предусмотренной настоящим пунктом, в течение 5 (Пяти)\nрабочих дней с даты получения указанного запроса.\n3.9.', 'После истечения указанного срока Исполнитель утрачивает право\nна оспаривание удержанной Заказчиком суммы. Обращение Исполнителя рассматривается в срок, необходимый для\nполного и всестороннего рассмотрения всех обстоятельств, а также получения дополнительной информации и\n\nдокументов от Исполнителя при необходимости, о чем Заказчик уведомляет Исполнителя. Максимальный срок\nрассмотрения в любом случае не может превышать 30 (тридцать) календарных дней.\n12.3.', '2.6.1. В случае непредоставления Исполнителем по требованию Заказчика записи с камер видеонаблюдения в\nтечение 2 (двух) часов с момента поступления соответствующего запроса Заказчика, подтверждающей факт\nвходящей и/или исходящей обработки Исполнителем Товаров Продавцов в соответствии с условиями настоящего\nпункта, факт обработки Исполнителем Товаров Продавцов считается не подтвержденным.\n2.6.2. При невозможности подтвердить выполнение входящей и/или исходящей обработки Товаров\nИсполнителем на ПВЗ, Исполнитель возвращает Заказчику необоснованно уплаченную премию, Вознаграждение в\nполном объеме.\n2.6.3. Исполнитель обязан обеспечить возможность доставки и вывоза Товара в/из ПВЗ сотрудникам Заказчика,\nПеревозчику, привлеченному Заказчиком, в любое время суток.\n3. Требования к подготовке Товаров к возврату\n3.1.', '8.5. Исполнитель, в случае, если является плательщиком НДС (кроме Исполнителей, указанных в п. 8.5.1. –\n8.5.5. Договора), еженедельно, не позднее 3 (трех) календарных дней с даты окончания Отчётного периода, обязан\nна основании размещенных на Портале сведений о совершенных операциях с Товарами сформировать и направить\nЗаказчику следующие Документы, подтверждающие оказание услуг в электронной форме и подписать их\nнадлежащим образом посредством Системы ЭДО:\n• Акт оказанных Услуг, счёт-фактуру или УПД.', '2.6.1. В случае непредоставления Исполнителем по требованию Заказчика записи с камер видеонаблюдения в\nтечение 2 (двух) часов с момента поступления соответствующего запроса Заказчика, подтверждающей факт\nвходящей и/или исходящей обработки Исполнителем Товаров Продавцов в соответствии с условиями настоящего\nпункта, факт обработки Исполнителем Товаров Продавцов считается не подтвержденным.\n2.6.2.', '2.8. Заказчик предоставит Исполнителю полностью соответствующие действующему законодательству Российской\nФедерации первичные документы: товарную накладную по форме ТОРГ-12/УПД со статусом «2» и счет-фактуру или\nУПД со статусом «1», в сроки согласно действующему законодательству и договоренностям Сторон. В случае, если\nИсполнитель не подписал первичные документы в течение 5 (пяти) календарных дней с даты их предоставления или\nне предоставил мотивированные возражения, то документы считаются принятыми и подтвержденными Сторонами\nнадлежащим образом.\n2.9.', '2 В случае нарушения Исполнителем любого изперечисленных ниже обязательств 3 (три) и более разподряд в течение 1 (одного) календарного года оказанияУслуг Исполнителем в ПВЗ с даты Активации ПВЗ(систематическое нарушение) или при неустранениидлящегося нарушения после получения соответствующегоуведомления от Заказчика:1) указанных в Договоре:- пп. 5.15, 5.16, 5.17, 5.18, 5.19, 5.20, 5.21 (нарушениясроков и условий приемки, обработки, обеспечениясохранности, выдачи, перемещения Товаров);- Раздел 9 (Видеонаблюдение);2) указанных в пунктах Правил оказания Услуг:- Раздел 2 (Порядок получения/возврата товаровИсполнителем); 3) указанных в п. 5.7 Договора(несоответствие ПВЗ условиям, указанным в Брендбуке,являющимся частью Регламента состояния ПВЗ).\nДля систематического нарушения — БлокировкаПВЗ вводится на срок от 1 (одного) до 5 (пяти)календарных дней в зависимости от характеранарушения.']","Срок, установленный для предоставления Исполнителем доказательств передачи Товара Получателю после получения извещения от Заказчика, — **5 (пяти) календарных дней**."
"Какие документы должен сформировать Исполнитель, являющийся плательщиком НДС, для подтверждения оказания услуг в электронной форме?",['14'],"['8.5. Исполнитель, в случае, если является плательщиком НДС (кроме Исполнителей, указанных в п. 8.5.1. –\n8.5.5. Договора), еженедельно, не позднее 3 (трех) календарных дней с даты окончания Отчётного периода, обязан\nна основании размещенных на Портале сведений о совершенных операциях с Товарами сформировать и направить\nЗаказчику следующие Документы, подтверждающие оказание услуг в электронной форме и подписать их\nнадлежащим образом посредством Системы ЭДО:\n• Акт оказанных Услуг, счёт-фактуру или УПД. Закрывающие документы должны быть датированы последним днём\nотчётного периода, за который они формируются и направляются.\nДля Исполнителей, не являющихся плательщиками НДС (кроме Исполнителей, указанных в п. 8.5.1. – 8.5.5.', '8.5. Исполнитель, в случае, если является плательщиком НДС (кроме Исполнителей, указанных в п. 8.5.1. –\n8.5.5. Договора), еженедельно, не позднее 3 (трех) календарных дней с даты окончания Отчётного периода, обязан\nна основании размещенных на Портале сведений о совершенных операциях с Товарами сформировать и направить\nЗаказчику следующие Документы, подтверждающие оказание услуг в электронной форме и подписать их\nнадлежащим образом посредством Системы ЭДО:\n• Акт оказанных Услуг, счёт-фактуру или УПД.', 'Счёт-фактура выставляется на дату оказания Услуг либо, если документы оформляются последним\n\nднём месяца реализации — не позднее 10-го числа месяца, следующего за месяцем оказания Услуг.\nИсполнители, не являющиеся плательщиками НДС, формируют и направляют Заказчику электронный Акт оказанных\nуслуг через систему электронного документооборота либо иным согласованным Сторонами способом. Если Акт не\nподписан Исполнителем и отсутствуют мотивированные возражения в течение 5 (пяти) календарных дней с даты его\nформирования, Акт считается принятым. Стороны подтверждают, что Заказчик не вправе оформлять или выставлять\nпервичные учетные документы за Исполнителя. Исполнитель предоставляет Акт сверки взаиморасчётов по запросу\nЗаказчика, но не реже одного раза в полугодие.\n8.6. Стороны вправе использовать иные Документы, подтверждающие оказание Услуг по установленной форме.\nВсе документы, используемые Сторонами для подтверждения оказания Услуг, формируются на основании\nразмещенных на Портале сведений о совершенных операциях с Товарами.\n8.7.', '8.5.2. Для Исполнителей, зарегистрированных на территории Республики Армения, как являющихся\nплательщиками НДС, так и не являющихся плательщиками НДС, Исполнитель в течение 5 (пяти) рабочих дней с\nдаты получения отчета об оказанных Услугах, сформированного в ЛК Исполнителя, обязан на основе отчета\nсформировать счет-фактуру за оказанные Услуги и налоговый счет на портале http://e-invoice.taxservice.am/ и\nвыставить его Заказчику.\n8.5.3. Для Исполнителей, зарегистрированных на территории Республики Беларусь, как являющихся\nплательщиками НДС, так и не являющихся плательщиками НДС, Стороны составляют первичные учетные\nдокументы, подтверждающие оказание Услуг единолично (Постановление Министерства финансов Республики\nБеларусь от 12.02.2018 г. № 13, включая любые изменяющие или дополняющие его документы) на основании\nразмещенных на Портале сведений о совершенных операциях с Товарами. В соответствии с п.', '8.5.1. – 8.5.5.\nДоговора), по окончании Отчетного периода формируются следующие Документы, подтверждающие оказание Услуг,\nкоторые могут быть подписаны между Сторонами согласованным способом, в том числе, посредством ПЭП (простой\nэлектронной подписью, которая посредством использования кодов, паролей или иных средств подтверждает факт\nподписания электронной подписью электронных документов, иной информации в электронной форме определенным\nлицом. Электронная подпись, является аналогом собственноручной подписи в соответствии с законодательством\nРФ):\n• Акт оказанных Услуг за Отчётный период;\nВ случае, если Исполнитель не подписал, сформированный Акт оказанных услуг, в том числе, ПЭП в течение 5 (пяти)\nкалендарных дней с даты его формирования или не предоставил мотивированные возражения, то Акт оказанных\nУслуг считается принятым между Сторонами. Электронные документы, иная информация в электронной форме,\nподписанные ПЭП с использованием системы Заказчика, в которой Исполнитель авторизуется с использованием\nследующих данных (логина и пароля) Исполнителя, считаются подписанными самим Исполнителем.\n8.5.1.', '8.5.1. Для Исполнителей, зарегистрированных на территории Республики Казахстан (РК), как являющихся\nплательщиками НДС, так и не являющихся плательщиками НДС, Стороны составляют первичные учетные\nдокументы, подтверждающие факт оказание/принятия Услуг в соответствии с требованиями законодательства РК, в\nтом числе Кодекса РК «О налогах и других обязательных платежах в бюджет (Налоговый кодекс)», Закона РК «О\nбухгалтерском учете и финансовой отчетности», приказа Министра финансов РК от 20.12.2012 года № 562,', 'обязан\nна основании размещенных на Портале сведений о совершенных операциях с Товарами сформировать и направить\nЗаказчику следующие Документы, подтверждающие оказание услуг в электронной форме и подписать их\nнадлежащим образом посредством Системы ЭДО:\n• Акт оказанных Услуг,', 'Если в соответствии с действующим законодательством страны регистрации Исполнитель для учета\nфактов хозяйственной жизни в целях налогообложения обязан предоставлять Заказчику соответствующие\nдокументы, то обмен документами происходит посредством Системы ЭДО. Стороны договорились о признании\nэлектронных документов, иной информации в электронной форме, подписанных в системе ЭДО равнозначными\nдокументам на бумажном носителе, подписанным собственноручной подписью.\n2.10.2. Исполнитель обязан сохранять конфиденциальность ключа зарегистрированной усиленной\nквалифицированной электронной подписи.', '8.5.3. Для Исполнителей, зарегистрированных на территории Республики Беларусь, как являющихся\nплательщиками НДС, так и не являющихся плательщиками НДС, Стороны составляют первичные учетные\nдокументы, подтверждающие оказание Услуг единолично (Постановление Министерства финансов Республики\nБеларусь от 12.02.2018 г. № 13, включая любые изменяющие или дополняющие его документы) на основании\nразмещенных на Портале сведений о совершенных операциях с Товарами. В соответствии с п.', 'Исполнители, не являющиеся плательщиками НДС, формируют и направляют Заказчику электронный Акт оказанных\nуслуг через систему электронного документооборота либо иным согласованным Сторонами способом.']","Исполнитель, являющийся плательщиком НДС (кроме Исполнителей, указанных в п. 8.5.1 – 8.5.5 Договора), должен сформировать и направить Заказчику следующие документы, подтверждающие оказание услуг в электронной форме:

- **Акт оказанных Услуг, счёт-фактуру или УПД**.

Документы должны быть датированы последним днём отчётного периода, за который они формируются и направляются.  

Если речь идёт о счёте-фактуре, он выставляется на дату оказания услуг или, если документы оформляются последним днём месяца реализации — не позднее 10-го числа следующего месяца.  

Для Исполнителей, зарегистрированных в Республике Армения, также предусмотрено обязательное формирование и выставление счёта-фактуры и налогового счёта на портале http://e-invoice.taxservice.am/ в течение 5 рабочих дней с даты получения отчёта об оказанных услугах.  

Таким образом, основные документы — **Акт оказанных Услуг, счёт-фактура или УПД**."
"Какое решение может принять Заказчик после проверки доказательств, предоставляемых Исполнителем по п. 8.2.2 Договора, и как это повлияет на расчет вознаграждения Исполнителя?",['14'],"['По итогам проведенной проверки Заказчиком принимается одно\nиз решений:\n• при подтверждении факта передачи Товара, который считался утерянным, данная операция учитывается\nЗаказчиком, при расчете Вознаграждения Исполнителя за следующий Отчетный период;\n• при признании предоставленных Исполнителем доказательств необоснованными Заказчик направляет\nИсполнителю соответствующее уведомление.\n8.3.', 'По итогам проведенной проверки Заказчиком принимается одно\nиз решений:\n• при подтверждении факта передачи Товара, который считался утерянным, данная операция учитывается\nЗаказчиком, при расчете Вознаграждения Исполнителя за следующий Отчетный период;\n• при признании предоставленных Исполнителем доказательств необоснованными Заказчик направляет\nИсполнителю соответствующее уведомление.\n8.3. Стороны признают, что данные, содержащиеся на Портале и в ЛК Исполнителя, являются достаточным и\nточным доказательством объема оказанных Услуг, количества Товаров, переданных Исполнителю, стоимости таких\nТоваров и других обстоятельств, сведения о которых содержатся на Портале. Расчет и оплата вознаграждения\nпроизводятся по данным, полученным на Портале или иным согласованным Сторонами способом. Данные Портала\nмогут быть предоставлены любой из Сторон в суд в качестве доказательства. Сторона, возражающая против\nобстоятельств, подтвержденных данными с Портала, должна доказать недостоверность таких данных.\n8.4. Все расчеты по Договору производятся в национальной валюте страны по месту государственной\nрегистрации сторон.\n8.5.', '8.2.1. В случае, если указанные выше обстоятельства выявлены Заказчиком за Отчётный период, Заказчик\nучитывает данные обстоятельства при расчёте вознаграждения за Услуги за любой последующий Отчётный период,\nв течение которого были выявлены указанные обстоятельства и на соответствующую сумму уменьшает размер\nвознаграждения Исполнителя за такой Отчётный период.\n\n8.2.2. Исполнитель вправе предоставить Заказчику доказательства передачи Товаров Получателю в течение 5\n(пяти) календарных дней с момента получения извещения от Заказчика посредством Портала, либо электронной\nпочты, о выявленных в п. 8.2 Договора обстоятельствах. Исполнитель направляет доказательства Заказчику через\nЛичный кабинет.\n8.2.3. В случае направления Исполнителем Заказчику доказательств, указанных в пп. 8.2.2 Договора, Заказчик\nпроводит проверку представленных доказательств.', '8.2.2. Исполнитель вправе предоставить Заказчику доказательства передачи Товаров Получателю в течение 5\n(пяти) календарных дней с момента получения извещения от Заказчика посредством Портала, либо электронной\nпочты, о выявленных в п. 8.2 Договора обстоятельствах. Исполнитель направляет доказательства Заказчику через\nЛичный кабинет.\n8.2.3. В случае направления Исполнителем Заказчику доказательств, указанных в пп. 8.2.2 Договора, Заказчик\nпроводит проверку представленных доказательств.', '8.2.1. В случае, если указанные выше обстоятельства выявлены Заказчиком за Отчётный период, Заказчик\nучитывает данные обстоятельства при расчёте вознаграждения за Услуги за любой последующий Отчётный период,\nв течение которого были выявлены указанные обстоятельства и на соответствующую сумму уменьшает размер\nвознаграждения Исполнителя за такой Отчётный период.\n\n8.2.2.', '8.2 Договора обстоятельствах. Исполнитель направляет доказательства Заказчику через\nЛичный кабинет.\n8.2.3. В случае направления Исполнителем Заказчику доказательств, указанных в пп. 8.2.2 Договора, Заказчик\nпроводит проверку представленных доказательств.', '8.2. При расчёте вознаграждения Исполнителя Заказчик исключает из расчёта операции, размещённые\nИсполнителем на Портале, в отношении которых было выявлено любое из следующих обстоятельств:\n• от Получателя поступило обращение о том, что им не был получен Товар,', '8.2. При расчёте вознаграждения Исполнителя Заказчик исключает из расчёта операции, размещённые\nИсполнителем на Портале, в отношении которых было выявлено любое из следующих обстоятельств:\n• от Получателя поступило обращение о том, что им не был получен Товар, относительно которого\nИсполнитель разместил в Личном кабинете информацию о выдаче (вручении) Получателю;\n• Товары, указанные Исполнителем как возвращенные Клиентами или не востребованные Клиентами, не были\nпереданы Исполнителем Заказчику/Перевозчику.\n8.2.1.', '13.5. Заказчик вправе применить к Исполнителю Блокировку выплат ПВЗ, в случаях проведения Заказчиком\nпроверки Исполнителя на предмет нарушения Договора и/или выявления Заказчиком нарушений Исполнителем\nтаких условий Договора, как снижение Рейтинга ПВЗ до Минимального значения рейтинга ПВЗ, не предоставления\nнеобходимых документов в соответствии с п. 8.5, включая п. 8.5.1. – 8.5.5. Договора.', '13.5. Заказчик вправе применить к Исполнителю Блокировку выплат ПВЗ, в случаях проведения Заказчиком\nпроверки Исполнителя на предмет нарушения Договора и/или выявления Заказчиком нарушений Исполнителем\nтаких условий Договора,']","После проверки доказательств, предоставляемых Исполнителем по п. 8.2.2 Договора, Заказчик может принять одно из двух решений:

1. **При подтверждении факта передачи Товара, который считался утерянным**, данная операция учитывается Заказчиком при расчете Вознаграждения Исполнителя **за следующий Отчетный период**.  
   → Это означает, что операция возвращается в расчет, и вознаграждение Исполнителя **увеличивается** на соответствующую сумму.

2. **При признании предоставленных Исполнителем доказательств необоснованными**, Заказчик направляет Исполнителю соответствующее уведомление.  
   → В этом случае операция **исключается из расчета вознаграждения**, и Заказчик **не учитывает** эту операцию при расчете вознаграждения, что приводит к **уменьшению размера вознаграждения** Исполнителя.

**Вывод:**  
Решение Заказчика после проверки доказательств напрямую влияет на расчет вознаграждения:  
- если доказательства подтверждаются — вознаграждение **увеличивается** (операция включается в расчет за следующий период);  
- если доказательства признаны необоснованными — вознаграждение **уменьшается** (операция исключается из расчета)."
Какой код экономической деятельности должен указываться в налоговой и бухгалтерской документации Исполнителями из Кыргызстана?,['15'],"['8.5.4. Для Исполнителей, зарегистрированных на территории Республики Кыргызстан, как являющихся\nплательщиками НДС, так и не являющихся плательщиками НДС, в целях соответствия фактическому содержанию\nоказываемых Услуг настоящему Договору, обязательно указывать при оформлении налоговой и бухгалтерской\nдокументации следующий код экономической деятельности согласно Государственному классификатору\nэкономической деятельности Кыргызской Республики:\n53.20.0 — Прочая почтовая и курьерская деятельность.\nИсполнитель подтверждает и гарантирует, что вышеуказанный код включён в его регистрационные данные в\nуполномоченных государственных органах и будет использоваться при оформлении электронных счетов-фактур\n(ЭСФ) и иной налоговой и бухгалтерской документации, связанной с исполнением настоящего Договора.', '8.5.4. Для Исполнителей, зарегистрированных на территории Республики Кыргызстан, как являющихся\nплательщиками НДС, так и не являющихся плательщиками НДС, в целях соответствия фактическому содержанию\nоказываемых Услуг настоящему Договору, обязательно указывать при оформлении налоговой и бухгалтерской\nдокументации следующий код экономической деятельности согласно Государственному классификатору\nэкономической деятельности Кыргызской Республики:\n53.20.0 — Прочая почтовая и курьерская деятельность.', 'обязательно указывать при оформлении налоговой и бухгалтерской\nдокументации следующий код экономической деятельности согласно Государственному классификатору\nэкономической деятельности Кыргызской Республики:\n53.20.0 — Прочая почтовая и курьерская деятельность.', 'В случае\nоформления и предоставления Заказчику ЭСФ, иной налоговой и бухгалтерской документации с неверным кодом\nэкономической деятельности или без надлежащего кода, Заказчик вправе отказать в принятии таких документов от\nИсполнителя до устранения несоответствия и предоставления ЭСФ, иной налоговой и бухгалтерской документации с\nверным кодом экономической деятельности согласно настоящему пункту. Исполнитель несет ответственность за\nправильность указания кода экономической деятельности, а также за все последствия, возникшие вследствие его\nневерного указания.\n8.5.5. Для Исполнителей, зарегистрированных на территории Республики Узбекистан, первичные учетные\nдокументы по настоящему Договору оформляются исключительно в электронной форме через государственную\nсистему электронного документооборота, расположенную на сайте soliq.uz в соответствии с Налоговым кодексом\nРеспублики Узбекистан, Законом Республики Узбекистан «О бухгалтерском учёте» и постановлением Кабинета\nМинистров № 489 от 14.08.2020 г.\nПлательщики НДС формируют и выставляют Заказчику электронный счёт-фактуру и Акт оказанных услуг через\nсистему soliq.uz.', 'В случае\nоформления и предоставления Заказчику ЭСФ, иной налоговой и бухгалтерской документации с неверным кодом\nэкономической деятельности или без надлежащего кода, Заказчик вправе отказать в принятии таких документов от\nИсполнителя до устранения несоответствия и предоставления ЭСФ, иной налоговой и бухгалтерской документации с\nверным кодом экономической деятельности согласно настоящему пункту. Исполнитель несет ответственность за\nправильность указания кода экономической деятельности, а также за все последствия, возникшие вследствие его\nневерного указания.\n8.5.5. Для Исполнителей,', 'иной налоговой и бухгалтерской документации с\nверным кодом экономической деятельности согласно настоящему пункту. Исполнитель несет ответственность за\nправильность указания кода экономической деятельности, а также за все последствия, возникшие вследствие его\nневерного указания.\n8.5.5. Для Исполнителей,', 'В случае\nоформления и предоставления Заказчику ЭСФ, иной налоговой и бухгалтерской документации с неверным кодом\nэкономической деятельности или без надлежащего кода, Заказчик вправе отказать в принятии таких документов от\nИсполнителя до устранения несоответствия и предоставления ЭСФ,', '8.5.1. Для Исполнителей, зарегистрированных на территории Республики Казахстан (РК), как являющихся\nплательщиками НДС, так и не являющихся плательщиками НДС, Стороны составляют первичные учетные\nдокументы, подтверждающие факт оказание/принятия Услуг в соответствии с требованиями законодательства РК, в\nтом числе Кодекса РК «О налогах и других обязательных платежах в бюджет (Налоговый кодекс)», Закона РК «О\nбухгалтерском учете и финансовой отчетности», приказа Министра финансов РК от 20.12.2012 года № 562,', 'Исполнитель подтверждает и гарантирует, что вышеуказанный код включён в его регистрационные данные в\nуполномоченных государственных органах и будет использоваться при оформлении электронных счетов-фактур\n(ЭСФ) и иной налоговой и бухгалтерской документации, связанной с исполнением настоящего Договора.', '8.5.1. Для Исполнителей, зарегистрированных на территории Республики Казахстан (РК), как являющихся\nплательщиками НДС, так и не являющихся плательщиками НДС, Стороны составляют первичные учетные\nдокументы, подтверждающие факт оказание/принятия Услуг в соответствии с требованиями законодательства РК, в\nтом числе Кодекса РК «О налогах и других обязательных платежах в бюджет (Налоговый кодекс)», Закона РК «О\nбухгалтерском учете и финансовой отчетности», приказа Министра финансов РК от 20.12.2012 года № 562, Министра\n\nфинансов РК от 31.03.2015 года № 241.\nИсполнители, зарегистрированные на территории РК, обязуются предоставлять Акт сверки взаиморасчетов, но не\nреже одного раза в 6 (шесть) месяцев в целях обеспечения корректности учета, а при получении запроса в течение 5\n(пяти) рабочих дней с даты получения соответствующего запроса.\n8.5.2.']","Код экономической деятельности, который должен указываться в налоговой и бухгалтерской документации Исполнителями из Кыргызстана, — **53.20.0 — Прочая почтовая и курьерская деятельность**."
Какой срок установлен для предоставления Акта сверки взаиморасчетов Исполнителями из Республики Беларусь по запросу?,['15'],"['Исполнители, зарегистрированные на территории Республики Беларусь, обязуются предоставлять Акт сверки\nвзаиморасчётов по запросу, но не реже одного раза в 6 (шесть) месяцев в целях обеспечения корректности учёта в\nтечение 5 (пяти) рабочих дней с даты получения соответствующего запроса. Годовая сверка расчётов по акту\nявляется обязательной и проводится в срок, установленный законодательством Республики Беларусь, с учётом\nтребований Инструкции №180 Минфина РБ от 30.11.2007 г.\n8.5.4.', 'В соответствии с п. 15.2 Договора,\nусловие о необходимости оформления первичных учётных документов для Исполнителей, зарегистрированных в\nРеспублике Беларусь, распространяется на все периоды сотрудничества, включая предыдущие, независимо от даты\nвступления в силу изменений.\nИсполнители, зарегистрированные на территории Республики Беларусь, обязуются предоставлять Акт сверки\nвзаиморасчётов по запросу, но не реже одного раза в 6 (шесть) месяцев в целях обеспечения корректности учёта в\nтечение 5 (пяти) рабочих дней с даты получения соответствующего запроса. Годовая сверка расчётов по акту\nявляется обязательной и проводится в срок, установленный законодательством Республики Беларусь, с учётом\nтребований Инструкции №180 Минфина РБ от 30.11.2007 г.\n8.5.4.', 'Исполнители, зарегистрированные на территории РК, обязуются предоставлять Акт сверки взаиморасчетов, но не\nреже одного раза в 6 (шесть) месяцев в целях обеспечения корректности учета, а при получении запроса в течение 5\n(пяти) рабочих дней с даты получения соответствующего запроса.', 'Исполнители, зарегистрированные на территории Республики Беларусь, обязуются предоставлять Акт сверки\nвзаиморасчётов по запросу,', 'Исполнитель предоставляет Акт сверки взаиморасчётов по запросу\nЗаказчика, но не реже одного раза в полугодие.\n8.6. Стороны вправе использовать иные Документы, подтверждающие оказание Услуг по установленной форме.', '12.2012 года № 562, Министра\n\nфинансов РК от 31.03.2015 года № 241.\nИсполнители, зарегистрированные на территории РК, обязуются предоставлять Акт сверки взаиморасчетов, но не\nреже одного раза в 6 (шесть) месяцев в целях обеспечения корректности учета, а при получении запроса в течение 5\n(пяти) рабочих дней с даты получения соответствующего запроса.\n8.5.2.', 'Годовая сверка расчётов по акту\nявляется обязательной и проводится в срок, установленный законодательством Республики Беларусь, с учётом\nтребований Инструкции №180 Минфина РБ от 30.11.2007 г.\n8.5.4.', 'В указанном случае Стороны проводят сверку по взаимным обязательствам и на\nосновании сверки осуществляют итоговые взаиморасчеты в течение 60 (шестидесяти) календарных дней с даты\nрасторжения Договора.', '8.5.1. Для Исполнителей, зарегистрированных на территории Республики Казахстан (РК), как являющихся\nплательщиками НДС, так и не являющихся плательщиками НДС, Стороны составляют первичные учетные\nдокументы, подтверждающие факт оказание/принятия Услуг в соответствии с требованиями законодательства РК, в\nтом числе Кодекса РК «О налогах и других обязательных платежах в бюджет (Налоговый кодекс)», Закона РК «О\nбухгалтерском учете и финансовой отчетности», приказа Министра финансов РК от 20.12.2012 года № 562, Министра\n\nфинансов РК от 31.03.2015 года № 241.\nИсполнители, зарегистрированные на территории РК, обязуются предоставлять Акт сверки взаиморасчетов, но не\nреже одного раза в 6 (шесть) месяцев в целях обеспечения корректности учета, а при получении запроса в течение 5\n(пяти) рабочих дней с даты получения соответствующего запроса.\n8.5.2.', '8.5.2. Для Исполнителей, зарегистрированных на территории Республики Армения, как являющихся\nплательщиками НДС, так и не являющихся плательщиками НДС, Исполнитель в течение 5 (пяти) рабочих дней с\nдаты получения отчета об оказанных Услугах, сформированного в ЛК Исполнителя, обязан на основе отчета\nсформировать счет-фактуру за оказанные Услуги и налоговый счет на портале http://e-invoice.taxservice.am/ и\nвыставить его Заказчику.\n8.5.3. Для Исполнителей, зарегистрированных на территории Республики Беларусь, как являющихся\nплательщиками НДС, так и не являющихся плательщиками НДС, Стороны составляют первичные учетные\nдокументы, подтверждающие оказание Услуг единолично (Постановление Министерства финансов Республики\nБеларусь от 12.02.2018 г. № 13, включая любые изменяющие или дополняющие его документы) на основании\nразмещенных на Портале сведений о совершенных операциях с Товарами. В соответствии с п.']","Срок, установленный для предоставления Акта сверки взаиморасчётов Исполнителями из Республики Беларусь по запросу, — **в течение 5 (пяти) рабочих дней с даты получения соответствующего запроса**."
"Какие действия может предпринять Заказчик, если Исполнитель из Кыргызстана предоставит ЭСФ с неверным кодом экономической деятельности?",['15'],"['В случае\nоформления и предоставления Заказчику ЭСФ, иной налоговой и бухгалтерской документации с неверным кодом\nэкономической деятельности или без надлежащего кода, Заказчик вправе отказать в принятии таких документов от\nИсполнителя до устранения несоответствия и предоставления ЭСФ, иной налоговой и бухгалтерской документации с\nверным кодом экономической деятельности согласно настоящему пункту. Исполнитель несет ответственность за\nправильность указания кода экономической деятельности, а также за все последствия, возникшие вследствие его\nневерного указания.\n8.5.5. Для Исполнителей,', 'В случае\nоформления и предоставления Заказчику ЭСФ, иной налоговой и бухгалтерской документации с неверным кодом\nэкономической деятельности или без надлежащего кода, Заказчик вправе отказать в принятии таких документов от\nИсполнителя до устранения несоответствия и предоставления ЭСФ,', 'В случае\nоформления и предоставления Заказчику ЭСФ, иной налоговой и бухгалтерской документации с неверным кодом\nэкономической деятельности или без надлежащего кода, Заказчик вправе отказать в принятии таких документов от\nИсполнителя до устранения несоответствия и предоставления ЭСФ, иной налоговой и бухгалтерской документации с\nверным кодом экономической деятельности согласно настоящему пункту. Исполнитель несет ответственность за\nправильность указания кода экономической деятельности, а также за все последствия, возникшие вследствие его\nневерного указания.\n8.5.5. Для Исполнителей, зарегистрированных на территории Республики Узбекистан, первичные учетные\nдокументы по настоящему Договору оформляются исключительно в электронной форме через государственную\nсистему электронного документооборота, расположенную на сайте soliq.uz в соответствии с Налоговым кодексом\nРеспублики Узбекистан, Законом Республики Узбекистан «О бухгалтерском учёте» и постановлением Кабинета\nМинистров № 489 от 14.08.2020 г.\nПлательщики НДС формируют и выставляют Заказчику электронный счёт-фактуру и Акт оказанных услуг через\nсистему soliq.uz.', '8.5.4. Для Исполнителей, зарегистрированных на территории Республики Кыргызстан, как являющихся\nплательщиками НДС, так и не являющихся плательщиками НДС, в целях соответствия фактическому содержанию\nоказываемых Услуг настоящему Договору, обязательно указывать при оформлении налоговой и бухгалтерской\nдокументации следующий код экономической деятельности согласно Государственному классификатору\nэкономической деятельности Кыргызской Республики:\n53.20.0 — Прочая почтовая и курьерская деятельность.\nИсполнитель подтверждает и гарантирует, что вышеуказанный код включён в его регистрационные данные в\nуполномоченных государственных органах и будет использоваться при оформлении электронных счетов-фактур\n(ЭСФ) и иной налоговой и бухгалтерской документации, связанной с исполнением настоящего Договора.', 'иной налоговой и бухгалтерской документации с\nверным кодом экономической деятельности согласно настоящему пункту. Исполнитель несет ответственность за\nправильность указания кода экономической деятельности, а также за все последствия, возникшие вследствие его\nневерного указания.\n8.5.5. Для Исполнителей,', '8.5.4. Для Исполнителей, зарегистрированных на территории Республики Кыргызстан, как являющихся\nплательщиками НДС, так и не являющихся плательщиками НДС, в целях соответствия фактическому содержанию\nоказываемых Услуг настоящему Договору, обязательно указывать при оформлении налоговой и бухгалтерской\nдокументации следующий код экономической деятельности согласно Государственному классификатору\nэкономической деятельности Кыргызской Республики:\n53.20.0 — Прочая почтовая и курьерская деятельность.', 'обязательно указывать при оформлении налоговой и бухгалтерской\nдокументации следующий код экономической деятельности согласно Государственному классификатору\nэкономической деятельности Кыргызской Республики:\n53.20.0 — Прочая почтовая и курьерская деятельность.', 'Исполнитель подтверждает и гарантирует, что вышеуказанный код включён в его регистрационные данные в\nуполномоченных государственных органах и будет использоваться при оформлении электронных счетов-фактур\n(ЭСФ) и иной налоговой и бухгалтерской документации, связанной с исполнением настоящего Договора.', '8.5.4. Для Исполнителей, зарегистрированных на территории Республики Кыргызстан, как являющихся\nплательщиками НДС, так и не являющихся плательщиками НДС, в целях соответствия фактическому содержанию\nоказываемых Услуг настоящему Договору,', 'В случае если Исполнитель предоставит третьим лицам доступ к\nиспользованию своей электронной подписи, Исполнитель в полном объеме отвечает за любые действия и\nбездействие таких лиц, совершенные (допущенные) ими при использовании электронной подписи, как за свои\nсобственные.\n3.']","Заказчик вправе отказать в принятии таких документов от Исполнителя до устранения несоответствия и предоставления ЭСФ, иной налоговой и бухгалтерской документации с верным кодом экономической деятельности согласно настоящему пункту.  

Пояснение: В контексте указано, что для Исполнителей, зарегистрированных в Кыргызстане, обязательно указывать код экономической деятельности 53.20.0 — «Прочая почтовая и курьерская деятельность». Если Исполнитель предоставит ЭСФ с неверным кодом, Заказчик имеет право отказать в принятии таких документов до устранения несоответствия."
Какой срок установлен для уплаты разницы между размером причиненных убытков и фактическим удержанием?,['16'],"['разницу между размером причиненных убытков и\nразмером фактического удержания в течение 5 (пяти) рабочих дней с момента направления Исполнителю\nуведомления об удержании.\n8.9.', '8.8. В случае, если Заказчиком в одностороннем порядке была удержана часть вознаграждения по Договору или\nпо любому другому договору, заключенному между Сторонами, и удержанная сумма не покрывает размер\nпричиненных убытков/неустоек (пени, штрафы), Исполнитель обязуется оплатить по реквизитам Заказчика,\nуказанным на Портале или предоставленным Заказчиком, разницу между размером причиненных убытков и\nразмером фактического удержания в течение 5 (пяти) рабочих дней с момента направления Исполнителю\nуведомления об удержании.\n8.9.', '8.7. Требования Заказчика к Исполнителю о возмещении убытков, штрафов за допущенные нарушения\nДоговора, а также требования Заказчика об уплате сумм, возникших из любых договоров и соглашений между\nИсполнителем и Заказчиком и требования Исполнителя к Заказчику о выплате вознаграждения по Договору, а также\nуплате любых других сумм, включая требования о возмещении убытков, сальдируются в момент отражения сумм\nтаких требований в Личном кабинете Исполнителя. Такое сальдирование прекращает требования в соответствующей\nчасти и происходит автоматически без дополнительных заявлений от любой из Сторон.\nПо результатам такого сальдирования:\n— если сумма требований Заказчика была меньше, Заказчик перечисляет оставшуюся после удержаний сумму\nвознаграждения в предусмотренном Договором порядке;\n— если сумма требований Заказчика была больше, Исполнитель обязан уплатить сумму разницы в течение срока,\nуказанного в п. 8.8. Договора, с момента отражения такого требования в Личном кабинете Исполнителя или Заказчик\nвправе осуществить удержание в оставшейся сумме при последующем перечислении вознаграждения.\n8.8.', 'Заказчик перечисляет оставшуюся после удержаний сумму\nвознаграждения в предусмотренном Договором порядке;\n— если сумма требований Заказчика была больше, Исполнитель обязан уплатить сумму разницы в течение срока,\nуказанного в п. 8.8.', '8.8. В случае, если Заказчиком в одностороннем порядке была удержана часть вознаграждения по Договору или\nпо любому другому договору, заключенному между Сторонами, и удержанная сумма не покрывает размер\nпричиненных убытков/неустоек (пени, штрафы),', 'Приложение № 4\nк Оферте об оказании услуг в ПВЗ\nОТВЕТСТВЕННОСТЬ\nВ случае если местом регистрации сторон по Договору является не Российская Федерация, предусмотренные\nДоговором штрафы или удержания, размер которых установлен в рублях Российской Федерации, уплачиваются\nИсполнителем в национальной валюте страны государственной регистрации Сторон по курсу ЦБ РФ на дату\nвыставления штрафа или совершения удержания за каждый выявленный случай. Требования по уплате штрафов,\nпеней, неустоек, вытекающие из настоящего Договора, НДС не облагаются.\n\nТребования Заказчика к Исполнителю по Договору, в том числе требования об уплате неустоек и возмещении\nубытков, могут быть уступлены Заказчиком третьим лицам без получения предварительного согласия Исполнителя.\nВ случае если Договором предусмотрено право Заказчика требовать уплаты неустоек, Заказчик при наличии\nсоответствующего обоснования и признаков явной несоразмерности неустойки последствиям нарушения,\nдопущенного Исполнителем, вправе требовать уплаты неустоек в сумме меньшей, чем предусмотренный Договором\nразмер неустойки.', 'Максимальный срок рассмотрения в любом случае не\nможет превышать 30 (тридцать) календарных дней.\n12.2. Исполнитель посредством функционала Портала вправе оспорить произведенное Заказчиком удержание\nстоимости подготовки Товаров к возврату на Склад, утраченных, утерянных, Зависших Товаров, Товаров с\nнедостатком, или Подмен в течение 7 (семи) календарных дней с момента информирования Исполнителя путём\nразмещения соответствующих сведений об удержании на Портале с помощью обращения, поданного через Личный\nкабинет, с приложением подтверждающих документов, в том числе видеоматериалов, подтверждающих\nнеобоснованность примененной ответственности. После истечения указанного срока Исполнитель утрачивает право\nна оспаривание удержанной Заказчиком суммы. Обращение Исполнителя рассматривается в срок, необходимый для\nполного и всестороннего рассмотрения всех обстоятельств, а также получения дополнительной информации и\n\nдокументов от Исполнителя при необходимости, о чем Заказчик уведомляет Исполнителя. Максимальный срок\nрассмотрения в любом случае не может превышать 30 (тридцать) календарных дней.\n12.3.', 'Товаров с\nнедостатком, или Подмен в течение 7 (семи) календарных дней с момента информирования Исполнителя путём\nразмещения соответствующих сведений об удержании на Портале с помощью обращения, поданного через Личный\nкабинет, с приложением подтверждающих документов,', 'В отношении Зависших Товаров - совокупная Стоимость Зависших Товаров удерживается Заказчиком в\nслучае, если Исполнителем не был оспорен факт утери Товара в период его нахождения в ПВЗ Исполнителя в\nтечение 7 (семи) календарных дней с момента обнаружения Заказчиком', 'В случае если Договором предусмотрено право Заказчика требовать уплаты неустоек, Заказчик при наличии\nсоответствующего обоснования и признаков явной несоразмерности неустойки последствиям нарушения,\nдопущенного Исполнителем, вправе требовать уплаты неустоек в сумме меньшей, чем предусмотренный Договором\nразмер неустойки.']","Срок, установленный для уплаты разницы между размером причиненных убытков и фактическим удержанием, — **5 (пяти) рабочих дней** с момента направления Исполнителю уведомления об удержании."
"Каким образом Стороны могут подтверждать оказание Услуг, согласно фрагменту оферты?",['16'],"['Исполнитель предоставляет Акт сверки взаиморасчётов по запросу\nЗаказчика, но не реже одного раза в полугодие.\n8.6. Стороны вправе использовать иные Документы, подтверждающие оказание Услуг по установленной форме.', '8.5.1. – 8.5.5.\nДоговора), по окончании Отчетного периода формируются следующие Документы, подтверждающие оказание Услуг,\nкоторые могут быть подписаны между Сторонами согласованным способом, в том числе, посредством ПЭП (простой\nэлектронной подписью,', '1.10. Документ, подтверждающий оказание Услуг, — документ(ы) в зависимости от страны регистрации\nИсполнителя, оказывающего Услуги, подтверждающий(ие) факт оказания Услуг Исполнителем, подписываемый(ые)\nобеими Сторонами по окончании оказания Услуг в соответствии с условиями Договора, указанными в разделе 8\nДоговора.\n1.11. Доля Подмен — процентное соотношение совокупной Стоимости Товаров, удержанных в качестве Подмен, к\nОбороту ПВЗ Исполнителя за период времени, определенный в соответствующем положении Договора.', 'Стороны составляют первичные учетные\nдокументы, подтверждающие факт оказание/принятия Услуг в соответствии с требованиями законодательства РК, в\nтом числе Кодекса РК «О налогах и других обязательных платежах в бюджет (Налоговый кодекс)»,', 'Стороны составляют первичные учетные\nдокументы, подтверждающие оказание Услуг единолично (Постановление Министерства финансов Республики\nБеларусь от 12.02.2018 г.', '8.3. Стороны признают, что данные, содержащиеся на Портале и в ЛК Исполнителя, являются достаточным и\nточным доказательством объема оказанных Услуг, количества Товаров, переданных Исполнителю, стоимости таких\nТоваров и других обстоятельств, сведения о которых содержатся на Портале. Расчет и оплата вознаграждения\nпроизводятся по данным, полученным на Портале или иным согласованным Сторонами способом. Данные Портала\nмогут быть предоставлены любой из Сторон в суд в качестве доказательства.', '8.3. Стороны признают, что данные, содержащиеся на Портале и в ЛК Исполнителя, являются достаточным и\nточным доказательством объема оказанных Услуг, количества Товаров, переданных Исполнителю, стоимости таких\nТоваров и других обстоятельств, сведения о которых содержатся на Портале.', '1.10. Документ, подтверждающий оказание Услуг, — документ(ы) в зависимости от страны регистрации\nИсполнителя, оказывающего Услуги, подтверждающий(ие) факт оказания Услуг Исполнителем,', '2.6. По запросу Заказчика Исполнитель обязуется предоставить дополнительное подтверждение о заключении\nДоговора в указанной Заказчиком форме, например, в форме подписанного Исполнителем заявления о\nприсоединении к Оферте или текста Оферты.\n2.7.', '1.27. Оферта — условия настоящей оферты об оказании услуг в ПВЗ, которая содержит все существенные\nусловия и принятие которой влечет заключение Договора на указанных в Оферте условиях.\n1.28.']","Стороны могут подтверждать оказание Услуг следующими способами:

1. **Посредством данных, содержащихся на Портале и в Личном кабинете (ЛК) Исполнителя** — данные, содержащиеся на Портале и в ЛК, признаются Сторонами достаточными и точными доказательствами объема оказанных Услуг, количества переданных Товаров, их стоимости и других обстоятельств. Расчет и оплата вознаграждения производятся по этим данным.

2. **Предоставлением Акта сверки взаиморасчётов** — Исполнитель предоставляет Акт сверки взаиморасчётов по запросу Заказчика, но не реже одного раза в полугодие.

3. **Составлением первичных учетных документов** — Стороны составляют первичные учетные документы, подтверждающие факт оказания/принятия Услуг, в соответствии с требованиями законодательства Республики Казахстан (РК), включая Налоговый кодекс.

4. **Подписанием документов в установленной форме** — документы, подтверждающие оказание Услуг, могут быть подписаны обеими Сторонами согласованным способом, в том числе посредством простой электронной подписи (ПЭП).

5. **Предоставлением дополнительного подтверждения по запросу Заказчика** — по запросу Заказчика Исполнитель предоставляет подтверждение о заключении Договора, например, в форме подписанного заявления о присоединении к Оферте или текста Оферты.

Таким образом, согласно фрагменту оферты, оказание Услуг подтверждается как **данными на Портале и в ЛК**, так и **письменными документами**, включая **Акт сверки**, **первичные учетные документы**, **документы, подписанные Сторонами**, а также **дополнительными подтверждениями по запросу**."
"Какие действия Исполнителя позволяют Заказчику списывать суммы, подлежащие уплате, без дополнительного согласия Исполнителя?",['16'],"['Исполнитель понимает и соглашается, что в случае предоставления заявления (поручения и/или иного\nраспоряжения) в ПАО Сбербанк и/или АО «ТБанк» на списание без дополнительных распоряжений Исполнителя\n(согласия/акцепта) денежных средств в соответствии с настоящим пунктом через Портал с использованием сервисов\nи функционала ПАО Сбербанк и/или АО «ТБанк» Исполнитель предоставляет Заказчику право списывать суммы,\nподлежащие уплате Заказчику без распоряжения (согласия) Исполнителя путем предъявления к банковским счетам\nИсполнителя, открытым в ПАО Сбербанк и/или АО «ТБанк» платежного требования, инкассового распоряжения и\nиных, предусмотренных законодательством Российской Федерации, форм расчетных документов, предусмотренных\nдля осуществления списания денежных средств со счета Исполнителя по требованию получателя средств, в\n\nсоответствии с Договором.', 'Исполнитель понимает и соглашается, что в случае предоставления заявления (поручения и/или иного\nраспоряжения) в ПАО Сбербанк и/или АО «ТБанк» на списание без дополнительных распоряжений Исполнителя\n(согласия/акцепта) денежных средств в соответствии с настоящим пунктом через Портал с использованием сервисов\nи функционала ПАО Сбербанк и/или АО «ТБанк» Исполнитель предоставляет Заказчику право списывать суммы,\nподлежащие уплате Заказчику без распоряжения (согласия) Исполнителя путем предъявления к банковским счетам\nИсполнителя,', 'Заказчику право списывать суммы,\nподлежащие уплате Заказчику без распоряжения (согласия) Исполнителя путем предъявления к банковским счетам\nИсполнителя,', 'списание без\nдополнительных распоряжений Исполнителя (согласия/акцепта) денежных средств в любой сумме в рамках одного\nплатежного требования Заказчика с расчетного счета Исполнителя, открытого в ПАО Сбербанк и/или АО «ТБанк»,\nсоответственно.', 'Требования Заказчика к Исполнителю по Договору, в том числе требования об уплате неустоек и возмещении\nубытков, могут быть уступлены Заказчиком третьим лицам без получения предварительного согласия Исполнителя.', 'Требования\nЗаказчика к Исполнителю по Оферте, в том числе требования об уплате неустоек и возмещении убытков, могут быть\nуступлены Заказчиком третьим лицам без получения предварительного согласия Исполнителя.', 'Требования по уплате штрафов,\nпеней, неустоек, вытекающие из настоящего Договора, НДС не облагаются.\n\nТребования Заказчика к Исполнителю по Договору, в том числе требования об уплате неустоек и возмещении\nубытков, могут быть уступлены Заказчиком третьим лицам без получения предварительного согласия Исполнителя.', 'Права и обязательства Заказчика\n\n6.1. Заказчик вправе по своему усмотрению и без согласования с Исполнителем вносить изменения в\nсодержание, функциональные возможности и пользовательский интерфейс Портала.\n6.2. Заказчик вправе осуществлять любые действия по проверке качества оказания Исполнителем Услуг.\nЗаказчик самостоятельно определяет способы, периодичность и основания проведения таких проверок.\n6.3. Заказчик вправе проводить оценку качества исполнения Договора Сторонами, включая оказание Услуг\nКлиенту, как во взаимодействии, так и без взаимодействия с Исполнителем, в том числе с привлечением третьих\nлиц, без дополнительного согласия Исполнителя.\n6.4. Заказчик обязуется оплачивать оказанные Исполнителем Услуги в порядке и сроки, установленные\nДоговором.\n6.5. Заказчик обязуется предоставлять Исполнителю информацию, необходимую для целей оказания Услуг по\nДоговору посредством Личного кабинета на Портале, которая включает в себя в том числе: информацию о Клиенте,\nкод получения и адрес Клиента в случае осуществления доставки Курьером.\n6.6.', '6.3. Заказчик вправе проводить оценку качества исполнения Договора Сторонами, включая оказание Услуг\nКлиенту, как во взаимодействии, так и без взаимодействия с Исполнителем, в том числе с привлечением третьих\nлиц, без дополнительного согласия Исполнителя.\n6.4. Заказчик обязуется оплачивать оказанные Исполнителем Услуги в порядке и сроки, установленные\nДоговором.\n6.5.', 'средств в соответствии с настоящим пунктом через Портал с использованием сервисов\nи функционала ПАО Сбербанк и/или АО «ТБанк» Исполнитель предоставляет Заказчику право списывать суммы,']","Исполнитель предоставляет Заказчику право списывать суммы, подлежащие уплате, без дополнительного согласия Исполнителя, в случае предоставления заявления (поручения и/или иного распоряжения) в ПАО Сбербанк и/или АО «ТБанк» на списание без дополнительных распоряжений Исполнителя (согласия/акцепта) денежных средств в соответствии с настоящим пунктом через Портал с использованием сервисов и функционала ПАО Сбербанк и/или АО «ТБанк»."
Какое минимальное количество камер видеонаблюдения должно быть установлено в ПВЗ при всех остальных условиях открытия?,['17'],"['3.16.2. Требования к установке:\n• при упрощенных условиях открытия ПВЗ — 1 (одна) камера видеонаблюдения;\n• при всех остальных условиях открытия ПВЗ — минимальное количество камер для покрытия всех зон составляет\nне менее 3 (трех).', 'В случае если 1 (одной) камеры\nнедостаточно для охвата всех зон ПВЗ, Исполнитель обязуется оборудовать ПВЗ необходимым количеством камер,\nохватывающим всю площадь ПВЗ;\n• при всех остальных условиях открытия ПВЗ — не менее 3 (трех) камер видеонаблюдения. Все камеры\nвидеонаблюдения должны осуществлять функцию видеофиксации. В случае если ПВЗ оборудован столом для\nподготовки Товара к возврату, Исполнитель обязуется установить камеру видеонаблюдения на таком столе, в\nсоответствии с техническими стандартами оборудования.', 'В случае если 1 (одной) камерынедостаточно для охвата всех зон ПВЗ, то Исполнительобязуется оборудовать ПВЗ необходимым количествомкамер, охватывающих всю площадь ПВЗ;- при всех остальных условиях открытия ПВЗ – неменее 3 (трех) камер видеонаблюдения. Все камерывидеонаблюдения должны осуществлять функциювидеофиксации.', 'В случае если 1 (одной) камеры\nнедостаточно для охвата всех зон ПВЗ, Исполнитель обязуется оборудовать ПВЗ необходимым количеством камер,\nохватывающим всю площадь ПВЗ;\n• при всех остальных условиях открытия ПВЗ — не менее 3 (трех) камер видеонаблюдения.', 'В случае если 1 (одной) камерынедостаточно для охвата всех зон ПВЗ, то Исполнительобязуется оборудовать ПВЗ необходимым количествомкамер, охватывающих всю площадь ПВЗ;- при всех остальных условиях открытия ПВЗ – неменее 3 (трех) камер видеонаблюдения.', 'Запрещено использовать камеры с Wi-Fi;\n— режим день/ночь: автоматическое переключение;\n— RAM: 8-16 МБ.\n3.16.2. Требования к установке:\n• при упрощенных условиях открытия ПВЗ — 1 (одна) камера видеонаблюдения;\n• при всех остальных условиях открытия ПВЗ — минимальное количество камер для покрытия всех зон составляет\nне менее 3 (трех).', '9. Видеонаблюдение\n9.1.1. Исполнитель обязуется оборудовать ПВЗ системой видеонаблюдения, соответствующей техническим\nтребованиям, указанным в Регламенте состояния ПВЗ (Приложение № 3), и подключить систему к провайдеру\nоблачного видеонаблюдения, соответствующего техническим требованиям, которые размещены на сайте\nhttps://pvz.wb.ru/video-connection\nИсполнитель обязуется оборудовать ПВЗ:\n• при упрощенных условиях открытия ПВЗ — 1 (одной) камерой видеонаблюдения, которая должна\nохватывать все зоны ПВЗ, в том числе клиентскую и складскую зоны полностью. В случае если 1 (одной) камеры\nнедостаточно для охвата всех зон ПВЗ, Исполнитель обязуется оборудовать ПВЗ необходимым количеством камер,\nохватывающим всю площадь ПВЗ;\n• при всех остальных условиях открытия ПВЗ — не менее 3 (трех) камер видеонаблюдения. Все камеры\nвидеонаблюдения должны осуществлять функцию видеофиксации. В случае если ПВЗ оборудован столом для\nподготовки Товара к возврату, Исполнитель обязуется установить камеру видеонаблюдения на таком столе, в\nсоответствии с техническими стандартами оборудования.', 'Исполнитель обязуется оборудовать ПВЗсистемой видеонаблюдения, соответствующейтехническим требованиям, указанным в Регламентесостояния ПВЗ (Приложение № 3), и подключитьсистему к провайдеру облачного видеонаблюдения,соответствующего техническим требованиям, которыеразмещены на сайте https://pvz.wb.ru/video-connection Исполнитель обязуется оборудовать ПВЗ:- при упрощенных условиях открытия ПВЗ – 1 (одной)камерой видеонаблюдения, которая должна охватыватьвсе зоны ПВЗ, в том числе клиентскую и складскуюзоны полностью. В случае если 1 (одной) камерынедостаточно для охвата всех зон ПВЗ, то Исполнительобязуется оборудовать ПВЗ необходимым количествомкамер, охватывающих всю площадь ПВЗ;- при всех остальных условиях открытия ПВЗ – неменее 3 (трех) камер видеонаблюдения. Все камерывидеонаблюдения должны осуществлять функциювидеофиксации.', 'PCMa (G.711A), PCMu (G711U);\n— возможность конфигурирования интервала ключевых кадров idr (iframe interval): от 1 с до 8 с;\n— механический ИК-фильтр: в наличии;\n— ИК-подсветка: в наличии;\n— дальность действия ИК-подсветки: не менее 20 м;\n— рабочая температура: от минус 10 °С до плюс 45 °С;\n— питание: 12V (DC) или POE (рекомендовано);\n— минимальная освещенность: не более 0,01 лк;\n— защита корпуса от пыли и влаги: не ниже IP40;\n— технология передачи данных: Ethernet. Запрещено использовать камеры с Wi-Fi;\n— режим день/ночь: автоматическое переключение;\n— RAM: 8-16 МБ.\n3.16.2. Требования к установке:\n• при упрощенных условиях открытия ПВЗ — 1 (одна) камера видеонаблюдения;\n• при всех остальных условиях открытия ПВЗ — минимальное количество камер для покрытия всех зон составляет\nне менее 3 (трех).', 'Количество и расположение камер должно быть таким, чтобы был полный охват помещения ПВЗ при любых\nусловиях открытия ПВЗ, в частности, клиентская зона (общий план), стол менеджера, монитор (крупный план или\nзапись экрана), складское помещение, зона приемки/возврата/подготовки Товара к отправке на склад и другие\nпомещения для работы с Товаром.\n3.16.3. Требования к системе облачного видеонаблюдения:\n• Подключить систему видеонаблюдения к провайдеру облачного видеонаблюдения, соответствующему техническим\nтребованиям, которые размещены на сайте https://pvz.wb.ru/video-connection;\n• Видеосервис должен обеспечивать доступ к API по авторизационному токену, web-интерфейс (личный кабинет) для\nпросмотра и работы с камерами, обеспечивать бесперебойную работу и доступ к данным через API, а также\nвыдерживать высокую нагрузку;\n• Запись аудио и видео осуществлять в непрерывном режиме (постоянная запись, не по датчику движения), за\nисключением ПВЗ, расположенных на территории Республики Беларусь, для которых запись аудио не является\nобязательной;\n• Минимальная глубина архива — 90 (девяносто) дней на каждой камере, за исключением ПВЗ,']","Минимальное количество камер видеонаблюдения, которое должно быть установлено в ПВЗ при всех остальных условиях открытия, — **не менее трёх (3)**."
Какие зоны ПВЗ должны охватываться камерами видеонаблюдения согласно оферте?,['17'],"['Камеры должны охватывать всю площадь ПВЗ, складскую и клиентскую зоны, зоны осуществления приемки,\nотправки Товаров, подготовки Товаров к возврату, в том числе в Возвратные коробки. Стороны согласовали, что стол\nподготовки Товаров к возврату — это стол, оборудованный камерой и дополнительным светом для видеофиксации\nдействий с Товарами. Все оборудование крепится к столу посредством специального кронштейна.\n9.1.2. Исполнитель обязуется подключить инструмент (программу для ЭВМ) для записи монитора сотрудника\nИсполнителя, который предоставляется провайдерами видеонаблюдения согласно п. 9.1 Договора.\n9.1.3. Исполнитель обеспечивает хранение данных с камер видеонаблюдения в ПВЗ, а также записи монитора\nкомпьютера сотрудника Исполнителя в облачном хранилище провайдера видеонаблюдения в течение не менее 90\n(девяноста) календарных дней в период действия Договора, а также в срок не менее 90 (девяноста) календарных\nдней с даты прекращения действия Договора, используя видеосервисы, представленные в Регламенте состояния\nПВЗ.', 'Камеры должны охватывать всю площадь ПВЗ, складскую и клиентскую зоны, зоны осуществления приемки,\nотправки Товаров, подготовки Товаров к возврату, в том числе в Возвратные коробки.', 'В случае если ПВЗ оборудован столомдля подготовки Товара к возврату, то Исполнительобязуется установить камеру видеонаблюдения натаком столе, в соответствии с техническимистандартами оборудования.Камеры должны охватывать всю площадь ПВЗ,складскую и клиентскую зоны, зоны осуществленияприемки, отправки Товаров, подготовки Товаров квозврату, в том числе в Возвратные коробки. Сторонысогласовали, что стол подготовки Товаров к возврату –это стол, оборудованный камерой и дополнительнымсветом для видеофиксации действий с Товарами.', 'В случае если ПВЗ оборудован столомдля подготовки Товара к возврату, то Исполнительобязуется установить камеру видеонаблюдения натаком столе, в соответствии с техническимистандартами оборудования.Камеры должны охватывать всю площадь ПВЗ,складскую и клиентскую зоны, зоны осуществленияприемки, отправки Товаров, подготовки Товаров квозврату, в том числе в Возвратные коробки. Сторонысогласовали, что стол подготовки Товаров к возврату –это стол, оборудованный камерой и дополнительнымсветом для видеофиксации действий с Товарами. Всеоборудование крепится к столу посредствомспециального кронштейна.9.1.2. Исполнитель обязуется подключить инструмент(программу для ЭВМ) для записи монитора сотрудникаИсполнителя, который предоставляется провайдерамивидеонаблюдения согласно п. 9.1 Договора.9.1.3.', 'В случае если ПВЗ оборудован столомдля подготовки Товара к возврату, то Исполнительобязуется установить камеру видеонаблюдения натаком столе, в соответствии с техническимистандартами оборудования.Камеры должны охватывать всю площадь ПВЗ,складскую и клиентскую зоны,', '9. Видеонаблюдение\n9.1.1. Исполнитель обязуется оборудовать ПВЗ системой видеонаблюдения, соответствующей техническим\nтребованиям, указанным в Регламенте состояния ПВЗ (Приложение № 3), и подключить систему к провайдеру\nоблачного видеонаблюдения, соответствующего техническим требованиям, которые размещены на сайте\nhttps://pvz.wb.ru/video-connection\nИсполнитель обязуется оборудовать ПВЗ:\n• при упрощенных условиях открытия ПВЗ — 1 (одной) камерой видеонаблюдения, которая должна\nохватывать все зоны ПВЗ, в том числе клиентскую и складскую зоны полностью. В случае если 1 (одной) камеры\nнедостаточно для охвата всех зон ПВЗ, Исполнитель обязуется оборудовать ПВЗ необходимым количеством камер,\nохватывающим всю площадь ПВЗ;\n• при всех остальных условиях открытия ПВЗ — не менее 3 (трех) камер видеонаблюдения. Все камеры\nвидеонаблюдения должны осуществлять функцию видеофиксации. В случае если ПВЗ оборудован столом для\nподготовки Товара к возврату, Исполнитель обязуется установить камеру видеонаблюдения на таком столе, в\nсоответствии с техническими стандартами оборудования.', 'Исполнитель обязуется оборудовать ПВЗсистемой видеонаблюдения, соответствующейтехническим требованиям, указанным в Регламентесостояния ПВЗ (Приложение № 3), и подключитьсистему к провайдеру облачного видеонаблюдения,соответствующего техническим требованиям, которыеразмещены на сайте https://pvz.wb.ru/video-connection Исполнитель обязуется оборудовать ПВЗ:- при упрощенных условиях открытия ПВЗ – 1 (одной)камерой видеонаблюдения, которая должна охватыватьвсе зоны ПВЗ, в том числе клиентскую и складскуюзоны полностью. В случае если 1 (одной) камерынедостаточно для охвата всех зон ПВЗ, то Исполнительобязуется оборудовать ПВЗ необходимым количествомкамер, охватывающих всю площадь ПВЗ;- при всех остальных условиях открытия ПВЗ – неменее 3 (трех) камер видеонаблюдения. Все камерывидеонаблюдения должны осуществлять функциювидеофиксации.', '9. Видеонаблюдение\n9.1.1. Исполнитель обязуется оборудовать ПВЗ системой видеонаблюдения, соответствующей техническим\nтребованиям, указанным в Регламенте состояния ПВЗ (Приложение № 3), и подключить систему к провайдеру\nоблачного видеонаблюдения, соответствующего техническим требованиям, которые размещены на сайте\nhttps://pvz.wb.ru/video-connection\nИсполнитель обязуется оборудовать ПВЗ:\n• при упрощенных условиях открытия ПВЗ — 1 (одной) камерой видеонаблюдения, которая должна\nохватывать все зоны ПВЗ, в том числе клиентскую и складскую зоны полностью.', 'Исполнитель обязуется оборудовать ПВЗсистемой видеонаблюдения, соответствующейтехническим требованиям, указанным в Регламентесостояния ПВЗ (Приложение № 3), и подключитьсистему к провайдеру облачного видеонаблюдения,соответствующего техническим требованиям, которыеразмещены на сайте https://pvz.wb.ru/video-connection Исполнитель обязуется оборудовать ПВЗ:- при упрощенных условиях открытия ПВЗ – 1 (одной)камерой видеонаблюдения, которая должна охватыватьвсе зоны ПВЗ, в том числе клиентскую и складскуюзоны полностью.', 'В случае если 1 (одной) камеры\nнедостаточно для охвата всех зон ПВЗ, Исполнитель обязуется оборудовать ПВЗ необходимым количеством камер,\nохватывающим всю площадь ПВЗ;\n• при всех остальных условиях открытия ПВЗ — не менее 3 (трех) камер видеонаблюдения. Все камеры\nвидеонаблюдения должны осуществлять функцию видеофиксации. В случае если ПВЗ оборудован столом для\nподготовки Товара к возврату, Исполнитель обязуется установить камеру видеонаблюдения на таком столе, в\nсоответствии с техническими стандартами оборудования.']","Камеры видеонаблюдения должны охватывать всю площадь ПВЗ, включая:

- складскую зону,  
- клиентскую зону,  
- зоны осуществления приемки,  
- зоны отправки товаров,  
- зону подготовки товаров к возврату,  
- в том числе в возвратные коробки.

Также, если ПВЗ оборудован столом для подготовки товаров к возврату, на этом столе должна быть установлена камера видеонаблюдения, оборудованная дополнительным светом для видеофиксации действий с товарами."
"Какие сроки хранения данных с камер видеонаблюдения установлены для ПВЗ, расположенных на территории Республики Беларусь, в период действия Договора и после его прекращения?",['17'],"['Исполнитель, оказывающий услуги в ПВЗ, расположенном на территории Республики Беларусь, обеспечивает\nхранение данных с камер видеонаблюдения, расположенных в клиентских зонах, а также записи монитора\nкомпьютера сотрудника Исполнителя, в облачном хранилище провайдера видеонаблюдения, используя\nвидеосервисы, которые представлены в Регламенте Состояния ПВЗ, в течение не более 30 (тридцати) календарных\nдней в период срока действия Договора и не более 30 (тридцати) календарных дней с даты прекращения срока\nдействия Договора.', '9.1 Договора.9.1.3. Исполнитель обеспечивает хранение данных скамер видеонаблюдения в ПВЗ, а также записимонитора компьютера сотрудника Исполнителя воблачном хранилище провайдера видеонаблюдения втечение не менее 90 (девяноста) календарных дней впериод действия Договора, а также в срок не менее 90(девяноста) календарных дней с даты прекращениядействия Договора, используя видеосервисы,представленные в Регламенте состояния ПВЗ.Исполнитель, оказывающий услуги в ПВЗ,расположенном на территории Республики Беларусь,', 'Исполнитель, оказывающий услуги в ПВЗ, расположенном на территории Республики Беларусь, обеспечивает\nхранение данных с камер видеонаблюдения, расположенных в клиентских зонах, а также записи монитора\nкомпьютера сотрудника Исполнителя, в облачном хранилище провайдера видеонаблюдения, используя\nвидеосервисы, которые представлены в Регламенте Состояния ПВЗ, в течение не более 30 (тридцати) календарных\nдней в период срока действия Договора и не более 30 (тридцати) календарных дней с даты прекращения срока\nдействия Договора.\n9.1.4. Исполнитель обязан проверять ежедневно до начала работы и приема/обработки Товаров работу всех\nкамер видеонаблюдения, которые всегда должны быть подключены к электросети и сети Интернет, и корректность\nданных на видеозаписи (дата и время), которые должны соответствовать реальным дате и времени, указанным на\nПортале.\n9.1.5. Допускается использование только одного провайдера сервиса видеонаблюдения для одного ПВЗ.\n\n9.1.6.', '9.1 Договора.9.1.3. Исполнитель обеспечивает хранение данных скамер видеонаблюдения в ПВЗ, а также записимонитора компьютера сотрудника Исполнителя воблачном хранилище провайдера видеонаблюдения втечение не менее 90 (девяноста) календарных дней впериод действия Договора, а также в срок не менее 90(девяноста) календарных дней с даты прекращениядействия Договора, используя видеосервисы,представленные в Регламенте состояния ПВЗ.Исполнитель, оказывающий услуги в ПВЗ,расположенном на территории Республики Беларусь,обеспечивает хранение данных с камервидеонаблюдения, расположенных в клиентских зонах,а также записи монитора компьютера сотрудникаИсполнителя, в облачном хранилище провайдеравидеонаблюдения, используя видеосервисы, которые\nЗа каждое выявленное нарушение –10 000 (десять тысяч) российскихрублей.', '9.1 Договора.\n9.1.3. Исполнитель обеспечивает хранение данных с камер видеонаблюдения в ПВЗ, а также записи монитора\nкомпьютера сотрудника Исполнителя в облачном хранилище провайдера видеонаблюдения в течение не менее 90\n(девяноста) календарных дней в период действия Договора, а также в срок не менее 90 (девяноста) календарных\nдней с даты прекращения действия Договора, используя видеосервисы, представленные в Регламенте состояния\nПВЗ.', 'Камеры должны охватывать всю площадь ПВЗ, складскую и клиентскую зоны, зоны осуществления приемки,\nотправки Товаров, подготовки Товаров к возврату, в том числе в Возвратные коробки. Стороны согласовали, что стол\nподготовки Товаров к возврату — это стол, оборудованный камерой и дополнительным светом для видеофиксации\nдействий с Товарами. Все оборудование крепится к столу посредством специального кронштейна.\n9.1.2. Исполнитель обязуется подключить инструмент (программу для ЭВМ) для записи монитора сотрудника\nИсполнителя, который предоставляется провайдерами видеонаблюдения согласно п. 9.1 Договора.\n9.1.3. Исполнитель обеспечивает хранение данных с камер видеонаблюдения в ПВЗ, а также записи монитора\nкомпьютера сотрудника Исполнителя в облачном хранилище провайдера видеонаблюдения в течение не менее 90\n(девяноста) календарных дней в период действия Договора, а также в срок не менее 90 (девяноста) календарных\nдней с даты прекращения действия Договора, используя видеосервисы, представленные в Регламенте состояния\nПВЗ.', 'а также в срок не менее 90(девяноста) календарных дней с даты прекращениядействия Договора, используя видеосервисы,представленные в Регламенте состояния ПВЗ.Исполнитель, оказывающий услуги в ПВЗ,расположенном на территории Республики Беларусь,', '№строки №разделаили пп.Договора\nДоговор ОТВЕТСТВЕННОСТЬ / РАЗМЕРШТРАФОВ\nпредставлены в Регламенте Состояния ПВЗ, в течениене более 30 (тридцати) календарных дней в периодсрока действия Договора и не более 30 (тридцати)календарных дней с даты прекращения срока действияДоговора.9.1.4. Исполнитель обязан проверять ежедневно доначала работы и приема/обработки Товаров работувсех камер видеонаблюдения, которые всегда должныбыть подключены к электросети и сети Интернет, икорректность данных на видеозаписи (дата и время),которые должны соответствовать реальной дате ивремени, указанной на Портале.9.1.6.', 'за исключением ПВЗ, расположенных на\nтерритории Республики Беларусь, для которых минимальная глубина архива 30 (тридцать) дней только для камеры в\nклиентской зоне;\n• Минимальное качество хранения записи с разрешением 1280х720 и 16 кадров в секунду (fps);', 'посредством передачи сведений,\nсодержащих адрес электронного ресурса в сети Интернет (ссылка), согласно установленным срокам хранения\nвидеозаписи, с момента начала оказания Услуг в ПВЗ (активации ПВЗ), и до окончания срока действия Договора,']","Для ПВЗ, расположенных на территории Республики Беларусь, сроки хранения данных с камер видеонаблюдения установлены следующим образом:

- **В период действия Договора** — **не менее 90 календарных дней**;  
- **С даты прекращения действия Договора** — **не менее 90 календарных дней**.

Это указано в пункте 9.1.3 Договора:  
«Исполнитель обеспечивает хранение данных с камер видеонаблюдения в ПВЗ, а также записи монитора компьютера сотрудника Исполнителя в облачном хранилище провайдера видеонаблюдения в течение не менее 90 (девяноста) календарных дней в период действия Договора, а также в срок не менее 90 (девяноста) календарных дней с даты прекращения действия Договора, используя видеосервисы, представленные в Регламенте состояния ПВЗ».

**Ответ:**  
В период действия Договора — не менее 90 календарных дней; после прекращения Договора — не менее 90 календарных дней."
Какой срок у Исполнителя на предоставление видеоматериалов с камер видеонаблюдения после получения запроса Заказчика?,['18'],"['при которых у Заказчика будет отсутствовать доступ к данным с камер видеонаблюдения,\nИсполнитель обязуется в течение 3 (трех) часов с момента получения запроса Заказчика предоставить\nвидеоматериалы с камер видеонаблюдения, установленных на ПВЗ, за запрашиваемый Заказчиком период времени.', 'В случае неисполнения или ненадлежащегоисполнения Исполнителем пунктов 9.1, 9.2, 9.3Договора, а также в случае технического сбоя в работекамер видеонаблюдения или при наступлении любыхиных обстоятельств, при которых у Заказчика будетотсутствовать доступ к данным с камервидеонаблюдения, Исполнитель обязуется в течение 3(трех) часов с момента получения запроса Заказчикапредоставить видеоматериалы с камервидеонаблюдения, установленных на ПВЗ, зазапрашиваемый Заказчиком период времени.9.2.1.', '9.2. В случае неисполнения или ненадлежащего исполнения Исполнителем пунктов 9.1, 9.2, 9.3 Договора, а\nтакже в случае технического сбоя в работе камер видеонаблюдения или при наступлении любых иных\nобстоятельств, при которых у Заказчика будет отсутствовать доступ к данным с камер видеонаблюдения,\nИсполнитель обязуется в течение 3 (трех) часов с момента получения запроса Заказчика предоставить\nвидеоматериалы с камер видеонаблюдения, установленных на ПВЗ, за запрашиваемый Заказчиком период времени.\n9.2.1.', '6.4. Исполнитель обязуется по требованию Заказчика предоставить видеоматериалы с камер видеонаблюдения,\nустановленных на ПВЗ, в течение 6 (шести) часов с момента направления требования Исполнителю за\nзапрашиваемый Заказчиком период времени.\n6.4.1.', '9.1.10. Исполнитель обязуется совершать все действия с Товаром исключительно под камерами\nвидеонаблюдения в ПВЗ, обеспечивая возможность отследить Товар с момента его приемки и до момента его\nвозврата, выдачи или при совершении подготовки Товаров к возврату, в случаях, когда ПВЗ оборудован столом для\nподготовки Товаров к возврату.\n9.2. В случае неисполнения или ненадлежащего исполнения Исполнителем пунктов 9.1, 9.2, 9.3 Договора, а\nтакже в случае технического сбоя в работе камер видеонаблюдения или при наступлении любых иных\nобстоятельств, при которых у Заказчика будет отсутствовать доступ к данным с камер видеонаблюдения,\nИсполнитель обязуется в течение 3 (трех) часов с момента получения запроса Заказчика предоставить\nвидеоматериалы с камер видеонаблюдения, установленных на ПВЗ, за запрашиваемый Заказчиком период времени.\n9.2.1. Запрос о предоставлении видеоматериалов с камер видеонаблюдения ПВЗ может быть направлен\nИсполнителю любым доступным способом, в том числе через ЛК Исполнителя, предусмотренным условиями\nДоговора.\n9.2.2.', 'Исполнитель обязуется совершать все действияс Товаром исключительно под камерамивидеонаблюдения в ПВЗ, обеспечивая возможностьотследить Товар с момента его приемки и до моментаего возврата, выдачи или при совершении подготовкиТоваров к возврату, в случаях, когда ПВЗ оборудованстолом для подготовки Товаров к возврату.9.2. В случае неисполнения или ненадлежащегоисполнения Исполнителем пунктов 9.1, 9.2, 9.3Договора, а также в случае технического сбоя в работекамер видеонаблюдения или при наступлении любыхиных обстоятельств, при которых у Заказчика будетотсутствовать доступ к данным с камервидеонаблюдения, Исполнитель обязуется в течение 3(трех) часов с момента получения запроса Заказчикапредоставить видеоматериалы с камервидеонаблюдения, установленных на ПВЗ, зазапрашиваемый Заказчиком период времени.9.2.1. Запрос о предоставлении видеоматериалов скамер видеонаблюдения ПВЗ может быть направленИсполнителю любым доступным способом, в том числечерез ЛК Исполнителя, предусмотренным условиямиДоговора.9.2.2.', '31. 6.4.6.4.1. Исполнитель обязуется по требованию Заказчикапредоставить видеоматериалы с камервидеонаблюдения, установленных на ПВЗ, втечение 6 (шести) часов с момента направлениятребования Исполнителю за запрашиваемыйЗаказчиком период времени.6.4.1.', '6.4. Исполнитель обязуется потребованию Заказчика предоставитьвидеоматериалы с камервидеонаблюдения, установленных наПВЗ, в течение 6 (шести) часов смомента направления требованияИсполнителю за запрашиваемыйЗаказчиком период времени.6.4.1. Заказчик вправе запрашивать уИсполнителя видеозаписи с камервидеонаблюдения и фотографии вотношении Товаров, указанных вПоручении, подтверждающие любыефакты обработки таких Товаров вконкретном ПВЗ.', '6.4. Исполнитель обязуется потребованию Заказчика предоставитьвидеоматериалы с камервидеонаблюдения, установленных наПВЗ, в течение 6 (шести) часов смомента направления требованияИсполнителю за запрашиваемыйЗаказчиком период времени.6.4.1.', '6.4. Исполнитель обязуется потребованию Заказчика предоставитьвидеоматериалы с камервидеонаблюдения, установленных наПВЗ, в течение 6 (шести) часов смомента направления требованияИсполнителю за запрашиваемыйЗаказчиком период времени.6.4.1. Заказчик вправе запрашивать уИсполнителя видеозаписи с камервидеонаблюдения и фотографии вотношении Товаров, указанных вПоручении, подтверждающие любыефакты обработки таких Товаров вконкретном ПВЗ. Исполнитель обязанпредоставить запрошенныевидеозаписи и/или фотографии втечение 48 (сорока восьми) часов смомента направления Заказчикомзапроса.\n32. 6.6. Исполнитель обязуется не допускать накопления,нагромождения в ПВЗ посторонних предметов имусора. Исполнитель вправе размещать натерритории Клиентской зоны ПВЗ Возвратныекоробки с Товаром и вторсырье (отходыпроизводства и потребления: бумага и картон и т.п.)в собранном, сложенном виде, предназначенноедля возврата Заказчику.Заказчик вправе проводить проверки выполнениятребований данного пункта по своей инициативеили на основании жалоб Клиентов.']","Срок у Исполнителя на предоставление видеоматериалов с камер видеонаблюдения после получения запроса Заказчика — **3 часа**.

Этот срок указан в нескольких пунктах контекста, включая пункты 9.2, 9.2.1, 9.2.2, а также в других формулировках, где говорится о предоставлении видеоматериалов в течение 3 часов с момента получения запроса при наступлении определённых обстоятельств (включая технические сбои или отсутствие доступа к данным).

Однако в пункте 6.4 указан срок **6 часов** — но он относится к другому случаю: предоставлению видеоматериалов **по требованию Исполнителю** (то есть Заказчик направляет запрос Исполнителю), а не по запросу Заказчика к Исполнителю.

Вопрос касается **срока после получения запроса Заказчиком**, и именно в таких случаях (при отсутствии доступа к данным или технических сбоях) Исполнитель обязан предоставить материалы **в течение 3 часов**.

**Ответ: 3 часа.**"
Каким образом Исполнитель обязуется идентифицировать камеры ПВЗ?,['18'],"['Исполнитель обязуется предоставитьвозможность идентифицировать камеры ПВЗ по ID(например, путем присвоения камерам названия в виде:«ID Исполнителя / № камеры / наименование зоны»,как, например, «ID-1 – складская зона», «ID-2 –клиентская зона», «ID-3 – рабочий стол СотрудникаПВЗ», «ID-4 – стол подготовки Товаров к возврату», атакже сменить название группы камер на ID ПВЗ).9.1.10.', 'Исполнитель обязуется предоставитьвозможность идентифицировать камеры ПВЗ по ID(например, путем присвоения камерам названия в виде:«ID Исполнителя / № камеры / наименование зоны»,как, например, «ID-1 – складская зона», «ID-2 –клиентская зона»,', '9.1.9. Исполнитель обязуется предоставить возможность идентифицировать камеры ПВЗ по ID (например,\nпутем присвоения камерам названия в виде: «ID Исполнителя / № камеры / наименование зоны», как, например, «ID-\n1 — складская зона», «ID-2 — клиентская зона», «ID-3 — рабочий стол Сотрудника ПВЗ», «ID-4 — стол подготовки\nТоваров к возврату», а также сменить название группы камер на ID ПВЗ).\n9.1.10.', '9.1.9. Исполнитель обязуется предоставить возможность идентифицировать камеры ПВЗ по ID (например,\nпутем присвоения камерам названия в виде: «ID Исполнителя / № камеры / наименование зоны», как, например, «ID-\n1 — складская зона», «ID-2 — клиентская зона»,', 'Исполнитель обязан придерживаться этическихнорм и делового стиля общения, уважать права исвободы, честь, достоинство и деловую репутациюЗаказчика, Клиентов и третьих лиц.\n\n№строки №разделаили пп.Договора\nДоговор ОТВЕТСТВЕННОСТЬ / РАЗМЕРШТРАФОВ\n20. 9.1.5,9.1.7,9.1.9,9.1.10, 9.2.\nНарушение Исполнителем любого из или несколькихобязательств, указанных в следующих пунктах иподпунктов:9.1.5. Допускается использование только одногопровайдера сервиса видеонаблюдения для одного ПВЗ.9.1.7. Исполнитель предоставляет Заказчику черезПортал актуальные данные для входа в личный кабинетпользователя выбранного видеосервиса (логин,пароль).9.1.9. Исполнитель обязуется предоставитьвозможность идентифицировать камеры ПВЗ по ID(например, путем присвоения камерам названия в виде:«ID Исполнителя / № камеры / наименование зоны»,как, например, «ID-1 – складская зона», «ID-2 –клиентская зона», «ID-3 – рабочий стол СотрудникаПВЗ», «ID-4 – стол подготовки Товаров к возврату», атакже сменить название группы камер на ID ПВЗ).9.1.10.', '9.1.8. Исполнитель посредством программного интерфейса взаимодействия (API) предоставляет Заказчику\nдоступ к сервисам облачного хранилища в Личном кабинете путем входа через токен либо другим доступным\nспособом (согласно специальным инструкциям, размещенным у каждого видеосервиса из Регламента состояния\nПВЗ) с возможностью обрабатывать, копировать и сохранять видеозаписи с камер видеонаблюдения в ПВЗ.\n9.1.9. Исполнитель обязуется предоставить возможность идентифицировать камеры ПВЗ по ID (например,\nпутем присвоения камерам названия в виде: «ID Исполнителя / № камеры / наименование зоны», как, например, «ID-\n1 — складская зона», «ID-2 — клиентская зона», «ID-3 — рабочий стол Сотрудника ПВЗ», «ID-4 — стол подготовки\nТоваров к возврату», а также сменить название группы камер на ID ПВЗ).\n9.1.10.', 'Исполнитель обязуется оборудовать ПВЗсистемой видеонаблюдения, соответствующейтехническим требованиям, указанным в Регламентесостояния ПВЗ (Приложение № 3), и подключитьсистему к провайдеру облачного видеонаблюдения,соответствующего техническим требованиям, которыеразмещены на сайте https://pvz.wb.ru/video-connection Исполнитель обязуется оборудовать ПВЗ:- при упрощенных условиях открытия ПВЗ – 1 (одной)камерой видеонаблюдения, которая должна охватыватьвсе зоны ПВЗ, в том числе клиентскую и складскуюзоны полностью. В случае если 1 (одной) камерынедостаточно для охвата всех зон ПВЗ, то Исполнительобязуется оборудовать ПВЗ необходимым количествомкамер, охватывающих всю площадь ПВЗ;- при всех остальных условиях открытия ПВЗ – неменее 3 (трех) камер видеонаблюдения. Все камерывидеонаблюдения должны осуществлять функциювидеофиксации.', '6.2. Исполнитель обязан не реже 1 (одного) раза в 30 (тридцать) календарных дней проводить инвентаризацию\nТоваров в ПВЗ посредством Портала с обязательной фиксацией проводимой инвентаризации на камеры\nвидеонаблюдения.', 'Исполнитель обязуется оборудовать ПВЗсистемой видеонаблюдения, соответствующейтехническим требованиям, указанным в Регламентесостояния ПВЗ (Приложение № 3), и подключитьсистему к провайдеру облачного видеонаблюдения,соответствующего техническим требованиям, которыеразмещены на сайте https://pvz.wb.ru/video-connection Исполнитель обязуется оборудовать ПВЗ:- при упрощенных условиях открытия ПВЗ – 1 (одной)камерой видеонаблюдения, которая должна охватыватьвсе зоны ПВЗ, в том числе клиентскую и складскуюзоны полностью.', '9. Видеонаблюдение\n9.1.1. Исполнитель обязуется оборудовать ПВЗ системой видеонаблюдения, соответствующей техническим\nтребованиям, указанным в Регламенте состояния ПВЗ (Приложение № 3), и подключить систему к провайдеру\nоблачного видеонаблюдения, соответствующего техническим требованиям, которые размещены на сайте\nhttps://pvz.wb.ru/video-connection\nИсполнитель обязуется оборудовать ПВЗ:\n• при упрощенных условиях открытия ПВЗ — 1 (одной) камерой видеонаблюдения, которая должна\nохватывать все зоны ПВЗ, в том числе клиентскую и складскую зоны полностью. В случае если 1 (одной) камеры\nнедостаточно для охвата всех зон ПВЗ, Исполнитель обязуется оборудовать ПВЗ необходимым количеством камер,\nохватывающим всю площадь ПВЗ;\n• при всех остальных условиях открытия ПВЗ — не менее 3 (трех) камер видеонаблюдения. Все камеры\nвидеонаблюдения должны осуществлять функцию видеофиксации. В случае если ПВЗ оборудован столом для\nподготовки Товара к возврату, Исполнитель обязуется установить камеру видеонаблюдения на таком столе, в\nсоответствии с техническими стандартами оборудования.']","Исполнитель обязуется идентифицировать камеры ПВЗ путём присвоения им названий в виде: «ID Исполнителя / № камеры / наименование зоны», например: «ID-1 – складская зона», «ID-2 – клиентская зона», «ID-3 – рабочий стол Сотрудника ПВЗ», «ID-4 – стол подготовки Товаров к возврату», а также сменить название группы камер на ID ПВЗ."
"Какие действия должен предпринять Исполнитель в случае, если видеоматериалы, предоставленные Заказчику, не содержат информации о дате и времени записи или если время на камере не соответствует времени на Портале?",['18'],"['В случае отсутствия в представленныхИсполнителем видеоматериалах сведений о дате ивремени совершения видеозаписи и/или в случае, еслиустановленные на камере видеонаблюдения дата ивремя (часы и минуты) не соответствуют реальной датеили времени, указанной на Портале,', 'В случае отсутствия в представленныхИсполнителем видеоматериалах сведений о дате ивремени совершения видеозаписи и/или в случае, еслиустановленные на камере видеонаблюдения дата ивремя (часы и минуты) не соответствуют реальной датеили времени, указанной на Портале, видеоматериалысчитаются не предоставленными Исполнителем. Запервое нарушение – предупреждение;за каждое следующее выявленное нарушение – 10 000(десять тысяч) российских рублей.', 'В случае отсутствия в представленныхИсполнителем видеоматериалах сведений о дате ивремени совершения видеозаписи и/или в случае, еслиустановленные на камере видеонаблюдения дата ивремя (часы и минуты) не соответствуют реальной датеили времени, указанной на Портале, видеоматериалысчитаются не предоставленными Исполнителем. Запервое нарушение – предупреждение;за каждое следующее выявленное нарушение – 10 000(десять тысяч) российских рублей.\nЗа первое нарушение –предупреждение;за каждое следующее выявленноенарушение – 10 000 (десять тысяч)российских рублей.\n21. Раздел 10Нарушение Исполнителем обязательств,установленных разделом 10 Договора (Обработкаперсональных данных).\nЗа первое нарушение –предупреждение;за второе нарушение – 50 000(пятьдесят тысяч) российскихрублей;за каждое следующее выявленноенарушение – 100 000 (сто тысяч)российских рублей.\n\n№строки №разделаили пп.Договора\nПриложение №2 (Правила оказания услуг) ОТВЕТСТВЕННОСТЬ / РАЗМЕРШТРАФОВ\n22. 2.2, 2.2.1.2.2.', '9.2.2. В случае отсутствия в представленных Исполнителем видеоматериалах сведений о дате и времени\nсовершения видеозаписи и/или в случае, если установленные на камере видеонаблюдения дата и время (часы и\nминуты) не соответствуют реальной дате или времени, указанной на Портале, видеоматериалы считаются не\nпредоставленными Исполнителем.\n9.3. Исполнитель обеспечивает непрерывную работу камер видеонаблюдения в ПВЗ. В случае обнаружения\nнеисправности или некорректной работы системы видеонаблюдения Исполнитель обязуется устранить\nнеисправность (организовать устранение) в течение 30 (тридцати) минут с момента ее обнаружения.\n9.4. Меры по организации Исполнителем видеонаблюдения в ПВЗ, по хранению/обработке/копированию/\nпредоставлению Заказчику данных с камер видеонаблюдения, предпринимаются исключительно в целях исполнения\nДоговора, обеспечения сохранности Товаров, контроля за поступлением/передвижением Товаров в ПВЗ, а также в\nцелях безопасности лиц, находящихся в ПВЗ.\n9.4.1.', '9.2.2. В случае отсутствия в представленных Исполнителем видеоматериалах сведений о дате и времени\nсовершения видеозаписи и/или в случае, если установленные на камере видеонаблюдения дата и время (часы и\nминуты) не соответствуют реальной дате или времени, указанной на Портале,', '9.2.2. В случае отсутствия в представленных Исполнителем видеоматериалах сведений о дате и времени\nсовершения видеозаписи и/или в случае, если установленные на камере видеонаблюдения дата и время (часы и\nминуты) не соответствуют реальной дате или времени, указанной на Портале, видеоматериалы считаются не\nпредоставленными Исполнителем.\n9.3. Исполнитель обеспечивает непрерывную работу камер видеонаблюдения в ПВЗ.', 'Исполнитель обязан проверять ежедневно до начала работы и приема/обработки Товаров работу всех\nкамер видеонаблюдения, которые всегда должны быть подключены к электросети и сети Интернет, и корректность\nданных на видеозаписи (дата и время), которые должны соответствовать реальным дате и времени, указанным на\nПортале.', '14.8. Инвентаризация завершается:\n• в случае обработки Исполнителем всех числящихся в ПВЗ Товаров и установления Заказчиком соответствия\nфактического количества и состояния инвентаризируемых Товаров информации, отраженной о них на Портале;\n• по истечение срока проведения инвентаризации, установленного настоящим пунктом, Заказчик в\nодностороннем порядке, без предварительного уведомления Исполнителя производит удержание из вознаграждения\nИсполнителя сумму Стоимостей Товаров, не обработанных Исполнителем при проведении инвентаризации в\nустановленные сроки, либо в случае, если информация о фактическом количестве и состоянии инвентаризируемых\nТоваров не соответствует информации, отраженной о них на Портале.\n14.9. В случае непоступления Товаров в альтернативный ПВЗ, указанный Заказчиком, Исполнитель обязуется\nнезамедлительно с момента поступления запроса Заказчика предоставить записи с камер видеонаблюдения,\nподтверждающие формирование Возвратных коробок.', 'либо в случае, если информация о фактическом количестве и состоянии инвентаризируемых\nТоваров не соответствует информации, отраженной о них на Портале.\n14.9. В случае непоступления Товаров в альтернативный ПВЗ, указанный Заказчиком, Исполнитель обязуется\nнезамедлительно с момента поступления запроса Заказчика предоставить записи с камер видеонаблюдения,\nподтверждающие формирование Возвратных коробок.', 'В\nслучае если Исполнитель не проводит инвентаризацию Товаров в ПВЗ в установленные настоящим пунктом сроки,\nТовары, числящиеся на ПВЗ, начиная со дня, следующего за последним представленным для инвентаризации днем,\nсчитаются утраченными.\n6.3. Исполнитель обязан предоставлять Заказчику сведения о возможности оказания Услуг, в том числе:\n6.3.1. В течение 3 (трех) календарных дней с момента получения запроса посредством Портала предоставить\nЗаказчику качественные фотоснимки ПВЗ (в соответствии с требованиями и указаниями Заказчика) путем их\nразмещения (загрузки) на Портал по адресу и согласно инструкциям, указанным на Портале и в ЛК, или иным\nопределенным Заказчиком способом.\n\n6.3.2. Предоставить Заказчику полный доступ к камерам видеонаблюдения в ПВЗ в период действия Договора\nс правом обработки/хранения/копирования информации, полученной с камер видеонаблюдения.\n6.4. Исполнитель обязуется по требованию Заказчика предоставить видеоматериалы с камер видеонаблюдения,\nустановленных на ПВЗ, в течение 6 (шести) часов с момента направления требования Исполнителю за\nзапрашиваемый Заказчиком период времени.\n6.4.1.']","В случае отсутствия в представленных Исполнителем видеоматериалах сведений о дате и времени совершения видеозаписи и/или в случае, если установленные на камере видеонаблюдения дата и время (часы и минуты) не соответствуют реальной дате или времени, указанной на Портале, **videоматериалы считаются не предоставленными Исполнителем**.

**Последствия:**
- **Первое нарушение** — предупреждение;
- **Каждое последующее нарушение** — штраф в размере **10 000 российских рублей**.

Кроме того, Исполнитель обязан **ежедневно проверять** работу камер видеонаблюдения и **корректность данных на видеозаписи (дата и время)**, которые должны соответствовать реальным дате и времени, указанным на Портале."
Какие данные Исполнителя могут обрабатываться Заказчиком в рамках исполнения Договора?,['19'],"['Исполнитель гарантирует защиту и обеспечивает конфиденциальность персональных данных сотрудников\nЗаказчика, лиц, являющихся исполнителями Заказчика по договору гражданско-правового характера, и иных лиц,\nдействующих на стороне Заказчика, персональных данных Получателей , и персональных данных иных третьих лиц,\nкоторые стали известны Исполнителю в связи с исполнением Договора, а также обязуется осуществлять обработку\nэтих данных исключительно в целях, предусмотренных Договором, и с соблюдением Законодательства в области\nПерсональных данных.\n10.2. Для достижения целей, предусмотренных Договором, требуется обработка персональных данных\nИсполнителя в статусе индивидуального предпринимателя, а также, если применимо, представителей Исполнителя,\nсотрудников Исполнителя и иных третьих лиц, привлекаемых Исполнителем для исполнения Договора.', '10.5. Исполнитель уведомлен и понимает, что в целях оформления транспортных документов (в том числе\nтоварно-транспортных накладных) для организации перевозки Товаров, Заказчик вправе обрабатывать\nперсональные данные Исполнителя, сотрудников, и / или представителей Исполнителя, в том числе передавать\nуказанные персональные данные Перевозчикам.\n10.6. В отношении обработки персональных данных , осуществляемой Заказчиком в целях исполнения\nДоговора, а именно выполнения условий, указанных в разделе 4 Договора, Исполнитель является оператором\nперсональных данных в отношении представителей Исполнителя, сотрудников Исполнителя и иных третьих лиц,\nпривлекаемых Исполнителем для исполнения Договора, а также – в отношении Получателей, в том числе для целей\nвыполнения условий, указанных в разделе 9 Договора и поручает Заказчику осуществлять их обработку в\nнеобходимом для этого объёме, при этом:\n10.6.1. Исполнитель предоставляет заверения, имеющие существенное значение для заключения и\nдальнейшего исполнения Договора, о том, что Исполнителем обеспечены правовые основания для обработки\nперсональных данных субъектов, указанных в п.', '10.6. В отношении обработки персональных данных , осуществляемой Заказчиком в целях исполнения\nДоговора, а именно выполнения условий, указанных в разделе 4 Договора, Исполнитель является оператором\nперсональных данных в отношении представителей Исполнителя, сотрудников Исполнителя и иных третьих лиц,\nпривлекаемых Исполнителем для исполнения Договора, а также – в отношении Получателей, в том числе для целей\nвыполнения условий, указанных в разделе 9 Договора и поручает Заказчику осуществлять их обработку в\nнеобходимом для этого объёме, при этом:\n10.6.1.', 'Конкретный\nобъем необходимых и достаточных данных определяется функционалом Портала и Договором и включает\nследующие сведения: фамилия, имя, отчество (при наличии); данные, содержащиеся в доверенности или ином\nдокументе, подтверждающем право заключать Договор в соответствии с применимым законодательством; номер\nтелефона; User ID; адрес электронной почты; и иные данные, необходимые для заключения и исполнения Договора,\nвключая надлежащее определение стороны Договора. Обработка персональных данных Исполнителя и / или\nсотрудников Исполнителя осуществляется Заказчиком в соответствии с применимым законодательством и\nдокументом, определяющим политику Заказчика в отношении обработки персональных данных.\n10.3. В случае если Исполнитель направляет Заказчику уведомление о расторжении Договора в порядке,\nпредусмотренном Договором, обработка персональных данных, необходимая для предоставления Исполнителю\nфункциональных возможностей Портала, прекращается в порядке и в сроки, предусмотренные применимым\nзаконодательством.\n10.4. Заказчик вправе осуществлять передачу персональных данных третьим лицам, предоставляющим услуги\nИсполнителю по его выбору, когда это необходимо для обеспечения надлежащего исполнения Договора.\n10.5.', 'Исполнитель гарантирует защиту и обеспечивает конфиденциальность персональных данных сотрудников\nЗаказчика, лиц, являющихся исполнителями Заказчика по договору гражданско-правового характера, и иных лиц,\nдействующих на стороне Заказчика, персональных данных Получателей , и персональных данных иных третьих лиц,\nкоторые стали известны Исполнителю в связи с исполнением Договора, а также обязуется осуществлять обработку\nэтих данных исключительно в целях, предусмотренных Договором, и с соблюдением Законодательства в области\nПерсональных данных.\n10.2.', '10.6. В отношении обработки персональных данных , осуществляемой Заказчиком в целях исполнения\nДоговора, а именно выполнения условий, указанных в разделе 4 Договора, Исполнитель является оператором\nперсональных данных в отношении представителей Исполнителя, сотрудников Исполнителя и иных третьих лиц,', '10.6 для передачи персональных данных Заказчику и дальнейшей\nобработки Заказчиком для целей исполнения Договора, включая согласия субъектов на обработку и передачу их\nперсональных данных в рамках поручения на обработку данных (с правом дальнейшей передачи третьим лицам\n\n(субобработчикам) в целях исполнения Договора), если это предусмотрено Законодательством в области\nперсональных данных;\n10.6.2.', '16.5. Заказчик рассматривает заявку Исполнителя в течение 30 (тридцати) календарных дней и проверяет\nпредоставленные данные о новом Исполнителе, а также проверяет наличие задолженности Исполнителя и нового\nИсполнителя перед Заказчиком. Заказчик вправе отказать в согласовании заявки Исполнителя.\n17. Заключительные положения\n17.1. Отношения сторон по Договору, заключение, прекращение и исполнение Договора регулируются\nдействующим законодательством Российской Федерации.\n17.2. Направление юридически значимых сообщений:\n17.2.1.', '8.9. Стороны пришли к соглашению, что в целях исполнения обязательств Исполнителя, зарегистрированного на\nтерритории Российской Федерации, перед Заказчиком в рамках настоящего Договора, в том числе, но не\nограничиваясь в целях погашения любой задолженности по Договору, Исполнителю может быть предоставлена\nвозможность через Портал с использованием сервисов и функционала ПАО Сбербанк и/или АО «ТБанк»\nпредоставить по своему выбору указанным банкам заявление (поручение и/или иное распоряжение) на списание без\nдополнительных распоряжений Исполнителя (согласия/акцепта) денежных средств в любой сумме в рамках одного\nплатежного требования Заказчика с расчетного счета Исполнителя, открытого в ПАО Сбербанк и/или АО «ТБанк»,\nсоответственно.', '4.2. Каждая из Сторон вправе исполнять условия Договора как самостоятельно, так и с привлечением любых\nтретьих лиц, отвечая при этом перед другой Стороной за действия привлеченных третьих лиц, как за свои\nсобственные.\n5. Права и обязательства Исполнителя\nОбмен информацией между Сторонами\n5.1. Исполнитель обязуется предоставлять достоверные, актуальные сведения о себе и/или сотрудниках (в том\nчисле, но не ограничиваясь: название организации, номер регистрации в качестве налогоплательщика, телефон,\nэлектронная почта), привязанных к Личному кабинету Исполнителя, а также обязуется обеспечить возможность\nтелефонной связи с Исполнителем в ПВЗ согласно сведениям, предоставленным в ЛК, в часы работы ПВЗ.\n5.2. Исполнитель обязуется предоставлять в Личном кабинете достоверные данные о характеристиках ПВЗ:\nадрес, площадь помещения, количество сотрудников Исполнителя в ПВЗ и др.\n5.3. При оказании Услуг Исполнитель обязуется использовать для работы только Портал и вести учет всех\nдействий в Личном кабинете в соответствии с Инструкциями по работе с Порталом, соблюдая условия раздела 9\nДоговора (Видеонаблюдение).']","В рамках исполнения Договора Заказчик может обрабатывать следующие персональные данные Исполнителя и/или его сотрудников:

- фамилия, имя, отчество (при наличии);  
- данные, содержащиеся в доверенности или ином документе, подтверждающем право заключать Договор в соответствии с применимым законодательством;  
- номер телефона;  
- User ID;  
- адрес электронной почты;  
- иные данные, необходимые для заключения и исполнения Договора, включая надлежащее определение стороны Договора.

Эти данные обрабатываются Заказчиком в соответствии с применимым законодательством и документом, определяющим политику Заказчика в отношении обработки персональных данных."
В каком статусе Исполнитель может обрабатывать персональные данные в рамках исполнения Договора?,['19'],"['Для достижения целей, предусмотренных Договором, требуется обработка персональных данных\nИсполнителя в статусе индивидуального предпринимателя, а также, если применимо, представителей Исполнителя,\nсотрудников Исполнителя и иных третьих лиц, привлекаемых Исполнителем для исполнения Договора.', 'Исполнитель гарантирует защиту и обеспечивает конфиденциальность персональных данных сотрудников\nЗаказчика, лиц, являющихся исполнителями Заказчика по договору гражданско-правового характера, и иных лиц,\nдействующих на стороне Заказчика, персональных данных Получателей , и персональных данных иных третьих лиц,\nкоторые стали известны Исполнителю в связи с исполнением Договора, а также обязуется осуществлять обработку\nэтих данных исключительно в целях, предусмотренных Договором, и с соблюдением Законодательства в области\nПерсональных данных.\n10.2. Для достижения целей, предусмотренных Договором, требуется обработка персональных данных\nИсполнителя в статусе индивидуального предпринимателя, а также, если применимо, представителей Исполнителя,\nсотрудников Исполнителя и иных третьих лиц, привлекаемых Исполнителем для исполнения Договора.', '10.2. Для достижения целей, предусмотренных Договором, требуется обработка персональных данных\nИсполнителя в статусе индивидуального предпринимателя, а также, если применимо, представителей Исполнителя,\nсотрудников Исполнителя и иных третьих лиц, привлекаемых Исполнителем для исполнения Договора.', '10.5. Исполнитель уведомлен и понимает, что в целях оформления транспортных документов (в том числе\nтоварно-транспортных накладных) для организации перевозки Товаров, Заказчик вправе обрабатывать\nперсональные данные Исполнителя, сотрудников, и / или представителей Исполнителя, в том числе передавать\nуказанные персональные данные Перевозчикам.\n10.6. В отношении обработки персональных данных , осуществляемой Заказчиком в целях исполнения\nДоговора, а именно выполнения условий, указанных в разделе 4 Договора, Исполнитель является оператором\nперсональных данных в отношении представителей Исполнителя, сотрудников Исполнителя и иных третьих лиц,\nпривлекаемых Исполнителем для исполнения Договора, а также – в отношении Получателей, в том числе для целей\nвыполнения условий, указанных в разделе 9 Договора и поручает Заказчику осуществлять их обработку в\nнеобходимом для этого объёме, при этом:\n10.6.1. Исполнитель предоставляет заверения, имеющие существенное значение для заключения и\nдальнейшего исполнения Договора, о том, что Исполнителем обеспечены правовые основания для обработки\nперсональных данных субъектов, указанных в п.', '10.6. В отношении обработки персональных данных , осуществляемой Заказчиком в целях исполнения\nДоговора, а именно выполнения условий, указанных в разделе 4 Договора, Исполнитель является оператором\nперсональных данных в отношении представителей Исполнителя, сотрудников Исполнителя и иных третьих лиц,\nпривлекаемых Исполнителем для исполнения Договора, а также – в отношении Получателей, в том числе для целей\nвыполнения условий, указанных в разделе 9 Договора и поручает Заказчику осуществлять их обработку в\nнеобходимом для этого объёме, при этом:\n10.6.1.', '10.6. В отношении обработки персональных данных , осуществляемой Заказчиком в целях исполнения\nДоговора, а именно выполнения условий, указанных в разделе 4 Договора, Исполнитель является оператором\nперсональных данных в отношении представителей Исполнителя, сотрудников Исполнителя и иных третьих лиц,', 'Исполнитель гарантирует защиту и обеспечивает конфиденциальность персональных данных сотрудников\nЗаказчика, лиц, являющихся исполнителями Заказчика по договору гражданско-правового характера, и иных лиц,\nдействующих на стороне Заказчика, персональных данных Получателей , и персональных данных иных третьих лиц,\nкоторые стали известны Исполнителю в связи с исполнением Договора, а также обязуется осуществлять обработку\nэтих данных исключительно в целях, предусмотренных Договором, и с соблюдением Законодательства в области\nПерсональных данных.\n10.2.', '9.4.4. Исполнитель обязан придерживаться этических норм и делового стиля общения, уважать права и\nсвободы, честь, достоинство и деловую репутацию Заказчика, Клиентов и третьих лиц.\n10. Обработка персональных данных\nВ отношении обработки Персональных данных , осуществляемой в рамках заключения Договора и дальнейшего\nисполнения обязательств по Договору, Стороны договорились о следующем:\n10.1.', 'Обработка персональных данных Исполнителя и / или\nсотрудников Исполнителя осуществляется Заказчиком в соответствии с применимым законодательством и\nдокументом, определяющим политику Заказчика в отношении обработки персональных данных.\n10.3. В случае если Исполнитель направляет Заказчику уведомление о расторжении Договора в порядке,\nпредусмотренном Договором, обработка персональных данных, необходимая для предоставления Исполнителю\nфункциональных возможностей Портала, прекращается в порядке и в сроки, предусмотренные применимым\nзаконодательством.\n10.4.', '10.5. Исполнитель уведомлен и понимает, что в целях оформления транспортных документов (в том числе\nтоварно-транспортных накладных) для организации перевозки Товаров, Заказчик вправе обрабатывать\nперсональные данные Исполнителя, сотрудников, и / или представителей Исполнителя,']","Исполнитель может обрабатывать персональные данные в статусе индивидуального предпринимателя, а также, если применимо, представителей Исполнителя, сотрудников Исполнителя и иных третьих лиц, привлекаемых Исполнителем для исполнения Договора."
"Какие действия Исполнителя могут быть ограничены в связи с обработкой персональных данных, и как это связано с выполнением условий Договора?",['19'],"['Исполнитель гарантирует защиту и обеспечивает конфиденциальность персональных данных сотрудников\nЗаказчика, лиц, являющихся исполнителями Заказчика по договору гражданско-правового характера, и иных лиц,\nдействующих на стороне Заказчика, персональных данных Получателей , и персональных данных иных третьих лиц,\nкоторые стали известны Исполнителю в связи с исполнением Договора, а также обязуется осуществлять обработку\nэтих данных исключительно в целях, предусмотренных Договором, и с соблюдением Законодательства в области\nПерсональных данных.\n10.2. Для достижения целей, предусмотренных Договором, требуется обработка персональных данных\nИсполнителя в статусе индивидуального предпринимателя, а также, если применимо, представителей Исполнителя,\nсотрудников Исполнителя и иных третьих лиц, привлекаемых Исполнителем для исполнения Договора.', '10.6. В отношении обработки персональных данных , осуществляемой Заказчиком в целях исполнения\nДоговора, а именно выполнения условий, указанных в разделе 4 Договора, Исполнитель является оператором\nперсональных данных в отношении представителей Исполнителя, сотрудников Исполнителя и иных третьих лиц,\nпривлекаемых Исполнителем для исполнения Договора, а также – в отношении Получателей, в том числе для целей\nвыполнения условий, указанных в разделе 9 Договора и поручает Заказчику осуществлять их обработку в\nнеобходимом для этого объёме, при этом:\n10.6.1.', 'Исполнитель гарантирует защиту и обеспечивает конфиденциальность персональных данных сотрудников\nЗаказчика, лиц, являющихся исполнителями Заказчика по договору гражданско-правового характера, и иных лиц,\nдействующих на стороне Заказчика, персональных данных Получателей , и персональных данных иных третьих лиц,\nкоторые стали известны Исполнителю в связи с исполнением Договора, а также обязуется осуществлять обработку\nэтих данных исключительно в целях, предусмотренных Договором, и с соблюдением Законодательства в области\nПерсональных данных.\n10.2.', '10.6. В отношении обработки персональных данных , осуществляемой Заказчиком в целях исполнения\nДоговора, а именно выполнения условий, указанных в разделе 4 Договора, Исполнитель является оператором\nперсональных данных в отношении представителей Исполнителя, сотрудников Исполнителя и иных третьих лиц,', 'персональных данных Получателей , и персональных данных иных третьих лиц,\nкоторые стали известны Исполнителю в связи с исполнением Договора, а также обязуется осуществлять обработку\nэтих данных исключительно в целях, предусмотренных Договором, и с соблюдением Законодательства в области\nПерсональных данных.', '10.5. Исполнитель уведомлен и понимает, что в целях оформления транспортных документов (в том числе\nтоварно-транспортных накладных) для организации перевозки Товаров, Заказчик вправе обрабатывать\nперсональные данные Исполнителя, сотрудников, и / или представителей Исполнителя, в том числе передавать\nуказанные персональные данные Перевозчикам.\n10.6. В отношении обработки персональных данных , осуществляемой Заказчиком в целях исполнения\nДоговора, а именно выполнения условий, указанных в разделе 4 Договора, Исполнитель является оператором\nперсональных данных в отношении представителей Исполнителя, сотрудников Исполнителя и иных третьих лиц,\nпривлекаемых Исполнителем для исполнения Договора, а также – в отношении Получателей, в том числе для целей\nвыполнения условий, указанных в разделе 9 Договора и поручает Заказчику осуществлять их обработку в\nнеобходимом для этого объёме, при этом:\n10.6.1. Исполнитель предоставляет заверения, имеющие существенное значение для заключения и\nдальнейшего исполнения Договора, о том, что Исполнителем обеспечены правовые основания для обработки\nперсональных данных субъектов, указанных в п.', 'Конкретный\nобъем необходимых и достаточных данных определяется функционалом Портала и Договором и включает\nследующие сведения: фамилия, имя, отчество (при наличии); данные, содержащиеся в доверенности или ином\nдокументе, подтверждающем право заключать Договор в соответствии с применимым законодательством; номер\nтелефона; User ID; адрес электронной почты; и иные данные, необходимые для заключения и исполнения Договора,\nвключая надлежащее определение стороны Договора. Обработка персональных данных Исполнителя и / или\nсотрудников Исполнителя осуществляется Заказчиком в соответствии с применимым законодательством и\nдокументом, определяющим политику Заказчика в отношении обработки персональных данных.\n10.3. В случае если Исполнитель направляет Заказчику уведомление о расторжении Договора в порядке,\nпредусмотренном Договором, обработка персональных данных, необходимая для предоставления Исполнителю\nфункциональных возможностей Портала, прекращается в порядке и в сроки, предусмотренные применимым\nзаконодательством.\n10.4. Заказчик вправе осуществлять передачу персональных данных третьим лицам, предоставляющим услуги\nИсполнителю по его выбору, когда это необходимо для обеспечения надлежащего исполнения Договора.\n10.5.', 'Для достижения целей, предусмотренных Договором, требуется обработка персональных данных\nИсполнителя в статусе индивидуального предпринимателя, а также, если применимо, представителей Исполнителя,\nсотрудников Исполнителя и иных третьих лиц, привлекаемых Исполнителем для исполнения Договора.', '10.2. Для достижения целей, предусмотренных Договором, требуется обработка персональных данных\nИсполнителя в статусе индивидуального предпринимателя, а также, если применимо, представителей Исполнителя,\nсотрудников Исполнителя и иных третьих лиц, привлекаемых Исполнителем для исполнения Договора.', 'Обработка персональных данных Исполнителя и / или\nсотрудников Исполнителя осуществляется Заказчиком в соответствии с применимым законодательством и\nдокументом, определяющим политику Заказчика в отношении обработки персональных данных.\n10.3. В случае если Исполнитель направляет Заказчику уведомление о расторжении Договора в порядке,\nпредусмотренном Договором, обработка персональных данных, необходимая для предоставления Исполнителю\nфункциональных возможностей Портала, прекращается в порядке и в сроки, предусмотренные применимым\nзаконодательством.\n10.4.']","Действия Исполнителя, связанные с обработкой персональных данных, могут быть ограничены следующим образом:

Исполнитель **гарантирует защиту и обеспечивает конфиденциальность** персональных данных сотрудников Заказчика, лиц, являющихся исполнителями Заказчика, и иных лиц, действующих на стороне Заказчика, а также персональных данных Получателей и иных третьих лиц, которые стали известны Исполнителю в связи с исполнением Договора.

Он **обязуется осуществлять обработку этих данных исключительно в целях, предусмотренных Договором**, и **с соблюдением Законодательства в области персональных данных**.

Таким образом, действия Исполнителя, связанные с обработкой персональных данных, ограничиваются:

- **Целями, установленными Договором** (например, выполнением условий раздела 4 и 9 Договора);
- **Необходимостью соблюдения законодательства** в области персональных данных;
- **Отсутствием обработки данных вне рамок, предусмотренных Договором**.

Кроме того, в случае расторжения Договора в порядке, предусмотренном Договором, **обработка персональных данных, необходимая для предоставления Исполнителю функциональных возможностей Портала, прекращается**.

Это означает, что **обязанности по обработке персональных данных ограничиваются сроками и целями, установленными Договором**, и прекращаются при расторжении договора.

**Связь с выполнением условий Договора**:  
Ограничения в обработке персональных данных обеспечивают, что обработка данных осуществляется **только в целях, предусмотренных Договором**, что является необходимым условием для надлежащего исполнения условий Договора (например, выполнения условий раздела 4 и 9), а также для соблюдения правовых требований и конфиденциальности."
Какой срок установлен для предоставления подтверждения принятия мер и соблюдения требований по обработке персональных данных по запросу Исполнителя?,['20'],"['По запросу Исполнителя Заказчик обязуется в разумный срок предоставить подтверждение принятия мер\nи соблюдения требований, предусмотренных настоящим разделом;\n10.6.5.', '10.6 для передачи персональных данных Заказчику и дальнейшей\nобработки Заказчиком для целей исполнения Договора, включая согласия субъектов на обработку и передачу их\nперсональных данных в рамках поручения на обработку данных (с правом дальнейшей передачи третьим лицам\n\n(субобработчикам) в целях исполнения Договора), если это предусмотрено Законодательством в области\nперсональных данных;\n10.6.2. Заказчик обязуется соблюдать конфиденциальность персональных данных и обеспечивать\nбезопасность персональных данных при их обработке, а также принимать необходимые правовые , организационные\nи технические меры защиты персональных данных , в том числе посредством реализации применимых мер,\nпредусмотренных положениями соответствующего законодательства в области персональных данных;\n10.6.3. Заказчик вправе привлекать к обработке персональных данных третьих лиц (субобработчиков), когда\nэто необходимо для достижения целей, предусмотренных Договором;\n10.6.4. По запросу Исполнителя Заказчик обязуется в разумный срок предоставить подтверждение принятия мер\nи соблюдения требований, предусмотренных настоящим разделом;\n10.6.5.', 'В случае предъявления претензий или требований к Заказчику по вопросам обработки персональных\nданных, а также в любое время по запросу Заказчика Исполнитель обязуется предоставить подтверждение\nвыполнения обязательств, предусмотренных настоящим разделом, включая копии согласий (если применимо) или\nподтверждение наличия иных правовых оснований, предусмотренных Законодательством в области персональных\nданных , для обработки персональных данных субъектов, указанных в п. 10.6.\n10.7. Во всех случаях, не урегулированных п. 10.6.', 'В случае установления факта неправомерной или случайной передачи (предоставления,\nраспространения, доступа) персональных данных, повлекшей нарушение прав субъектов персональных данных и\nпроизошедшей по вине Заказчика, Заказчик обязуется уведомить об этом Исполнителя без необоснованной\nзадержки , в т.ч. посредством Портала;\n10.6.6. В случае поступления запросов от субъектов персональных данных или государственных органов по\nвопросам, связанным с обработкой персональных данных Заказчиком по настоящему Договору, Заказчик по\nпоручению Исполнителя обязуется рассмотреть их самостоятельно;\n10.6.7. В случае предъявления претензий или требований к Заказчику по вопросам обработки персональных\nданных, а также в любое время по запросу Заказчика Исполнитель обязуется предоставить подтверждение\nвыполнения обязательств, предусмотренных настоящим разделом, включая копии согласий (если применимо) или\nподтверждение наличия иных правовых оснований, предусмотренных Законодательством в области персональных\nданных , для обработки персональных данных субъектов, указанных в п. 10.6.\n10.7. Во всех случаях, не урегулированных п. 10.6.', 'По запросу Заказчика Исполнитель обязуется представить заверенные надлежащим образом копии документов,\nподтверждающих выполнение Исполнителем обязанности, предусмотренной настоящим пунктом, в течение 5 (Пяти)\nрабочих дней с даты получения указанного запроса.\n3.9.', 'В случае предъявления претензий или требований к Заказчику по вопросам обработки персональных\nданных, а также в любое время по запросу Заказчика Исполнитель обязуется предоставить подтверждение\nвыполнения обязательств, предусмотренных настоящим разделом,', 'Обработка персональных данных Исполнителя и / или\nсотрудников Исполнителя осуществляется Заказчиком в соответствии с применимым законодательством и\nдокументом, определяющим политику Заказчика в отношении обработки персональных данных.\n10.3. В случае если Исполнитель направляет Заказчику уведомление о расторжении Договора в порядке,\nпредусмотренном Договором, обработка персональных данных, необходимая для предоставления Исполнителю\nфункциональных возможностей Портала, прекращается в порядке и в сроки, предусмотренные применимым\nзаконодательством.\n10.4.', 'Обращение Исполнителя\nрассматривается в срок не позднее 3 (трех) календарных дней с момента получения Заказчиком обращения.', 'Исполнитель обязуется в случае поступления запросов и\nобращений от Физических лиц или государственных органов по вопросам, связанным с обработкой персональных\nданных в рамках настоящего Приложения, рассмотреть такие запросы и обращения самостоятельно.\n2.5. Заказчик обязуется обеспечивать конфиденциальность персональных данных и безопасность их обработки в\nсоответствии с требованиями Федерального закона от 27.07.2006 № 152-ФЗ «О персональных данных». Заказчик\nимеет право осуществлять обработку персональных данных Физических лиц самостоятельно, либо привлечь к\nобработке персональных данных третьих лиц.\n2.6. Стоимость Услуги WB Проверка учитывается при определении Вознаграждения и отражается на Балансе\nИсполнителя. Стоимость Услуги включает в себя НДС по ставке, установленной действующим законодательством\nРФ.\n2.7. Заказчик предоставит Исполнителю полностью соответствующие действующему законодательству Российской\nФедерации первичные документы: акт, счет-фактуру или УПД со статусом «1» в отношении оказанной Услуги, в сроки\nсогласно действующему законодательству.', 'Исполнитель гарантирует защиту и обеспечивает конфиденциальность персональных данных сотрудников\nЗаказчика, лиц, являющихся исполнителями Заказчика по договору гражданско-правового характера, и иных лиц,\nдействующих на стороне Заказчика, персональных данных Получателей , и персональных данных иных третьих лиц,\nкоторые стали известны Исполнителю в связи с исполнением Договора, а также обязуется осуществлять обработку\nэтих данных исключительно в целях, предусмотренных Договором, и с соблюдением Законодательства в области\nПерсональных данных.\n10.2. Для достижения целей, предусмотренных Договором, требуется обработка персональных данных\nИсполнителя в статусе индивидуального предпринимателя, а также, если применимо, представителей Исполнителя,\nсотрудников Исполнителя и иных третьих лиц, привлекаемых Исполнителем для исполнения Договора.']","Срок для предоставления подтверждения принятия мер и соблюдения требований по обработке персональных данных по запросу Исполнителя — **разумный срок**.

В контексте указано:  
> «По запросу Исполнителя Заказчик обязуется в разумный срок предоставить подтверждение принятия мер и соблюдения требований, предусмотренных настоящим разделом».

Таким образом, в тексте не указан конкретный срок (например, в днях), а лишь указан **разумный срок**, что является общим правовым термином.  

**Ответ: разумный срок.**"
Какие меры защиты персональных данных должны быть реализованы Заказчиком в соответствии с положениями оферты?,['20'],"['Заказчик обязуется соблюдать конфиденциальность персональных данных и обеспечивать\nбезопасность персональных данных при их обработке, а также принимать необходимые правовые , организационные\nи технические меры защиты персональных данных , в том числе посредством реализации применимых мер,\nпредусмотренных положениями соответствующего законодательства в области персональных данных;\n10.6.3. Заказчик вправе привлекать к обработке персональных данных третьих лиц (субобработчиков), когда\nэто необходимо для достижения целей, предусмотренных Договором;\n10.6.4.', 'Заказчик обязуется соблюдать конфиденциальность персональных данных и обеспечивать\nбезопасность персональных данных при их обработке, а также принимать необходимые правовые , организационные\nи технические меры защиты персональных данных , в том числе посредством реализации применимых мер,', '10.6 для передачи персональных данных Заказчику и дальнейшей\nобработки Заказчиком для целей исполнения Договора, включая согласия субъектов на обработку и передачу их\nперсональных данных в рамках поручения на обработку данных (с правом дальнейшей передачи третьим лицам\n\n(субобработчикам) в целях исполнения Договора), если это предусмотрено Законодательством в области\nперсональных данных;\n10.6.2. Заказчик обязуется соблюдать конфиденциальность персональных данных и обеспечивать\nбезопасность персональных данных при их обработке, а также принимать необходимые правовые , организационные\nи технические меры защиты персональных данных , в том числе посредством реализации применимых мер,\nпредусмотренных положениями соответствующего законодательства в области персональных данных;\n10.6.3. Заказчик вправе привлекать к обработке персональных данных третьих лиц (субобработчиков), когда\nэто необходимо для достижения целей, предусмотренных Договором;\n10.6.4. По запросу Исполнителя Заказчик обязуется в разумный срок предоставить подтверждение принятия мер\nи соблюдения требований, предусмотренных настоящим разделом;\n10.6.5.', '2.5. Заказчик обязуется обеспечивать конфиденциальность персональных данных и безопасность их обработки в\nсоответствии с требованиями Федерального закона от 27.07.2006 № 152-ФЗ «О персональных данных».', 'Исполнитель обязуется в случае поступления запросов и\nобращений от Физических лиц или государственных органов по вопросам, связанным с обработкой персональных\nданных в рамках настоящего Приложения, рассмотреть такие запросы и обращения самостоятельно.\n2.5. Заказчик обязуется обеспечивать конфиденциальность персональных данных и безопасность их обработки в\nсоответствии с требованиями Федерального закона от 27.07.2006 № 152-ФЗ «О персональных данных». Заказчик\nимеет право осуществлять обработку персональных данных Физических лиц самостоятельно, либо привлечь к\nобработке персональных данных третьих лиц.', 'Исполнитель гарантирует защиту и обеспечивает конфиденциальность персональных данных сотрудников\nЗаказчика, лиц, являющихся исполнителями Заказчика по договору гражданско-правового характера, и иных лиц,\nдействующих на стороне Заказчика, персональных данных Получателей , и персональных данных иных третьих лиц,\nкоторые стали известны Исполнителю в связи с исполнением Договора, а также обязуется осуществлять обработку\nэтих данных исключительно в целях, предусмотренных Договором, и с соблюдением Законодательства в области\nПерсональных данных.\n10.2.', 'Исполнитель гарантирует защиту и обеспечивает конфиденциальность персональных данных сотрудников\nЗаказчика, лиц, являющихся исполнителями Заказчика по договору гражданско-правового характера, и иных лиц,\nдействующих на стороне Заказчика, персональных данных Получателей , и персональных данных иных третьих лиц,\nкоторые стали известны Исполнителю в связи с исполнением Договора, а также обязуется осуществлять обработку\nэтих данных исключительно в целях, предусмотренных Договором, и с соблюдением Законодательства в области\nПерсональных данных.\n10.2. Для достижения целей, предусмотренных Договором, требуется обработка персональных данных\nИсполнителя в статусе индивидуального предпринимателя, а также, если применимо, представителей Исполнителя,\nсотрудников Исполнителя и иных третьих лиц, привлекаемых Исполнителем для исполнения Договора.', 'предусмотренных положениями соответствующего законодательства в области персональных данных;\n10.6.3. Заказчик вправе привлекать к обработке персональных данных третьих лиц (субобработчиков), когда\nэто необходимо для достижения целей, предусмотренных Договором;\n10.6.4.', 'Уполномоченный\n\nпредставитель Исполнителя, заполняющий заявку, также обязуется предоставить согласие на сбор и дальнейшую\nобработку персональных данных в целях рассмотрения заявки, заключения и исполнения настоящей Оферты.\n2.5. Заказчик уведомляет об акцепте заявки Исполнителя в порядке и в сроки, предусмотренные Офертой.\nДоговор считается заключенным Сторонами с даты одобрения Заказчиком заявки на открытие ПВЗ. Такое одобрение\nпризнается акцептом предложения Исполнителя заключить Договор.\n2.6. По запросу Заказчика Исполнитель обязуется предоставить дополнительное подтверждение о заключении\nДоговора в указанной Заказчиком форме, например, в форме подписанного Исполнителем заявления о\nприсоединении к Оферте или текста Оферты.\n2.7. Исполнитель признает, что использование им логина и пароля является надлежащей и достаточной\nидентификацией Исполнителя на Портале, подтверждением права совершать действия на Портале и является\nаналогом собственноручной подписи Исполнителя. Действия, совершенные с использованием логина и пароля\nИсполнителя, считаются совершенными самим Исполнителем.\n2.8.', '10.6. Договора , Стороны являются самостоятельными\nоператорами персональных данных, при этом каждая из Сторон обеспечивает конфиденциальность персональных\nданных, полученных от другой Стороны, соблюдение требований к обработке персональных данных, установленных\nЗаконодательством в области персональных данных и принятыми в его исполнение нормативными правовыми\nактами, и несет ответственность за принятие всех необходимых правовых, организационных и технических мер\nзащиты персональных данных от неправомерного или случайного доступа к ним, уничтожения, изменения,\nблокирования, копирования, распространения персональных данных, а также от иных неправомерных действий в\nотношении них\n11. Ответственность\n11.1. Стороны несут ответственность за неисполнение или ненадлежащее исполнение своих обязательств в\nсоответствии с условиями Договора и Приложениями к нему. Никакие иные меры ответственности, не\nпредусмотренные в Договоре и Приложениях к нему, не могут быть применены к отношениям Сторон.\n11.2.']","В соответствии с положениями оферты Заказчик обязан:

- соблюдать конфиденциальность и обеспечивать безопасность персональных данных при их обработке;  
- принимать необходимые правовые, организационные и технические меры защиты персональных данных;  
- в том числе реализовывать меры, предусмотренные законодательством в области персональных данных (в частности, Федеральным законом от 27.07.2006 № 152-ФЗ «О персональных данных»);  
- в случае запроса Исполнителя — в разумный срок предоставить подтверждение принятия мер и соблюдения требований, предусмотренных настоящим разделом;  
- привлекать к обработке персональных данных третьих лиц (субобработчиков) только в случае необходимости для достижения целей, предусмотренных Договором;  
- нести ответственность за неправомерный или случайный доступ к персональным данным, их уничтожение, изменение, блокирование, копирование, распространение и иные неправомерные действия.

Таким образом, меры защиты включают правовые, организационные и технические, а также соответствуют требованиям законодательства в области персональных данных."
"Какие последствия наступают для Исполнителя в случае нарушения заверений и гарантий, предусмотренных разделами 3 и 10 оферты?",['20'],"['11.3. В случае нарушения Исполнителем заверений и гарантий, предусмотренных условиями раздела 3, раздела\n10 Договора, Исполнитель обязуется возместить Заказчику убытки, связанные с таким нарушением, включая\nпонесенные Заказчиком расходы на оплату пени и штрафов,', '11.3. В случае нарушения Исполнителем заверений и гарантий, предусмотренных условиями раздела 3, раздела\n10 Договора, Исполнитель обязуется возместить Заказчику убытки, связанные с таким нарушением, включая\nпонесенные Заказчиком расходы на оплату пени и штрафов, наложенных органами государственной или\nмуниципальной власти, или расходы на удовлетворение требований третьих лиц, связанных с таким нарушением.\n11.4.', '11.2. В случае неисполнения Исполнителем денежных обязательств перед Заказчиком, предусмотренных\nДоговором, в том числе обязательств по возмещению убытков, Заказчик начисляет Исполнителю пени в размере\n0,1% (одна десятая процента) за каждый день просрочки от суммы просроченного денежного обязательства.\n11.3. В случае нарушения Исполнителем заверений и гарантий, предусмотренных условиями раздела 3, раздела\n10 Договора, Исполнитель обязуется возместить Заказчику убытки, связанные с таким нарушением, включая\nпонесенные Заказчиком расходы на оплату пени и штрафов, наложенных органами государственной или\nмуниципальной власти, или расходы на удовлетворение требований третьих лиц, связанных с таким нарушением.\n11.4. Заказчик не несет ответственности за косвенные убытки и упущенную выгоду Исполнителя, третьих лиц, в\nтом числе возникшие в связи с расторжением Договора.\n11.5. Исполнитель несет имущественную ответственность в виде возмещения убытков за утрату, недостачу или\nповреждение Товара в период с момента приемки Товара Исполнителем в ПВЗ и до момента вручения Товара\n\nПолучателю.', '5.10. Исполнитель обязуется не совершатьнедобросовестных действий, а также не следоватьнедобросовестному поведению (ни сам, ни через\nЗа первое выявленное нарушение –предупреждение;за каждое второе выявленное\n\n№строки №разделаили пп.Договора\nДоговор ОТВЕТСТВЕННОСТЬ / РАЗМЕРШТРАФОВ\nтретьих лиц), которое может причинить убытки илииным образом причинить вред иным Исполнителям,включая, но не ограничиваясь, в том числесистематическое:• намеренное оставление негативных отзывов и/илипроставление низких оценок иным Исполнителям сцелью понижения их рейтинга,• осуществление ложных (фейковых) заказов в ПВЗиных Исполнителей с целями, не связанными среальным намерением приобрести Товар,• и иных действий, результатом которых может явитьсяискусственное понижение Рейтинга иного Исполнителя,невозможность заказа товаров в ПВЗ иногоИсполнителя и другие негативные последствия.\nнарушение – 50 000 (пятьдесяттысяч) российских рублей;за каждое следующее выявленноенарушение – 100 000 (сто тысяч)российских рублей.\n7.', '5.10. Исполнитель обязуется не совершать недобросовестных действий, а также не следовать\nнедобросовестному поведению (ни сам, ни через третьих лиц), которое может причинить убытки или иным образом\nпричинить вред иным Исполнителям, включая, но не ограничиваясь, в том числе систематическое:\n• намеренное оставление негативных отзывов и/или проставление низких оценок иным Исполнителям с целью\nпонижения их рейтинга;\n• осуществление ложных (фейковых) заказов в ПВЗ иных Исполнителей с целями, не связанными с реальным\nнамерением приобрести Товар,\n• а также совершение иных действий, результатом которых могут явиться искусственное понижение Рейтинга\nиного Исполнителя, невозможность заказа товаров в ПВЗ иного Исполнителя и другие негативные последствия.\n5.11. Исполнитель обязуется не допускать несогласованное с Заказчиком прекращение оказания Услуг в ПВЗ, в\nтом числе без предупреждения Заказчика или с нарушением сроков, согласованных Сторонами при расторжении\nДоговора.\n5.12.', '5.10. Исполнитель обязуется не совершатьнедобросовестных действий, а также не следоватьнедобросовестному поведению (ни сам, ни через\nЗа первое выявленное нарушение –предупреждение;за каждое второе выявленное\n\n№строки №разделаили пп.Договора\nДоговор ОТВЕТСТВЕННОСТЬ / РАЗМЕРШТРАФОВ\nтретьих лиц), которое может причинить убытки илииным образом причинить вред иным Исполнителям,включая, но не ограничиваясь,', '5.10. Исполнитель обязуется не совершать недобросовестных действий, а также не следовать\nнедобросовестному поведению (ни сам, ни через третьих лиц), которое может причинить убытки или иным образом\nпричинить вред иным Исполнителям, включая, но не ограничиваясь, в том числе систематическое:\n• намеренное оставление негативных отзывов и/или проставление низких оценок иным Исполнителям с целью\nпонижения их рейтинга;\n• осуществление ложных (фейковых) заказов в ПВЗ иных Исполнителей с целями, не связанными с реальным\nнамерением приобрести Товар,', 'В случае снижения\nРейтинга ПВЗ Исполнителя ниже указанного Минимального значения рейтинга ПВЗ, Заказчик уведомляет\nИсполнителя через Личный кабинет об этом, а кроме того, наступают последствия, предусмотренные настоящим\nДоговором.\n1.23. Обеспечительный платеж — это единовременный платеж Исполнителя Заказчику в определенном\nДоговоре размере, который оплачивается Исполнителем во время подачи Исполнителем заявки на открытие ПВЗ.\nОбеспечительный платеж является гарантией выполнения Исполнителем обязательств п. 3.1.4 Договора.\n1.24.', '1.21. Маркетплейс Товар или Маркетплейс-короб — Товар или короб с Товарами, передаваемый в ПВЗ\nПродавцом, предназначенный для последующей передачи Исполнителем Перевозчику для доставки Заказчику или\nлицу, указанному Заказчиком или Получателю.\n1.22. Минимальное значение рейтинга ПВЗ — отображаемое в ЛК значение Рейтинга ПВЗ. В случае снижения\nРейтинга ПВЗ Исполнителя ниже указанного Минимального значения рейтинга ПВЗ, Заказчик уведомляет\nИсполнителя через Личный кабинет об этом, а кроме того, наступают последствия, предусмотренные настоящим\nДоговором.\n1.23. Обеспечительный платеж — это единовременный платеж Исполнителя Заказчику в определенном\nДоговоре размере, который оплачивается Исполнителем во время подачи Исполнителем заявки на открытие ПВЗ.\nОбеспечительный платеж является гарантией выполнения Исполнителем обязательств п. 3.1.4 Договора.\n1.24.', '5.10. Исполнитель обязуется не совершать недобросовестных действий, а также не следовать\nнедобросовестному поведению (ни сам, ни через третьих лиц), которое может причинить убытки или иным образом\nпричинить вред иным Исполнителям, включая, но не ограничиваясь,']","В случае нарушения Исполнителем заверений и гарантий, предусмотренных условиями раздела 3 и раздела 10 Договора, Исполнитель обязуется возместить Заказчику убытки, связанные с таким нарушением, включая понесённые Заказчиком расходы на оплату пени и штрафов, наложенных органами государственной или муниципальной власти, или расходы на удовлетворение требований третьих лиц, связанных с таким нарушением."
Какой срок установлен для оспаривания штрафа Исполнителем после уведомления?,['21'],"['12.1. Исполнитель посредством функционала Портала вправе оспорить полученный штраф за нарушение\nусловий Договора в соответствии с Приложением № 4 (Ответственность ПВЗ) к Договору в течение 7 (семи)\nкалендарных дней с момента уведомления Исполнителя путем размещения Заказчиком соответствующих сведений\nо нарушении обязательств Исполнителем в ЛК. В случае, если Исполнитель не предоставит в установленные\nДоговором и обучающим Порталом ( https://edtech.rwb.ru ) сроки видеоматериалы, а также документы, в том\nчисле, но не ограничиваясь выданные государственными органами по месту регистрации Сторон, контролирующими\nвопросы в области чрезвычайных ситуаций, подтверждающие невозможность исполнения обязанностей по Договору\nИсполнителем вследствие чрезвычайных обстоятельств, нарушение считается подтвержденным Исполнителем.\nОбращение Исполнителя рассматривается в срок, необходимый для полного и всестороннего рассмотрения всех\nобстоятельств нарушения, а также получения дополнительной информации и документов от Исполнителя при\nнеобходимости, о чем Заказчик уведомляет Исполнителя.', '12.1. Исполнитель посредством функционала Портала вправе оспорить полученный штраф за нарушение\nусловий Договора в соответствии с Приложением № 4 (Ответственность ПВЗ) к Договору в течение 7 (семи)\nкалендарных дней с момента уведомления Исполнителя путем размещения Заказчиком соответствующих сведений\nо нарушении обязательств Исполнителем в ЛК.', '12.1. Исполнитель посредством функционала Портала вправе оспорить полученный штраф за нарушение\nусловий Договора в соответствии с Приложением № 4 (Ответственность ПВЗ) к Договору в течение 7 (семи)\nкалендарных дней с момента уведомления Исполнителя путем размещения Заказчиком', 'После истечения указанного срока Исполнитель утрачивает право\nна оспаривание удержанной Заказчиком суммы. Обращение Исполнителя рассматривается в срок, необходимый для\nполного и всестороннего рассмотрения всех обстоятельств, а также получения дополнительной информации и\n\nдокументов от Исполнителя при необходимости, о чем Заказчик уведомляет Исполнителя. Максимальный срок\nрассмотрения в любом случае не может превышать 30 (тридцать) календарных дней.\n12.3.', 'посредством направления уведомления в ЛК.Общий срок прохождения Аудита ПВЗ не можетпревышать 7 (семи) календарных дней с датыполучения уведомления об Аудите ПВЗ в ЛКИсполнителя. Исполнитель обязуется предоставлять\nЗа невыполнение обязанности,предусмотренной п. 5.14. илинарушении сроков предоставленияматериалов и информации:выявленное впервые —предупреждение;за каждое следующее выявленноенарушение — штраф в размере 10000 (Десять тысяч) российскихрублей.', '11.6. Возмещение Исполнителем убытков и/или уплата неустойки (пени, штрафы) не освобождает его от\nустранения допущенных нарушений.\n12. Меры по урегулированию споров\nОспаривание штрафов и удержаний Исполнителем.\n12.1.', 'Штрафы применяются кИсполнителю каждые 7 (семь)календарных дней до датыснижения доли Подмен в ОборотеПВЗ до уровня менее 0,4% (ноляцелых четырех десятых процента) отОборота ПВЗ.Б) Ответственность/штрафприменяются в зависимости от долиЗависших Товаров в Обороте ПВЗ запоследние 30 (Тридцать)календарных дней, котораяучитывается Заказчиком, и еслисоставляет:\n\n№строки №разделаили пп.Договора\nДоговор ОТВЕТСТВЕННОСТЬ / РАЗМЕРШТРАФОВ\n(i) от 0,1% (ноля целых однойдесятых процента) включительно отОборота ПВЗ – предупреждение;(ii) от 0,2% (ноля целых двухдесятых процента) включительно отОборота ПВЗ – предупреждение, аЗаказчик вправе назначить в ПВЗИсполнителя внеочереднуюинвентаризацию, на проведениекоторой выделяется 72 (семьдесятдва) часа с момента назначения.', 'Вслучае непроведения вустановленные срокидополнительной инвентаризации наИсполнителя налагается штраф вразмере 10 000 рублей;(iii) от 0,4% (ноля целых четырехдесятых процента) включительно отОборота ПВЗ – предупреждение, аЗаказчик вправе ограничить выводденежных средств до 1 (одного) разав месяц, от даты превышенияИсполнителем доли ЗависшихТоваров до установленного даннымпунктом более низкого уровня поЗависшим Товарам;(iv) от 0,', 'посредством направления уведомления в ЛК.Общий срок прохождения Аудита ПВЗ не можетпревышать 7 (семи) календарных дней с датыполучения уведомления об Аудите ПВЗ в ЛКИсполнителя. Исполнитель обязуется предоставлять\nЗа невыполнение обязанности,предусмотренной п.', 'Вслучае непроведения вустановленные срокидополнительной инвентаризации наИсполнителя налагается штраф вразмере 10 000 рублей;(iii) от 0,4% (ноля целых четырехдесятых процента) включительно отОборота ПВЗ – предупреждение,']","Срок, установленный для оспаривания штрафа Исполнителем после уведомления, — **7 (семи) календарных дней** с момента уведомления Исполнителя путем размещения Заказчиком сведений о нарушении обязательств в Личном кабинете (ЛК)."
"Какие документы должен предоставить Исполнитель для оспаривания штрафа, связанного с чрезвычайными обстоятельствами?",['21'],"['12.1. Исполнитель посредством функционала Портала вправе оспорить полученный штраф за нарушение\nусловий Договора в соответствии с Приложением № 4 (Ответственность ПВЗ) к Договору в течение 7 (семи)\nкалендарных дней с момента уведомления Исполнителя путем размещения Заказчиком соответствующих сведений\nо нарушении обязательств Исполнителем в ЛК. В случае, если Исполнитель не предоставит в установленные\nДоговором и обучающим Порталом ( https://edtech.rwb.ru ) сроки видеоматериалы, а также документы, в том\nчисле, но не ограничиваясь выданные государственными органами по месту регистрации Сторон, контролирующими\nвопросы в области чрезвычайных ситуаций, подтверждающие невозможность исполнения обязанностей по Договору\nИсполнителем вследствие чрезвычайных обстоятельств, нарушение считается подтвержденным Исполнителем.\nОбращение Исполнителя рассматривается в срок, необходимый для полного и всестороннего рассмотрения всех\nобстоятельств нарушения, а также получения дополнительной информации и документов от Исполнителя при\nнеобходимости, о чем Заказчик уведомляет Исполнителя.', '12.3. При оспаривании штрафов и удержаний Исполнитель обязан предоставить Заказчику видеосъемку и/или\nфотографии в отношении того Товара, который Заказчиком признан как Товар с недостатками, при этом на\nвидеосъемке и/или фотографии должен быть зафиксирован процесс подготовки Товара для отправки Исполнителем,\nследующего в адрес Заказчика, без его повреждений. На видеосъемке и/или фотографии должны быть\nзафиксированы дата и время совершения видеозаписи и/или фотографии.\n12.4.', '12.3. При оспаривании штрафов и удержаний Исполнитель обязан предоставить Заказчику видеосъемку и/или\nфотографии в отношении того Товара, который Заказчиком признан как Товар с недостатками, при этом на\nвидеосъемке и/или фотографии должен быть зафиксирован процесс подготовки Товара для отправки Исполнителем,\nследующего в адрес Заказчика, без его повреждений. На видеосъемке и/или фотографии должны быть\nзафиксированы дата и время совершения видеозаписи и/или фотографии.\n12.4. В случае если Исполнитель не предоставит видеоматериалы и/или фотографии, подтверждающие\nнеобоснованность произведенного удержания в установленные Договором сроки, такое удержание считается\nподтверждёнными (признанным) Исполнителем.\n13. Блокировка ПВЗ\n13.1. Независимо от применения штрафов в соответствии с Приложением № 4 к Договору Заказчик в целях\nпресечения нарушения Исполнителем обязательств по Договору, в том числе на будущий период и/или длящихся\nнарушений и/или защиты прав третьих лиц, осуществляет Блокировку ПВЗ в нижеследующих случаях.', '12.1. Исполнитель посредством функционала Портала вправе оспорить полученный штраф за нарушение\nусловий Договора в соответствии с Приложением № 4 (Ответственность ПВЗ) к Договору в течение 7 (семи)\nкалендарных дней с момента уведомления Исполнителя путем размещения Заказчиком', '12.1. Исполнитель посредством функционала Портала вправе оспорить полученный штраф за нарушение\nусловий Договора в соответствии с Приложением № 4 (Ответственность ПВЗ) к Договору в течение 7 (семи)\nкалендарных дней с момента уведомления Исполнителя путем размещения Заказчиком соответствующих сведений\nо нарушении обязательств Исполнителем в ЛК.', '12.3. При оспаривании штрафов и удержаний Исполнитель обязан предоставить Заказчику видеосъемку и/или\nфотографии в отношении того Товара, который Заказчиком признан как Товар с недостатками,', '3.2. При Активации ПВЗ Исполнитель обязан предоставить правоустанавливающие документы на помещение\nЗаказчику, выписку из ЕГРН или технический план БТИ или иные документы.', 'ПЕРЕЧЕНЬ ШТРАФОВ:\n№строки №разделаили пп.Договора\nДоговор ОТВЕТСТВЕННОСТЬ / РАЗМЕРШТРАФОВ\n1. 5.1. Исполнитель обязуется предоставлять достоверные,актуальные сведения о себе и/или сотрудниках (в томчисле, но не ограничиваясь: название организации,номер регистрации в качестве налогоплательщика,телефон, электронная почта), привязанных к Личномукабинету Исполнителя, а также обязуется обеспечитьвозможность телефонной связи с Исполнителем в ПВЗсогласно сведениям, предоставленным в ЛК, в часыработы ПВЗ.\nЗа первое нарушение —предупреждение;за второе нарушение — 5 000 (пятьтысяч) российских рублей;за каждое следующее выявленноенарушение (в том числе:предоставление не верноготелефона, номер телефона недоступен для связи/необслуживается, Исполнитель неотвечает на звонки в течениерабочего дня) и последующие – 10000 (десять тысяч) российскихрублей.\n2. 5.2.', 'Исполнитель обязан предоставить Заказчику документы, подтверждающие\nналичие у Исполнителя права пользования помещением ПВЗ (собственности, аренды или на ином основании),\nоформленные или подписанные надлежащим образом;\n• Исполнитель заверяет, что Обеспечительный платеж будет произведен им лично или лицом,\nуполномоченным на совершение указанного платежа (участник, единоличный исполнительный орган, работник или\nиное). Настоящее заверение для Заказчика является заверением, имеющим существенное значение.\n3.1.2.', 'Исполнитель обязан предоставить Заказчику документы, подтверждающие\nналичие у Исполнителя права пользования помещением ПВЗ (собственности, аренды или на ином основании),\nоформленные или подписанные надлежащим образом;\n• Исполнитель заверяет, что Обеспечительный платеж будет произведен им лично или лицом,']","Для оспаривания штрафа, связанного с чрезвычайными обстоятельствами, Исполнитель **должен предоставить документы, подтверждающие невозможность исполнения обязанностей по Договору вследствие чрезвычайных обстоятельств**.

Конкретно, согласно контексту, в этом случае речь идёт о **документах, выданных государственными органами по месту регистрации Сторон, контролирующими вопросы в области чрезвычайных ситуаций**, подтверждающих невозможность исполнения обязанностей.

Таким образом, **документы, которые должен предоставить Исполнитель**, — это:

> **Документы, выданные государственными органами по месту регистрации Сторон, контролирующими вопросы в области чрезвычайных ситуаций, подтверждающие невозможность исполнения обязанностей по Договору вследствие чрезвычайных обстоятельств.**

Эти документы должны быть представлены в установленные Договором и обучающим Порталом сроки. В противном случае нарушение считается подтверждённым Исполнителем."
"Какие сроки установлены для рассмотрения обращения Исполнителя по оспариванию штрафа, и каков максимальный срок, в течение которого это может быть сделано?",['21'],"['12.1. Исполнитель посредством функционала Портала вправе оспорить полученный штраф за нарушение\nусловий Договора в соответствии с Приложением № 4 (Ответственность ПВЗ) к Договору в течение 7 (семи)\nкалендарных дней с момента уведомления Исполнителя путем размещения Заказчиком соответствующих сведений\nо нарушении обязательств Исполнителем в ЛК. В случае, если Исполнитель не предоставит в установленные\nДоговором и обучающим Порталом ( https://edtech.rwb.ru ) сроки видеоматериалы, а также документы, в том\nчисле, но не ограничиваясь выданные государственными органами по месту регистрации Сторон, контролирующими\nвопросы в области чрезвычайных ситуаций, подтверждающие невозможность исполнения обязанностей по Договору\nИсполнителем вследствие чрезвычайных обстоятельств, нарушение считается подтвержденным Исполнителем.\nОбращение Исполнителя рассматривается в срок, необходимый для полного и всестороннего рассмотрения всех\nобстоятельств нарушения, а также получения дополнительной информации и документов от Исполнителя при\nнеобходимости, о чем Заказчик уведомляет Исполнителя.', 'После истечения указанного срока Исполнитель утрачивает право\nна оспаривание удержанной Заказчиком суммы. Обращение Исполнителя рассматривается в срок, необходимый для\nполного и всестороннего рассмотрения всех обстоятельств, а также получения дополнительной информации и\n\nдокументов от Исполнителя при необходимости, о чем Заказчик уведомляет Исполнителя. Максимальный срок\nрассмотрения в любом случае не может превышать 30 (тридцать) календарных дней.\n12.3.', '12.1. Исполнитель посредством функционала Портала вправе оспорить полученный штраф за нарушение\nусловий Договора в соответствии с Приложением № 4 (Ответственность ПВЗ) к Договору в течение 7 (семи)\nкалендарных дней с момента уведомления Исполнителя путем размещения Заказчиком соответствующих сведений\nо нарушении обязательств Исполнителем в ЛК.', 'Максимальный срок рассмотрения в любом случае не\nможет превышать 30 (тридцать) календарных дней.\n12.2. Исполнитель посредством функционала Портала вправе оспорить произведенное Заказчиком удержание\nстоимости подготовки Товаров к возврату на Склад, утраченных, утерянных, Зависших Товаров, Товаров с\nнедостатком, или Подмен в течение 7 (семи) календарных дней с момента информирования Исполнителя путём\nразмещения соответствующих сведений об удержании на Портале с помощью обращения, поданного через Личный\nкабинет, с приложением подтверждающих документов, в том числе видеоматериалов, подтверждающих\nнеобоснованность примененной ответственности. После истечения указанного срока Исполнитель утрачивает право\nна оспаривание удержанной Заказчиком суммы. Обращение Исполнителя рассматривается в срок, необходимый для\nполного и всестороннего рассмотрения всех обстоятельств, а также получения дополнительной информации и\n\nдокументов от Исполнителя при необходимости, о чем Заказчик уведомляет Исполнителя. Максимальный срок\nрассмотрения в любом случае не может превышать 30 (тридцать) календарных дней.\n12.3.', '12.1. Исполнитель посредством функционала Портала вправе оспорить полученный штраф за нарушение\nусловий Договора в соответствии с Приложением № 4 (Ответственность ПВЗ) к Договору в течение 7 (семи)\nкалендарных дней с момента уведомления Исполнителя путем размещения Заказчиком', 'Максимальный срок такого ответа на запрос Исполнителя в любом случае не может превышать 30\n(тридцать) календарных дней.\n7.', 'При этом срок рассмотрения\nможет быть продлен по инициативе Заказчика для полного и всестороннего рассмотрения всех обстоятельств\nзапроса, а также получения дополнительной информации и документов от Исполнителя, о чем Заказчик уведомляет\nИсполнителя. Максимальный срок такого ответа на запрос Исполнителя в любом случае не может превышать 30\n(тридцать) календарных дней.\n7.', '6.6. Заказчик обязуется предоставить Исполнителю инструкции по работе с Порталом и информационные\nматериалы о процессе оказания Услуг, а также своевременно вносить в них изменения и уведомлять о них\nИсполнителя.\n6.7. Заказчик обязуется отвечать на запросы Исполнителя (за исключением письменных претензий), касающиеся\nработы ПВЗ, полученные посредством электронной почты или путем размещения в Личном кабинете, в срок, не\nпревышающий 14 (четырнадцать) календарных дней с даты получения такого запроса. При этом срок рассмотрения\nможет быть продлен по инициативе Заказчика для полного и всестороннего рассмотрения всех обстоятельств\nзапроса, а также получения дополнительной информации и документов от Исполнителя, о чем Заказчик уведомляет\nИсполнителя. Максимальный срок такого ответа на запрос Исполнителя в любом случае не может превышать 30\n(тридцать) календарных дней.\n7.', 'Максимальный срок рассмотрения в любом случае не\nможет превышать 30 (тридцать) календарных дней.\n12.2.', 'Максимальный срок\nрассмотрения в любом случае не может превышать 30 (тридцать) календарных дней.\n12.3.']","Сроки для рассмотрения обращения Исполнителя по оспариванию штрафа:

- Исполнитель имеет право оспорить штраф в течение **7 календарных дней** с момента уведомления о нарушении обязательств.
- После истечения этого срока Исполнитель утрачивает право на оспаривание удержанной суммы.
- **Максимальный срок рассмотрения обращения** в любом случае не может превышать **30 календарных дней**.

Таким образом, установленные сроки:

- Срок подачи оспаривания — **7 календарных дней**.
- Максимальный срок рассмотрения обращения — **30 календарных дней**."
Какой срок установлен для рассмотрения претензии Заказчика в оферте?,['22'],"['Срок ответа на претензию составляет 30 (тридцать) календарных дней со\nдня ее получения.\nВ случае недостижения согласия спор подлежит разрешению соответственно: в случае, если Заказчик является\nроссийским юридическим лицом, — в Арбитражном суде г. Москвы (или в Тимирязевском районном суде г. Москвы,\nесли Исполнитель-резидент РФ утратил статус индивидуального предпринимателя).', 'Срок ответа на претензию составляет 30 (тридцать) календарных дней со\nдня ее получения.\nВ случае недостижения согласия спор подлежит разрешению соответственно: в случае, если Заказчик является\nроссийским юридическим лицом, — в Арбитражном суде г.', '6.6. Заказчик обязуется предоставить Исполнителю инструкции по работе с Порталом и информационные\nматериалы о процессе оказания Услуг, а также своевременно вносить в них изменения и уведомлять о них\nИсполнителя.\n6.7. Заказчик обязуется отвечать на запросы Исполнителя (за исключением письменных претензий), касающиеся\nработы ПВЗ, полученные посредством электронной почты или путем размещения в Личном кабинете, в срок, не\nпревышающий 14 (четырнадцать) календарных дней с даты получения такого запроса. При этом срок рассмотрения\nможет быть продлен по инициативе Заказчика для полного и всестороннего рассмотрения всех обстоятельств\nзапроса, а также получения дополнительной информации и документов от Исполнителя, о чем Заказчик уведомляет\nИсполнителя. Максимальный срок такого ответа на запрос Исполнителя в любом случае не может превышать 30\n(тридцать) календарных дней.\n7.', 'После истечения указанного срока Исполнитель утрачивает право\nна оспаривание удержанной Заказчиком суммы. Обращение Исполнителя рассматривается в срок, необходимый для\nполного и всестороннего рассмотрения всех обстоятельств, а также получения дополнительной информации и\n\nдокументов от Исполнителя при необходимости, о чем Заказчик уведомляет Исполнителя. Максимальный срок\nрассмотрения в любом случае не может превышать 30 (тридцать) календарных дней.\n12.3.', 'Максимальный срок рассмотрения в любом случае не\nможет превышать 30 (тридцать) календарных дней.\n12.2. Исполнитель посредством функционала Портала вправе оспорить произведенное Заказчиком удержание\nстоимости подготовки Товаров к возврату на Склад, утраченных, утерянных, Зависших Товаров, Товаров с\nнедостатком, или Подмен в течение 7 (семи) календарных дней с момента информирования Исполнителя путём\nразмещения соответствующих сведений об удержании на Портале с помощью обращения, поданного через Личный\nкабинет, с приложением подтверждающих документов, в том числе видеоматериалов, подтверждающих\nнеобоснованность примененной ответственности. После истечения указанного срока Исполнитель утрачивает право\nна оспаривание удержанной Заказчиком суммы. Обращение Исполнителя рассматривается в срок, необходимый для\nполного и всестороннего рассмотрения всех обстоятельств, а также получения дополнительной информации и\n\nдокументов от Исполнителя при необходимости, о чем Заказчик уведомляет Исполнителя. Максимальный срок\nрассмотрения в любом случае не может превышать 30 (тридцать) календарных дней.\n12.3.', 'При этом срок рассмотрения\nможет быть продлен по инициативе Заказчика для полного и всестороннего рассмотрения всех обстоятельств\nзапроса, а также получения дополнительной информации и документов от Исполнителя, о чем Заказчик уведомляет\nИсполнителя. Максимальный срок такого ответа на запрос Исполнителя в любом случае не может превышать 30\n(тридцать) календарных дней.\n7.', 'Обращение Исполнителя\nрассматривается в срок не позднее 3 (трех) календарных дней с момента получения Заказчиком обращения.', 'Максимальный срок рассмотрения в любом случае не\nможет превышать 30 (тридцать) календарных дней.\n12.2.', 'При этом срок рассмотрения\nможет быть продлен по инициативе Заказчика для полного и всестороннего рассмотрения всех обстоятельств\nзапроса, а также получения дополнительной информации и документов от Исполнителя, о чем Заказчик уведомляет\nИсполнителя.', '12.1. Исполнитель посредством функционала Портала вправе оспорить полученный штраф за нарушение\nусловий Договора в соответствии с Приложением № 4 (Ответственность ПВЗ) к Договору в течение 7 (семи)\nкалендарных дней с момента уведомления Исполнителя путем размещения Заказчиком соответствующих сведений\nо нарушении обязательств Исполнителем в ЛК. В случае, если Исполнитель не предоставит в установленные\nДоговором и обучающим Порталом ( https://edtech.rwb.ru ) сроки видеоматериалы, а также документы, в том\nчисле, но не ограничиваясь выданные государственными органами по месту регистрации Сторон, контролирующими\nвопросы в области чрезвычайных ситуаций, подтверждающие невозможность исполнения обязанностей по Договору\nИсполнителем вследствие чрезвычайных обстоятельств, нарушение считается подтвержденным Исполнителем.\nОбращение Исполнителя рассматривается в срок, необходимый для полного и всестороннего рассмотрения всех\nобстоятельств нарушения, а также получения дополнительной информации и документов от Исполнителя при\nнеобходимости, о чем Заказчик уведомляет Исполнителя.']","В предоставленном контексте **нет информации о сроке рассмотрения претензии Заказчика**.

Контекст содержит информацию о сроках:

- **Ответа на претензию Исполнителя** — 30 календарных дней (в случае, если Заказчик — российское юридическое лицо, спор разрешается в Арбитражном суде г. Москвы).
- **Рассмотрения запросов Исполнителя** — до 30 календарных дней (с возможным продлением).
- **Рассмотрения обращений Исполнителя** (например, о спорах по удержанию, штрафам) — до 30 календарных дней (с возможным продлением).

Однако **нет упоминания о сроке рассмотрения претензии Заказчика**, то есть претензии, подаваемой Заказчиком в отношении Исполнителя.

Следовательно, **информации недостаточно** для ответа на вопрос о сроке рассмотрения претензии Заказчика.

**Ответ: информации недостаточно.**"
Какие видеоматериалы должен предоставить Исполнитель для оспаривания штрафа?,['22'],"['12.3. При оспаривании штрафов и удержаний Исполнитель обязан предоставить Заказчику видеосъемку и/или\nфотографии в отношении того Товара, который Заказчиком признан как Товар с недостатками, при этом на\nвидеосъемке и/или фотографии должен быть зафиксирован процесс подготовки Товара для отправки Исполнителем,\nследующего в адрес Заказчика, без его повреждений. На видеосъемке и/или фотографии должны быть\nзафиксированы дата и время совершения видеозаписи и/или фотографии.\n12.4. В случае если Исполнитель не предоставит видеоматериалы и/или фотографии, подтверждающие\nнеобоснованность произведенного удержания в установленные Договором сроки, такое удержание считается\nподтверждёнными (признанным) Исполнителем.\n13. Блокировка ПВЗ\n13.1. Независимо от применения штрафов в соответствии с Приложением № 4 к Договору Заказчик в целях\nпресечения нарушения Исполнителем обязательств по Договору, в том числе на будущий период и/или длящихся\nнарушений и/или защиты прав третьих лиц, осуществляет Блокировку ПВЗ в нижеследующих случаях.', '12.3. При оспаривании штрафов и удержаний Исполнитель обязан предоставить Заказчику видеосъемку и/или\nфотографии в отношении того Товара, который Заказчиком признан как Товар с недостатками, при этом на\nвидеосъемке и/или фотографии должен быть зафиксирован процесс подготовки Товара для отправки Исполнителем,\nследующего в адрес Заказчика, без его повреждений. На видеосъемке и/или фотографии должны быть\nзафиксированы дата и время совершения видеозаписи и/или фотографии.\n12.4.', '12.1. Исполнитель посредством функционала Портала вправе оспорить полученный штраф за нарушение\nусловий Договора в соответствии с Приложением № 4 (Ответственность ПВЗ) к Договору в течение 7 (семи)\nкалендарных дней с момента уведомления Исполнителя путем размещения Заказчиком соответствующих сведений\nо нарушении обязательств Исполнителем в ЛК. В случае, если Исполнитель не предоставит в установленные\nДоговором и обучающим Порталом ( https://edtech.rwb.ru ) сроки видеоматериалы, а также документы, в том\nчисле, но не ограничиваясь выданные государственными органами по месту регистрации Сторон, контролирующими\nвопросы в области чрезвычайных ситуаций, подтверждающие невозможность исполнения обязанностей по Договору\nИсполнителем вследствие чрезвычайных обстоятельств, нарушение считается подтвержденным Исполнителем.\nОбращение Исполнителя рассматривается в срок, необходимый для полного и всестороннего рассмотрения всех\nобстоятельств нарушения, а также получения дополнительной информации и документов от Исполнителя при\nнеобходимости, о чем Заказчик уведомляет Исполнителя.', '12.3. При оспаривании штрафов и удержаний Исполнитель обязан предоставить Заказчику видеосъемку и/или\nфотографии в отношении того Товара, который Заказчиком признан как Товар с недостатками,', '10. 5.14. Исполнитель обязуется в случае полученияуведомления от Заказчика в ЛК об Аудите ПВЗпредоставить Заказчику качественные фото- ивидеоматериалы внешнего вида ПВЗ (в соответствии стребованиями и указаниями Заказчика,представленными в инструкции в данном разделе ЛК)путем их размещения и загрузки на Портале в разделеАудит ПВЗ или иным определенным Заказчикомспособом.Заказчик вправе после проверки всех необходимыхматериалов и информации запросить Исполнителяисправить замечания, выявленные в процессе АудитаПВЗ, посредством направления уведомления в ЛК.Общий срок прохождения Аудита ПВЗ не можетпревышать 7 (семи) календарных дней с датыполучения уведомления об Аудите ПВЗ в ЛКИсполнителя. Исполнитель обязуется предоставлять\nЗа невыполнение обязанности,предусмотренной п. 5.14. илинарушении сроков предоставленияматериалов и информации:выявленное впервые —предупреждение;за каждое следующее выявленноенарушение — штраф в размере 10000 (Десять тысяч) российскихрублей.', '12.1. Исполнитель посредством функционала Портала вправе оспорить полученный штраф за нарушение\nусловий Договора в соответствии с Приложением № 4 (Ответственность ПВЗ) к Договору в течение 7 (семи)\nкалендарных дней с момента уведомления Исполнителя путем размещения Заказчиком', '12.1. Исполнитель посредством функционала Портала вправе оспорить полученный штраф за нарушение\nусловий Договора в соответствии с Приложением № 4 (Ответственность ПВЗ) к Договору в течение 7 (семи)\nкалендарных дней с момента уведомления Исполнителя путем размещения Заказчиком соответствующих сведений\nо нарушении обязательств Исполнителем в ЛК.', 'В качестве подтверждения\nвыполнения указанных требований Исполнитель обязан предоставить Заказчику фото- и видеоматериалы в\nдостаточном объеме для объективной оценки надлежащего исполнения обязательств по Активации Исполнителем\nПВЗ.\n3.12.', '6.5. Исполнитель обязан предоставить Заказчику в порядке, предусмотренном пунктами 6.3, 6.4 настоящих\nПравил оказания услуг, фото- и видеоматериалы, соответствующие действительности, в том числе, но не\nограничиваясь, относительно места, даты или времени съемки.', 'В\nпротивном случае Исполнитель лишается права активировать указанный ПВЗ. В качестве подтверждения\nвыполнения указанных требований Исполнитель обязан предоставить Заказчику фото- и видеоматериалы в\nдостаточном объеме для объективной оценки надлежащего исполнения обязательств по Активации Исполнителем\nПВЗ.\n3.12.']","Для оспаривания штрафа Исполнитель должен предоставить Заказчику **видеосъемку и/или фотографии** в отношении Товара, который Заказчиком признан как Товар с недостатками.  

На видеосъемке и/или фотографиях должен быть зафиксирован:  
- процесс подготовки Товара для отправки Исполнителем в адрес Заказчика;  
- отсутствие повреждений Товара при подготовке к отправке.  

Кроме того, на видеоматериале и/или фотографии должны быть зафиксированы:  
- **дата и время** совершения видеозаписи и/или фотографии.  

Если Исполнитель не предоставит такие материалы в установленные Договором сроки, удержание считается подтверждённым (признанным) Исполнителем."
"В каких случаях Заказчик может применить Блокировку ПВЗ, если Рейтинг ПВЗ Исполнителя снижается ниже Минимального значения?",['22'],"['13.5. Заказчик вправе применить к Исполнителю Блокировку выплат ПВЗ, в случаях проведения Заказчиком\nпроверки Исполнителя на предмет нарушения Договора и/или выявления Заказчиком нарушений Исполнителем\nтаких условий Договора, как снижение Рейтинга ПВЗ до Минимального значения рейтинга ПВЗ, не предоставления\nнеобходимых документов в соответствии с п. 8.5, включая п. 8.5.1. – 8.5.5. Договора.', 'В случае подтверждения обстоятельств, указанных в обращении\nИсполнителя, Блокировка ПВЗ прекращается Заказчиком.\n13.4. Заказчик вправе осуществить Блокировку ПВЗ Исполнителя по инициативе Исполнителя в случаях, если у\nИсполнителя возникли или могут возникнуть обстоятельства, препятствующие исполнению Договора в полном\nобъеме или частично, в том числе: у Исполнителя возникли проблемы с использованием ПВЗ (аренда или иное),\nИсполнитель готовится к переезду в другой ПВЗ или осуществляет ремонт в текущем ПВЗ, либо по иной причине.\n13.5. Заказчик вправе применить к Исполнителю Блокировку выплат ПВЗ, в случаях проведения Заказчиком\nпроверки Исполнителя на предмет нарушения Договора и/или выявления Заказчиком нарушений Исполнителем\nтаких условий Договора, как снижение Рейтинга ПВЗ до Минимального значения рейтинга ПВЗ, не предоставления\nнеобходимых документов в соответствии с п. 8.5, включая п. 8.5.1. – 8.5.5. Договора.\nБлокировка выплат ПВЗ вводится с даты направления Исполнителю уведомления о Блокировке выплат ПВЗ и до\nдаты прекращения проводимой Заказчиком проверки и/или устранения, допущенного Исполнителем нарушения.', 'Основания и Порядок Блокировки Условия снятия Блокировки\n1 Если значение Рейтинга ПВЗ Исполнителя становитсяменьше Минимального значения рейтинга ПВЗ, Заказчикосуществляет Блокировку ПВЗ Исполнителя.В случае если Блокировка ПВЗ Исполнителя длится 2(два) календарных дня подряд и более, то Заказчикразличными способами содействует Исполнителю вулучшении качества оказания Услуг в ПВЗ Исполнителя.', 'Основания и Порядок Блокировки Условия снятия Блокировки\n1 Если значение Рейтинга ПВЗ Исполнителя становитсяменьше Минимального значения рейтинга ПВЗ, Заказчикосуществляет Блокировку ПВЗ Исполнителя.', 'Если Рейтинг ПВЗ Исполнителя становится равнымили больше Минимального значения рейтинга ПВЗ,Заказчик незамедлительно прекращает БлокировкуПВЗ и направляет соответствующее уведомление вЛК.Заказчик вправе прекратить Блокировку ПВЗИсполнителя, если значение Рейтинга ПВЗИсполнителя менее Минимального значениярейтинга ПВЗ, но Исполнитель прикладывает усилиядля улучшения качества оказания Услуг по Договору,устраняет все нарушения, послужившие основаниемдля снижения Рейтинга и приведшие к БлокировкеПВЗ, а также продолжает соблюдать полностью идобросовестно Договор.Если Рейтинг ПВЗ снижался три и более раза нижеМинимального значения рейтинга ПВЗ Исполнителяв течение 1 (одного) календарного года оказанияУслуг Исполнителем с даты Активации ПВЗ попричине нарушений, послуживших основанием дляснижения Рейтинга и приведших к Блокировке ПВЗ,то прекращение применения Блокировки ПВЗ, приусловии устранения нарушений, Заказчиком неприменяется.', 'При\nсистематических нарушениях Блокировка применяется с момента выявления нарушения (с момента уведомления в\nЛК о причинах Блокировки), а для длящихся нарушений — незамедлительно по истечении срока, указанного в\nуведомлении Заказчика об устранении нарушения.\nОснования и Порядок Блокировки Условия снятия Блокировки\n1 Если значение Рейтинга ПВЗ Исполнителя становитсяменьше Минимального значения рейтинга ПВЗ, Заказчикосуществляет Блокировку ПВЗ Исполнителя.В случае если Блокировка ПВЗ Исполнителя длится 2(два) календарных дня подряд и более, то Заказчикразличными способами содействует Исполнителю вулучшении качества оказания Услуг в ПВЗ Исполнителя.', 'Если Рейтинг ПВЗ Исполнителя становится равнымили больше Минимального значения рейтинга ПВЗ,Заказчик незамедлительно прекращает БлокировкуПВЗ и направляет соответствующее уведомление вЛК.Заказчик вправе прекратить Блокировку ПВЗИсполнителя, если значение Рейтинга ПВЗИсполнителя менее Минимального значениярейтинга ПВЗ, но Исполнитель прикладывает усилиядля улучшения качества оказания Услуг по Договору,устраняет все нарушения, послужившие основаниемдля снижения Рейтинга и приведшие к БлокировкеПВЗ, а также продолжает соблюдать полностью идобросовестно Договор.', 'Если Рейтинг ПВЗ снижался три и более раза нижеМинимального значения рейтинга ПВЗ Исполнителяв течение 1 (одного) календарного года оказанияУслуг Исполнителем с даты Активации ПВЗ попричине нарушений, послуживших основанием дляснижения Рейтинга и приведших к Блокировке ПВЗ,то прекращение применения Блокировки ПВЗ, приусловии устранения нарушений, Заказчиком неприменяется.', '13.5. Заказчик вправе применить к Исполнителю Блокировку выплат ПВЗ, в случаях проведения Заказчиком\nпроверки Исполнителя на предмет нарушения Договора и/или выявления Заказчиком нарушений Исполнителем\nтаких условий Договора,', 'Если Рейтинг ПВЗ Исполнителя становится равнымили больше Минимального значения рейтинга ПВЗ,Заказчик незамедлительно прекращает БлокировкуПВЗ и направляет соответствующее уведомление вЛК.Заказчик вправе прекратить Блокировку ПВЗИсполнителя,']","Заказчик может применить Блокировку ПВЗ, если значение Рейтинга ПВЗ Исполнителя становится меньше Минимального значения рейтинга ПВЗ."
Какой минимальный размер задолженности Исполнителя может привести к блокировке ПВЗ?,['23'],"['Основания и Порядок Блокировки Условия снятия Блокировки\n3 Если в результате неисполнения и/или ненадлежащегоисполнения своих обязательств по Договору уИсполнителя возникла задолженность в размере 10 000(десяти тысяч) рублей и больше или эквивалентуказанной суммы в национальной валюте страныгосударственной регистрации Сторон Договора по курсуЦБ РФ, то Заказчик осуществляет Блокировку такого ПВЗИсполнителя, о чем Исполнитель незамедлительнополучает уведомление в ЛК.', 'Если Исполнитель совершит идентичноенарушение в период Блокировки ПВЗ, то периодБлокировки продлевается до момента, когдаИсполнитель не улучшит качество оказания Услуг ине перестанет совершать нарушения в периодБлокировки ПВЗ.Для длящегося нарушения — если Исполнительустраняет нарушение в сроки, указанные вуведомлении или раньше, то Заказчик снимаетБлокировку ПВЗ и направляет соответствующееуведомление в ЛК.\n\nОснования и Порядок Блокировки Условия снятия Блокировки\n3 Если в результате неисполнения и/или ненадлежащегоисполнения своих обязательств по Договору уИсполнителя возникла задолженность в размере 10 000(десяти тысяч) рублей и больше или эквивалентуказанной суммы в национальной валюте страныгосударственной регистрации Сторон Договора по курсуЦБ РФ, то Заказчик осуществляет Блокировку такого ПВЗИсполнителя, о чем Исполнитель незамедлительнополучает уведомление в ЛК.', 'В случае подтверждения обстоятельств, указанных в обращении\nИсполнителя, Блокировка ПВЗ прекращается Заказчиком.\n13.4. Заказчик вправе осуществить Блокировку ПВЗ Исполнителя по инициативе Исполнителя в случаях, если у\nИсполнителя возникли или могут возникнуть обстоятельства, препятствующие исполнению Договора в полном\nобъеме или частично, в том числе: у Исполнителя возникли проблемы с использованием ПВЗ (аренда или иное),\nИсполнитель готовится к переезду в другой ПВЗ или осуществляет ремонт в текущем ПВЗ, либо по иной причине.\n13.5. Заказчик вправе применить к Исполнителю Блокировку выплат ПВЗ, в случаях проведения Заказчиком\nпроверки Исполнителя на предмет нарушения Договора и/или выявления Заказчиком нарушений Исполнителем\nтаких условий Договора, как снижение Рейтинга ПВЗ до Минимального значения рейтинга ПВЗ, не предоставления\nнеобходимых документов в соответствии с п. 8.5, включая п. 8.5.1. – 8.5.5. Договора.\nБлокировка выплат ПВЗ вводится с даты направления Исполнителю уведомления о Блокировке выплат ПВЗ и до\nдаты прекращения проводимой Заказчиком проверки и/или устранения, допущенного Исполнителем нарушения.', 'Если Рейтинг ПВЗ Исполнителя становится равнымили больше Минимального значения рейтинга ПВЗ,Заказчик незамедлительно прекращает БлокировкуПВЗ и направляет соответствующее уведомление вЛК.Заказчик вправе прекратить Блокировку ПВЗИсполнителя, если значение Рейтинга ПВЗИсполнителя менее Минимального значениярейтинга ПВЗ, но Исполнитель прикладывает усилиядля улучшения качества оказания Услуг по Договору,устраняет все нарушения, послужившие основаниемдля снижения Рейтинга и приведшие к БлокировкеПВЗ, а также продолжает соблюдать полностью идобросовестно Договор.Если Рейтинг ПВЗ снижался три и более раза нижеМинимального значения рейтинга ПВЗ Исполнителяв течение 1 (одного) календарного года оказанияУслуг Исполнителем с даты Активации ПВЗ попричине нарушений, послуживших основанием дляснижения Рейтинга и приведших к Блокировке ПВЗ,то прекращение применения Блокировки ПВЗ, приусловии устранения нарушений, Заказчиком неприменяется.', 'Основания и Порядок Блокировки Условия снятия Блокировки\n1 Если значение Рейтинга ПВЗ Исполнителя становитсяменьше Минимального значения рейтинга ПВЗ, Заказчикосуществляет Блокировку ПВЗ Исполнителя.В случае если Блокировка ПВЗ Исполнителя длится 2(два) календарных дня подряд и более, то Заказчикразличными способами содействует Исполнителю вулучшении качества оказания Услуг в ПВЗ Исполнителя.', '13.5. Заказчик вправе применить к Исполнителю Блокировку выплат ПВЗ, в случаях проведения Заказчиком\nпроверки Исполнителя на предмет нарушения Договора и/или выявления Заказчиком нарушений Исполнителем\nтаких условий Договора, как снижение Рейтинга ПВЗ до Минимального значения рейтинга ПВЗ, не предоставления\nнеобходимых документов в соответствии с п. 8.5, включая п. 8.5.1. – 8.5.5. Договора.', 'Исполнитель обязан оказывать Услуги в ПВЗ, независимо от применения Блокировки выплат ПВЗ. Блокировка\nвыплат ПВЗ, применяемая к Исполнителю в соответствии с настоящим пунктом, не ограничивает иные\nфункциональные возможности, предоставляемые Заказчиком Исполнителю в целях исполнения Договора.\nБлокировка выплат ПВЗ не изменяет какие-либо условия Договора, которые продолжают действовать для обеих\nСторон без исключений.\n14. Деактивация и расторжение Договора\n14.1. Заказчик вправе отказаться от исполнения Договора в одностороннем внесудебном порядке полностью или\nв части определенного ПВЗ Исполнителя, при наличии у Исполнителя более 1 (одного) ПВЗ, то есть осуществить\nпроцесс Деактивации ПВЗ.\n14.2. Заказчик инициирует процесс Деактивации ПВЗ в указанных ниже случаях:\nОснования и порядок Деактивации Прекращение процессаДеактивации (еслиприменимо)\n1 Если Доля Подмен за последние 30 (тридцать) календарных дней подрядоказания Услуг Исполнителем в ПВЗ будет составлять более 1% (одногопроцента).', '– 8.5.5. Договора.\nБлокировка выплат ПВЗ вводится с даты направления Исполнителю уведомления о Блокировке выплат ПВЗ и до\nдаты прекращения проводимой Заказчиком проверки и/или устранения, допущенного Исполнителем нарушения.', 'послуживших основанием дляснижения Рейтинга и приведших к Блокировке ПВЗ,то прекращение применения Блокировки ПВЗ, приусловии устранения нарушений, Заказчиком неприменяется.', 'При наличии у Исполнителя задолженности по оплате стоимости Оборудования в течение 2 (двух) и более\nкалендарных месяцев, Заказчик вправе отключить Исполнителя от Услуги WB Рекламные экраны,']","Минимальный размер задолженности Исполнителя, который может привести к блокировке ПВЗ, — **10 000 рублей** или эквивалентной суммы в национальной валюте страны государственной регистрации Сторон Договора по курсу ЦБ РФ."
Какой срок установлен для рассмотрения обращения Исполнителя об отмене блокировки ПВЗ?,['23'],"['13.1 Договора.\n13.3. Исполнитель вправе с использованием Портала направить Заказчику обращение об отмене Блокировки\nПВЗ или о том, что его ПВЗ заблокировали необоснованно, при условии устранения им указанных в уведомлении\nнарушений или предоставления подтверждений необоснованной Блокировки ПВЗ. Обращение Исполнителя\nрассматривается в срок не позднее 3 (трех) календарных дней с момента получения Заказчиком обращения.', 'Если Исполнитель в течение 7 (семи) календарныхдней с даты Блокировки возмещает Заказчику суммузадолженности по реквизитам Заказчика сприложением подтверждающих документов, тоЗаказчик снимает Блокировку и направляетсоответствующее уведомление в ЛК.\n13.2. Заказчик через Портал уведомляет Исполнителя об осуществлении Блокировки ПВЗ Исполнителя с\nуказанием оснований для Блокировки ПВЗ, срока и/или условий для снятия Блокировки согласно п. 13.1 Договора.\n13.3. Исполнитель вправе с использованием Портала направить Заказчику обращение об отмене Блокировки\nПВЗ или о том, что его ПВЗ заблокировали необоснованно, при условии устранения им указанных в уведомлении\nнарушений или предоставления подтверждений необоснованной Блокировки ПВЗ. Обращение Исполнителя\nрассматривается в срок не позднее 3 (трех) календарных дней с момента получения Заказчиком обращения.\nУказанный срок может быть продлен на срок не более 7 (семи) календарных дней в случае необходимости\nполучения дополнительной информации для принятия решения без учета времени, требуемого Исполнителю для\nпредоставления соответствующей информации.', 'В случае подтверждения обстоятельств, указанных в обращении\nИсполнителя, Блокировка ПВЗ прекращается Заказчиком.\n13.4. Заказчик вправе осуществить Блокировку ПВЗ Исполнителя по инициативе Исполнителя в случаях, если у\nИсполнителя возникли или могут возникнуть обстоятельства, препятствующие исполнению Договора в полном\nобъеме или частично, в том числе: у Исполнителя возникли проблемы с использованием ПВЗ (аренда или иное),\nИсполнитель готовится к переезду в другой ПВЗ или осуществляет ремонт в текущем ПВЗ, либо по иной причине.\n13.5. Заказчик вправе применить к Исполнителю Блокировку выплат ПВЗ, в случаях проведения Заказчиком\nпроверки Исполнителя на предмет нарушения Договора и/или выявления Заказчиком нарушений Исполнителем\nтаких условий Договора, как снижение Рейтинга ПВЗ до Минимального значения рейтинга ПВЗ, не предоставления\nнеобходимых документов в соответствии с п. 8.5, включая п. 8.5.1. – 8.5.5. Договора.\nБлокировка выплат ПВЗ вводится с даты направления Исполнителю уведомления о Блокировке выплат ПВЗ и до\nдаты прекращения проводимой Заказчиком проверки и/или устранения, допущенного Исполнителем нарушения.', 'Если Исполнитель в течение 7 (семи) календарныхдней с даты Блокировки возмещает Заказчику суммузадолженности по реквизитам Заказчика сприложением подтверждающих документов, тоЗаказчик снимает Блокировку и направляетсоответствующее уведомление в ЛК.\n13.2. Заказчик через Портал уведомляет Исполнителя об осуществлении Блокировки ПВЗ Исполнителя с\nуказанием оснований для Блокировки ПВЗ, срока и/или условий для снятия Блокировки согласно п. 13.1 Договора.\n13.3.', '13.1 Договора.\n13.3. Исполнитель вправе с использованием Портала направить Заказчику обращение об отмене Блокировки\nПВЗ или о том, что его ПВЗ заблокировали необоснованно, при условии устранения им указанных в уведомлении\nнарушений или предоставления подтверждений необоснованной Блокировки ПВЗ.', 'При\nсистематических нарушениях Блокировка применяется с момента выявления нарушения (с момента уведомления в\nЛК о причинах Блокировки), а для длящихся нарушений — незамедлительно по истечении срока, указанного в\nуведомлении Заказчика об устранении нарушения.\nОснования и Порядок Блокировки Условия снятия Блокировки\n1 Если значение Рейтинга ПВЗ Исполнителя становитсяменьше Минимального значения рейтинга ПВЗ, Заказчикосуществляет Блокировку ПВЗ Исполнителя.В случае если Блокировка ПВЗ Исполнителя длится 2(два) календарных дня подряд и более, то Заказчикразличными способами содействует Исполнителю вулучшении качества оказания Услуг в ПВЗ Исполнителя.', 'Если Исполнитель совершит идентичноенарушение в период Блокировки ПВЗ, то периодБлокировки продлевается до момента, когдаИсполнитель не улучшит качество оказания Услуг ине перестанет совершать нарушения в периодБлокировки ПВЗ.Для длящегося нарушения — если Исполнительустраняет нарушение в сроки, указанные вуведомлении или раньше, то Заказчик снимаетБлокировку ПВЗ и направляет соответствующееуведомление в ЛК.\n\nОснования и Порядок Блокировки Условия снятия Блокировки\n3 Если в результате неисполнения и/или ненадлежащегоисполнения своих обязательств по Договору уИсполнителя возникла задолженность в размере 10 000(десяти тысяч) рублей и больше или эквивалентуказанной суммы в национальной валюте страныгосударственной регистрации Сторон Договора по курсуЦБ РФ, то Заказчик осуществляет Блокировку такого ПВЗИсполнителя, о чем Исполнитель незамедлительнополучает уведомление в ЛК.', '– 8.5.5. Договора.\nБлокировка выплат ПВЗ вводится с даты направления Исполнителю уведомления о Блокировке выплат ПВЗ и до\nдаты прекращения проводимой Заказчиком проверки и/или устранения, допущенного Исполнителем нарушения.', 'Основания и Порядок Блокировки Условия снятия Блокировки\n1 Если значение Рейтинга ПВЗ Исполнителя становитсяменьше Минимального значения рейтинга ПВЗ, Заказчикосуществляет Блокировку ПВЗ Исполнителя.В случае если Блокировка ПВЗ Исполнителя длится 2(два) календарных дня подряд и более, то Заказчикразличными способами содействует Исполнителю вулучшении качества оказания Услуг в ПВЗ Исполнителя.', '13.2. Заказчик через Портал уведомляет Исполнителя об осуществлении Блокировки ПВЗ Исполнителя с\nуказанием оснований для Блокировки ПВЗ, срока и/или условий для снятия Блокировки согласно п. 13.1 Договора.\n13.3.']","Срок для рассмотрения обращения Исполнителя об отмене блокировки ПВЗ — **не позднее 3 (трех) календарных дней** с момента получения Заказчиком обращения.

В случае необходимости получения дополнительной информации, срок может быть **продлен на срок не более 7 (семи) календарных дней**."
"В каких случаях Заказчик может применить блокировку выплат ПВЗ, и как это влияет на обязанности Исполнителя по оказанию услуг?",['23'],"['В случае подтверждения обстоятельств, указанных в обращении\nИсполнителя, Блокировка ПВЗ прекращается Заказчиком.\n13.4. Заказчик вправе осуществить Блокировку ПВЗ Исполнителя по инициативе Исполнителя в случаях, если у\nИсполнителя возникли или могут возникнуть обстоятельства, препятствующие исполнению Договора в полном\nобъеме или частично, в том числе: у Исполнителя возникли проблемы с использованием ПВЗ (аренда или иное),\nИсполнитель готовится к переезду в другой ПВЗ или осуществляет ремонт в текущем ПВЗ, либо по иной причине.\n13.5. Заказчик вправе применить к Исполнителю Блокировку выплат ПВЗ, в случаях проведения Заказчиком\nпроверки Исполнителя на предмет нарушения Договора и/или выявления Заказчиком нарушений Исполнителем\nтаких условий Договора, как снижение Рейтинга ПВЗ до Минимального значения рейтинга ПВЗ, не предоставления\nнеобходимых документов в соответствии с п. 8.5, включая п. 8.5.1. – 8.5.5. Договора.\nБлокировка выплат ПВЗ вводится с даты направления Исполнителю уведомления о Блокировке выплат ПВЗ и до\nдаты прекращения проводимой Заказчиком проверки и/или устранения, допущенного Исполнителем нарушения.', '13.5. Заказчик вправе применить к Исполнителю Блокировку выплат ПВЗ, в случаях проведения Заказчиком\nпроверки Исполнителя на предмет нарушения Договора и/или выявления Заказчиком нарушений Исполнителем\nтаких условий Договора, как снижение Рейтинга ПВЗ до Минимального значения рейтинга ПВЗ, не предоставления\nнеобходимых документов в соответствии с п. 8.5, включая п. 8.5.1. – 8.5.5. Договора.', '13.5. Заказчик вправе применить к Исполнителю Блокировку выплат ПВЗ, в случаях проведения Заказчиком\nпроверки Исполнителя на предмет нарушения Договора и/или выявления Заказчиком нарушений Исполнителем\nтаких условий Договора,', 'В случае подтверждения обстоятельств, указанных в обращении\nИсполнителя, Блокировка ПВЗ прекращается Заказчиком.\n13.4. Заказчик вправе осуществить Блокировку ПВЗ Исполнителя по инициативе Исполнителя в случаях, если у\nИсполнителя возникли или могут возникнуть обстоятельства, препятствующие исполнению Договора в полном\nобъеме или частично, в том числе: у Исполнителя возникли проблемы с использованием ПВЗ (аренда или иное),\nИсполнитель готовится к переезду в другой ПВЗ или осуществляет ремонт в текущем ПВЗ, либо по иной причине.\n13.5.', 'В случае подтверждения обстоятельств, указанных в обращении\nИсполнителя, Блокировка ПВЗ прекращается Заказчиком.\n13.4. Заказчик вправе осуществить Блокировку ПВЗ Исполнителя по инициативе Исполнителя в случаях, если у\nИсполнителя возникли или могут возникнуть обстоятельства,', 'Исполнитель обязан оказывать Услуги в ПВЗ, независимо от применения Блокировки выплат ПВЗ. Блокировка\nвыплат ПВЗ, применяемая к Исполнителю в соответствии с настоящим пунктом, не ограничивает иные\nфункциональные возможности, предоставляемые Заказчиком Исполнителю в целях исполнения Договора.\nБлокировка выплат ПВЗ не изменяет какие-либо условия Договора, которые продолжают действовать для обеих\nСторон без исключений.\n14. Деактивация и расторжение Договора\n14.1. Заказчик вправе отказаться от исполнения Договора в одностороннем внесудебном порядке полностью или\nв части определенного ПВЗ Исполнителя, при наличии у Исполнителя более 1 (одного) ПВЗ, то есть осуществить\nпроцесс Деактивации ПВЗ.\n14.2. Заказчик инициирует процесс Деактивации ПВЗ в указанных ниже случаях:\nОснования и порядок Деактивации Прекращение процессаДеактивации (еслиприменимо)\n1 Если Доля Подмен за последние 30 (тридцать) календарных дней подрядоказания Услуг Исполнителем в ПВЗ будет составлять более 1% (одногопроцента).', 'Исполнитель обязан оказывать Услуги в ПВЗ, независимо от применения Блокировки выплат ПВЗ. Блокировка\nвыплат ПВЗ, применяемая к Исполнителю в соответствии с настоящим пунктом, не ограничивает иные\nфункциональные возможности, предоставляемые Заказчиком Исполнителю в целях исполнения Договора.\nБлокировка выплат ПВЗ не изменяет какие-либо условия Договора, которые продолжают действовать для обеих\nСторон без исключений.\n14. Деактивация и расторжение Договора\n14.1.', '13. Блокировка ПВЗ\n13.1. Независимо от применения штрафов в соответствии с Приложением № 4 к Договору Заказчик в целях\nпресечения нарушения Исполнителем обязательств по Договору, в том числе на будущий период и/или длящихся\nнарушений и/или защиты прав третьих лиц, осуществляет Блокировку ПВЗ в нижеследующих случаях.', 'Блокировка\nвыплат ПВЗ, применяемая к Исполнителю в соответствии с настоящим пунктом, не ограничивает иные\nфункциональные возможности, предоставляемые Заказчиком Исполнителю в целях исполнения Договора.', '– 8.5.5. Договора.\nБлокировка выплат ПВЗ вводится с даты направления Исполнителю уведомления о Блокировке выплат ПВЗ и до\nдаты прекращения проводимой Заказчиком проверки и/или устранения, допущенного Исполнителем нарушения.']","Заказчик может применить блокировку выплат ПВЗ в следующих случаях:

1. При проведении проверки Исполнителя на предмет нарушения Договора;
2. При выявлении нарушений Исполнителем таких условий Договора, как:
   - снижение рейтинга ПВЗ до минимального значения;
   - не предоставление необходимых документов в соответствии с п. 8.5 Договора, включая п. 8.5.1 – 8.5.5.

Блокировка выплат ПВЗ вводится с даты направления уведомления Исполнителю и продолжается до даты прекращения проверки и/или устранения нарушения.

**Влияние на обязанности Исполнителя:**

- Исполнитель **обязан оказывать Услуги в ПВЗ независимо от применения блокировки выплат ПВЗ**;
- Блокировка выплат ПВЗ **не ограничивает иные функциональные возможности**, предоставляемые Заказчиком Исполнителю в целях исполнения Договора;
- Блокировка не изменяет другие условия Договора, которые продолжают действовать для обеих сторон без исключений.

Таким образом, блокировка выплат не освобождает Исполнителя от обязательства по оказанию услуг в ПВЗ."
"Какой срок предусмотрен для Деактивации ПВЗ, если Исполнитель нарушает условие п. 6.1 Правил оказания услуг более 3 календарных дней подряд?",['24'],"['2 В случае нарушения п. 6.1 Правил оказания услуг (круглосуточный,беспрепятственный доступ в ПВЗ) со стороны Исполнителя на срок более 3(трех) календарных дней подряд, Заказчик направляет Исполнителюуведомление через ЛК о Деактивации ПВЗ на 4-й календарный день.', '6.1 Правил оказания услуг (круглосуточный,беспрепятственный доступ в ПВЗ) со стороны Исполнителя на срок более 3(трех) календарных дней подряд, Заказчик направляет Исполнителюуведомление через ЛК о Деактивации ПВЗ на 4-й календарный день.', 'Заказчик направляет Исполнителю уведомление через ЛК, о том, чтона 31-й (календарный) день происходит Деактивация ПВЗ.\nЕсли Доля ПодменИсполнителя снизится втечение 30 (тридцати)календарных дней с моментанаправления Заказчикомуведомления о Деактивации,\n\nОснования и порядок Деактивации Прекращение процессаДеактивации (еслиприменимо)\nто Заказчик вправепрекратить процессДеактивации.\n2 В случае нарушения п. 6.1 Правил оказания услуг (круглосуточный,беспрепятственный доступ в ПВЗ) со стороны Исполнителя на срок более 3(трех) календарных дней подряд, Заказчик направляет Исполнителюуведомление через ЛК о Деактивации ПВЗ на 4-й календарный день.\n3 В случае приостановки оказания Услуг по Договору со стороны Исполнителя насрок более 2 (двух) календарных дней подряд по любым основаниям безпредварительного согласования с Заказчиком, Заказчик направляетИсполнителю уведомление через ЛК о Деактивации ПВЗ на 3-ий\xa0календарныйдень.', '3 В случае приостановки оказания Услуг по Договору со стороны Исполнителя насрок более 2 (двух) календарных дней подряд по любым основаниям безпредварительного согласования с Заказчиком, Заказчик направляетИсполнителю уведомление через ЛК о Деактивации ПВЗ на 3-ий\xa0календарныйдень.', '5.5 Договора (распространение Исполнителем информации, порочащейчесть, достоинство и деловую репутацию Заказчика) систематически (3 (три) иболее раза), Заказчик направляет Исполнителю уведомление через ЛК оДеактивации ПВЗ через 2 (два) календарных дня с даты получения уведомленияв ЛК Исполнителя.\n7 Если в течение 21 (двадцати одного) календарного дня подряд после полученияуведомления в ЛК Рейтинг ПВЗ Исполнителя будет составлять значение нижеМинимального значения рейтинга ПВЗ, то на 22-й (двадцать второй)календарный день Заказчик производит Деактивацию ПВЗ.\n14.3. Заказчик через Портал уведомляет Исполнителя об осуществлении Деактивации ПВЗ Исполнителя с\nуказанием оснований для Деактивации ПВЗ.\n14.4. Если при Деактивации у Исполнителя не остается действующих ПВЗ в Личном кабинете, Договор с таким\nИсполнителем считается расторгнутым (прекращенным) в одностороннем внесудебном порядке, а Личный кабинет\nИсполнителя — удаленным в течение 90 (девяноста) календарных дней со дня направления Заказчиком\nуведомления о Деактивации всех ПВЗ Исполнителя.', 'инициирует процесс Деактивации ПВЗ в указанных ниже случаях:\nОснования и порядок Деактивации Прекращение процессаДеактивации (еслиприменимо)\n1 Если Доля Подмен за последние 30 (тридцать) календарных дней подрядоказания Услуг Исполнителем в ПВЗ будет составлять более 1%', 'Исполнитель имеет право отказаться от оказания Услуг в отношении определенного ПВЗ и потребовать от\nЗаказчика инициировать процесс Деактивации конкретного ПВЗ, при наличии у Исполнителя более 1 (одного) ПВЗ,\nпутем направления Заказчику заявки о Деактивации ПВЗ не позднее чем за 14 (четырнадцать) календарных дней до\nпредполагаемой даты Деактивации ПВЗ.\n\n14.6.', 'При осуществлении процесса Деактивации ПВЗ по инициативе\nЗаказчика применяются положения пп. 14.6–14.11 Договора.\n14.5. Исполнитель имеет право полностью отказаться от исполнения Договора в одностороннем внесудебном\nпорядке путем направления Заказчику уведомления о расторжении Договора не позднее чем за 30 (тридцать)\nкалендарных дней до предполагаемой даты расторжения Договора (Деактивация всех ПВЗ Исполнителя).\nИсполнитель имеет право отказаться от оказания Услуг в отношении определенного ПВЗ и потребовать от\nЗаказчика инициировать процесс Деактивации конкретного ПВЗ, при наличии у Исполнителя более 1 (одного) ПВЗ,\nпутем направления Заказчику заявки о Деактивации ПВЗ не позднее чем за 14 (четырнадцать) календарных дней до\nпредполагаемой даты Деактивации ПВЗ.\n\n14.6.', '14.6. Исполнитель обязуется в течение 14 (четырнадцати) календарных дней с даты утверждения Заказчиком\nзаявки Исполнителя на Деактивацию ПВЗ:\n• надлежащим образом оказывать Услуги на таком ПВЗ;', '5.5 Договора (распространение Исполнителем информации, порочащейчесть, достоинство и деловую репутацию Заказчика) систематически (3 (три) иболее раза), Заказчик направляет Исполнителю уведомление через ЛК оДеактивации ПВЗ через 2 (два) календарных дня с даты получения уведомленияв ЛК Исполнителя.']","Срок, предусмотренный для Деактивации ПВЗ, если Исполнитель нарушает условие п. 6.1 Правил оказания услуг более 3 календарных дней подряд, — **на 4-й календарный день** после нарушения.

**Ответ:** на 4-й календарный день."
Какое количество повторных Блокировок ПВЗ Исполнителя в течение одного календарного года может стать основанием для Деактивации ПВЗ?,['24'],"['5 Если к ПВЗ Исполнителя применялась Блокировка более трех раз пооснованиям, указанным в разделе 13 Договора, в течение каждого календарногогода с даты начала Активации ПВЗ, то при наличии оснований для применения4-й Блокировки Заказчик вправе Деактивировать ПВЗ Исполнителя.', 'совершение мнимых и притворных сделок в отношении Товаров сиспользованием ПВЗ, Заказчик вправе Деактивировать ПВЗ Исполнителя.\n5 Если к ПВЗ Исполнителя применялась Блокировка более трех раз пооснованиям, указанным в разделе 13 Договора, в течение каждого календарногогода с даты начала Активации ПВЗ, то при наличии оснований для применения4-й Блокировки Заказчик вправе Деактивировать ПВЗ Исполнителя.\n6 В случае нарушения Исполнителем любого из перечисленных нижеобязательств:- пп. 5.1–5.2 Договора (предоставление достоверных данных и информации),- пп.', '4 При наличии в действиях Исполнителя при оказании Услуг по Договорунарушений законодательства и (или) существенного нарушения условийДоговора, влекущих угрозу безопасности, жизни и (или) здоровья Получателей и/или иных лиц, безопасности и (или) стабильности работы ПВЗ, а такжесовершение действий, направленных на создание сбоев в функционированииработы Портала и/или ПВЗ, умышленное предоставление информации, несоответствующей действительности, при создании ЛК, оскорбления и/илииспользование ненормативной лексики в отношении Получателей и/или иныхлиц, совершение мнимых и притворных сделок в отношении Товаров сиспользованием ПВЗ, Заказчик вправе Деактивировать ПВЗ Исполнителя.\n5 Если к ПВЗ Исполнителя применялась Блокировка более трех раз пооснованиям, указанным в разделе 13 Договора, в течение каждого календарногогода с даты начала Активации ПВЗ, то при наличии оснований для применения4-й Блокировки Заказчик вправе Деактивировать ПВЗ Исполнителя.\n6 В случае нарушения Исполнителем любого из перечисленных нижеобязательств:- пп. 5.1–5.2 Договора (предоставление достоверных данных и информации),- пп.', 'Заказчик вправе отказаться от исполнения Договора в одностороннем внесудебном порядке полностью или\nв части определенного ПВЗ Исполнителя, при наличии у Исполнителя более 1 (одного) ПВЗ, то есть осуществить\nпроцесс Деактивации ПВЗ.\n14.2. Заказчик инициирует процесс Деактивации ПВЗ в указанных ниже случаях:\nОснования и порядок Деактивации Прекращение процессаДеактивации (еслиприменимо)\n1 Если Доля Подмен за последние 30 (тридцать) календарных дней подрядоказания Услуг Исполнителем в ПВЗ будет составлять более 1% (одногопроцента).', 'Исполнитель обязан оказывать Услуги в ПВЗ, независимо от применения Блокировки выплат ПВЗ. Блокировка\nвыплат ПВЗ, применяемая к Исполнителю в соответствии с настоящим пунктом, не ограничивает иные\nфункциональные возможности, предоставляемые Заказчиком Исполнителю в целях исполнения Договора.\nБлокировка выплат ПВЗ не изменяет какие-либо условия Договора, которые продолжают действовать для обеих\nСторон без исключений.\n14. Деактивация и расторжение Договора\n14.1. Заказчик вправе отказаться от исполнения Договора в одностороннем внесудебном порядке полностью или\nв части определенного ПВЗ Исполнителя, при наличии у Исполнителя более 1 (одного) ПВЗ, то есть осуществить\nпроцесс Деактивации ПВЗ.\n14.2. Заказчик инициирует процесс Деактивации ПВЗ в указанных ниже случаях:\nОснования и порядок Деактивации Прекращение процессаДеактивации (еслиприменимо)\n1 Если Доля Подмен за последние 30 (тридцать) календарных дней подрядоказания Услуг Исполнителем в ПВЗ будет составлять более 1% (одногопроцента).', '7 Если в течение 21 (двадцати одного) календарного дня подряд после полученияуведомления в ЛК Рейтинг ПВЗ Исполнителя будет составлять значение нижеМинимального значения рейтинга ПВЗ, то на 22-й (двадцать второй)календарный день Заказчик производит Деактивацию ПВЗ.\n14.3. Заказчик через Портал уведомляет Исполнителя об осуществлении Деактивации ПВЗ Исполнителя с\nуказанием оснований для Деактивации ПВЗ.\n14.4.', 'Если Рейтинг ПВЗ снижался три и более раза нижеМинимального значения рейтинга ПВЗ Исполнителяв течение 1 (одного) календарного года оказанияУслуг Исполнителем с даты Активации ПВЗ попричине нарушений, послуживших основанием дляснижения Рейтинга и приведших к Блокировке ПВЗ,то прекращение применения Блокировки ПВЗ, приусловии устранения нарушений, Заказчиком неприменяется.', 'Если Рейтинг ПВЗ Исполнителя становится равнымили больше Минимального значения рейтинга ПВЗ,Заказчик незамедлительно прекращает БлокировкуПВЗ и направляет соответствующее уведомление вЛК.Заказчик вправе прекратить Блокировку ПВЗИсполнителя, если значение Рейтинга ПВЗИсполнителя менее Минимального значениярейтинга ПВЗ, но Исполнитель прикладывает усилиядля улучшения качества оказания Услуг по Договору,устраняет все нарушения, послужившие основаниемдля снижения Рейтинга и приведшие к БлокировкеПВЗ, а также продолжает соблюдать полностью идобросовестно Договор.Если Рейтинг ПВЗ снижался три и более раза нижеМинимального значения рейтинга ПВЗ Исполнителяв течение 1 (одного) календарного года оказанияУслуг Исполнителем с даты Активации ПВЗ попричине нарушений, послуживших основанием дляснижения Рейтинга и приведших к Блокировке ПВЗ,то прекращение применения Блокировки ПВЗ, приусловии устранения нарушений, Заказчиком неприменяется.', '5.5 Договора (распространение Исполнителем информации, порочащейчесть, достоинство и деловую репутацию Заказчика) систематически (3 (три) иболее раза), Заказчик направляет Исполнителю уведомление через ЛК оДеактивации ПВЗ через 2 (два) календарных дня с даты получения уведомленияв ЛК Исполнителя.\n7 Если в течение 21 (двадцати одного) календарного дня подряд после полученияуведомления в ЛК Рейтинг ПВЗ Исполнителя будет составлять значение нижеМинимального значения рейтинга ПВЗ, то на 22-й (двадцать второй)календарный день Заказчик производит Деактивацию ПВЗ.\n14.3. Заказчик через Портал уведомляет Исполнителя об осуществлении Деактивации ПВЗ Исполнителя с\nуказанием оснований для Деактивации ПВЗ.\n14.4. Если при Деактивации у Исполнителя не остается действующих ПВЗ в Личном кабинете, Договор с таким\nИсполнителем считается расторгнутым (прекращенным) в одностороннем внесудебном порядке, а Личный кабинет\nИсполнителя — удаленным в течение 90 (девяноста) календарных дней со дня направления Заказчиком\nуведомления о Деактивации всех ПВЗ Исполнителя.', 'Основания и Порядок Блокировки Условия снятия Блокировки\n1 Если значение Рейтинга ПВЗ Исполнителя становитсяменьше Минимального значения рейтинга ПВЗ, Заказчикосуществляет Блокировку ПВЗ Исполнителя.В случае если Блокировка ПВЗ Исполнителя длится 2(два) календарных дня подряд и более, то Заказчикразличными способами содействует Исполнителю вулучшении качества оказания Услуг в ПВЗ Исполнителя.']","Количество повторных Блокировок ПВЗ Исполнителя в течение одного календарного года, которое может стать основанием для Деактивации ПВЗ, — **четыре**.

Обоснование:  
В тексте указано:  
> «Если к ПВЗ Исполнителя применялась Блокировка более трёх раз по основаниям, указанным в разделе 13 Договора, в течение каждого календарного года с даты начала Активации ПВЗ, то при наличии оснований для применения 4-й Блокировки Заказчик вправе Деактивировать ПВЗ Исполнителя.»

То есть, **более трёх раз** — это **четыре и более**, а **4-я Блокировка** — это и есть критерий для Деактивации.

**Ответ: 4**."
Какие два условия нарушения Исполнителем обязательств могут привести к Деактивации ПВЗ через 2 календарных дня после получения уведомления в Личном кабинете?,['24'],"['5.5 Договора (распространение Исполнителем информации, порочащейчесть, достоинство и деловую репутацию Заказчика) систематически (3 (три) иболее раза), Заказчик направляет Исполнителю уведомление через ЛК оДеактивации ПВЗ через 2 (два) календарных дня с даты получения уведомленияв ЛК Исполнителя.\n7 Если в течение 21 (двадцати одного) календарного дня подряд после полученияуведомления в ЛК Рейтинг ПВЗ Исполнителя будет составлять значение нижеМинимального значения рейтинга ПВЗ, то на 22-й (двадцать второй)календарный день Заказчик производит Деактивацию ПВЗ.\n14.3. Заказчик через Портал уведомляет Исполнителя об осуществлении Деактивации ПВЗ Исполнителя с\nуказанием оснований для Деактивации ПВЗ.\n14.4. Если при Деактивации у Исполнителя не остается действующих ПВЗ в Личном кабинете, Договор с таким\nИсполнителем считается расторгнутым (прекращенным) в одностороннем внесудебном порядке, а Личный кабинет\nИсполнителя — удаленным в течение 90 (девяноста) календарных дней со дня направления Заказчиком\nуведомления о Деактивации всех ПВЗ Исполнителя.', 'Заказчик направляет Исполнителю уведомление через ЛК, о том, чтона 31-й (календарный) день происходит Деактивация ПВЗ.\nЕсли Доля ПодменИсполнителя снизится втечение 30 (тридцати)календарных дней с моментанаправления Заказчикомуведомления о Деактивации,\n\nОснования и порядок Деактивации Прекращение процессаДеактивации (еслиприменимо)\nто Заказчик вправепрекратить процессДеактивации.\n2 В случае нарушения п. 6.1 Правил оказания услуг (круглосуточный,беспрепятственный доступ в ПВЗ) со стороны Исполнителя на срок более 3(трех) календарных дней подряд, Заказчик направляет Исполнителюуведомление через ЛК о Деактивации ПВЗ на 4-й календарный день.\n3 В случае приостановки оказания Услуг по Договору со стороны Исполнителя насрок более 2 (двух) календарных дней подряд по любым основаниям безпредварительного согласования с Заказчиком, Заказчик направляетИсполнителю уведомление через ЛК о Деактивации ПВЗ на 3-ий\xa0календарныйдень.', 'При\nсистематических нарушениях Блокировка применяется с момента выявления нарушения (с момента уведомления в\nЛК о причинах Блокировки), а для длящихся нарушений — незамедлительно по истечении срока, указанного в\nуведомлении Заказчика об устранении нарушения.\nОснования и Порядок Блокировки Условия снятия Блокировки\n1 Если значение Рейтинга ПВЗ Исполнителя становитсяменьше Минимального значения рейтинга ПВЗ, Заказчикосуществляет Блокировку ПВЗ Исполнителя.В случае если Блокировка ПВЗ Исполнителя длится 2(два) календарных дня подряд и более, то Заказчикразличными способами содействует Исполнителю вулучшении качества оказания Услуг в ПВЗ Исполнителя.', 'Заказчик направляет Исполнителю уведомление через ЛК оДеактивации ПВЗ через 2 (два) календарных дня с даты получения уведомленияв ЛК Исполнителя.', '7 Если в течение 21 (двадцати одного) календарного дня подряд после полученияуведомления в ЛК Рейтинг ПВЗ Исполнителя будет составлять значение нижеМинимального значения рейтинга ПВЗ, то на 22-й (двадцать второй)календарный день Заказчик производит Деактивацию ПВЗ.\n14.3. Заказчик через Портал уведомляет Исполнителя об осуществлении Деактивации ПВЗ Исполнителя с\nуказанием оснований для Деактивации ПВЗ.\n14.4.', '5.5 Договора (распространение Исполнителем информации, порочащейчесть, достоинство и деловую репутацию Заказчика) систематически (3 (три) иболее раза), Заказчик направляет Исполнителю уведомление через ЛК оДеактивации ПВЗ через 2 (два) календарных дня с даты получения уведомленияв ЛК Исполнителя.', '2 В случае нарушения п. 6.1 Правил оказания услуг (круглосуточный,беспрепятственный доступ в ПВЗ) со стороны Исполнителя на срок более 3(трех) календарных дней подряд, Заказчик направляет Исполнителюуведомление через ЛК о Деактивации ПВЗ на 4-й календарный день.', '14.4. Если при Деактивации у Исполнителя не остается действующих ПВЗ в Личном кабинете, Договор с таким\nИсполнителем считается расторгнутым (прекращенным) в одностороннем внесудебном порядке, а Личный кабинет\nИсполнителя — удаленным в течение 90 (девяноста) календарных дней со дня направления Заказчиком\nуведомления о Деактивации всех ПВЗ Исполнителя.', 'Заказчик направляет Исполнителю уведомление через ЛК, о том, чтона 31-й (календарный) день происходит Деактивация ПВЗ.\nЕсли Доля ПодменИсполнителя снизится втечение 30 (тридцати)календарных дней с моментанаправления Заказчикомуведомления о Деактивации,\n\nОснования и порядок Деактивации Прекращение процессаДеактивации (еслиприменимо)\nто Заказчик вправепрекратить процессДеактивации.\n2 В случае нарушения п.', '2 В случае нарушения Исполнителем любого изперечисленных ниже обязательств 3 (три) и более разподряд в течение 1 (одного) календарного года оказанияУслуг Исполнителем в ПВЗ с даты Активации ПВЗ(систематическое нарушение) или при неустранениидлящегося нарушения после получения соответствующегоуведомления от Заказчика:1) указанных в Договоре:- пп.']","Из предоставленного контекста два условия нарушения Исполнителем обязательств, которые могут привести к **Деактивации ПВЗ через 2 календарных дня после получения уведомления в Личном кабинете**, — это:

1. **Систематические нарушения (3 и более раза в течение одного календарного года)** — включая нарушение п. 6.1 Правил оказания услуг (круглосуточный, беспрепятственный доступ в ПВЗ) на срок более 3 календарных дней подряд.  
   → В тексте указано: *""Заказчик направляет Исполнителю уведомление через ЛК о Деактивации ПВЗ на 4-й календарный день""* — **не соответствует** условию ""через 2 дня"".

2. **Приостановка оказания Услуг по Договору со стороны Исполнителя на срок более 2 календарных дней подряд без предварительного согласования с Заказчиком**.  
   → В тексте указано: *""Заказчик направляет Исполнителю уведомление через ЛК о Деактивации ПВЗ на 3-й календарный день""* — **тоже не соответствует** условию ""через 2 дня"".

Однако в **пункте 5.5** прямо указано:  
> *""Заказчик направляет Исполнителю уведомление через ЛК о Деактивации ПВЗ через 2 (два) календарных дня с даты получения уведомления в ЛК Исполнителя.""*  
и это указано в контексте **систематических нарушений** (3 и более раза).

Таким образом, **единственное условие**, при котором **Деактивация происходит через 2 календарных дня после получения уведомления**, — это **систематические нарушения (3 и более раза)**, включая нарушение обязательств, указанных в Договоре.

Однако в тексте **не указано**, что именно из обязательств — например, нарушение доступа в ПВЗ — приводит к Деактивации **через 2 дня**.  
Только **нарушение доступа в ПВЗ** (п. 6.1) приводит к уведомлению **на 4-й день**, а приостановка услуг — на **3-й день**.

Следовательно, **в контексте нет явного указания на два условия**, при которых Деактивация происходит **через 2 календарных дня**.

Однако в **пункте 5.5** говорится, что при систематических нарушениях (3 и более раз) Заказчик направляет уведомление **через 2 дня**.

Таким образом, **единственное условие**, приводящее к Деактивации через 2 дня, — **систематические нарушения (3 и более раза)**.

Но вопрос требует **два условия**.

Поскольку в тексте **нет двух условий**, при которых Деактивация происходит **через 2 календарных дня**, а только одно — систематические нарушения, и другие случаи (нарушение доступа, приостановка услуг) — через 3 или 4 дня, то:

👉 **Информации недостаточно** для указания двух условий, приводящих к Деактивации через 2 календарных дня.

**Однако**, если рассматривать **систематические нарушения** как основное условие, и **не уточнено**, что именно из обязательств — то, возможно, имеется в виду **нарушение доступа в ПВЗ** и **другие обязательства**, но **все они не приводят к Деактивации через 2 дня**.

**Вывод:**

❌ В тексте **нет двух условий**, при которых Деактивация происходит **через 2 календарных дня**.  
✅ Только одно — систематические нарушения (3 и более раза).

**Ответ: Информации недостаточно.**"
"Какой срок установлен для проведения инвентаризации Товаров в ПВЗ, находящемся в процессе Деактивации?",['25'],"['Исполнитель обязан осуществить инвентаризацию Товаров в ПВЗ, находящемся в процессе Деактивации, в\nтечение 24 (двадцати четырех) часов с момента начала инвентаризации, указанного в уведомлении,\nзаблаговременно направляемом Заказчиком в Личный кабинет Исполнителя.\n14.8.', '14.6. Исполнитель обязуется в течение 14 (четырнадцати) календарных дней с даты утверждения Заказчиком\nзаявки Исполнителя на Деактивацию ПВЗ:\n• надлежащим образом оказывать Услуги на таком ПВЗ;\n• или собственными силами осуществить перемещение находящихся в ПВЗ Товаров в альтернативный ПВЗ,\nинформация о котором направляется Заказчиком после утверждения заявки Исполнителя о начале процесса\nДеактивации ПВЗ.\nПеремещение Товаров в альтернативный ПВЗ допускается исключительно после проведения Исполнителем\nинвентаризации Товаров в ПВЗ, находящемся в процессе Деактивации.\n14.7. Инвентаризация Товаров в ПВЗ, находящемся в процессе Деактивации, осуществляется Исполнителем\nпосредством использования Портала в Возвратные коробки с обязательной фиксацией проводимой инвентаризации\nна камеры видеонаблюдения.\nИсполнитель обязан осуществить инвентаризацию Товаров в ПВЗ, находящемся в процессе Деактивации, в\nтечение 24 (двадцати четырех) часов с момента начала инвентаризации, указанного в уведомлении,\nзаблаговременно направляемом Заказчиком в Личный кабинет Исполнителя.\n14.8.', 'Нормативнаяпродолжительность времени проведенияинвентаризации составляет 24 (двадцать четыре)часа с момента начала инвентаризации.В случае если Исполнитель не проводитинвентаризацию Товаров в ПВЗ в установленныенастоящим пунктом сроки, Товары, числящиеся вПВЗ,', 'Нормативнаяпродолжительность времени проведенияинвентаризации составляет 24 (двадцать четыре)часа с момента начала инвентаризации.В случае если Исполнитель не проводитинвентаризацию Товаров в ПВЗ в установленныенастоящим пунктом сроки, Товары, числящиеся вПВЗ, начиная со дня следующего за последнимпредставленным для инвентаризации днем,считаются утраченными.\nЗа каждое выявленное нарушение – 50000 (пятьдесят тысяч) российскихрублей.\n31. 6.4.6.4.1.', 'Нормативнаяпродолжительность времени проведенияинвентаризации составляет 24 (двадцать четыре)часа с момента начала инвентаризации.В случае если Исполнитель не проводитинвентаризацию Товаров в ПВЗ в установленныенастоящим пунктом сроки, Товары, числящиеся вПВЗ, начиная со дня следующего за последнимпредставленным для инвентаризации днем,считаются утраченными.\nЗа каждое выявленное нарушение – 50000 (пятьдесят тысяч) российскихрублей.\n31. 6.4.6.4.1. Исполнитель обязуется по требованию Заказчикапредоставить видеоматериалы с камервидеонаблюдения, установленных на ПВЗ, втечение 6 (шести) часов с момента направлениятребования Исполнителю за запрашиваемыйЗаказчиком период времени.6.4.1. Заказчик вправе запрашивать у Исполнителявидеозаписи с камер видеонаблюдения ифотографии в отношении Товаров, указанных вПоручении, подтверждающие любые фактыобработки таких Товаров в конкретном ПВЗ.Исполнитель обязан предоставить запрошенныевидеозаписи и/или фотографии в течение 48(сорока восьми) часов с момента направленияЗаказчиком запроса.\n6.4.', '6.2. Исполнитель обязан не реже 1 (одного) раза в 30 (тридцать) календарных дней проводить инвентаризацию\nТоваров в ПВЗ посредством Портала с обязательной фиксацией проводимой инвентаризации на камеры\nвидеонаблюдения. При проведении инвентаризации должны быть отсканированы (обработаны) штрихкоды всех\nчислящихся в ПВЗ Товаров, а статусы Товаров должны быть отражены на Портале. Нормативная продолжительность\nвремени проведения инвентаризации составляет 24 (двадцать четыре) часа с момента начала инвентаризации.', 'Перемещение Товаров в альтернативный ПВЗ допускается исключительно после проведения Исполнителем\nинвентаризации Товаров в ПВЗ, находящемся в процессе Деактивации.\n14.7. Инвентаризация Товаров в ПВЗ, находящемся в процессе Деактивации, осуществляется Исполнителем\nпосредством использования Портала в Возвратные коробки с обязательной фиксацией проводимой инвентаризации\nна камеры видеонаблюдения.', 'При проведении инвентаризации должны быть отсканированы (обработаны) штрихкоды всех\nчислящихся в ПВЗ Товаров, а статусы Товаров должны быть отражены на Портале. Нормативная продолжительность\nвремени проведения инвентаризации составляет 24 (двадцать четыре) часа с момента начала инвентаризации.', 'Перемещение Товаров в альтернативный ПВЗ допускается исключительно после проведения Исполнителем\nинвентаризации Товаров в ПВЗ, находящемся в процессе Деактивации.\n14.7.', 'Контроль качества оказания Услуг\n6.1. Исполнитель, заключая Договор, подтверждает предоставление Заказчику (его представителям) права на\nпроведение проверок качества оказания Услуг, в том числе права на беспрепятственный доступ в ПВЗ, включая, но\nне ограничиваясь: в целях проведения инвентаризации Товаров и (или) проверки их наличия в местах хранения (в\nПВЗ), а также в целях изъятия Товаров и их вывоза Заказчиком в случаях, предусмотренных Договором.\n6.2. Исполнитель обязан не реже 1 (одного) раза в 30 (тридцать) календарных дней проводить инвентаризацию\nТоваров в ПВЗ посредством Портала с обязательной фиксацией проводимой инвентаризации на камеры\nвидеонаблюдения. При проведении инвентаризации должны быть отсканированы (обработаны) штрихкоды всех\nчислящихся в ПВЗ Товаров, а статусы Товаров должны быть отражены на Портале. Нормативная продолжительность\nвремени проведения инвентаризации составляет 24 (двадцать четыре) часа с момента начала инвентаризации.']","Срок, установленный для проведения инвентаризации Товаров в ПВЗ, находящемся в процессе Деактивации, — **24 (двадцать четыре) часа** с момента начала инвентаризации, указанного в уведомлении, заблаговременно направляемом Заказчиком в Личный кабинет Исполнителя."
"Что обязан сделать Исполнитель в случае непоступления Товаров в альтернативный ПВЗ, указанный Заказчиком?",['25'],"['14.9. В случае непоступления Товаров в альтернативный ПВЗ, указанный Заказчиком, Исполнитель обязуется\nнезамедлительно с момента поступления запроса Заказчика предоставить записи с камер видеонаблюдения,\nподтверждающие формирование Возвратных коробок.', 'либо в случае, если информация о фактическом количестве и состоянии инвентаризируемых\nТоваров не соответствует информации, отраженной о них на Портале.\n14.9. В случае непоступления Товаров в альтернативный ПВЗ, указанный Заказчиком, Исполнитель обязуется\nнезамедлительно с момента поступления запроса Заказчика предоставить записи с камер видеонаблюдения,\nподтверждающие формирование Возвратных коробок.', '14.8. Инвентаризация завершается:\n• в случае обработки Исполнителем всех числящихся в ПВЗ Товаров и установления Заказчиком соответствия\nфактического количества и состояния инвентаризируемых Товаров информации, отраженной о них на Портале;\n• по истечение срока проведения инвентаризации, установленного настоящим пунктом, Заказчик в\nодностороннем порядке, без предварительного уведомления Исполнителя производит удержание из вознаграждения\nИсполнителя сумму Стоимостей Товаров, не обработанных Исполнителем при проведении инвентаризации в\nустановленные сроки, либо в случае, если информация о фактическом количестве и состоянии инвентаризируемых\nТоваров не соответствует информации, отраженной о них на Портале.\n14.9. В случае непоступления Товаров в альтернативный ПВЗ, указанный Заказчиком, Исполнитель обязуется\nнезамедлительно с момента поступления запроса Заказчика предоставить записи с камер видеонаблюдения,\nподтверждающие формирование Возвратных коробок.', '14.6. Исполнитель обязуется в течение 14 (четырнадцати) календарных дней с даты утверждения Заказчиком\nзаявки Исполнителя на Деактивацию ПВЗ:\n• надлежащим образом оказывать Услуги на таком ПВЗ;\n• или собственными силами осуществить перемещение находящихся в ПВЗ Товаров в альтернативный ПВЗ,\nинформация о котором направляется Заказчиком после утверждения заявки Исполнителя о начале процесса\nДеактивации ПВЗ.\nПеремещение Товаров в альтернативный ПВЗ допускается исключительно после проведения Исполнителем\nинвентаризации Товаров в ПВЗ, находящемся в процессе Деактивации.\n14.7. Инвентаризация Товаров в ПВЗ, находящемся в процессе Деактивации, осуществляется Исполнителем\nпосредством использования Портала в Возвратные коробки с обязательной фиксацией проводимой инвентаризации\nна камеры видеонаблюдения.\nИсполнитель обязан осуществить инвентаризацию Товаров в ПВЗ, находящемся в процессе Деактивации, в\nтечение 24 (двадцати четырех) часов с момента начала инвентаризации, указанного в уведомлении,\nзаблаговременно направляемом Заказчиком в Личный кабинет Исполнителя.\n14.8.', 'В случае поступления по указанному Заказчиком адресу\nТоваров с недостатками (включая, но не ограничиваясь: частичное повреждение, неверное вложение) и/или Подмен,\nИсполнитель обязуется возместить Стоимость Товаров с недостатками и/или замененных на Подмены.\nВзаиморасчеты по недостачам и недостаткам Товаров производятся Сторонами в соответствии с условиями\nДоговора.\n14.10. Утвержденная Заказчиком заявка Исполнителя на осуществление процесса Деактивации ПВЗ не может\nбыть отозвана Исполнителем. Данное условие не лишает Исполнителя возможности осуществить Активацию нового\nПВЗ.\n14.11. При расторжении Договора по любому основанию Исполнитель обязан передать Заказчику Товары,\nнаходящиеся в ПВЗ, по первому требованию Заказчика в течение 3 (трех) календарных дней с даты получения\nсоответствующего требования, а также предоставить доступ представителям Заказчика к Товарам в ПВЗ для\nпроведения инвентаризации. В указанном случае Стороны проводят сверку по взаимным обязательствам и на\nосновании сверки осуществляют итоговые взаиморасчеты в течение 60 (шестидесяти) календарных дней с даты\nрасторжения Договора.', '14.6. Исполнитель обязуется в течение 14 (четырнадцати) календарных дней с даты утверждения Заказчиком\nзаявки Исполнителя на Деактивацию ПВЗ:\n• надлежащим образом оказывать Услуги на таком ПВЗ;\n• или собственными силами осуществить перемещение находящихся в ПВЗ Товаров в альтернативный ПВЗ,\nинформация о котором направляется Заказчиком после утверждения заявки Исполнителя о начале процесса\nДеактивации ПВЗ.', 'Исполнитель принимает на\nсебя обязательство принимать все разумные и доступные меры для обеспечения сохранности, предотвращения\nпорчи или повреждения Товара.\n5.20. Исполнитель обязуется выдать поступивший в ПВЗ Товар Получателям в количестве, ассортименте и\nкомплектации в соответствии с положениями п. 5.3 Договора и требованиями, указанными в Поручениях Заказчика.\n5.21. Исполнитель обязуется принимать Товар от Продавца и выдавать Товар Продавцу исключительно в\nприсутствии Продавца либо лица, документально уполномоченного Продавцом на передачу или приемку такого\nТовара, под камерами видеонаблюдения, установленными в ПВЗ.\n5.22. Исполнитель обязуется в любое время прибытия транспортного средства с Товаром к ПВЗ в часы работы\nПВЗ принимать от Заказчика/Перевозчика/Продавца и передавать Товар Заказчику/Перевозчику/Продавцу.\n5.23. Исполнитель не вправе перемещать Товар, Маркетплейс-короба, Маркетплейс Товары, Клиентские\nвозвраты на другие ПВЗ, выносить Товар за территорию ПВЗ, если это прямо не предусмотрено Поручением\nЗаказчика.\n6. Права и обязательства Заказчика\n\n6.1.', 'При получении\nпретензий Заказчик вправе переадресовать их в адрес Исполнителя и/или сообщить данные об Исполнителе\nгосударственным органам.\nОперации с Товаром\n5.17. При приёмке Товара в ПВЗ Исполнитель обязуется отражать в Личном кабинете достоверные сведения о\nналичии или отсутствии недостатка в принятом Товаре (делать соответствующую отметку в ЛК на Портале только\nпри действительном наличии недостатка Товара).\n5.18. В ходе обработки или сортировки поступившего на ПВЗ Товара, или подготовки Товара к возврату, в случае\nобнаружения в Товаре недостатка Исполнитель обязуется действовать в соответствии с настоящим Договором и\nИнструкциями и предоставить достоверную информацию о недостатке Товара Заказчику, проставив\nсоответствующую отметку с выбором типа выявленного недостатка, посредством Личного кабинета с приложением\nподтверждающих фото- и/или видео доказательств. Предоставленные фото- и/или видео доказательства не должны\nсодержать персональные данные третьих лиц.\n5.19. Исполнитель обязуется обеспечить сохранность Товаров, находящихся в ПВЗ.', 'Данное условие не лишает Исполнителя возможности осуществить Активацию нового\nПВЗ.\n14.11. При расторжении Договора по любому основанию Исполнитель обязан передать Заказчику Товары,\nнаходящиеся в ПВЗ, по первому требованию Заказчика в течение 3 (трех) календарных дней с даты получения\nсоответствующего требования, а также предоставить доступ представителям Заказчика к Товарам в ПВЗ для\nпроведения инвентаризации.', '2.4. Исполнитель обязуется подготовить для передачи и направить на Склад Клиентские возвраты, не\nвостребованные Клиентом Товары, Товары, Поручения на которые были отменены посредством Портала, либо\nТовары, доставленные на ПВЗ Исполнителя ошибочно, не по адресу (статусы на Портале: Излишки/Ошибочные\nдоставки/Ошибочный ПВЗ), путем физического вложения указанного Товара Исполнителем в Возвратную коробку в\nтечение 24 (двадцати четырех) часов с момента:\n• отказа от Товара Клиентом, или\n• истечения срока, когда Товар мог быть получен в ПВЗ Исполнителя,']","В случае непоступления Товаров в альтернативный ПВЗ, указанный Заказчиком, Исполнитель обязан **незамедлительно с момента поступления запроса Заказчика предоставить записи с камер видеонаблюдения, подтверждающие формирование Возвратных коробок**."
"Какие действия должен предпринять Исполнитель в случае, если информация о фактическом количестве и состоянии инвентаризируемых Товаров не соответствует информации, отраженной о них на Портале?",['25'],"['14.8. Инвентаризация завершается:\n• в случае обработки Исполнителем всех числящихся в ПВЗ Товаров и установления Заказчиком соответствия\nфактического количества и состояния инвентаризируемых Товаров информации, отраженной о них на Портале;\n• по истечение срока проведения инвентаризации, установленного настоящим пунктом, Заказчик в\nодностороннем порядке, без предварительного уведомления Исполнителя производит удержание из вознаграждения\nИсполнителя сумму Стоимостей Товаров, не обработанных Исполнителем при проведении инвентаризации в\nустановленные сроки, либо в случае, если информация о фактическом количестве и состоянии инвентаризируемых\nТоваров не соответствует информации, отраженной о них на Портале.\n14.9. В случае непоступления Товаров в альтернативный ПВЗ, указанный Заказчиком, Исполнитель обязуется\nнезамедлительно с момента поступления запроса Заказчика предоставить записи с камер видеонаблюдения,\nподтверждающие формирование Возвратных коробок.', 'либо в случае, если информация о фактическом количестве и состоянии инвентаризируемых\nТоваров не соответствует информации, отраженной о них на Портале.\n14.9. В случае непоступления Товаров в альтернативный ПВЗ, указанный Заказчиком, Исполнитель обязуется\nнезамедлительно с момента поступления запроса Заказчика предоставить записи с камер видеонаблюдения,\nподтверждающие формирование Возвратных коробок.', 'либо в случае, если информация о фактическом количестве и состоянии инвентаризируемых\nТоваров не соответствует информации, отраженной о них на Портале.\n14.9.', '14.8. Инвентаризация завершается:\n• в случае обработки Исполнителем всех числящихся в ПВЗ Товаров и установления Заказчиком соответствия\nфактического количества и состояния инвентаризируемых Товаров информации, отраженной о них на Портале;\n• по истечение срока проведения инвентаризации, установленного настоящим пунктом, Заказчик в\nодностороннем порядке, без предварительного уведомления Исполнителя производит удержание из вознаграждения\nИсполнителя сумму Стоимостей Товаров, не обработанных Исполнителем при проведении инвентаризации в\nустановленные сроки, либо в случае,', '14.8. Инвентаризация завершается:\n• в случае обработки Исполнителем всех числящихся в ПВЗ Товаров и установления Заказчиком соответствия\nфактического количества и состояния инвентаризируемых Товаров информации, отраженной о них на Портале;\n• по истечение срока проведения инвентаризации,', '30. 6.2. Исполнитель обязан не реже 1 (одного) раза в 30(тридцать) календарных дней проводитьинвентаризацию Товаров в ПВЗ посредствомПортала с обязательной фиксацией проводимойинвентаризации на камеры видеонаблюдения. Припроведении инвентаризации должны бытьотсканированы (обработаны) штрихкоды всехчислящихся в ПВЗ Товаров, а статусы Товаровдолжны быть отражены на Портале.', 'При оказании Услуг Товар считается утраченным/утерянным Исполнителем в следующих случаях:\n1) непредоставление Исполнителем информации о движении Товара, находящегося на ПВЗ и/или информации\nо возврате, отказе от Товара в сроки, указанные в Поручении;\n2) если Товар не обнаружен Заказчиком в Возвратной коробке, переданной Исполнителем из ПВЗ Заказчику;\n3) если в ходе проводимой в ПВЗ инвентаризации Товар не обработан (не отсканирован штрих-код) и/или не\nобнаружен в том месте, где он должен находиться согласно статусу, отраженному в Личном кабинете;\n4) отказ Исполнителя от проведения инвентаризации или непредоставление доступа в ПВЗ Заказчику для её\nпроведения после направления Заказчиком уведомления о дате и времени проведения инвентаризации;\n5) полная или частичная гибель Товара, утрата, порча или повреждение Товара в таре, включая нарушение\nтоварного вида Товара (товарной упаковки);\n6) несоответствие вложения Товара в упаковке/таре/товарной упаковке Заказу (Подмена), в т.ч.', '6.2. Исполнитель обязан не реже 1 (одного) раза в 30 (тридцать) календарных дней проводить инвентаризацию\nТоваров в ПВЗ посредством Портала с обязательной фиксацией проводимой инвентаризации на камеры\nвидеонаблюдения. При проведении инвентаризации должны быть отсканированы (обработаны) штрихкоды всех\nчислящихся в ПВЗ Товаров, а статусы Товаров должны быть отражены на Портале. Нормативная продолжительность\nвремени проведения инвентаризации составляет 24 (двадцать четыре) часа с момента начала инвентаризации.', 'В\nслучае если Исполнитель не проводит инвентаризацию Товаров в ПВЗ в установленные настоящим пунктом сроки,\nТовары, числящиеся на ПВЗ, начиная со дня, следующего за последним представленным для инвентаризации днем,\nсчитаются утраченными.\n6.3. Исполнитель обязан предоставлять Заказчику сведения о возможности оказания Услуг, в том числе:\n6.3.1. В течение 3 (трех) календарных дней с момента получения запроса посредством Портала предоставить\nЗаказчику качественные фотоснимки ПВЗ (в соответствии с требованиями и указаниями Заказчика) путем их\nразмещения (загрузки) на Портал по адресу и согласно инструкциям, указанным на Портале и в ЛК, или иным\nопределенным Заказчиком способом.\n\n6.3.2. Предоставить Заказчику полный доступ к камерам видеонаблюдения в ПВЗ в период действия Договора\nс правом обработки/хранения/копирования информации, полученной с камер видеонаблюдения.\n6.4. Исполнитель обязуется по требованию Заказчика предоставить видеоматериалы с камер видеонаблюдения,\nустановленных на ПВЗ, в течение 6 (шести) часов с момента направления требования Исполнителю за\nзапрашиваемый Заказчиком период времени.\n6.4.1.', 'Исполнитель несет ответственность в соответствии с Приложением № 4\nДоговора, также в случае, если неверный Товар вложен в Возвратную коробку, т.е. Товар, не предназначенный к\nвозврату из ПВЗ на Склад.\n2.4.2. Факт передачи Исполнителю Товаров и передачи Исполнителем возвращаемых или невостребованных\nТоваров отражается на Портале на основании данных, полученных Заказчиком от Исполнителя в порядке,\nпредусмотренном настоящим разделом. Стороны признают, что данные на Портале являются достаточным и\nнадлежащим доказательством факта передачи Исполнителю Товаров.\n2.5. Исполнитель обязуется принимать от Продавцов Маркетплейс Товары и Товары в Маркетплейс-коробах\n(габариты которых указаны в Поручении на Портале) исключительно в присутствии Продавцов, либо лиц,\nдокументально уполномоченных Продавцами на передачу таких Товаров, под камерами видеонаблюдения,\nустановленными на ПВЗ, и хранить их до передачи Перевозчику для доставки на Склад, выдачи Получателю или\nвозврата Продавцу.']","В случае, если информация о фактическом количестве и состоянии инвентаризируемых Товаров не соответствует информации, отраженной о них на Портале, **Заказчик в одностороннем порядке, без предварительного уведомления Исполнителя, производит удержание из вознаграждения Исполнителя суммы Стоимостей Товаров, не обработанных Исполнителем при проведении инвентаризации в установленные сроки**."
Какой срок у Заказчика на рассмотрение заявки Исполнителя о смене Исполнителя?,['26'],"['16.5. Заказчик рассматривает заявку Исполнителя в течение 30 (тридцати) календарных дней и проверяет\nпредоставленные данные о новом Исполнителе, а также проверяет наличие задолженности Исполнителя и нового\nИсполнителя перед Заказчиком.', '16.5. Заказчик рассматривает заявку Исполнителя в течение 30 (тридцати) календарных дней и проверяет\nпредоставленные данные о новом Исполнителе, а также проверяет наличие задолженности Исполнителя и нового\nИсполнителя перед Заказчиком. Заказчик вправе отказать в согласовании заявки Исполнителя.\n17. Заключительные положения\n17.1. Отношения сторон по Договору, заключение, прекращение и исполнение Договора регулируются\nдействующим законодательством Российской Федерации.\n17.2. Направление юридически значимых сообщений:\n17.2.1.', '16.5. Заказчик рассматривает заявку Исполнителя в течение 30 (тридцати) календарных дней и проверяет\nпредоставленные данные о новом Исполнителе, а также проверяет наличие задолженности Исполнителя и нового\nИсполнителя перед Заказчиком. Заказчик вправе отказать в согласовании заявки Исполнителя.\n17. Заключительные положения\n17.1. Отношения сторон по Договору, заключение, прекращение и исполнение Договора регулируются\nдействующим законодательством Российской Федерации.\n17.2. Направление юридически значимых сообщений:\n17.2.1. Заявления, уведомления, извещения, требования или любые иные юридически значимые сообщения, в\nтом числе составленные в соответствии с п.', '16. Замена Исполнителя по Договору\n16.1. Смена Исполнителя на другое лицо возможна:\n— до истечения 6 (шести) месяцев с даты Активации ПВЗ только при условии перечисления Исполнителем\n(действующим или новым) Заказчику платы за замену на стороне Исполнителя в размере, действующем на момент\nподачи заявки о смене и указанном на Портале.', 'Изменения вступают в силу с 00 часов 00 минут:\n▪ дня, который указан в новости, но который может наступить не ранее чем по истечении 14 (четырнадцати)\nполных суток с даты опубликования новости о внесении Изменений — если Изменения касаются изменения порядка\nрасчета стоимости Услуг по Договору, тарифов или если Изменения требуют адаптации деятельности ПВЗ под новые\nусловия;\n▪ дня, который указан в новости, но который наступит не ранее чем по истечении 7 (семи) полных суток с даты\nопубликования новости о внесении Изменений, — все иные Изменения.\n16. Замена Исполнителя по Договору\n16.1. Смена Исполнителя на другое лицо возможна:\n— до истечения 6 (шести) месяцев с даты Активации ПВЗ только при условии перечисления Исполнителем\n(действующим или новым) Заказчику платы за замену на стороне Исполнителя в размере, действующем на момент\nподачи заявки о смене и указанном на Портале.\n— после истечения 6 (шести) месяцев с даты Активации ПВЗ – Заказчик оставляет за собой право не взимать плату\nза смену на стороне Исполнителя (действующего или нового), о чем уведомит Исполнителя после рассмотрения\nзаявки согласно п. 16.5. Договора.', '16. Замена Исполнителя по Договору\n16.1. Смена Исполнителя на другое лицо возможна:\n— до истечения 6 (шести) месяцев с даты Активации ПВЗ только при условии перечисления Исполнителем\n(действующим или новым) Заказчику платы за замену на стороне Исполнителя в размере,', 'При этом срок рассмотрения\nможет быть продлен по инициативе Заказчика для полного и всестороннего рассмотрения всех обстоятельств\nзапроса, а также получения дополнительной информации и документов от Исполнителя, о чем Заказчик уведомляет\nИсполнителя. Максимальный срок такого ответа на запрос Исполнителя в любом случае не может превышать 30\n(тридцать) календарных дней.\n7.', 'Под сменой Исполнителя понимается замена Стороны Исполнителя по Договору, при\nкоторой изначальный Исполнитель передаёт все права и обязанности по Договору новому Исполнителю.\nИсполнитель обязан возвратить Заказчику суммы Дополнительных поддерживающих выплат:\n• в течение 5 (пяти) календарных дней до даты Деактивации ПВЗ Исполнителя;\n• не позднее 5 (пяти) календарных дней до даты смены Исполнителя.', '16.5. Договора.\nЗаказчик вправе обусловить выдачу согласия на замену Исполнителя выплатой Исполнителем денежной суммы,\nкоторая устанавливается на усмотрение Заказчика и доступна для ознакомления Исполнителю до совершения\nдействий по смене на другое лицо.\n16.2. После получения согласования от Заказчика о смене Исполнителя в Договоре:\n• действующий Исполнитель полностью погашает свою задолженность перед Заказчиком до того, как он сам\nбудет заменен новым Исполнителем в Договоре, или\n• новый Исполнитель, принимая на себя все права и обязанности по Договору, также принимает на себя\nполностью задолженность текущего Исполнителя по Договору (перевод долга).\n16.3. При смене Исполнителя по Договору расчеты между Исполнителем и новым Исполнителем\nосуществляются на основании отдельных договоренностей, достигнутых между сторонами, и Заказчик не является\nучастником таких взаиморасчетов.\n16.4. В случае необходимости сменить Исполнителя по Договору, Исполнитель направляет Заказчику\nсоответствующую заявку через Личный кабинет. В заявке на смену Исполнителя указываются контактные данные\nнового Исполнителя.\n16.5.', '16.3. При смене Исполнителя по Договору расчеты между Исполнителем и новым Исполнителем\nосуществляются на основании отдельных договоренностей, достигнутых между сторонами, и Заказчик не является\nучастником таких взаиморасчетов.\n16.4. В случае необходимости сменить Исполнителя по Договору, Исполнитель направляет Заказчику\nсоответствующую заявку через Личный кабинет. В заявке на смену Исполнителя указываются контактные данные\nнового Исполнителя.\n16.5.']","Срок у Заказчика на рассмотрение заявки Исполнителя о смене Исполнителя — **30 (тридцать) календарных дней**.

Этот срок указан в пункте 16.5: «Заказчик рассматривает заявку Исполнителя в течение 30 (тридцати) календарных дней и проверяет предоставленные данные о новом Исполнителе, а также проверяет наличие задолженности Исполнителя и нового Исполнителя перед Заказчиком».  

Кроме того, указано, что срок может быть продлен по инициативе Заказчика, но **максимальный срок не может превышать 30 календарных дней**."
Какие условия необходимо выполнить Исполнителю для смены на другое лицо в течение первых 6 месяцев после Активации ПВЗ?,['26'],"['16. Замена Исполнителя по Договору\n16.1. Смена Исполнителя на другое лицо возможна:\n— до истечения 6 (шести) месяцев с даты Активации ПВЗ только при условии перечисления Исполнителем\n(действующим или новым) Заказчику платы за замену на стороне Исполнителя в размере, действующем на момент\nподачи заявки о смене и указанном на Портале.', '16. Замена Исполнителя по Договору\n16.1. Смена Исполнителя на другое лицо возможна:\n— до истечения 6 (шести) месяцев с даты Активации ПВЗ только при условии перечисления Исполнителем\n(действующим или новым) Заказчику платы за замену на стороне Исполнителя в размере,', 'Изменения вступают в силу с 00 часов 00 минут:\n▪ дня, который указан в новости, но который может наступить не ранее чем по истечении 14 (четырнадцати)\nполных суток с даты опубликования новости о внесении Изменений — если Изменения касаются изменения порядка\nрасчета стоимости Услуг по Договору, тарифов или если Изменения требуют адаптации деятельности ПВЗ под новые\nусловия;\n▪ дня, который указан в новости, но который наступит не ранее чем по истечении 7 (семи) полных суток с даты\nопубликования новости о внесении Изменений, — все иные Изменения.\n16. Замена Исполнителя по Договору\n16.1. Смена Исполнителя на другое лицо возможна:\n— до истечения 6 (шести) месяцев с даты Активации ПВЗ только при условии перечисления Исполнителем\n(действующим или новым) Заказчику платы за замену на стороне Исполнителя в размере, действующем на момент\nподачи заявки о смене и указанном на Портале.\n— после истечения 6 (шести) месяцев с даты Активации ПВЗ – Заказчик оставляет за собой право не взимать плату\nза смену на стороне Исполнителя (действующего или нового), о чем уведомит Исполнителя после рассмотрения\nзаявки согласно п. 16.5. Договора.', '7.1., 7.1.1., 7.1.2. и 7.2 Договора, если в течение 12 (двенадцати) календарных месяцев или, если в течение 18\n(восемнадцати) календарных месяцев, при получении от одной до девяти Дополнительных выплат согласно п. 7.2.\nДоговора, после Активации ПВЗ произойдет любое из нижеследующих событий:\n• Деактивация ПВЗ Исполнителя в результате прекращения оказания Услуг в ПВЗ Исполнителем по\nоснованиям, предусмотренным Договором;\n• Смена Исполнителя. Под сменой Исполнителя понимается замена Стороны Исполнителя по Договору, при\nкоторой изначальный Исполнитель передаёт все права и обязанности по Договору новому Исполнителю.\nИсполнитель обязан возвратить Заказчику суммы Дополнительных поддерживающих выплат:\n• в течение 5 (пяти) календарных дней до даты Деактивации ПВЗ Исполнителя;\n• не позднее 5 (пяти) календарных дней до даты смены Исполнителя.', '3.13. В случае если продолжительность работы ПВЗ с момента Активации составила не менее 6 (шести) месяцев,\nИсполнитель после согласования Заказчиком заявки, поданной через Личный кабинет, вправе изменить место\nнахождения ПВЗ путем его открытия в новом помещении, по иному адресу,', '— после истечения 6 (шести) месяцев с даты Активации ПВЗ – Заказчик оставляет за собой право не взимать плату\nза смену на стороне Исполнителя (действующего или нового), о чем уведомит Исполнителя после рассмотрения\nзаявки согласно п. 16.5. Договора.', '3.13. В случае если продолжительность работы ПВЗ с момента Активации составила не менее 6 (шести) месяцев,\nИсполнитель после согласования Заказчиком заявки, поданной через Личный кабинет, вправе изменить место\nнахождения ПВЗ путем его открытия в новом помещении, по иному адресу, в радиусе до 500 (пятисот) метров от\nпрежнего места нахождения ПВЗ.\n3.14. Исполнитель обязуется обеспечить в ПВЗ порядок, чистоту, надлежащее освещение и вентиляцию\n(воздухообмен).', '3.13. В случае если продолжительность работы ПВЗ с момента Активации составила не менее 6 (шести) месяцев,\nИсполнитель после согласования Заказчиком заявки, поданной через Личный кабинет, вправе изменить место\nнахождения ПВЗ путем его открытия в новом помещении, по иному адресу, в радиусе до 500 (пятисот) метров от\nпрежнего места нахождения ПВЗ.\n3.14. Исполнитель обязуется обеспечить в ПВЗ порядок, чистоту, надлежащее освещение и вентиляцию\n(воздухообмен).\nВ случае если по результатам проверки, проведенной по инициативе Заказчика, либо проверки, проведенной на\nосновании поступивших жалоб Клиентов, Заказчиком будет выявлено в ПВЗ наличие загрязнения, недостаточного\nосвещения и/или вентиляции (воздухообмена), то Исполнитель обязуется их незамедлительно устранить.\n3.15.', 'Под сменой Исполнителя понимается замена Стороны Исполнителя по Договору, при\nкоторой изначальный Исполнитель передаёт все права и обязанности по Договору новому Исполнителю.\nИсполнитель обязан возвратить Заказчику суммы Дополнительных поддерживающих выплат:\n• в течение 5 (пяти) календарных дней до даты Деактивации ПВЗ Исполнителя;\n• не позднее 5 (пяти) календарных дней до даты смены Исполнителя.', '7.1., 7.1.1., 7.1.2. и 7.2 Договора, если в течение 12 (двенадцати) календарных месяцев или, если в течение 18\n(восемнадцати) календарных месяцев, при получении от одной до девяти Дополнительных выплат согласно п. 7.2.\nДоговора, после Активации ПВЗ произойдет любое из нижеследующих событий:\n• Деактивация ПВЗ Исполнителя в результате прекращения оказания Услуг в ПВЗ Исполнителем по\nоснованиям, предусмотренным Договором;\n• Смена Исполнителя.']","Для смены Исполнителя на другое лицо в течение первых 6 месяцев после Активации ПВЗ необходимо выполнить следующее условие:

— перечислить Заказчику плату за замену на стороне Исполнителя в размере, действующем на момент подачи заявки о смене и указанном на Портале."
