user_input,retrieved_contexts,response,faithfulness,answer_relevancy,llm_context_precision_without_reference
Какие юридические лица могут быть Заказчиками в зависимости от места государственной регистрации Исполнителя?,"['1.15. Инструкции — информация, размещаемая Заказчиком через Портал в различном виде, содержащая\nправила, указания или руководства, устанавливающие порядок и способ оказания Услуг, использования Портала.\nИнструкции являются обязательными для ознакомления и соблюдения Исполнителем и иными лицами,\nпривлеченными Исполнителем для оказания Услуг в ПВЗ.\n1.16. Исполнитель — коммерческая организация, или индивидуальный предприниматель, или иное лицо, в\nзависимости от места государственной регистрации Исполнителя, заключившие Договор на условиях Оферты об\nоказании услуг в ПВЗ.\n1.17.', '1.16. Исполнитель — коммерческая организация, или индивидуальный предприниматель, или иное лицо, в\nзависимости от места государственной регистрации Исполнителя, заключившие Договор на условиях Оферты об\nоказании услуг в ПВЗ.\n1.17.', '17.4. Права и обязанности Заказчика в полном объеме или в части, включая уступку только прав по Оферте,\nмогут быть переданы и/или уступлены Заказчиком любому лицу из Группы компаний Вайлдберриз. Требования\nЗаказчика к Исполнителю по Оферте, в том числе требования об уплате неустоек и возмещении убытков, могут быть\nуступлены Заказчиком третьим лицам без получения предварительного согласия Исполнителя. Исполнитель\nпризнается выразившим согласие на такую передачу с момента совершения им действий, свидетельствующих о\nсогласии с настоящим условием. Права и обязанности по Оферте переходят к третьему лицу с момента\nуведомления Исполнителя о состоявшемся переходе или истечения срока, указанного в таком уведомлении, путем\nопубликования соответствующего сообщения на Портале. Права и обязанности Заказчика переходят к такому\nтретьему лицу в полном объеме и в том составе, в котором они существуют на момент перехода.\n17.5. К отношениям сторон по настоящему Договору применяется право государства — места регистрации\nЗаказчика, за исключением случаев, прямо предусмотренных Договором.', 'Общество с ограниченной ответственностью «РВБ» (ОГРН 1247700471919, ИНН 9714053621),\nзарегистрированное и действующее по законодательству Российской Федерации, адрес юридического лица: 142181,\nМосковская область, г.о. Подольск, д. Коледино, тер. Индустриальный Парк Коледино, д. 6, строение 1 — если\nИсполнитель по месту государственной регистрации находится на территории Российской Федерации;\n1.13.2. Товарищество с ограниченной ответственностью «ИМВБКЗ» (БИН 220240020422), зарегистрированное и\nдействующее по законодательству Республики Казахстан, адрес юридического лица: 050040, РК, г. Алматы,\nБостандыкский район, проспект Аль-Фараби 77/8, 3 этаж, офис 3В – если Исполнитель по месту государственной\nрегистрации находится на территории Республики Казахстан;\n1.13.3. Общество с ограниченной ответственностью «ИМВБАМ» (ИНН 02899159), зарегистрированное и\nдействующее по законодательству Республики Армения, адрес юридического лица: Республика Армения, г. Ереван,\nЦентр, ул. А. Манукяна, д. 17, стр.', 'А. Манукяна, д. 17, стр. 41 – если Исполнитель по месту государственной регистрации находится на\nтерритории Республики Армения;\n1.13.4. Общество с ограниченной ответственностью «ИМВБРБ» (ИНН 193630204), зарегистрированное и\nдействующее по законодательству Республики Беларусь, адрес юридического лица: Республика Беларусь, 220036, г.\nМинск, ул. Грушевская, д. 21, пом. 217 — если Исполнитель по месту государственной регистрации находится на\nтерритории Республики Беларусь;\n1.13.5. Общество с ограниченной ответственностью «ВБ КейДжи» (ИНН 01506202210353), зарегистрированное и\nдействующее по законодательству Республики Кыргызстан, адрес юридического лица: Кыргызская Республика, г.\nБишкек, Первомайский район, ул. Табалдиева, д. 45, 2-Этаж 2 Офис – если Исполнитель по месту государственной\nрегистрации находится на территории Республики Кыргызстан;\n1.13.6.', 'А. Манукяна, д. 17, стр. 41 – если Исполнитель по месту государственной регистрации находится на\nтерритории Республики Армения;\n1.13.4. Общество с ограниченной ответственностью «ИМВБРБ» (ИНН 193630204), зарегистрированное и\nдействующее по законодательству Республики Беларусь, адрес юридического лица: Республика Беларусь, 220036, г.\nМинск, ул. Грушевская, д. 21, пом. 217 — если Исполнитель по месту государственной регистрации находится на\nтерритории Республики Беларусь;\n1.13.5.', 'направляются по адресу\nместа нахождения Стороны-получателя: для Заказчика — указанному в ЕГРЮЛ, а для Исполнителя — по адресу,\nуказанному на Портале или по месту нахождения ПВЗ;\n• на адрес электронной почты Исполнителя,', '8.9. Стороны пришли к соглашению, что в целях исполнения обязательств Исполнителя, зарегистрированного на\nтерритории Российской Федерации, перед Заказчиком в рамках настоящего Договора, в том числе, но не\nограничиваясь в целях погашения любой задолженности по Договору,', 'А. Манукяна, д. 17, стр. 41 – если Исполнитель по месту государственной регистрации находится на\nтерритории Республики Армения;\n1.13.4.', 'Махтумкули, д. 1, БЦ «Kayan» – если Исполнитель по\nместу государственной регистрации находится на территории Республики Узбекистан.\n1.14.']","Ответ: Заказчиками могут быть следующие юридические лица в зависимости от места государственной регистрации Исполнителя:

- Общество с ограниченной ответственностью «РВБ» (ОГРН 1247700471919, ИНН 9714053621), зарегистрированное и действующее по законодательству Российской Федерации, адрес юридического лица: 142181, Московская область, г.о. Подольск, д. Коледино, тер. Индустриальный Парк Коледино, д. 6, строение 1 — если Исполнитель по месту государственной регистрации находится на территории Российской Федерации;
- Товарищество с ограниченной ответственностью «ИМВБКЗ» (БИН 220240020422), зарегистрированное и действующее по законодательству Республики Казахстан, адрес юридического лица: 050040, РК, г. Алматы, Бостандыкский район, проспект Аль-Фараби 77/8, 3 этаж, офис 3В – если Исполнитель по месту государственной регистрации находится на территории Республики Казахстан;
- Общество с ограниченной ответственностью «ИМВБАМ» (ИНН 02899159), зарегистрированное и действующее по законодательству Республики Армения, адрес юридического лица: Республика Армения, г. Ереван, Центр, ул. А. Манукяна, д. 17, стр. 41 – если Исполнитель по месту государственной регистрации находится на территории Республики Армения;
- Общество с ограниченной ответственностью «ИМВБРБ» (ИНН 193630204), зарегистрированное и действующее по законодательству Республики Беларусь, адрес юридического лица: Республика Беларусь, 220036, г. Минск, ул. Грушевская, д. 21, пом. 217 — если Исполнитель по месту государственной регистрации находится на территории Республики Беларусь;
- Общество с ограниченной ответственностью «ВБ КейДжи» (ИНН 01506202210353), зарегистрированное и действующее по законодательству Республики Кыргызстан, адрес юридического лица: Кыргызская Республика, г. Бишкек, Первомайский район, ул. Табалдиева, д. 45, 2-Этаж 2 Офис – если Исполнитель по месту государственной регистрации находится на территории Республики Кыргызстан;
- Общество с ограниченной ответственностью «ИМВБАМ» (ИНН 02899159), зарегистрированное и действующее по законодательству Республики Армения, адрес юридического лица: Республика Армения, г. Ереван, Центр, ул. А. Манукяна, д. 17, стр. 41 – если Исполнитель по месту государственной регистрации находится на территории Республики Армении;
- Общество с ограниченной ответственностью «ИМВБРБ» (ИНН 193630204), зарегистрированное и действующее по законодательству Республики Беларусь, адрес юридического лица: Республика Беларусь, 220036, г. Минск, ул. Грушевская, д. 21, пом. 217 — если Исполнитель по месту государственной регистрации находится на территории Республики Беларусь;
- Общество с ограниченной ответственностью «ВБ КейДжи» (ИНН 01506202210353), зарегистрированное и действующее по законодательству Республики Кыргызстан, адрес юридического лица: Кыргызская Республика,",1.0,0.9700363199624061,
Какие факторы учитываются при определении Рейтинга ПВЗ Исполнителя?,"['1.38. Рейтинг ПВЗ Исполнителя — единица оценки ПВЗ Исполнителя и качества оказываемых им Услуг в ПВЗ,\nопределяемая на основании анализа 150 (ста пятидесяти) последних уникальных отзывов и оценок Клиентов о ПВЗ\nна Торговой площадке, включая, но не ограничиваясь, в отношении: состояния ПВЗ, качества обслуживания\nКлиентов, а также иных факторов, влияющих на качество оказания Услуг Исполнителем.\n1.39. Склад — помещение Заказчика или лица, привлеченного Заказчиком, в котором осуществляется хранение,\nобработка и упаковка Товаров.', '1.38. Рейтинг ПВЗ Исполнителя — единица оценки ПВЗ Исполнителя и качества оказываемых им Услуг в ПВЗ,\nопределяемая на основании анализа 150 (ста пятидесяти) последних уникальных отзывов и оценок Клиентов о ПВЗ\nна Торговой площадке, включая, но не ограничиваясь, в отношении: состояния ПВЗ, качества обслуживания\nКлиентов, а также иных факторов, влияющих на качество оказания Услуг Исполнителем.\n1.39. Склад — помещение Заказчика или лица, привлеченного Заказчиком, в котором осуществляется хранение,\nобработка и упаковка Товаров.\n1.40. Стоимость Товара — розничная цена, по которой Товар был или может быть заказан Клиентом на\nТорговой площадке, указанная в Поручении.\n1.41. Сторона/Стороны — отдельное/совместное упоминание Заказчика или/и Исполнителя.\n1.42. Тепловая карта — карта, доступная по ссылке https://pvz-stat-map.wildberries.ru/#2/62/56\nопределяющая возможные зоны для открытия ПВЗ, формы поддержки ПВЗ, тарифы, вознаграждение, оценку\nпредполагаемого дохода Исполнителя в ПВЗ и иные данные при указанных на карте параметрах.\n\n1.43.', '1.38. Рейтинг ПВЗ Исполнителя — единица оценки ПВЗ Исполнителя и качества оказываемых им Услуг в ПВЗ,\nопределяемая на основании анализа 150 (ста пятидесяти) последних уникальных отзывов и оценок Клиентов о ПВЗ\nна Торговой площадке, включая,', '2.2. Рейтинг ПВЗ Исполнителя\nПремия за Рейтинг ПВЗ Исполнителя рассчитывается за каждую оценку Клиента от 1 до 5 для ПВЗ Исполнителя,\nкоторая может оценивать качество оказания Услуг в ПВЗ, требования к обслуживанию Клиентов и исполнение иных\nправил оказания Услуг (далее — Оценка) по формуле:\n\nР = Стоимость Оценки * Вес Оценки / Коэффициент премирования, где Р — Премия за Рейтинг ПВЗ\nИсполнителя, выплачивается Исполнителю только в результате проставления Оценок (4 и 5).\nСтоимость Оценки — индивидуальный показатель, указанный в ЛК Исполнителя.\nВес Оценки — индивидуальный вес каждой Оценки Клиента, указанный в ЛК Исполнителя.\nКоэффициент премирования — показатель, публикуемый на Портале, означающий среднее значение Веса всех\nОценок всех ПВЗ за определенный период времени, который может быть изменен Заказчиком в одностороннем\nпорядке в случае динамики соответствующего среднего значения. Новое значение Коэффициента премирования\nприменяется для расчета с 00 часов 00 минут дня, следующего за днем, в котором новое значение было\nопубликовано на Портале.\nПремия за Рейтинг ПВЗ отражается на Балансе Исполнителя на дату выставления Оценки.', '2.2. Рейтинг ПВЗ Исполнителя\nПремия за Рейтинг ПВЗ Исполнителя рассчитывается за каждую оценку Клиента от 1 до 5 для ПВЗ Исполнителя,\nкоторая может оценивать качество оказания Услуг в ПВЗ, требования к обслуживанию Клиентов и исполнение иных\nправил оказания Услуг (далее — Оценка) по формуле:\n\nР = Стоимость Оценки * Вес Оценки / Коэффициент премирования, где Р — Премия за Рейтинг ПВЗ\nИсполнителя, выплачивается Исполнителю только в результате проставления Оценок (4 и 5).\nСтоимость Оценки — индивидуальный показатель, указанный в ЛК Исполнителя.', '2.2. Рейтинг ПВЗ Исполнителя\nПремия за Рейтинг ПВЗ Исполнителя рассчитывается за каждую оценку Клиента от 1 до 5 для ПВЗ Исполнителя,\nкоторая может оценивать качество оказания Услуг в ПВЗ,', 'При определении Базового или Дифференцированного тарифа учитываются такие характеристики ПВЗ Исполнителя,\nкак регион и зона расположения на Тепловой карте, площадь помещения, цена аренды, количество сотрудников\nИсполнителя и размер оплаты им,', 'При определении Базового или Дифференцированного тарифа учитываются такие характеристики ПВЗ Исполнителя,\nкак регион и зона расположения на Тепловой карте, площадь помещения, цена аренды, количество сотрудников\nИсполнителя и размер оплаты им, прогнозируемый Оборот ПВЗ за 30 (тридцать) календарных дней. При изменении\nлюбой из указанных характеристик, используемых для расчета тарифа, он может измениться, что также отражается\nна Тепловой карте.', 'Если Рейтинг ПВЗ Исполнителя становится равнымили больше Минимального значения рейтинга ПВЗ,Заказчик незамедлительно прекращает БлокировкуПВЗ и направляет соответствующее уведомление вЛК.Заказчик вправе прекратить Блокировку ПВЗИсполнителя, если значение Рейтинга ПВЗИсполнителя менее Минимального значениярейтинга ПВЗ, но Исполнитель прикладывает усилиядля улучшения качества оказания Услуг по Договору,устраняет все нарушения, послужившие основаниемдля снижения Рейтинга и приведшие к БлокировкеПВЗ, а также продолжает соблюдать полностью идобросовестно Договор.Если Рейтинг ПВЗ снижался три и более раза нижеМинимального значения рейтинга ПВЗ Исполнителяв течение 1 (одного) календарного года оказанияУслуг Исполнителем с даты Активации ПВЗ попричине нарушений, послуживших основанием дляснижения Рейтинга и приведших к Блокировке ПВЗ,то прекращение применения Блокировки ПВЗ, приусловии устранения нарушений, Заказчиком неприменяется.', 'если значение Рейтинга ПВЗИсполнителя менее Минимального значениярейтинга ПВЗ, но Исполнитель прикладывает усилиядля улучшения качества оказания Услуг по Договору,устраняет все нарушения, послужившие основаниемдля снижения Рейтинга и приведшие к БлокировкеПВЗ,']","Ответ: При определении Рейтинга ПВЗ Исполнителя учитываются следующие факторы: состояние ПВЗ, качество обслуживания Клиентов, а также иные факторы, влияющие на качество оказания Услуг Исполнителем. Рейтинг определяется на основании анализа 150 последних уникальных отзывов и оценок Клиентов о ПВЗ на Торговой площадке.",1.0,1.0000000000000002,
Какие действия совершают Стороны при совершении юридически значимых действий в рамках Договора?,"['Стороны совершают\nюридически значимые действия только с использованием Портала.\n1.33. Поручение — задание Заказчика, содержащее совокупность сведений в электронной форме,\nнаправленное Исполнителю посредством Личного кабинета и содержащее в том числе сведения о наименованиях и\nколичестве Товаров, данные о Продавце, о Клиенте, заключившем договор розничной купли-продажи с Продавцом, и\nиную информацию, необходимую для выполнения Поручения Исполнителем. Указанное поручение не считается\nпоручением на обработку персональных данных.\n1.34.', 'Стороны совершают\nюридически значимые действия только с использованием Портала.\n1.33. Поручение — задание Заказчика, содержащее совокупность сведений в электронной форме,', 'Пользовательское соглашение расположено по адресу и доступно для ознакомления по ссылке и действует в части,\nне противоречащей настоящему Договору.\n1.32. Портал — интегрированная автоматизированная электронная система Заказчика, использование которой\nпроисходит на условиях простой (неисключительной) лицензии на срок действия Договора, предоставленной\nЗаказчиком Исполнителю в целях исполнения Договора, и включающая, но не ограничивающаяся веб-сервисом,\nдоступным через браузер или мобильные устройства (смартфоны, планшеты и т.д.). Стороны совершают\nюридически значимые действия только с использованием Портала.\n1.33. Поручение — задание Заказчика, содержащее совокупность сведений в электронной форме,\nнаправленное Исполнителю посредством Личного кабинета и содержащее в том числе сведения о наименованиях и\nколичестве Товаров, данные о Продавце, о Клиенте, заключившем договор розничной купли-продажи с Продавцом, и\nиную информацию, необходимую для выполнения Поручения Исполнителем. Указанное поручение не считается\nпоручением на обработку персональных данных.\n1.34.', '10.6. Договора , Стороны являются самостоятельными\nоператорами персональных данных, при этом каждая из Сторон обеспечивает конфиденциальность персональных\nданных, полученных от другой Стороны, соблюдение требований к обработке персональных данных, установленных\nЗаконодательством в области персональных данных и принятыми в его исполнение нормативными правовыми\nактами, и несет ответственность за принятие всех необходимых правовых, организационных и технических мер\nзащиты персональных данных от неправомерного или случайного доступа к ним, уничтожения, изменения,\nблокирования, копирования, распространения персональных данных, а также от иных неправомерных действий в\nотношении них\n11. Ответственность\n11.1. Стороны несут ответственность за неисполнение или ненадлежащее исполнение своих обязательств в\nсоответствии с условиями Договора и Приложениями к нему. Никакие иные меры ответственности, не\nпредусмотренные в Договоре и Приложениях к нему, не могут быть применены к отношениям Сторон.\n11.2.', '17.3 Договора, с которыми закон или Договор связывают наступление\n\nгражданско-правовых последствий для другой стороны, должны направляться только одним из следующих способов:\n• нарочным (курьерской доставкой), заказным письмом или ценным с описью вложений, направляются по адресу\nместа нахождения Стороны-получателя: для Заказчика — указанному в ЕГРЮЛ, а для Исполнителя — по адресу,\nуказанному на Портале или по месту нахождения ПВЗ;\n• на адрес электронной почты Исполнителя, указанной им при регистрации на Портале или в любом исходящем от\nИсполнителя документе или сообщении;\n• посредством Портала / Личного кабинета.\n17.2.2. Юридически значимые сообщения направляются исключительно предусмотренными Договором\nспособами. Направление сообщения иным способом не считается надлежащим, а сообщения считаются\nнедоставленными.\n17.2.3. Юридически значимые сообщения, направленные Исполнителю через Портал или на электронную\nпочту, считаются доставленными в дату отправки Заказчиком соответствующего юридически значимого сообщения.\n17.2.4.', '4.2. Каждая из Сторон вправе исполнять условия Договора как самостоятельно, так и с привлечением любых\nтретьих лиц, отвечая при этом перед другой Стороной за действия привлеченных третьих лиц, как за свои\nсобственные.\n5.', '16.5. Заказчик рассматривает заявку Исполнителя в течение 30 (тридцати) календарных дней и проверяет\nпредоставленные данные о новом Исполнителе, а также проверяет наличие задолженности Исполнителя и нового\nИсполнителя перед Заказчиком. Заказчик вправе отказать в согласовании заявки Исполнителя.\n17. Заключительные положения\n17.1. Отношения сторон по Договору, заключение, прекращение и исполнение Договора регулируются\nдействующим законодательством Российской Федерации.\n17.2. Направление юридически значимых сообщений:\n17.2.1. Заявления, уведомления, извещения, требования или любые иные юридически значимые сообщения, в\nтом числе составленные в соответствии с п.', '4.2. Каждая из Сторон вправе исполнять условия Договора как самостоятельно, так и с привлечением любых\nтретьих лиц, отвечая при этом перед другой Стороной за действия привлеченных третьих лиц, как за свои\nсобственные.\n5. Права и обязательства Исполнителя\nОбмен информацией между Сторонами\n5.1.', '10.6. Договора , Стороны являются самостоятельными\nоператорами персональных данных, при этом каждая из Сторон обеспечивает конфиденциальность персональных\nданных, полученных от другой Стороны, соблюдение требований к обработке персональных данных, установленных\nЗаконодательством в области персональных данных и принятыми в его исполнение нормативными правовыми\nактами, и несет ответственность за принятие всех необходимых правовых, организационных и технических мер\nзащиты персональных данных от неправомерного или случайного доступа к ним, уничтожения, изменения,\nблокирования, копирования, распространения персональных данных,', '16.5. Заказчик рассматривает заявку Исполнителя в течение 30 (тридцати) календарных дней и проверяет\nпредоставленные данные о новом Исполнителе, а также проверяет наличие задолженности Исполнителя и нового\nИсполнителя перед Заказчиком. Заказчик вправе отказать в согласовании заявки Исполнителя.\n17. Заключительные положения\n17.1. Отношения сторон по Договору, заключение, прекращение и исполнение Договора регулируются\nдействующим законодательством Российской Федерации.\n17.2. Направление юридически значимых сообщений:\n17.2.1.']",Ответ: Стороны совершают юридически значимые действия только с использованием Портала.,1.0,0.813900467480642,
"Какие документы и инструменты Исполнитель использует для оказания Услуг, включая Услугу WB Track и Услугу WB Рекламные экраны?","['1.46. Услуги – комплекс услуг, оказываемых Исполнителем по Договору в ПВЗ, неотъемлемой частью которого\nявляются такие Услуги, как приемка Товаров от Заказчика/Перевозчика/Продавца/Курьера, выдача Товара\nПолучателям, в том числе Курьерам, получение Клиентских возвратов, подготовка Товара к возврату, Услуга WB\nTrack, Услуга WB Рекламные экраны и иные услуги, для оказания которых Исполнитель использует Портал и\nдействует в соответствии с Инструкциями и иными документами Заказчика, размещенными на Портале.\n1.47. Услуга WB Track — услуга, оказываемая Исполнителем по Договору, в том числе приемка Отправлений\nWB Track от Отправителя, выдача Получателю Отправления WB Track, подготовка Отправления WB Track к отправке\nи иные действия, для которых Исполнитель использует Портал и действует в соответствии с Приложением № 5,\nИнструкциями и иными документами Заказчика, размещенными на Портале.\n1.48. Услуга WB Рекламные экраны — услуга, оказываемая Исполнителем, в соответствии с правилами и\nусловиями Приложения № 7 к Договору, заключается в предоставлении доступа Заказчику к Оборудованию для\nтрансляции Рекламных материалов Заказчиком.\n1.49.', 'в том числе Курьерам, получение Клиентских возвратов, подготовка Товара к возврату, Услуга WB\nTrack, Услуга WB Рекламные экраны и иные услуги, для оказания которых Исполнитель использует Портал и\nдействует в соответствии с Инструкциями и иными документами Заказчика, размещенными на Портале.', '1.46. Услуги – комплекс услуг, оказываемых Исполнителем по Договору в ПВЗ, неотъемлемой частью которого\nявляются такие Услуги, как приемка Товаров от Заказчика/Перевозчика/Продавца/Курьера, выдача Товара\nПолучателям, в том числе Курьерам, получение Клиентских возвратов, подготовка Товара к возврату, Услуга WB\nTrack, Услуга WB Рекламные экраны и иные услуги, для оказания которых Исполнитель использует Портал и\nдействует в соответствии с Инструкциями и иными документами Заказчика, размещенными на Портале.\n1.47.', '1.47. Услуга WB Track — услуга, оказываемая Исполнителем по Договору, в том числе приемка Отправлений\nWB Track от Отправителя, выдача Получателю Отправления WB Track, подготовка Отправления WB Track к отправке\nи иные действия, для которых Исполнитель использует Портал и действует в соответствии с Приложением № 5,\nИнструкциями и иными документами Заказчика, размещенными на Портале.\n1.48.', '1.53. Услуга WB Track – услуга, оказываемая Исполнителем по Договору, в том числе приемка Отправлений WB\nTrack от Отправителя, выдача Получателю Отправления WB Track, подготовка Отправления WB Track к отправке и\nиные действия, для которых Исполнитель использует Портал и действует в соответствии с Инструкциями и иными\nдокументами Заказчика, размещенными на Портале.\n1.55.', '1.53. Услуга WB Track – услуга, оказываемая Исполнителем по Договору, в том числе приемка Отправлений WB\nTrack от Отправителя, выдача Получателю Отправления WB Track, подготовка Отправления WB Track к отправке и\nиные действия, для которых Исполнитель использует Портал и действует в соответствии с Инструкциями и иными\nдокументами Заказчика, размещенными на Портале.\n1.55. Push-уведомление — уведомление, направляемое в личный кабинет Отправителя на Торговой площадке,\nсодержащее информацию об Отправителе, Получателе Отправления WB Track, адресе пункта назначения,\nгабаритах, характере, Объявленной ценности Отправления WB Track, стоимости доставки и иную информацию, а\nтакже содержащее модальное окно с возможностью согласиться с условиями доставки Отправления WB Track. Push-\nуведомление сохраняется в личном кабинете Отправителя до момента получения Отправления WB Track\nПолучателем или до момента истечения срока хранения Отправления WB Track в случае, если Получатель его не\nзабрал или отказался от его получения.\n1.56.', '1.47. Услуга WB Track — услуга, оказываемая Исполнителем по Договору, в том числе приемка Отправлений\nWB Track от Отправителя, выдача Получателю Отправления WB Track, подготовка Отправления WB Track к отправке\nи иные действия, для которых Исполнитель использует Портал и действует в соответствии с Приложением № 5,', 'При этом Исполнители обязаны:\nПри этом Исполнители обязаны:\n• оформлять документы, связанные с приёмкой/отправкой Товаров;\n• проставлять подписи с расшифровкой и печать (при её наличии) грузополучателя/грузоотправителя;\n• делать отметки о расхождениях (как излишек, так и недостаток), при их фактическом выявлении;\nИсполнитель не вправе принимать от Продавцов в ПВЗ Маркетплейс-короба или Маркетплейс Товары,\nнесоответствующие требуемым габаритам. Вознаграждение Исполнителя за приемку Маркетплейс Товаров, и также\nМаркетплейс-коробов с дальнейшей передачей их для доставки на Склад, рассчитывается за каждую единицу\nТовара, принятого на ПВЗ, согласно Тарифам (Приложение №1 к Договору).\n2.6. Оказание Услуги WB Track по доставке Отправлений WB Track осуществляется при условии предоставления и\nподтверждения Отправителем всей необходимой информации, указанной в п. 2.1 настоящего Приложения., в том\nчисле об Объявленной ценности Отправления WB Track.\n\n2.6.1.', 'Приложение № 5\nк Оферте об оказании услуг в ПВЗ\nУслуга WB Track\n\nПриложение № 5 содержит порядок и условия оказания Услуги WB Track, дополняет Оферту об оказании услуг в ПВЗ\nв части, необходимой для Услуги WB Track, и является обязательным для Исполнителей, оказывающих такую Услугу.\nРаздел 1. Термины и определения Оферты\n1.50. Объявленная ценность – сумма, от 1 000 (одной тысячи) до 50 000 (пятидесяти тысяч) российских\nрублей, которую сообщает Отправитель Исполнителю при оформлении Отправления, определяемая им\nсамостоятельно.\n1.51. Отправитель WB Track или Отправитель — физическое лицо, Клиент Торговой площадки, который\nпередал Исполнителю отправление WB Track для оформления доставки в соответствии с правилами и инструкциями\nи оплатил услугу WB Track.\n1.52. Отправление WB Track — вложения документарного и недокументарного характера, принимаемые в\nиндивидуальных транспортировочных упаковках и пересылаемые в одной оформленной доставке от одного Клиента/\nПолучателя к другому.\n1.53. Получатель Отправления WB Track, или Получатель, — физическое лицо, Клиент Торговой площадки,\nкоторому Отправитель направляет для получения Отправление WB Track.\n1.53.', '3.6. Исполнитель обязуется оказывать Услуги WB Track в полном объеме, согласно настоящему Приложению №5\nи Договору.\n4. Требования к обслуживанию Клиентов\n4.1.']","Ответ: Исполнитель использует Портал и действует в соответствии с Инструкциями и иными документами Заказчика, размещенными на Портале, для оказания Услуг, включая Услугу WB Track и Услугу WB Рекламные экраны.",1.0,0.6622516069134068,
Как Исполнитель подтверждает свое согласие на обработку персональных данных при подаче заявки на открытие ПВЗ?,"['Уполномоченный\n\nпредставитель Исполнителя, заполняющий заявку, также обязуется предоставить согласие на сбор и дальнейшую\nобработку персональных данных в целях рассмотрения заявки, заключения и исполнения настоящей Оферты.\n2.5. Заказчик уведомляет об акцепте заявки Исполнителя в порядке и в сроки, предусмотренные Офертой.\nДоговор считается заключенным Сторонами с даты одобрения Заказчиком заявки на открытие ПВЗ. Такое одобрение\nпризнается акцептом предложения Исполнителя заключить Договор.\n2.6. По запросу Заказчика Исполнитель обязуется предоставить дополнительное подтверждение о заключении\nДоговора в указанной Заказчиком форме, например, в форме подписанного Исполнителем заявления о\nприсоединении к Оферте или текста Оферты.\n2.7. Исполнитель признает, что использование им логина и пароля является надлежащей и достаточной\nидентификацией Исполнителя на Портале, подтверждением права совершать действия на Портале и является\nаналогом собственноручной подписи Исполнителя. Действия, совершенные с использованием логина и пароля\nИсполнителя, считаются совершенными самим Исполнителем.\n2.8.', 'Уполномоченный\n\nпредставитель Исполнителя, заполняющий заявку, также обязуется предоставить согласие на сбор и дальнейшую\nобработку персональных данных в целях рассмотрения заявки, заключения и исполнения настоящей Оферты.\n2.5. Заказчик уведомляет об акцепте заявки Исполнителя в порядке и в сроки, предусмотренные Офертой.\nДоговор считается заключенным Сторонами с даты одобрения Заказчиком заявки на открытие ПВЗ. Такое одобрение\nпризнается акцептом предложения Исполнителя заключить Договор.\n2.6.', '3.1.1. Договора, то Исполнитель\nподает заявку на открытие ПВЗ без выполнения необходимых условий, указанных в первом абзаце этого пункта.\n• указывает в заявке информацию и прикладывает (загружает) документацию согласно требованиям,\nуказанным в Регламенте состояния ПВЗ. Исполнитель обязан предоставить Заказчику документы, подтверждающие\nналичие у Исполнителя права пользования помещением ПВЗ (собственности, аренды или на ином основании),\nоформленные или подписанные надлежащим образом;\n• Исполнитель заверяет, что Обеспечительный платеж будет произведен им лично или лицом,\nуполномоченным на совершение указанного платежа (участник, единоличный исполнительный орган, работник или\nиное). Настоящее заверение для Заказчика является заверением, имеющим существенное значение.\n3.1.2. Заказчик изучает и проверяет полученные в заявке от Исполнителя информацию и документы, а также\nинформирует Исполнителя о принятом решении в течение 5 (пяти) календарных дней с даты получения заявки на\nоткрытие ПВЗ. После окончания проверки Заказчиком принимается одно из следующих решений:\n• заявка Исполнителя на открытие ПВЗ одобряется Заказчиком, и Исполнитель обязан выполнить условия п.', 'Исполнитель на Портале проходит авторизацию с использованием им логина (номер телефона, указанный\nпри регистрации) и пароля (код, получаемый посредством push-уведомления, которое приходит через приложение\nТорговой площадки или смс), что является надлежащей и достаточной идентификацией Исполнителя на Портале.\n2.2. Исполнитель на Портале подает заявку и/или заявки на открытие ПВЗ по предусмотренной Заказчиком\nформе. Заполнение и отправка Исполнителем такой заявки и оплата Обеспечительного платежа, если он\nпредусмотрен, признаются направлением Исполнителем Заказчику предложения заключить Договор на условиях,\nпредусмотренных Офертой и документами, которые являются ее неотъемлемой частью.\n2.3. Исполнитель заполняет на Портале сведения и загружает документы, необходимые для заключения\nДоговора с Заказчиком, соответствующие требованиям, изложенным на Портале, и совершает действия,\nпредусмотренные соответствующей страницей Портала.\n2.4. Исполнитель обязан внимательно ознакомиться с Офертой, Обязательными условиями и Правилами,\nопубликованными на Портале, и принять на себя безусловное обязательство следовать им.', 'Исполнитель на Портале проходит авторизацию с использованием им логина (номер телефона, указанный\nпри регистрации) и пароля (код, получаемый посредством push-уведомления, которое приходит через приложение\nТорговой площадки или смс), что является надлежащей и достаточной идентификацией Исполнителя на Портале.\n2.2. Исполнитель на Портале подает заявку и/или заявки на открытие ПВЗ по предусмотренной Заказчиком\nформе.', '3.12. Исполнитель после одобрения Заказчиком заявки на открытие ПВЗ, до момента подачи заявки на Активацию\nПВЗ, должен оборудовать ПВЗ системой видеонаблюдения и подключить такую систему к одному из сервисов\nвидеонаблюдения, соответствующему различным техническим требованиям, параметры которых размещены на\nсайте https://pvz.wb.ru/video-connection\nИсполнитель обязан предоставить Заказчику доступ в Личный кабинет путем входа через токен и/или путем ввода\nлогина и пароля Исполнителя, с возможностью обрабатывать, копировать и сохранять видеозаписи с камер\nвидеонаблюдения в ПВЗ. В случае если Исполнитель не подключится к сервисам видеонаблюдения и не\nпредоставит доступ в Личный кабинет путем входа через токен и/или путем ввода логина и пароля Исполнителя,\nсогласно условиям настоящего пункта, Заказчик вправе отказать Исполнителю в одобрении заявки на Активацию\nПВЗ.\n\n3.13.', 'Уполномоченный\n\nпредставитель Исполнителя, заполняющий заявку, также обязуется предоставить согласие на сбор и дальнейшую\nобработку персональных данных в целях рассмотрения заявки, заключения и исполнения настоящей Оферты.\n2.5.', 'Для подачи заявки на открытие ПВЗ Исполнитель:\n• в течение срока, определенного правилами в момента подачи заявки оплачивает Обеспечительный платёж\nпосредством перечисления денежных средств на расчетный счет Заказчика способом, указанным при подаче Заявки,\nи в определенном размере, что также будет отражено в момент подачи заявки Исполнителем для определенных зон\nна Тепловой карте:\nРоссийская Федерация:\n• Условия открытия стандартные – 50 000 (пятьдесят тысяч) российских рублей;\n• Условия открытия упрощенные – 5 000 (пять тысяч) российских рублей;', '3.1.1. Договора, то Исполнитель\nподает заявку на открытие ПВЗ без выполнения необходимых условий, указанных в первом абзаце этого пункта.\n• указывает в заявке информацию и прикладывает (загружает) документацию согласно требованиям,\nуказанным в Регламенте состояния ПВЗ.', 'Для подачи заявки на открытие ПВЗ Исполнитель:\n• в течение срока, определенного правилами в момента подачи заявки оплачивает Обеспечительный платёж\nпосредством перечисления денежных средств на расчетный счет Заказчика способом, указанным при подаче Заявки,\nи в определенном размере,']","Исполнитель подтверждает свое согласие на обработку персональных данных при подаче заявки на открытие ПВЗ, предоставив согласие на сбор и дальнейшую обработку персональных данных в целях рассмотрения заявки, заключения и исполнения настоящей Оферты. Это согласие предоставляет уполномоченный представитель Исполнителя, заполняющий заявку.",1.0,0.7402167149959843,
"Какие действия Исполнителя могут быть признаны действиями самого Исполнителя, согласно положениям о логине, пароле и электронной подписи?","['Действия, совершенные с использованием логина и пароля\nИсполнителя, считаются совершенными самим Исполнителем.\n2.8.', '2.8. Исполнитель обязан обеспечить безопасное и конфиденциальное хранение логина и пароля, используемых\nдля входа на Портал. В случае их утраты, в том числе в результате получения к ним доступа третьими лицами,\nИсполнитель обязан не использовать такие данные и незамедлительно уведомить об этом Заказчика.\n2.9. В случае если Исполнитель предоставит третьим лицам доступ к Личному кабинету на Портале с\nиспользованием своих логина и пароля, Исполнитель в полном объеме отвечает за любые действия и бездействие\nтаких лиц, совершенные (допущенные) ими при использовании такого Личного кабинета, как за свои собственные.\n2.10. Порядок ведения электронного документооборота между Сторонами.\n2.10.1. Стороны договорились при взаимодействии, обмене документами и иной информацией в электронной\nформе использовать систему электронного оборота между Сторонами, Исполнитель подключен и зарегистрирован в\nсистеме электронного документооборота (далее – Система ЭДО), с зарегистрированной усиленной\nквалифицированной электронной подписью согласно установленным нормам и правилам в стране регистрации\nИсполнителя.', 'Электронные документы, иная информация в электронной форме,\nподписанные ПЭП с использованием системы Заказчика, в которой Исполнитель авторизуется с использованием\nследующих данных (логина и пароля) Исполнителя, считаются подписанными самим Исполнителем.\n8.5.1.', '8.5.1. – 8.5.5.\nДоговора), по окончании Отчетного периода формируются следующие Документы, подтверждающие оказание Услуг,\nкоторые могут быть подписаны между Сторонами согласованным способом, в том числе, посредством ПЭП (простой\nэлектронной подписью, которая посредством использования кодов, паролей или иных средств подтверждает факт\nподписания электронной подписью электронных документов, иной информации в электронной форме определенным\nлицом. Электронная подпись, является аналогом собственноручной подписи в соответствии с законодательством\nРФ):\n• Акт оказанных Услуг за Отчётный период;\nВ случае, если Исполнитель не подписал, сформированный Акт оказанных услуг, в том числе, ПЭП в течение 5 (пяти)\nкалендарных дней с даты его формирования или не предоставил мотивированные возражения, то Акт оказанных\nУслуг считается принятым между Сторонами. Электронные документы, иная информация в электронной форме,\nподписанные ПЭП с использованием системы Заказчика, в которой Исполнитель авторизуется с использованием\nследующих данных (логина и пароля) Исполнителя, считаются подписанными самим Исполнителем.\n8.5.1.', '2.7. Исполнитель признает, что использование им логина и пароля является надлежащей и достаточной\nидентификацией Исполнителя на Портале, подтверждением права совершать действия на Портале и является\nаналогом собственноручной подписи Исполнителя.', 'В случае если Исполнитель предоставит третьим лицам доступ к\nиспользованию своей электронной подписи, Исполнитель в полном объеме отвечает за любые действия и\nбездействие таких лиц, совершенные (допущенные) ими при использовании электронной подписи, как за свои\nсобственные.\n3.', '2.6. По запросу Заказчика Исполнитель обязуется предоставить дополнительное подтверждение о заключении\nДоговора в указанной Заказчиком форме, например, в форме подписанного Исполнителем заявления о\nприсоединении к Оферте или текста Оферты.\n2.7. Исполнитель признает, что использование им логина и пароля является надлежащей и достаточной\nидентификацией Исполнителя на Портале, подтверждением права совершать действия на Портале и является\nаналогом собственноручной подписи Исполнителя.', '2.9. В случае если Исполнитель предоставит третьим лицам доступ к Личному кабинету на Портале с\nиспользованием своих логина и пароля, Исполнитель в полном объеме отвечает за любые действия и бездействие\nтаких лиц, совершенные (допущенные) ими при использовании такого Личного кабинета, как за свои собственные.\n2.10. Порядок ведения электронного документооборота между Сторонами.\n2.10.1.', '2.9. В случае если Исполнитель предоставит третьим лицам доступ к Личному кабинету на Портале с\nиспользованием своих логина и пароля, Исполнитель в полном объеме отвечает за любые действия и бездействие\nтаких лиц, совершенные (допущенные) ими при использовании такого Личного кабинета,', 'В случае если Исполнитель предоставит третьим лицам доступ к\nиспользованию своей электронной подписи, Исполнитель в полном объеме отвечает за любые действия и\nбездействие таких лиц, совершенные (допущенные) ими при использовании электронной подписи, как за свои\nсобственные.\n3. Подача заявок на открытие и активацию ПВЗ\n3.1. Открытие нового ПВЗ\n3.1.1.']","Действия, совершенные с использованием логина и пароля Исполнителя, считаются совершенными самим Исполнителем. Также действия, совершенные с использованием электронной подписи Исполнителя, считаются действиями самого Исполнителя.",1.0,0.5828452205887307,
Какой срок установлен для выполнения условий подготовки к открытию ПВЗ после одобрения заявки?,"['3.1.4. Исполнитель обязан при подготовке к открытию ПВЗ выполнить все условия и требования к состоянию\nПВЗ, указанные в Договоре и Регламенте состояния ПВЗ, в течение 30 (тридцати) календарных дней с даты\nодобрения заявки на открытие ПВЗ.\n3.1.5. Заказчиком устанавливаются зоны открытия ПВЗ в соответствии с Тепловой картой, которая учитывает\nнагрузку на действующие в данной зоне ПВЗ и плотность населения в конкретном районе.', '3.1.4. Исполнитель обязан при подготовке к открытию ПВЗ выполнить все условия и требования к состоянию\nПВЗ, указанные в Договоре и Регламенте состояния ПВЗ, в течение 30 (тридцати) календарных дней с даты\nодобрения заявки на открытие ПВЗ.\n3.1.5.', '3.1.4. Исполнитель обязан при подготовке к открытию ПВЗ выполнить все условия и требования к состоянию\nПВЗ, указанные в Договоре и Регламенте состояния ПВЗ, в течение 30 (тридцати) календарных дней с даты\nодобрения заявки на открытие ПВЗ.\n3.1.5. Заказчиком устанавливаются зоны открытия ПВЗ в соответствии с Тепловой картой, которая учитывает\nнагрузку на действующие в данной зоне ПВЗ и плотность населения в конкретном районе. Размещение в одном\nстроении/здании более одного ПВЗ не допускается, за исключением случаев, согласованных с Заказчиком.\n3.2. Активация ПВЗ\n3.2.1. С момента одобрения Заказчиком заявки Исполнителя на открытие ПВЗ и выполнения Исполнителем\nусловий п. 3.1.4 Договора Исполнитель вправе подать заявку на Активацию ПВЗ через Портал. Заявка на Активацию\nПВЗ должна соответствовать требованиям и содержать документацию, указанную в Регламенте состояния ПВЗ.\nПосле окончания проверки Заказчиком принимается одно из следующих решений:\n• Заявка Исполнителя на Активацию ПВЗ считается одобренной.', '3.17.3.1. В целях исполнения указанного обязательства Исполнитель вправе привлекать третьих лиц.\n3.17.3.2. Исполнитель обязан по требованию Заказчика устранить нарушения требований к Активации ПВЗ в\nустановленный Заказчиком срок, но не позднее 30 (тридцати) дней с момента выявления указанных нарушений. В\nпротивном случае Исполнитель лишается права активировать указанный ПВЗ. В качестве подтверждения\nвыполнения указанных требований Исполнитель обязан предоставить Заказчику фото- и видеоматериалы в\nдостаточном объеме, для объективной оценки надлежащего исполнения обязательств.\n3.17.4. Заказчик по запросу Исполнителя может давать консультации последнему по вопросам установки, монтажа,\nналадки работы, правильной эксплуатации и обслуживания Системы WB-LOCK.\n3.17.5. Исполнитель после одобрения Заказчиком заявки на открытие ПВЗ, до момента подачи заявки на\nАктивацию ПВЗ, должен оборудовать ПВЗ Системой WB-LOCK.\n3.17.6. Исполнители действующих ПВЗ устанавливают Систему WB-LOCK в течение 10 (десяти) календарных дней\nс момента её передачи Заказчиком согласно акту приема-передачи.', '3.1.1. Договора, то Исполнитель\nподает заявку на открытие ПВЗ без выполнения необходимых условий, указанных в первом абзаце этого пункта.\n• указывает в заявке информацию и прикладывает (загружает) документацию согласно требованиям,\nуказанным в Регламенте состояния ПВЗ. Исполнитель обязан предоставить Заказчику документы, подтверждающие\nналичие у Исполнителя права пользования помещением ПВЗ (собственности, аренды или на ином основании),\nоформленные или подписанные надлежащим образом;\n• Исполнитель заверяет, что Обеспечительный платеж будет произведен им лично или лицом,\nуполномоченным на совершение указанного платежа (участник, единоличный исполнительный орган, работник или\nиное). Настоящее заверение для Заказчика является заверением, имеющим существенное значение.\n3.1.2. Заказчик изучает и проверяет полученные в заявке от Исполнителя информацию и документы, а также\nинформирует Исполнителя о принятом решении в течение 5 (пяти) календарных дней с даты получения заявки на\nоткрытие ПВЗ. После окончания проверки Заказчиком принимается одно из следующих решений:\n• заявка Исполнителя на открытие ПВЗ одобряется Заказчиком, и Исполнитель обязан выполнить условия п.', '3.1.2. Заказчик изучает и проверяет полученные в заявке от Исполнителя информацию и документы, а также\nинформирует Исполнителя о принятом решении в течение 5 (пяти) календарных дней с даты получения заявки на\nоткрытие ПВЗ. После окончания проверки Заказчиком принимается одно из следующих решений:\n• заявка Исполнителя на открытие ПВЗ одобряется Заказчиком, и Исполнитель обязан выполнить условия п.', 'отказа\nИсполнителя открывать и активировать ПВЗ в течение 7 (семи) календарных дней после одобрения заявки на\nоткрытие ПВЗ, то Заказчик возвращает Исполнителю сумму Обеспечительного платежа, если он был оплачен\nИсполнителем в течение 3 (трех) рабочих дней,', 'Для подачи заявки на открытие ПВЗ Исполнитель:\n• в течение срока, определенного правилами в момента подачи заявки оплачивает Обеспечительный платёж\nпосредством перечисления денежных средств на расчетный счет Заказчика способом, указанным при подаче Заявки,\nи в определенном размере, что также будет отражено в момент подачи заявки Исполнителем для определенных зон\nна Тепловой карте:\nРоссийская Федерация:\n• Условия открытия стандартные – 50 000 (пятьдесят тысяч) российских рублей;\n• Условия открытия упрощенные – 5 000 (пять тысяч) российских рублей;\nРеспублика Казахстан:\n\n• 270 000 (двести семьдесят тысяч) казахстанских тенге (KZT) — оплачивается только после согласования\nс Заказчиком;\nРеспублика Армения:\n• Условия открытия стандартные – 175 000 (сто семьдесят пять тысяч) Армянских драм (AMD);\nУсловия открытия упрощенные – 40 000 (сорок тысяч) Армянских драм (AMD);\nРеспублика Беларусь:\n• Условия открытия стандартные — 1 300 (одна тысяча триста) Белорусских рублей (BYN);\nЕсли страна регистрации Исполнителя и/или условия открытия не указаны в п.', 'Для подачи заявки на открытие ПВЗ Исполнитель:\n• в течение срока, определенного правилами в момента подачи заявки оплачивает Обеспечительный платёж\nпосредством перечисления денежных средств на расчетный счет Заказчика способом, указанным при подаче Заявки,\nи в определенном размере, что также будет отражено в момент подачи заявки Исполнителем для определенных зон\nна Тепловой карте:\nРоссийская Федерация:\n• Условия открытия стандартные – 50 000 (пятьдесят тысяч) российских рублей;\n• Условия открытия упрощенные – 5 000 (пять тысяч) российских рублей;', '3.12. Исполнитель после одобрения Заказчиком заявки на открытие ПВЗ, до момента подачи заявки на Активацию\nПВЗ, должен оборудовать ПВЗ системой видеонаблюдения и подключить такую систему к одному из сервисов\nвидеонаблюдения, соответствующему различным техническим требованиям,']","Ответ: Срок, установленный для выполнения условий подготовки к открытию ПВЗ после одобрения заявки, составляет 30 календарных дней.",1.0,0.9999999999999998,
"Какие основания могут быть для отклонения заявки на открытие или Активацию ПВЗ, согласно пункту 3.2.3?","['Активация ПВЗ происходит с момента\nполучения Исполнителем сообщения об активации, и ПВЗ считается действующим с такого момента.\n\n• Заявка отклоняется с указанием причин отказа и рекомендаций по их устранению.\n3.2.2. В случае получения Исполнителем отказа в Активации ПВЗ, Исполнитель вправе повторно подать заявку\nна Активацию ПВЗ в установленном Договором порядке.\n3.2.3. Основанием для отклонения заявок на открытие и Активацию ПВЗ в том числе могут являться:\n3.2.3.1. несоблюдение требований, указанных в Регламенте состояния ПВЗ;\n3.2.3.2. предоставление ложных (недостоверных) сведений; сведений, содержащих противоречивую,\nнеполную информацию; не предоставление документов или предоставление документов в нечитаемых форматах,\nвключая случаи, когда документ(ы) не открываются на ЭВМ, либо открываются с ошибками, не позволяющими\nознакомиться с содержащейся в них информацией, а также информацию, находящуюся в документах с низким\nкачеством изображения, не позволяющим изучить такую информацию.\n3.2.4.', 'Активация ПВЗ происходит с момента\nполучения Исполнителем сообщения об активации, и ПВЗ считается действующим с такого момента.\n\n• Заявка отклоняется с указанием причин отказа и рекомендаций по их устранению.\n3.2.2. В случае получения Исполнителем отказа в Активации ПВЗ, Исполнитель вправе повторно подать заявку\nна Активацию ПВЗ в установленном Договором порядке.\n3.2.3. Основанием для отклонения заявок на открытие и Активацию ПВЗ в том числе могут являться:\n3.2.3.1. несоблюдение требований, указанных в Регламенте состояния ПВЗ;\n3.2.3.', '3.2.3. Основанием для отклонения заявок на открытие и Активацию ПВЗ в том числе могут являться:\n3.2.3.1. несоблюдение требований, указанных в Регламенте состояния ПВЗ;\n3.2.3.', '3.1.4 Договора;\n• заявка Исполнителя на открытие ПВЗ отклоняется Заказчиком с указанием причин отказа в соответствии с\nп. 3.2.3 Договора и рекомендациями по их устранению в соответствии с Регламентом состояния ПВЗ.\n3.1.3. Если заявка Исполнителя на открытие нового ПВЗ была отклонена Заказчиком, удалена по причине\nотсутствия доработки Исполнителем в течение 5 (пяти) рабочих дней после получения такого статуса, отказа\nИсполнителя открывать и активировать ПВЗ в течение 7 (семи) календарных дней после одобрения заявки на\nоткрытие ПВЗ, то Заказчик возвращает Исполнителю сумму Обеспечительного платежа, если он был оплачен\nИсполнителем в течение 3 (трех) рабочих дней, с момента отклонения указанной заявки. Моментом возврата суммы\nОбеспечительного платежа Исполнителю является дата списания соответствующих денежных средств с расчётного\nсчёта банка, в котором обслуживается Заказчик.\n3.1.4.', '3.1.4 Договора;\n• заявка Исполнителя на открытие ПВЗ отклоняется Заказчиком с указанием причин отказа в соответствии с\nп. 3.2.3 Договора и рекомендациями по их устранению в соответствии с Регламентом состояния ПВЗ.\n3.1.3.', '3.1.3. Если заявка Исполнителя на открытие нового ПВЗ была отклонена Заказчиком, удалена по причине\nотсутствия доработки Исполнителем в течение 5 (пяти) рабочих дней после получения такого статуса, отказа\nИсполнителя открывать и активировать ПВЗ в течение 7 (семи) календарных дней после одобрения заявки на\nоткрытие ПВЗ, то Заказчик возвращает Исполнителю сумму Обеспечительного платежа, если он был оплачен\nИсполнителем в течение 3 (трех) рабочих дней, с момента отклонения указанной заявки.', '3.2.2. В случае получения Исполнителем отказа в Активации ПВЗ, Исполнитель вправе повторно подать заявку\nна Активацию ПВЗ в установленном Договором порядке.\n3.2.3.', '3.1.4. Исполнитель обязан при подготовке к открытию ПВЗ выполнить все условия и требования к состоянию\nПВЗ, указанные в Договоре и Регламенте состояния ПВЗ, в течение 30 (тридцати) календарных дней с даты\nодобрения заявки на открытие ПВЗ.\n3.1.5. Заказчиком устанавливаются зоны открытия ПВЗ в соответствии с Тепловой картой, которая учитывает\nнагрузку на действующие в данной зоне ПВЗ и плотность населения в конкретном районе. Размещение в одном\nстроении/здании более одного ПВЗ не допускается, за исключением случаев, согласованных с Заказчиком.\n3.2. Активация ПВЗ\n3.2.1. С момента одобрения Заказчиком заявки Исполнителя на открытие ПВЗ и выполнения Исполнителем\nусловий п. 3.1.4 Договора Исполнитель вправе подать заявку на Активацию ПВЗ через Портал. Заявка на Активацию\nПВЗ должна соответствовать требованиям и содержать документацию, указанную в Регламенте состояния ПВЗ.\nПосле окончания проверки Заказчиком принимается одно из следующих решений:\n• Заявка Исполнителя на Активацию ПВЗ считается одобренной.', 'согласно условиям настоящего пункта, Заказчик вправе отказать Исполнителю в одобрении заявки на Активацию\nПВЗ.\n\n3.13.', 'Размещение в одном\nстроении/здании более одного ПВЗ не допускается, за исключением случаев, согласованных с Заказчиком.\n3.2. Активация ПВЗ\n3.2.1. С момента одобрения Заказчиком заявки Исполнителя на открытие ПВЗ и выполнения Исполнителем\nусловий п. 3.1.4 Договора Исполнитель вправе подать заявку на Активацию ПВЗ через Портал. Заявка на Активацию\nПВЗ должна соответствовать требованиям и содержать документацию, указанную в Регламенте состояния ПВЗ.']","Основаниями для отклонения заявок на открытие и Активацию ПВЗ, согласно пункту 3.2.3, являются:

1. Несоблюдение требований, указанных в Регламенте состояния ПВЗ.
2. Предоставление ложных (недостоверных) сведений; сведений, содержащих противоречивую, неполную информацию.
3. Не предоставление документов или предоставление документов в нечитаемых форматах, включая случаи, когда документ(ы) не открываются на ЭВМ, либо открываются с ошибками, не позволяющими ознакомиться с содержащейся в них информацией.
4. Информация, находящаяся в документах с низким качеством изображения, не позволяющим изучить такую информацию.",1.0,0.9120994191479005,
"Какие действия Исполнителя могут привести к удержанию Обеспечительного платежа в полном объеме, согласно пункту 3.2.4?","['В случае если Исполнитель после одобрения заявки на открытие ПВЗ не подал заявку на\nАктивацию ПВЗ, или удалил заявку на открытие ПВЗ или не выполнил все необходимые условия по Активации ПВЗ,\nто сумма Обеспечительного платежа удерживается Заказчиком в полном объеме в качестве неустойки.\n4.', 'В случае если Исполнитель после одобрения заявки на открытие ПВЗ не подал заявку на\nАктивацию ПВЗ, или удалил заявку на открытие ПВЗ или не выполнил все необходимые условия по Активации ПВЗ,\nто сумма Обеспечительного платежа удерживается Заказчиком в полном объеме в качестве неустойки.\n4. Предмет Договора\n4.1.', '3.2.4. После Активации ПВЗ сумма Обеспечительного платежа, если была оплачена Исполнителем, будет\nвозвращена Исполнителю тем же способом, которым была оплачена, также сумма Обеспечительного платежа может\nбыть отражена на Балансе Исполнителя в связи с выполнением Исполнителем обязательства согласно п. 3.1.4\nДоговора и Активации ПВЗ. В случае если Исполнитель после одобрения заявки на открытие ПВЗ не подал заявку на\nАктивацию ПВЗ, или удалил заявку на открытие ПВЗ или не выполнил все необходимые условия по Активации ПВЗ,\nто сумма Обеспечительного платежа удерживается Заказчиком в полном объеме в качестве неустойки.\n4. Предмет Договора\n4.1. По Договору Исполнитель обязуется оказывать Заказчику Услуги на территории Российской Федерации и\nиных стран, в соответствии с применимым законодательством, правами, обязанностями и ответственностью,\nпредусмотренными Договором и Приложениями, в том числе в соответствии с Поручениями Заказчика в Личном\nкабинете и Инструкциями, а Заказчик обязуется принять и оплатить оказанные Услуги в сроки и на условиях,\nуказанных в Договоре.\n4.2.', '3.2.4. После Активации ПВЗ сумма Обеспечительного платежа, если была оплачена Исполнителем, будет\nвозвращена Исполнителю тем же способом, которым была оплачена, также сумма Обеспечительного платежа может\nбыть отражена на Балансе Исполнителя в связи с выполнением Исполнителем обязательства согласно п. 3.1.4\nДоговора и Активации ПВЗ.', 'которым была оплачена, также сумма Обеспечительного платежа может\nбыть отражена на Балансе Исполнителя в связи с выполнением Исполнителем обязательства согласно п. 3.1.4\nДоговора и Активации ПВЗ.', '3.1.4 Договора;\n• заявка Исполнителя на открытие ПВЗ отклоняется Заказчиком с указанием причин отказа в соответствии с\nп. 3.2.3 Договора и рекомендациями по их устранению в соответствии с Регламентом состояния ПВЗ.\n3.1.3. Если заявка Исполнителя на открытие нового ПВЗ была отклонена Заказчиком, удалена по причине\nотсутствия доработки Исполнителем в течение 5 (пяти) рабочих дней после получения такого статуса, отказа\nИсполнителя открывать и активировать ПВЗ в течение 7 (семи) календарных дней после одобрения заявки на\nоткрытие ПВЗ, то Заказчик возвращает Исполнителю сумму Обеспечительного платежа, если он был оплачен\nИсполнителем в течение 3 (трех) рабочих дней, с момента отклонения указанной заявки. Моментом возврата суммы\nОбеспечительного платежа Исполнителю является дата списания соответствующих денежных средств с расчётного\nсчёта банка, в котором обслуживается Заказчик.\n3.1.4.', 'Исполнитель обязан предоставить Заказчику документы, подтверждающие\nналичие у Исполнителя права пользования помещением ПВЗ (собственности, аренды или на ином основании),\nоформленные или подписанные надлежащим образом;\n• Исполнитель заверяет, что Обеспечительный платеж будет произведен им лично или лицом,\nуполномоченным на совершение указанного платежа (участник, единоличный исполнительный орган, работник или\nиное). Настоящее заверение для Заказчика является заверением, имеющим существенное значение.\n3.1.2.', 'В случае если Исполнитель предоставит третьим лицам доступ к\nиспользованию своей электронной подписи, Исполнитель в полном объеме отвечает за любые действия и\nбездействие таких лиц, совершенные (допущенные) ими при использовании электронной подписи, как за свои\nсобственные.\n3.', '3.2.4. После Активации ПВЗ сумма Обеспечительного платежа, если была оплачена Исполнителем, будет\nвозвращена Исполнителю тем же способом, которым была оплачена,', 'Заказчик вправе в одностороннем порядке удержать указанные суммы Дополнительных поддерживающих\nвыплат Исполнителя из вознаграждения Исполнителя по истечении срока, указанного выше для возврата\nДополнительных поддерживающих выплат Исполнителем, но не позднее дня наступления Деактивации или смены\nИсполнителя.\n7.4.']","Ответ:  
Действия Исполнителя, которые могут привести к удержанию Обеспечительного платежа в полном объеме, согласно пункту 3.2.4, включают:

- Не подачу заявки на Активацию ПВЗ после одобрения заявки на открытие ПВЗ;
- Удаление заявки на открытие ПВЗ;
- Невыполнение всех необходимых условий по Активации ПВЗ.",0.0,0.935728151740328,
"Какой документ определяет требования к состоянию ПВЗ, на которые должен ориентироваться Исполнитель?","['2. 5.2. Исполнитель обязуется предоставлять в Личномкабинете достоверные данные о характеристиках ПВЗ:адрес, площадь помещения, в которомнепосредственно оказываются Услуги, количествосотрудников Исполнителя в ПВЗ и др. Данные охарактеристиках ПВЗ должны подтверждатьсядокументами в соответствии с п. 3.2. Приложения № 3Договора.\nЗа первое нарушение – 10 000(десять тысяч) российских рублей;за каждое следующее выявленноенарушение – 100 000 (сто тысяч)российских рублей.\n3. 5.7. Исполнитель обязуется на протяжении срока действияДоговора поддерживать состояние ПВЗ в соответствиис требованиями, указанными в Регламенте состоянияПВЗ, в том числе в соответствии с требованиямиБрендбука, проводить за свой счет ремонт внутри ПВЗ.В случае обнаружения Заказчиком несоответствиясостояния ПВЗ указанным требованиям Заказчикпосредством Портала направляет Исполнителютребование о необходимости приведения ПВЗ всостояние, соответствующее требованиям, указанным вРегламенте состояния ПВЗ.', 'Исполнитель обязуется на протяжении срока действия Договора поддерживать состояние ПВЗ в\nсоответствии с требованиями, указанными в Регламенте состояния ПВЗ, в том числе в соответствии с требованиями\nБрендбука, проводить за свой счет ремонт внутри ПВЗ.', 'ПВЗ является объектом логистической инфраструктуры, в котором\nИсполнитель непосредственно оказывает комплекс Услуг в соответствии с настоящим Договором.\n1.36. ПЭП — электронная подпись, которая посредством использования кодов, паролей или иных средств\nподтверждает факт подписания электронной подписью электронных документов, иной информации в электронной\nформе определенным лицом, является аналогом собственноручной подписи.\n1.37. Регламент состояния ПВЗ — документ (Приложение № 3 к Договору), размещенный на Портале, который\nсодержит требования к состоянию ПВЗ.\n1.38.', '3.1.4. Исполнитель обязан при подготовке к открытию ПВЗ выполнить все условия и требования к состоянию\nПВЗ, указанные в Договоре и Регламенте состояния ПВЗ, в течение 30 (тридцати) календарных дней с даты\nодобрения заявки на открытие ПВЗ.\n3.1.5. Заказчиком устанавливаются зоны открытия ПВЗ в соответствии с Тепловой картой, которая учитывает\nнагрузку на действующие в данной зоне ПВЗ и плотность населения в конкретном районе.', '3. 5.7. Исполнитель обязуется на протяжении срока действияДоговора поддерживать состояние ПВЗ в соответствиис требованиями, указанными в Регламенте состоянияПВЗ, в том числе в соответствии с требованиямиБрендбука, проводить за свой счет ремонт внутри ПВЗ.В случае обнаружения Заказчиком несоответствиясостояния ПВЗ указанным требованиям Заказчикпосредством Портала направляет Исполнителютребование о необходимости приведения ПВЗ всостояние, соответствующее требованиям, указанным вРегламенте состояния ПВЗ.', '3.1.4. Исполнитель обязан при подготовке к открытию ПВЗ выполнить все условия и требования к состоянию\nПВЗ, указанные в Договоре и Регламенте состояния ПВЗ, в течение 30 (тридцати) календарных дней с даты\nодобрения заявки на открытие ПВЗ.\n3.1.5.', '1.34. Продавец — Заказчик или иное лицо (коммерческая организация, индивидуальный предприниматель, или\nгражданин, признанный в установленном законом порядке самозанятым), которое осуществляет деятельность на\nТорговой площадке и с которым Клиент заключил договор розничной купли-продажи Товаров.\n1.35. Пункт выдачи заказов (ПВЗ) — помещение или часть помещения, здания, дома Исполнителя,\nсоответствующее условиям Договора. ПВЗ является объектом логистической инфраструктуры, в котором\nИсполнитель непосредственно оказывает комплекс Услуг в соответствии с настоящим Договором.\n1.36. ПЭП — электронная подпись, которая посредством использования кодов, паролей или иных средств\nподтверждает факт подписания электронной подписью электронных документов, иной информации в электронной\nформе определенным лицом, является аналогом собственноручной подписи.\n1.37. Регламент состояния ПВЗ — документ (Приложение № 3 к Договору), размещенный на Портале, который\nсодержит требования к состоянию ПВЗ.\n1.38.', '5.6. Исполнитель обязан информировать своих работников, а также привлеченных им третьих лиц, об условиях и\nпорядке оказания Услуг по Договору, Инструкциях, которым они должны следовать в целях надлежащего исполнения\nобязательств по Договору. Исполнитель вправе обеспечить сотрудника Исполнителя корпоративным номером\nтелефона для целей выполнения обязательств сотрудника перед Исполнителем в рамках трудовых или иных\nотношений сотрудника и Исполнителя, а в случае невозможности обеспечения корпоративным номером телефона\nИсполнитель обеспечивает наличие правовых оснований использования сотрудником Исполнителя личного номера\nтелефона для указанных целей.\nКачество оказания Услуг и состояние ПВЗ\n5.7. Исполнитель обязуется на протяжении срока действия Договора поддерживать состояние ПВЗ в\nсоответствии с требованиями, указанными в Регламенте состояния ПВЗ, в том числе в соответствии с требованиями\nБрендбука, проводить за свой счет ремонт внутри ПВЗ.', 'В случае обнаружения Заказчиком несоответствия состояния\nПВЗ указанным требованиям, Заказчик посредством Портала направляет Исполнителю требование о необходимости\nприведения ПВЗ в состояние, соответствующее требованиям, указанным в Регламенте состояния ПВЗ.\n5.8. Исполнитель обязуется использовать рекламно-информационные материалы, содержащие допустимые\nЗаказчиком для таких целей фирменные наименование, знак, логотип, шрифты, цвета и их сочетания, изображения,\nиллюстрации, исключительный перечень и дизайн-макеты, которые размещены на сайте: https://pvz.wb.ru/ для\nцелей оказания Услуг в ПВЗ.\n5.9. Исполнитель обязуется при оказании Услуг не использовать в отношении Товара (в том числе при передаче\nПолучателю) расходные материалы с логотипами и товарными знаками, отличными от тех, правообладателем\nкоторых является Заказчик.\n5.10.', '3.1.1. Договора, то Исполнитель\nподает заявку на открытие ПВЗ без выполнения необходимых условий, указанных в первом абзаце этого пункта.\n• указывает в заявке информацию и прикладывает (загружает) документацию согласно требованиям,\nуказанным в Регламенте состояния ПВЗ. Исполнитель обязан предоставить Заказчику документы, подтверждающие\nналичие у Исполнителя права пользования помещением ПВЗ (собственности, аренды или на ином основании),\nоформленные или подписанные надлежащим образом;\n• Исполнитель заверяет, что Обеспечительный платеж будет произведен им лично или лицом,\nуполномоченным на совершение указанного платежа (участник, единоличный исполнительный орган, работник или\nиное). Настоящее заверение для Заказчика является заверением, имеющим существенное значение.\n3.1.2. Заказчик изучает и проверяет полученные в заявке от Исполнителя информацию и документы, а также\nинформирует Исполнителя о принятом решении в течение 5 (пяти) календарных дней с даты получения заявки на\nоткрытие ПВЗ. После окончания проверки Заказчиком принимается одно из следующих решений:\n• заявка Исполнителя на открытие ПВЗ одобряется Заказчиком, и Исполнитель обязан выполнить условия п.']","Ответ: Регламент состояния ПВЗ, который является документом (Приложение № 3 к Договору), размещённым на Портале и содержащим требования к состоянию ПВЗ.",1.0,0.758114146109226,
Какой срок установлен для прохождения Аудита ПВЗ с момента получения уведомления?,"['Общий срок прохождения Аудита ПВЗ не может превышать 7 (семи) календарных дней с даты получения\nуведомления об Аудите ПВЗ в ЛК Исполнителя. Исполнитель обязуется предоставлять материалы и информацию, а\nтакже исправлять замечания в течение этого срока.\n5.15. Исполнитель несет ответственность за повреждение, утрату, утерю, уничтожение, продажу, безвозмездную\nпередачу третьим лицам принадлежащих Заказчику и находящихся в ПВЗ оборудования, материалов (картон и иное)\nпредназначенных для обработки Товаров. Исполнитель не вправе использовать получаемые/приобретаемые в\nсоответствии с условиями Договора оборудование, материалы (картон и иное) для собственных\nпредпринимательских целей и в своих интересах.\n5.16. Исполнитель несет ответственность за надлежащую эксплуатацию и содержание ПВЗ и обязуется отвечать\nпо претензиям физических лиц и административным санкциям государственных органов, связанным с\nнесоблюдением применимого в месте нахождения ПВЗ законодательства в отношении ПВЗ.', 'Общий срок прохождения Аудита ПВЗ не может превышать 7 (семи) календарных дней с даты получения\nуведомления об Аудите ПВЗ в ЛК Исполнителя. Исполнитель обязуется предоставлять материалы и информацию, а\nтакже исправлять замечания в течение этого срока.\n5.15. Исполнитель несет ответственность за повреждение, утрату, утерю, уничтожение, продажу, безвозмездную\nпередачу третьим лицам принадлежащих Заказчику и находящихся в ПВЗ оборудования, материалов (картон и иное)\nпредназначенных для обработки Товаров.', 'Общий срок прохождения Аудита ПВЗ не может превышать 7 (семи) календарных дней с даты получения\nуведомления об Аудите ПВЗ в ЛК Исполнителя. Исполнитель обязуется предоставлять материалы и информацию, а\nтакже исправлять замечания в течение этого срока.\n5.15.', 'посредством направления уведомления в ЛК.Общий срок прохождения Аудита ПВЗ не можетпревышать 7 (семи) календарных дней с датыполучения уведомления об Аудите ПВЗ в ЛКИсполнителя. Исполнитель обязуется предоставлять\nЗа невыполнение обязанности,предусмотренной п. 5.14. илинарушении сроков предоставленияматериалов и информации:выявленное впервые —предупреждение;за каждое следующее выявленноенарушение — штраф в размере 10000 (Десять тысяч) российскихрублей.', 'посредством направления уведомления в ЛК.Общий срок прохождения Аудита ПВЗ не можетпревышать 7 (семи) календарных дней с датыполучения уведомления об Аудите ПВЗ в ЛКИсполнителя. Исполнитель обязуется предоставлять\nЗа невыполнение обязанности,предусмотренной п.', '10. 5.14. Исполнитель обязуется в случае полученияуведомления от Заказчика в ЛК об Аудите ПВЗпредоставить Заказчику качественные фото- ивидеоматериалы внешнего вида ПВЗ (в соответствии стребованиями и указаниями Заказчика,представленными в инструкции в данном разделе ЛК)путем их размещения и загрузки на Портале в разделеАудит ПВЗ или иным определенным Заказчикомспособом.Заказчик вправе после проверки всех необходимыхматериалов и информации запросить Исполнителяисправить замечания, выявленные в процессе АудитаПВЗ, посредством направления уведомления в ЛК.Общий срок прохождения Аудита ПВЗ не можетпревышать 7 (семи) календарных дней с датыполучения уведомления об Аудите ПВЗ в ЛКИсполнителя. Исполнитель обязуется предоставлять\nЗа невыполнение обязанности,предусмотренной п. 5.14. илинарушении сроков предоставленияматериалов и информации:выявленное впервые —предупреждение;за каждое следующее выявленноенарушение — штраф в размере 10000 (Десять тысяч) российскихрублей.', 'Уведомление\nнаправляется посредством Портала не позднее чем за 3 (три) календарных дня до увеличения времени ежедневного\nоказания Услуг в ПВЗ.\n6.', 'Нормативнаяпродолжительность времени проведенияинвентаризации составляет 24 (двадцать четыре)часа с момента начала инвентаризации.В случае если Исполнитель не проводитинвентаризацию Товаров в ПВЗ в установленныенастоящим пунктом сроки, Товары, числящиеся вПВЗ,', 'Если Исполнитель в течение 7 (семи) календарныхдней с даты Блокировки возмещает Заказчику суммузадолженности по реквизитам Заказчика сприложением подтверждающих документов, тоЗаказчик снимает Блокировку и направляетсоответствующее уведомление в ЛК.\n13.2. Заказчик через Портал уведомляет Исполнителя об осуществлении Блокировки ПВЗ Исполнителя с\nуказанием оснований для Блокировки ПВЗ, срока и/или условий для снятия Блокировки согласно п. 13.1 Договора.\n13.3. Исполнитель вправе с использованием Портала направить Заказчику обращение об отмене Блокировки\nПВЗ или о том, что его ПВЗ заблокировали необоснованно, при условии устранения им указанных в уведомлении\nнарушений или предоставления подтверждений необоснованной Блокировки ПВЗ. Обращение Исполнителя\nрассматривается в срок не позднее 3 (трех) календарных дней с момента получения Заказчиком обращения.\nУказанный срок может быть продлен на срок не более 7 (семи) календарных дней в случае необходимости\nполучения дополнительной информации для принятия решения без учета времени, требуемого Исполнителю для\nпредоставления соответствующей информации.', '14.6. Исполнитель обязуется в течение 14 (четырнадцати) календарных дней с даты утверждения Заказчиком\nзаявки Исполнителя на Деактивацию ПВЗ:\n• надлежащим образом оказывать Услуги на таком ПВЗ;\n• или собственными силами осуществить перемещение находящихся в ПВЗ Товаров в альтернативный ПВЗ,\nинформация о котором направляется Заказчиком после утверждения заявки Исполнителя о начале процесса\nДеактивации ПВЗ.\nПеремещение Товаров в альтернативный ПВЗ допускается исключительно после проведения Исполнителем\nинвентаризации Товаров в ПВЗ, находящемся в процессе Деактивации.\n14.7. Инвентаризация Товаров в ПВЗ, находящемся в процессе Деактивации, осуществляется Исполнителем\nпосредством использования Портала в Возвратные коробки с обязательной фиксацией проводимой инвентаризации\nна камеры видеонаблюдения.\nИсполнитель обязан осуществить инвентаризацию Товаров в ПВЗ, находящемся в процессе Деактивации, в\nтечение 24 (двадцати четырех) часов с момента начала инвентаризации, указанного в уведомлении,\nзаблаговременно направляемом Заказчиком в Личный кабинет Исполнителя.\n14.8.']",Ответ: Срок прохождения Аудита ПВЗ с момента получения уведомления не может превышать 7 (семи) календарных дней.,1.0,0.9910081323917117,0.9999999999833333
"Какой срок установлен для ответа на запросы Исполнителя, поступившие через электронную почту или Личный кабинет?","['6.6. Заказчик обязуется предоставить Исполнителю инструкции по работе с Порталом и информационные\nматериалы о процессе оказания Услуг, а также своевременно вносить в них изменения и уведомлять о них\nИсполнителя.\n6.7. Заказчик обязуется отвечать на запросы Исполнителя (за исключением письменных претензий), касающиеся\nработы ПВЗ, полученные посредством электронной почты или путем размещения в Личном кабинете, в срок, не\nпревышающий 14 (четырнадцать) календарных дней с даты получения такого запроса. При этом срок рассмотрения\nможет быть продлен по инициативе Заказчика для полного и всестороннего рассмотрения всех обстоятельств\nзапроса, а также получения дополнительной информации и документов от Исполнителя, о чем Заказчик уведомляет\nИсполнителя. Максимальный срок такого ответа на запрос Исполнителя в любом случае не может превышать 30\n(тридцать) календарных дней.\n7.', '6.7. Заказчик обязуется отвечать на запросы Исполнителя (за исключением письменных претензий), касающиеся\nработы ПВЗ, полученные посредством электронной почты или путем размещения в Личном кабинете, в срок,', 'Максимальный срок такого ответа на запрос Исполнителя в любом случае не может превышать 30\n(тридцать) календарных дней.\n7.', 'При этом срок рассмотрения\nможет быть продлен по инициативе Заказчика для полного и всестороннего рассмотрения всех обстоятельств\nзапроса, а также получения дополнительной информации и документов от Исполнителя, о чем Заказчик уведомляет\nИсполнителя. Максимальный срок такого ответа на запрос Исполнителя в любом случае не может превышать 30\n(тридцать) календарных дней.\n7.', 'Максимальный срок рассмотрения в любом случае не\nможет превышать 30 (тридцать) календарных дней.\n12.2. Исполнитель посредством функционала Портала вправе оспорить произведенное Заказчиком удержание\nстоимости подготовки Товаров к возврату на Склад, утраченных, утерянных, Зависших Товаров, Товаров с\nнедостатком, или Подмен в течение 7 (семи) календарных дней с момента информирования Исполнителя путём\nразмещения соответствующих сведений об удержании на Портале с помощью обращения, поданного через Личный\nкабинет, с приложением подтверждающих документов, в том числе видеоматериалов, подтверждающих\nнеобоснованность примененной ответственности. После истечения указанного срока Исполнитель утрачивает право\nна оспаривание удержанной Заказчиком суммы. Обращение Исполнителя рассматривается в срок, необходимый для\nполного и всестороннего рассмотрения всех обстоятельств, а также получения дополнительной информации и\n\nдокументов от Исполнителя при необходимости, о чем Заказчик уведомляет Исполнителя. Максимальный срок\nрассмотрения в любом случае не может превышать 30 (тридцать) календарных дней.\n12.3.', 'Обращение Исполнителя\nрассматривается в срок не позднее 3 (трех) календарных дней с момента получения Заказчиком обращения.', 'После истечения указанного срока Исполнитель утрачивает право\nна оспаривание удержанной Заказчиком суммы. Обращение Исполнителя рассматривается в срок, необходимый для\nполного и всестороннего рассмотрения всех обстоятельств, а также получения дополнительной информации и\n\nдокументов от Исполнителя при необходимости, о чем Заказчик уведомляет Исполнителя. Максимальный срок\nрассмотрения в любом случае не может превышать 30 (тридцать) календарных дней.\n12.3.', '• посредством Портала / Личного кабинета.\n17.2.2. Юридически значимые сообщения направляются исключительно предусмотренными Договором\nспособами. Направление сообщения иным способом не считается надлежащим, а сообщения считаются\nнедоставленными.\n17.2.3. Юридически значимые сообщения, направленные Исполнителю через Портал или на электронную\nпочту, считаются доставленными в дату отправки Заказчиком соответствующего юридически значимого сообщения.\n17.2.4.', '17.2.4. Юридически значимые сообщения, направленные Исполнителю почтовым отправлением, считаются\nдоставленными в дату доставки или в дату первой неудачной попытки вручения письма, если оно поступило\nадресату, которому оно направлено, но по обстоятельствам, зависящим от адресата, не было ему вручено или\nадресат не ознакомился с ним.\n17.3. Все споры и разногласия, возникающие между Сторонами по Договору или в связи с ним, подлежат\nурегулированию в претензионном порядке. Срок ответа на претензию составляет 30 (тридцать) календарных дней со\nдня ее получения.\nВ случае недостижения согласия спор подлежит разрешению соответственно: в случае, если Заказчик является\nроссийским юридическим лицом, — в Арбитражном суде г. Москвы (или в Тимирязевском районном суде г. Москвы,\nесли Исполнитель-резидент РФ утратил статус индивидуального предпринимателя).\nВ остальных случаях спор передается на рассмотрение в суд по месту регистрации Заказчика-нерезидента РФ в\nсоответствии с национальным процессуальным законодательством Заказчика-нерезидента.\n17.4.', 'Товаров с\nнедостатком, или Подмен в течение 7 (семи) календарных дней с момента информирования Исполнителя путём\nразмещения соответствующих сведений об удержании на Портале с помощью обращения, поданного через Личный\nкабинет, с приложением подтверждающих документов,']","Срок ответа на запросы Исполнителя, поступившие через электронную почту или Личный кабинет, составляет не более 30 календарных дней.",1.0,0.987212583146345,0.7861904761747525
Какой срок составляет максимальный период для отражения дополнительной выплаты на Балансе Исполнителя?,"['Дополнительная выплата отражается на Балансе Исполнителя в течение 7 (семи) календарных дней после\nзавершения каждого тридцатидневного периода оказания Услуг, начиная с даты начала оказания Услуг (выдачи\nТовара Клиенту).\n8.', 'Дополнительная выплата отражается на Балансе Исполнителя в течение 7 (семи) календарных дней после\nзавершения каждого тридцатидневного периода оказания Услуг, начиная с даты начала оказания Услуг (выдачи\nТовара Клиенту).\n8. Порядок определения размера вознаграждения Исполнителя и порядок расчетов между Сторонами\n8.1.', 'Заказчик вправе в одностороннем порядке удержать указанные суммы Дополнительных поддерживающих\nвыплат Исполнителя из вознаграждения Исполнителя по истечении срока, указанного выше для возврата\nДополнительных поддерживающих выплат Исполнителем, но не позднее дня наступления Деактивации или смены\nИсполнителя.\n7.4. Заказчик оставляет за собой право устанавливать и осуществлять иные дополнительные\nподдерживающие выплаты или меры поддержки для Исполнителей, порядок, основания, критерии и размеры\nкоторых будут определяться Заказчиком дополнительно, в том числе на Тепловой карте. Действие п. 7.3. Договора\nна такие выплаты не распространяется.\n7.5. Вознаграждение в размере Единоразовой выплаты согласно п. 7.1., 7.1.1. и 7.1.2. Договора отражается на\nБалансе Исполнителя в качестве авансового платежа и является дополнительным вознаграждением Исполнителя по\n\nДоговору за 12 (двенадцатый) Отчетный и последующие периоды оказания Услуг.\nЕдиноразовая выплата отражается на Балансе Исполнителя в течение 30 (тридцати) календарных дней с момента\nдостижения, указанного в п. 7.1.', '7.1., 7.1.1. и 7.1.2. Договора отражается на\nБалансе Исполнителя в качестве авансового платежа и является дополнительным вознаграждением Исполнителя по\n\nДоговору за 12 (двенадцатый) Отчетный и последующие периоды оказания Услуг.\nЕдиноразовая выплата отражается на Балансе Исполнителя в течение 30 (тридцати) календарных дней с момента\nдостижения, указанного в п. 7.1.', '7.1. Договора Оборота ПВЗ Исполнителя или в течение 30 (тридцати) календарных дней\nсогласно п. 7.1.1. и 7.1.2. с даты начала оказания Услуг (выдачи Товара Клиенту).\nВознаграждение в размере Дополнительной выплаты и иных выплат согласно п. 7.2. Договора отражается на\nБалансе Исполнителя в качестве авансового платежа и является дополнительным вознаграждением Исполнителя\nПВЗ по Договору за 12 (двенадцатый) Отчетный и последующие периоды оказания Услуг, в зависимости от периода\nполучения Дополнительных выплат.\nДополнительная выплата отражается на Балансе Исполнителя в течение 7 (семи) календарных дней после\nзавершения каждого тридцатидневного периода оказания Услуг, начиная с даты начала оказания Услуг (выдачи\nТовара Клиенту).\n8. Порядок определения размера вознаграждения Исполнителя и порядок расчетов между Сторонами\n8.1. Вознаграждение за оказанные Исполнителем Услуги за Отчетный период рассчитывается на основании\nотчетов, формируемых еженедельно в ЛК Исполнителя по Тарифам, указанным в Приложении №1 к Договору, и\nотражается на Балансе Исполнителя в его ЛК.', 'Единоразовая выплата отражается на Балансе Исполнителя в течение 30 (тридцати) календарных дней с момента\nдостижения, указанного в п. 7.1.', 'Исполнитель обязан возвратить Заказчику суммы Дополнительных поддерживающих выплат:\n• в течение 5 (пяти) календарных дней до даты Деактивации ПВЗ Исполнителя;\n• не позднее 5 (пяти) календарных дней до даты смены Исполнителя.', 'После истечения указанного срока Исполнитель утрачивает право\nна оспаривание удержанной Заказчиком суммы. Обращение Исполнителя рассматривается в срок, необходимый для\nполного и всестороннего рассмотрения всех обстоятельств, а также получения дополнительной информации и\n\nдокументов от Исполнителя при необходимости, о чем Заказчик уведомляет Исполнителя. Максимальный срок\nрассмотрения в любом случае не может превышать 30 (тридцать) календарных дней.\n12.3.', 'Под сменой Исполнителя понимается замена Стороны Исполнителя по Договору, при\nкоторой изначальный Исполнитель передаёт все права и обязанности по Договору новому Исполнителю.\nИсполнитель обязан возвратить Заказчику суммы Дополнительных поддерживающих выплат:\n• в течение 5 (пяти) календарных дней до даты Деактивации ПВЗ Исполнителя;\n• не позднее 5 (пяти) календарных дней до даты смены Исполнителя.', 'Максимальный срок такого ответа на запрос Исполнителя в любом случае не может превышать 30\n(тридцать) календарных дней.\n7.']","Максимальный срок для отражения дополнительной выплаты на Балансе Исполнителя составляет 7 календарных дней после завершения каждого тридцатидневного периода оказания Услуг, начиная с даты начала оказания Услуг (выдачи Товара Клиенту).",1.0,0.9930848189643452,0.8666666666377778
"Какие операции исключаются из расчёта вознаграждения Исполнителя, если Заказчик выявил соответствующие обстоятельства?","['8.2. При расчёте вознаграждения Исполнителя Заказчик исключает из расчёта операции, размещённые\nИсполнителем на Портале, в отношении которых было выявлено любое из следующих обстоятельств:\n• от Получателя поступило обращение о том, что им не был получен Товар, относительно которого\nИсполнитель разместил в Личном кабинете информацию о выдаче (вручении) Получателю;\n• Товары, указанные Исполнителем как возвращенные Клиентами или не востребованные Клиентами, не были\nпереданы Исполнителем Заказчику/Перевозчику.\n8.2.1.', '8.2. При расчёте вознаграждения Исполнителя Заказчик исключает из расчёта операции, размещённые\nИсполнителем на Портале, в отношении которых было выявлено любое из следующих обстоятельств:\n• от Получателя поступило обращение о том, что им не был получен Товар,', 'В случае, если за Отчетный период Исполнителем оказаны Услуги на сумму менее 500 (пятисот) российских рублей\nили эквивалента указанной суммы в национальной валюте страны государственной регистрации сторон по курсу ЦБ\nРФ на дату расчета, Заказчик переносит оплату таких Услуг пока сумма вознаграждения будет более 500 (пятисот)\nроссийских рублей.\n8.2. При расчёте вознаграждения Исполнителя Заказчик исключает из расчёта операции, размещённые\nИсполнителем на Портале, в отношении которых было выявлено любое из следующих обстоятельств:\n• от Получателя поступило обращение о том, что им не был получен Товар, относительно которого\nИсполнитель разместил в Личном кабинете информацию о выдаче (вручении) Получателю;\n• Товары, указанные Исполнителем как возвращенные Клиентами или не востребованные Клиентами, не были\nпереданы Исполнителем Заказчику/Перевозчику.\n8.2.1.', '8.2.1. В случае, если указанные выше обстоятельства выявлены Заказчиком за Отчётный период, Заказчик\nучитывает данные обстоятельства при расчёте вознаграждения за Услуги за любой последующий Отчётный период,\nв течение которого были выявлены указанные обстоятельства и на соответствующую сумму уменьшает размер\nвознаграждения Исполнителя за такой Отчётный период.\n\n8.2.2. Исполнитель вправе предоставить Заказчику доказательства передачи Товаров Получателю в течение 5\n(пяти) календарных дней с момента получения извещения от Заказчика посредством Портала, либо электронной\nпочты, о выявленных в п. 8.2 Договора обстоятельствах. Исполнитель направляет доказательства Заказчику через\nЛичный кабинет.\n8.2.3. В случае направления Исполнителем Заказчику доказательств, указанных в пп. 8.2.2 Договора, Заказчик\nпроводит проверку представленных доказательств.', '8.2.1. В случае, если указанные выше обстоятельства выявлены Заказчиком за Отчётный период, Заказчик\nучитывает данные обстоятельства при расчёте вознаграждения за Услуги за любой последующий Отчётный период,\nв течение которого были выявлены указанные обстоятельства и на соответствующую сумму уменьшает размер\nвознаграждения Исполнителя за такой Отчётный период.\n\n8.2.2.', 'в течение которого были выявлены указанные обстоятельства и на соответствующую сумму уменьшает размер\nвознаграждения Исполнителя за такой Отчётный период.\n\n8.2.2.', 'Тарифы\n1.1. Вознаграждение – это сумма, рассчитываемая для каждого ПВЗ Исполнителя в соответствии с Базовым,\nДифференцированным или Фиксированным тарифом (если применимо), указанными для соответствующего ПВЗ в\nЛК Исполнителя, исходя из количества оказанных Исполнителем Услуг за Отчетный период, а также с учетом\nвозможных премий и иных выплат, неустоек согласно настоящему Приложению № 1. Размер Вознаграждения\nИсполнителя, не включает в себя налог на добавленную стоимость, если Исполнитель по месту регистрации\nнаходится за пределами Российской Федерации. Суммы, указываемые в согласованных и/или подписанных\nСторонами по настоящему Договору документах, как они определены в разделе 8 Договора, включают в себя суммы\nвсех применимых налогов и сборов, в том числе НДС. Никакие иные суммы налогов, сборов, в т.ч. НДС, не подлежат\nоплате Заказчиком сверх сумм, указанных в документах, подтверждающих оказание Услуг.\nВознаграждение для Исполнителя рассчитывается и выплачивается в национальной валюте страны государственной\nрегистрации Исполнителя.', '8.2.1. В случае, если указанные выше обстоятельства выявлены Заказчиком за Отчётный период, Заказчик\nучитывает данные обстоятельства при расчёте вознаграждения за Услуги за любой последующий Отчётный период,', 'В случае подтверждения обстоятельств, указанных в обращении\nИсполнителя, Блокировка ПВЗ прекращается Заказчиком.\n13.4. Заказчик вправе осуществить Блокировку ПВЗ Исполнителя по инициативе Исполнителя в случаях, если у\nИсполнителя возникли или могут возникнуть обстоятельства,', '13.5. Заказчик вправе применить к Исполнителю Блокировку выплат ПВЗ, в случаях проведения Заказчиком\nпроверки Исполнителя на предмет нарушения Договора и/или выявления Заказчиком нарушений Исполнителем\nтаких условий Договора, как снижение Рейтинга ПВЗ до Минимального значения рейтинга ПВЗ, не предоставления\nнеобходимых документов в соответствии с п. 8.5, включая п. 8.5.1. – 8.5.5. Договора.']","Операции, исключаемые из расчёта вознаграждения Исполнителя, если Заказчик выявил соответствующие обстоятельства, это:

- операции, размещённые Исполнителем на Портале, в отношении которых было выявлено, что от Получателя поступило обращение о том, что им не был получен Товар, относительно которого Исполнитель разместил в Личном кабинете информацию о выдаче (вручении) Получателю;
- операции, размещённые Исполнителем на Портале, в отношении которых было выявлено, что Товары, указанные Исполнителем как возвращенные Клиентами или не востребованные Клиентами, не были переданы Исполнителем Заказчику/Перевозчику.",1.0,0.9074416756277941,0.9999999999666667
Какой срок установлен для предоставления Акта сверки взаиморасчетов Исполнителями из Республики Беларусь по запросу?,"['Исполнители, зарегистрированные на территории Республики Беларусь, обязуются предоставлять Акт сверки\nвзаиморасчётов по запросу, но не реже одного раза в 6 (шесть) месяцев в целях обеспечения корректности учёта в\nтечение 5 (пяти) рабочих дней с даты получения соответствующего запроса. Годовая сверка расчётов по акту\nявляется обязательной и проводится в срок, установленный законодательством Республики Беларусь, с учётом\nтребований Инструкции №180 Минфина РБ от 30.11.2007 г.\n8.5.4.', 'В соответствии с п. 15.2 Договора,\nусловие о необходимости оформления первичных учётных документов для Исполнителей, зарегистрированных в\nРеспублике Беларусь, распространяется на все периоды сотрудничества, включая предыдущие, независимо от даты\nвступления в силу изменений.\nИсполнители, зарегистрированные на территории Республики Беларусь, обязуются предоставлять Акт сверки\nвзаиморасчётов по запросу, но не реже одного раза в 6 (шесть) месяцев в целях обеспечения корректности учёта в\nтечение 5 (пяти) рабочих дней с даты получения соответствующего запроса. Годовая сверка расчётов по акту\nявляется обязательной и проводится в срок, установленный законодательством Республики Беларусь, с учётом\nтребований Инструкции №180 Минфина РБ от 30.11.2007 г.\n8.5.4.', 'Исполнители, зарегистрированные на территории РК, обязуются предоставлять Акт сверки взаиморасчетов, но не\nреже одного раза в 6 (шесть) месяцев в целях обеспечения корректности учета, а при получении запроса в течение 5\n(пяти) рабочих дней с даты получения соответствующего запроса.', 'Исполнители, зарегистрированные на территории Республики Беларусь, обязуются предоставлять Акт сверки\nвзаиморасчётов по запросу,', 'Исполнитель предоставляет Акт сверки взаиморасчётов по запросу\nЗаказчика, но не реже одного раза в полугодие.\n8.6. Стороны вправе использовать иные Документы, подтверждающие оказание Услуг по установленной форме.', '12.2012 года № 562, Министра\n\nфинансов РК от 31.03.2015 года № 241.\nИсполнители, зарегистрированные на территории РК, обязуются предоставлять Акт сверки взаиморасчетов, но не\nреже одного раза в 6 (шесть) месяцев в целях обеспечения корректности учета, а при получении запроса в течение 5\n(пяти) рабочих дней с даты получения соответствующего запроса.\n8.5.2.', 'Годовая сверка расчётов по акту\nявляется обязательной и проводится в срок, установленный законодательством Республики Беларусь, с учётом\nтребований Инструкции №180 Минфина РБ от 30.11.2007 г.\n8.5.4.', 'В указанном случае Стороны проводят сверку по взаимным обязательствам и на\nосновании сверки осуществляют итоговые взаиморасчеты в течение 60 (шестидесяти) календарных дней с даты\nрасторжения Договора.', '8.5.1. Для Исполнителей, зарегистрированных на территории Республики Казахстан (РК), как являющихся\nплательщиками НДС, так и не являющихся плательщиками НДС, Стороны составляют первичные учетные\nдокументы, подтверждающие факт оказание/принятия Услуг в соответствии с требованиями законодательства РК, в\nтом числе Кодекса РК «О налогах и других обязательных платежах в бюджет (Налоговый кодекс)», Закона РК «О\nбухгалтерском учете и финансовой отчетности», приказа Министра финансов РК от 20.12.2012 года № 562, Министра\n\nфинансов РК от 31.03.2015 года № 241.\nИсполнители, зарегистрированные на территории РК, обязуются предоставлять Акт сверки взаиморасчетов, но не\nреже одного раза в 6 (шесть) месяцев в целях обеспечения корректности учета, а при получении запроса в течение 5\n(пяти) рабочих дней с даты получения соответствующего запроса.\n8.5.2.', '8.5.2. Для Исполнителей, зарегистрированных на территории Республики Армения, как являющихся\nплательщиками НДС, так и не являющихся плательщиками НДС, Исполнитель в течение 5 (пяти) рабочих дней с\nдаты получения отчета об оказанных Услугах, сформированного в ЛК Исполнителя, обязан на основе отчета\nсформировать счет-фактуру за оказанные Услуги и налоговый счет на портале http://e-invoice.taxservice.am/ и\nвыставить его Заказчику.\n8.5.3. Для Исполнителей, зарегистрированных на территории Республики Беларусь, как являющихся\nплательщиками НДС, так и не являющихся плательщиками НДС, Стороны составляют первичные учетные\nдокументы, подтверждающие оказание Услуг единолично (Постановление Министерства финансов Республики\nБеларусь от 12.02.2018 г. № 13, включая любые изменяющие или дополняющие его документы) на основании\nразмещенных на Портале сведений о совершенных операциях с Товарами. В соответствии с п.']",Ответ: Срок для предоставления Акта сверки взаиморасчетов Исполнителями из Республики Беларусь по запросу составляет 5 (пяти) рабочих дней с даты получения соответствующего запроса.,1.0,0.708391305139967,0.99999999995
Какой срок установлен для уплаты разницы между размером причиненных убытков и фактическим удержанием?,"['разницу между размером причиненных убытков и\nразмером фактического удержания в течение 5 (пяти) рабочих дней с момента направления Исполнителю\nуведомления об удержании.\n8.9.', '8.8. В случае, если Заказчиком в одностороннем порядке была удержана часть вознаграждения по Договору или\nпо любому другому договору, заключенному между Сторонами, и удержанная сумма не покрывает размер\nпричиненных убытков/неустоек (пени, штрафы), Исполнитель обязуется оплатить по реквизитам Заказчика,\nуказанным на Портале или предоставленным Заказчиком, разницу между размером причиненных убытков и\nразмером фактического удержания в течение 5 (пяти) рабочих дней с момента направления Исполнителю\nуведомления об удержании.\n8.9.', '8.7. Требования Заказчика к Исполнителю о возмещении убытков, штрафов за допущенные нарушения\nДоговора, а также требования Заказчика об уплате сумм, возникших из любых договоров и соглашений между\nИсполнителем и Заказчиком и требования Исполнителя к Заказчику о выплате вознаграждения по Договору, а также\nуплате любых других сумм, включая требования о возмещении убытков, сальдируются в момент отражения сумм\nтаких требований в Личном кабинете Исполнителя. Такое сальдирование прекращает требования в соответствующей\nчасти и происходит автоматически без дополнительных заявлений от любой из Сторон.\nПо результатам такого сальдирования:\n— если сумма требований Заказчика была меньше, Заказчик перечисляет оставшуюся после удержаний сумму\nвознаграждения в предусмотренном Договором порядке;\n— если сумма требований Заказчика была больше, Исполнитель обязан уплатить сумму разницы в течение срока,\nуказанного в п. 8.8. Договора, с момента отражения такого требования в Личном кабинете Исполнителя или Заказчик\nвправе осуществить удержание в оставшейся сумме при последующем перечислении вознаграждения.\n8.8.', 'Заказчик перечисляет оставшуюся после удержаний сумму\nвознаграждения в предусмотренном Договором порядке;\n— если сумма требований Заказчика была больше, Исполнитель обязан уплатить сумму разницы в течение срока,\nуказанного в п. 8.8.', '8.8. В случае, если Заказчиком в одностороннем порядке была удержана часть вознаграждения по Договору или\nпо любому другому договору, заключенному между Сторонами, и удержанная сумма не покрывает размер\nпричиненных убытков/неустоек (пени, штрафы),', 'Приложение № 4\nк Оферте об оказании услуг в ПВЗ\nОТВЕТСТВЕННОСТЬ\nВ случае если местом регистрации сторон по Договору является не Российская Федерация, предусмотренные\nДоговором штрафы или удержания, размер которых установлен в рублях Российской Федерации, уплачиваются\nИсполнителем в национальной валюте страны государственной регистрации Сторон по курсу ЦБ РФ на дату\nвыставления штрафа или совершения удержания за каждый выявленный случай. Требования по уплате штрафов,\nпеней, неустоек, вытекающие из настоящего Договора, НДС не облагаются.\n\nТребования Заказчика к Исполнителю по Договору, в том числе требования об уплате неустоек и возмещении\nубытков, могут быть уступлены Заказчиком третьим лицам без получения предварительного согласия Исполнителя.\nВ случае если Договором предусмотрено право Заказчика требовать уплаты неустоек, Заказчик при наличии\nсоответствующего обоснования и признаков явной несоразмерности неустойки последствиям нарушения,\nдопущенного Исполнителем, вправе требовать уплаты неустоек в сумме меньшей, чем предусмотренный Договором\nразмер неустойки.', 'Максимальный срок рассмотрения в любом случае не\nможет превышать 30 (тридцать) календарных дней.\n12.2. Исполнитель посредством функционала Портала вправе оспорить произведенное Заказчиком удержание\nстоимости подготовки Товаров к возврату на Склад, утраченных, утерянных, Зависших Товаров, Товаров с\nнедостатком, или Подмен в течение 7 (семи) календарных дней с момента информирования Исполнителя путём\nразмещения соответствующих сведений об удержании на Портале с помощью обращения, поданного через Личный\nкабинет, с приложением подтверждающих документов, в том числе видеоматериалов, подтверждающих\nнеобоснованность примененной ответственности. После истечения указанного срока Исполнитель утрачивает право\nна оспаривание удержанной Заказчиком суммы. Обращение Исполнителя рассматривается в срок, необходимый для\nполного и всестороннего рассмотрения всех обстоятельств, а также получения дополнительной информации и\n\nдокументов от Исполнителя при необходимости, о чем Заказчик уведомляет Исполнителя. Максимальный срок\nрассмотрения в любом случае не может превышать 30 (тридцать) календарных дней.\n12.3.', 'Товаров с\nнедостатком, или Подмен в течение 7 (семи) календарных дней с момента информирования Исполнителя путём\nразмещения соответствующих сведений об удержании на Портале с помощью обращения, поданного через Личный\nкабинет, с приложением подтверждающих документов,', 'В отношении Зависших Товаров - совокупная Стоимость Зависших Товаров удерживается Заказчиком в\nслучае, если Исполнителем не был оспорен факт утери Товара в период его нахождения в ПВЗ Исполнителя в\nтечение 7 (семи) календарных дней с момента обнаружения Заказчиком', 'В случае если Договором предусмотрено право Заказчика требовать уплаты неустоек, Заказчик при наличии\nсоответствующего обоснования и признаков явной несоразмерности неустойки последствиям нарушения,\nдопущенного Исполнителем, вправе требовать уплаты неустоек в сумме меньшей, чем предусмотренный Договором\nразмер неустойки.']",Ответ: Срок для уплаты разницы между размером причиненных убытков и фактическим удержанием установлен в размере 5 (пяти) рабочих дней с момента направления Исполнителю уведомления об удержании.,1.0,0.9999999999999999,0.99999999995
"Каким образом Стороны могут подтверждать оказание Услуг, согласно фрагменту оферты?","['Исполнитель предоставляет Акт сверки взаиморасчётов по запросу\nЗаказчика, но не реже одного раза в полугодие.\n8.6. Стороны вправе использовать иные Документы, подтверждающие оказание Услуг по установленной форме.', '8.5.1. – 8.5.5.\nДоговора), по окончании Отчетного периода формируются следующие Документы, подтверждающие оказание Услуг,\nкоторые могут быть подписаны между Сторонами согласованным способом, в том числе, посредством ПЭП (простой\nэлектронной подписью,', '1.10. Документ, подтверждающий оказание Услуг, — документ(ы) в зависимости от страны регистрации\nИсполнителя, оказывающего Услуги, подтверждающий(ие) факт оказания Услуг Исполнителем, подписываемый(ые)\nобеими Сторонами по окончании оказания Услуг в соответствии с условиями Договора, указанными в разделе 8\nДоговора.\n1.11. Доля Подмен — процентное соотношение совокупной Стоимости Товаров, удержанных в качестве Подмен, к\nОбороту ПВЗ Исполнителя за период времени, определенный в соответствующем положении Договора.', 'Стороны составляют первичные учетные\nдокументы, подтверждающие факт оказание/принятия Услуг в соответствии с требованиями законодательства РК, в\nтом числе Кодекса РК «О налогах и других обязательных платежах в бюджет (Налоговый кодекс)»,', 'Стороны составляют первичные учетные\nдокументы, подтверждающие оказание Услуг единолично (Постановление Министерства финансов Республики\nБеларусь от 12.02.2018 г.', '8.3. Стороны признают, что данные, содержащиеся на Портале и в ЛК Исполнителя, являются достаточным и\nточным доказательством объема оказанных Услуг, количества Товаров, переданных Исполнителю, стоимости таких\nТоваров и других обстоятельств, сведения о которых содержатся на Портале. Расчет и оплата вознаграждения\nпроизводятся по данным, полученным на Портале или иным согласованным Сторонами способом. Данные Портала\nмогут быть предоставлены любой из Сторон в суд в качестве доказательства.', '8.3. Стороны признают, что данные, содержащиеся на Портале и в ЛК Исполнителя, являются достаточным и\nточным доказательством объема оказанных Услуг, количества Товаров, переданных Исполнителю, стоимости таких\nТоваров и других обстоятельств, сведения о которых содержатся на Портале.', '1.10. Документ, подтверждающий оказание Услуг, — документ(ы) в зависимости от страны регистрации\nИсполнителя, оказывающего Услуги, подтверждающий(ие) факт оказания Услуг Исполнителем,', '2.6. По запросу Заказчика Исполнитель обязуется предоставить дополнительное подтверждение о заключении\nДоговора в указанной Заказчиком форме, например, в форме подписанного Исполнителем заявления о\nприсоединении к Оферте или текста Оферты.\n2.7.', '1.27. Оферта — условия настоящей оферты об оказании услуг в ПВЗ, которая содержит все существенные\nусловия и принятие которой влечет заключение Договора на указанных в Оферте условиях.\n1.28.']","Стороны могут подтверждать оказание Услуг следующими способами:

1. Использованием **Акта сверки взаиморасчётов**, который предоставляется Исполнителем по запросу Заказчика не реже одного раза в полугодие.
2. Формированием и подписанием **Документов, подтверждающих оказание Услуг**, в соответствии с условиями Договора. Такие документы могут быть подписаны между Сторонами согласованным способом, в том числе посредством простой электронной подписи (ПЭП).
3. Составлением **первичных учетных документов**, подтверждающих факт оказания/принятия Услуг, в соответствии с требованиями законодательства РК, включая Налоговый кодекс.
4. Использованием **данных, содержащихся на Портале и в ЛК Исполнителя**, которые признаются достаточным и точным доказательством объема оказанных Услуг, количества Товаров, стоимости и других обстоятельств. Эти данные могут быть использованы для расчета и оплаты вознаграждения, а также представлены в суд в качестве доказательства.
5. Использованием **других документов**, подтверждающих оказание Услуг, в зависимости от страны регистрации Исполнителя.
6. Предоставлением **дополнительного подтверждения о заключении Договора** по запросу Заказчика, например, в форме подписанного Исполнителем заявления о присоединении к Оферте или текста Оферты.",0.8620689655172413,0.874586405268274,0.9999999999875
"Какие действия Исполнителя позволяют Заказчику списывать суммы, подлежащие уплате, без дополнительного согласия Исполнителя?","['Исполнитель понимает и соглашается, что в случае предоставления заявления (поручения и/или иного\nраспоряжения) в ПАО Сбербанк и/или АО «ТБанк» на списание без дополнительных распоряжений Исполнителя\n(согласия/акцепта) денежных средств в соответствии с настоящим пунктом через Портал с использованием сервисов\nи функционала ПАО Сбербанк и/или АО «ТБанк» Исполнитель предоставляет Заказчику право списывать суммы,\nподлежащие уплате Заказчику без распоряжения (согласия) Исполнителя путем предъявления к банковским счетам\nИсполнителя, открытым в ПАО Сбербанк и/или АО «ТБанк» платежного требования, инкассового распоряжения и\nиных, предусмотренных законодательством Российской Федерации, форм расчетных документов, предусмотренных\nдля осуществления списания денежных средств со счета Исполнителя по требованию получателя средств, в\n\nсоответствии с Договором.', 'Исполнитель понимает и соглашается, что в случае предоставления заявления (поручения и/или иного\nраспоряжения) в ПАО Сбербанк и/или АО «ТБанк» на списание без дополнительных распоряжений Исполнителя\n(согласия/акцепта) денежных средств в соответствии с настоящим пунктом через Портал с использованием сервисов\nи функционала ПАО Сбербанк и/или АО «ТБанк» Исполнитель предоставляет Заказчику право списывать суммы,\nподлежащие уплате Заказчику без распоряжения (согласия) Исполнителя путем предъявления к банковским счетам\nИсполнителя,', 'Заказчику право списывать суммы,\nподлежащие уплате Заказчику без распоряжения (согласия) Исполнителя путем предъявления к банковским счетам\nИсполнителя,', 'списание без\nдополнительных распоряжений Исполнителя (согласия/акцепта) денежных средств в любой сумме в рамках одного\nплатежного требования Заказчика с расчетного счета Исполнителя, открытого в ПАО Сбербанк и/или АО «ТБанк»,\nсоответственно.', 'Требования Заказчика к Исполнителю по Договору, в том числе требования об уплате неустоек и возмещении\nубытков, могут быть уступлены Заказчиком третьим лицам без получения предварительного согласия Исполнителя.', 'Требования\nЗаказчика к Исполнителю по Оферте, в том числе требования об уплате неустоек и возмещении убытков, могут быть\nуступлены Заказчиком третьим лицам без получения предварительного согласия Исполнителя.', 'Требования по уплате штрафов,\nпеней, неустоек, вытекающие из настоящего Договора, НДС не облагаются.\n\nТребования Заказчика к Исполнителю по Договору, в том числе требования об уплате неустоек и возмещении\nубытков, могут быть уступлены Заказчиком третьим лицам без получения предварительного согласия Исполнителя.', 'Права и обязательства Заказчика\n\n6.1. Заказчик вправе по своему усмотрению и без согласования с Исполнителем вносить изменения в\nсодержание, функциональные возможности и пользовательский интерфейс Портала.\n6.2. Заказчик вправе осуществлять любые действия по проверке качества оказания Исполнителем Услуг.\nЗаказчик самостоятельно определяет способы, периодичность и основания проведения таких проверок.\n6.3. Заказчик вправе проводить оценку качества исполнения Договора Сторонами, включая оказание Услуг\nКлиенту, как во взаимодействии, так и без взаимодействия с Исполнителем, в том числе с привлечением третьих\nлиц, без дополнительного согласия Исполнителя.\n6.4. Заказчик обязуется оплачивать оказанные Исполнителем Услуги в порядке и сроки, установленные\nДоговором.\n6.5. Заказчик обязуется предоставлять Исполнителю информацию, необходимую для целей оказания Услуг по\nДоговору посредством Личного кабинета на Портале, которая включает в себя в том числе: информацию о Клиенте,\nкод получения и адрес Клиента в случае осуществления доставки Курьером.\n6.6.', '6.3. Заказчик вправе проводить оценку качества исполнения Договора Сторонами, включая оказание Услуг\nКлиенту, как во взаимодействии, так и без взаимодействия с Исполнителем, в том числе с привлечением третьих\nлиц, без дополнительного согласия Исполнителя.\n6.4. Заказчик обязуется оплачивать оказанные Исполнителем Услуги в порядке и сроки, установленные\nДоговором.\n6.5.', 'средств в соответствии с настоящим пунктом через Портал с использованием сервисов\nи функционала ПАО Сбербанк и/или АО «ТБанк» Исполнитель предоставляет Заказчику право списывать суммы,']","Ответ:  
Исполнитель предоставляет Заказчику право списывать суммы, подлежащие уплате, без дополнительного согласия Исполнителя, если Исполнитель предоставляет заявление (поручение и/или иное распоряжение) в ПАО Сбербанк и/или АО «ТБанк» на списание денежных средств в соответствии с настоящим пунктом через Портал с использованием сервисов и функционала ПАО Сбербанк и/или АО «ТБанк».",1.0,0.9272863155491686,0.766666666641111
Какие зоны ПВЗ должны охватываться камерами видеонаблюдения согласно оферте?,"['Камеры должны охватывать всю площадь ПВЗ, складскую и клиентскую зоны, зоны осуществления приемки,\nотправки Товаров, подготовки Товаров к возврату, в том числе в Возвратные коробки. Стороны согласовали, что стол\nподготовки Товаров к возврату — это стол, оборудованный камерой и дополнительным светом для видеофиксации\nдействий с Товарами. Все оборудование крепится к столу посредством специального кронштейна.\n9.1.2. Исполнитель обязуется подключить инструмент (программу для ЭВМ) для записи монитора сотрудника\nИсполнителя, который предоставляется провайдерами видеонаблюдения согласно п. 9.1 Договора.\n9.1.3. Исполнитель обеспечивает хранение данных с камер видеонаблюдения в ПВЗ, а также записи монитора\nкомпьютера сотрудника Исполнителя в облачном хранилище провайдера видеонаблюдения в течение не менее 90\n(девяноста) календарных дней в период действия Договора, а также в срок не менее 90 (девяноста) календарных\nдней с даты прекращения действия Договора, используя видеосервисы, представленные в Регламенте состояния\nПВЗ.', 'Камеры должны охватывать всю площадь ПВЗ, складскую и клиентскую зоны, зоны осуществления приемки,\nотправки Товаров, подготовки Товаров к возврату, в том числе в Возвратные коробки.', 'В случае если ПВЗ оборудован столомдля подготовки Товара к возврату, то Исполнительобязуется установить камеру видеонаблюдения натаком столе, в соответствии с техническимистандартами оборудования.Камеры должны охватывать всю площадь ПВЗ,складскую и клиентскую зоны, зоны осуществленияприемки, отправки Товаров, подготовки Товаров квозврату, в том числе в Возвратные коробки. Сторонысогласовали, что стол подготовки Товаров к возврату –это стол, оборудованный камерой и дополнительнымсветом для видеофиксации действий с Товарами.', 'В случае если ПВЗ оборудован столомдля подготовки Товара к возврату, то Исполнительобязуется установить камеру видеонаблюдения натаком столе, в соответствии с техническимистандартами оборудования.Камеры должны охватывать всю площадь ПВЗ,складскую и клиентскую зоны, зоны осуществленияприемки, отправки Товаров, подготовки Товаров квозврату, в том числе в Возвратные коробки. Сторонысогласовали, что стол подготовки Товаров к возврату –это стол, оборудованный камерой и дополнительнымсветом для видеофиксации действий с Товарами. Всеоборудование крепится к столу посредствомспециального кронштейна.9.1.2. Исполнитель обязуется подключить инструмент(программу для ЭВМ) для записи монитора сотрудникаИсполнителя, который предоставляется провайдерамивидеонаблюдения согласно п. 9.1 Договора.9.1.3.', 'В случае если ПВЗ оборудован столомдля подготовки Товара к возврату, то Исполнительобязуется установить камеру видеонаблюдения натаком столе, в соответствии с техническимистандартами оборудования.Камеры должны охватывать всю площадь ПВЗ,складскую и клиентскую зоны,', '9. Видеонаблюдение\n9.1.1. Исполнитель обязуется оборудовать ПВЗ системой видеонаблюдения, соответствующей техническим\nтребованиям, указанным в Регламенте состояния ПВЗ (Приложение № 3), и подключить систему к провайдеру\nоблачного видеонаблюдения, соответствующего техническим требованиям, которые размещены на сайте\nhttps://pvz.wb.ru/video-connection\nИсполнитель обязуется оборудовать ПВЗ:\n• при упрощенных условиях открытия ПВЗ — 1 (одной) камерой видеонаблюдения, которая должна\nохватывать все зоны ПВЗ, в том числе клиентскую и складскую зоны полностью. В случае если 1 (одной) камеры\nнедостаточно для охвата всех зон ПВЗ, Исполнитель обязуется оборудовать ПВЗ необходимым количеством камер,\nохватывающим всю площадь ПВЗ;\n• при всех остальных условиях открытия ПВЗ — не менее 3 (трех) камер видеонаблюдения. Все камеры\nвидеонаблюдения должны осуществлять функцию видеофиксации. В случае если ПВЗ оборудован столом для\nподготовки Товара к возврату, Исполнитель обязуется установить камеру видеонаблюдения на таком столе, в\nсоответствии с техническими стандартами оборудования.', 'Исполнитель обязуется оборудовать ПВЗсистемой видеонаблюдения, соответствующейтехническим требованиям, указанным в Регламентесостояния ПВЗ (Приложение № 3), и подключитьсистему к провайдеру облачного видеонаблюдения,соответствующего техническим требованиям, которыеразмещены на сайте https://pvz.wb.ru/video-connection Исполнитель обязуется оборудовать ПВЗ:- при упрощенных условиях открытия ПВЗ – 1 (одной)камерой видеонаблюдения, которая должна охватыватьвсе зоны ПВЗ, в том числе клиентскую и складскуюзоны полностью. В случае если 1 (одной) камерынедостаточно для охвата всех зон ПВЗ, то Исполнительобязуется оборудовать ПВЗ необходимым количествомкамер, охватывающих всю площадь ПВЗ;- при всех остальных условиях открытия ПВЗ – неменее 3 (трех) камер видеонаблюдения. Все камерывидеонаблюдения должны осуществлять функциювидеофиксации.', '9. Видеонаблюдение\n9.1.1. Исполнитель обязуется оборудовать ПВЗ системой видеонаблюдения, соответствующей техническим\nтребованиям, указанным в Регламенте состояния ПВЗ (Приложение № 3), и подключить систему к провайдеру\nоблачного видеонаблюдения, соответствующего техническим требованиям, которые размещены на сайте\nhttps://pvz.wb.ru/video-connection\nИсполнитель обязуется оборудовать ПВЗ:\n• при упрощенных условиях открытия ПВЗ — 1 (одной) камерой видеонаблюдения, которая должна\nохватывать все зоны ПВЗ, в том числе клиентскую и складскую зоны полностью.', 'Исполнитель обязуется оборудовать ПВЗсистемой видеонаблюдения, соответствующейтехническим требованиям, указанным в Регламентесостояния ПВЗ (Приложение № 3), и подключитьсистему к провайдеру облачного видеонаблюдения,соответствующего техническим требованиям, которыеразмещены на сайте https://pvz.wb.ru/video-connection Исполнитель обязуется оборудовать ПВЗ:- при упрощенных условиях открытия ПВЗ – 1 (одной)камерой видеонаблюдения, которая должна охватыватьвсе зоны ПВЗ, в том числе клиентскую и складскуюзоны полностью.', 'В случае если 1 (одной) камеры\nнедостаточно для охвата всех зон ПВЗ, Исполнитель обязуется оборудовать ПВЗ необходимым количеством камер,\nохватывающим всю площадь ПВЗ;\n• при всех остальных условиях открытия ПВЗ — не менее 3 (трех) камер видеонаблюдения. Все камеры\nвидеонаблюдения должны осуществлять функцию видеофиксации. В случае если ПВЗ оборудован столом для\nподготовки Товара к возврату, Исполнитель обязуется установить камеру видеонаблюдения на таком столе, в\nсоответствии с техническими стандартами оборудования.']","Ответ: Камеры видеонаблюдения должны охватывать всю площадь ПВЗ, складскую и клиентскую зоны, зоны осуществления приемки, отправки товаров, подготовки товаров к возврату, в том числе в возвратные коробки.",1.0,0.7791201993227287,
"Какие сроки хранения данных с камер видеонаблюдения установлены для ПВЗ, расположенных на территории Республики Беларусь, в период действия Договора и после его прекращения?","['Исполнитель, оказывающий услуги в ПВЗ, расположенном на территории Республики Беларусь, обеспечивает\nхранение данных с камер видеонаблюдения, расположенных в клиентских зонах, а также записи монитора\nкомпьютера сотрудника Исполнителя, в облачном хранилище провайдера видеонаблюдения, используя\nвидеосервисы, которые представлены в Регламенте Состояния ПВЗ, в течение не более 30 (тридцати) календарных\nдней в период срока действия Договора и не более 30 (тридцати) календарных дней с даты прекращения срока\nдействия Договора.', '9.1 Договора.9.1.3. Исполнитель обеспечивает хранение данных скамер видеонаблюдения в ПВЗ, а также записимонитора компьютера сотрудника Исполнителя воблачном хранилище провайдера видеонаблюдения втечение не менее 90 (девяноста) календарных дней впериод действия Договора, а также в срок не менее 90(девяноста) календарных дней с даты прекращениядействия Договора, используя видеосервисы,представленные в Регламенте состояния ПВЗ.Исполнитель, оказывающий услуги в ПВЗ,расположенном на территории Республики Беларусь,', 'Исполнитель, оказывающий услуги в ПВЗ, расположенном на территории Республики Беларусь, обеспечивает\nхранение данных с камер видеонаблюдения, расположенных в клиентских зонах, а также записи монитора\nкомпьютера сотрудника Исполнителя, в облачном хранилище провайдера видеонаблюдения, используя\nвидеосервисы, которые представлены в Регламенте Состояния ПВЗ, в течение не более 30 (тридцати) календарных\nдней в период срока действия Договора и не более 30 (тридцати) календарных дней с даты прекращения срока\nдействия Договора.\n9.1.4. Исполнитель обязан проверять ежедневно до начала работы и приема/обработки Товаров работу всех\nкамер видеонаблюдения, которые всегда должны быть подключены к электросети и сети Интернет, и корректность\nданных на видеозаписи (дата и время), которые должны соответствовать реальным дате и времени, указанным на\nПортале.\n9.1.5. Допускается использование только одного провайдера сервиса видеонаблюдения для одного ПВЗ.\n\n9.1.6.', '9.1 Договора.9.1.3. Исполнитель обеспечивает хранение данных скамер видеонаблюдения в ПВЗ, а также записимонитора компьютера сотрудника Исполнителя воблачном хранилище провайдера видеонаблюдения втечение не менее 90 (девяноста) календарных дней впериод действия Договора, а также в срок не менее 90(девяноста) календарных дней с даты прекращениядействия Договора, используя видеосервисы,представленные в Регламенте состояния ПВЗ.Исполнитель, оказывающий услуги в ПВЗ,расположенном на территории Республики Беларусь,обеспечивает хранение данных с камервидеонаблюдения, расположенных в клиентских зонах,а также записи монитора компьютера сотрудникаИсполнителя, в облачном хранилище провайдеравидеонаблюдения, используя видеосервисы, которые\nЗа каждое выявленное нарушение –10 000 (десять тысяч) российскихрублей.', '9.1 Договора.\n9.1.3. Исполнитель обеспечивает хранение данных с камер видеонаблюдения в ПВЗ, а также записи монитора\nкомпьютера сотрудника Исполнителя в облачном хранилище провайдера видеонаблюдения в течение не менее 90\n(девяноста) календарных дней в период действия Договора, а также в срок не менее 90 (девяноста) календарных\nдней с даты прекращения действия Договора, используя видеосервисы, представленные в Регламенте состояния\nПВЗ.', 'Камеры должны охватывать всю площадь ПВЗ, складскую и клиентскую зоны, зоны осуществления приемки,\nотправки Товаров, подготовки Товаров к возврату, в том числе в Возвратные коробки. Стороны согласовали, что стол\nподготовки Товаров к возврату — это стол, оборудованный камерой и дополнительным светом для видеофиксации\nдействий с Товарами. Все оборудование крепится к столу посредством специального кронштейна.\n9.1.2. Исполнитель обязуется подключить инструмент (программу для ЭВМ) для записи монитора сотрудника\nИсполнителя, который предоставляется провайдерами видеонаблюдения согласно п. 9.1 Договора.\n9.1.3. Исполнитель обеспечивает хранение данных с камер видеонаблюдения в ПВЗ, а также записи монитора\nкомпьютера сотрудника Исполнителя в облачном хранилище провайдера видеонаблюдения в течение не менее 90\n(девяноста) календарных дней в период действия Договора, а также в срок не менее 90 (девяноста) календарных\nдней с даты прекращения действия Договора, используя видеосервисы, представленные в Регламенте состояния\nПВЗ.', 'а также в срок не менее 90(девяноста) календарных дней с даты прекращениядействия Договора, используя видеосервисы,представленные в Регламенте состояния ПВЗ.Исполнитель, оказывающий услуги в ПВЗ,расположенном на территории Республики Беларусь,', '№строки №разделаили пп.Договора\nДоговор ОТВЕТСТВЕННОСТЬ / РАЗМЕРШТРАФОВ\nпредставлены в Регламенте Состояния ПВЗ, в течениене более 30 (тридцати) календарных дней в периодсрока действия Договора и не более 30 (тридцати)календарных дней с даты прекращения срока действияДоговора.9.1.4. Исполнитель обязан проверять ежедневно доначала работы и приема/обработки Товаров работувсех камер видеонаблюдения, которые всегда должныбыть подключены к электросети и сети Интернет, икорректность данных на видеозаписи (дата и время),которые должны соответствовать реальной дате ивремени, указанной на Портале.9.1.6.', 'за исключением ПВЗ, расположенных на\nтерритории Республики Беларусь, для которых минимальная глубина архива 30 (тридцать) дней только для камеры в\nклиентской зоне;\n• Минимальное качество хранения записи с разрешением 1280х720 и 16 кадров в секунду (fps);', 'посредством передачи сведений,\nсодержащих адрес электронного ресурса в сети Интернет (ссылка), согласно установленным срокам хранения\nвидеозаписи, с момента начала оказания Услуг в ПВЗ (активации ПВЗ), и до окончания срока действия Договора,']","В период действия Договора данные с камер видеонаблюдения в ПВЗ, расположенных на территории Республики Беларусь, хранятся в течение не менее 90 календарных дней. После прекращения действия Договора хранение данных продолжается не менее 90 календарных дней с даты прекращения действия Договора.",0.5,0.7908123347156426,
"Какие действия должен предпринять Исполнитель в случае, если видеоматериалы, предоставленные Заказчику, не содержат информации о дате и времени записи или если время на камере не соответствует времени на Портале?","['В случае отсутствия в представленныхИсполнителем видеоматериалах сведений о дате ивремени совершения видеозаписи и/или в случае, еслиустановленные на камере видеонаблюдения дата ивремя (часы и минуты) не соответствуют реальной датеили времени, указанной на Портале,', 'В случае отсутствия в представленныхИсполнителем видеоматериалах сведений о дате ивремени совершения видеозаписи и/или в случае, еслиустановленные на камере видеонаблюдения дата ивремя (часы и минуты) не соответствуют реальной датеили времени, указанной на Портале, видеоматериалысчитаются не предоставленными Исполнителем. Запервое нарушение – предупреждение;за каждое следующее выявленное нарушение – 10 000(десять тысяч) российских рублей.', 'В случае отсутствия в представленныхИсполнителем видеоматериалах сведений о дате ивремени совершения видеозаписи и/или в случае, еслиустановленные на камере видеонаблюдения дата ивремя (часы и минуты) не соответствуют реальной датеили времени, указанной на Портале, видеоматериалысчитаются не предоставленными Исполнителем. Запервое нарушение – предупреждение;за каждое следующее выявленное нарушение – 10 000(десять тысяч) российских рублей.\nЗа первое нарушение –предупреждение;за каждое следующее выявленноенарушение – 10 000 (десять тысяч)российских рублей.\n21. Раздел 10Нарушение Исполнителем обязательств,установленных разделом 10 Договора (Обработкаперсональных данных).\nЗа первое нарушение –предупреждение;за второе нарушение – 50 000(пятьдесят тысяч) российскихрублей;за каждое следующее выявленноенарушение – 100 000 (сто тысяч)российских рублей.\n\n№строки №разделаили пп.Договора\nПриложение №2 (Правила оказания услуг) ОТВЕТСТВЕННОСТЬ / РАЗМЕРШТРАФОВ\n22. 2.2, 2.2.1.2.2.', '9.2.2. В случае отсутствия в представленных Исполнителем видеоматериалах сведений о дате и времени\nсовершения видеозаписи и/или в случае, если установленные на камере видеонаблюдения дата и время (часы и\nминуты) не соответствуют реальной дате или времени, указанной на Портале, видеоматериалы считаются не\nпредоставленными Исполнителем.\n9.3. Исполнитель обеспечивает непрерывную работу камер видеонаблюдения в ПВЗ. В случае обнаружения\nнеисправности или некорректной работы системы видеонаблюдения Исполнитель обязуется устранить\nнеисправность (организовать устранение) в течение 30 (тридцати) минут с момента ее обнаружения.\n9.4. Меры по организации Исполнителем видеонаблюдения в ПВЗ, по хранению/обработке/копированию/\nпредоставлению Заказчику данных с камер видеонаблюдения, предпринимаются исключительно в целях исполнения\nДоговора, обеспечения сохранности Товаров, контроля за поступлением/передвижением Товаров в ПВЗ, а также в\nцелях безопасности лиц, находящихся в ПВЗ.\n9.4.1.', '9.2.2. В случае отсутствия в представленных Исполнителем видеоматериалах сведений о дате и времени\nсовершения видеозаписи и/или в случае, если установленные на камере видеонаблюдения дата и время (часы и\nминуты) не соответствуют реальной дате или времени, указанной на Портале,', '9.2.2. В случае отсутствия в представленных Исполнителем видеоматериалах сведений о дате и времени\nсовершения видеозаписи и/или в случае, если установленные на камере видеонаблюдения дата и время (часы и\nминуты) не соответствуют реальной дате или времени, указанной на Портале, видеоматериалы считаются не\nпредоставленными Исполнителем.\n9.3. Исполнитель обеспечивает непрерывную работу камер видеонаблюдения в ПВЗ.', 'Исполнитель обязан проверять ежедневно до начала работы и приема/обработки Товаров работу всех\nкамер видеонаблюдения, которые всегда должны быть подключены к электросети и сети Интернет, и корректность\nданных на видеозаписи (дата и время), которые должны соответствовать реальным дате и времени, указанным на\nПортале.', '14.8. Инвентаризация завершается:\n• в случае обработки Исполнителем всех числящихся в ПВЗ Товаров и установления Заказчиком соответствия\nфактического количества и состояния инвентаризируемых Товаров информации, отраженной о них на Портале;\n• по истечение срока проведения инвентаризации, установленного настоящим пунктом, Заказчик в\nодностороннем порядке, без предварительного уведомления Исполнителя производит удержание из вознаграждения\nИсполнителя сумму Стоимостей Товаров, не обработанных Исполнителем при проведении инвентаризации в\nустановленные сроки, либо в случае, если информация о фактическом количестве и состоянии инвентаризируемых\nТоваров не соответствует информации, отраженной о них на Портале.\n14.9. В случае непоступления Товаров в альтернативный ПВЗ, указанный Заказчиком, Исполнитель обязуется\nнезамедлительно с момента поступления запроса Заказчика предоставить записи с камер видеонаблюдения,\nподтверждающие формирование Возвратных коробок.', 'либо в случае, если информация о фактическом количестве и состоянии инвентаризируемых\nТоваров не соответствует информации, отраженной о них на Портале.\n14.9. В случае непоступления Товаров в альтернативный ПВЗ, указанный Заказчиком, Исполнитель обязуется\nнезамедлительно с момента поступления запроса Заказчика предоставить записи с камер видеонаблюдения,\nподтверждающие формирование Возвратных коробок.', 'В\nслучае если Исполнитель не проводит инвентаризацию Товаров в ПВЗ в установленные настоящим пунктом сроки,\nТовары, числящиеся на ПВЗ, начиная со дня, следующего за последним представленным для инвентаризации днем,\nсчитаются утраченными.\n6.3. Исполнитель обязан предоставлять Заказчику сведения о возможности оказания Услуг, в том числе:\n6.3.1. В течение 3 (трех) календарных дней с момента получения запроса посредством Портала предоставить\nЗаказчику качественные фотоснимки ПВЗ (в соответствии с требованиями и указаниями Заказчика) путем их\nразмещения (загрузки) на Портал по адресу и согласно инструкциям, указанным на Портале и в ЛК, или иным\nопределенным Заказчиком способом.\n\n6.3.2. Предоставить Заказчику полный доступ к камерам видеонаблюдения в ПВЗ в период действия Договора\nс правом обработки/хранения/копирования информации, полученной с камер видеонаблюдения.\n6.4. Исполнитель обязуется по требованию Заказчика предоставить видеоматериалы с камер видеонаблюдения,\nустановленных на ПВЗ, в течение 6 (шести) часов с момента направления требования Исполнителю за\nзапрашиваемый Заказчиком период времени.\n6.4.1.']","Ответ: В случае, если видеоматериалы, предоставленные Исполнителем, не содержат информации о дате и времени записи или если время на камере видеонаблюдения не соответствует времени, указанному на Портале, видеоматериалы считаются не предоставленными Исполнителем. За первое нарушение — предупреждение; за каждое следующее выявленное нарушение — 10 000 (десять тысяч) российских рублей.",0.75,0.838188009354136,0.6388888888675925
Какие данные Исполнителя могут обрабатываться Заказчиком в рамках исполнения Договора?,"['Исполнитель гарантирует защиту и обеспечивает конфиденциальность персональных данных сотрудников\nЗаказчика, лиц, являющихся исполнителями Заказчика по договору гражданско-правового характера, и иных лиц,\nдействующих на стороне Заказчика, персональных данных Получателей , и персональных данных иных третьих лиц,\nкоторые стали известны Исполнителю в связи с исполнением Договора, а также обязуется осуществлять обработку\nэтих данных исключительно в целях, предусмотренных Договором, и с соблюдением Законодательства в области\nПерсональных данных.\n10.2. Для достижения целей, предусмотренных Договором, требуется обработка персональных данных\nИсполнителя в статусе индивидуального предпринимателя, а также, если применимо, представителей Исполнителя,\nсотрудников Исполнителя и иных третьих лиц, привлекаемых Исполнителем для исполнения Договора.', '10.5. Исполнитель уведомлен и понимает, что в целях оформления транспортных документов (в том числе\nтоварно-транспортных накладных) для организации перевозки Товаров, Заказчик вправе обрабатывать\nперсональные данные Исполнителя, сотрудников, и / или представителей Исполнителя, в том числе передавать\nуказанные персональные данные Перевозчикам.\n10.6. В отношении обработки персональных данных , осуществляемой Заказчиком в целях исполнения\nДоговора, а именно выполнения условий, указанных в разделе 4 Договора, Исполнитель является оператором\nперсональных данных в отношении представителей Исполнителя, сотрудников Исполнителя и иных третьих лиц,\nпривлекаемых Исполнителем для исполнения Договора, а также – в отношении Получателей, в том числе для целей\nвыполнения условий, указанных в разделе 9 Договора и поручает Заказчику осуществлять их обработку в\nнеобходимом для этого объёме, при этом:\n10.6.1. Исполнитель предоставляет заверения, имеющие существенное значение для заключения и\nдальнейшего исполнения Договора, о том, что Исполнителем обеспечены правовые основания для обработки\nперсональных данных субъектов, указанных в п.', '10.6. В отношении обработки персональных данных , осуществляемой Заказчиком в целях исполнения\nДоговора, а именно выполнения условий, указанных в разделе 4 Договора, Исполнитель является оператором\nперсональных данных в отношении представителей Исполнителя, сотрудников Исполнителя и иных третьих лиц,\nпривлекаемых Исполнителем для исполнения Договора, а также – в отношении Получателей, в том числе для целей\nвыполнения условий, указанных в разделе 9 Договора и поручает Заказчику осуществлять их обработку в\nнеобходимом для этого объёме, при этом:\n10.6.1.', 'Конкретный\nобъем необходимых и достаточных данных определяется функционалом Портала и Договором и включает\nследующие сведения: фамилия, имя, отчество (при наличии); данные, содержащиеся в доверенности или ином\nдокументе, подтверждающем право заключать Договор в соответствии с применимым законодательством; номер\nтелефона; User ID; адрес электронной почты; и иные данные, необходимые для заключения и исполнения Договора,\nвключая надлежащее определение стороны Договора. Обработка персональных данных Исполнителя и / или\nсотрудников Исполнителя осуществляется Заказчиком в соответствии с применимым законодательством и\nдокументом, определяющим политику Заказчика в отношении обработки персональных данных.\n10.3. В случае если Исполнитель направляет Заказчику уведомление о расторжении Договора в порядке,\nпредусмотренном Договором, обработка персональных данных, необходимая для предоставления Исполнителю\nфункциональных возможностей Портала, прекращается в порядке и в сроки, предусмотренные применимым\nзаконодательством.\n10.4. Заказчик вправе осуществлять передачу персональных данных третьим лицам, предоставляющим услуги\nИсполнителю по его выбору, когда это необходимо для обеспечения надлежащего исполнения Договора.\n10.5.', 'Исполнитель гарантирует защиту и обеспечивает конфиденциальность персональных данных сотрудников\nЗаказчика, лиц, являющихся исполнителями Заказчика по договору гражданско-правового характера, и иных лиц,\nдействующих на стороне Заказчика, персональных данных Получателей , и персональных данных иных третьих лиц,\nкоторые стали известны Исполнителю в связи с исполнением Договора, а также обязуется осуществлять обработку\nэтих данных исключительно в целях, предусмотренных Договором, и с соблюдением Законодательства в области\nПерсональных данных.\n10.2.', '10.6. В отношении обработки персональных данных , осуществляемой Заказчиком в целях исполнения\nДоговора, а именно выполнения условий, указанных в разделе 4 Договора, Исполнитель является оператором\nперсональных данных в отношении представителей Исполнителя, сотрудников Исполнителя и иных третьих лиц,', '10.6 для передачи персональных данных Заказчику и дальнейшей\nобработки Заказчиком для целей исполнения Договора, включая согласия субъектов на обработку и передачу их\nперсональных данных в рамках поручения на обработку данных (с правом дальнейшей передачи третьим лицам\n\n(субобработчикам) в целях исполнения Договора), если это предусмотрено Законодательством в области\nперсональных данных;\n10.6.2.', '16.5. Заказчик рассматривает заявку Исполнителя в течение 30 (тридцати) календарных дней и проверяет\nпредоставленные данные о новом Исполнителе, а также проверяет наличие задолженности Исполнителя и нового\nИсполнителя перед Заказчиком. Заказчик вправе отказать в согласовании заявки Исполнителя.\n17. Заключительные положения\n17.1. Отношения сторон по Договору, заключение, прекращение и исполнение Договора регулируются\nдействующим законодательством Российской Федерации.\n17.2. Направление юридически значимых сообщений:\n17.2.1.', '8.9. Стороны пришли к соглашению, что в целях исполнения обязательств Исполнителя, зарегистрированного на\nтерритории Российской Федерации, перед Заказчиком в рамках настоящего Договора, в том числе, но не\nограничиваясь в целях погашения любой задолженности по Договору, Исполнителю может быть предоставлена\nвозможность через Портал с использованием сервисов и функционала ПАО Сбербанк и/или АО «ТБанк»\nпредоставить по своему выбору указанным банкам заявление (поручение и/или иное распоряжение) на списание без\nдополнительных распоряжений Исполнителя (согласия/акцепта) денежных средств в любой сумме в рамках одного\nплатежного требования Заказчика с расчетного счета Исполнителя, открытого в ПАО Сбербанк и/или АО «ТБанк»,\nсоответственно.', '4.2. Каждая из Сторон вправе исполнять условия Договора как самостоятельно, так и с привлечением любых\nтретьих лиц, отвечая при этом перед другой Стороной за действия привлеченных третьих лиц, как за свои\nсобственные.\n5. Права и обязательства Исполнителя\nОбмен информацией между Сторонами\n5.1. Исполнитель обязуется предоставлять достоверные, актуальные сведения о себе и/или сотрудниках (в том\nчисле, но не ограничиваясь: название организации, номер регистрации в качестве налогоплательщика, телефон,\nэлектронная почта), привязанных к Личному кабинету Исполнителя, а также обязуется обеспечить возможность\nтелефонной связи с Исполнителем в ПВЗ согласно сведениям, предоставленным в ЛК, в часы работы ПВЗ.\n5.2. Исполнитель обязуется предоставлять в Личном кабинете достоверные данные о характеристиках ПВЗ:\nадрес, площадь помещения, количество сотрудников Исполнителя в ПВЗ и др.\n5.3. При оказании Услуг Исполнитель обязуется использовать для работы только Портал и вести учет всех\nдействий в Личном кабинете в соответствии с Инструкциями по работе с Порталом, соблюдая условия раздела 9\nДоговора (Видеонаблюдение).']","Заказчик вправе обрабатывать следующие данные Исполнителя в рамках исполнения Договора:

- Фамилия, имя, отчество (при наличии);
- Данные, содержащиеся в доверенности или ином документе, подтверждающем право заключать Договор в соответствии с применимым законодательством;
- Номер телефона;
- User ID;
- Адрес электронной почты;
- Иные данные, необходимые для заключения и исполнения Договора, включая надлежащее определение стороны Договора.

Обработка персональных данных Исполнителя и/или сотрудников Исполнителя осуществляется Заказчиком в соответствии с применимым законодательством и документом, определяющим политику Заказчика в отношении обработки персональных данных.",1.0,0.9719228641624215,
"Какие действия Исполнителя могут быть ограничены в связи с обработкой персональных данных, и как это связано с выполнением условий Договора?","['Исполнитель гарантирует защиту и обеспечивает конфиденциальность персональных данных сотрудников\nЗаказчика, лиц, являющихся исполнителями Заказчика по договору гражданско-правового характера, и иных лиц,\nдействующих на стороне Заказчика, персональных данных Получателей , и персональных данных иных третьих лиц,\nкоторые стали известны Исполнителю в связи с исполнением Договора, а также обязуется осуществлять обработку\nэтих данных исключительно в целях, предусмотренных Договором, и с соблюдением Законодательства в области\nПерсональных данных.\n10.2. Для достижения целей, предусмотренных Договором, требуется обработка персональных данных\nИсполнителя в статусе индивидуального предпринимателя, а также, если применимо, представителей Исполнителя,\nсотрудников Исполнителя и иных третьих лиц, привлекаемых Исполнителем для исполнения Договора.', '10.6. В отношении обработки персональных данных , осуществляемой Заказчиком в целях исполнения\nДоговора, а именно выполнения условий, указанных в разделе 4 Договора, Исполнитель является оператором\nперсональных данных в отношении представителей Исполнителя, сотрудников Исполнителя и иных третьих лиц,\nпривлекаемых Исполнителем для исполнения Договора, а также – в отношении Получателей, в том числе для целей\nвыполнения условий, указанных в разделе 9 Договора и поручает Заказчику осуществлять их обработку в\nнеобходимом для этого объёме, при этом:\n10.6.1.', 'Исполнитель гарантирует защиту и обеспечивает конфиденциальность персональных данных сотрудников\nЗаказчика, лиц, являющихся исполнителями Заказчика по договору гражданско-правового характера, и иных лиц,\nдействующих на стороне Заказчика, персональных данных Получателей , и персональных данных иных третьих лиц,\nкоторые стали известны Исполнителю в связи с исполнением Договора, а также обязуется осуществлять обработку\nэтих данных исключительно в целях, предусмотренных Договором, и с соблюдением Законодательства в области\nПерсональных данных.\n10.2.', '10.6. В отношении обработки персональных данных , осуществляемой Заказчиком в целях исполнения\nДоговора, а именно выполнения условий, указанных в разделе 4 Договора, Исполнитель является оператором\nперсональных данных в отношении представителей Исполнителя, сотрудников Исполнителя и иных третьих лиц,', 'персональных данных Получателей , и персональных данных иных третьих лиц,\nкоторые стали известны Исполнителю в связи с исполнением Договора, а также обязуется осуществлять обработку\nэтих данных исключительно в целях, предусмотренных Договором, и с соблюдением Законодательства в области\nПерсональных данных.', '10.5. Исполнитель уведомлен и понимает, что в целях оформления транспортных документов (в том числе\nтоварно-транспортных накладных) для организации перевозки Товаров, Заказчик вправе обрабатывать\nперсональные данные Исполнителя, сотрудников, и / или представителей Исполнителя, в том числе передавать\nуказанные персональные данные Перевозчикам.\n10.6. В отношении обработки персональных данных , осуществляемой Заказчиком в целях исполнения\nДоговора, а именно выполнения условий, указанных в разделе 4 Договора, Исполнитель является оператором\nперсональных данных в отношении представителей Исполнителя, сотрудников Исполнителя и иных третьих лиц,\nпривлекаемых Исполнителем для исполнения Договора, а также – в отношении Получателей, в том числе для целей\nвыполнения условий, указанных в разделе 9 Договора и поручает Заказчику осуществлять их обработку в\nнеобходимом для этого объёме, при этом:\n10.6.1. Исполнитель предоставляет заверения, имеющие существенное значение для заключения и\nдальнейшего исполнения Договора, о том, что Исполнителем обеспечены правовые основания для обработки\nперсональных данных субъектов, указанных в п.', 'Конкретный\nобъем необходимых и достаточных данных определяется функционалом Портала и Договором и включает\nследующие сведения: фамилия, имя, отчество (при наличии); данные, содержащиеся в доверенности или ином\nдокументе, подтверждающем право заключать Договор в соответствии с применимым законодательством; номер\nтелефона; User ID; адрес электронной почты; и иные данные, необходимые для заключения и исполнения Договора,\nвключая надлежащее определение стороны Договора. Обработка персональных данных Исполнителя и / или\nсотрудников Исполнителя осуществляется Заказчиком в соответствии с применимым законодательством и\nдокументом, определяющим политику Заказчика в отношении обработки персональных данных.\n10.3. В случае если Исполнитель направляет Заказчику уведомление о расторжении Договора в порядке,\nпредусмотренном Договором, обработка персональных данных, необходимая для предоставления Исполнителю\nфункциональных возможностей Портала, прекращается в порядке и в сроки, предусмотренные применимым\nзаконодательством.\n10.4. Заказчик вправе осуществлять передачу персональных данных третьим лицам, предоставляющим услуги\nИсполнителю по его выбору, когда это необходимо для обеспечения надлежащего исполнения Договора.\n10.5.', 'Для достижения целей, предусмотренных Договором, требуется обработка персональных данных\nИсполнителя в статусе индивидуального предпринимателя, а также, если применимо, представителей Исполнителя,\nсотрудников Исполнителя и иных третьих лиц, привлекаемых Исполнителем для исполнения Договора.', '10.2. Для достижения целей, предусмотренных Договором, требуется обработка персональных данных\nИсполнителя в статусе индивидуального предпринимателя, а также, если применимо, представителей Исполнителя,\nсотрудников Исполнителя и иных третьих лиц, привлекаемых Исполнителем для исполнения Договора.', 'Обработка персональных данных Исполнителя и / или\nсотрудников Исполнителя осуществляется Заказчиком в соответствии с применимым законодательством и\nдокументом, определяющим политику Заказчика в отношении обработки персональных данных.\n10.3. В случае если Исполнитель направляет Заказчику уведомление о расторжении Договора в порядке,\nпредусмотренном Договором, обработка персональных данных, необходимая для предоставления Исполнителю\nфункциональных возможностей Портала, прекращается в порядке и в сроки, предусмотренные применимым\nзаконодательством.\n10.4.']",Информации недостаточно.,0.0,0.0,
"Какие документы должен предоставить Исполнитель для оспаривания штрафа, связанного с чрезвычайными обстоятельствами?","['12.1. Исполнитель посредством функционала Портала вправе оспорить полученный штраф за нарушение\nусловий Договора в соответствии с Приложением № 4 (Ответственность ПВЗ) к Договору в течение 7 (семи)\nкалендарных дней с момента уведомления Исполнителя путем размещения Заказчиком соответствующих сведений\nо нарушении обязательств Исполнителем в ЛК. В случае, если Исполнитель не предоставит в установленные\nДоговором и обучающим Порталом ( https://edtech.rwb.ru ) сроки видеоматериалы, а также документы, в том\nчисле, но не ограничиваясь выданные государственными органами по месту регистрации Сторон, контролирующими\nвопросы в области чрезвычайных ситуаций, подтверждающие невозможность исполнения обязанностей по Договору\nИсполнителем вследствие чрезвычайных обстоятельств, нарушение считается подтвержденным Исполнителем.\nОбращение Исполнителя рассматривается в срок, необходимый для полного и всестороннего рассмотрения всех\nобстоятельств нарушения, а также получения дополнительной информации и документов от Исполнителя при\nнеобходимости, о чем Заказчик уведомляет Исполнителя.', '12.3. При оспаривании штрафов и удержаний Исполнитель обязан предоставить Заказчику видеосъемку и/или\nфотографии в отношении того Товара, который Заказчиком признан как Товар с недостатками, при этом на\nвидеосъемке и/или фотографии должен быть зафиксирован процесс подготовки Товара для отправки Исполнителем,\nследующего в адрес Заказчика, без его повреждений. На видеосъемке и/или фотографии должны быть\nзафиксированы дата и время совершения видеозаписи и/или фотографии.\n12.4.', '12.3. При оспаривании штрафов и удержаний Исполнитель обязан предоставить Заказчику видеосъемку и/или\nфотографии в отношении того Товара, который Заказчиком признан как Товар с недостатками, при этом на\nвидеосъемке и/или фотографии должен быть зафиксирован процесс подготовки Товара для отправки Исполнителем,\nследующего в адрес Заказчика, без его повреждений. На видеосъемке и/или фотографии должны быть\nзафиксированы дата и время совершения видеозаписи и/или фотографии.\n12.4. В случае если Исполнитель не предоставит видеоматериалы и/или фотографии, подтверждающие\nнеобоснованность произведенного удержания в установленные Договором сроки, такое удержание считается\nподтверждёнными (признанным) Исполнителем.\n13. Блокировка ПВЗ\n13.1. Независимо от применения штрафов в соответствии с Приложением № 4 к Договору Заказчик в целях\nпресечения нарушения Исполнителем обязательств по Договору, в том числе на будущий период и/или длящихся\nнарушений и/или защиты прав третьих лиц, осуществляет Блокировку ПВЗ в нижеследующих случаях.', '12.1. Исполнитель посредством функционала Портала вправе оспорить полученный штраф за нарушение\nусловий Договора в соответствии с Приложением № 4 (Ответственность ПВЗ) к Договору в течение 7 (семи)\nкалендарных дней с момента уведомления Исполнителя путем размещения Заказчиком', '12.1. Исполнитель посредством функционала Портала вправе оспорить полученный штраф за нарушение\nусловий Договора в соответствии с Приложением № 4 (Ответственность ПВЗ) к Договору в течение 7 (семи)\nкалендарных дней с момента уведомления Исполнителя путем размещения Заказчиком соответствующих сведений\nо нарушении обязательств Исполнителем в ЛК.', '12.3. При оспаривании штрафов и удержаний Исполнитель обязан предоставить Заказчику видеосъемку и/или\nфотографии в отношении того Товара, который Заказчиком признан как Товар с недостатками,', '3.2. При Активации ПВЗ Исполнитель обязан предоставить правоустанавливающие документы на помещение\nЗаказчику, выписку из ЕГРН или технический план БТИ или иные документы.', 'ПЕРЕЧЕНЬ ШТРАФОВ:\n№строки №разделаили пп.Договора\nДоговор ОТВЕТСТВЕННОСТЬ / РАЗМЕРШТРАФОВ\n1. 5.1. Исполнитель обязуется предоставлять достоверные,актуальные сведения о себе и/или сотрудниках (в томчисле, но не ограничиваясь: название организации,номер регистрации в качестве налогоплательщика,телефон, электронная почта), привязанных к Личномукабинету Исполнителя, а также обязуется обеспечитьвозможность телефонной связи с Исполнителем в ПВЗсогласно сведениям, предоставленным в ЛК, в часыработы ПВЗ.\nЗа первое нарушение —предупреждение;за второе нарушение — 5 000 (пятьтысяч) российских рублей;за каждое следующее выявленноенарушение (в том числе:предоставление не верноготелефона, номер телефона недоступен для связи/необслуживается, Исполнитель неотвечает на звонки в течениерабочего дня) и последующие – 10000 (десять тысяч) российскихрублей.\n2. 5.2.', 'Исполнитель обязан предоставить Заказчику документы, подтверждающие\nналичие у Исполнителя права пользования помещением ПВЗ (собственности, аренды или на ином основании),\nоформленные или подписанные надлежащим образом;\n• Исполнитель заверяет, что Обеспечительный платеж будет произведен им лично или лицом,\nуполномоченным на совершение указанного платежа (участник, единоличный исполнительный орган, работник или\nиное). Настоящее заверение для Заказчика является заверением, имеющим существенное значение.\n3.1.2.', 'Исполнитель обязан предоставить Заказчику документы, подтверждающие\nналичие у Исполнителя права пользования помещением ПВЗ (собственности, аренды или на ином основании),\nоформленные или подписанные надлежащим образом;\n• Исполнитель заверяет, что Обеспечительный платеж будет произведен им лично или лицом,']","Исполнитель должен предоставить документы, подтверждающие невозможность исполнения обязанностей по Договору вследствие чрезвычайных обстоятельств. Эти документы должны быть выданы государственными органами по месту регистрации Сторон, контролирующими вопросы в области чрезвычайных ситуаций.",0.8333333333333334,0.7640247202009564,0.9999999999
"Какие сроки установлены для рассмотрения обращения Исполнителя по оспариванию штрафа, и каков максимальный срок, в течение которого это может быть сделано?","['12.1. Исполнитель посредством функционала Портала вправе оспорить полученный штраф за нарушение\nусловий Договора в соответствии с Приложением № 4 (Ответственность ПВЗ) к Договору в течение 7 (семи)\nкалендарных дней с момента уведомления Исполнителя путем размещения Заказчиком соответствующих сведений\nо нарушении обязательств Исполнителем в ЛК. В случае, если Исполнитель не предоставит в установленные\nДоговором и обучающим Порталом ( https://edtech.rwb.ru ) сроки видеоматериалы, а также документы, в том\nчисле, но не ограничиваясь выданные государственными органами по месту регистрации Сторон, контролирующими\nвопросы в области чрезвычайных ситуаций, подтверждающие невозможность исполнения обязанностей по Договору\nИсполнителем вследствие чрезвычайных обстоятельств, нарушение считается подтвержденным Исполнителем.\nОбращение Исполнителя рассматривается в срок, необходимый для полного и всестороннего рассмотрения всех\nобстоятельств нарушения, а также получения дополнительной информации и документов от Исполнителя при\nнеобходимости, о чем Заказчик уведомляет Исполнителя.', 'После истечения указанного срока Исполнитель утрачивает право\nна оспаривание удержанной Заказчиком суммы. Обращение Исполнителя рассматривается в срок, необходимый для\nполного и всестороннего рассмотрения всех обстоятельств, а также получения дополнительной информации и\n\nдокументов от Исполнителя при необходимости, о чем Заказчик уведомляет Исполнителя. Максимальный срок\nрассмотрения в любом случае не может превышать 30 (тридцать) календарных дней.\n12.3.', '12.1. Исполнитель посредством функционала Портала вправе оспорить полученный штраф за нарушение\nусловий Договора в соответствии с Приложением № 4 (Ответственность ПВЗ) к Договору в течение 7 (семи)\nкалендарных дней с момента уведомления Исполнителя путем размещения Заказчиком соответствующих сведений\nо нарушении обязательств Исполнителем в ЛК.', 'Максимальный срок рассмотрения в любом случае не\nможет превышать 30 (тридцать) календарных дней.\n12.2. Исполнитель посредством функционала Портала вправе оспорить произведенное Заказчиком удержание\nстоимости подготовки Товаров к возврату на Склад, утраченных, утерянных, Зависших Товаров, Товаров с\nнедостатком, или Подмен в течение 7 (семи) календарных дней с момента информирования Исполнителя путём\nразмещения соответствующих сведений об удержании на Портале с помощью обращения, поданного через Личный\nкабинет, с приложением подтверждающих документов, в том числе видеоматериалов, подтверждающих\nнеобоснованность примененной ответственности. После истечения указанного срока Исполнитель утрачивает право\nна оспаривание удержанной Заказчиком суммы. Обращение Исполнителя рассматривается в срок, необходимый для\nполного и всестороннего рассмотрения всех обстоятельств, а также получения дополнительной информации и\n\nдокументов от Исполнителя при необходимости, о чем Заказчик уведомляет Исполнителя. Максимальный срок\nрассмотрения в любом случае не может превышать 30 (тридцать) календарных дней.\n12.3.', '12.1. Исполнитель посредством функционала Портала вправе оспорить полученный штраф за нарушение\nусловий Договора в соответствии с Приложением № 4 (Ответственность ПВЗ) к Договору в течение 7 (семи)\nкалендарных дней с момента уведомления Исполнителя путем размещения Заказчиком', 'Максимальный срок такого ответа на запрос Исполнителя в любом случае не может превышать 30\n(тридцать) календарных дней.\n7.', 'При этом срок рассмотрения\nможет быть продлен по инициативе Заказчика для полного и всестороннего рассмотрения всех обстоятельств\nзапроса, а также получения дополнительной информации и документов от Исполнителя, о чем Заказчик уведомляет\nИсполнителя. Максимальный срок такого ответа на запрос Исполнителя в любом случае не может превышать 30\n(тридцать) календарных дней.\n7.', '6.6. Заказчик обязуется предоставить Исполнителю инструкции по работе с Порталом и информационные\nматериалы о процессе оказания Услуг, а также своевременно вносить в них изменения и уведомлять о них\nИсполнителя.\n6.7. Заказчик обязуется отвечать на запросы Исполнителя (за исключением письменных претензий), касающиеся\nработы ПВЗ, полученные посредством электронной почты или путем размещения в Личном кабинете, в срок, не\nпревышающий 14 (четырнадцать) календарных дней с даты получения такого запроса. При этом срок рассмотрения\nможет быть продлен по инициативе Заказчика для полного и всестороннего рассмотрения всех обстоятельств\nзапроса, а также получения дополнительной информации и документов от Исполнителя, о чем Заказчик уведомляет\nИсполнителя. Максимальный срок такого ответа на запрос Исполнителя в любом случае не может превышать 30\n(тридцать) календарных дней.\n7.', 'Максимальный срок рассмотрения в любом случае не\nможет превышать 30 (тридцать) календарных дней.\n12.2.', 'Максимальный срок\nрассмотрения в любом случае не может превышать 30 (тридцать) календарных дней.\n12.3.']","**Ответ:**  
Для рассмотрения обращения Исполнителя по оспариванию штрафа установлен срок в **7 календарных дней** с момента уведомления Исполнителя. Максимальный срок рассмотрения такого обращения не может превышать **30 календарных дней**.",0.6666666666666666,0.9514054417544431,
"В каких случаях Заказчик может применить блокировку выплат ПВЗ, и как это влияет на обязанности Исполнителя по оказанию услуг?","['В случае подтверждения обстоятельств, указанных в обращении\nИсполнителя, Блокировка ПВЗ прекращается Заказчиком.\n13.4. Заказчик вправе осуществить Блокировку ПВЗ Исполнителя по инициативе Исполнителя в случаях, если у\nИсполнителя возникли или могут возникнуть обстоятельства, препятствующие исполнению Договора в полном\nобъеме или частично, в том числе: у Исполнителя возникли проблемы с использованием ПВЗ (аренда или иное),\nИсполнитель готовится к переезду в другой ПВЗ или осуществляет ремонт в текущем ПВЗ, либо по иной причине.\n13.5. Заказчик вправе применить к Исполнителю Блокировку выплат ПВЗ, в случаях проведения Заказчиком\nпроверки Исполнителя на предмет нарушения Договора и/или выявления Заказчиком нарушений Исполнителем\nтаких условий Договора, как снижение Рейтинга ПВЗ до Минимального значения рейтинга ПВЗ, не предоставления\nнеобходимых документов в соответствии с п. 8.5, включая п. 8.5.1. – 8.5.5. Договора.\nБлокировка выплат ПВЗ вводится с даты направления Исполнителю уведомления о Блокировке выплат ПВЗ и до\nдаты прекращения проводимой Заказчиком проверки и/или устранения, допущенного Исполнителем нарушения.', '13.5. Заказчик вправе применить к Исполнителю Блокировку выплат ПВЗ, в случаях проведения Заказчиком\nпроверки Исполнителя на предмет нарушения Договора и/или выявления Заказчиком нарушений Исполнителем\nтаких условий Договора, как снижение Рейтинга ПВЗ до Минимального значения рейтинга ПВЗ, не предоставления\nнеобходимых документов в соответствии с п. 8.5, включая п. 8.5.1. – 8.5.5. Договора.', '13.5. Заказчик вправе применить к Исполнителю Блокировку выплат ПВЗ, в случаях проведения Заказчиком\nпроверки Исполнителя на предмет нарушения Договора и/или выявления Заказчиком нарушений Исполнителем\nтаких условий Договора,', 'В случае подтверждения обстоятельств, указанных в обращении\nИсполнителя, Блокировка ПВЗ прекращается Заказчиком.\n13.4. Заказчик вправе осуществить Блокировку ПВЗ Исполнителя по инициативе Исполнителя в случаях, если у\nИсполнителя возникли или могут возникнуть обстоятельства, препятствующие исполнению Договора в полном\nобъеме или частично, в том числе: у Исполнителя возникли проблемы с использованием ПВЗ (аренда или иное),\nИсполнитель готовится к переезду в другой ПВЗ или осуществляет ремонт в текущем ПВЗ, либо по иной причине.\n13.5.', 'В случае подтверждения обстоятельств, указанных в обращении\nИсполнителя, Блокировка ПВЗ прекращается Заказчиком.\n13.4. Заказчик вправе осуществить Блокировку ПВЗ Исполнителя по инициативе Исполнителя в случаях, если у\nИсполнителя возникли или могут возникнуть обстоятельства,', 'Исполнитель обязан оказывать Услуги в ПВЗ, независимо от применения Блокировки выплат ПВЗ. Блокировка\nвыплат ПВЗ, применяемая к Исполнителю в соответствии с настоящим пунктом, не ограничивает иные\nфункциональные возможности, предоставляемые Заказчиком Исполнителю в целях исполнения Договора.\nБлокировка выплат ПВЗ не изменяет какие-либо условия Договора, которые продолжают действовать для обеих\nСторон без исключений.\n14. Деактивация и расторжение Договора\n14.1. Заказчик вправе отказаться от исполнения Договора в одностороннем внесудебном порядке полностью или\nв части определенного ПВЗ Исполнителя, при наличии у Исполнителя более 1 (одного) ПВЗ, то есть осуществить\nпроцесс Деактивации ПВЗ.\n14.2. Заказчик инициирует процесс Деактивации ПВЗ в указанных ниже случаях:\nОснования и порядок Деактивации Прекращение процессаДеактивации (еслиприменимо)\n1 Если Доля Подмен за последние 30 (тридцать) календарных дней подрядоказания Услуг Исполнителем в ПВЗ будет составлять более 1% (одногопроцента).', 'Исполнитель обязан оказывать Услуги в ПВЗ, независимо от применения Блокировки выплат ПВЗ. Блокировка\nвыплат ПВЗ, применяемая к Исполнителю в соответствии с настоящим пунктом, не ограничивает иные\nфункциональные возможности, предоставляемые Заказчиком Исполнителю в целях исполнения Договора.\nБлокировка выплат ПВЗ не изменяет какие-либо условия Договора, которые продолжают действовать для обеих\nСторон без исключений.\n14. Деактивация и расторжение Договора\n14.1.', '13. Блокировка ПВЗ\n13.1. Независимо от применения штрафов в соответствии с Приложением № 4 к Договору Заказчик в целях\nпресечения нарушения Исполнителем обязательств по Договору, в том числе на будущий период и/или длящихся\nнарушений и/или защиты прав третьих лиц, осуществляет Блокировку ПВЗ в нижеследующих случаях.', 'Блокировка\nвыплат ПВЗ, применяемая к Исполнителю в соответствии с настоящим пунктом, не ограничивает иные\nфункциональные возможности, предоставляемые Заказчиком Исполнителю в целях исполнения Договора.', '– 8.5.5. Договора.\nБлокировка выплат ПВЗ вводится с даты направления Исполнителю уведомления о Блокировке выплат ПВЗ и до\nдаты прекращения проводимой Заказчиком проверки и/или устранения, допущенного Исполнителем нарушения.']","Заказчик может применить блокировку выплат ПВЗ в следующих случаях:

1. При проведении проверки Исполнителя на предмет нарушения Договора.
2. При выявлении нарушений со стороны Исполнителя, включая:
   - Снижение Рейтинга ПВЗ до Минимального значения рейтинга ПВЗ.
   - Не предоставление необходимых документов в соответствии с п. 8.5 Договора, включая подпункты 8.5.1 — 8.5.5.

Блокировка выплат ПВЗ вводится с даты направления уведомления Исполнителю и действует до даты прекращения проверки и/или устранения нарушения.

Влияние на обязанности Исполнителя:
- Исполнитель **обязан оказывать Услуги в ПВЗ**, независимо от применения блокировки выплат ПВЗ.
- Блокировка выплат ПВЗ **не ограничивает иные функциональные возможности**, предоставляемые Заказчиком Исполнителю в целях исполнения Договора.
- Блокировка выплат ПВЗ **не изменяет условия Договора**, которые продолжают действовать для обеих сторон без исключений.",1.0,0.982472843118907,
"Какой срок предусмотрен для Деактивации ПВЗ, если Исполнитель нарушает условие п. 6.1 Правил оказания услуг более 3 календарных дней подряд?","['2 В случае нарушения п. 6.1 Правил оказания услуг (круглосуточный,беспрепятственный доступ в ПВЗ) со стороны Исполнителя на срок более 3(трех) календарных дней подряд, Заказчик направляет Исполнителюуведомление через ЛК о Деактивации ПВЗ на 4-й календарный день.', '6.1 Правил оказания услуг (круглосуточный,беспрепятственный доступ в ПВЗ) со стороны Исполнителя на срок более 3(трех) календарных дней подряд, Заказчик направляет Исполнителюуведомление через ЛК о Деактивации ПВЗ на 4-й календарный день.', 'Заказчик направляет Исполнителю уведомление через ЛК, о том, чтона 31-й (календарный) день происходит Деактивация ПВЗ.\nЕсли Доля ПодменИсполнителя снизится втечение 30 (тридцати)календарных дней с моментанаправления Заказчикомуведомления о Деактивации,\n\nОснования и порядок Деактивации Прекращение процессаДеактивации (еслиприменимо)\nто Заказчик вправепрекратить процессДеактивации.\n2 В случае нарушения п. 6.1 Правил оказания услуг (круглосуточный,беспрепятственный доступ в ПВЗ) со стороны Исполнителя на срок более 3(трех) календарных дней подряд, Заказчик направляет Исполнителюуведомление через ЛК о Деактивации ПВЗ на 4-й календарный день.\n3 В случае приостановки оказания Услуг по Договору со стороны Исполнителя насрок более 2 (двух) календарных дней подряд по любым основаниям безпредварительного согласования с Заказчиком, Заказчик направляетИсполнителю уведомление через ЛК о Деактивации ПВЗ на 3-ий\xa0календарныйдень.', '3 В случае приостановки оказания Услуг по Договору со стороны Исполнителя насрок более 2 (двух) календарных дней подряд по любым основаниям безпредварительного согласования с Заказчиком, Заказчик направляетИсполнителю уведомление через ЛК о Деактивации ПВЗ на 3-ий\xa0календарныйдень.', '5.5 Договора (распространение Исполнителем информации, порочащейчесть, достоинство и деловую репутацию Заказчика) систематически (3 (три) иболее раза), Заказчик направляет Исполнителю уведомление через ЛК оДеактивации ПВЗ через 2 (два) календарных дня с даты получения уведомленияв ЛК Исполнителя.\n7 Если в течение 21 (двадцати одного) календарного дня подряд после полученияуведомления в ЛК Рейтинг ПВЗ Исполнителя будет составлять значение нижеМинимального значения рейтинга ПВЗ, то на 22-й (двадцать второй)календарный день Заказчик производит Деактивацию ПВЗ.\n14.3. Заказчик через Портал уведомляет Исполнителя об осуществлении Деактивации ПВЗ Исполнителя с\nуказанием оснований для Деактивации ПВЗ.\n14.4. Если при Деактивации у Исполнителя не остается действующих ПВЗ в Личном кабинете, Договор с таким\nИсполнителем считается расторгнутым (прекращенным) в одностороннем внесудебном порядке, а Личный кабинет\nИсполнителя — удаленным в течение 90 (девяноста) календарных дней со дня направления Заказчиком\nуведомления о Деактивации всех ПВЗ Исполнителя.', 'инициирует процесс Деактивации ПВЗ в указанных ниже случаях:\nОснования и порядок Деактивации Прекращение процессаДеактивации (еслиприменимо)\n1 Если Доля Подмен за последние 30 (тридцать) календарных дней подрядоказания Услуг Исполнителем в ПВЗ будет составлять более 1%', 'Исполнитель имеет право отказаться от оказания Услуг в отношении определенного ПВЗ и потребовать от\nЗаказчика инициировать процесс Деактивации конкретного ПВЗ, при наличии у Исполнителя более 1 (одного) ПВЗ,\nпутем направления Заказчику заявки о Деактивации ПВЗ не позднее чем за 14 (четырнадцать) календарных дней до\nпредполагаемой даты Деактивации ПВЗ.\n\n14.6.', 'При осуществлении процесса Деактивации ПВЗ по инициативе\nЗаказчика применяются положения пп. 14.6–14.11 Договора.\n14.5. Исполнитель имеет право полностью отказаться от исполнения Договора в одностороннем внесудебном\nпорядке путем направления Заказчику уведомления о расторжении Договора не позднее чем за 30 (тридцать)\nкалендарных дней до предполагаемой даты расторжения Договора (Деактивация всех ПВЗ Исполнителя).\nИсполнитель имеет право отказаться от оказания Услуг в отношении определенного ПВЗ и потребовать от\nЗаказчика инициировать процесс Деактивации конкретного ПВЗ, при наличии у Исполнителя более 1 (одного) ПВЗ,\nпутем направления Заказчику заявки о Деактивации ПВЗ не позднее чем за 14 (четырнадцать) календарных дней до\nпредполагаемой даты Деактивации ПВЗ.\n\n14.6.', '5.5 Договора (распространение Исполнителем информации, порочащейчесть, достоинство и деловую репутацию Заказчика) систематически (3 (три) иболее раза), Заказчик направляет Исполнителю уведомление через ЛК оДеактивации ПВЗ через 2 (два) календарных дня с даты получения уведомленияв ЛК Исполнителя.', '14.6. Исполнитель обязуется в течение 14 (четырнадцати) календарных дней с даты утверждения Заказчиком\nзаявки Исполнителя на Деактивацию ПВЗ:\n• надлежащим образом оказывать Услуги на таком ПВЗ;']","Срок, предусмотренный для Деактивации ПВЗ, если Исполнитель нарушает условие п. 6.1 Правил оказания услуг более 3 календарных дней подряд, составляет **4-й календарный день** с момента нарушения. 

Заказчик направляет уведомление через ЛК о Деактивации ПВЗ на **4-й календарный день** после нарушения.",0.6666666666666666,0.7429805945708298,
Какое количество повторных Блокировок ПВЗ Исполнителя в течение одного календарного года может стать основанием для Деактивации ПВЗ?,"['5 Если к ПВЗ Исполнителя применялась Блокировка более трех раз пооснованиям, указанным в разделе 13 Договора, в течение каждого календарногогода с даты начала Активации ПВЗ, то при наличии оснований для применения4-й Блокировки Заказчик вправе Деактивировать ПВЗ Исполнителя.', 'совершение мнимых и притворных сделок в отношении Товаров сиспользованием ПВЗ, Заказчик вправе Деактивировать ПВЗ Исполнителя.\n5 Если к ПВЗ Исполнителя применялась Блокировка более трех раз пооснованиям, указанным в разделе 13 Договора, в течение каждого календарногогода с даты начала Активации ПВЗ, то при наличии оснований для применения4-й Блокировки Заказчик вправе Деактивировать ПВЗ Исполнителя.\n6 В случае нарушения Исполнителем любого из перечисленных нижеобязательств:- пп. 5.1–5.2 Договора (предоставление достоверных данных и информации),- пп.', '4 При наличии в действиях Исполнителя при оказании Услуг по Договорунарушений законодательства и (или) существенного нарушения условийДоговора, влекущих угрозу безопасности, жизни и (или) здоровья Получателей и/или иных лиц, безопасности и (или) стабильности работы ПВЗ, а такжесовершение действий, направленных на создание сбоев в функционированииработы Портала и/или ПВЗ, умышленное предоставление информации, несоответствующей действительности, при создании ЛК, оскорбления и/илииспользование ненормативной лексики в отношении Получателей и/или иныхлиц, совершение мнимых и притворных сделок в отношении Товаров сиспользованием ПВЗ, Заказчик вправе Деактивировать ПВЗ Исполнителя.\n5 Если к ПВЗ Исполнителя применялась Блокировка более трех раз пооснованиям, указанным в разделе 13 Договора, в течение каждого календарногогода с даты начала Активации ПВЗ, то при наличии оснований для применения4-й Блокировки Заказчик вправе Деактивировать ПВЗ Исполнителя.\n6 В случае нарушения Исполнителем любого из перечисленных нижеобязательств:- пп. 5.1–5.2 Договора (предоставление достоверных данных и информации),- пп.', 'Заказчик вправе отказаться от исполнения Договора в одностороннем внесудебном порядке полностью или\nв части определенного ПВЗ Исполнителя, при наличии у Исполнителя более 1 (одного) ПВЗ, то есть осуществить\nпроцесс Деактивации ПВЗ.\n14.2. Заказчик инициирует процесс Деактивации ПВЗ в указанных ниже случаях:\nОснования и порядок Деактивации Прекращение процессаДеактивации (еслиприменимо)\n1 Если Доля Подмен за последние 30 (тридцать) календарных дней подрядоказания Услуг Исполнителем в ПВЗ будет составлять более 1% (одногопроцента).', 'Исполнитель обязан оказывать Услуги в ПВЗ, независимо от применения Блокировки выплат ПВЗ. Блокировка\nвыплат ПВЗ, применяемая к Исполнителю в соответствии с настоящим пунктом, не ограничивает иные\nфункциональные возможности, предоставляемые Заказчиком Исполнителю в целях исполнения Договора.\nБлокировка выплат ПВЗ не изменяет какие-либо условия Договора, которые продолжают действовать для обеих\nСторон без исключений.\n14. Деактивация и расторжение Договора\n14.1. Заказчик вправе отказаться от исполнения Договора в одностороннем внесудебном порядке полностью или\nв части определенного ПВЗ Исполнителя, при наличии у Исполнителя более 1 (одного) ПВЗ, то есть осуществить\nпроцесс Деактивации ПВЗ.\n14.2. Заказчик инициирует процесс Деактивации ПВЗ в указанных ниже случаях:\nОснования и порядок Деактивации Прекращение процессаДеактивации (еслиприменимо)\n1 Если Доля Подмен за последние 30 (тридцать) календарных дней подрядоказания Услуг Исполнителем в ПВЗ будет составлять более 1% (одногопроцента).', '7 Если в течение 21 (двадцати одного) календарного дня подряд после полученияуведомления в ЛК Рейтинг ПВЗ Исполнителя будет составлять значение нижеМинимального значения рейтинга ПВЗ, то на 22-й (двадцать второй)календарный день Заказчик производит Деактивацию ПВЗ.\n14.3. Заказчик через Портал уведомляет Исполнителя об осуществлении Деактивации ПВЗ Исполнителя с\nуказанием оснований для Деактивации ПВЗ.\n14.4.', 'Если Рейтинг ПВЗ снижался три и более раза нижеМинимального значения рейтинга ПВЗ Исполнителяв течение 1 (одного) календарного года оказанияУслуг Исполнителем с даты Активации ПВЗ попричине нарушений, послуживших основанием дляснижения Рейтинга и приведших к Блокировке ПВЗ,то прекращение применения Блокировки ПВЗ, приусловии устранения нарушений, Заказчиком неприменяется.', 'Если Рейтинг ПВЗ Исполнителя становится равнымили больше Минимального значения рейтинга ПВЗ,Заказчик незамедлительно прекращает БлокировкуПВЗ и направляет соответствующее уведомление вЛК.Заказчик вправе прекратить Блокировку ПВЗИсполнителя, если значение Рейтинга ПВЗИсполнителя менее Минимального значениярейтинга ПВЗ, но Исполнитель прикладывает усилиядля улучшения качества оказания Услуг по Договору,устраняет все нарушения, послужившие основаниемдля снижения Рейтинга и приведшие к БлокировкеПВЗ, а также продолжает соблюдать полностью идобросовестно Договор.Если Рейтинг ПВЗ снижался три и более раза нижеМинимального значения рейтинга ПВЗ Исполнителяв течение 1 (одного) календарного года оказанияУслуг Исполнителем с даты Активации ПВЗ попричине нарушений, послуживших основанием дляснижения Рейтинга и приведших к Блокировке ПВЗ,то прекращение применения Блокировки ПВЗ, приусловии устранения нарушений, Заказчиком неприменяется.', '5.5 Договора (распространение Исполнителем информации, порочащейчесть, достоинство и деловую репутацию Заказчика) систематически (3 (три) иболее раза), Заказчик направляет Исполнителю уведомление через ЛК оДеактивации ПВЗ через 2 (два) календарных дня с даты получения уведомленияв ЛК Исполнителя.\n7 Если в течение 21 (двадцати одного) календарного дня подряд после полученияуведомления в ЛК Рейтинг ПВЗ Исполнителя будет составлять значение нижеМинимального значения рейтинга ПВЗ, то на 22-й (двадцать второй)календарный день Заказчик производит Деактивацию ПВЗ.\n14.3. Заказчик через Портал уведомляет Исполнителя об осуществлении Деактивации ПВЗ Исполнителя с\nуказанием оснований для Деактивации ПВЗ.\n14.4. Если при Деактивации у Исполнителя не остается действующих ПВЗ в Личном кабинете, Договор с таким\nИсполнителем считается расторгнутым (прекращенным) в одностороннем внесудебном порядке, а Личный кабинет\nИсполнителя — удаленным в течение 90 (девяноста) календарных дней со дня направления Заказчиком\nуведомления о Деактивации всех ПВЗ Исполнителя.', 'Основания и Порядок Блокировки Условия снятия Блокировки\n1 Если значение Рейтинга ПВЗ Исполнителя становитсяменьше Минимального значения рейтинга ПВЗ, Заказчикосуществляет Блокировку ПВЗ Исполнителя.В случае если Блокировка ПВЗ Исполнителя длится 2(два) календарных дня подряд и более, то Заказчикразличными способами содействует Исполнителю вулучшении качества оказания Услуг в ПВЗ Исполнителя.']",Ответ: **Более трех повторных Блокировок ПВЗ Исполнителя в течение одного календарного года может стать основанием для Деактивации ПВЗ.**,1.0,0.8970301118830759,
Какие два условия нарушения Исполнителем обязательств могут привести к Деактивации ПВЗ через 2 календарных дня после получения уведомления в Личном кабинете?,"['5.5 Договора (распространение Исполнителем информации, порочащейчесть, достоинство и деловую репутацию Заказчика) систематически (3 (три) иболее раза), Заказчик направляет Исполнителю уведомление через ЛК оДеактивации ПВЗ через 2 (два) календарных дня с даты получения уведомленияв ЛК Исполнителя.\n7 Если в течение 21 (двадцати одного) календарного дня подряд после полученияуведомления в ЛК Рейтинг ПВЗ Исполнителя будет составлять значение нижеМинимального значения рейтинга ПВЗ, то на 22-й (двадцать второй)календарный день Заказчик производит Деактивацию ПВЗ.\n14.3. Заказчик через Портал уведомляет Исполнителя об осуществлении Деактивации ПВЗ Исполнителя с\nуказанием оснований для Деактивации ПВЗ.\n14.4. Если при Деактивации у Исполнителя не остается действующих ПВЗ в Личном кабинете, Договор с таким\nИсполнителем считается расторгнутым (прекращенным) в одностороннем внесудебном порядке, а Личный кабинет\nИсполнителя — удаленным в течение 90 (девяноста) календарных дней со дня направления Заказчиком\nуведомления о Деактивации всех ПВЗ Исполнителя.', 'Заказчик направляет Исполнителю уведомление через ЛК, о том, чтона 31-й (календарный) день происходит Деактивация ПВЗ.\nЕсли Доля ПодменИсполнителя снизится втечение 30 (тридцати)календарных дней с моментанаправления Заказчикомуведомления о Деактивации,\n\nОснования и порядок Деактивации Прекращение процессаДеактивации (еслиприменимо)\nто Заказчик вправепрекратить процессДеактивации.\n2 В случае нарушения п. 6.1 Правил оказания услуг (круглосуточный,беспрепятственный доступ в ПВЗ) со стороны Исполнителя на срок более 3(трех) календарных дней подряд, Заказчик направляет Исполнителюуведомление через ЛК о Деактивации ПВЗ на 4-й календарный день.\n3 В случае приостановки оказания Услуг по Договору со стороны Исполнителя насрок более 2 (двух) календарных дней подряд по любым основаниям безпредварительного согласования с Заказчиком, Заказчик направляетИсполнителю уведомление через ЛК о Деактивации ПВЗ на 3-ий\xa0календарныйдень.', 'При\nсистематических нарушениях Блокировка применяется с момента выявления нарушения (с момента уведомления в\nЛК о причинах Блокировки), а для длящихся нарушений — незамедлительно по истечении срока, указанного в\nуведомлении Заказчика об устранении нарушения.\nОснования и Порядок Блокировки Условия снятия Блокировки\n1 Если значение Рейтинга ПВЗ Исполнителя становитсяменьше Минимального значения рейтинга ПВЗ, Заказчикосуществляет Блокировку ПВЗ Исполнителя.В случае если Блокировка ПВЗ Исполнителя длится 2(два) календарных дня подряд и более, то Заказчикразличными способами содействует Исполнителю вулучшении качества оказания Услуг в ПВЗ Исполнителя.', 'Заказчик направляет Исполнителю уведомление через ЛК оДеактивации ПВЗ через 2 (два) календарных дня с даты получения уведомленияв ЛК Исполнителя.', '7 Если в течение 21 (двадцати одного) календарного дня подряд после полученияуведомления в ЛК Рейтинг ПВЗ Исполнителя будет составлять значение нижеМинимального значения рейтинга ПВЗ, то на 22-й (двадцать второй)календарный день Заказчик производит Деактивацию ПВЗ.\n14.3. Заказчик через Портал уведомляет Исполнителя об осуществлении Деактивации ПВЗ Исполнителя с\nуказанием оснований для Деактивации ПВЗ.\n14.4.', '5.5 Договора (распространение Исполнителем информации, порочащейчесть, достоинство и деловую репутацию Заказчика) систематически (3 (три) иболее раза), Заказчик направляет Исполнителю уведомление через ЛК оДеактивации ПВЗ через 2 (два) календарных дня с даты получения уведомленияв ЛК Исполнителя.', '2 В случае нарушения п. 6.1 Правил оказания услуг (круглосуточный,беспрепятственный доступ в ПВЗ) со стороны Исполнителя на срок более 3(трех) календарных дней подряд, Заказчик направляет Исполнителюуведомление через ЛК о Деактивации ПВЗ на 4-й календарный день.', '14.4. Если при Деактивации у Исполнителя не остается действующих ПВЗ в Личном кабинете, Договор с таким\nИсполнителем считается расторгнутым (прекращенным) в одностороннем внесудебном порядке, а Личный кабинет\nИсполнителя — удаленным в течение 90 (девяноста) календарных дней со дня направления Заказчиком\nуведомления о Деактивации всех ПВЗ Исполнителя.', 'Заказчик направляет Исполнителю уведомление через ЛК, о том, чтона 31-й (календарный) день происходит Деактивация ПВЗ.\nЕсли Доля ПодменИсполнителя снизится втечение 30 (тридцати)календарных дней с моментанаправления Заказчикомуведомления о Деактивации,\n\nОснования и порядок Деактивации Прекращение процессаДеактивации (еслиприменимо)\nто Заказчик вправепрекратить процессДеактивации.\n2 В случае нарушения п.', '2 В случае нарушения Исполнителем любого изперечисленных ниже обязательств 3 (три) и более разподряд в течение 1 (одного) календарного года оказанияУслуг Исполнителем в ПВЗ с даты Активации ПВЗ(систематическое нарушение) или при неустранениидлящегося нарушения после получения соответствующегоуведомления от Заказчика:1) указанных в Договоре:- пп.']","Ответ:  
1) Систематическое нарушение обязательств Исполнителя (3 и более раз подряд в течение 1 календарного года оказания услуг в ПВЗ с даты активации ПВЗ).  
2) Неустранение длящегося нарушения после получения соответствующего уведомления от Заказчика.",1.0,0.5828894337029963,
"Что обязан сделать Исполнитель в случае непоступления Товаров в альтернативный ПВЗ, указанный Заказчиком?","['14.9. В случае непоступления Товаров в альтернативный ПВЗ, указанный Заказчиком, Исполнитель обязуется\nнезамедлительно с момента поступления запроса Заказчика предоставить записи с камер видеонаблюдения,\nподтверждающие формирование Возвратных коробок.', 'либо в случае, если информация о фактическом количестве и состоянии инвентаризируемых\nТоваров не соответствует информации, отраженной о них на Портале.\n14.9. В случае непоступления Товаров в альтернативный ПВЗ, указанный Заказчиком, Исполнитель обязуется\nнезамедлительно с момента поступления запроса Заказчика предоставить записи с камер видеонаблюдения,\nподтверждающие формирование Возвратных коробок.', '14.8. Инвентаризация завершается:\n• в случае обработки Исполнителем всех числящихся в ПВЗ Товаров и установления Заказчиком соответствия\nфактического количества и состояния инвентаризируемых Товаров информации, отраженной о них на Портале;\n• по истечение срока проведения инвентаризации, установленного настоящим пунктом, Заказчик в\nодностороннем порядке, без предварительного уведомления Исполнителя производит удержание из вознаграждения\nИсполнителя сумму Стоимостей Товаров, не обработанных Исполнителем при проведении инвентаризации в\nустановленные сроки, либо в случае, если информация о фактическом количестве и состоянии инвентаризируемых\nТоваров не соответствует информации, отраженной о них на Портале.\n14.9. В случае непоступления Товаров в альтернативный ПВЗ, указанный Заказчиком, Исполнитель обязуется\nнезамедлительно с момента поступления запроса Заказчика предоставить записи с камер видеонаблюдения,\nподтверждающие формирование Возвратных коробок.', '14.6. Исполнитель обязуется в течение 14 (четырнадцати) календарных дней с даты утверждения Заказчиком\nзаявки Исполнителя на Деактивацию ПВЗ:\n• надлежащим образом оказывать Услуги на таком ПВЗ;\n• или собственными силами осуществить перемещение находящихся в ПВЗ Товаров в альтернативный ПВЗ,\nинформация о котором направляется Заказчиком после утверждения заявки Исполнителя о начале процесса\nДеактивации ПВЗ.\nПеремещение Товаров в альтернативный ПВЗ допускается исключительно после проведения Исполнителем\nинвентаризации Товаров в ПВЗ, находящемся в процессе Деактивации.\n14.7. Инвентаризация Товаров в ПВЗ, находящемся в процессе Деактивации, осуществляется Исполнителем\nпосредством использования Портала в Возвратные коробки с обязательной фиксацией проводимой инвентаризации\nна камеры видеонаблюдения.\nИсполнитель обязан осуществить инвентаризацию Товаров в ПВЗ, находящемся в процессе Деактивации, в\nтечение 24 (двадцати четырех) часов с момента начала инвентаризации, указанного в уведомлении,\nзаблаговременно направляемом Заказчиком в Личный кабинет Исполнителя.\n14.8.', 'В случае поступления по указанному Заказчиком адресу\nТоваров с недостатками (включая, но не ограничиваясь: частичное повреждение, неверное вложение) и/или Подмен,\nИсполнитель обязуется возместить Стоимость Товаров с недостатками и/или замененных на Подмены.\nВзаиморасчеты по недостачам и недостаткам Товаров производятся Сторонами в соответствии с условиями\nДоговора.\n14.10. Утвержденная Заказчиком заявка Исполнителя на осуществление процесса Деактивации ПВЗ не может\nбыть отозвана Исполнителем. Данное условие не лишает Исполнителя возможности осуществить Активацию нового\nПВЗ.\n14.11. При расторжении Договора по любому основанию Исполнитель обязан передать Заказчику Товары,\nнаходящиеся в ПВЗ, по первому требованию Заказчика в течение 3 (трех) календарных дней с даты получения\nсоответствующего требования, а также предоставить доступ представителям Заказчика к Товарам в ПВЗ для\nпроведения инвентаризации. В указанном случае Стороны проводят сверку по взаимным обязательствам и на\nосновании сверки осуществляют итоговые взаиморасчеты в течение 60 (шестидесяти) календарных дней с даты\nрасторжения Договора.', '14.6. Исполнитель обязуется в течение 14 (четырнадцати) календарных дней с даты утверждения Заказчиком\nзаявки Исполнителя на Деактивацию ПВЗ:\n• надлежащим образом оказывать Услуги на таком ПВЗ;\n• или собственными силами осуществить перемещение находящихся в ПВЗ Товаров в альтернативный ПВЗ,\nинформация о котором направляется Заказчиком после утверждения заявки Исполнителя о начале процесса\nДеактивации ПВЗ.', 'Исполнитель принимает на\nсебя обязательство принимать все разумные и доступные меры для обеспечения сохранности, предотвращения\nпорчи или повреждения Товара.\n5.20. Исполнитель обязуется выдать поступивший в ПВЗ Товар Получателям в количестве, ассортименте и\nкомплектации в соответствии с положениями п. 5.3 Договора и требованиями, указанными в Поручениях Заказчика.\n5.21. Исполнитель обязуется принимать Товар от Продавца и выдавать Товар Продавцу исключительно в\nприсутствии Продавца либо лица, документально уполномоченного Продавцом на передачу или приемку такого\nТовара, под камерами видеонаблюдения, установленными в ПВЗ.\n5.22. Исполнитель обязуется в любое время прибытия транспортного средства с Товаром к ПВЗ в часы работы\nПВЗ принимать от Заказчика/Перевозчика/Продавца и передавать Товар Заказчику/Перевозчику/Продавцу.\n5.23. Исполнитель не вправе перемещать Товар, Маркетплейс-короба, Маркетплейс Товары, Клиентские\nвозвраты на другие ПВЗ, выносить Товар за территорию ПВЗ, если это прямо не предусмотрено Поручением\nЗаказчика.\n6. Права и обязательства Заказчика\n\n6.1.', 'При получении\nпретензий Заказчик вправе переадресовать их в адрес Исполнителя и/или сообщить данные об Исполнителе\nгосударственным органам.\nОперации с Товаром\n5.17. При приёмке Товара в ПВЗ Исполнитель обязуется отражать в Личном кабинете достоверные сведения о\nналичии или отсутствии недостатка в принятом Товаре (делать соответствующую отметку в ЛК на Портале только\nпри действительном наличии недостатка Товара).\n5.18. В ходе обработки или сортировки поступившего на ПВЗ Товара, или подготовки Товара к возврату, в случае\nобнаружения в Товаре недостатка Исполнитель обязуется действовать в соответствии с настоящим Договором и\nИнструкциями и предоставить достоверную информацию о недостатке Товара Заказчику, проставив\nсоответствующую отметку с выбором типа выявленного недостатка, посредством Личного кабинета с приложением\nподтверждающих фото- и/или видео доказательств. Предоставленные фото- и/или видео доказательства не должны\nсодержать персональные данные третьих лиц.\n5.19. Исполнитель обязуется обеспечить сохранность Товаров, находящихся в ПВЗ.', 'Данное условие не лишает Исполнителя возможности осуществить Активацию нового\nПВЗ.\n14.11. При расторжении Договора по любому основанию Исполнитель обязан передать Заказчику Товары,\nнаходящиеся в ПВЗ, по первому требованию Заказчика в течение 3 (трех) календарных дней с даты получения\nсоответствующего требования, а также предоставить доступ представителям Заказчика к Товарам в ПВЗ для\nпроведения инвентаризации.', '2.4. Исполнитель обязуется подготовить для передачи и направить на Склад Клиентские возвраты, не\nвостребованные Клиентом Товары, Товары, Поручения на которые были отменены посредством Портала, либо\nТовары, доставленные на ПВЗ Исполнителя ошибочно, не по адресу (статусы на Портале: Излишки/Ошибочные\nдоставки/Ошибочный ПВЗ), путем физического вложения указанного Товара Исполнителем в Возвратную коробку в\nтечение 24 (двадцати четырех) часов с момента:\n• отказа от Товара Клиентом, или\n• истечения срока, когда Товар мог быть получен в ПВЗ Исполнителя,']","Ответ: В случае непоступления Товаров в альтернативный ПВЗ, указанный Заказчиком, Исполнитель обязуется незамедлительно с момента поступления запроса Заказчика предоставить записи с камер видеонаблюдения, подтверждающие формирование Возвратных коробок.",0.75,0.9445685217764093,0.999999999975
Какой срок у Заказчика на рассмотрение заявки Исполнителя о смене Исполнителя?,"['16.5. Заказчик рассматривает заявку Исполнителя в течение 30 (тридцати) календарных дней и проверяет\nпредоставленные данные о новом Исполнителе, а также проверяет наличие задолженности Исполнителя и нового\nИсполнителя перед Заказчиком.', '16.5. Заказчик рассматривает заявку Исполнителя в течение 30 (тридцати) календарных дней и проверяет\nпредоставленные данные о новом Исполнителе, а также проверяет наличие задолженности Исполнителя и нового\nИсполнителя перед Заказчиком. Заказчик вправе отказать в согласовании заявки Исполнителя.\n17. Заключительные положения\n17.1. Отношения сторон по Договору, заключение, прекращение и исполнение Договора регулируются\nдействующим законодательством Российской Федерации.\n17.2. Направление юридически значимых сообщений:\n17.2.1.', '16.5. Заказчик рассматривает заявку Исполнителя в течение 30 (тридцати) календарных дней и проверяет\nпредоставленные данные о новом Исполнителе, а также проверяет наличие задолженности Исполнителя и нового\nИсполнителя перед Заказчиком. Заказчик вправе отказать в согласовании заявки Исполнителя.\n17. Заключительные положения\n17.1. Отношения сторон по Договору, заключение, прекращение и исполнение Договора регулируются\nдействующим законодательством Российской Федерации.\n17.2. Направление юридически значимых сообщений:\n17.2.1. Заявления, уведомления, извещения, требования или любые иные юридически значимые сообщения, в\nтом числе составленные в соответствии с п.', '16. Замена Исполнителя по Договору\n16.1. Смена Исполнителя на другое лицо возможна:\n— до истечения 6 (шести) месяцев с даты Активации ПВЗ только при условии перечисления Исполнителем\n(действующим или новым) Заказчику платы за замену на стороне Исполнителя в размере, действующем на момент\nподачи заявки о смене и указанном на Портале.', 'Изменения вступают в силу с 00 часов 00 минут:\n▪ дня, который указан в новости, но который может наступить не ранее чем по истечении 14 (четырнадцати)\nполных суток с даты опубликования новости о внесении Изменений — если Изменения касаются изменения порядка\nрасчета стоимости Услуг по Договору, тарифов или если Изменения требуют адаптации деятельности ПВЗ под новые\nусловия;\n▪ дня, который указан в новости, но который наступит не ранее чем по истечении 7 (семи) полных суток с даты\nопубликования новости о внесении Изменений, — все иные Изменения.\n16. Замена Исполнителя по Договору\n16.1. Смена Исполнителя на другое лицо возможна:\n— до истечения 6 (шести) месяцев с даты Активации ПВЗ только при условии перечисления Исполнителем\n(действующим или новым) Заказчику платы за замену на стороне Исполнителя в размере, действующем на момент\nподачи заявки о смене и указанном на Портале.\n— после истечения 6 (шести) месяцев с даты Активации ПВЗ – Заказчик оставляет за собой право не взимать плату\nза смену на стороне Исполнителя (действующего или нового), о чем уведомит Исполнителя после рассмотрения\nзаявки согласно п. 16.5. Договора.', '16. Замена Исполнителя по Договору\n16.1. Смена Исполнителя на другое лицо возможна:\n— до истечения 6 (шести) месяцев с даты Активации ПВЗ только при условии перечисления Исполнителем\n(действующим или новым) Заказчику платы за замену на стороне Исполнителя в размере,', 'При этом срок рассмотрения\nможет быть продлен по инициативе Заказчика для полного и всестороннего рассмотрения всех обстоятельств\nзапроса, а также получения дополнительной информации и документов от Исполнителя, о чем Заказчик уведомляет\nИсполнителя. Максимальный срок такого ответа на запрос Исполнителя в любом случае не может превышать 30\n(тридцать) календарных дней.\n7.', 'Под сменой Исполнителя понимается замена Стороны Исполнителя по Договору, при\nкоторой изначальный Исполнитель передаёт все права и обязанности по Договору новому Исполнителю.\nИсполнитель обязан возвратить Заказчику суммы Дополнительных поддерживающих выплат:\n• в течение 5 (пяти) календарных дней до даты Деактивации ПВЗ Исполнителя;\n• не позднее 5 (пяти) календарных дней до даты смены Исполнителя.', '16.5. Договора.\nЗаказчик вправе обусловить выдачу согласия на замену Исполнителя выплатой Исполнителем денежной суммы,\nкоторая устанавливается на усмотрение Заказчика и доступна для ознакомления Исполнителю до совершения\nдействий по смене на другое лицо.\n16.2. После получения согласования от Заказчика о смене Исполнителя в Договоре:\n• действующий Исполнитель полностью погашает свою задолженность перед Заказчиком до того, как он сам\nбудет заменен новым Исполнителем в Договоре, или\n• новый Исполнитель, принимая на себя все права и обязанности по Договору, также принимает на себя\nполностью задолженность текущего Исполнителя по Договору (перевод долга).\n16.3. При смене Исполнителя по Договору расчеты между Исполнителем и новым Исполнителем\nосуществляются на основании отдельных договоренностей, достигнутых между сторонами, и Заказчик не является\nучастником таких взаиморасчетов.\n16.4. В случае необходимости сменить Исполнителя по Договору, Исполнитель направляет Заказчику\nсоответствующую заявку через Личный кабинет. В заявке на смену Исполнителя указываются контактные данные\nнового Исполнителя.\n16.5.', '16.3. При смене Исполнителя по Договору расчеты между Исполнителем и новым Исполнителем\nосуществляются на основании отдельных договоренностей, достигнутых между сторонами, и Заказчик не является\nучастником таких взаиморасчетов.\n16.4. В случае необходимости сменить Исполнителя по Договору, Исполнитель направляет Заказчику\nсоответствующую заявку через Личный кабинет. В заявке на смену Исполнителя указываются контактные данные\nнового Исполнителя.\n16.5.']",Ответ: Срок на рассмотрение заявки Исполнителя о смене Исполнителя составляет 30 календарных дней.,1.0,0.969699161470476,0.8928571428348213
Какие условия необходимо выполнить Исполнителю для смены на другое лицо в течение первых 6 месяцев после Активации ПВЗ?,"['16. Замена Исполнителя по Договору\n16.1. Смена Исполнителя на другое лицо возможна:\n— до истечения 6 (шести) месяцев с даты Активации ПВЗ только при условии перечисления Исполнителем\n(действующим или новым) Заказчику платы за замену на стороне Исполнителя в размере, действующем на момент\nподачи заявки о смене и указанном на Портале.', '16. Замена Исполнителя по Договору\n16.1. Смена Исполнителя на другое лицо возможна:\n— до истечения 6 (шести) месяцев с даты Активации ПВЗ только при условии перечисления Исполнителем\n(действующим или новым) Заказчику платы за замену на стороне Исполнителя в размере,', 'Изменения вступают в силу с 00 часов 00 минут:\n▪ дня, который указан в новости, но который может наступить не ранее чем по истечении 14 (четырнадцати)\nполных суток с даты опубликования новости о внесении Изменений — если Изменения касаются изменения порядка\nрасчета стоимости Услуг по Договору, тарифов или если Изменения требуют адаптации деятельности ПВЗ под новые\nусловия;\n▪ дня, который указан в новости, но который наступит не ранее чем по истечении 7 (семи) полных суток с даты\nопубликования новости о внесении Изменений, — все иные Изменения.\n16. Замена Исполнителя по Договору\n16.1. Смена Исполнителя на другое лицо возможна:\n— до истечения 6 (шести) месяцев с даты Активации ПВЗ только при условии перечисления Исполнителем\n(действующим или новым) Заказчику платы за замену на стороне Исполнителя в размере, действующем на момент\nподачи заявки о смене и указанном на Портале.\n— после истечения 6 (шести) месяцев с даты Активации ПВЗ – Заказчик оставляет за собой право не взимать плату\nза смену на стороне Исполнителя (действующего или нового), о чем уведомит Исполнителя после рассмотрения\nзаявки согласно п. 16.5. Договора.', '3.13. В случае если продолжительность работы ПВЗ с момента Активации составила не менее 6 (шести) месяцев,\nИсполнитель после согласования Заказчиком заявки, поданной через Личный кабинет, вправе изменить место\nнахождения ПВЗ путем его открытия в новом помещении, по иному адресу,', '7.1., 7.1.1., 7.1.2. и 7.2 Договора, если в течение 12 (двенадцати) календарных месяцев или, если в течение 18\n(восемнадцати) календарных месяцев, при получении от одной до девяти Дополнительных выплат согласно п. 7.2.\nДоговора, после Активации ПВЗ произойдет любое из нижеследующих событий:\n• Деактивация ПВЗ Исполнителя в результате прекращения оказания Услуг в ПВЗ Исполнителем по\nоснованиям, предусмотренным Договором;\n• Смена Исполнителя. Под сменой Исполнителя понимается замена Стороны Исполнителя по Договору, при\nкоторой изначальный Исполнитель передаёт все права и обязанности по Договору новому Исполнителю.\nИсполнитель обязан возвратить Заказчику суммы Дополнительных поддерживающих выплат:\n• в течение 5 (пяти) календарных дней до даты Деактивации ПВЗ Исполнителя;\n• не позднее 5 (пяти) календарных дней до даты смены Исполнителя.', '— после истечения 6 (шести) месяцев с даты Активации ПВЗ – Заказчик оставляет за собой право не взимать плату\nза смену на стороне Исполнителя (действующего или нового), о чем уведомит Исполнителя после рассмотрения\nзаявки согласно п. 16.5. Договора.', '3.13. В случае если продолжительность работы ПВЗ с момента Активации составила не менее 6 (шести) месяцев,\nИсполнитель после согласования Заказчиком заявки, поданной через Личный кабинет, вправе изменить место\nнахождения ПВЗ путем его открытия в новом помещении, по иному адресу, в радиусе до 500 (пятисот) метров от\nпрежнего места нахождения ПВЗ.\n3.14. Исполнитель обязуется обеспечить в ПВЗ порядок, чистоту, надлежащее освещение и вентиляцию\n(воздухообмен).', '3.13. В случае если продолжительность работы ПВЗ с момента Активации составила не менее 6 (шести) месяцев,\nИсполнитель после согласования Заказчиком заявки, поданной через Личный кабинет, вправе изменить место\nнахождения ПВЗ путем его открытия в новом помещении, по иному адресу, в радиусе до 500 (пятисот) метров от\nпрежнего места нахождения ПВЗ.\n3.14. Исполнитель обязуется обеспечить в ПВЗ порядок, чистоту, надлежащее освещение и вентиляцию\n(воздухообмен).\nВ случае если по результатам проверки, проведенной по инициативе Заказчика, либо проверки, проведенной на\nосновании поступивших жалоб Клиентов, Заказчиком будет выявлено в ПВЗ наличие загрязнения, недостаточного\nосвещения и/или вентиляции (воздухообмена), то Исполнитель обязуется их незамедлительно устранить.\n3.15.', 'Под сменой Исполнителя понимается замена Стороны Исполнителя по Договору, при\nкоторой изначальный Исполнитель передаёт все права и обязанности по Договору новому Исполнителю.\nИсполнитель обязан возвратить Заказчику суммы Дополнительных поддерживающих выплат:\n• в течение 5 (пяти) календарных дней до даты Деактивации ПВЗ Исполнителя;\n• не позднее 5 (пяти) календарных дней до даты смены Исполнителя.', '7.1., 7.1.1., 7.1.2. и 7.2 Договора, если в течение 12 (двенадцати) календарных месяцев или, если в течение 18\n(восемнадцати) календарных месяцев, при получении от одной до девяти Дополнительных выплат согласно п. 7.2.\nДоговора, после Активации ПВЗ произойдет любое из нижеследующих событий:\n• Деактивация ПВЗ Исполнителя в результате прекращения оказания Услуг в ПВЗ Исполнителем по\nоснованиям, предусмотренным Договором;\n• Смена Исполнителя.']","Для смены Исполнителя на другое лицо в течение первых 6 месяцев после Активации ПВЗ необходимо выполнить следующие условия:

— Смена Исполнителя возможна только при условии перечисления Заказчику платы за замену на стороне Исполнителя в размере, действующем на момент подачи заявки о смене и указанном на Портале.",1.0,0.9905759725971415,
Сколько всего приложений с дополнительными услугами указано в данном фрагменте оферты и как они нумеруются?,"['• Приложение № 4 — Ответственность;\n\n• Приложение № 5 — Услуга WB Track;\n• Приложение № 6 — Услуга WB Проверка сотрудников;\n• Приложение № 7 — Услуга WB Рекламные экран.', 'Раздел 4. Тарифы\nСтороны пришли к соглашению дополнить Приложение №1 к Оферте об оказании услуг в ПВЗ Тарифы следующим\nпунктом:\n2.6.', 'ПРИЛОЖЕНИЯ к Договору, являющиеся его неотъемлемой частью:\n• Приложение № 1 — Тарифы;\n• Приложение № 2 — Правила оказания услуг в ПВЗ;\n• Приложение № 3 — Регламент состояния ПВЗ;\n• Приложение № 4 — Ответственность;\n\n• Приложение № 5 — Услуга WB Track;\n• Приложение № 6 — Услуга WB Проверка сотрудников;\n• Приложение № 7 — Услуга WB Рекламные экран.', 'Приложение № 5\nк Оферте об оказании услуг в ПВЗ\nУслуга WB Track\n\nПриложение № 5 содержит порядок и условия оказания Услуги WB Track, дополняет Оферту об оказании услуг в ПВЗ\nв части, необходимой для Услуги WB Track, и является обязательным для Исполнителей, оказывающих такую Услугу.\nРаздел 1. Термины и определения Оферты\n1.50. Объявленная ценность – сумма, от 1 000 (одной тысячи) до 50 000 (пятидесяти тысяч) российских\nрублей, которую сообщает Отправитель Исполнителю при оформлении Отправления, определяемая им\nсамостоятельно.\n1.51.', 'ПРИЛОЖЕНИЯ к Договору, являющиеся его неотъемлемой частью:\n• Приложение № 1 — Тарифы;\n• Приложение № 2 — Правила оказания услуг в ПВЗ;\n• Приложение № 3 — Регламент состояния ПВЗ;\n• Приложение № 4 — Ответственность;', 'Раздел 1. Термины и определения Оферты:\nРаздел Термины и определения Оферты об оказании услуг в ПВЗ дополняется следующими терминами и\nопределениями:\n1.', '7.1., 7.1.1. и 7.1.2. Договора отражается на\nБалансе Исполнителя в качестве авансового платежа и является дополнительным вознаграждением Исполнителя по\n\nДоговору за 12 (двенадцатый) Отчетный и последующие периоды оказания Услуг.', '24. 3.1. Если это указано в соответствующих Поручениях, тоИсполнитель обязуется оказывать услуги поподготовке Товаров к возврату, которая можетвключать в себя, как упаковку Товара в сейф-пакет сиспользованием стикера, так и перестикеровку(наклейку стикера на уже имеющийся пакет,коробку, упаковку и т.п.', '24. 3.1. Если это указано в соответствующих Поручениях, тоИсполнитель обязуется оказывать услуги поподготовке Товаров к возврату, которая можетвключать в себя, как упаковку Товара в сейф-пакет сиспользованием стикера, так и перестикеровку(наклейку стикера на уже имеющийся пакет,', '№строки №разделаили пп.Договора\nПриложение №2 (Правила оказания услуг) ОТВЕТСТВЕННОСТЬ / РАЗМЕРШТРАФОВ\n33. За иные нарушения Правил оказания услуг, непоименованные в Приложении № 2.']","Ответ: В данном фрагменте оферты указано 3 приложения с дополнительными услугами, которые нумеруются следующим образом:

1. Приложение № 5 — Услуга WB Track  
2. Приложение № 6 — Услуга WB Проверка сотрудников  
3. Приложение № 7 — Услуга WB Рекламные экран",0.8,0.9630258310834744,
Какой срок установлен для подготовки Возвратных коробок с Товарами для возврата на Склад?,"['2.4. Исполнитель обязуется подготовить для передачи и направить на Склад Клиентские возвраты, не\nвостребованные Клиентом Товары, Товары, Поручения на которые были отменены посредством Портала, либо\nТовары, доставленные на ПВЗ Исполнителя ошибочно, не по адресу (статусы на Портале: Излишки/Ошибочные\nдоставки/Ошибочный ПВЗ), путем физического вложения указанного Товара Исполнителем в Возвратную коробку в\nтечение 24 (двадцати четырех) часов с момента:\n• отказа от Товара Клиентом, или\n• истечения срока, когда Товар мог быть получен в ПВЗ Исполнителя, или\n• отмены Поручения.\n2.4.1. Подготовленные Возвратные коробки с Товарами, предназначенными для возврата на Склад, должны быть\nразмещены в Клиентской зоне ПВЗ, в случае если возвратные коробки отправляются на Склад из регионов места\nрасположения, указанных в Дополнении № 1 к Приложению № 2, то Исполнитель обязуется упаковать их в стретч-\nпленку. Если Возвратные коробки будут находиться в Складской зоне ПВЗ, Товары будут считаться не\nподготовленными для возврата на Склад.', '2.4, 2.4.1,2.4.2. Исполнитель обязуется подготовить для передачи инаправить на Склад Клиентские возвраты, невостребованные Клиентом Товары, Товары,Поручения на которые были отменены посредствомПортала, либо Товары, доставленные на ПВЗИсполнителя ошибочно, не по адресу (статусы наПортале: Излишки/Ошибочные доставки/Ошибочный ПВЗ), путем физического вложенияуказанного Товара Исполнителем в Возвратнуюкоробку в течение 24 (двадцати четырех) часов смомента:• отказа от Товара Клиентом или• истечения срока, когда Товар мог быть получен наПВЗ Исполнителя, или• отмены Поручения.2.4.1. Подготовленные Возвратные коробки сТоварами, предназначенными для возврата наСклад, должны быть размещены в Клиентской зонеПВЗ в случае, если возвратные коробкиотправляются на Склад из регионов местарасположения, указанных в Дополнении № 1 кПриложению № 2, то Исполнитель обязуетсяупаковать их в стретч-пленку.', '40 3.6 Исполнитель обязуется подготовить для передачи инаправить на Склад Возвратные коробки сОтправлениями WB Track в течение 24 (двадцатичетырех) часов с момента приемки Отправления WBTrack.', '39 3.4 Исполнитель обязуется подготовить для передачи инаправить на Склад Возвратные коробки сОтправлениями WB Track в течение 24 (двадцатичетырех) часов с момента приемки Отправления WBTrack.', '2.4. Исполнитель обязуется подготовить для передачи и направить на Склад Клиентские возвраты, не\nвостребованные Клиентом Товары, Товары, Поручения на которые были отменены посредством Портала, либо\nТовары, доставленные на ПВЗ Исполнителя ошибочно, не по адресу (статусы на Портале: Излишки/Ошибочные\nдоставки/Ошибочный ПВЗ), путем физического вложения указанного Товара Исполнителем в Возвратную коробку в\nтечение 24 (двадцати четырех) часов с момента:\n• отказа от Товара Клиентом, или\n• истечения срока, когда Товар мог быть получен в ПВЗ Исполнителя,', '3.4. Исполнитель обязуется подготовить Отправление WB Track для передачи на Склад, поместив его в\nВозвратную коробку в течение 24 (двадцати четырех) часов с момента приёмки Отправления от Отправителя,\nзапечатать Возвратную коробку и оставить в доступном для Перевозчика месте.\n3.6.', '3.4. Исполнитель обязуется подготовить Отправление WB Track для передачи на Склад, поместив его в\nВозвратную коробку в течение 24 (двадцати четырех) часов с момента приёмки Отправления от Отправителя,\nзапечатать Возвратную коробку и оставить в доступном для Перевозчика месте.\n3.5.', '2.4, 2.4.1,2.4.2. Исполнитель обязуется подготовить для передачи инаправить на Склад Клиентские возвраты, невостребованные Клиентом Товары, Товары,Поручения на которые были отменены посредствомПортала, либо Товары, доставленные на ПВЗИсполнителя ошибочно, не по адресу (статусы наПортале: Излишки/Ошибочные доставки/Ошибочный ПВЗ), путем физического вложенияуказанного Товара Исполнителем в Возвратнуюкоробку в течение 24 (двадцати четырех) часов смомента:• отказа от Товара Клиентом или• истечения срока,', 'когда Товар мог быть получен в ПВЗ Исполнителя, или\n• отмены Поручения.\n2.4.1. Подготовленные Возвратные коробки с Товарами, предназначенными для возврата на Склад, должны быть\nразмещены в Клиентской зоне ПВЗ, в случае если возвратные коробки отправляются на Склад из регионов места\nрасположения, указанных в Дополнении № 1 к Приложению № 2, то Исполнитель обязуется упаковать их в стретч-\nпленку. Если Возвратные коробки будут находиться в Складской зоне ПВЗ, Товары будут считаться не\nподготовленными для возврата на Склад.', 'когда Товар мог быть получен в ПВЗ Исполнителя, или\n• отмены Поручения.\n2.4.1. Подготовленные Возвратные коробки с Товарами, предназначенными для возврата на Склад, должны быть\nразмещены в Клиентской зоне ПВЗ,']","Срок, установленный для подготовки Возвратных коробок с Товарами для возврата на Склад, составляет **24 (двадцати четырех) часов** с момента:

- отказа от Товара Клиентом,  
- истечения срока, когда Товар мог быть получен в ПВЗ Исполнителя,  
- или отмены Поручения.",1.0,0.9696249801614141,
"Какие действия должен предпринять Исполнитель, если не сможет подтвердить обработку товаров в ПВЗ?","['2.6.2. При невозможности подтвердить выполнение входящей и/или исходящей обработки Товаров\nИсполнителем на ПВЗ, Исполнитель возвращает Заказчику необоснованно уплаченную премию, Вознаграждение в\nполном объеме.\n2.6.3. Исполнитель обязан обеспечить возможность доставки и вывоза Товара в/из ПВЗ сотрудникам Заказчика,\nПеревозчику, привлеченному Заказчиком, в любое время суток.\n3. Требования к подготовке Товаров к возврату\n3.1.', '2.6.2. При невозможности подтвердить выполнение входящей и/или исходящей обработки Товаров\nИсполнителем на ПВЗ, Исполнитель возвращает Заказчику необоснованно уплаченную премию, Вознаграждение в\nполном объеме.\n2.6.3.', '2.6.1. В случае непредоставления Исполнителем по требованию Заказчика записи с камер видеонаблюдения в\nтечение 2 (двух) часов с момента поступления соответствующего запроса Заказчика, подтверждающей факт\nвходящей и/или исходящей обработки Исполнителем Товаров Продавцов в соответствии с условиями настоящего\nпункта, факт обработки Исполнителем Товаров Продавцов считается не подтвержденным.\n2.6.2. При невозможности подтвердить выполнение входящей и/или исходящей обработки Товаров\nИсполнителем на ПВЗ, Исполнитель возвращает Заказчику необоснованно уплаченную премию, Вознаграждение в\nполном объеме.\n2.6.3. Исполнитель обязан обеспечить возможность доставки и вывоза Товара в/из ПВЗ сотрудникам Заказчика,\nПеревозчику, привлеченному Заказчиком, в любое время суток.\n3. Требования к подготовке Товаров к возврату\n3.1.', '2.2, 2.2.1.2.2. Исполнитель обязан осуществить приемкуТоваров, полученных им в ПВЗ, путем считыванияштрих-кодов и маркировок КИЗ (контрольно-идентификационные знаки) Товаров и направлениесведений о таком считывании Заказчикупосредством Портала.2.2.1. В случае невозможности считываниямаркировки КИЗ Товара по причине ее отсутствия,повреждения, либо наличия иныхидентификационных знаков/этикеток, нанесенныхповерх маркировки КИЗ, Исполнитель обязуетсясообщить Заказчику посредством Портала оневозможности считывания такой маркировки КИЗТовара с предоставлением фотоматериалов,подтверждающих невозможность считывания.\nЗа первое нарушение –предупреждение;за каждое следующее выявленноенарушение – 10 000 (десять тысяч)российских рублей.\n23. 2.4, 2.4.1,2.4.2.', 'При получении\nпретензий Заказчик вправе переадресовать их в адрес Исполнителя и/или сообщить данные об Исполнителе\nгосударственным органам.\nОперации с Товаром\n5.17. При приёмке Товара в ПВЗ Исполнитель обязуется отражать в Личном кабинете достоверные сведения о\nналичии или отсутствии недостатка в принятом Товаре (делать соответствующую отметку в ЛК на Портале только\nпри действительном наличии недостатка Товара).\n5.18. В ходе обработки или сортировки поступившего на ПВЗ Товара, или подготовки Товара к возврату, в случае\nобнаружения в Товаре недостатка Исполнитель обязуется действовать в соответствии с настоящим Договором и\nИнструкциями и предоставить достоверную информацию о недостатке Товара Заказчику, проставив\nсоответствующую отметку с выбором типа выявленного недостатка, посредством Личного кабинета с приложением\nподтверждающих фото- и/или видео доказательств. Предоставленные фото- и/или видео доказательства не должны\nсодержать персональные данные третьих лиц.\n5.19. Исполнитель обязуется обеспечить сохранность Товаров, находящихся в ПВЗ.', 'Исполнитель вправе без согласования с Заказчиком осуществлять в ПВЗ следующие действия:\n• размещать вендинговые автоматы для продажи товаров;\n• размещать терминалы, предназначенные для оплаты услуг, реализация которых не связана с деятельностью\nИсполнителя, осуществляемой в ПВЗ по Договору;\n• размещать постаматы, но только при условии, если площадь ПВЗ составляет более 70 (семидесяти) кв.', 'Исполнитель вправе без согласования с Заказчиком осуществлять в ПВЗ следующие действия:\n• размещать вендинговые автоматы для продажи товаров;\n• размещать терминалы, предназначенные для оплаты услуг, реализация которых не связана с деятельностью\nИсполнителя, осуществляемой в ПВЗ по Договору;', 'При этом Исполнители обязаны:\nПри этом Исполнители обязаны:\n• оформлять документы, связанные с приёмкой/отправкой Товаров;\n• проставлять подписи с расшифровкой и печать (при её наличии) грузополучателя/грузоотправителя;\n• делать отметки о расхождениях (как излишек, так и недостаток), при их фактическом выявлении;\nИсполнитель не вправе принимать от Продавцов в ПВЗ Маркетплейс-короба или Маркетплейс Товары,\nнесоответствующие требуемым габаритам.', 'Исполнитель обязан осуществить приемку Товаров, полученных им в ПВЗ от Заказчика/Перевозчика/\nПродавца и отразить на Портале информацию о приемке Товаров в ПВЗ, в течение периода времени,\nустановленного на Портале для территории, на которой расположен ПВЗ Исполнителя. Исполнитель обязуется\nобеспечить наличие на ПВЗ сканеров для считывания штрих-кодов и QR-кодов Товаров.\nЗа приемку Товаров Исполнителем со Склада от Перевозчика в соответствии с настоящим пунктом, предусмотрена\nмотивация согласно формуле, указанной в Тарифах (Приложение № 1 к Договору).\n2.2. Исполнитель обязан осуществить приемку Товаров, полученных им в ПВЗ, путем считывания штрихкодов и\nмаркировок КИЗ (контрольно-идентификационные знаки) Товаров и направить сведения о таком считывании\nЗаказчику посредством Портала.\n\n2.2.1.', '5.12. Исполнитель обязуется не осуществлять в ПВЗ те виды деятельности, которые не указаны в Договоре и/\nили не согласованы с Заказчиком в порядке, установленном на Портале. При осуществлении в ПВЗ иной,\nсогласованной с Заказчиком деятельности, не допускается использование рекламных, маркетинговых материалов,\nфирменных вывесок, логотипов, отличных от тех, правообладателем которых является Заказчик.\n5.13. Исполнитель обязуется производить возврат поступающих в ПВЗ от Заказчика материалов повторного\nпроизводства (картон и иное), принадлежащих Заказчику.\n\n5.14. Исполнитель обязуется в случае получения уведомления от Заказчика в ЛК об Аудите ПВЗ предоставить\nЗаказчику качественные фото и видео материалы внешнего вида ПВЗ (в соответствии с требованиями и указаниями\nЗаказчика, представленными в инструкции в данном разделе ЛК) путем их размещения и загрузки на Портале в\nразделе Аудит ПВЗ или иным определенным Заказчиком способом.\nЗаказчик вправе после проверки всех необходимых материалов и информации, запросить Исполнителя исправить\nзамечания, выявленные в процессе Аудита ПВЗ посредством направления уведомления в ЛК.']","Ответ: Если Исполнитель не сможет подтвердить выполнение входящей и/или исходящей обработки Товаров на ПВЗ, он обязан вернуть Заказчику необоснованно уплаченную премию и Вознаграждение в полном объеме.",1.0,0.9304680519703853,
Какие виды материалов может запросить Заказчик у Исполнителя в соответствии с пунктом 6.4.1?,"['6.4.1. Заказчик вправе запрашивать у Исполнителя видеозаписи с камер видеонаблюдения и фотографии в\nотношении Товаров, указанных в Поручении, подтверждающие любые факты обработки таких Товаров в конкретном\nПВЗ.\nИсполнитель обязан предоставить запрошенные видеозаписи и/или фотографии в течение 48 (сорока восьми) часов\nс момента направления Заказчиком запроса.\n6.5. Исполнитель обязан предоставить Заказчику в порядке, предусмотренном пунктами 6.3, 6.4 настоящих\nПравил оказания услуг, фото- и видеоматериалы, соответствующие действительности, в том числе, но не\nограничиваясь, относительно места, даты или времени съемки.\n6.6. Исполнитель обязуется не допускать накопления, нагромождения в ПВЗ посторонних предметов и мусора.\nИсполнитель вправе размещать на территории Клиентской зоны ПВЗ Возвратные коробки с Товаром и вторсырье\n(отходы производства и потребления: бумага и картон, упаковочный материал и т.п.) в собранном, сложенном виде,\nпредназначенные для возврата Заказчику.', '6.4. Исполнитель обязуется потребованию Заказчика предоставитьвидеоматериалы с камервидеонаблюдения, установленных наПВЗ, в течение 6 (шести) часов смомента направления требованияИсполнителю за запрашиваемыйЗаказчиком период времени.6.4.1. Заказчик вправе запрашивать уИсполнителя видеозаписи с камервидеонаблюдения и фотографии вотношении Товаров, указанных вПоручении, подтверждающие любыефакты обработки таких Товаров вконкретном ПВЗ. Исполнитель обязанпредоставить запрошенныевидеозаписи и/или фотографии втечение 48 (сорока восьми) часов смомента направления Заказчикомзапроса.\n32. 6.6. Исполнитель обязуется не допускать накопления,нагромождения в ПВЗ посторонних предметов имусора. Исполнитель вправе размещать натерритории Клиентской зоны ПВЗ Возвратныекоробки с Товаром и вторсырье (отходыпроизводства и потребления: бумага и картон и т.п.)в собранном, сложенном виде, предназначенноедля возврата Заказчику.Заказчик вправе проводить проверки выполнениятребований данного пункта по своей инициативеили на основании жалоб Клиентов.', '6.4.1. Заказчик вправе запрашивать у Исполнителя видеозаписи с камер видеонаблюдения и фотографии в\nотношении Товаров, указанных в Поручении, подтверждающие любые факты обработки таких Товаров в конкретном\nПВЗ.\nИсполнитель обязан предоставить запрошенные видеозаписи и/или фотографии в течение 48 (сорока восьми) часов\nс момента направления Заказчиком запроса.\n6.5.', '6.5. Исполнитель обязан предоставить Заказчику в порядке, предусмотренном пунктами 6.3, 6.4 настоящих\nПравил оказания услуг, фото- и видеоматериалы, соответствующие действительности, в том числе, но не\nограничиваясь, относительно места, даты или времени съемки.', '6.5. Исполнитель обязан предоставить Заказчику в порядке, предусмотренном пунктами 6.3, 6.4 настоящих\nПравил оказания услуг, фото- и видеоматериалы, соответствующие действительности, в том числе, но не\nограничиваясь, относительно места, даты или времени съемки.\n6.6. Исполнитель обязуется не допускать накопления, нагромождения в ПВЗ посторонних предметов и мусора.', '5.12. Исполнитель обязуется не осуществлять в ПВЗ те виды деятельности, которые не указаны в Договоре и/\nили не согласованы с Заказчиком в порядке, установленном на Портале. При осуществлении в ПВЗ иной,\nсогласованной с Заказчиком деятельности, не допускается использование рекламных, маркетинговых материалов,\nфирменных вывесок, логотипов, отличных от тех, правообладателем которых является Заказчик.\n5.13. Исполнитель обязуется производить возврат поступающих в ПВЗ от Заказчика материалов повторного\nпроизводства (картон и иное), принадлежащих Заказчику.\n\n5.14. Исполнитель обязуется в случае получения уведомления от Заказчика в ЛК об Аудите ПВЗ предоставить\nЗаказчику качественные фото и видео материалы внешнего вида ПВЗ (в соответствии с требованиями и указаниями\nЗаказчика, представленными в инструкции в данном разделе ЛК) путем их размещения и загрузки на Портале в\nразделе Аудит ПВЗ или иным определенным Заказчиком способом.\nЗаказчик вправе после проверки всех необходимых материалов и информации, запросить Исполнителя исправить\nзамечания, выявленные в процессе Аудита ПВЗ посредством направления уведомления в ЛК.', 'Заказчик вправе после проверки всех необходимых материалов и информации, запросить Исполнителя исправить\nзамечания, выявленные в процессе Аудита ПВЗ посредством направления уведомления в ЛК.', '6.6. Заказчик обязуется предоставить Исполнителю инструкции по работе с Порталом и информационные\nматериалы о процессе оказания Услуг, а также своевременно вносить в них изменения и уведомлять о них\nИсполнителя.\n6.7.', '6.3. Заказчик вправе проводить оценку качества исполнения Договора Сторонами, включая оказание Услуг\nКлиенту, как во взаимодействии, так и без взаимодействия с Исполнителем, в том числе с привлечением третьих\nлиц, без дополнительного согласия Исполнителя.\n6.4. Заказчик обязуется оплачивать оказанные Исполнителем Услуги в порядке и сроки, установленные\nДоговором.\n6.5.', '6.4. Заказчик обязуется оплачивать оказанные Исполнителем Услуги в порядке и сроки, установленные\nДоговором.\n6.5.']","Заказчик вправе запросить у Исполнителя видеозаписи с камер видеонаблюдения и фотографии в отношении Товаров, указанных в Поручении, подтверждающие любые факты обработки таких Товаров в конкретном ПВЗ.",1.0,0.7224532723438324,
Какой минимальный срок для получения выписки из ЕГРН установлен в оферте?,"['При этом выписка из ЕГРН должна быть\nполучена Исполнителем в срок, не превышающий 1 (один) месяц до даты Активации ПВЗ. Заказчик оставляет за\nсобой право запросить дополнительные документы.', 'ПВЗ – помещение или часть помещения, здания, дома, находящееся у Исполнителя в собственности или во\nвладении и пользовании или на ином законном основании, в котором Исполнитель непосредственно оказывает\nУслуги.\n3.2. При Активации ПВЗ Исполнитель обязан предоставить правоустанавливающие документы на помещение\nЗаказчику, выписку из ЕГРН или технический план БТИ или иные документы. При этом выписка из ЕГРН должна быть\nполучена Исполнителем в срок, не превышающий 1 (один) месяц до даты Активации ПВЗ. Заказчик оставляет за\nсобой право запросить дополнительные документы.', '2. Правила Активации ПВЗ\nПредоставьте видеообзор ПВЗ для подтверждения брендирования, в котором необходимо\nпродемонстрировать:\n• адресную табличку дома;\n• панорамный вид окрестности;\n• фасад с вывеской и режимом работы;\n• клиентскую зону (зону выдачи/приемки Товаров, примерки Товаров Клиентами) полностью;\n• складскую зону (зону местонахождения Товаров) полностью.\n3. Требования, предъявляемые к ПВЗ Исполнителя\n3.1. ПВЗ – помещение или часть помещения, здания, дома, находящееся у Исполнителя в собственности или во\nвладении и пользовании или на ином законном основании, в котором Исполнитель непосредственно оказывает\nУслуги.\n3.2. При Активации ПВЗ Исполнитель обязан предоставить правоустанавливающие документы на помещение\nЗаказчику, выписку из ЕГРН или технический план БТИ или иные документы. При этом выписка из ЕГРН должна быть\nполучена Исполнителем в срок, не превышающий 1 (один) месяц до даты Активации ПВЗ. Заказчик оставляет за\nсобой право запросить дополнительные документы.\n3.3.', 'в срок, не\nпревышающий 14 (четырнадцать) календарных дней с даты получения такого запроса.', '3.2. При Активации ПВЗ Исполнитель обязан предоставить правоустанавливающие документы на помещение\nЗаказчику, выписку из ЕГРН или технический план БТИ или иные документы.', 'Указанный срок может быть продлен на срок не более 7 (семи) календарных дней в случае необходимости\nполучения дополнительной информации для принятия решения без учета времени, требуемого Исполнителю для\nпредоставления соответствующей информации.', 'Исполнители, зарегистрированные на территории РК, обязуются предоставлять Акт сверки взаиморасчетов, но не\nреже одного раза в 6 (шесть) месяцев в целях обеспечения корректности учета, а при получении запроса в течение 5\n(пяти) рабочих дней с даты получения соответствующего запроса.', '8.5.2. Для Исполнителей, зарегистрированных на территории Республики Армения, как являющихся\nплательщиками НДС, так и не являющихся плательщиками НДС, Исполнитель в течение 5 (пяти) рабочих дней с\nдаты получения отчета об оказанных Услугах,', '12.2012 года № 562, Министра\n\nфинансов РК от 31.03.2015 года № 241.\nИсполнители, зарегистрированные на территории РК, обязуются предоставлять Акт сверки взаиморасчетов, но не\nреже одного раза в 6 (шесть) месяцев в целях обеспечения корректности учета, а при получении запроса в течение 5\n(пяти) рабочих дней с даты получения соответствующего запроса.\n8.5.2.', 'В случае, если за Отчетный период Исполнителем оказаны Услуги на сумму менее 500 (пятисот) российских рублей\nили эквивалента указанной суммы в национальной валюте страны государственной регистрации сторон по курсу ЦБ\nРФ на дату расчета,']","Минимальный срок для получения выписки из ЕГРН, установленный в оферте, составляет **1 (один) месяц до даты Активации ПВЗ**.",0.0,0.9999999999999998,
Какую сумму в российских рублях Исполнитель получает за установку Фирменной вывески с высотой букв 300 мм?,"['если такие элементы были переданы Исполнителю в соответствии с пп. (i) п.\n3.10. настоящего Регламента;\n• стоимости Фирменной вывески согласно данным ниже, в национальной валюте страны государственной\nрегистрации Сторон, эквивалентной сумме в российских рублях по курсу ЦБ РФ на дату оплаты в соответствии с\nпп. (ii) п. 3.10. настоящего Регламента.\nСтоимость Фирменной вывески:\n101 000 (сто одна тысяча) российских рублей, вывеска с высотой букв 500 мм;\n80 000 (восемьдесят тысяч) российских рублей, вывеска с высотой букв 400 мм;\n60 000 (шестьдесят тысяч) российских рублей, вывеска с высотой букв 300 мм;\n30 000 (тридцать тысяч) российских рублей, мини-вывеска;\n20 000 (двадцать тысяч) российских рублей, световой кронштейн;\n30 000 (тридцать тысяч) российских рублей, вывеска-кнопка высотой 500 мм;\n25 000 (двадцать пять тысяч) российских рублей, вывеска-кнопка высотой 400 мм;\n20 000 (двадцать тысяч) российских рублей, вывеска-кнопка высотой 300 мм.\n3.10.', 'вывеска с высотой букв 400 мм;\n60 000 (шестьдесят тысяч) российских рублей, вывеска с высотой букв 300 мм;\n30 000 (тридцать тысяч) российских рублей, мини-вывеска;\n20 000 (двадцать тысяч) российских рублей,', 'вывеска с высотой букв 400 мм;\n60 000 (шестьдесят тысяч) российских рублей, вывеска с высотой букв 300 мм;\n30 000 (тридцать тысяч) российских рублей, мини-вывеска;\n20 000 (двадцать тысяч) российских рублей, световой кронштейн;\n30 000 (тридцать тысяч) российских рублей, вывеска-кнопка высотой 500 мм;\n25 000 (двадцать пять тысяч) российских рублей, вывеска-кнопка высотой 400 мм;\n20 000 (двадцать тысяч) российских рублей,', 'если такие элементы были переданы Исполнителю в соответствии с пп. (i) п.\n3.10. настоящего Регламента;\n• стоимости Фирменной вывески согласно данным ниже, в национальной валюте страны государственной\nрегистрации Сторон, эквивалентной сумме в российских рублях по курсу ЦБ РФ на дату оплаты в соответствии с\nпп. (ii) п. 3.10. настоящего Регламента.\nСтоимость Фирменной вывески:\n101 000 (сто одна тысяча) российских рублей, вывеска с высотой букв 500 мм;\n80 000 (восемьдесят тысяч) российских рублей,', '(ii) п. 3.10. настоящего Регламента.\nСтоимость Фирменной вывески:\n101 000 (сто одна тысяча) российских рублей, вывеска с высотой букв 500 мм;\n80 000 (восемьдесят тысяч) российских рублей,', 'Заказчик вправе:\n(i) для ПВЗ, расположенных в любой зоне на территории Российской Федерации, Республики Беларусь, Республики\nКазахстан, Республики Армении, предоставить Исполнителю элементы брендинга (Фирменную вывеску в количестве\n1 (одной) единицы, панель-кронштейн в количестве 1 (одной) единицы);\n\n(ii) для ПВЗ, расположенных в любой зоне других стран, компенсировать расходы Исполнителя на приобретение\nФирменной вывески градиентного цвета с высотой букв 300 мм в количестве 1 (одной) единицы после успешно\nпройденного Аудита, путем перечисления на Баланс Исполнителя фиксированной выплаты в следующем размере\nдля следующих стран:\nРеспублика Узбекистан – 6 920 000 узбекских сумов (UZS);\nРеспублика Кыргызстан – 43 000 киргизских сомов (KGS);\nВ случае если в течение 12 (двенадцати) календарных месяцев с даты Активации ПВЗ Договор будет расторгнут,\nИсполнитель обязуется в течение 30 (тридцати) календарных дней с даты расторжения Договора возместить\nЗаказчику имущественные расходы в размере:\n• стоимости элементов брендинга,', 'расположенных в любой зоне других стран, компенсировать расходы Исполнителя на приобретение\nФирменной вывески градиентного цвета с высотой букв 300 мм в количестве 1 (одной) единицы после успешно\nпройденного Аудита, путем перечисления на Баланс Исполнителя фиксированной выплаты в следующем размере\nдля следующих стран:\nРеспублика Узбекистан – 6 920 000 узбекских сумов (UZS);\nРеспублика Кыргызстан – 43 000 киргизских сомов (KGS);', '3.7. Исполнитель с момента начала оказания Услугобязуется разместить на фасаде ПВЗ вывеску ипанель-кронштейн, а Исполнитель, местомрегистрации которого является РеспубликаКазахстан также обязуется разместить дескрипторна вывеске, в дизайне вывески и панель-кронштейна должны использоваться толькотоварный знак WILDBERRIES и/или WB (далее –Фирменная вывеска), принадлежащий Заказчику.Исполнитель обязуется обеспечить исправноесостояние Фирменной вывески и подключение ксети электропитания, при этом все буквы наФирменной вывеске должны подсвечиваться.\nЗа первое нарушение – предупреждение;за второе нарушение – 10 000 (десятьтысяч) российских рублей;за каждое следующее выявленноенарушение – 30 000 (тридцать тысяч)российских рублей.\n35. 3.15.1.', 'расположенных в любой зоне других стран, компенсировать расходы Исполнителя на приобретение\nФирменной вывески градиентного цвета с высотой букв 300 мм в количестве 1 (одной) единицы после успешно\nпройденного Аудита,', 'световой кронштейн;\n30 000 (тридцать тысяч) российских рублей, вывеска-кнопка высотой 500 мм;\n25 000 (двадцать пять тысяч) российских рублей, вывеска-кнопка высотой 400 мм;\n20 000 (двадцать тысяч) российских рублей,']",Ответ: 60 000 (шестьдесят тысяч) российских рублей.,0.0,0.5176976846890325,0.99999999995
Какие элементы брендинга Исполнитель обязан возместить Заказчику в случае расторжения Договора в течение 12 месяцев с даты Активации ПВЗ?,"['Заказчик вправе:\n(i) для ПВЗ, расположенных в любой зоне на территории Российской Федерации, Республики Беларусь, Республики\nКазахстан, Республики Армении, предоставить Исполнителю элементы брендинга (Фирменную вывеску в количестве\n1 (одной) единицы, панель-кронштейн в количестве 1 (одной) единицы);\n\n(ii) для ПВЗ, расположенных в любой зоне других стран, компенсировать расходы Исполнителя на приобретение\nФирменной вывески градиентного цвета с высотой букв 300 мм в количестве 1 (одной) единицы после успешно\nпройденного Аудита, путем перечисления на Баланс Исполнителя фиксированной выплаты в следующем размере\nдля следующих стран:\nРеспублика Узбекистан – 6 920 000 узбекских сумов (UZS);\nРеспублика Кыргызстан – 43 000 киргизских сомов (KGS);\nВ случае если в течение 12 (двенадцати) календарных месяцев с даты Активации ПВЗ Договор будет расторгнут,\nИсполнитель обязуется в течение 30 (тридцати) календарных дней с даты расторжения Договора возместить\nЗаказчику имущественные расходы в размере:\n• стоимости элементов брендинга,', 'В случае если в течение 12 (двенадцати) календарных месяцев с даты Активации ПВЗ Договор будет расторгнут,\nИсполнитель обязуется в течение 30 (тридцати) календарных дней с даты расторжения Договора возместить\nЗаказчику имущественные расходы в размере:\n• стоимости элементов брендинга,', 'В случае если в течение 12 (двенадцати) календарных месяцев с даты Активации ПВЗ Договор будет расторгнут,', '3.17.8. В случае если в течение 12 (двенадцати) календарных месяцев с даты Активации ПВЗ (для новых ПВЗ) или\nс даты установки Системы WB-LOCK (для действующих ПВЗ в Москве и Московской области) Договор будет\nрасторгнут или произойдет смена собственника ПВЗ, Исполнитель обязуется в течение 30 (тридцати) календарных\nдней с даты расторжения Договора возместить Заказчику имущественные расходы в размере стоимости Системы\nWB-LOCK, указанной ниже:\nСтоимость Системы WB-LOCK:\n16 000 (шестнадцать тысяч) российских рублей комплектация «А;\n18 000 (восемнадцать тысяч) российских рублей комплектация «Б»;\n20 000 (двадцать тысяч) российских рублей комплектация «В».\n3.17.9. По согласованию с Заказчиком в отдельных случаях Исполнитель может быть освобожден от обязанности\nустановить Систему WB-LOCK на входную дверь в ПВЗ, в связи с техническими особенностями установки Системы\nWB-LOCK.\n3.17.10.', '3.17.8. В случае если в течение 12 (двенадцати) календарных месяцев с даты Активации ПВЗ (для новых ПВЗ) или\nс даты установки Системы WB-LOCK (для действующих ПВЗ в Москве и Московской области) Договор будет\nрасторгнут или произойдет смена собственника ПВЗ, Исполнитель обязуется в течение 30 (тридцати) календарных\nдней с даты расторжения Договора возместить Заказчику имущественные расходы в размере стоимости Системы\nWB-LOCK,', 'Исполнитель обязуется в течение 30 (тридцати) календарных дней с даты расторжения Договора возместить\nЗаказчику имущественные расходы в размере:\n• стоимости элементов брендинга,', '7.1., 7.1.1., 7.1.2. и 7.2 Договора, если в течение 12 (двенадцати) календарных месяцев или, если в течение 18\n(восемнадцати) календарных месяцев, при получении от одной до девяти Дополнительных выплат согласно п. 7.2.\nДоговора, после Активации ПВЗ произойдет любое из нижеследующих событий:\n• Деактивация ПВЗ Исполнителя в результате прекращения оказания Услуг в ПВЗ Исполнителем по\nоснованиям, предусмотренным Договором;\n• Смена Исполнителя. Под сменой Исполнителя понимается замена Стороны Исполнителя по Договору, при\nкоторой изначальный Исполнитель передаёт все права и обязанности по Договору новому Исполнителю.\nИсполнитель обязан возвратить Заказчику суммы Дополнительных поддерживающих выплат:\n• в течение 5 (пяти) календарных дней до даты Деактивации ПВЗ Исполнителя;\n• не позднее 5 (пяти) календарных дней до даты смены Исполнителя.', 'В случае поступления по указанному Заказчиком адресу\nТоваров с недостатками (включая, но не ограничиваясь: частичное повреждение, неверное вложение) и/или Подмен,\nИсполнитель обязуется возместить Стоимость Товаров с недостатками и/или замененных на Подмены.\nВзаиморасчеты по недостачам и недостаткам Товаров производятся Сторонами в соответствии с условиями\nДоговора.\n14.10. Утвержденная Заказчиком заявка Исполнителя на осуществление процесса Деактивации ПВЗ не может\nбыть отозвана Исполнителем. Данное условие не лишает Исполнителя возможности осуществить Активацию нового\nПВЗ.\n14.11. При расторжении Договора по любому основанию Исполнитель обязан передать Заказчику Товары,\nнаходящиеся в ПВЗ, по первому требованию Заказчика в течение 3 (трех) календарных дней с даты получения\nсоответствующего требования, а также предоставить доступ представителям Заказчика к Товарам в ПВЗ для\nпроведения инвентаризации. В указанном случае Стороны проводят сверку по взаимным обязательствам и на\nосновании сверки осуществляют итоговые взаиморасчеты в течение 60 (шестидесяти) календарных дней с даты\nрасторжения Договора.', 'В случае если в течение 12 (двенадцати) календарных месяцев с даты Активации ПВЗ (для новых ПВЗ) или\nс даты установки Системы WB-LOCK (для действующих ПВЗ в Москве и Московской области) Договор будет\nрасторгнут или произойдет смена собственника ПВЗ,', 'Данное условие не лишает Исполнителя возможности осуществить Активацию нового\nПВЗ.\n14.11. При расторжении Договора по любому основанию Исполнитель обязан передать Заказчику Товары,\nнаходящиеся в ПВЗ, по первому требованию Заказчика в течение 3 (трех) календарных дней с даты получения\nсоответствующего требования, а также предоставить доступ представителям Заказчика к Товарам в ПВЗ для\nпроведения инвентаризации.']",Исполнитель обязан возместить Заказчику стоимость элементов брендинга в случае расторжения Договора в течение 12 месяцев с даты Активации ПВЗ.,1.0,0.7727910510550604,0.8333333333055556
Какие условия должны быть выполнены Исполнителем для подключения системы видеонаблюдения и предоставления доступа в Личный кабинет Заказчику?,"['3.12. Исполнитель после одобрения Заказчиком заявки на открытие ПВЗ, до момента подачи заявки на Активацию\nПВЗ, должен оборудовать ПВЗ системой видеонаблюдения и подключить такую систему к одному из сервисов\nвидеонаблюдения, соответствующему различным техническим требованиям, параметры которых размещены на\nсайте https://pvz.wb.ru/video-connection\nИсполнитель обязан предоставить Заказчику доступ в Личный кабинет путем входа через токен и/или путем ввода\nлогина и пароля Исполнителя, с возможностью обрабатывать, копировать и сохранять видеозаписи с камер\nвидеонаблюдения в ПВЗ. В случае если Исполнитель не подключится к сервисам видеонаблюдения и не\nпредоставит доступ в Личный кабинет путем входа через токен и/или путем ввода логина и пароля Исполнителя,\nсогласно условиям настоящего пункта, Заказчик вправе отказать Исполнителю в одобрении заявки на Активацию\nПВЗ.\n\n3.13.', '3.12. Исполнитель после одобрения Заказчиком заявки на открытие ПВЗ, до момента подачи заявки на Активацию\nПВЗ, должен оборудовать ПВЗ системой видеонаблюдения и подключить такую систему к одному из сервисов\nвидеонаблюдения, соответствующему различным техническим требованиям, параметры которых размещены на\nсайте https://pvz.wb.ru/video-connection\nИсполнитель обязан предоставить Заказчику доступ в Личный кабинет путем входа через токен и/или путем ввода\nлогина и пароля Исполнителя, с возможностью обрабатывать, копировать и сохранять видеозаписи с камер\nвидеонаблюдения в ПВЗ.', 'В случае если Исполнитель не подключится к сервисам видеонаблюдения и не\nпредоставит доступ в Личный кабинет путем входа через токен и/или путем ввода логина и пароля Исполнителя,\nсогласно условиям настоящего пункта, Заказчик вправе отказать Исполнителю в одобрении заявки на Активацию\nПВЗ.\n\n3.13.', '5.2. Исполнитель обязуется предоставлять в Личном кабинете достоверные данные о характеристиках ПВЗ:\nадрес, площадь помещения, количество сотрудников Исполнителя в ПВЗ и др.\n5.3. При оказании Услуг Исполнитель обязуется использовать для работы только Портал и вести учет всех\nдействий в Личном кабинете в соответствии с Инструкциями по работе с Порталом, соблюдая условия раздела 9\nДоговора (Видеонаблюдение).', 'и до окончания срока действия Договора, с\nправом Заказчика на обработку/хранение/копирование информации, полученной с камер видеонаблюдения, в том\nчисле у лица, оказывающего Исполнителю услуги по предоставлению сервиса видеонаблюдения и/или обработки\nаудио-, видеозаписей и/или их хранению.\n9.1.7. Исполнитель предоставляет Заказчику через Портал актуальные данные для входа в личный кабинет\nпользователя, выбранного видеосервиса (логин, пароль).\n9.1.8.', 'Допускается использование только одногопровайдера сервиса видеонаблюдения для одного ПВЗ.9.1.7. Исполнитель предоставляет Заказчику черезПортал актуальные данные для входа в личный кабинетпользователя выбранного видеосервиса (логин,пароль).9.1.9.', 'В случае если Исполнитель не подключится к сервисам видеонаблюдения и не\nпредоставит доступ в Личный кабинет путем входа через токен и/или путем ввода логина и пароля Исполнителя,\nсогласно условиям настоящего пункта,', 'Исполнитель обязуется оборудовать ПВЗсистемой видеонаблюдения, соответствующейтехническим требованиям, указанным в Регламентесостояния ПВЗ (Приложение № 3), и подключитьсистему к провайдеру облачного видеонаблюдения,соответствующего техническим требованиям, которыеразмещены на сайте https://pvz.wb.ru/video-connection Исполнитель обязуется оборудовать ПВЗ:- при упрощенных условиях открытия ПВЗ – 1 (одной)камерой видеонаблюдения, которая должна охватыватьвсе зоны ПВЗ, в том числе клиентскую и складскуюзоны полностью. В случае если 1 (одной) камерынедостаточно для охвата всех зон ПВЗ, то Исполнительобязуется оборудовать ПВЗ необходимым количествомкамер, охватывающих всю площадь ПВЗ;- при всех остальных условиях открытия ПВЗ – неменее 3 (трех) камер видеонаблюдения. Все камерывидеонаблюдения должны осуществлять функциювидеофиксации.', 'Исполнитель обязуется оборудовать ПВЗсистемой видеонаблюдения, соответствующейтехническим требованиям, указанным в Регламентесостояния ПВЗ (Приложение № 3), и подключитьсистему к провайдеру облачного видеонаблюдения,соответствующего техническим требованиям, которыеразмещены на сайте https://pvz.wb.ru/video-connection Исполнитель обязуется оборудовать ПВЗ:- при упрощенных условиях открытия ПВЗ – 1 (одной)камерой видеонаблюдения, которая должна охватыватьвсе зоны ПВЗ, в том числе клиентскую и складскуюзоны полностью.', 'видеозаписей и/или их хранению.\n9.1.7. Исполнитель предоставляет Заказчику через Портал актуальные данные для входа в личный кабинет\nпользователя, выбранного видеосервиса (логин, пароль).\n9.1.8.']","Исполнитель должен выполнить следующие условия для подключения системы видеонаблюдения и предоставления доступа в Личный кабинет Заказчику:

1. Оборудовать ПВЗ системой видеонаблюдения, соответствующей техническим требованиям, указанным в Регламенте состояния ПВЗ (Приложение № 3), и подключить систему к провайдеру облачного видеонаблюдения, соответствующему техническим требованиям, размещённым на сайте https://pvz.wb.ru/video-connection.

2. В зависимости от условий открытия ПВЗ:
   - При упрощенных условиях открытия ПВЗ — установить 1 камеру видеонаблюдения, которая должна охватывать все зоны ПВЗ (включая клиентскую и складскую зоны). Если одной камеры недостаточно, Исполнитель обязан установить необходимое количество камер для полного охвата всей площади ПВЗ.
   - При всех остальных условиях открытия ПВЗ — установить не менее 3 камер видеонаблюдения. Все камеры должны осуществлять функцию видеофиксации.

3. Предоставить Заказчику доступ в Личный кабинет путём входа через токен и/или ввода логина и пароля Исполнителя, с возможностью обрабатывать, копировать и сохранять видеозаписи с камер видеонаблюдения в ПВЗ.

4. Обеспечить достоверность данных о характеристиках ПВЗ в Личном кабинете (адрес, площадь помещения, количество сотрудников и т.д.).

5. Использовать только Портал для работы и вести учёт всех действий в Личном кабинете в соответствии с Инструкциями по работе с Порталом, соблюдая условия раздела 9 Договора (Видеонаблюдение).

6. Предоставить Заказчику через Портал актуальные данные для входа в личный кабинет пользователя выбранного видеосервиса (логин, пароль).",1.0,0.8588519033467371,0.6797619047521938
"Какие действия должен предпринять Исполнитель, если в ПВЗ выявлено загрязнение или недостаточное освещение?","['В случае если по результатам проверки, проведенной по инициативе Заказчика, либо проверки, проведенной на\nосновании поступивших жалоб Клиентов, Заказчиком будет выявлено в ПВЗ наличие загрязнения, недостаточного\nосвещения и/или вентиляции (воздухообмена), то Исполнитель обязуется их незамедлительно устранить.\n3.15.', '3.13. В случае если продолжительность работы ПВЗ с момента Активации составила не менее 6 (шести) месяцев,\nИсполнитель после согласования Заказчиком заявки, поданной через Личный кабинет, вправе изменить место\nнахождения ПВЗ путем его открытия в новом помещении, по иному адресу, в радиусе до 500 (пятисот) метров от\nпрежнего места нахождения ПВЗ.\n3.14. Исполнитель обязуется обеспечить в ПВЗ порядок, чистоту, надлежащее освещение и вентиляцию\n(воздухообмен).\nВ случае если по результатам проверки, проведенной по инициативе Заказчика, либо проверки, проведенной на\nосновании поступивших жалоб Клиентов, Заказчиком будет выявлено в ПВЗ наличие загрязнения, недостаточного\nосвещения и/или вентиляции (воздухообмена), то Исполнитель обязуется их незамедлительно устранить.\n3.15.', 'В случае если по результатам проверки, проведенной по инициативе Заказчика, либо проверки, проведенной на\nосновании поступивших жалоб Клиентов, Заказчиком будет выявлено в ПВЗ наличие загрязнения, недостаточного\nосвещения и/или вентиляции (воздухообмена),', '3.13. В случае если продолжительность работы ПВЗ с момента Активации составила не менее 6 (шести) месяцев,\nИсполнитель после согласования Заказчиком заявки, поданной через Личный кабинет, вправе изменить место\nнахождения ПВЗ путем его открытия в новом помещении, по иному адресу, в радиусе до 500 (пятисот) метров от\nпрежнего места нахождения ПВЗ.\n3.14. Исполнитель обязуется обеспечить в ПВЗ порядок, чистоту, надлежащее освещение и вентиляцию\n(воздухообмен).', 'по иному адресу, в радиусе до 500 (пятисот) метров от\nпрежнего места нахождения ПВЗ.\n3.14. Исполнитель обязуется обеспечить в ПВЗ порядок, чистоту, надлежащее освещение и вентиляцию\n(воздухообмен).', 'Ежедневно после открытия ПВЗ для Клиентов, а затем периодически (каждый час) в течение периода времени\nработы ПВЗ Исполнитель обязан убедиться в том, что:\n1. Экран включен и идет трансляция видеоряда\n2. Изображение корректное (картинка не повернута, нет мерцания или каких-либо искажений изображения).\n6.1.1. Если присутствуют неисправности, указанные в пп.1. или 2 п. 6.1., то Исполнитель выполняет следующую\nпоследовательность действий:\n1. Перезагружает Экран и ПК, вынимая и вставляя обратно вилку(-и) в блоке розеток Оборудования\n2.', 'Исполнитель несет ответственность за надлежащую эксплуатацию и содержание ПВЗ и обязуется отвечать\nпо претензиям физических лиц и административным санкциям государственных органов, связанным с\nнесоблюдением применимого в месте нахождения ПВЗ законодательства в отношении ПВЗ.', '3.10. Исполнитель обязан разместить информационную конструкцию (вывеску и панель-кронштейн).\nИнформационная конструкция (вывеска) представляет собой отдельные формованные или металлические цветные\nбуквы с внутренней подсветкой, собранные на раме с пигментом. Вывеска должна быть изготовлена без подложки.\n3.11.  Исполнитель обязан по требованию Заказчика устранить нарушения требований к Активации ПВЗ в\nустановленный Заказчиком срок, но не позднее 30 (тридцати) дней с момента выявления указанных нарушений. В\nпротивном случае Исполнитель лишается права активировать указанный ПВЗ. В качестве подтверждения\nвыполнения указанных требований Исполнитель обязан предоставить Заказчику фото- и видеоматериалы в\nдостаточном объеме для объективной оценки надлежащего исполнения обязательств по Активации Исполнителем\nПВЗ.\n3.12.', '3.10. Исполнитель обязан разместить информационную конструкцию (вывеску и панель-кронштейн).\nИнформационная конструкция (вывеска) представляет собой отдельные формованные или металлические цветные\nбуквы с внутренней подсветкой, собранные на раме с пигментом. Вывеска должна быть изготовлена без подложки.\n3.11.  Исполнитель обязан по требованию Заказчика устранить нарушения требований к Активации ПВЗ в\nустановленный Заказчиком срок, но не позднее 30 (тридцати) дней с момента выявления указанных нарушений.', 'Исполнитель самостоятельно, с учетом сезонности и текущей нагрузки на ПВЗ, определяет\nнеобходимое количество лиц, действующих на стороне Исполнителя, задействованных в ПВЗ, для целей\nсвоевременного и качественного обслуживания Клиентов/Продавцов.\n4.2.1. В случае получения Заказчиком от Клиентов/Продавцов двух и более жалоб/обращений о наличии\nочередей в ПВЗ, а также при выявлении очередей в ПВЗ в ходе проведенных Заказчиком контрольных мероприятий,\nв том числе путем просмотра видеозаписей с камер видеонаблюдения в ПВЗ, Заказчик направляет Исполнителю\nуведомление о необходимости улучшения качества оказания Услуг в ПВЗ.\n4.3. Все взаиморасчеты между Заказчиком и Клиентом должны производиться Исполнителем исключительно\nдистанционным способом через Портал.\n\n4.4. Исполнитель обязуется при выдаче Товаров Клиентам в ПВЗ и путем курьерской доставки по требованию\nКлиента предоставить последнему полиэтиленовый пакет, дизайн, цвет и изображение которого соответствует\nуказанным Заказчиком характеристикам, в количестве, соответствующем указанному в Инструкциях, сделав об этом\nотметку на Портале.']","Исполнитель обязан незамедлительно устранить выявленные в ПВЗ нарушения, такие как загрязнение, недостаточное освещение и/или вентиляцию (воздухообмен).",1.0,0.5782709612236259,
Какое минимальное количество камер видеонаблюдения требуется при упрощенных условиях открытия ПВЗ?,"['3.16.2. Требования к установке:\n• при упрощенных условиях открытия ПВЗ — 1 (одна) камера видеонаблюдения;\n• при всех остальных условиях открытия ПВЗ — минимальное количество камер для покрытия всех зон составляет\nне менее 3 (трех).', 'Запрещено использовать камеры с Wi-Fi;\n— режим день/ночь: автоматическое переключение;\n— RAM: 8-16 МБ.\n3.16.2. Требования к установке:\n• при упрощенных условиях открытия ПВЗ — 1 (одна) камера видеонаблюдения;\n• при всех остальных условиях открытия ПВЗ — минимальное количество камер для покрытия всех зон составляет\nне менее 3 (трех).', 'PCMa (G.711A), PCMu (G711U);\n— возможность конфигурирования интервала ключевых кадров idr (iframe interval): от 1 с до 8 с;\n— механический ИК-фильтр: в наличии;\n— ИК-подсветка: в наличии;\n— дальность действия ИК-подсветки: не менее 20 м;\n— рабочая температура: от минус 10 °С до плюс 45 °С;\n— питание: 12V (DC) или POE (рекомендовано);\n— минимальная освещенность: не более 0,01 лк;\n— защита корпуса от пыли и влаги: не ниже IP40;\n— технология передачи данных: Ethernet. Запрещено использовать камеры с Wi-Fi;\n— режим день/ночь: автоматическое переключение;\n— RAM: 8-16 МБ.\n3.16.2. Требования к установке:\n• при упрощенных условиях открытия ПВЗ — 1 (одна) камера видеонаблюдения;\n• при всех остальных условиях открытия ПВЗ — минимальное количество камер для покрытия всех зон составляет\nне менее 3 (трех).', 'Исполнитель обязуется оборудовать ПВЗсистемой видеонаблюдения, соответствующейтехническим требованиям, указанным в Регламентесостояния ПВЗ (Приложение № 3), и подключитьсистему к провайдеру облачного видеонаблюдения,соответствующего техническим требованиям, которыеразмещены на сайте https://pvz.wb.ru/video-connection Исполнитель обязуется оборудовать ПВЗ:- при упрощенных условиях открытия ПВЗ – 1 (одной)камерой видеонаблюдения, которая должна охватыватьвсе зоны ПВЗ, в том числе клиентскую и складскуюзоны полностью. В случае если 1 (одной) камерынедостаточно для охвата всех зон ПВЗ, то Исполнительобязуется оборудовать ПВЗ необходимым количествомкамер, охватывающих всю площадь ПВЗ;- при всех остальных условиях открытия ПВЗ – неменее 3 (трех) камер видеонаблюдения. Все камерывидеонаблюдения должны осуществлять функциювидеофиксации.', '9. Видеонаблюдение\n9.1.1. Исполнитель обязуется оборудовать ПВЗ системой видеонаблюдения, соответствующей техническим\nтребованиям, указанным в Регламенте состояния ПВЗ (Приложение № 3), и подключить систему к провайдеру\nоблачного видеонаблюдения, соответствующего техническим требованиям, которые размещены на сайте\nhttps://pvz.wb.ru/video-connection\nИсполнитель обязуется оборудовать ПВЗ:\n• при упрощенных условиях открытия ПВЗ — 1 (одной) камерой видеонаблюдения, которая должна\nохватывать все зоны ПВЗ, в том числе клиентскую и складскую зоны полностью. В случае если 1 (одной) камеры\nнедостаточно для охвата всех зон ПВЗ, Исполнитель обязуется оборудовать ПВЗ необходимым количеством камер,\nохватывающим всю площадь ПВЗ;\n• при всех остальных условиях открытия ПВЗ — не менее 3 (трех) камер видеонаблюдения. Все камеры\nвидеонаблюдения должны осуществлять функцию видеофиксации. В случае если ПВЗ оборудован столом для\nподготовки Товара к возврату, Исполнитель обязуется установить камеру видеонаблюдения на таком столе, в\nсоответствии с техническими стандартами оборудования.', 'соответствующего техническим требованиям, которые размещены на сайте\nhttps://pvz.wb.ru/video-connection\nИсполнитель обязуется оборудовать ПВЗ:\n• при упрощенных условиях открытия ПВЗ — 1 (одной) камерой видеонаблюдения, которая должна\nохватывать все зоны ПВЗ,', 'соответствующего техническим требованиям, которыеразмещены на сайте https://pvz.wb.ru/video-connection Исполнитель обязуется оборудовать ПВЗ:- при упрощенных условиях открытия ПВЗ – 1 (одной)камерой видеонаблюдения, которая должна охватыватьвсе зоны ПВЗ,', 'В случае если 1 (одной) камеры\nнедостаточно для охвата всех зон ПВЗ, Исполнитель обязуется оборудовать ПВЗ необходимым количеством камер,\nохватывающим всю площадь ПВЗ;\n• при всех остальных условиях открытия ПВЗ — не менее 3 (трех) камер видеонаблюдения. Все камеры\nвидеонаблюдения должны осуществлять функцию видеофиксации. В случае если ПВЗ оборудован столом для\nподготовки Товара к возврату, Исполнитель обязуется установить камеру видеонаблюдения на таком столе, в\nсоответствии с техническими стандартами оборудования.', '9. Видеонаблюдение\n9.1.1. Исполнитель обязуется оборудовать ПВЗ системой видеонаблюдения, соответствующей техническим\nтребованиям, указанным в Регламенте состояния ПВЗ (Приложение № 3), и подключить систему к провайдеру\nоблачного видеонаблюдения, соответствующего техническим требованиям, которые размещены на сайте\nhttps://pvz.wb.ru/video-connection\nИсполнитель обязуется оборудовать ПВЗ:\n• при упрощенных условиях открытия ПВЗ — 1 (одной) камерой видеонаблюдения, которая должна\nохватывать все зоны ПВЗ, в том числе клиентскую и складскую зоны полностью.', 'В случае если 1 (одной) камерынедостаточно для охвата всех зон ПВЗ, то Исполнительобязуется оборудовать ПВЗ необходимым количествомкамер, охватывающих всю площадь ПВЗ;- при всех остальных условиях открытия ПВЗ – неменее 3 (трех) камер видеонаблюдения. Все камерывидеонаблюдения должны осуществлять функциювидеофиксации.']",Ответ: 1 (одна) камера видеонаблюдения.,1.0,0.6760857770361403,
Какие действия должен предпринять Исполнитель в случае обнаружения неисправности в работе Системы WB-LOCK?,"['В случае обнаружения в процессеэксплуатации Исполнителем некорректной работыСистемы WB-LOCK или её отдельныхкомплектующих, Исполнитель обязан в течение 24(двадцати четырех) часов с момента обнаружениянеисправности сообщить Заказчику посредствомнаправления уведомления через соответствующийраздел в Личном кабинете, согласовав с нимвозможное отключение Системы WB-LOCK довыяснения причин и устранения возможныхнеисправностей.', '3.17.7. В случае обнаружения в процессе эксплуатации Исполнителем некорректной работы Системы WB-LOCK\nили её отдельных комплектующих, Исполнитель обязан в течение 24 (двадцати четырех) часов с момента\nобнаружения неисправности сообщить Заказчику посредством направления уведомления через соответствующий\nраздел в Личном кабинете, согласовав с ним возможное отключение Системы WB-LOCK до выяснения причин и\nустранения возможных неисправностей.\n3.17.7.1.', 'В качестве подтверждения выполнения указанных требований Исполнитель обязан предоставить Заказчику фото- и\nвидеоматериалы в достаточном объеме, для объективной оценки надлежащего исполнения обязательств, с целью\nисполнения п.5.14 Договора.\n3.17.7. В случае обнаружения в процессе эксплуатации Исполнителем некорректной работы Системы WB-LOCK\nили её отдельных комплектующих, Исполнитель обязан в течение 24 (двадцати четырех) часов с момента\nобнаружения неисправности сообщить Заказчику посредством направления уведомления через соответствующий\nраздел в Личном кабинете, согласовав с ним возможное отключение Системы WB-LOCK до выяснения причин и\nустранения возможных неисправностей.\n3.17.7.1. В случае обнаружения Заказчиком производственного брака Системы WB-LOCK, Исполнитель имеет\nправо по согласованию с Заказчиком на безвозмездную замену всей Системы WB-LOCK или отдельных\nкомплектующих Системы WB-LOCK.\n3.17.7.2. Если будет установлено, что Система WB-LOCK была повреждена и/или не функционирует по вине\nИсполнителя, стоимость Системы WB-LOCK, указанная в акте приема-передачи, подлежит компенсации\nИсполнителем.\n\n3.17.8.', 'Исполнители действующих ПВЗустанавливают Систему WB-LOCK в течение 10(десяти) календарных дней с момента её передачиЗаказчиком согласно акту приема-передачи.3.17.7. В случае обнаружения в процессеэксплуатации Исполнителем некорректной работыСистемы WB-LOCK или её отдельныхкомплектующих, Исполнитель обязан в течение 24(двадцати четырех) часов с момента обнаружениянеисправности сообщить Заказчику посредствомнаправления уведомления через соответствующийраздел в Личном кабинете, согласовав с нимвозможное отключение Системы WB-LOCK довыяснения причин и устранения возможныхнеисправностей.', 'В случае обнаружения в процессеэксплуатации Исполнителем некорректной работыСистемы WB-LOCK или её отдельныхкомплектующих,', '3.17.7.1. В случае обнаружения Заказчиком производственного брака Системы WB-LOCK, Исполнитель имеет\nправо по согласованию с Заказчиком на безвозмездную замену всей Системы WB-LOCK или отдельных\nкомплектующих Системы WB-LOCK.\n3.17.7.2. Если будет установлено, что Система WB-LOCK была повреждена и/или не функционирует по вине\nИсполнителя, стоимость Системы WB-LOCK, указанная в акте приема-передачи, подлежит компенсации\nИсполнителем.\n\n3.17.8.', '3.17.7.1. В случае обнаружения Заказчиком производственного брака Системы WB-LOCK, Исполнитель имеет\nправо по согласованию с Заказчиком на безвозмездную замену всей Системы WB-LOCK или отдельных\nкомплектующих Системы WB-LOCK.\n3.17.7.2.', 'Не установление Системы WB-LOCK втечение 10 (десяти) календарных дней смомента её передачи ЗаказчикомИсполнителю, не обеспечениеработоспособности и функционированияСистемы WB-LOCK во время оказанияуслуг по Договору, не уведомлениеЗаказчика в случае выхода из строяСистемы WB-LOCK или отдельныхкомплектующих, в течение 24 (двадцатичетырех) часов с момента обнаружениянеисправности:За первое выявленное нарушение –предупреждение;за второе нарушение – штраф в размере5 000 (пять тысяч) российских рублей;за третье нарушение – штраф в размере10 000 (десять тысяч) российских рублей.\n\n№строки №разделаили пп.Договора\nПриложение №5 (Услуга WB Track) ОТВЕТСТВЕННОСТЬ / РАЗМЕРШТРАФОВ\n37 2.5 При принятии Отправления WB Track для доставки,Исполнитель не обязан осуществлять досмотр ипроверку содержимого Отправления WB Track напредмет работоспособности, внутренней комплектации,количества, наличия явных или скрытых дефектов,чувствительности к температурному воздействию ииных качественных характеристик и пр.', '3.17.3.1. В целях исполнения указанного обязательства Исполнитель вправе привлекать третьих лиц.\n3.17.3.2. Исполнитель обязан по требованию Заказчика устранить нарушения требований к Активации ПВЗ в\nустановленный Заказчиком срок, но не позднее 30 (тридцати) дней с момента выявления указанных нарушений. В\nпротивном случае Исполнитель лишается права активировать указанный ПВЗ. В качестве подтверждения\nвыполнения указанных требований Исполнитель обязан предоставить Заказчику фото- и видеоматериалы в\nдостаточном объеме, для объективной оценки надлежащего исполнения обязательств.\n3.17.4. Заказчик по запросу Исполнителя может давать консультации последнему по вопросам установки, монтажа,\nналадки работы, правильной эксплуатации и обслуживания Системы WB-LOCK.\n3.17.5. Исполнитель после одобрения Заказчиком заявки на открытие ПВЗ, до момента подачи заявки на\nАктивацию ПВЗ, должен оборудовать ПВЗ Системой WB-LOCK.\n3.17.6. Исполнители действующих ПВЗ устанавливают Систему WB-LOCK в течение 10 (десяти) календарных дней\nс момента её передачи Заказчиком согласно акту приема-передачи.', 'Не установление Системы WB-LOCK втечение 10 (десяти) календарных дней смомента её передачи ЗаказчикомИсполнителю, не обеспечениеработоспособности и функционированияСистемы WB-LOCK во время оказанияуслуг по Договору, не уведомлениеЗаказчика в случае выхода из строяСистемы WB-LOCK или отдельныхкомплектующих, в течение 24 (двадцатичетырех) часов с момента обнаружениянеисправности:За первое выявленное нарушение –предупреждение;за второе нарушение – штраф в размере5 000 (пять тысяч) российских рублей;']","В случае обнаружения неисправности в работе Системы WB-LOCK Исполнитель должен:

1. В течение 24 часов с момента обнаружения неисправности сообщить Заказчику посредством направления уведомления через соответствующий раздел в Личном кабинете.
2. Согласовать с Заказчиком возможное отключение Системы WB-LOCK до выяснения причин и устранения возможных неисправностей.
3. Предоставить Заказчику фото- и видеоматериалы в достаточном объеме для объективной оценки надлежащего исполнения обязательств.",1.0,0.9941537935069416,
Какой тип управления рекомендуется использовать для замка ПВЗ?,"['— тип управления (рекомендуемый) – система команд по сети RS485 (запросить узаказчика);— встроен датчик двери (сухой контакт или RS485);— встроен датчик состояния замка (сухой контакт или RS485).4.8.', 'При выборе типа запирающего механизма рекомендуется использоватьнормально закрытые механизмы (закрыт при отсутствии напряжения) или триггерныемеханизмы (может быть закрыт вне зависимости от состояния поданногонапряжения).4.6. Механизм замка или встроенная схема управления замка должна обеспечиватьрежим работы «Постоянно открыто» для обеспечения свободного прохода в рабочеевремя.4.7. Устройство должно быть в обязательном порядке совместимым с ПО итехническими характеристиками фирменного контроллера:— напряжение 12 В;— ток, не более 4 А;— тип управления (возможный) – сухой контакт (замыкание – замок открыт);— тип управления (рекомендуемый) – система команд по сети RS485 (запросить узаказчика);— встроен датчик двери (сухой контакт или RS485);— встроен датчик состояния замка (сухой контакт или RS485).4.8. Конструкция замка должна обеспечивать минимальный уровень вмешательства вконструкцию двери и дверного полотна при монтаже.4.9.', 'Устройство должно быть в обязательном порядке совместимым с ПО итехническими характеристиками фирменного контроллера:— напряжение 12 В;— ток, не более 4 А;— тип управления (возможный) – сухой контакт (замыкание – замок открыт);— тип управления (рекомендуемый) – система команд по сети RS485 (запросить узаказчика);— встроен датчик двери (сухой контакт или RS485);— встроен датчик состояния замка (сухой контакт или RS485).4.8. Конструкция замка должна обеспечивать минимальный уровень вмешательства вконструкцию двери и дверного полотна при монтаже.4.9.', 'При выборе типа запирающего механизма рекомендуется использоватьнормально закрытые механизмы (закрыт при отсутствии напряжения) или триггерныемеханизмы (может быть закрыт вне зависимости от состояния поданногонапряжения).4.6. Механизм замка или встроенная схема управления замка должна обеспечиватьрежим работы «Постоянно открыто» для обеспечения свободного прохода в рабочеевремя.4.7.', '3.15.1. Установка в ПВЗ электромеханического/электромагнитного замка и контроллера может быть осуществлена\nИсполнителем самостоятельно, либо силами Заказчика на основании согласованной Сторонами заявки на установку\nэлектромеханического/электромагнитного замка со встроенным контроллером. В случае, если установка в ПВЗ\nэлектромеханического/электромагнитного замка и контроллера была осуществлена по согласованной между\nСторонами заявке на установку, то Исполнитель обеспечивает подключение такого замка к сети электропитания,\nработоспособность и функционирование на все время оказания услуг по Договору.\n3.16. Технические стандарты системы видеонаблюдения\nСистема видеонаблюдения состоит из необходимого оборудования, в том числе видеокамер и системы провайдера\nоблачного видеонаблюдения. Оборудование должно соответствовать требованиям законодательства государства, на\nтерритории которого Исполнитель оказывает Услуги. Оборудование должно быть серийно изготовленным в заводских\nусловиях, работоспособным и обеспечивать предусмотренную производителем функциональность.', '3.15. В случае, если ПВЗ расположен на территории Российской Федерации (за исключением Москвы и\nМосковской области), Исполнитель обязуется оборудовать входную дверь ПВЗ электромеханическим/\nэлектромагнитным замком со встроенным электромеханическим/электромагнитным контроллером, а также\nобеспечить его подключение к сети электропитания, работоспособность и функционирование на всё время оказания\nуслуг по Договору. В целях исполнения указанного обязательства Исполнитель обязан оформить заказ на\nприобретение контроллера на Торговой площадке. Контроллер предоставляется Заказчиком Исполнителю на\nусловиях, указанных на Портале, а электромеханический/электромагнитный замок Исполнитель обязуется оплатить\nпо цене, установленной на Торговой площадке. После успешной Активации ПВЗ по согласованию с Заказчиком\nИсполнитель может быть освобожден от обязанности оборудовать входную дверь в ПВЗ вышеуказанным замком и\nконтроллером.\n3.15.1.', '3.15.1. Установка в ПВЗ электромеханического/электромагнитного замка и контроллера может быть осуществлена\nИсполнителем самостоятельно, либо силами Заказчика на основании согласованной Сторонами заявки на установку\nэлектромеханического/электромагнитного замка со встроенным контроллером.', 'В случае, если установка в ПВЗ\nэлектромеханического/электромагнитного замка и контроллера была осуществлена по согласованной между\nСторонами заявке на установку, то Исполнитель обеспечивает подключение такого замка к сети электропитания,', '3.15.1. Установка в ПВЗ электромеханического/электромагнитного замка и контроллера может быть осуществлена\nИсполнителем самостоятельно,', 'Механизм замка или встроенная схема управления замка должна обеспечиватьрежим работы «Постоянно открыто» для обеспечения свободного прохода в рабочеевремя.4.7.']",Рекомендуемый тип управления для замка ПВЗ — система команд по сети RS485 (запросить у заказчика).,1.0,0.9897305602596168,0.9999999999666667
Какой штраф предусмотрен за первое нарушение требований по предоставлению достоверных данных о характеристиках ПВЗ?,"['2. 5.2. Исполнитель обязуется предоставлять в Личномкабинете достоверные данные о характеристиках ПВЗ:адрес, площадь помещения, в которомнепосредственно оказываются Услуги, количествосотрудников Исполнителя в ПВЗ и др. Данные охарактеристиках ПВЗ должны подтверждатьсядокументами в соответствии с п. 3.2. Приложения № 3Договора.\nЗа первое нарушение – 10 000(десять тысяч) российских рублей;за каждое следующее выявленноенарушение – 100 000 (сто тысяч)российских рублей.\n3. 5.7.', '2. 5.2. Исполнитель обязуется предоставлять в Личномкабинете достоверные данные о характеристиках ПВЗ:адрес, площадь помещения, в которомнепосредственно оказываются Услуги, количествосотрудников Исполнителя в ПВЗ и др. Данные охарактеристиках ПВЗ должны подтверждатьсядокументами в соответствии с п. 3.2. Приложения № 3Договора.\nЗа первое нарушение – 10 000(десять тысяч) российских рублей;за каждое следующее выявленноенарушение – 100 000 (сто тысяч)российских рублей.\n3. 5.7. Исполнитель обязуется на протяжении срока действияДоговора поддерживать состояние ПВЗ в соответствиис требованиями, указанными в Регламенте состоянияПВЗ, в том числе в соответствии с требованиямиБрендбука, проводить за свой счет ремонт внутри ПВЗ.В случае обнаружения Заказчиком несоответствиясостояния ПВЗ указанным требованиям Заказчикпосредством Портала направляет Исполнителютребование о необходимости приведения ПВЗ всостояние, соответствующее требованиям, указанным вРегламенте состояния ПВЗ.', 'Данные охарактеристиках ПВЗ должны подтверждатьсядокументами в соответствии с п. 3.2. Приложения № 3Договора.\nЗа первое нарушение – 10 000(десять тысяч) российских рублей;за каждое следующее выявленноенарушение – 100 000 (сто тысяч)российских рублей.', 'ПЕРЕЧЕНЬ ШТРАФОВ:\n№строки №разделаили пп.Договора\nДоговор ОТВЕТСТВЕННОСТЬ / РАЗМЕРШТРАФОВ\n1. 5.1. Исполнитель обязуется предоставлять достоверные,актуальные сведения о себе и/или сотрудниках (в томчисле, но не ограничиваясь: название организации,номер регистрации в качестве налогоплательщика,телефон, электронная почта), привязанных к Личномукабинету Исполнителя, а также обязуется обеспечитьвозможность телефонной связи с Исполнителем в ПВЗсогласно сведениям, предоставленным в ЛК, в часыработы ПВЗ.\nЗа первое нарушение —предупреждение;за второе нарушение — 5 000 (пятьтысяч) российских рублей;за каждое следующее выявленноенарушение (в том числе:предоставление не верноготелефона, номер телефона недоступен для связи/необслуживается, Исполнитель неотвечает на звонки в течениерабочего дня) и последующие – 10000 (десять тысяч) российскихрублей.\n2. 5.2.', 'За первое нарушение –предупреждение;за каждое следующее выявленноенарушение – 50 000 (пятьдесяттысяч) российских рублей.\n4. 5.8. Исполнитель обязуется использовать рекламно-информационные материалы, содержащие допустимыеЗаказчиком для таких целей фирменные наименование,знак, логотип, шрифты, цвета и их сочетания,изображения, иллюстрации, исключительный переченьи дизайн-макеты которых размещены на сайте:https://pvz.wb.ru/ только для целей оказания Услуг вПВЗ.\n2 500 000 (два миллиона пятьсоттысяч) российских рублей.\n5. 5.9.', 'За первое нарушение - штраф в размере5 000 (пять тысяч) российских рублей;за второе нарушение – штраф в размере10 000 (десять тысяч) российских рублей;за каждое следующее выявленноенарушение – штраф в размере 30 000(тридцать тысяч) российских рублей.\n36 3.17.3.3.17.6.3.17.7.\n3.17.3. Исполнитель обязуется самостоятельно иза свой счет установить Систему WB-LOCK навходную дверь ПВЗ, следуя инструкции к СистемеWB-LOCK, а также обеспечить еёработоспособность и функционирование на всёвремя оказания Услуг по Договору.3.17.6.', 'За первое нарушение –предупреждение;за второе нарушение – 3 000 (тритысячи) российских рублей;за третье и последующие нарушения - 5000 (пять тысяч) российских рублей.Если Заказчику будут предъявленыштрафы со стороны государственныхорганов за нарушениезаконодательства, связанного свозрастными ограничениями дляТоваров, Заказчик вправе взыскатьлюбые штрафы, пени и иные убытки сИсполнителя.\n30. 6.2. Исполнитель обязан не реже 1 (одного) раза в 30(тридцать) календарных дней проводитьинвентаризацию Товаров в ПВЗ посредствомПортала с обязательной фиксацией проводимойинвентаризации на камеры видеонаблюдения. Припроведении инвентаризации должны бытьотсканированы (обработаны) штрихкоды всехчислящихся в ПВЗ Товаров, а статусы Товаровдолжны быть отражены на Портале.', 'посредством направления уведомления в ЛК.Общий срок прохождения Аудита ПВЗ не можетпревышать 7 (семи) календарных дней с датыполучения уведомления об Аудите ПВЗ в ЛКИсполнителя. Исполнитель обязуется предоставлять\nЗа невыполнение обязанности,предусмотренной п. 5.14. илинарушении сроков предоставленияматериалов и информации:выявленное впервые —предупреждение;за каждое следующее выявленноенарушение — штраф в размере 10000 (Десять тысяч) российскихрублей.', '9. 5.13. Исполнитель обязуется производить возвратпоступающих в ПВЗ от Заказчика материаловповторного производства (картон и др.),принадлежащих Заказчику.\nПри невозврате материаловповторного производства:за первое нарушение –предупреждение;за второе нарушение – 1 000 (однатысяча) российских рублей;за третье нарушение – штраф вразмере 10 000 (десяти тысяч)российских рублей;за каждое следующее выявленноенарушение – штраф в размере 50000 (пятидесяти тысяч) российскихрублей.\n10. 5.14.', 'В случае если Исполнитель отметилна Портале выдачу ТовараПолучателю, при этом фактическиданный Товар Получателю непередал (фиктивная выдача Товара)– штраф в размере 100% отСтоимости Товара;в иных случаях:за первое нарушение – 5 000 (пятьтысяч) российских рублей;за каждое следующее выявленноенарушение – 10 000 (десять тысяч)российских рублей.\n16. 5.21. Исполнитель обязуется принимать Товар от Продавца ивыдавать Товар Продавцу исключительно в присутствииПродавца либо лица, документально уполномоченногоПродавцом на передачу или приемку такого Товара, подкамерами видеонаблюдения, установленными в ПВЗ.\nЗа первое нарушение –предупреждение;за каждое следующее выявленноенарушение – 100 000 (сто тысяч)российских рублей.\n17. 5.22. Исполнитель обязуется в любое время прибытиятранспортного средства с Товаром к ПВЗ в часы работыПВЗ принимать от Заказчика/Перевозчика/Продавца ипередавать Товар Заказчику/Перевозчику/Продавцу.\nЗа первое нарушение –предупреждение;за каждое следующее выявленноенарушение 30 000 (тридцать тысяч)российских рублей.']",Ответ: За первое нарушение требований по предоставлению достоверных данных о характеристиках ПВЗ предусмотрен штраф в размере 10 000 (десять тысяч) российских рублей.,1.0,1.0,0.9999999999666667
"Какие штрафы предусмотрены за первое, второе и каждое последующее нарушение по п. 5.13, связанное с невозвратом материалов повторного производства?","['9. 5.13. Исполнитель обязуется производить возвратпоступающих в ПВЗ от Заказчика материаловповторного производства (картон и др.),принадлежащих Заказчику.\nПри невозврате материаловповторного производства:за первое нарушение –предупреждение;за второе нарушение – 1 000 (однатысяча) российских рублей;за третье нарушение – штраф вразмере 10 000 (десяти тысяч)российских рублей;за каждое следующее выявленноенарушение – штраф в размере 50000 (пятидесяти тысяч) российскихрублей.\n10. 5.14.', '9. 5.13. Исполнитель обязуется производить возвратпоступающих в ПВЗ от Заказчика материаловповторного производства (картон и др.),принадлежащих Заказчику.\nПри невозврате материаловповторного производства:за первое нарушение –предупреждение;', '5.14. илинарушении сроков предоставленияматериалов и информации:выявленное впервые —предупреждение;за каждое следующее выявленноенарушение — штраф в размере 10000 (Десять тысяч) российскихрублей.', 'Товара), в целяхобеспечения сохранности Товаров притранспортировке и доставке;\nПри неоказании Исполнителем услуги поподготовке Товаров к возврату:за первое нарушение –предупреждение;за второе нарушение – 10 000 (десятьтысяч) российских рублей;за каждое следующее выявленноенарушение – 30 000 (тридцать тысяч)российских рублей;Исключением для применения\n\n№строки №разделаили пп.Договора\nПриложение №2 (Правила оказания услуг) ОТВЕТСТВЕННОСТЬ / РАЗМЕРШТРАФОВ\nответственности являются случаи, когдау Исполнителя отсутствует материал дляупаковки на ПВЗ, но не более, чем 2(два) рабочих дня.\n25. 3.4. При оказании услуг по подготовке Товара к возвратуИсполнитель должен действовать в соответствии сПоручением Заказчика, в том числе, соблюдатьправила и инструкции по подготовке к возврату,находящиеся на Портале, осуществлять корректнуюподготовку Товаров, исключать случаи неправильносделанной упаковки (использование неверныхсейф-пакетов или не верная перестикеровка и т.п.', 'За первое нарушение –предупреждение;за второе нарушение – 1 000 (однатысяча) российских рублей;за третье нарушение – штраф вразмере 10 000 (десяти тысяч)российских рублей;за каждое следующее выявленноенарушение – штраф в размере 50000 (пятидесяти тысяч) российскихрублей.\n12. 5.17.', 'За первое нарушение –предупреждение;за второе нарушение – 5 000 (пятьтысяч) российских рублей;за каждое следующее выявленноенарушение – 10 000 (десять тысяч)российских рублей.', 'За первое нарушение –предупреждение;за второе нарушение – 50 000(пятьдесят тысяч) российскихрублей;за каждое следующее выявленноенарушение – 100 000 (сто тысяч)российских рублей.', 'За первое нарушение – предупреждение;за второе нарушение – 10 000 (десятьтысяч) российских рублей;за каждое следующее выявленноенарушение – 30 000 (тридцать тысяч)российских рублей.\n35. 3.15.1.', '№строки №разделаили пп.Договора\nДоговор ОТВЕТСТВЕННОСТЬ / РАЗМЕРШТРАФОВ\nматериалы и информацию, а также исправлятьзамечания в течение этого срока.\n11. 5.15. Исполнитель несет ответственность за повреждение,утрату, утерю, уничтожение, продажу, безвозмезднуюпередачу третьим лицам принадлежащих Заказчику инаходящихся в ПВЗ оборудования, материалов (картони иное), предназначенных для обработки Товаров.Исполнитель не вправе использовать получаемые/приобретаемые в соответствии с условиями Договораоборудование, материалы (картон и иное) длясобственных предпринимательских целей и в своихинтересах.\nЗа первое нарушение –предупреждение;за второе нарушение – 1 000 (однатысяча) российских рублей;за третье нарушение – штраф вразмере 10 000 (десяти тысяч)российских рублей;за каждое следующее выявленноенарушение – штраф в размере 50000 (пятидесяти тысяч) российскихрублей.\n12. 5.17.', '5.13. Исполнитель обязуется производить возврат поступающих в ПВЗ от Заказчика материалов повторного\nпроизводства (картон и иное), принадлежащих Заказчику.\n\n5.14.']","Ответ:  
За первое нарушение — предупреждение;  
за второе нарушение — 1 000 (одна тысяча) российских рублей;  
за каждое следующее нарушение — штраф в размере 50 000 (пятьдесят тысяч) российских рублей.",0.3333333333333333,0.638525963516148,0.699999999965
"Какой штраф предусмотрен за нарушение обязательств по хранению данных с камер видеонаблюдения и записи монитора компьютера сотрудника Исполнителя, если такое нарушение выявлено?","['обеспечивает хранение данных с камервидеонаблюдения, расположенных в клиентских зонах,а также записи монитора компьютера сотрудникаИсполнителя, в облачном хранилище провайдеравидеонаблюдения, используя видеосервисы, которые\nЗа каждое выявленное нарушение –10 000 (десять тысяч) российскихрублей.', '9.1 Договора.9.1.3. Исполнитель обеспечивает хранение данных скамер видеонаблюдения в ПВЗ, а также записимонитора компьютера сотрудника Исполнителя воблачном хранилище провайдера видеонаблюдения втечение не менее 90 (девяноста) календарных дней впериод действия Договора, а также в срок не менее 90(девяноста) календарных дней с даты прекращениядействия Договора, используя видеосервисы,представленные в Регламенте состояния ПВЗ.Исполнитель, оказывающий услуги в ПВЗ,расположенном на территории Республики Беларусь,обеспечивает хранение данных с камервидеонаблюдения, расположенных в клиентских зонах,а также записи монитора компьютера сотрудникаИсполнителя, в облачном хранилище провайдеравидеонаблюдения, используя видеосервисы, которые\nЗа каждое выявленное нарушение –10 000 (десять тысяч) российскихрублей.', 'В случае отсутствия в представленныхИсполнителем видеоматериалах сведений о дате ивремени совершения видеозаписи и/или в случае, еслиустановленные на камере видеонаблюдения дата ивремя (часы и минуты) не соответствуют реальной датеили времени, указанной на Портале, видеоматериалысчитаются не предоставленными Исполнителем. Запервое нарушение – предупреждение;за каждое следующее выявленное нарушение – 10 000(десять тысяч) российских рублей.\nЗа первое нарушение –предупреждение;за каждое следующее выявленноенарушение – 10 000 (десять тысяч)российских рублей.\n21. Раздел 10Нарушение Исполнителем обязательств,установленных разделом 10 Договора (Обработкаперсональных данных).\nЗа первое нарушение –предупреждение;за второе нарушение – 50 000(пятьдесят тысяч) российскихрублей;за каждое следующее выявленноенарушение – 100 000 (сто тысяч)российских рублей.\n\n№строки №разделаили пп.Договора\nПриложение №2 (Правила оказания услуг) ОТВЕТСТВЕННОСТЬ / РАЗМЕРШТРАФОВ\n22. 2.2, 2.2.1.2.2.', 'Исполнитель, оказывающий услуги в ПВЗ, расположенном на территории Республики Беларусь, обеспечивает\nхранение данных с камер видеонаблюдения, расположенных в клиентских зонах, а также записи монитора\nкомпьютера сотрудника Исполнителя, в облачном хранилище провайдера видеонаблюдения, используя\nвидеосервисы, которые представлены в Регламенте Состояния ПВЗ, в течение не более 30 (тридцати) календарных\nдней в период срока действия Договора и не более 30 (тридцати) календарных дней с даты прекращения срока\nдействия Договора.\n9.1.4. Исполнитель обязан проверять ежедневно до начала работы и приема/обработки Товаров работу всех\nкамер видеонаблюдения, которые всегда должны быть подключены к электросети и сети Интернет, и корректность\nданных на видеозаписи (дата и время), которые должны соответствовать реальным дате и времени, указанным на\nПортале.\n9.1.5. Допускается использование только одного провайдера сервиса видеонаблюдения для одного ПВЗ.\n\n9.1.6.', 'В случае отсутствия в представленныхИсполнителем видеоматериалах сведений о дате ивремени совершения видеозаписи и/или в случае, еслиустановленные на камере видеонаблюдения дата ивремя (часы и минуты) не соответствуют реальной датеили времени, указанной на Портале, видеоматериалысчитаются не предоставленными Исполнителем. Запервое нарушение – предупреждение;за каждое следующее выявленное нарушение – 10 000(десять тысяч) российских рублей.', 'Исполнитель, оказывающий услуги в ПВЗ, расположенном на территории Республики Беларусь, обеспечивает\nхранение данных с камер видеонаблюдения, расположенных в клиентских зонах, а также записи монитора\nкомпьютера сотрудника Исполнителя, в облачном хранилище провайдера видеонаблюдения, используя\nвидеосервисы, которые представлены в Регламенте Состояния ПВЗ, в течение не более 30 (тридцати) календарных\nдней в период срока действия Договора и не более 30 (тридцати) календарных дней с даты прекращения срока\nдействия Договора.', '9.1 Договора.9.1.3. Исполнитель обеспечивает хранение данных скамер видеонаблюдения в ПВЗ, а также записимонитора компьютера сотрудника Исполнителя воблачном хранилище провайдера видеонаблюдения втечение не менее 90 (девяноста) календарных дней впериод действия Договора, а также в срок не менее 90(девяноста) календарных дней с даты прекращениядействия Договора, используя видеосервисы,представленные в Регламенте состояния ПВЗ.Исполнитель, оказывающий услуги в ПВЗ,расположенном на территории Республики Беларусь,', '9.1 Договора.\n9.1.3. Исполнитель обеспечивает хранение данных с камер видеонаблюдения в ПВЗ, а также записи монитора\nкомпьютера сотрудника Исполнителя в облачном хранилище провайдера видеонаблюдения в течение не менее 90\n(девяноста) календарных дней в период действия Договора, а также в срок не менее 90 (девяноста) календарных\nдней с даты прекращения действия Договора, используя видеосервисы, представленные в Регламенте состояния\nПВЗ.', 'Камеры должны охватывать всю площадь ПВЗ, складскую и клиентскую зоны, зоны осуществления приемки,\nотправки Товаров, подготовки Товаров к возврату, в том числе в Возвратные коробки. Стороны согласовали, что стол\nподготовки Товаров к возврату — это стол, оборудованный камерой и дополнительным светом для видеофиксации\nдействий с Товарами. Все оборудование крепится к столу посредством специального кронштейна.\n9.1.2. Исполнитель обязуется подключить инструмент (программу для ЭВМ) для записи монитора сотрудника\nИсполнителя, который предоставляется провайдерами видеонаблюдения согласно п. 9.1 Договора.\n9.1.3. Исполнитель обеспечивает хранение данных с камер видеонаблюдения в ПВЗ, а также записи монитора\nкомпьютера сотрудника Исполнителя в облачном хранилище провайдера видеонаблюдения в течение не менее 90\n(девяноста) календарных дней в период действия Договора, а также в срок не менее 90 (девяноста) календарных\nдней с даты прекращения действия Договора, используя видеосервисы, представленные в Регламенте состояния\nПВЗ.', 'Исполнитель, оказывающий услуги в ПВЗ, расположенном на территории Республики Беларусь, обеспечивает\nхранение данных с камер видеонаблюдения, расположенных в клиентских зонах, а также записи монитора\nкомпьютера сотрудника Исполнителя,']","Ответ: За нарушение обязательств по хранению данных с камер видеонаблюдения и записи монитора компьютера сотрудника Исполнителя, если такое нарушение выявлено, предусмотрен штраф в размере 10 000 (десять тысяч) российских рублей за каждое следующее выявленное нарушение после первого.",0.75,0.9930059526250726,0.94999999997625
"Какие последствия наступают, если видеоматериалы, предоставленные Исполнителем, не содержат информации о дате и времени видеозаписи или если дата и время на камере не соответствуют реальному времени, указанному на Портале?","['В случае отсутствия в представленныхИсполнителем видеоматериалах сведений о дате ивремени совершения видеозаписи и/или в случае, еслиустановленные на камере видеонаблюдения дата ивремя (часы и минуты) не соответствуют реальной датеили времени, указанной на Портале, видеоматериалысчитаются не предоставленными Исполнителем. Запервое нарушение – предупреждение;за каждое следующее выявленное нарушение – 10 000(десять тысяч) российских рублей.', 'В случае отсутствия в представленныхИсполнителем видеоматериалах сведений о дате ивремени совершения видеозаписи и/или в случае, еслиустановленные на камере видеонаблюдения дата ивремя (часы и минуты) не соответствуют реальной датеили времени, указанной на Портале,', 'В случае отсутствия в представленныхИсполнителем видеоматериалах сведений о дате ивремени совершения видеозаписи и/или в случае, еслиустановленные на камере видеонаблюдения дата ивремя (часы и минуты) не соответствуют реальной датеили времени, указанной на Портале, видеоматериалысчитаются не предоставленными Исполнителем. Запервое нарушение – предупреждение;за каждое следующее выявленное нарушение – 10 000(десять тысяч) российских рублей.\nЗа первое нарушение –предупреждение;за каждое следующее выявленноенарушение – 10 000 (десять тысяч)российских рублей.\n21. Раздел 10Нарушение Исполнителем обязательств,установленных разделом 10 Договора (Обработкаперсональных данных).\nЗа первое нарушение –предупреждение;за второе нарушение – 50 000(пятьдесят тысяч) российскихрублей;за каждое следующее выявленноенарушение – 100 000 (сто тысяч)российских рублей.\n\n№строки №разделаили пп.Договора\nПриложение №2 (Правила оказания услуг) ОТВЕТСТВЕННОСТЬ / РАЗМЕРШТРАФОВ\n22. 2.2, 2.2.1.2.2.', '9.2.2. В случае отсутствия в представленных Исполнителем видеоматериалах сведений о дате и времени\nсовершения видеозаписи и/или в случае, если установленные на камере видеонаблюдения дата и время (часы и\nминуты) не соответствуют реальной дате или времени, указанной на Портале, видеоматериалы считаются не\nпредоставленными Исполнителем.\n9.3. Исполнитель обеспечивает непрерывную работу камер видеонаблюдения в ПВЗ.', '9.2.2. В случае отсутствия в представленных Исполнителем видеоматериалах сведений о дате и времени\nсовершения видеозаписи и/или в случае, если установленные на камере видеонаблюдения дата и время (часы и\nминуты) не соответствуют реальной дате или времени, указанной на Портале,', '9.2.2. В случае отсутствия в представленных Исполнителем видеоматериалах сведений о дате и времени\nсовершения видеозаписи и/или в случае, если установленные на камере видеонаблюдения дата и время (часы и\nминуты) не соответствуют реальной дате или времени, указанной на Портале, видеоматериалы считаются не\nпредоставленными Исполнителем.\n9.3. Исполнитель обеспечивает непрерывную работу камер видеонаблюдения в ПВЗ. В случае обнаружения\nнеисправности или некорректной работы системы видеонаблюдения Исполнитель обязуется устранить\nнеисправность (организовать устранение) в течение 30 (тридцати) минут с момента ее обнаружения.\n9.4. Меры по организации Исполнителем видеонаблюдения в ПВЗ, по хранению/обработке/копированию/\nпредоставлению Заказчику данных с камер видеонаблюдения, предпринимаются исключительно в целях исполнения\nДоговора, обеспечения сохранности Товаров, контроля за поступлением/передвижением Товаров в ПВЗ, а также в\nцелях безопасности лиц, находящихся в ПВЗ.\n9.4.1.', 'Исполнитель обязан проверять ежедневно доначала работы и приема/обработки Товаров работувсех камер видеонаблюдения, которые всегда должныбыть подключены к электросети и сети Интернет, икорректность данных на видеозаписи (дата и время),которые должны соответствовать реальной дате ивремени, указанной на Портале.9.1.6.', 'указанной на Портале, видеоматериалысчитаются не предоставленными Исполнителем. Запервое нарушение – предупреждение;за каждое следующее выявленное нарушение – 10 000(десять тысяч) российских рублей.', 'Исполнитель обязан проверять ежедневно до начала работы и приема/обработки Товаров работу всех\nкамер видеонаблюдения, которые всегда должны быть подключены к электросети и сети Интернет, и корректность\nданных на видеозаписи (дата и время), которые должны соответствовать реальным дате и времени, указанным на\nПортале.', 'В случае, если Исполнитель не предоставит в установленные\nДоговором и обучающим Порталом ( https://edtech.rwb.ru ) сроки видеоматериалы, а также документы, в том\nчисле, но не ограничиваясь выданные государственными органами по месту регистрации Сторон, контролирующими\nвопросы в области чрезвычайных ситуаций, подтверждающие невозможность исполнения обязанностей по Договору\nИсполнителем вследствие чрезвычайных обстоятельств, нарушение считается подтвержденным Исполнителем.']","Если видеоматериалы, предоставленные Исполнителем, не содержат информации о дате и времени видеозаписи или если дата и время на камере не соответствуют реальному времени, указанному на Портале, видеоматериалы считаются не предоставленными Исполнителем. 

За первое нарушение — предупреждение; за каждое следующее выявленное нарушение — 10 000 (десять тысяч) российских рублей.",0.75,0.8015833378261668,0.6805555555328703
Какой штраф предусмотрен за первое нарушение при невозможности считывания маркировки КИЗ Товара?,"['В случае невозможности считываниямаркировки КИЗ Товара по причине ее отсутствия,повреждения, либо наличия иныхидентификационных знаков/этикеток, нанесенныхповерх маркировки КИЗ, Исполнитель обязуетсясообщить Заказчику посредством Портала оневозможности считывания такой маркировки КИЗТовара с предоставлением фотоматериалов,подтверждающих невозможность считывания.\nЗа первое нарушение –предупреждение;за каждое следующее выявленноенарушение – 10 000 (десять тысяч)российских рублей.\n23. 2.4, 2.4.1,2.4.2.', '2.2, 2.2.1.2.2. Исполнитель обязан осуществить приемкуТоваров, полученных им в ПВЗ, путем считыванияштрих-кодов и маркировок КИЗ (контрольно-идентификационные знаки) Товаров и направлениесведений о таком считывании Заказчикупосредством Портала.2.2.1. В случае невозможности считываниямаркировки КИЗ Товара по причине ее отсутствия,повреждения, либо наличия иныхидентификационных знаков/этикеток, нанесенныхповерх маркировки КИЗ, Исполнитель обязуетсясообщить Заказчику посредством Портала оневозможности считывания такой маркировки КИЗТовара с предоставлением фотоматериалов,подтверждающих невозможность считывания.\nЗа первое нарушение –предупреждение;за каждое следующее выявленноенарушение – 10 000 (десять тысяч)российских рублей.\n23. 2.4, 2.4.1,2.4.2.', 'В случае невозможности считываниямаркировки КИЗ Товара по причине ее отсутствия,повреждения, либо наличия иныхидентификационных знаков/этикеток, нанесенныхповерх маркировки КИЗ,', 'За первое нарушение –предупреждение;за второе нарушение – 3 000 (тритысячи) российских рублей;за третье и последующие нарушения - 5000 (пять тысяч) российских рублей.Если Заказчику будут предъявленыштрафы со стороны государственныхорганов за нарушениезаконодательства, связанного свозрастными ограничениями дляТоваров, Заказчик вправе взыскатьлюбые штрафы, пени и иные убытки сИсполнителя.\n30. 6.2. Исполнитель обязан не реже 1 (одного) раза в 30(тридцать) календарных дней проводитьинвентаризацию Товаров в ПВЗ посредствомПортала с обязательной фиксацией проводимойинвентаризации на камеры видеонаблюдения. Припроведении инвентаризации должны бытьотсканированы (обработаны) штрихкоды всехчислящихся в ПВЗ Товаров, а статусы Товаровдолжны быть отражены на Портале.', '2.2.1. В случае невозможности считывания маркировки КИЗ Товара по причине ее отсутствия, повреждения,\nлибо наличия иных идентификационных знаков/этикеток, нанесенных поверх маркировки КИЗ, Исполнитель\nобязуется сообщить Заказчику посредством Портала о невозможности считывания такой маркировки КИЗ Товара с\nпредоставлением фотоматериалов, подтверждающих невозможность считывания.\n2.3. Момент приемки Товаров Исполнителем в ПВЗ и момент предоставления Исполнителем сведений об\nобработке Товаров, а также данные об этих показателях фиксируются на Портале.', '2.2.1. В случае невозможности считывания маркировки КИЗ Товара по причине ее отсутствия, повреждения,\nлибо наличия иных идентификационных знаков/этикеток, нанесенных поверх маркировки КИЗ, Исполнитель\nобязуется сообщить Заказчику посредством Портала о невозможности считывания такой маркировки КИЗ Товара с\nпредоставлением фотоматериалов, подтверждающих невозможность считывания.\n2.3. Момент приемки Товаров Исполнителем в ПВЗ и момент предоставления Исполнителем сведений об\nобработке Товаров, а также данные об этих показателях фиксируются на Портале. Стороны признают, что для целей\nрасчета статистики своевременной обработки Товаров используются исключительно данные об указанных\nпоказателях, хранящиеся на Портале.\n2.4.', '2.2.1. В случае невозможности считывания маркировки КИЗ Товара по причине ее отсутствия, повреждения,\nлибо наличия иных идентификационных знаков/этикеток, нанесенных поверх маркировки КИЗ,', 'В случае если Исполнитель отметилна Портале выдачу ТовараПолучателю, при этом фактическиданный Товар Получателю непередал (фиктивная выдача Товара)– штраф в размере 100% отСтоимости Товара;в иных случаях:за первое нарушение – 5 000 (пятьтысяч) российских рублей;', 'За первое нарушение - штраф в размере5 000 (пять тысяч) российских рублей;за второе нарушение – штраф в размере10 000 (десять тысяч) российских рублей;', 'нанесенныхповерх маркировки КИЗ, Исполнитель обязуетсясообщить Заказчику посредством Портала оневозможности считывания такой маркировки КИЗТовара с предоставлением фотоматериалов,подтверждающих невозможность считывания.']",Ответ: За первое нарушение при невозможности считывания маркировки КИЗ Товара предусмотрен штраф в размере 5 000 (пять тысяч) российских рублей.,0.0,0.9936487020544317,0.17361111110243055
"Какие штрафы применяются за нарушение условий подготовки и передачи возвратных коробок, и как они зависят от количества нарушений?","['При непредъявлении Получателем кодадля получения, выдача не производится.\nЗа первое нарушение любого изобязательств в пункте —предупреждение;за каждое следующее выявленноенарушение — 10 000 (Десять тысяч)российских рублей.\n39 3.4 Исполнитель обязуется подготовить для передачи инаправить на Склад Возвратные коробки сОтправлениями WB Track в течение 24 (двадцатичетырех) часов с момента приемки Отправления WBTrack.\nЗа первое нарушение любой изобязанности — в размере 100% (стапроцентов) от Объявленнойценности Отправления WB Track;за второе и последующиенарушения — 120% (сто двадцатьпроцентов) от Объявленнойценности Отправления WB Track;\n40 3.6 Исполнитель обязуется подготовить для передачи инаправить на Склад Возвратные коробки сОтправлениями WB Track в течение 24 (двадцатичетырех) часов с момента приемки Отправления WBTrack.\nПри неоказании Исполнителемуслуги WB Track:за первое нарушение —предупреждение;за второе нарушение — 5 000 (пятьтысяч) российских рублей;за каждое следующее выявленноенарушение — 10 000 (десять тысяч)российских рублей.', 'Товара), в целяхобеспечения сохранности Товаров притранспортировке и доставке;\nПри неоказании Исполнителем услуги поподготовке Товаров к возврату:за первое нарушение –предупреждение;за второе нарушение – 10 000 (десятьтысяч) российских рублей;за каждое следующее выявленноенарушение – 30 000 (тридцать тысяч)российских рублей;Исключением для применения\n\n№строки №разделаили пп.Договора\nПриложение №2 (Правила оказания услуг) ОТВЕТСТВЕННОСТЬ / РАЗМЕРШТРАФОВ\nответственности являются случаи, когдау Исполнителя отсутствует материал дляупаковки на ПВЗ, но не более, чем 2(два) рабочих дня.\n25. 3.4. При оказании услуг по подготовке Товара к возвратуИсполнитель должен действовать в соответствии сПоручением Заказчика, в том числе, соблюдатьправила и инструкции по подготовке к возврату,находящиеся на Портале, осуществлять корректнуюподготовку Товаров, исключать случаи неправильносделанной упаковки (использование неверныхсейф-пакетов или не верная перестикеровка и т.п.', 'За первое нарушение любой изобязанности — в размере 100% (стапроцентов) от Объявленнойценности Отправления WB Track;за второе и последующиенарушения — 120% (сто двадцатьпроцентов) от Объявленнойценности Отправления WB Track;\n40 3.6 Исполнитель обязуется подготовить для передачи инаправить на Склад Возвратные коробки сОтправлениями WB Track в течение 24 (двадцатичетырех) часов с момента приемки Отправления WBTrack.', 'Если Возвратныекоробки будут находиться в Складской зоне ПВЗ,Товары будут считаться не подготовленными длявозврата на Склад.Исполнитель несет ответственность в соответствиис Приложением № 4 Договора, также в случае, еслиневерный Товар вложен в Возвратную коробку, т.е.Товар, не предназначенный к возврату из ПВЗ наСклад.2.4.2. Факт передачи Исполнителю Товаров ипередачи Исполнителем возвращаемых илиневостребованных Товаров отражается на Порталена основании данных, полученных Заказчиком отИсполнителя в порядке, предусмотренномнастоящим разделом. Стороны признают, чтоданные на Портале являются достаточным инадлежащим доказательством факта передачиИсполнителю Товаров.\nШтраф в размере 100% (ста процентов)от Стоимости Товара,за второе и каждое следующеенарушение – в размере 120% отСтоимости Товара.\n24. 3.1. Если это указано в соответствующих Поручениях, тоИсполнитель обязуется оказывать услуги поподготовке Товаров к возврату, которая можетвключать в себя, как упаковку Товара в сейф-пакет сиспользованием стикера, так и перестикеровку(наклейку стикера на уже имеющийся пакет,коробку, упаковку и т.п.', 'Товара), в целяхобеспечения сохранности Товаров притранспортировке и доставке;\nПри неоказании Исполнителем услуги поподготовке Товаров к возврату:за первое нарушение –предупреждение;за второе нарушение – 10 000 (десятьтысяч) российских рублей;за каждое следующее выявленноенарушение – 30 000 (тридцать тысяч)российских рублей;Исключением для применения\n\n№строки №разделаили пп.Договора\nПриложение №2 (Правила оказания услуг) ОТВЕТСТВЕННОСТЬ / РАЗМЕРШТРАФОВ\nответственности являются случаи,', 'При непредъявлении Получателем кодадля получения, выдача не производится.\nЗа первое нарушение любого изобязательств в пункте —предупреждение;за каждое следующее выявленноенарушение — 10 000 (Десять тысяч)российских рублей.\n39 3.4 Исполнитель обязуется подготовить для передачи инаправить на Склад Возвратные коробки сОтправлениями WB Track в течение 24 (двадцатичетырех) часов с момента приемки Отправления WBTrack.', 'За каждое второе нарушение, помимоудержания стоимости услуги, приформировании возвратного коробаневерно после полученияпредупреждения — 10 000 (десятьтысяч) российских рублей.\n26. 4.2.', '9. 5.13. Исполнитель обязуется производить возвратпоступающих в ПВЗ от Заказчика материаловповторного производства (картон и др.),принадлежащих Заказчику.\nПри невозврате материаловповторного производства:за первое нарушение –предупреждение;за второе нарушение – 1 000 (однатысяча) российских рублей;за третье нарушение – штраф вразмере 10 000 (десяти тысяч)российских рублей;за каждое следующее выявленноенарушение – штраф в размере 50000 (пятидесяти тысяч) российскихрублей.\n10. 5.14.', 'За первое нарушение –предупреждение;за второе нарушение – 3 000 (тритысячи) российских рублей;за третье и последующие нарушения - 5000 (пять тысяч) российских рублей.Если Заказчику будут предъявленыштрафы со стороны государственныхорганов за нарушениезаконодательства, связанного свозрастными ограничениями дляТоваров, Заказчик вправе взыскатьлюбые штрафы, пени и иные убытки сИсполнителя.\n30. 6.2.', 'Штрафы применяются кИсполнителю каждые 7 (семь)календарных дней до датыснижения доли Подмен в ОборотеПВЗ до уровня менее 0,4% (ноляцелых четырех десятых процента) отОборота ПВЗ.Б) Ответственность/штрафприменяются в зависимости от долиЗависших Товаров в Обороте ПВЗ запоследние 30 (Тридцать)календарных дней, котораяучитывается Заказчиком, и еслисоставляет:\n\n№строки №разделаили пп.Договора\nДоговор ОТВЕТСТВЕННОСТЬ / РАЗМЕРШТРАФОВ\n(i) от 0,']","**Ответ:**

За нарушение условий подготовки и передачи возвратных коробок применяются следующие штрафы:

1. **За первое нарушение** любой из обязанностей по подготовке и передаче возвратных коробок:
   - **Предупреждение** (в случае нарушения условий подготовки Товара к возврату, включая неправильную упаковку или перестикеровку).
   - **В случае неоказания услуги WB Track** — предупреждение.

2. **За второе нарушение**:
   - **10 000 (десять тысяч) российских рублей** (в случае неоказания услуги WB Track).
   - **10 000 (десять тысяч) российских рублей** (в случае несвоевременной передачи возвратных коробок на склад).
   - **10 000 (десять тысяч) российских рублей** (в случае несвоевременной передачи возвратных коробок на склад после получения предупреждения).

3. **За каждое следующее нарушение** (третье и последующие):
   - **10 000 (десять тысяч) российских рублей** (в случае несвоевременной передачи возвратных коробок на склад).
   - **30 000 (тридцать тысяч) российских рублей** (в случае неоказания услуги по подготовке Товара к возврату).
   - **10 000 (десять тысяч) российских рублей** (в случае несвоевременной передачи возвратных коробок на склад после получения предупреждения).

**Зависимость от количества нарушений:**
- **Первое нарушение** — предупреждение.
- **Второе нарушение** — штраф в размере 10 000 рублей.
- **Третье и последующие нарушения** — штраф в размере 10 000 или 30 000 рублей в зависимости от конкретного нарушения.",0.35294117647058826,0.9736072545296369,
"Какой штраф предусмотрен за повторное нарушение при формировании возвратного короба неправильно после получения первого предупреждения, и как он соотносится с штрафом за второе нарушение при невыдаче полиэтиленового пакета?","['За каждое второе нарушение, помимоудержания стоимости услуги, приформировании возвратного коробаневерно после полученияпредупреждения — 10 000 (десятьтысяч) российских рублей.\n26. 4.2.', 'не была необходима, неверно отражена информация орасходных материалах, а такжестоимость сейф-пакета в двойномразмере, если такой сейф-пакетнеобходим для повторной подготовкиТовара Заказчиком вследствиенеправильной подготовки ТовараИсполнителем;За каждое второе нарушение, помимоудержания стоимости услуги, приформировании возвратного коробаневерно после полученияпредупреждения — 10 000 (десятьтысяч) российских рублей.\n26. 4.2.', '),а также упаковки в сейф-пакет в тех случаях, когдаона не была указана в Поручении и отражать всистеме корректную информацию об использованиирасходных материалов для подготовки Товаров квозврату. Исполнитель обязуется не допускатьневерного формирования возвратного короба сТоварами, наличие лишних/не нужных вложений вкоробе, не относящихся к Товару, подготовленномук возврату.\nИз Вознаграждения Исполнителявычитается стоимость услуг поподготовке Товаров к возврату вдвойном размере, которая была сделананекорректно, неправильно, сиспользованием неверного упаковочногоматериала, не была необходима, неверно отражена информация орасходных материалах, а такжестоимость сейф-пакета в двойномразмере, если такой сейф-пакетнеобходим для повторной подготовкиТовара Заказчиком вследствиенеправильной подготовки ТовараИсполнителем;За каждое второе нарушение, помимоудержания стоимости услуги, приформировании возвратного коробаневерно после полученияпредупреждения — 10 000 (десятьтысяч) российских рублей.\n26. 4.2.', 'Товара), в целяхобеспечения сохранности Товаров притранспортировке и доставке;\nПри неоказании Исполнителем услуги поподготовке Товаров к возврату:за первое нарушение –предупреждение;за второе нарушение – 10 000 (десятьтысяч) российских рублей;за каждое следующее выявленноенарушение – 30 000 (тридцать тысяч)российских рублей;Исключением для применения\n\n№строки №разделаили пп.Договора\nПриложение №2 (Правила оказания услуг) ОТВЕТСТВЕННОСТЬ / РАЗМЕРШТРАФОВ\nответственности являются случаи, когдау Исполнителя отсутствует материал дляупаковки на ПВЗ, но не более, чем 2(два) рабочих дня.\n25. 3.4. При оказании услуг по подготовке Товара к возвратуИсполнитель должен действовать в соответствии сПоручением Заказчика, в том числе, соблюдатьправила и инструкции по подготовке к возврату,находящиеся на Портале, осуществлять корректнуюподготовку Товаров, исключать случаи неправильносделанной упаковки (использование неверныхсейф-пакетов или не верная перестикеровка и т.п.', '9. 5.13. Исполнитель обязуется производить возвратпоступающих в ПВЗ от Заказчика материаловповторного производства (картон и др.),принадлежащих Заказчику.\nПри невозврате материаловповторного производства:за первое нарушение –предупреждение;за второе нарушение – 1 000 (однатысяча) российских рублей;за третье нарушение – штраф вразмере 10 000 (десяти тысяч)российских рублей;за каждое следующее выявленноенарушение – штраф в размере 50000 (пятидесяти тысяч) российскихрублей.\n10. 5.14.', 'В случае выявления фактов принятияоплаты Исполнителем инымиспособами, помимо предусмотренныхПорталом, в том числе наличнымиденежными средствами:за первое нарушение –предупреждение;за каждое следующее выявленноенарушение – 10 000 (десять тысяч)российских рублей, при этомИсполнитель обязуется также вернутьЗаказчику стоимость Товара, оплатакоторого была принята Исполнителем снарушением условий настоящего пункта.Заказчик вправе удержать СтоимостьТовара при выплате ВознагражденияИсполнителю.\n28. 4.4. Исполнитель обязуется при выдаче ТоваровКлиентам в ПВЗ и путем курьерской доставкипредоставить последнему полиэтиленовый пакет,дизайн, цвет и изображение которого соответствуетуказанным Заказчиком характеристикам, вколичестве, соответствующем указанному вИнструкциях, сделав об этом отметку на Портале.Заказчик предоставляет пакеты Исполнителюсогласно условиям, указанным на Портале.', 'За первое нарушение –предупреждение;за второе нарушение – 1 000 (однатысяча) российских рублей;за третье нарушение – штраф вразмере 10 000 (десяти тысяч)российских рублей;', 'За первое нарушение - штраф в размере5 000 (пять тысяч) российских рублей;за второе нарушение – штраф в размере10 000 (десять тысяч) российских рублей;', 'За первое нарушение –предупреждение;за второе нарушение – 1 000 (однатысяча) российских рублей;за третье нарушение – штраф вразмере 10 000 (десяти тысяч)российских рублей;за каждое следующее выявленноенарушение – штраф в размере 50000 (пятидесяти тысяч) российскихрублей.\n12. 5.17.', 'за второе нарушение – штраф в размере5 000 (пять тысяч) российских рублей;']","Ответ:  
За повторное нарушение при формировании возвратного короба неправильно после получения первого предупреждения предусмотрен штраф в размере 10 000 (десять тысяч) российских рублей.  

Этот штраф соотносится с штрафом за второе нарушение при невыдаче полиэтиленового пакета, который также составляет 5 000 (пять тысяч) российских рублей. Таким образом, штраф за нарушение при формировании возвратного короба выше, чем штраф за второе нарушение при невыдаче полиэтиленового пакета.",0.5,0.8997215352089003,0.59999999997
Какой штраф предусмотрен за первое нарушение правил проверки возраста Клиента при выдаче товаров с возрастными ограничениями?,"['В том числе невыдача / невернаявыдача / выдача без отметки на Порталеили иные нарушения со стороныИсполнителя:за первое нарушение –предупреждение;за второе нарушение – 10 000 (десятьтысяч) российских рублей;за каждое следующее выявленноенарушение – 50 000 (пятьдесят тысяч)российских рублей.\n\n№строки №разделаили пп.Договора\nПриложение №2 (Правила оказания услуг) ОТВЕТСТВЕННОСТЬ / РАЗМЕРШТРАФОВ\n29. 4.6. Исполнитель обязуется осуществить проверкупаспорта Клиента или иных документов,удостоверяющих возраст Клиента при выдачеТоваров, имеющих возрастные ограничения,предусмотренные текущим законодательствомстраны, в которой находится ПВЗ Исполнителя. Вслучае выявления несоответствия возраста,необходимого установленному законодательством,согласно предъявленным документам от Клиента и/или в случае, отказа Клиента от подтверждениявозраста Исполнитель обязан отказать в выдачеТовара Клиенту.', 'За первое нарушение –предупреждение;за второе нарушение – 3 000 (тритысячи) российских рублей;за третье и последующие нарушения - 5000 (пять тысяч) российских рублей.Если Заказчику будут предъявленыштрафы со стороны государственныхорганов за нарушениезаконодательства, связанного свозрастными ограничениями дляТоваров, Заказчик вправе взыскатьлюбые штрафы, пени и иные убытки сИсполнителя.\n30. 6.2.', 'За первое нарушение –предупреждение;за второе нарушение – 3 000 (тритысячи) российских рублей;за третье и последующие нарушения - 5000 (пять тысяч) российских рублей.Если Заказчику будут предъявленыштрафы со стороны государственныхорганов за нарушениезаконодательства, связанного свозрастными ограничениями дляТоваров, Заказчик вправе взыскатьлюбые штрафы, пени и иные убытки сИсполнителя.\n30. 6.2. Исполнитель обязан не реже 1 (одного) раза в 30(тридцать) календарных дней проводитьинвентаризацию Товаров в ПВЗ посредствомПортала с обязательной фиксацией проводимойинвентаризации на камеры видеонаблюдения. Припроведении инвентаризации должны бытьотсканированы (обработаны) штрихкоды всехчислящихся в ПВЗ Товаров, а статусы Товаровдолжны быть отражены на Портале.', 'Если Заказчику будут предъявленыштрафы со стороны государственныхорганов за нарушениезаконодательства, связанного свозрастными ограничениями дляТоваров, Заказчик вправе взыскатьлюбые штрафы, пени и иные убытки сИсполнителя.\n30. 6.2.', '4.6. Исполнитель обязуется осуществить проверкупаспорта Клиента или иных документов,удостоверяющих возраст Клиента при выдачеТоваров, имеющих возрастные ограничения,предусмотренные текущим законодательствомстраны, в которой находится ПВЗ Исполнителя. Вслучае выявления несоответствия возраста,необходимого установленному законодательством,согласно предъявленным документам от Клиента и/или в случае, отказа Клиента от подтверждениявозраста Исполнитель обязан отказать в выдачеТовара Клиенту.', '4.6. Исполнитель обязуется осуществить проверку паспорта Клиента или иных документов, удостоверяющих\nвозраст Клиента при выдаче Товаров, имеющих возрастные ограничения, предусмотренные текущим\nзаконодательством страны, в которой находится ПВЗ Исполнителя. В случае выявления несоответствия возраста,\nнеобходимого установленному законодательством, согласно предъявленным документам от Клиента и/или в случае\nотказа Клиента от подтверждения возраста Исполнитель обязан отказать в выдаче Товара Клиенту.\n5. Продолжительность оказания Услуг\n5.1.', 'За первое нарушение - штраф в размере5 000 (пять тысяч) российских рублей;за второе нарушение – штраф в размере10 000 (десять тысяч) российских рублей;', 'За первое нарушение –предупреждение;за второе нарушение – 1 000 (однатысяча) российских рублей;за третье нарушение – штраф вразмере 10 000 (десяти тысяч)российских рублей;', 'За первое нарушение –предупреждение;за второе нарушение – 1 000 (однатысяча) российских рублей;за третье нарушение – штраф вразмере 10 000 (десяти тысяч)российских рублей;за каждое следующее выявленноенарушение – штраф в размере 50000 (пятидесяти тысяч) российскихрублей.\n12. 5.17.', '9. 5.13. Исполнитель обязуется производить возвратпоступающих в ПВЗ от Заказчика материаловповторного производства (картон и др.),принадлежащих Заказчику.\nПри невозврате материаловповторного производства:за первое нарушение –предупреждение;за второе нарушение – 1 000 (однатысяча) российских рублей;за третье нарушение – штраф вразмере 10 000 (десяти тысяч)российских рублей;за каждое следующее выявленноенарушение – штраф в размере 50000 (пятидесяти тысяч) российскихрублей.\n10. 5.14.']",Ответ: За первое нарушение правил проверки возраста Клиента при выдаче товаров с возрастными ограничениями предусмотрен штраф в размере 1 000 (одна тысяча) российских рублей.,0.0,1.0,0.0
Какой срок установлен для предоставления видеоматериалов с камер видеонаблюдения ПВЗ Заказчику по требованию?,"['6.4. Исполнитель обязуется по требованию Заказчика предоставить видеоматериалы с камер видеонаблюдения,\nустановленных на ПВЗ, в течение 6 (шести) часов с момента направления требования Исполнителю за\nзапрашиваемый Заказчиком период времени.\n6.4.1.', '31. 6.4.6.4.1. Исполнитель обязуется по требованию Заказчикапредоставить видеоматериалы с камервидеонаблюдения, установленных на ПВЗ, втечение 6 (шести) часов с момента направлениятребования Исполнителю за запрашиваемыйЗаказчиком период времени.6.4.1.', '6.4. Исполнитель обязуется потребованию Заказчика предоставитьвидеоматериалы с камервидеонаблюдения, установленных наПВЗ, в течение 6 (шести) часов смомента направления требованияИсполнителю за запрашиваемыйЗаказчиком период времени.6.4.1. Заказчик вправе запрашивать уИсполнителя видеозаписи с камервидеонаблюдения и фотографии вотношении Товаров, указанных вПоручении, подтверждающие любыефакты обработки таких Товаров вконкретном ПВЗ.', '6.4. Исполнитель обязуется потребованию Заказчика предоставитьвидеоматериалы с камервидеонаблюдения, установленных наПВЗ, в течение 6 (шести) часов смомента направления требованияИсполнителю за запрашиваемыйЗаказчиком период времени.6.4.1.', '6.4. Исполнитель обязуется потребованию Заказчика предоставитьвидеоматериалы с камервидеонаблюдения, установленных наПВЗ, в течение 6 (шести) часов смомента направления требованияИсполнителю за запрашиваемыйЗаказчиком период времени.6.4.1. Заказчик вправе запрашивать уИсполнителя видеозаписи с камервидеонаблюдения и фотографии вотношении Товаров, указанных вПоручении, подтверждающие любыефакты обработки таких Товаров вконкретном ПВЗ. Исполнитель обязанпредоставить запрошенныевидеозаписи и/или фотографии втечение 48 (сорока восьми) часов смомента направления Заказчикомзапроса.\n32. 6.6. Исполнитель обязуется не допускать накопления,нагромождения в ПВЗ посторонних предметов имусора. Исполнитель вправе размещать натерритории Клиентской зоны ПВЗ Возвратныекоробки с Товаром и вторсырье (отходыпроизводства и потребления: бумага и картон и т.п.)в собранном, сложенном виде, предназначенноедля возврата Заказчику.Заказчик вправе проводить проверки выполнениятребований данного пункта по своей инициативеили на основании жалоб Клиентов.', 'при которых у Заказчика будет отсутствовать доступ к данным с камер видеонаблюдения,\nИсполнитель обязуется в течение 3 (трех) часов с момента получения запроса Заказчика предоставить\nвидеоматериалы с камер видеонаблюдения, установленных на ПВЗ, за запрашиваемый Заказчиком период времени.', 'В\nслучае если Исполнитель не проводит инвентаризацию Товаров в ПВЗ в установленные настоящим пунктом сроки,\nТовары, числящиеся на ПВЗ, начиная со дня, следующего за последним представленным для инвентаризации днем,\nсчитаются утраченными.\n6.3. Исполнитель обязан предоставлять Заказчику сведения о возможности оказания Услуг, в том числе:\n6.3.1. В течение 3 (трех) календарных дней с момента получения запроса посредством Портала предоставить\nЗаказчику качественные фотоснимки ПВЗ (в соответствии с требованиями и указаниями Заказчика) путем их\nразмещения (загрузки) на Портал по адресу и согласно инструкциям, указанным на Портале и в ЛК, или иным\nопределенным Заказчиком способом.\n\n6.3.2. Предоставить Заказчику полный доступ к камерам видеонаблюдения в ПВЗ в период действия Договора\nс правом обработки/хранения/копирования информации, полученной с камер видеонаблюдения.\n6.4. Исполнитель обязуется по требованию Заказчика предоставить видеоматериалы с камер видеонаблюдения,\nустановленных на ПВЗ, в течение 6 (шести) часов с момента направления требования Исполнителю за\nзапрашиваемый Заказчиком период времени.\n6.4.1.', 'В случае неисполнения или ненадлежащегоисполнения Исполнителем пунктов 9.1, 9.2, 9.3Договора, а также в случае технического сбоя в работекамер видеонаблюдения или при наступлении любыхиных обстоятельств, при которых у Заказчика будетотсутствовать доступ к данным с камервидеонаблюдения, Исполнитель обязуется в течение 3(трех) часов с момента получения запроса Заказчикапредоставить видеоматериалы с камервидеонаблюдения, установленных на ПВЗ, зазапрашиваемый Заказчиком период времени.9.2.1.', '9.1.10. Исполнитель обязуется совершать все действия с Товаром исключительно под камерами\nвидеонаблюдения в ПВЗ, обеспечивая возможность отследить Товар с момента его приемки и до момента его\nвозврата, выдачи или при совершении подготовки Товаров к возврату, в случаях, когда ПВЗ оборудован столом для\nподготовки Товаров к возврату.\n9.2. В случае неисполнения или ненадлежащего исполнения Исполнителем пунктов 9.1, 9.2, 9.3 Договора, а\nтакже в случае технического сбоя в работе камер видеонаблюдения или при наступлении любых иных\nобстоятельств, при которых у Заказчика будет отсутствовать доступ к данным с камер видеонаблюдения,\nИсполнитель обязуется в течение 3 (трех) часов с момента получения запроса Заказчика предоставить\nвидеоматериалы с камер видеонаблюдения, установленных на ПВЗ, за запрашиваемый Заказчиком период времени.\n9.2.1. Запрос о предоставлении видеоматериалов с камер видеонаблюдения ПВЗ может быть направлен\nИсполнителю любым доступным способом, в том числе через ЛК Исполнителя, предусмотренным условиями\nДоговора.\n9.2.2.', 'Заказчик вправе запрашивать у Исполнителявидеозаписи с камер видеонаблюдения ифотографии в отношении Товаров, указанных вПоручении, подтверждающие любые фактыобработки таких Товаров в конкретном ПВЗ.Исполнитель обязан предоставить запрошенныевидеозаписи и/или фотографии в течение 48(сорока восьми) часов с момента направленияЗаказчиком запроса.\n6.4.']","Срок для предоставления видеоматериалов с камер видеонаблюдения ПВЗ Заказчику по требованию составляет **6 (шести) часов** с момента направления требования Исполнителю. 

В случае отсутствия доступа к данным с камер видеонаблюдения или технического сбоя, срок сокращается до **3 (трех) часов** с момента получения запроса Заказчика.",1.0,0.8179941515375477,0.826020408151465
"Какой штраф предусмотрен за первое нарушение правил, не оговоренных в Приложении №2?","['За первое нарушение –предупреждение;за каждое следующее выявленноенарушение – 10 000 (десять тысяч)российских рублей.\n\n№строки №разделаили пп.Договора\nПриложение №2 (Правила оказания услуг) ОТВЕТСТВЕННОСТЬ / РАЗМЕРШТРАФОВ\n33. За иные нарушения Правил оказания услуг, непоименованные в Приложении № 2. За первое нарушение –предупреждение;за второе нарушение – 5 000 (пятьтысяч) российских рублей;за каждое следующее выявленноенарушение – 10 000 (десять тысяч)российских рублей.', 'За первое нарушение –предупреждение;за каждое следующее выявленноенарушение – 10 000 (десять тысяч)российских рублей.\n\n№строки №разделаили пп.Договора\nПриложение №2 (Правила оказания услуг) ОТВЕТСТВЕННОСТЬ / РАЗМЕРШТРАФОВ\n33. За иные нарушения Правил оказания услуг, непоименованные в Приложении № 2. За первое нарушение –предупреждение;за второе нарушение – 5 000 (пятьтысяч) российских рублей;за каждое следующее выявленноенарушение – 10 000 (десять тысяч)российских рублей.\n№строки №разделаили пп.Договора\nПриложение №3 (Регламент состояния ПВЗ) ОТВЕТСТВЕННОСТЬ / РАЗМЕРШТРАФОВ\n34. 3.7.', 'За первое нарушение –предупреждение;за второе нарушение – 1 000 (однатысяча) российских рублей;за третье нарушение – штраф вразмере 10 000 (десяти тысяч)российских рублей;за каждое следующее выявленноенарушение – штраф в размере 50000 (пятидесяти тысяч) российскихрублей.\n12. 5.17.', 'За первое нарушение - штраф в размере5 000 (пять тысяч) российских рублей;за второе нарушение – штраф в размере10 000 (десять тысяч) российских рублей;', 'За первое нарушение –предупреждение;за второе нарушение – 3 000 (тритысячи) российских рублей;за третье и последующие нарушения - 5000 (пять тысяч) российских рублей.', 'За первое нарушение –предупреждение;за второе нарушение – 1 000 (однатысяча) российских рублей;за третье нарушение – штраф вразмере 10 000 (десяти тысяч)российских рублей;', 'первое нарушение –предупреждение\nВторое и последующеевыявленное нарушение - 10 000(десять тысяч) российскихрублей;\n5.4.', 'За первое нарушение – предупреждение;за второе нарушение – 10 000 (десятьтысяч) российских рублей;за каждое следующее выявленноенарушение – 30 000 (тридцать тысяч)российских рублей.\n35. 3.15.1.', 'За первое нарушение –предупреждение;за второе нарушение – 50 000(пятьдесят тысяч) российскихрублей;за каждое следующее выявленноенарушение – 100 000 (сто тысяч)российских рублей.', '№строки №разделаили пп.Договора\nПриложение №2 (Правила оказания услуг) ОТВЕТСТВЕННОСТЬ / РАЗМЕРШТРАФОВ\n33. За иные нарушения Правил оказания услуг, непоименованные в Приложении № 2.']","Ответ: За первое нарушение правил, не оговоренных в Приложении №2, предусмотрен предупреждение.",1.0,0.8527524518229928,
"Какие штрафы предусмотрены за повторные нарушения, связанные с неисправностью Системы WB-LOCK и несвоевременным уведомлением Заказчика?","['Не установление Системы WB-LOCK втечение 10 (десяти) календарных дней смомента её передачи ЗаказчикомИсполнителю, не обеспечениеработоспособности и функционированияСистемы WB-LOCK во время оказанияуслуг по Договору, не уведомлениеЗаказчика в случае выхода из строяСистемы WB-LOCK или отдельныхкомплектующих, в течение 24 (двадцатичетырех) часов с момента обнаружениянеисправности:За первое выявленное нарушение –предупреждение;за второе нарушение – штраф в размере5 000 (пять тысяч) российских рублей;', 'Не установление Системы WB-LOCK втечение 10 (десяти) календарных дней смомента её передачи ЗаказчикомИсполнителю, не обеспечениеработоспособности и функционированияСистемы WB-LOCK во время оказанияуслуг по Договору, не уведомлениеЗаказчика в случае выхода из строяСистемы WB-LOCK или отдельныхкомплектующих, в течение 24 (двадцатичетырех) часов с момента обнаружениянеисправности:За первое выявленное нарушение –предупреждение;за второе нарушение – штраф в размере5 000 (пять тысяч) российских рублей;за третье нарушение – штраф в размере10 000 (десять тысяч) российских рублей.\n\n№строки №разделаили пп.Договора\nПриложение №5 (Услуга WB Track) ОТВЕТСТВЕННОСТЬ / РАЗМЕРШТРАФОВ\n37 2.5 При принятии Отправления WB Track для доставки,Исполнитель не обязан осуществлять досмотр ипроверку содержимого Отправления WB Track напредмет работоспособности, внутренней комплектации,количества, наличия явных или скрытых дефектов,чувствительности к температурному воздействию ииных качественных характеристик и пр.', 'За первое нарушение - штраф в размере5 000 (пять тысяч) российских рублей;за второе нарушение – штраф в размере10 000 (десять тысяч) российских рублей;за каждое следующее выявленноенарушение – штраф в размере 30 000(тридцать тысяч) российских рублей.\n36 3.17.3.3.17.6.3.17.7.\n3.17.3. Исполнитель обязуется самостоятельно иза свой счет установить Систему WB-LOCK навходную дверь ПВЗ, следуя инструкции к СистемеWB-LOCK, а также обеспечить еёработоспособность и функционирование на всёвремя оказания Услуг по Договору.3.17.6.', 'не уведомлениеЗаказчика в случае выхода из строяСистемы WB-LOCK или отдельныхкомплектующих, в течение 24 (двадцатичетырех) часов с момента обнаружениянеисправности:За первое выявленное нарушение –предупреждение;', 'В случае обнаружения в процессеэксплуатации Исполнителем некорректной работыСистемы WB-LOCK или её отдельныхкомплектующих, Исполнитель обязан в течение 24(двадцати четырех) часов с момента обнаружениянеисправности сообщить Заказчику посредствомнаправления уведомления через соответствующийраздел в Личном кабинете, согласовав с нимвозможное отключение Системы WB-LOCK довыяснения причин и устранения возможныхнеисправностей.', '3.17.7. В случае обнаружения в процессе эксплуатации Исполнителем некорректной работы Системы WB-LOCK\nили её отдельных комплектующих, Исполнитель обязан в течение 24 (двадцати четырех) часов с момента\nобнаружения неисправности сообщить Заказчику посредством направления уведомления через соответствующий\nраздел в Личном кабинете, согласовав с ним возможное отключение Системы WB-LOCK до выяснения причин и\nустранения возможных неисправностей.\n3.17.7.1.', 'В качестве подтверждения выполнения указанных требований Исполнитель обязан предоставить Заказчику фото- и\nвидеоматериалы в достаточном объеме, для объективной оценки надлежащего исполнения обязательств, с целью\nисполнения п.5.14 Договора.\n3.17.7. В случае обнаружения в процессе эксплуатации Исполнителем некорректной работы Системы WB-LOCK\nили её отдельных комплектующих, Исполнитель обязан в течение 24 (двадцати четырех) часов с момента\nобнаружения неисправности сообщить Заказчику посредством направления уведомления через соответствующий\nраздел в Личном кабинете, согласовав с ним возможное отключение Системы WB-LOCK до выяснения причин и\nустранения возможных неисправностей.\n3.17.7.1. В случае обнаружения Заказчиком производственного брака Системы WB-LOCK, Исполнитель имеет\nправо по согласованию с Заказчиком на безвозмездную замену всей Системы WB-LOCK или отдельных\nкомплектующих Системы WB-LOCK.\n3.17.7.2. Если будет установлено, что Система WB-LOCK была повреждена и/или не функционирует по вине\nИсполнителя, стоимость Системы WB-LOCK, указанная в акте приема-передачи, подлежит компенсации\nИсполнителем.\n\n3.17.8.', 'Исполнители действующих ПВЗустанавливают Систему WB-LOCK в течение 10(десяти) календарных дней с момента её передачиЗаказчиком согласно акту приема-передачи.3.17.7. В случае обнаружения в процессеэксплуатации Исполнителем некорректной работыСистемы WB-LOCK или её отдельныхкомплектующих, Исполнитель обязан в течение 24(двадцати четырех) часов с момента обнаружениянеисправности сообщить Заказчику посредствомнаправления уведомления через соответствующийраздел в Личном кабинете, согласовав с нимвозможное отключение Системы WB-LOCK довыяснения причин и устранения возможныхнеисправностей.', 'Не установление Системы WB-LOCK втечение 10 (десяти) календарных дней смомента её передачи ЗаказчикомИсполнителю, не обеспечениеработоспособности и функционированияСистемы WB-LOCK во время оказанияуслуг по Договору,', '3.17.7.1. В случае обнаружения Заказчиком производственного брака Системы WB-LOCK, Исполнитель имеет\nправо по согласованию с Заказчиком на безвозмездную замену всей Системы WB-LOCK или отдельных\nкомплектующих Системы WB-LOCK.\n3.17.7.2. Если будет установлено, что Система WB-LOCK была повреждена и/или не функционирует по вине\nИсполнителя, стоимость Системы WB-LOCK, указанная в акте приема-передачи, подлежит компенсации\nИсполнителем.\n\n3.17.8.']",Ответ: За первое нарушение — штраф в размере 5 000 (пять тысяч) российских рублей; за второе нарушение — штраф в размере 10 000 (десять тысяч) российских рублей; за каждое следующее выявленное нарушение — штраф в размере 30 000 (тридцать тысяч) российских рублей.,0.0,0.6906493472463061,0.3333333333
"Какие штрафы применяются к Исполнителю в случае неоказания услуги WB Track, если нарушение повторяется более двух раз?","['При неоказании Исполнителемуслуги WB Track:за первое нарушение —предупреждение;за второе нарушение — 5 000 (пятьтысяч) российских рублей;за каждое следующее выявленноенарушение — 10 000 (десять тысяч)российских рублей.', 'При непредъявлении Получателем кодадля получения, выдача не производится.\nЗа первое нарушение любого изобязательств в пункте —предупреждение;за каждое следующее выявленноенарушение — 10 000 (Десять тысяч)российских рублей.\n39 3.4 Исполнитель обязуется подготовить для передачи инаправить на Склад Возвратные коробки сОтправлениями WB Track в течение 24 (двадцатичетырех) часов с момента приемки Отправления WBTrack.\nЗа первое нарушение любой изобязанности — в размере 100% (стапроцентов) от Объявленнойценности Отправления WB Track;за второе и последующиенарушения — 120% (сто двадцатьпроцентов) от Объявленнойценности Отправления WB Track;\n40 3.6 Исполнитель обязуется подготовить для передачи инаправить на Склад Возвратные коробки сОтправлениями WB Track в течение 24 (двадцатичетырех) часов с момента приемки Отправления WBTrack.\nПри неоказании Исполнителемуслуги WB Track:за первое нарушение —предупреждение;за второе нарушение — 5 000 (пятьтысяч) российских рублей;за каждое следующее выявленноенарушение — 10 000 (десять тысяч)российских рублей.', 'Не установление Системы WB-LOCK втечение 10 (десяти) календарных дней смомента её передачи ЗаказчикомИсполнителю, не обеспечениеработоспособности и функционированияСистемы WB-LOCK во время оказанияуслуг по Договору, не уведомлениеЗаказчика в случае выхода из строяСистемы WB-LOCK или отдельныхкомплектующих, в течение 24 (двадцатичетырех) часов с момента обнаружениянеисправности:За первое выявленное нарушение –предупреждение;за второе нарушение – штраф в размере5 000 (пять тысяч) российских рублей;за третье нарушение – штраф в размере10 000 (десять тысяч) российских рублей.\n\n№строки №разделаили пп.Договора\nПриложение №5 (Услуга WB Track) ОТВЕТСТВЕННОСТЬ / РАЗМЕРШТРАФОВ\n37 2.5 При принятии Отправления WB Track для доставки,Исполнитель не обязан осуществлять досмотр ипроверку содержимого Отправления WB Track напредмет работоспособности, внутренней комплектации,количества, наличия явных или скрытых дефектов,чувствительности к температурному воздействию ииных качественных характеристик и пр.', 'Однако,Исполнитель обязан провести проверку внутритарногосодержимого Отправления WB Track на предметсоответствия информации, предоставленной иподтвержденной Отправителем при передачеОтправления WB Track для доставки, а также напредмет отсутствия запрещенных вложений (списокзапрещенных вложений – Дополнение № 1 кПриложению №5 к Договору).\nВ случае, если Исполнительдопустил и Отправление WB Trackсодержало предметы, запрещенныедля отправки согласно Дополнению1 к Приложению № 5, топервое нарушение любого изобязательств в пункте -предупреждение; за каждоеследующее выявленное нарушение– 10 000 (Десять тысяч) российскихрублей.Помимо вышеуказанных штрафов,Заказчик оставляет за собой правопри наличии оснований иподозрений в любой моментвремени обратиться всоответствующиеправоохранительные органы приобнаружении отправки предметов,оборот которых ограничен всоответствии с Дополнением 1 кПриложению № 5.\n38 2.8 Выдача Отправления WB Track производитсяПолучателю, предъявившему QR-код или назвавшемучисловой код для получения Отправления WB Track,полученный в личном кабинете Торговой площадкиПолучателя.', 'За первое нарушение любой изобязанности — в размере 100% (стапроцентов) от Объявленнойценности Отправления WB Track;за второе и последующиенарушения — 120% (сто двадцатьпроцентов) от Объявленнойценности Отправления WB Track;\n40 3.6 Исполнитель обязуется подготовить для передачи инаправить на Склад Возвратные коробки сОтправлениями WB Track в течение 24 (двадцатичетырех) часов с момента приемки Отправления WBTrack.', 'за третье нарушение – штраф в размере10 000 (десять тысяч) российских рублей.\n\n№строки №разделаили пп.Договора\nПриложение №5 (Услуга WB Track) ОТВЕТСТВЕННОСТЬ / РАЗМЕРШТРАФОВ\n37 2.5 При принятии Отправления WB Track для доставки,Исполнитель не обязан осуществлять досмотр ипроверку содержимого Отправления WB Track напредмет работоспособности, внутренней комплектации,количества, наличия явных или скрытых дефектов,чувствительности к температурному воздействию ииных качественных характеристик и пр.', 'за каждоеследующее выявленное нарушение– 10 000 (Десять тысяч) российскихрублей.Помимо вышеуказанных штрафов,Заказчик оставляет за собой правопри наличии оснований иподозрений в любой моментвремени обратиться всоответствующиеправоохранительные органы приобнаружении отправки предметов,оборот которых ограничен всоответствии с Дополнением 1 кПриложению № 5.\n38 2.8 Выдача Отправления WB Track производитсяПолучателю, предъявившему QR-код или назвавшемучисловой код для получения Отправления WB Track,полученный в личном кабинете Торговой площадкиПолучателя.', 'Не установление Системы WB-LOCK втечение 10 (десяти) календарных дней смомента её передачи ЗаказчикомИсполнителю, не обеспечениеработоспособности и функционированияСистемы WB-LOCK во время оказанияуслуг по Договору, не уведомлениеЗаказчика в случае выхода из строяСистемы WB-LOCK или отдельныхкомплектующих, в течение 24 (двадцатичетырех) часов с момента обнаружениянеисправности:За первое выявленное нарушение –предупреждение;за второе нарушение – штраф в размере5 000 (пять тысяч) российских рублей;', 'При наличии у Исполнителя задолженности по оплате стоимости Оборудования в течение 2 (двух) и более\nкалендарных месяцев, Заказчик вправе отключить Исполнителя от Услуги WB Рекламные экраны, остановить\nперечисление дополнительной премии и вернуть Оборудование себе без какого-либо возмещения расходов\nИсполнителю.\n7.3. В случае неисполнения обязательства по возврату Оборудования Исполнитель несет ответственность за\nубытки, причиненные Заказчику, включая, но не ограничиваясь, связанные с потерей, повреждением или\n\nуничтожением Оборудования.', '1.56. Упаковка — индивидуальный транспортировочный сейф-пакет размера S, M, L (далее — сейф-пакеты),\nкартонный короб, картонный конверт и иные виды, и типы, предоставляемые Заказчиком Исполнителю на условиях,\nуказанных на Портале. Для упаковки Отправления WB Track Исполнитель обязан предоставить упаковку\nОтправителю, предварительно просканировав информацию о выдаче упаковки через Портал.\nРаздел 2. Порядок оказания Услуги WB Track\n2.1. Отправление WB Track оформляется путем предоставления Исполнителю информации об Отправителе,\nПолучателе, адресе пункта назначения, габаритах, характере, Объявленной ценности Отправления WB Track и иной\nнеобходимой информации.\n2.2. При приеме и оформлении Отправления WB Track Исполнитель запрашивает у Отправителя QR-код из\nмобильного приложения Торговой площадки. При непредъявлении Отправителем и/или невозможности считать\nуказанный QR-код Услуга WB Track не может быть оказана Исполнителем.\n2.3. Также при передаче Отправления Исполнителю Отправитель называет номер телефона Получателя. В\nслучае если Исполнителю не удается идентифицировать Получателя по номеру телефона при оформлении\nОтправления WB Track, то Отправление WB Track к доставке не принимается.']","Ответ: В случае неоказания услуги WB Track, если нарушение повторяется более двух раз, применяются штрафы в размере 10 000 (десять тысяч) российских рублей за каждое следующее выявленное нарушение.",0.5,0.963922509942473,0.8761904761729524
Какова стоимость услуги по выдаче Отправления WB Track Получателю в сейф-пакете?,"['Раздел 4. Тарифы\n1. Стороны пришли к соглашению дополнить Приложение №1 к Оферте об оказании услуг в ПВЗ «Тарифы»\nследующими пунктами о Тарифах WB Track:\nПриемка Отправления WB Track и передача его на Cклад:\n№Вид/тип ОтправленияСтоимость услуги за 1 ед. Отправления (руб.)\n1. Сейф-пакет размера S25 (двадцать пять) российских рублей за 1 единицу\n2. Сейф-пакет размера M30 (тридцать) российских рублей за 1 единицу\n\n№Вид/тип ОтправленияСтоимость услуги за 1 ед. Отправления (руб.)\n3. Сейф-пакет размера L35 (тридцать пять) российских рублей за 1 единицу\nВыдача Отправления WB Track Получателю — 7 (семь) российских рублей 50 коп. за 1 (Одну) единицу Отправления\nв сейф-пакете.\nПревышение срока нахождения Отправления WB Track в ПВЗ — 7 (семь) российских рублей 50 коп. за 1 (Одну)\nединицу Отправления в сейф-пакете.\nРаздел 5. Ответственность\n1. Исполнитель несет ответственность за сохранность Отправлений WB Track, находящихся в ПВЗ в соответствии с\nнормами и правилами, предусмотренными ст. 11.5.', 'Отправления (руб.)\n3. Сейф-пакет размера L35 (тридцать пять) российских рублей за 1 единицу\nВыдача Отправления WB Track Получателю — 7 (семь) российских рублей 50 коп. за 1 (Одну) единицу Отправления\nв сейф-пакете.', 'Отправления (руб.)\n3. Сейф-пакет размера L35 (тридцать пять) российских рублей за 1 единицу\nВыдача Отправления WB Track Получателю — 7 (семь) российских рублей 50 коп. за 1 (Одну) единицу Отправления\nв сейф-пакете.\nПревышение срока нахождения Отправления WB Track в ПВЗ — 7 (семь) российских рублей 50 коп. за 1 (Одну)\nединицу Отправления в сейф-пакете.\nРаздел 5. Ответственность\n1.', 'Раздел 4. Тарифы\n1. Стороны пришли к соглашению дополнить Приложение №1 к Оферте об оказании услуг в ПВЗ «Тарифы»\nследующими пунктами о Тарифах WB Track:\nПриемка Отправления WB Track и передача его на Cклад:\n№Вид/тип ОтправленияСтоимость услуги за 1 ед. Отправления (руб.)\n1. Сейф-пакет размера S25 (двадцать пять) российских рублей за 1 единицу\n2. Сейф-пакет размера M30 (тридцать) российских рублей за 1 единицу\n\n№Вид/тип ОтправленияСтоимость услуги за 1 ед. Отправления (руб.)\n3.', 'Превышение срока нахождения Отправления WB Track в ПВЗ — 7 (семь) российских рублей 50 коп. за 1 (Одну)\nединицу Отправления в сейф-пакете.\nРаздел 5. Ответственность\n1.', 'Приложение № 5\nк Оферте об оказании услуг в ПВЗ\nУслуга WB Track\n\nПриложение № 5 содержит порядок и условия оказания Услуги WB Track, дополняет Оферту об оказании услуг в ПВЗ\nв части, необходимой для Услуги WB Track, и является обязательным для Исполнителей, оказывающих такую Услугу.\nРаздел 1. Термины и определения Оферты\n1.50. Объявленная ценность – сумма, от 1 000 (одной тысячи) до 50 000 (пятидесяти тысяч) российских\nрублей, которую сообщает Отправитель Исполнителю при оформлении Отправления, определяемая им\nсамостоятельно.\n1.51. Отправитель WB Track или Отправитель — физическое лицо, Клиент Торговой площадки, который\nпередал Исполнителю отправление WB Track для оформления доставки в соответствии с правилами и инструкциями\nи оплатил услугу WB Track.\n1.52. Отправление WB Track — вложения документарного и недокументарного характера, принимаемые в\nиндивидуальных транспортировочных упаковках и пересылаемые в одной оформленной доставке от одного Клиента/\nПолучателя к другому.\n1.53. Получатель Отправления WB Track, или Получатель, — физическое лицо, Клиент Торговой площадки,\nкоторому Отправитель направляет для получения Отправление WB Track.\n1.53.', '1.53. Услуга WB Track – услуга, оказываемая Исполнителем по Договору, в том числе приемка Отправлений WB\nTrack от Отправителя, выдача Получателю Отправления WB Track, подготовка Отправления WB Track к отправке и\nиные действия,', '1.53. Услуга WB Track – услуга, оказываемая Исполнителем по Договору, в том числе приемка Отправлений WB\nTrack от Отправителя, выдача Получателю Отправления WB Track, подготовка Отправления WB Track к отправке и\nиные действия, для которых Исполнитель использует Портал и действует в соответствии с Инструкциями и иными\nдокументами Заказчика, размещенными на Портале.\n1.55. Push-уведомление — уведомление, направляемое в личный кабинет Отправителя на Торговой площадке,\nсодержащее информацию об Отправителе, Получателе Отправления WB Track, адресе пункта назначения,\nгабаритах, характере, Объявленной ценности Отправления WB Track, стоимости доставки и иную информацию, а\nтакже содержащее модальное окно с возможностью согласиться с условиями доставки Отправления WB Track. Push-\nуведомление сохраняется в личном кабинете Отправителя до момента получения Отправления WB Track\nПолучателем или до момента истечения срока хранения Отправления WB Track в случае, если Получатель его не\nзабрал или отказался от его получения.\n1.56.', '1.56. Упаковка — индивидуальный транспортировочный сейф-пакет размера S, M, L (далее — сейф-пакеты),\nкартонный короб, картонный конверт и иные виды, и типы, предоставляемые Заказчиком Исполнителю на условиях,\nуказанных на Портале. Для упаковки Отправления WB Track Исполнитель обязан предоставить упаковку\nОтправителю, предварительно просканировав информацию о выдаче упаковки через Портал.\nРаздел 2. Порядок оказания Услуги WB Track\n2.1. Отправление WB Track оформляется путем предоставления Исполнителю информации об Отправителе,\nПолучателе, адресе пункта назначения, габаритах, характере, Объявленной ценности Отправления WB Track и иной\nнеобходимой информации.\n2.2. При приеме и оформлении Отправления WB Track Исполнитель запрашивает у Отправителя QR-код из\nмобильного приложения Торговой площадки. При непредъявлении Отправителем и/или невозможности считать\nуказанный QR-код Услуга WB Track не может быть оказана Исполнителем.\n2.3. Также при передаче Отправления Исполнителю Отправитель называет номер телефона Получателя. В\nслучае если Исполнителю не удается идентифицировать Получателя по номеру телефона при оформлении\nОтправления WB Track, то Отправление WB Track к доставке не принимается.', '1.56. Упаковка — индивидуальный транспортировочный сейф-пакет размера S, M, L (далее — сейф-пакеты),\nкартонный короб, картонный конверт и иные виды, и типы, предоставляемые Заказчиком Исполнителю на условиях,\nуказанных на Портале. Для упаковки Отправления WB Track Исполнитель обязан предоставить упаковку\nОтправителю, предварительно просканировав информацию о выдаче упаковки через Портал.\nРаздел 2. Порядок оказания Услуги WB Track\n2.1.']",Стоимость услуги по выдаче Отправления WB Track Получателю в сейф-пакете составляет 7 рублей 50 копеек за 1 единицу Отправления.,1.0,1.0,0.9999999999666667
"Какие вещества относятся к категории взрывоопасных, легковоспламеняющихся и самовозгорающихся согласно оферте?","['2. Взрывоопасные, легковоспламеняющиеся и самовозгорающиеся предметы или вещества:\n• пиротехника с I по V классы, хлопушки пиротехнические, бенгальские огни, фонтаны «холодного» огня,\nсалютные батареи, ракеты, фестивальные шары, петарды, патроны звуковые резьбовые (средства пиротехнические)\nот аэрозольного устройства самообороны, пиротехническая бумага (как отдельно, так и в составе других предметов);\n• органические растворители, в том числе: углеводороды (жидкости для розжига, бензин, керосин, уайт-спирит,\nтолуол, петролейный эфир и др.), спирты (этанол, биоэтанол, N-пропанол, изопропанол, бутанол и др.), эфиры\nмуравьиной и уксусной кислот (этилформиат, этилацетат, изопропилацетат, бутилацетат и др.), кетоны (ацетон,\nметилэтилкетон и др.) от 80% и более.', '2. Взрывоопасные, легковоспламеняющиеся и самовозгорающиеся предметы или вещества:\n• пиротехника с I по V классы, хлопушки пиротехнические, бенгальские огни, фонтаны «холодного» огня,\nсалютные батареи, ракеты, фестивальные шары, петарды, патроны звуковые резьбовые (средства пиротехнические)\nот аэрозольного устройства самообороны, пиротехническая бумага (как отдельно, так и в составе других предметов);\n• органические растворители, в том числе: углеводороды (жидкости для розжига,', '2. Взрывоопасные, легковоспламеняющиеся и самовозгорающиеся предметы или вещества:\n• пиротехника с I по V классы, хлопушки пиротехнические, бенгальские огни, фонтаны «холодного» огня,\nсалютные батареи, ракеты, фестивальные шары, петарды,', 'o предметы, содержащие перкарбонат натрия и другие персоли в количестве 30% и более;\n• любые иные горючие жидкости технического характера, способные к самовозгоранию либо к возгоранию при\nконтакте с другими веществами;\n• резина вулканизированная и каучук,', 'натриевая, калиевая,\nмагниевая), карбид кальция (подразумевается собственно такой предмет), цапонлак, известь гашеная и негашеная;\n\n• жидкости, содержащие метанол в любой концентрации.\n3. Токсичные, взрывчатые, ядовитые и радиоактивные вещества.\n4.', 'Вооружение, боеприпасы к нему, взрывчатые вещества, средства взрывания,\nпатроны, порох, включая:\n• оружие огнестрельное, сигнальное, газовое оружие, боеприпасы, холодное оружие (включая метательное),\nэлектрошоковые устройства и искровые разрядники, а также основные части огнестрельного оружия, спецсредства\nтравматического и удерживающего действия;\n• гражданское оружие, для продажи которого требуется лицензия, в том числе:\no арбалеты с усилием натяжения более 43 кгс;\no аэрозольные и другие устройства, снаряженные слезоточивыми или раздражающими веществами, в том\nчисле газовые и перцовые баллончики;\no луки с усилием натяжения более 27 кгс;\no страйкболы и пневматическое оружие с дульной энергией более 3 Дж;\no телескопические дубинки;\no электрошокеры;\no кастеты;\no страйкбольные гранаты;\no муляжи любого оружия, прописанного в абзаце 2 Дополнения № 1.\n\n2.', 'Вооружение, боеприпасы к нему, взрывчатые вещества, средства взрывания,\nпатроны, порох, включая:\n• оружие огнестрельное, сигнальное, газовое оружие, боеприпасы, холодное оружие (включая метательное),\nэлектрошоковые устройства и искровые разрядники, а также основные части огнестрельного оружия, спецсредства\nтравматического и удерживающего действия;\n• гражданское оружие, для продажи которого требуется лицензия, в том числе:\no арбалеты с усилием натяжения более 43 кгс;', 'Вооружение, боеприпасы к нему, взрывчатые вещества, средства взрывания,\nпатроны, порох, включая:\n• оружие огнестрельное, сигнальное, газовое оружие, боеприпасы, холодное оружие (включая метательное),', '13. Прочие опасные предметы:\n• вещества, представляющие опасность для окружающей среды, людей и животных;\n• пищевая продукция, содержащая в своем составе мухоморы;\n• продукция, содержащая психотропные, наркотические, сильнодействующие или ядовитые вещества;\n• ртутные градусники;\n• запрещенные средства ловли и поимки животных: снасти, орудия лова, использование которых запрещено\nдействующим законодательством;\n• устройства для негласного получения информации, а также шифровальная техника;\n• подавители (глушилки) сигнала GPS / Глонасс / Платон / сотовой связи (GSM, LTE, пр.)', '13. Прочие опасные предметы:\n• вещества, представляющие опасность для окружающей среды, людей и животных;\n• пищевая продукция, содержащая в своем составе мухоморы;\n• продукция, содержащая психотропные, наркотические, сильнодействующие или ядовитые вещества;']","Ответ: К категории взрывоопасных, легковоспламеняющихся и самовозгорающихся веществ согласно оферте относятся:

- Пиротехника с I по V классы, хлопушки пиротехнические, бенгальские огни, фонтаны «холодного» огня, салютные батареи, ракеты, фестивальные шары, петарды, патроны звуковые резьбовые (средства пиротехнические) от аэрозольного устройства самообороны, пиротехническая бумага (как отдельно, так и в составе других предметов);
- Органические растворители, в том числе: углеводороды (жидкости для розжига, бензин, керосин, уайт-спирит, толуол, петролейный эфир и др.), спирты (этанол, биоэтанол, N-пропанол, изопропанол, бутанол и др.), эфиры муравьиной и уксусной кислот (этилформиат, этилацетат, изопропилацетат, бутилацетат и др.), кетоны (ацетон, метилэтилкетон и др.) от 80% и более;
- Предметы, содержащие перкарбонат натрия и другие персоли в количестве 30% и более;
- Любые иные горючие жидкости технического характера, способные к самовозгоранию либо к возгоранию при контакте с другими веществами;
- Резина вулканизированная и каучук;
- Жидкости, содержащие метанол в любой концентрации.",1.0,0.9999999999999997,
Какое ограничение установлено по суммарному содержанию органических растворителей в составе товара?,"['от 80% и более. Суммарное содержание всех растворителей в составе не должно превышать\n80%;\n• нашатырный спирт (аммиачная вода) от 10% и более;\n• любые зажигалки, в том числе зажигалки, содержащие в составе бензин или газ (пьезорозжиг). Спички,\nчиркала, баллоны газовые и пропановые заполненные;\n• предметы с активными окисляющими свойствами:\no пероксид водорода (перекись водорода) любой концентрации;\no средства для очистки бассейнов, чистящие и дезинфицирующие средства с содержанием пероксида\nводорода более 12% и объемом более 1 л;\no предметы, содержащие хлорат калия (бертолетову соль);\no предметы, содержащие перкарбонат натрия и другие персоли в количестве 30% и более;\n• любые иные горючие жидкости технического характера, способные к самовозгоранию либо к возгоранию при\nконтакте с другими веществами;\n• резина вулканизированная и каучук, в том числе авто-, мото-, велорезина, цельнолитые резиновые колеса для\nсадовой техники, тачек, тележек, техпластины резиновые, изделия резинотехнические,', 'от 80% и более. Суммарное содержание всех растворителей в составе не должно превышать\n80%;\n• нашатырный спирт (аммиачная вода) от 10% и более;\n• любые зажигалки, в том числе зажигалки, содержащие в составе бензин или газ (пьезорозжиг).', 'от 80% и более. Суммарное содержание всех растворителей в составе не должно превышать\n80%;\n• нашатырный спирт (аммиачная вода) от 10% и более;\n• любые зажигалки, в том числе зажигалки, содержащие в составе бензин или газ (пьезорозжиг). Спички,\nчиркала, баллоны газовые и пропановые заполненные;\n• предметы с активными окисляющими свойствами:\no пероксид водорода (перекись водорода) любой концентрации;\no средства для очистки бассейнов,', '• органические растворители, в том числе: углеводороды (жидкости для розжига,', 'изделия резинотехнические, крошка резиновая и покрытия\nна ее основе;\n• минеральные кислоты: азотная, серная, фтороводородная, хлорная, хлорноватая и хлорноватистая в любой\nконцентрации индивидуально или в составе средств;\n• кислота фосфорная (ортофосфорная) индивидуально или в составе средств в концентрации 76% и выше;\n• органические кислоты индивидуально или в составе средств:\no муравьиная (метановая) индивидуально или в составе средств в концентрации 86% и выше;\no уксусная (этановая) в концентрации 70% и выше, более 200 мл;\no щавелевая (этандионовая) и сульфаминовая в индивидуальном виде более 1000 г;\n• кислота соляная индивидуально или в составе средств в концентрации 16% и выше;\n• формалин;\n• электролит (аккумуляторы, содержащие электролит, под запрет не попадают);\n• гидразин;\n• дымовые шашки;\n• биотопливо жидкое;\n• перкарбонат;\n• сухое горючее, средства для очистки сажи, любая селитра (в том числе аммиачная, натриевая, калиевая,\nмагниевая),', 'o уксусная (этановая) в концентрации 70% и выше, более 200 мл;\no щавелевая (этандионовая) и сульфаминовая в индивидуальном виде более 1000 г;\n• кислота соляная индивидуально или в составе средств в концентрации 16% и выше;\n• формалин;\n• электролит (аккумуляторы, содержащие электролит, под запрет не попадают);\n• гидразин;\n• дымовые шашки;\n• биотопливо жидкое;\n• перкарбонат;\n• сухое горючее, средства для очистки сажи, любая селитра (в том числе аммиачная, натриевая,', 'изделия резинотехнические, крошка резиновая и покрытия\nна ее основе;\n• минеральные кислоты: азотная, серная, фтороводородная, хлорная, хлорноватая и хлорноватистая в любой\nконцентрации индивидуально или в составе средств;\n• кислота фосфорная (ортофосфорная) индивидуально или в составе средств в концентрации 76% и выше;\n• органические кислоты индивидуально или в составе средств:\no муравьиная (метановая) индивидуально или в составе средств в концентрации 86% и выше;', 'o средства для очистки бассейнов, чистящие и дезинфицирующие средства с содержанием пероксида\nводорода более 12% и объемом более 1 л;\no предметы, содержащие хлорат калия (бертолетову соль);\no предметы, содержащие перкарбонат натрия и другие персоли в количестве 30% и более;\n• любые иные горючие жидкости технического характера, способные к самовозгоранию либо к возгоранию при\nконтакте с другими веществами;\n• резина вулканизированная и каучук, в том числе авто-, мото-, велорезина,', 'o уксусная (этановая) в концентрации 70% и выше, более 200 мл;\no щавелевая (этандионовая) и сульфаминовая в индивидуальном виде более 1000 г;\n• кислота соляная индивидуально или в составе средств в концентрации 16% и выше;\n• формалин;', '• кислота фосфорная (ортофосфорная) индивидуально или в составе средств в концентрации 76% и выше;\n• органические кислоты индивидуально или в составе средств:\no муравьиная (метановая) индивидуально или в составе средств в концентрации 86% и выше;']",Ответ: Суммарное содержание всех растворителей в составе не должно превышать 80%.,1.0,0.6991903292375189,0.9999999999666667
Какие товары запрещено хранить или перевозить в ПВЗ Wildberries?,"['м;\n• размещать экобоксы для сбора бывших в употреблении (б/у) вещей и предметов;\n• осуществлять выдачу товаров, полученных от третьих лиц (маркетплейсов, ритейлеров, служб доставки,\nперевозчиков и т.д.), с соблюдением ограничений, установленных п. 5.9 Договора.\n1.2. В ПВЗ запрещается осуществлять следующие виды деятельности:\n• реализацию продуктов питания (за исключением продажи посредством вендингового автомата), алкогольной,\nспиртосодержащей продукции, табачной и никотиносодержащей продукции, табачных изделий, кальянов,', 'м;\n• размещать экобоксы для сбора бывших в употреблении (б/у) вещей и предметов;\n• осуществлять выдачу товаров, полученных от третьих лиц (маркетплейсов, ритейлеров, служб доставки,\nперевозчиков и т.д.), с соблюдением ограничений, установленных п. 5.9 Договора.\n1.2. В ПВЗ запрещается осуществлять следующие виды деятельности:\n• реализацию продуктов питания (за исключением продажи посредством вендингового автомата), алкогольной,\nспиртосодержащей продукции, табачной и никотиносодержащей продукции, табачных изделий, кальянов, устройств\nдля потребления никотиносодержащей продукции; м;\n• лицензируемые виды деятельности, а также продажу товаров, свободный оборот которых запрещается или\nограничивается законодательством страны, в которой расположен ПВЗ;\n• размещение в ПВЗ контрольно-кассовых аппаратов, терминалов и прием наличных/безналичных денежных\nсредств, в том числе посредством денежных переводов любым способом от третьих лиц, за Услуги,\nпредусмотренные Договором или в качестве оплаты за Товары по Договору или любые другие товары;\n2. Порядок получения/возврата Товаров Исполнителем\n2.1.', '5.9 Договора.\n1.2. В ПВЗ запрещается осуществлять следующие виды деятельности:\n• реализацию продуктов питания (за исключением продажи посредством вендингового автомата), алкогольной,\nспиртосодержащей продукции, табачной и никотиносодержащей продукции, табачных изделий, кальянов,', 'Заказчик вправе проводить проверки выполнения требований данного\nпункта по своей инициативе или на основании жалоб Клиентов.\n7. Дополнение № 1 – список регионов места нахождения ПВЗ для п. 2.4.1:\n• Воркута\n• Инта\n• Усинск\n• Печора\n• Салехард\n• Лабытнанги\n• Мужи\n• Яр-Сале\n• Нарьян-Мар\n• Батагай\n• Анадырь\n• Норильск\n• Новая Чара\n• Хандыга\n• Нюрба\n• Сунтар\n• Магадан\n\nПриложение № 3\nк Оферте об оказании услуг в ПВЗ\nРегламент состояния ПВЗ\n1. Навигация по материалам\n1.1. Брендбук – минимальные требования к ПВЗ Заказчика, доступен на сайте Заказчика.\n1.2. Рекламные макеты (доступны на сайте Заказчика):\n• Наклейка «Здесь вы можете получить заказы Wildberries»;\n• Рекламная листовка «Рядом с вами партнерский пункт самовывоза Wildberries»;\n• Наклейка с логотипом Wildberries и иные согласно Брендбуку и сайту Заказчика.\n2.', '3.1.4 Договора.\n1.24. Оборот ПВЗ — это сумма указанных в Поручениях Стоимостей Товаров, выданных в ПВЗ Клиентам и\nКурьерам (для доставки Клиентам), за вычетом суммы розничных цен Клиентских возвратов, выдача которых\nосуществлялась в этом ПВЗ, за период времени, определенный в соответствующем положении Договора.\nВознаграждение Исполнителя рассчитывается за Услуги, оказанные в отношении оплаченного Клиентом Товара.\n1.25. Обязательные условия — обязательные условия при заключении и исполнении договоров с лицом из\nГруппы компаний Вайлдберриз, опубликованные по адресу: https://legal.wildberries.ru/mandatory-\nconditions/country/ru/lang/ru/ являющиеся неотъемлемой частью Договора, если Исполнитель по месту\nгосударственной регистрации находится на территории Российской Федерации.\n1.26. Отчетный период — период, за который рассчитывается вознаграждение, равный одной календарной\nнеделе. Первый Отчётный период отсчитывается с даты Активации ПВЗ по последний день недели. Последний\nОтчётный период отсчитывается с первого дня календарной недели по день расторжения Договора включительно.\n1.27.', '2.5. Исполнитель обязуется принимать от Продавцов Маркетплейс Товары и Товары в Маркетплейс-коробах\n(габариты которых указаны в Поручении на Портале) исключительно в присутствии Продавцов, либо лиц,\nдокументально уполномоченных Продавцами на передачу таких Товаров, под камерами видеонаблюдения,\nустановленными на ПВЗ, и хранить их до передачи Перевозчику для доставки на Склад, выдачи Получателю или\nвозврата Продавцу.', 'Исполнитель несет ответственность в соответствии с Приложением № 4\nДоговора, также в случае, если неверный Товар вложен в Возвратную коробку, т.е. Товар, не предназначенный к\nвозврату из ПВЗ на Склад.\n2.4.2. Факт передачи Исполнителю Товаров и передачи Исполнителем возвращаемых или невостребованных\nТоваров отражается на Портале на основании данных, полученных Заказчиком от Исполнителя в порядке,\nпредусмотренном настоящим разделом. Стороны признают, что данные на Портале являются достаточным и\nнадлежащим доказательством факта передачи Исполнителю Товаров.\n2.5. Исполнитель обязуется принимать от Продавцов Маркетплейс Товары и Товары в Маркетплейс-коробах\n(габариты которых указаны в Поручении на Портале) исключительно в присутствии Продавцов, либо лиц,\nдокументально уполномоченных Продавцами на передачу таких Товаров, под камерами видеонаблюдения,\nустановленными на ПВЗ, и хранить их до передачи Перевозчику для доставки на Склад, выдачи Получателю или\nвозврата Продавцу.', 'Навигация по материалам\n1.1. Брендбук – минимальные требования к ПВЗ Заказчика, доступен на сайте Заказчика.\n1.2. Рекламные макеты (доступны на сайте Заказчика):\n• Наклейка «Здесь вы можете получить заказы Wildberries»;\n• Рекламная листовка «Рядом с вами партнерский пункт самовывоза Wildberries»;\n• Наклейка с логотипом Wildberries и иные согласно Брендбуку и сайту Заказчика.\n2.', 'под камерами видеонаблюдения,\nустановленными на ПВЗ, и хранить их до передачи Перевозчику для доставки на Склад, выдачи Получателю или\nвозврата Продавцу.', '/ сети Wi-Fi.\nСкоропортящиеся продукты питания, а также замороженные и охлажденные пищевые продукты -25 до +16\nградусов Цельсия, требующие специальных условий хранения и транспортировки, а также продукты с общим сроком\nгодности до 3 месяцев.\n15. Любые иные предметы, оборот которых запрещен или ограничен на территории Российской\nФедерации.']","Ответ: Запрещено хранить или перевозить в ПВЗ Wildberries следующие товары:

- Продукты питания (за исключением продажи посредством вендингового автомата);
- Алкогольную, спиртосодержащую продукцию;
- Табачную и никотиносодержащую продукцию, табачные изделия, кальяны, устройства для потребления никотиносодержащей продукции;
- Лицензируемые виды деятельности, а также товары, свободный оборот которых запрещается или ограничивается законодательством страны, в которой расположен ПВЗ;
- Скоропортящиеся продукты питания, а также замороженные и охлажденные пищевые продукты, требующие специальных условий хранения и транспортировки, а также продукты с общим сроком годности до 3 месяцев;
- Любые иные предметы, оборот которых запрещен или ограничен на территории Российской Федерации.",0.5,0.9999999999999998,
"Какие виды товаров, согласно оферте, могут быть запрещены к хранению в ПВЗ из-за их потенциальной опасности или специфических требований к хранению?","['м;\n• размещать экобоксы для сбора бывших в употреблении (б/у) вещей и предметов;\n• осуществлять выдачу товаров, полученных от третьих лиц (маркетплейсов, ритейлеров, служб доставки,\nперевозчиков и т.д.), с соблюдением ограничений, установленных п. 5.9 Договора.\n1.2. В ПВЗ запрещается осуществлять следующие виды деятельности:\n• реализацию продуктов питания (за исключением продажи посредством вендингового автомата), алкогольной,\nспиртосодержащей продукции, табачной и никотиносодержащей продукции, табачных изделий, кальянов,', '5.9 Договора.\n1.2. В ПВЗ запрещается осуществлять следующие виды деятельности:\n• реализацию продуктов питания (за исключением продажи посредством вендингового автомата), алкогольной,\nспиртосодержащей продукции, табачной и никотиносодержащей продукции, табачных изделий, кальянов,', 'м;\n• размещать экобоксы для сбора бывших в употреблении (б/у) вещей и предметов;\n• осуществлять выдачу товаров, полученных от третьих лиц (маркетплейсов, ритейлеров, служб доставки,\nперевозчиков и т.д.), с соблюдением ограничений, установленных п. 5.9 Договора.\n1.2. В ПВЗ запрещается осуществлять следующие виды деятельности:\n• реализацию продуктов питания (за исключением продажи посредством вендингового автомата), алкогольной,\nспиртосодержащей продукции, табачной и никотиносодержащей продукции, табачных изделий, кальянов, устройств\nдля потребления никотиносодержащей продукции; м;\n• лицензируемые виды деятельности, а также продажу товаров, свободный оборот которых запрещается или\nограничивается законодательством страны, в которой расположен ПВЗ;\n• размещение в ПВЗ контрольно-кассовых аппаратов, терминалов и прием наличных/безналичных денежных\nсредств, в том числе посредством денежных переводов любым способом от третьих лиц, за Услуги,\nпредусмотренные Договором или в качестве оплаты за Товары по Договору или любые другие товары;\n2. Порядок получения/возврата Товаров Исполнителем\n2.1.', 'табачных изделий, кальянов, устройств\nдля потребления никотиносодержащей продукции; м;\n• лицензируемые виды деятельности, а также продажу товаров, свободный оборот которых запрещается или\nограничивается законодательством страны, в которой расположен ПВЗ;\n• размещение в ПВЗ контрольно-кассовых аппаратов, терминалов и прием наличных/безналичных денежных\nсредств, в том числе посредством денежных переводов любым способом от третьих лиц, за Услуги,\nпредусмотренные Договором или в качестве оплаты за Товары по Договору или любые другие товары;\n2.', 'табачных изделий, кальянов, устройств\nдля потребления никотиносодержащей продукции; м;\n• лицензируемые виды деятельности, а также продажу товаров, свободный оборот которых запрещается или\nограничивается законодательством страны, в которой расположен ПВЗ;', '1.27. Оферта — условия настоящей оферты об оказании услуг в ПВЗ, которая содержит все существенные\nусловия и принятие которой влечет заключение Договора на указанных в Оферте условиях.\n1.28. Перевозчик — лицо, осуществляющее перевозку Товаров по указанию Заказчика на основании договора\nтранспортной экспедиции / договора перевозки / договора оказания курьерских услуг или любого иного договора,\n\nпредусматривающего перевозку Товара.\n1.29. Подмена — направленный Исполнителем Заказчику Товар, который не соответствует Товару, указанному в\nсоответствующем Поручении Исполнителю (Заказчиком было зафиксировано несоответствие вложенного Товара в\nупаковке/таре/товарной упаковке Товару, указанному в Поручении).\n1.30. Получатель — физическое или юридическое лицо, или индивидуальный предприниматель, указываемые в\nПоручении в качестве адресата, получающего Товар. В качестве Получателя могут выступать Клиент, Продавец,\nЗаказчик, Перевозчик, Курьер, а также иные лица, привлеченные Заказчиком.\n1.31. Пользовательское соглашение — условия использования Портала и входящих в него сервисов.', '1.27. Оферта — условия настоящей оферты об оказании услуг в ПВЗ, которая содержит все существенные\nусловия и принятие которой влечет заключение Договора на указанных в Оферте условиях.\n1.28. Перевозчик — лицо, осуществляющее перевозку Товаров по указанию Заказчика на основании договора\nтранспортной экспедиции / договора перевозки / договора оказания курьерских услуг или любого иного договора,\n\nпредусматривающего перевозку Товара.\n1.29.', '12. Радиоактивные материалы.\n13. Прочие опасные предметы:\n• вещества, представляющие опасность для окружающей среды, людей и животных;\n• пищевая продукция, содержащая в своем составе мухоморы;\n• продукция, содержащая психотропные, наркотические, сильнодействующие или ядовитые вещества;\n• ртутные градусники;\n• запрещенные средства ловли и поимки животных: снасти, орудия лова, использование которых запрещено\nдействующим законодательством;\n• устройства для негласного получения информации, а также шифровальная техника;\n• подавители (глушилки) сигнала GPS / Глонасс / Платон / сотовой связи (GSM, LTE, пр.) / сети Wi-Fi.\nСкоропортящиеся продукты питания, а также замороженные и охлажденные пищевые продукты -25 до +16\nградусов Цельсия, требующие специальных условий хранения и транспортировки, а также продукты с общим сроком\nгодности до 3 месяцев.\n15. Любые иные предметы, оборот которых запрещен или ограничен на территории Российской\nФедерации.', 'Меры по организации Исполнителемвидеонаблюдения в ПВЗ, по хранению/обработке/копированию/предоставлению Заказчику данных скамер видеонаблюдения предпринимаютсяисключительно в целях исполнения Договора,обеспечения сохранности Товаров, контроля запоступлением/передвижением Товаров в ПВЗ, а также вцелях безопасности лиц, находящихся в ПВЗ.9.4.1.', 'по хранению/обработке/копированию/\nпредоставлению Заказчику данных с камер видеонаблюдения, предпринимаются исключительно в целях исполнения\nДоговора, обеспечения сохранности Товаров, контроля за поступлением/передвижением Товаров в ПВЗ, а также в\nцелях безопасности лиц,']","Ответ:  
В ПВЗ запрещено хранение следующих видов товаров из-за их потенциальной опасности или специфических требований к хранению:  

- Радиоактивные материалы.  
- Прочие опасные предметы:  
  - Вещества, представляющие опасность для окружающей среды, людей и животных.  
  - Пищевая продукция, содержащая в своем составе мухоморы.  
  - Продукция, содержащая психотропные, наркотические, сильнодействующие или ядовитые вещества.  
  - Ртутные градусники.  
  - Запрещенные средства ловли и поимки животных (снасти, орудия лова, использование которых запрещено действующим законодательством).  
  - Устройства для негласного получения информации, а также шифровальная техника.  
  - Подавители (глушилки) сигнала GPS / Глонасс / Платон / сотовой связи (GSM, LTE, и т.д.) / сетей Wi-Fi.  
- Скоропортящиеся продукты питания, а также замороженные и охлажденные пищевые продукты (температура хранения от -25 до +16 градусов Цельсия), требующие специальных условий хранения и транспортировки.  
- Продукты с общим сроком годности до 3 месяцев.  
- Любые иные предметы, оборот которых запрещен или ограничен на территории Российской Федерации.",1.0,0.8572588048389089,0.1249999999875
Какой результат оказания Услуги WB Проверка получает Исполнитель?,"['Услуга «WB Проверка» — Услуга WB Проверка, или Услуга, оказываемая Заказчиком Исполнителю\nпосредством Портала. Результатом оказания Услуги для Исполнителя является получение итога проверки.\n1.1.2. Физическое лицо — гражданин РФ, данные которого предоставляются Исполнителем в заявке на Портале\nдля получения результата оказания Услуги.\n1.1.3. Заявка — специальная форма сбора данных Физического лица, заполнение и отправка которой\nИсполнителем являются обязательным условием оказания Услуги WB Проверка со стороны Заказчика.\n1.1.4.', 'Услуга «WB Проверка» — Услуга WB Проверка, или Услуга, оказываемая Заказчиком Исполнителю\nпосредством Портала. Результатом оказания Услуги для Исполнителя является получение итога проверки.\n1.1.2.', 'Приложение № 6\nк Оферте об оказании услуг в ПВЗ\nУслуга WB Проверка\nПриложение № 6 содержит порядок и условия оказания Услуги WB Проверка, дополняет Оферту об оказании услуг в\nПВЗ в части, необходимой для Услуги WB Проверка, и является обязательным для Исполнителей, использующих\nтакую услугу. В случае если Исполнитель хочет воспользоваться Услугой WB Проверка, то он получает доступ к\nданной услуге посредством Портала.\nРаздел 1. Термины и определения\nРаздел 1 «Термины и определения Оферты об оказании услуг в ПВЗ» дополняется следующими терминами и\nопределениями:\n1.1.1. Услуга «WB Проверка» — Услуга WB Проверка, или Услуга, оказываемая Заказчиком Исполнителю\nпосредством Портала. Результатом оказания Услуги для Исполнителя является получение итога проверки.\n1.1.2. Физическое лицо — гражданин РФ, данные которого предоставляются Исполнителем в заявке на Портале\nдля получения результата оказания Услуги.\n1.1.3. Заявка — специальная форма сбора данных Физического лица, заполнение и отправка которой\nИсполнителем являются обязательным условием оказания Услуги WB Проверка со стороны Заказчика.\n1.1.4.', '1.1.4. Стоимость Услуги — за одну принятую Заказчиком к рассмотрению Заявку, указывается для Исполнителя\nна Портале. Порядок и условия оплаты, в том числе возможные специальные предложения, указываются в\nнастоящем Приложении и в предоставляемой информации на Портале.\n1.1.5. Итог проверки — результат оказания Услуги после получения Заявки Заказчиком, выраженный в\nпредоставлении Исполнителю рекомендательной оценки уровня риска для сотрудничества с Физическим лицом\nпосредством отображения Итога проверки на Портале для Исполнителя. Оценка уровня риска может быть либо\n«высокий уровень риска сотрудничества», либо «низкий уровень риска сотрудничества».\nРаздел 2. Порядок оказания Услуги WB Проверка и получения Итога проверки\n2.1.', 'Итоги проверки, которые предоставляются\nИсполнителю, имеют информативный характер и служат для облегчения принятия решений Исполнителем.\n3.2. Все выводы, рекомендации и способы действий, указанные в Итогах проверки, не могут считаться\nобязательными для исполнения Исполнителем и не создают какой-либо юридической ответственности Заказчика за\nрезультаты, полученные в результате их реализации. Исполнитель самостоятельно принимает решения на основе\nпредоставленной информации и несет полную ответственность за свои действия и последствия, возникающие\nвследствие их выполнения.\n3.3. Заказчик также не гарантирует точность, полноту или актуальность информации, содержащейся в Итогах\nпроверки, и не отвечает за ущерб или убытки, которые могут возникнуть у Исполнителя или третьих лиц в результате\nиспользования данной информации.\n\nПриложение № 7\nк Оферте об оказании услуг в ПВЗ\nУслуга WB Рекламные экраны\nПриложение № 7 содержит порядок и условия Услуги WB Рекламные экраны, дополняет Оферту об оказании услуг в\nПВЗ в части необходимой для Услуги WB Рекламные экраны и является обязательным для Исполнителей,\nподключенных к такой услуге, для исполнения в полном объеме.\nРаздел 1.', '2.6. Стоимость Услуги WB Проверка учитывается при определении Вознаграждения и отражается на Балансе\nИсполнителя. Стоимость Услуги включает в себя НДС по ставке, установленной действующим законодательством\nРФ.\n2.7. Заказчик предоставит Исполнителю полностью соответствующие действующему законодательству Российской\nФедерации первичные документы: акт, счет-фактуру или УПД со статусом «1» в отношении оказанной Услуги, в сроки\nсогласно действующему законодательству.', 'Приложение № 6\nк Оферте об оказании услуг в ПВЗ\nУслуга WB Проверка\nПриложение № 6 содержит порядок и условия оказания Услуги WB Проверка, дополняет Оферту об оказании услуг в\nПВЗ в части, необходимой для Услуги WB Проверка, и является обязательным для Исполнителей, использующих\nтакую услугу. В случае если Исполнитель хочет воспользоваться Услугой WB Проверка, то он получает доступ к\nданной услуге посредством Портала.\nРаздел 1. Термины и определения\nРаздел 1 «Термины и определения Оферты об оказании услуг в ПВЗ» дополняется следующими терминами и\nопределениями:\n1.1.1.', '2.6. Стоимость Услуги WB Проверка учитывается при определении Вознаграждения и отражается на Балансе\nИсполнителя. Стоимость Услуги включает в себя НДС по ставке, установленной действующим законодательством\nРФ.\n2.7.', '2.4. Исполнитель, предоставляя данные по Физическому лицу посредством Заявки подтверждает и гарантирует\nЗаказчику, что все данные получены им добровольно и правомерно непосредственно у проверяемого Физического\nлица с его согласия и Исполнитель проинформировал Физическое лицо о проведении проверки на благонадежность,\nа также готов предоставить подтверждение наличия правового основания для передачи данных Заказчику и\nобработки данных Физических лиц Заказчиком. Заказчик обрабатывает данные Физического лица для целей\nоказания Услуги WB Проверка для выполнения Заявки Исполнителя в объеме, указанном в п.', 'и является обязательным для Исполнителей, использующих\nтакую услугу. В случае если Исполнитель хочет воспользоваться Услугой WB Проверка, то он получает доступ к\nданной услуге посредством Портала.\nРаздел 1.']","Ответ: Результатом оказания Услуги WB Проверка для Исполнителя является получение итога проверки, который выражается в предоставлении рекомендательной оценки уровня риска для сотрудничества с Физическим лицом. Оценка уровня риска может быть либо «высокий уровень риска сотрудничества», либо «низкий уровень риска сотрудничества».",1.0,0.9533283994554054,0.999999999975
Какие данные должен заполнить Исполнитель в Заявке для получения Итога проверки?,"['2.2. В Заявке Исполнитель заполняет необходимые данные по Физическому лицу, как то: ФИО, серия и номер, дата\nвыдачи паспорта гражданина РФ, место и дата рождения, адрес места регистрации, СНИЛС, ИНН, мобильный\nтелефон, и отправляет Заявку Заказчику на проверку,', 'Услуга «WB Проверка» — Услуга WB Проверка, или Услуга, оказываемая Заказчиком Исполнителю\nпосредством Портала. Результатом оказания Услуги для Исполнителя является получение итога проверки.\n1.1.2. Физическое лицо — гражданин РФ, данные которого предоставляются Исполнителем в заявке на Портале\nдля получения результата оказания Услуги.\n1.1.3. Заявка — специальная форма сбора данных Физического лица, заполнение и отправка которой\nИсполнителем являются обязательным условием оказания Услуги WB Проверка со стороны Заказчика.\n1.1.4.', 'Исполнитель имеет возможность посредством Портала через раздел «Сотрудники» отправить Заявку на\nпроверку благонадежности Физического лица, с которым Исполнитель сотрудничает и / или собирается в\nдальнейшем сотрудничать любым способом по своему выбору, как посредством заключения трудового договора, так\nи посредством любого иного договора гражданско-правового характера, с соблюдением действующих норм\nзаконодательства.\n2.2. В Заявке Исполнитель заполняет необходимые данные по Физическому лицу, как то: ФИО, серия и номер, дата\nвыдачи паспорта гражданина РФ, место и дата рождения, адрес места регистрации, СНИЛС, ИНН, мобильный\nтелефон, и отправляет Заявку Заказчику на проверку, которая проводится на основании анализа данных из\nобщедоступных открытых источников на предмет благонадежности Физического лица.\n2.3. Алгоритм оценки рисков из общедоступных открытых источников включает в себя совокупность различных\nфакторов, основанных на ключевых показателях, предоставленных данными источниками.', '1.1.5. Итог проверки — результат оказания Услуги после получения Заявки Заказчиком, выраженный в\nпредоставлении Исполнителю рекомендательной оценки уровня риска для сотрудничества с Физическим лицом\nпосредством отображения Итога проверки на Портале для Исполнителя.', '2.4. Исполнитель, предоставляя данные по Физическому лицу посредством Заявки подтверждает и гарантирует\nЗаказчику, что все данные получены им добровольно и правомерно непосредственно у проверяемого Физического\nлица с его согласия и Исполнитель проинформировал Физическое лицо о проведении проверки на благонадежность,\nа также готов предоставить подтверждение наличия правового основания для передачи данных Заказчику и\nобработки данных Физических лиц Заказчиком. Заказчик обрабатывает данные Физического лица для целей\nоказания Услуги WB Проверка для выполнения Заявки Исполнителя в объеме, указанном в п.', '1.1.4. Стоимость Услуги — за одну принятую Заказчиком к рассмотрению Заявку, указывается для Исполнителя\nна Портале. Порядок и условия оплаты, в том числе возможные специальные предложения, указываются в\nнастоящем Приложении и в предоставляемой информации на Портале.\n1.1.5. Итог проверки — результат оказания Услуги после получения Заявки Заказчиком, выраженный в\nпредоставлении Исполнителю рекомендательной оценки уровня риска для сотрудничества с Физическим лицом\nпосредством отображения Итога проверки на Портале для Исполнителя. Оценка уровня риска может быть либо\n«высокий уровень риска сотрудничества», либо «низкий уровень риска сотрудничества».\nРаздел 2. Порядок оказания Услуги WB Проверка и получения Итога проверки\n2.1.', '1.1.4. Стоимость Услуги — за одну принятую Заказчиком к рассмотрению Заявку, указывается для Исполнителя\nна Портале. Порядок и условия оплаты, в том числе возможные специальные предложения, указываются в\nнастоящем Приложении и в предоставляемой информации на Портале.\n1.1.5. Итог проверки — результат оказания Услуги после получения Заявки Заказчиком, выраженный в\nпредоставлении Исполнителю рекомендательной оценки уровня риска для сотрудничества с Физическим лицом\nпосредством отображения Итога проверки на Портале для Исполнителя.', '2.9. Заказчик не обязан раскрывать ни Исполнителю, ни Физическому лицу, ни какому-либо третьему лицу правила\nработы алгоритма и источники данных, а также давать какие-либо пояснения в отношении Итога проверки. Заказчик\nобязуется не распространять и не предоставлять кому-либо Итоги проверки Физического лица после оказания Услуги\nИсполнителю.\n3. Ограничение ответственности\n3.1. Заказчик не несет ответственности за действия или бездействия Исполнителя, которые основываются на\nинформации, содержащейся в предоставленных Итогах проверки.', 'Исполнитель обязуется предоставлять достоверные, актуальные сведения о себе и/или сотрудниках (в том\nчисле, но не ограничиваясь: название организации, номер регистрации в качестве налогоплательщика, телефон,\nэлектронная почта), привязанных к Личному кабинету Исполнителя,', '2.4. Исполнитель, предоставляя данные по Физическому лицу посредством Заявки подтверждает и гарантирует\nЗаказчику, что все данные получены им добровольно и правомерно непосредственно у проверяемого Физического\nлица с его согласия и Исполнитель проинформировал Физическое лицо о проведении проверки на благонадежность,']","Исполнитель должен заполнить в Заявке следующие данные по Физическому лицу:

- ФИО  
- Серия и номер паспорта гражданина РФ  
- Дата выдачи паспорта гражданина РФ  
- Место и дата рождения  
- Адрес места регистрации  
- СНИЛС  
- ИНН  
- Мобильный телефон",1.0,0.8360112462596249,0.8333333332916666
Какие два типа оценки уровня риска сотрудничества с Физическим лицом могут быть отражены в Итоге проверки?,"['1.1.4. Стоимость Услуги — за одну принятую Заказчиком к рассмотрению Заявку, указывается для Исполнителя\nна Портале. Порядок и условия оплаты, в том числе возможные специальные предложения, указываются в\nнастоящем Приложении и в предоставляемой информации на Портале.\n1.1.5. Итог проверки — результат оказания Услуги после получения Заявки Заказчиком, выраженный в\nпредоставлении Исполнителю рекомендательной оценки уровня риска для сотрудничества с Физическим лицом\nпосредством отображения Итога проверки на Портале для Исполнителя. Оценка уровня риска может быть либо\n«высокий уровень риска сотрудничества», либо «низкий уровень риска сотрудничества».\nРаздел 2. Порядок оказания Услуги WB Проверка и получения Итога проверки\n2.1.', 'Оценка уровня риска может быть либо\n«высокий уровень риска сотрудничества», либо «низкий уровень риска сотрудничества».\nРаздел 2. Порядок оказания Услуги WB Проверка и получения Итога проверки\n2.1.', '1.1.5. Итог проверки — результат оказания Услуги после получения Заявки Заказчиком, выраженный в\nпредоставлении Исполнителю рекомендательной оценки уровня риска для сотрудничества с Физическим лицом\nпосредством отображения Итога проверки на Портале для Исполнителя.', '1.1.4. Стоимость Услуги — за одну принятую Заказчиком к рассмотрению Заявку, указывается для Исполнителя\nна Портале. Порядок и условия оплаты, в том числе возможные специальные предложения, указываются в\nнастоящем Приложении и в предоставляемой информации на Портале.\n1.1.5. Итог проверки — результат оказания Услуги после получения Заявки Заказчиком, выраженный в\nпредоставлении Исполнителю рекомендательной оценки уровня риска для сотрудничества с Физическим лицом\nпосредством отображения Итога проверки на Портале для Исполнителя.', 'Исполнитель имеет возможность посредством Портала через раздел «Сотрудники» отправить Заявку на\nпроверку благонадежности Физического лица, с которым Исполнитель сотрудничает и / или собирается в\nдальнейшем сотрудничать любым способом по своему выбору, как посредством заключения трудового договора, так\nи посредством любого иного договора гражданско-правового характера, с соблюдением действующих норм\nзаконодательства.\n2.2. В Заявке Исполнитель заполняет необходимые данные по Физическому лицу, как то: ФИО, серия и номер, дата\nвыдачи паспорта гражданина РФ, место и дата рождения, адрес места регистрации, СНИЛС, ИНН, мобильный\nтелефон, и отправляет Заявку Заказчику на проверку, которая проводится на основании анализа данных из\nобщедоступных открытых источников на предмет благонадежности Физического лица.\n2.3. Алгоритм оценки рисков из общедоступных открытых источников включает в себя совокупность различных\nфакторов, основанных на ключевых показателях, предоставленных данными источниками.', '2.9. Заказчик не обязан раскрывать ни Исполнителю, ни Физическому лицу, ни какому-либо третьему лицу правила\nработы алгоритма и источники данных, а также давать какие-либо пояснения в отношении Итога проверки. Заказчик\nобязуется не распространять и не предоставлять кому-либо Итоги проверки Физического лица после оказания Услуги\nИсполнителю.\n3. Ограничение ответственности\n3.1. Заказчик не несет ответственности за действия или бездействия Исполнителя, которые основываются на\nинформации, содержащейся в предоставленных Итогах проверки.', 'Исполнитель имеет возможность посредством Портала через раздел «Сотрудники» отправить Заявку на\nпроверку благонадежности Физического лица, с которым Исполнитель сотрудничает и / или собирается в\nдальнейшем сотрудничать любым способом по своему выбору, как посредством заключения трудового договора, так\nи посредством любого иного договора гражданско-правового характера, с соблюдением действующих норм\nзаконодательства.\n2.2.', 'Порядок подписания и обмена первичными документами регулируется\nсоответствующими пунктами Оферты об оказании услуг в ПВЗ.\n2.8. Один Исполнитель может сделать не более 15 (пятнадцати) Заявок на Услугу WB Проверка в течение 30\n(тридцати) календарных дней. В случае превышения количества Заявок Заказчик информирует Исполнителя о\nпревышении посредством Портала. Следующие заявки Исполнителя могут быть приняты в работу Заказчиком в\nследующем периоде оказания Услуги.\n2.9. Заказчик не обязан раскрывать ни Исполнителю, ни Физическому лицу, ни какому-либо третьему лицу правила\nработы алгоритма и источники данных, а также давать какие-либо пояснения в отношении Итога проверки. Заказчик\nобязуется не распространять и не предоставлять кому-либо Итоги проверки Физического лица после оказания Услуги\nИсполнителю.\n3. Ограничение ответственности\n3.1. Заказчик не несет ответственности за действия или бездействия Исполнителя, которые основываются на\nинформации, содержащейся в предоставленных Итогах проверки.', 'Итоги проверки, которые предоставляются\nИсполнителю, имеют информативный характер и служат для облегчения принятия решений Исполнителем.\n3.2. Все выводы, рекомендации и способы действий, указанные в Итогах проверки, не могут считаться\nобязательными для исполнения Исполнителем и не создают какой-либо юридической ответственности Заказчика за\nрезультаты, полученные в результате их реализации. Исполнитель самостоятельно принимает решения на основе\nпредоставленной информации и несет полную ответственность за свои действия и последствия, возникающие\nвследствие их выполнения.\n3.3.', 'Итоги проверки, которые предоставляются\nИсполнителю, имеют информативный характер и служат для облегчения принятия решений Исполнителем.\n3.2.']","Ответ:  
«высокий уровень риска сотрудничества» и «низкий уровень риска сотрудничества».",1.0,0.7437539529965205,0.99999999995
"Какой порядок оплаты оборудования и услуг по его установке, подключению и запуску предусмотрен для Исполнителя?","['2.5. Исполнитель оплачивает Оборудование и стоимость установки, подключения и запуска Оборудования в\nрассрочку в следующем порядке:\nплатежи отражаются на Балансе и удерживаются из Вознаграждения Исполнителя, начиная с даты принятия\nОборудования через Портал на ПВЗ,', '2.5. Исполнитель оплачивает Оборудование и стоимость установки, подключения и запуска Оборудования в\nрассрочку в следующем порядке:\nплатежи отражаются на Балансе и удерживаются из Вознаграждения Исполнителя, начиная с даты принятия\nОборудования через Портал на ПВЗ, не позднее 25 (двадцать пятого) числа календарного месяца в течение 7 (семи)\nкалендарных месяцев подряд равными частями по 10 000 (десять тысяч) российских рублей, в том числе НДС по\nставке, применимой в соответствии с действующим законодательством РФ.', '2.5. Исполнитель оплачивает Оборудование и стоимость установки, подключения и запуска Оборудования в\nрассрочку в следующем порядке:\nплатежи отражаются на Балансе и удерживаются из Вознаграждения Исполнителя, начиная с даты принятия\nОборудования через Портал на ПВЗ, не позднее 25 (двадцать пятого) числа календарного месяца в течение 7 (семи)\nкалендарных месяцев подряд равными частями по 10 000 (десять тысяч) российских рублей, в том числе НДС по\nставке, применимой в соответствии с действующим законодательством РФ.\nВ случае получения Оборудования в ПВЗ Исполнителя в период с 25-го по последнее число месяца первый\nежемесячный платеж за Оборудование отражается на Балансе и удерживается из Вознаграждения Исполнителя не\nпозднее последнего числа календарного месяца.\n2.6. Установка, подключение и запуск Оборудования в ПВЗ Исполнителя осуществляется Заказчиком в сроки,\nсогласованные Сторонами дополнительно в зависимости от даты получения Оборудования Исполнителем.\n2.7.', 'При оказании Услуги Исполнитель обязуется установить, подключить и обеспечить работу Оборудования на ПВЗ в\nсоответствии с условиями, указанными в настоящем Приложении. Если один Исполнитель желает подключиться к\nУслуге WB Рекламные экраны на нескольких своих ПВЗ, то для каждого ПВЗ приобретается 1 (одна) единица\nОборудования.\n2.3. Заказчик гарантирует, что является собственником Оборудования, Оборудование в споре или под арестом не\nсостоит, не является предметом залога, не обременено другими правами третьих лиц и не нарушает прав третьих\nлиц.\n2.4. Стоимость 1 (одной) единицы Оборудования составляет 70 000 (семьдесят тысяч) российских рублей, в том\nчисле НДС по ставке, применимой в соответствии с действующим законодательством РФ. Стоимость установки,\nподключения и запуска 1 (одной) единицы Оборудования включена в стоимость Оборудования.\n2.5.', 'В случае получения Оборудования в ПВЗ Исполнителя в период с 25-го по последнее число месяца первый\nежемесячный платеж за Оборудование отражается на Балансе и удерживается из Вознаграждения Исполнителя не\nпозднее последнего числа календарного месяца.\n2.6. Установка, подключение и запуск Оборудования в ПВЗ Исполнителя осуществляется Заказчиком в сроки,\nсогласованные Сторонами дополнительно в зависимости от даты получения Оборудования Исполнителем.\n2.7.', '2.6. Установка, подключение и запуск Оборудования в ПВЗ Исполнителя осуществляется Заказчиком в сроки,\nсогласованные Сторонами дополнительно в зависимости от даты получения Оборудования Исполнителем.\n2.7.', '1.1.4. Стоимость Услуги — за одну принятую Заказчиком к рассмотрению Заявку, указывается для Исполнителя\nна Портале. Порядок и условия оплаты, в том числе возможные специальные предложения, указываются в\nнастоящем Приложении и в предоставляемой информации на Портале.\n1.1.5.', '- если Исполнитель не оплатил полную стоимость Оборудования на дату осуществления замены, то оставшаяся\nсумма от стоимости будет выплачиваться Исполнителем без каких-либо изменений;\n- стоимость доставки неработающих Экрана или ПК до Сервисного центра Заказчика осуществляется за счет\nЗаказчика.\n6.8.2.', 'Тарифы\n1.1. Вознаграждение – это сумма, рассчитываемая для каждого ПВЗ Исполнителя в соответствии с Базовым,\nДифференцированным или Фиксированным тарифом (если применимо), указанными для соответствующего ПВЗ в\nЛК Исполнителя, исходя из количества оказанных Исполнителем Услуг за Отчетный период, а также с учетом\nвозможных премий и иных выплат, неустоек согласно настоящему Приложению № 1. Размер Вознаграждения\nИсполнителя, не включает в себя налог на добавленную стоимость, если Исполнитель по месту регистрации\nнаходится за пределами Российской Федерации. Суммы, указываемые в согласованных и/или подписанных\nСторонами по настоящему Договору документах, как они определены в разделе 8 Договора, включают в себя суммы\nвсех применимых налогов и сборов, в том числе НДС. Никакие иные суммы налогов, сборов, в т.ч. НДС, не подлежат\nоплате Заказчиком сверх сумм, указанных в документах, подтверждающих оказание Услуг.\nВознаграждение для Исполнителя рассчитывается и выплачивается в национальной валюте страны государственной\nрегистрации Исполнителя.', '1.1.4. Стоимость Услуги — за одну принятую Заказчиком к рассмотрению Заявку, указывается для Исполнителя\nна Портале. Порядок и условия оплаты, в том числе возможные специальные предложения, указываются в\nнастоящем Приложении и в предоставляемой информации на Портале.\n1.1.5. Итог проверки — результат оказания Услуги после получения Заявки Заказчиком, выраженный в\nпредоставлении Исполнителю рекомендательной оценки уровня риска для сотрудничества с Физическим лицом\nпосредством отображения Итога проверки на Портале для Исполнителя.']","Порядок оплаты оборудования и услуг по его установке, подключению и запуску для Исполнителя предусмотрен следующим образом:

Исполнитель оплачивает оборудование и стоимость установки, подключения и запуска оборудования в рассрочку в следующем порядке: платежи отражаются на Балансе и удерживаются из Вознаграждения Исполнителя, начиная с даты принятия Оборудования через Портал на ПВЗ. 

Не позднее 25-го числа календарного месяца в течение 7 календарных месяцев подряд платежи равными частями по 10 000 рублей, в том числе НДС по ставке, применимой в соответствии с действующим законодательством РФ. 

В случае получения Оборудования в ПВЗ Исполнителя в период с 25-го по последнее число месяца первый ежемесячный платеж за Оборудование отражается на Балансе и удерживается из Вознаграждения Исполнителя не позднее последнего числа календарного месяца.",1.0,0.7710563476750256,0.5888888888692593
"Какие действия должен предпринять Исполнитель, если Экран и ПК не подлежат Гарантийному обслуживанию, и как распределяются расходы на доставку неработающего оборудования?","['6.8.2. Если Экран и ПК не подлежат Гарантийному обслуживанию:\n- Исполнитель обязуется оплатить новый комплект Оборудования в соответствии с условиями настоящего\nПриложения, включая стоимость установки, подключения и запуска Оборудования;\n- если Исполнитель не оплатил полную стоимость Оборудования, не подлежащего Гарантийному обслуживанию, на\nдату осуществления замены на новое Оборудование, то Исполнитель обязан оплатить оставшуюся сумму от\nстоимости Оборудования;\n- Исполнитель вправе осуществить самостоятельный ремонт Оборудования за свой счет, при условии использования\nсертифицированных запчастей для ремонта и сервисного центра, рекомендованного Заказчиком.\n- стоимость доставки неработающих Экрана или ПК до Сервисного центра Заказчика осуществляется за счет\nИсполнителя.\nРаздел 7. Ответственность\n7.1. Стороны пришли к соглашению дополнить Приложение №4 к Оферте об оказании услуг в ПВЗ\nОтветственность следующими пунктами:\n№ разделаили пп.Приложения№ 7\nПриложение № 7 ОТВЕТСТВЕННОСТЬ / РАЗМЕРШТРАФОВ\n2.2.', 'Если Экран и ПК подлежат Гарантийному обслуживанию:\n- Заказчик своими силами и за свой счет предоставляет замену на аналогичные Экран и ПК, но стоимость установки,\nподключения и запуска оплачивается Исполнителем;\n- если Исполнитель не оплатил полную стоимость Оборудования на дату осуществления замены, то оставшаяся\nсумма от стоимости будет выплачиваться Исполнителем без каких-либо изменений;\n- стоимость доставки неработающих Экрана или ПК до Сервисного центра Заказчика осуществляется за счет\nЗаказчика.\n6.8.2.', '6.8.2. Если Экран и ПК не подлежат Гарантийному обслуживанию:\n- Исполнитель обязуется оплатить новый комплект Оборудования в соответствии с условиями настоящего\nПриложения, включая стоимость установки, подключения и запуска Оборудования;\n- если Исполнитель не оплатил полную стоимость Оборудования, не подлежащего Гарантийному обслуживанию, на\nдату осуществления замены на новое Оборудование, то Исполнитель обязан оплатить оставшуюся сумму от\nстоимости Оборудования;\n- Исполнитель вправе осуществить самостоятельный ремонт Оборудования за свой счет,', '6.7. Заказчик устраняет неисправности Оборудования, если не докажет, что неисправности Экрана и ПК возникли\nпосле его передачи Исполнителю и Экран и ПК не подлежат Гарантийному обслуживанию.\n6.8. Стороны согласовывают следующий формат взаимодействия в период Гарантийного обслуживания:\n6.8.1. Если Экран и ПК подлежат Гарантийному обслуживанию:\n- Заказчик своими силами и за свой счет предоставляет замену на аналогичные Экран и ПК, но стоимость установки,\nподключения и запуска оплачивается Исполнителем;\n- если Исполнитель не оплатил полную стоимость Оборудования на дату осуществления замены, то оставшаяся\nсумма от стоимости будет выплачиваться Исполнителем без каких-либо изменений;\n- стоимость доставки неработающих Экрана или ПК до Сервисного центра Заказчика осуществляется за счет\nЗаказчика.\n6.8.2.', '6.8.2. Если Экран и ПК не подлежат Гарантийному обслуживанию:\n- Исполнитель обязуется оплатить новый комплект Оборудования в соответствии с условиями настоящего\nПриложения, включая стоимость установки, подключения и запуска Оборудования;\n- если Исполнитель не оплатил полную стоимость Оборудования,', '- если Исполнитель не оплатил полную стоимость Оборудования на дату осуществления замены, то оставшаяся\nсумма от стоимости будет выплачиваться Исполнителем без каких-либо изменений;\n- стоимость доставки неработающих Экрана или ПК до Сервисного центра Заказчика осуществляется за счет\nЗаказчика.\n6.8.2.', '6.7. Заказчик устраняет неисправности Оборудования, если не докажет, что неисправности Экрана и ПК возникли\nпосле его передачи Исполнителю и Экран и ПК не подлежат Гарантийному обслуживанию.\n6.8. Стороны согласовывают следующий формат взаимодействия в период Гарантийного обслуживания:\n6.8.1.', 'Если Экран и ПК подлежат Гарантийному обслуживанию:\n- Заказчик своими силами и за свой счет предоставляет замену на аналогичные Экран и ПК, но стоимость установки,\nподключения и запуска оплачивается Исполнителем;', '6.7. Заказчик устраняет неисправности Оборудования, если не докажет, что неисправности Экрана и ПК возникли\nпосле его передачи Исполнителю и Экран и ПК не подлежат Гарантийному обслуживанию.\n6.8.', 'при условии использования\nсертифицированных запчастей для ремонта и сервисного центра, рекомендованного Заказчиком.\n- стоимость доставки неработающих Экрана или ПК до Сервисного центра Заказчика осуществляется за счет\nИсполнителя.\nРаздел 7. Ответственность\n7.1. Стороны пришли к соглашению дополнить Приложение №4 к Оферте об оказании услуг в ПВЗ\nОтветственность следующими пунктами:\n№ разделаили пп.Приложения№ 7\nПриложение № 7 ОТВЕТСТВЕННОСТЬ / РАЗМЕРШТРАФОВ\n2.2.']","Если Экран и ПК не подлежат Гарантийному обслуживанию, Исполнитель должен:

- Оплатить новый комплект Оборудования в соответствии с условиями настоящего Приложения, включая стоимость установки, подключения и запуска Оборудования;
- Если Исполнитель не оплатил полную стоимость Оборудования на дату осуществления замены, то Исполнитель обязан оплатить оставшуюся сумму от стоимости Оборудования;
- Вправе осуществить самостоятельный ремонт Оборудования за свой счет, при условии использования сертифицированных запчастей для ремонта и сервисного центра, рекомендованного Заказчиком.

Расходы на доставку неработающего оборудования до Сервисного центра Заказчика осуществляются за счет Исполнителя.",0.6923076923076923,0.9216212291591034,0.574999999985625
"Какие два вида штрафов могут быть применены к Исполнителю за нарушение условий эксплуатации Оборудования, и в каких случаях?","['первое нарушение –предупреждение\nВторое и последующеевыявленное нарушение - 10 000(десять тысяч) российскихрублей;\n5.4. Исполнитель обязуется использовать Оборудование в периодподключения к Услуге WB Рекламные экраны строго поназначению и в соответствии с инструкциями Заказчика иправилами, установленными настоящим Приложением. Любыеизменения в условиях эксплуатации, изменения местаустановки, расположения Оборудования должны в обязательномпорядке быть согласованы с Заказчиком посредством ЛК.', 'первое нарушение –предупреждение\nВторое и последующеевыявленное нарушение - 10 000(десять тысяч) российскихрублей;\n5.4. Исполнитель обязуется использовать Оборудование в периодподключения к Услуге WB Рекламные экраны строго поназначению и в соответствии с инструкциями Заказчика иправилами, установленными настоящим Приложением. Любыеизменения в условиях эксплуатации, изменения местаустановки, расположения Оборудования должны в обязательномпорядке быть согласованы с Заказчиком посредством ЛК.\nпервое нарушение –предупреждение\nВторое и последующеевыявленное нарушение - 10 000(десять тысяч) российскихрублей;\n6.4. Исполнителю запрещается:\n1. Любым способом при отсутствии причины или исключенияотключать питание (вынимать вилки, нажимать кнопки)Оборудования, а также отключать от сети удлинитель, откоторого запитано Оборудование, за исключениемнеобходимости перезагрузки Оборудования.\n2. Вынимать ПК из разъема или отключать от Экран HDMIпровод.\n3. Подключать к Экрану любые дополнительные устройства(съемные носители, ноутбуки, сторонние плееры и т.п)\n4.', 'Приложения№ 7\nПриложение № 7 ОТВЕТСТВЕННОСТЬ / РАЗМЕРШТРАФОВ\nВторое нарушение - 10 000(десять тысяч) российскихрублей;\nТретье и последующеевыявленное нарушение – штрафв размере полной стоимостиОборудования.\nЗаказчик также вправеотключить Исполнителя отУслуги WB Рекламные экраны,забрать Оборудование себе судержанием стоимоститранспортных и иных расходов сИсполнителя.\n3.1.6. Не допускать загромождения Оборудования.', '№строки №разделаили пп.Договора\nДоговор ОТВЕТСТВЕННОСТЬ / РАЗМЕРШТРАФОВ\nматериалы и информацию, а также исправлятьзамечания в течение этого срока.\n11. 5.15. Исполнитель несет ответственность за повреждение,утрату, утерю, уничтожение, продажу, безвозмезднуюпередачу третьим лицам принадлежащих Заказчику инаходящихся в ПВЗ оборудования, материалов (картони иное), предназначенных для обработки Товаров.Исполнитель не вправе использовать получаемые/приобретаемые в соответствии с условиями Договораоборудование, материалы (картон и иное) длясобственных предпринимательских целей и в своихинтересах.\nЗа первое нарушение –предупреждение;за второе нарушение – 1 000 (однатысяча) российских рублей;за третье нарушение – штраф вразмере 10 000 (десяти тысяч)российских рублей;за каждое следующее выявленноенарушение – штраф в размере 50000 (пятидесяти тысяч) российскихрублей.\n12. 5.17.', 'Приложения№ 7\nПриложение № 7 ОТВЕТСТВЕННОСТЬ / РАЗМЕРШТРАФОВ\nВторое нарушение - 10 000(десять тысяч) российскихрублей;\nТретье и последующеевыявленное нарушение – штрафв размере полной стоимостиОборудования.', '35. 3.15.1. Отказ Исполнителя от установкиэлектромеханического/электромагнитного замка совстроенным контроллером силами Заказчика попредварительно согласованной Сторонами заявке.Отсутствие со стороны Исполнителя подключенияэлектромеханического/электромагнитного замка совстроенным контроллером к сети электропитания,работоспособности или функционирующего замкав любое время оказания услуг по Договору.\nЗа первое нарушение - штраф в размере5 000 (пять тысяч) российских рублей;за второе нарушение – штраф в размере10 000 (десять тысяч) российских рублей;за каждое следующее выявленноенарушение – штраф в размере 30 000(тридцать тысяч) российских рублей.\n36 3.17.3.3.17.6.3.17.7.\n3.17.3. Исполнитель обязуется самостоятельно иза свой счет установить Систему WB-LOCK навходную дверь ПВЗ, следуя инструкции к СистемеWB-LOCK, а также обеспечить еёработоспособность и функционирование на всёвремя оказания Услуг по Договору.3.17.6.', 'Вслучае непроведения вустановленные срокидополнительной инвентаризации наИсполнителя налагается штраф вразмере 10 000 рублей;(iii) от 0,4% (ноля целых четырехдесятых процента) включительно отОборота ПВЗ – предупреждение, аЗаказчик вправе ограничить выводденежных средств до 1 (одного) разав месяц, от даты превышенияИсполнителем доли ЗависшихТоваров до установленного даннымпунктом более низкого уровня поЗависшим Товарам;(iv) от 0,4% (ноля целых четырехдесятых процента) включительно отОборота ПВЗ – предупреждение ина Исполнителя налагается штраф вразмере 10% (десяти процентов) отстоимости утерянного Товара, вотношении которого Исполнителемне оспорено удержание согласноусловиям Договора;(v) от 1,0% (одного процента)включительно от Оборота ПВЗ –Заказчик вправе применитьБлокировку в соответствии сусловиями Договора.\n15. 5.20. Исполнитель обязуется выдать поступивший в ПВЗТовар Получателям в количестве, ассортименте икомплектации в соответствии с положениями п. 5.3Договора и требованиями, указанными в ПорученияхЗаказчика.', '12.1. Исполнитель посредством функционала Портала вправе оспорить полученный штраф за нарушение\nусловий Договора в соответствии с Приложением № 4 (Ответственность ПВЗ) к Договору в течение 7 (семи)\nкалендарных дней с момента уведомления Исполнителя путем размещения Заказчиком соответствующих сведений\nо нарушении обязательств Исполнителем в ЛК. В случае, если Исполнитель не предоставит в установленные\nДоговором и обучающим Порталом ( https://edtech.rwb.ru ) сроки видеоматериалы, а также документы, в том\nчисле, но не ограничиваясь выданные государственными органами по месту регистрации Сторон, контролирующими\nвопросы в области чрезвычайных ситуаций, подтверждающие невозможность исполнения обязанностей по Договору\nИсполнителем вследствие чрезвычайных обстоятельств, нарушение считается подтвержденным Исполнителем.\nОбращение Исполнителя рассматривается в срок, необходимый для полного и всестороннего рассмотрения всех\nобстоятельств нарушения, а также получения дополнительной информации и документов от Исполнителя при\nнеобходимости, о чем Заказчик уведомляет Исполнителя.', '11.6. Возмещение Исполнителем убытков и/или уплата неустойки (пени, штрафы) не освобождает его от\nустранения допущенных нарушений.\n12. Меры по урегулированию споров\nОспаривание штрафов и удержаний Исполнителем.\n12.1.', 'Вслучае непроведения вустановленные срокидополнительной инвентаризации наИсполнителя налагается штраф вразмере 10 000 рублей;(iii) от 0,4% (ноля целых четырехдесятых процента) включительно отОборота ПВЗ – предупреждение, аЗаказчик вправе ограничить выводденежных средств до 1 (одного) разав месяц, от даты превышенияИсполнителем доли ЗависшихТоваров до установленного даннымпунктом более низкого уровня поЗависшим Товарам;(iv) от 0,']","Ответ:  
Два вида штрафов, которые могут быть применены к Исполнителю за нарушение условий эксплуатации Оборудования, это:

1. **Штраф в размере 10 000 (десять тысяч) рублей** — применяется за **второе и последующие нарушения**, выявленные в ходе эксплуатации Оборудования.  
2. **Штраф в размере полной стоимости Оборудования** — применяется за **третье и последующие нарушения**, выявленные в ходе эксплуатации Оборудования.  

Эти штрафы указаны в Приложении № 7 ""Ответственность / Размер штрафов"".",0.75,0.9504175056022991,0.3333333333
"Какой тариф применяется для ПВЗ в Москве, если их оборот за 30 дней превышает 8 000 000 рублей?","['Дифференцированный тариф применяется при нижеследующем обороте ПВЗ Исполнителя:\n\n— от 4 000 000 (четырех миллионов) российских рублей для ПВЗ в Республике Казахстан;\n— от 6 000 000 (шести миллионов) российских рублей для ПВЗ во всех остальных странах и регионах РФ, кроме\nгорода Москва, Московской области, города Санкт-Петербург, Тюменской области, Сахалинской области, Ямало-\nНенецкого автономного округа и города Минск РБ;\n— от 8 000 000 (восьми миллионов) российских рублей для ПВЗ, расположенных в городе Москва, Московской\nобласти, города Санкт-Петербург, Тюменской области, Сахалинской области, Ямало-Ненецком автономном округе и\nгороде Минск РБ.\nТарифы для фиолетовой зоны:\nСтраны/Оборот 1 000 000\n₽  - 5 000\n000 ₽\n6 000\n000 ₽\n7 000\n0000 ₽\n8 000\n0000 ₽\n9 000\n0000 ₽\n10 000\n0000 ₽\n11 000\n0000 ₽\n12 000\n0000 ₽\n13 000\n0000 ₽\n14 000\n0000 ₽\n15 000\n0000 ₽\nРеспубликаКыргызстан 4,78% 3,', 'Базовый тариф применяется при нижеследующем Обороте ПВЗ Исполнителя:\n— до 4 000 000 (четырех миллионов) российских рублей для ПВЗ в Республике Казахстан;\n— до 6 000 000 (шести миллионов) российских рублей для ПВЗ во всех остальных странах и регионах РФ, кроме\nгорода Москва, Московской области, города Санкт-Петербург, Тюменской области, Сахалинской области, Ямало-\nНенецкого автономного округа и города Минск РБ;\n— до 8 000 000 (восьми миллионов) российских рублей для ПВЗ, расположенных в городе Москва, Московской\nобласти, города Санкт-Петербург, Тюменской области, Сахалинской области, Ямало-Ненецком автономном округе и\nгороде Минск РБ.', 'Базовый тариф применяется при нижеследующем Обороте ПВЗ Исполнителя:\n— до 4 000 000 (четырех миллионов) российских рублей для ПВЗ в Республике Казахстан;\n— до 6 000 000 (шести миллионов) российских рублей для ПВЗ во всех остальных странах и регионах РФ, кроме\nгорода Москва, Московской области, города Санкт-Петербург, Тюменской области, Сахалинской области, Ямало-\nНенецкого автономного округа и города Минск РБ;\n— до 8 000 000 (восьми миллионов) российских рублей для ПВЗ,', 'Дифференцированный тариф применяется при нижеследующем обороте ПВЗ Исполнителя:\n\n— от 4 000 000 (четырех миллионов) российских рублей для ПВЗ в Республике Казахстан;\n— от 6 000 000 (шести миллионов) российских рублей для ПВЗ во всех остальных странах и регионах РФ, кроме\nгорода Москва, Московской области, города Санкт-Петербург, Тюменской области, Сахалинской области, Ямало-\nНенецкого автономного округа и города Минск РБ;', 'Прекращение оказания Услуг в ПВЗна период более 30 (тридцати)минут и за каждые следующие 30(тридцать) минут неоказания Услуг:3 000 (три тысячи) рублей для ПВЗ,расположенных в Москве иМосковской области;2 000 (две тысячи) рублей для ПВЗ,', '78% 3,91%3,63%3,42%3,26%3,13%3,03%2,95%2,88%2,83%2,78%\nРеспубликаУзбекистан 4,64% 3,79%3,52%3,31%3,16%3,04%2,94%2,86%2,80%2,74%2,70%\nТарифы для белой зоны:\nСтраны/Оборот 1 000 000\n₽  - 5 000\n000 ₽\n6 000\n000 ₽\n7 000\n0000 ₽\n8 000\n0000 ₽\n9 000\n0000 ₽\n10 000\n0000 ₽\n11 000\n0000 ₽\n12 000\n0000 ₽\n13 000\n0000 ₽\n14 000\n0000 ₽\n15 000\n0000 ₽\nРеспубликаКыргызстан 4,46% 3,65%3,39%3,19%3,05%2,93%2,84%2,76%2,70%2,65%2,61%\nРеспубликаУзбекистан 4,33% 3,54%3,28%3,10%2,95%2,84%2,75%2,68%2,62%2,57%2,53%\n1.3. Фиксированный тариф — процент от Оборота ПВЗ Исполнителя, применяемый для расчета Вознаграждения\nза выдачу дорогостоящих Товаров, для ПВЗ, в Обороте которых доля дорогостоящих Товаров составила 40% (сорок\nпроцентов) и более.', '7. 5.11 Исполнитель обязуется не допускать не согласованноес Заказчиком прекращение оказания Услуг в ПВЗ, в томчисле без предупреждения Заказчика или снарушением сроков, согласованных Сторонами прирасторжении Договора.\nПрекращение оказания Услуг в ПВЗна период более 30 (тридцати)минут и за каждые следующие 30(тридцать) минут неоказания Услуг:3 000 (три тысячи) рублей для ПВЗ,расположенных в Москве иМосковской области;2 000 (две тысячи) рублей для ПВЗ,расположенных в иных регионах,странах.\n8.', '7. 5.11 Исполнитель обязуется не допускать не согласованноес Заказчиком прекращение оказания Услуг в ПВЗ, в томчисле без предупреждения Заказчика или снарушением сроков, согласованных Сторонами прирасторжении Договора.\nПрекращение оказания Услуг в ПВЗна период более 30 (тридцати)минут и за каждые следующие 30(тридцать) минут неоказания Услуг:3 000 (три тысячи) рублей для ПВЗ,расположенных в Москве иМосковской области;2 000 (две тысячи) рублей для ПВЗ,расположенных в иных регионах,странах.\n8. 5.12. Исполнитель обязуется не осуществлять в ПВЗ те видыдеятельности, которые не указаны в Договоре и/или несогласованы с Заказчиком в порядке, установленном наПортале. При осуществлении в ПВЗ инойсогласованной с Заказчиком деятельности недопускается использование рекламных, маркетинговыхматериалов, фирменных вывесок, логотипов, отличныхот тех, правообладателем которых является Заказчик.\nЗа первое нарушение –предупреждение;за каждое следующее выявленноенарушение – 50 000 (пятьдесяттысяч) российских рублей.\n9. 5.13.', 'Для целей применения Фиксированного тарифа Товар признается дорогостоящим в случае, если Стоимость Товара\nравна и выше 10 000 (десяти тысяч) российских рублей.\n2. Виды премий, неустоек, учитываемых при определении размера Вознаграждения\n2.1. Обработка Товаров Продавца\nОбработка Товаров Продавца Исполнителем на ПВЗ может включать в себя следующие виды премий:\n2.1.1. Сумма премии за обработку приемки и возврата Товаров Продавцу равна 15 (пятнадцать) российских рублей\nза 1 (один) Штрихкод (ШК) Товара;\n2.1.2. Сумма премии за обработку приемки Товаров Продавца равна 7 (семь) российских рублей, 50 копеек за 1\n(один) ШК Товара.\n2.1.3. Сумма премии за временное размещение Товаров Продавца в процессе обработки на ПВЗ начисляется с 3\n(третьего) календарного дня нахождения Товара Продавца в ПВЗ, равна 2 (два) российских рубля за 1 (один) ШК\nТовара, а кроме того 20 (двадцать) копеек за каждый литр, размещенного Товара на ПВЗ.\n2.2.', 'Базовый тариф применяется при нижеследующем Обороте ПВЗ Исполнителя:\n— до 4 000 000 (четырех миллионов) российских рублей для ПВЗ в Республике Казахстан;']",Ответ: Дифференцированный тариф.,0.0,0.4528549031981045,0.9999999999666667
Какой минимальный оборот ПВЗ в Республике Казахстан для применения фиксированного тарифа?,"['Базовый тариф применяется при нижеследующем Обороте ПВЗ Исполнителя:\n— до 4 000 000 (четырех миллионов) российских рублей для ПВЗ в Республике Казахстан;\n— до 6 000 000 (шести миллионов) российских рублей для ПВЗ во всех остальных странах и регионах РФ, кроме\nгорода Москва, Московской области, города Санкт-Петербург, Тюменской области, Сахалинской области, Ямало-\nНенецкого автономного округа и города Минск РБ;\n— до 8 000 000 (восьми миллионов) российских рублей для ПВЗ,', 'Базовый тариф применяется при нижеследующем Обороте ПВЗ Исполнителя:\n— до 4 000 000 (четырех миллионов) российских рублей для ПВЗ в Республике Казахстан;\n— до 6 000 000 (шести миллионов) российских рублей для ПВЗ во всех остальных странах и регионах РФ, кроме\nгорода Москва, Московской области, города Санкт-Петербург, Тюменской области, Сахалинской области, Ямало-\nНенецкого автономного округа и города Минск РБ;\n— до 8 000 000 (восьми миллионов) российских рублей для ПВЗ, расположенных в городе Москва, Московской\nобласти, города Санкт-Петербург, Тюменской области, Сахалинской области, Ямало-Ненецком автономном округе и\nгороде Минск РБ.', 'Базовый тариф применяется при нижеследующем Обороте ПВЗ Исполнителя:\n— до 4 000 000 (четырех миллионов) российских рублей для ПВЗ в Республике Казахстан;', 'Дифференцированный тариф применяется при нижеследующем обороте ПВЗ Исполнителя:\n\n— от 4 000 000 (четырех миллионов) российских рублей для ПВЗ в Республике Казахстан;\n— от 6 000 000 (шести миллионов) российских рублей для ПВЗ во всех остальных странах и регионах РФ, кроме\nгорода Москва, Московской области, города Санкт-Петербург, Тюменской области, Сахалинской области, Ямало-\nНенецкого автономного округа и города Минск РБ;\n— от 8 000 000 (восьми миллионов) российских рублей для ПВЗ, расположенных в городе Москва, Московской\nобласти, города Санкт-Петербург, Тюменской области, Сахалинской области, Ямало-Ненецком автономном округе и\nгороде Минск РБ.\nТарифы для фиолетовой зоны:\nСтраны/Оборот 1 000 000\n₽  - 5 000\n000 ₽\n6 000\n000 ₽\n7 000\n0000 ₽\n8 000\n0000 ₽\n9 000\n0000 ₽\n10 000\n0000 ₽\n11 000\n0000 ₽\n12 000\n0000 ₽\n13 000\n0000 ₽\n14 000\n0000 ₽\n15 000\n0000 ₽\nРеспубликаКыргызстан 4,78% 3,', '78% 3,91%3,63%3,42%3,26%3,13%3,03%2,95%2,88%2,83%2,78%\nРеспубликаУзбекистан 4,64% 3,79%3,52%3,31%3,16%3,04%2,94%2,86%2,80%2,74%2,70%\nТарифы для белой зоны:\nСтраны/Оборот 1 000 000\n₽  - 5 000\n000 ₽\n6 000\n000 ₽\n7 000\n0000 ₽\n8 000\n0000 ₽\n9 000\n0000 ₽\n10 000\n0000 ₽\n11 000\n0000 ₽\n12 000\n0000 ₽\n13 000\n0000 ₽\n14 000\n0000 ₽\n15 000\n0000 ₽\nРеспубликаКыргызстан 4,46% 3,65%3,39%3,19%3,05%2,93%2,84%2,76%2,70%2,65%2,61%\nРеспубликаУзбекистан 4,33% 3,54%3,28%3,10%2,95%2,84%2,75%2,68%2,62%2,57%2,53%\n1.3. Фиксированный тариф — процент от Оборота ПВЗ Исполнителя, применяемый для расчета Вознаграждения\nза выдачу дорогостоящих Товаров, для ПВЗ, в Обороте которых доля дорогостоящих Товаров составила 40% (сорок\nпроцентов) и более.', 'Дифференцированный тариф применяется при нижеследующем обороте ПВЗ Исполнителя:\n\n— от 4 000 000 (четырех миллионов) российских рублей для ПВЗ в Республике Казахстан;\n— от 6 000 000 (шести миллионов) российских рублей для ПВЗ во всех остальных странах и регионах РФ, кроме\nгорода Москва, Московской области, города Санкт-Петербург, Тюменской области, Сахалинской области, Ямало-\nНенецкого автономного округа и города Минск РБ;', 'Дифференцированный тариф применяется при нижеследующем обороте ПВЗ Исполнителя:\n\n— от 4 000 000 (четырех миллионов) российских рублей для ПВЗ в Республике Казахстан;', 'Для подачи заявки на открытие ПВЗ Исполнитель:\n• в течение срока, определенного правилами в момента подачи заявки оплачивает Обеспечительный платёж\nпосредством перечисления денежных средств на расчетный счет Заказчика способом, указанным при подаче Заявки,\nи в определенном размере, что также будет отражено в момент подачи заявки Исполнителем для определенных зон\nна Тепловой карте:\nРоссийская Федерация:\n• Условия открытия стандартные – 50 000 (пятьдесят тысяч) российских рублей;\n• Условия открытия упрощенные – 5 000 (пять тысяч) российских рублей;\nРеспублика Казахстан:\n\n• 270 000 (двести семьдесят тысяч) казахстанских тенге (KZT) — оплачивается только после согласования\nс Заказчиком;\nРеспублика Армения:\n• Условия открытия стандартные – 175 000 (сто семьдесят пять тысяч) Армянских драм (AMD);\nУсловия открытия упрощенные – 40 000 (сорок тысяч) Армянских драм (AMD);\nРеспублика Беларусь:\n• Условия открытия стандартные — 1 300 (одна тысяча триста) Белорусских рублей (BYN);\nЕсли страна регистрации Исполнителя и/или условия открытия не указаны в п.', '3.3. Предельная минимальная допустимая площадь ПВЗ, как при стандартных условиях открытия, так и при\nупрощенных, указывается на Тепловой карте https://map.wb.ru/#2/62/56\n3.4. Любой ПВЗ помимо расположения, указанного на Тепловой карте (для ПВЗ по упрощенным условиям открытия\nдопускается расположение в населенных пунктах с численностью населения менее 5 000 (пять тысяч) человек, а для\nРеспублики Казахстан — численностью населения не менее 10 000 (десять тысяч) человек), должен также\nсоответствовать следующим условиям:\n\n• должен быть расположен непосредственно вдоль основных улиц или магистралей с высоким пешеходным и\nавтомобильным трафиком,\n• находиться на первом этаже здания (помещения, расположенные на цокольных этажах, также могут быть\nпредложены к рассмотрению),\n• не должен иметь прохода через сторонние организации, которые могут помешать свободному доступу в ПВЗ,\n• не должен иметь препятствий для свободного доступа в ПВЗ сотрудникам Заказчика, Клиентам, Продавцам и\nПеревозчикам.', '3.3. Предельная минимальная допустимая площадь ПВЗ, как при стандартных условиях открытия, так и при\nупрощенных, указывается на Тепловой карте https://map.wb.ru/#2/62/56\n3.4. Любой ПВЗ помимо расположения, указанного на Тепловой карте (для ПВЗ по упрощенным условиям открытия\nдопускается расположение в населенных пунктах с численностью населения менее 5 000 (пять тысяч) человек, а для\nРеспублики Казахстан — численностью населения не менее 10 000 (десять тысяч) человек),']",Информация о минимальном обороте ПВЗ в Республике Казахстан для применения фиксированного тарифа отсутствует в предоставленном контексте.,1.0,0.0,0.99999999999
Как рассчитывается премия за рейтинг ПВЗ?,"['2.2. Рейтинг ПВЗ Исполнителя\nПремия за Рейтинг ПВЗ Исполнителя рассчитывается за каждую оценку Клиента от 1 до 5 для ПВЗ Исполнителя,\nкоторая может оценивать качество оказания Услуг в ПВЗ, требования к обслуживанию Клиентов и исполнение иных\nправил оказания Услуг (далее — Оценка) по формуле:\n\nР = Стоимость Оценки * Вес Оценки / Коэффициент премирования, где Р — Премия за Рейтинг ПВЗ\nИсполнителя, выплачивается Исполнителю только в результате проставления Оценок (4 и 5).\nСтоимость Оценки — индивидуальный показатель, указанный в ЛК Исполнителя.\nВес Оценки — индивидуальный вес каждой Оценки Клиента, указанный в ЛК Исполнителя.\nКоэффициент премирования — показатель, публикуемый на Портале, означающий среднее значение Веса всех\nОценок всех ПВЗ за определенный период времени, который может быть изменен Заказчиком в одностороннем\nпорядке в случае динамики соответствующего среднего значения. Новое значение Коэффициента премирования\nприменяется для расчета с 00 часов 00 минут дня, следующего за днем, в котором новое значение было\nопубликовано на Портале.\nПремия за Рейтинг ПВЗ отражается на Балансе Исполнителя на дату выставления Оценки.', '2.2. Рейтинг ПВЗ Исполнителя\nПремия за Рейтинг ПВЗ Исполнителя рассчитывается за каждую оценку Клиента от 1 до 5 для ПВЗ Исполнителя,\nкоторая может оценивать качество оказания Услуг в ПВЗ, требования к обслуживанию Клиентов и исполнение иных\nправил оказания Услуг (далее — Оценка) по формуле:\n\nР = Стоимость Оценки * Вес Оценки / Коэффициент премирования, где Р — Премия за Рейтинг ПВЗ\nИсполнителя, выплачивается Исполнителю только в результате проставления Оценок (4 и 5).\nСтоимость Оценки — индивидуальный показатель, указанный в ЛК Исполнителя.', '2.2. Рейтинг ПВЗ Исполнителя\nПремия за Рейтинг ПВЗ Исполнителя рассчитывается за каждую оценку Клиента от 1 до 5 для ПВЗ Исполнителя,\nкоторая может оценивать качество оказания Услуг в ПВЗ,', 'требования к обслуживанию Клиентов и исполнение иных\nправил оказания Услуг (далее — Оценка) по формуле:\n\nР = Стоимость Оценки * Вес Оценки / Коэффициент премирования, где Р — Премия за Рейтинг ПВЗ\nИсполнителя, выплачивается Исполнителю только в результате проставления Оценок (4 и 5).', 'Премия за Рейтинг ПВЗ отражается на Балансе Исполнителя на дату выставления Оценки.', 'Bk рассчитывается каждый календарный день, равный 24 часам, за предыдущий день работы ПВЗ с учетом\nвремени работы в конкретном регионе или стране (Период расчета).\nПремия (показатель Bk) распределяется пропорционально между всеми Исполнителями, своевременно принявшими\nТовары в ПВЗ, в зависимости от скорости приемки Товаров, а также от количества принятых Товаров и Стоимости\nТоваров (в зависимости от объема поставки, а также от времени, затраченного на приемку поставки).\nПремия за скорость приемки Товаров в ПВЗ учитывается при определении Вознаграждения и отражается на Балансе\nИсполнителя.', 'Bk рассчитывается каждый календарный день, равный 24 часам, за предыдущий день работы ПВЗ с учетом\nвремени работы в конкретном регионе или стране (Период расчета).\nПремия (показатель Bk) распределяется пропорционально между всеми Исполнителями, своевременно принявшими\nТовары в ПВЗ, в зависимости от скорости приемки Товаров, а также от количества принятых Товаров и Стоимости\nТоваров (в зависимости от объема поставки, а также от времени, затраченного на приемку поставки).\nПремия за скорость приемки Товаров в ПВЗ учитывается при определении Вознаграждения и отражается на Балансе\nИсполнителя.\nНеустойка применяется к ПВЗ Исполнителя за несвоевременную приемку Товаров (сроки приемки Товара указаны в\nЛК Исполнителя) и рассчитывается в зависимости от установленного времени приемки, количества и Стоимости\nТоваров, которые были приняты медленнее, чем установлено в ЛК Исполнителя.\nСумма неустойки учитывается при определении Вознаграждения и отражается на Балансе Исполнителя.\nИсполнитель вправе оспорить основание, послужившее выставлению неустойки за скорость приемки Товаров в\nотношении своего ПВЗ. Оспаривание Исполнителем производится по правилам раздела 12 Договора.\n2.4.', 'Bk рассчитывается каждый календарный день, равный 24 часам, за предыдущий день работы ПВЗ с учетом\nвремени работы в конкретном регионе или стране (Период расчета).\nПремия (показатель Bk) распределяется пропорционально между всеми Исполнителями,', '2.3. Скорость приемки Товаров Исполнителем в ПВЗ\nСумма мотивационных премий за скорость приемки Товаров в ПВЗ Исполнителей, открытых на стандартных\nусловиях, рассчитывается с использованием следующей формулы:\nBk = St * k, где:\nBk — общая сумма мотивационных премий (определяется в российских рублях), формируется, исходя из общей\nсуммы Стоимостей, принятых в срок Товаров всеми Исполнителями в ПВЗ;\nSt — сумма Стоимостей Товаров, принятых в течение фиксированного времени, обозначенного в ЛК Исполнителя\n(определяется в российских рублях);', 'Вес Оценки — индивидуальный вес каждой Оценки Клиента, указанный в ЛК Исполнителя.\nКоэффициент премирования — показатель, публикуемый на Портале, означающий среднее значение Веса всех\nОценок всех ПВЗ за определенный период времени, который может быть изменен Заказчиком в одностороннем\nпорядке в случае динамики соответствующего среднего значения. Новое значение Коэффициента премирования\nприменяется для расчета с 00 часов 00 минут дня, следующего за днем, в котором новое значение было\nопубликовано на Портале.']","Премия за рейтинг ПВЗ Исполнителя рассчитывается по формуле:

**Р = Стоимость Оценки * Вес Оценки / Коэффициент премирования**, где:

- **Р** — Премия за рейтинг ПВЗ Исполнителя;
- **Стоимость Оценки** — индивидуальный показатель, указанный в ЛК Исполнителя;
- **Вес Оценки** — индивидуальный вес каждой Оценки Клиента, указанный в ЛК Исполнителя;
- **Коэффициент премирования** — показатель, публикуемый на Портале, означающий среднее значение Веса всех Оценок всех ПВЗ за определенный период времени, который может быть изменен Заказчиком в одностороннем порядке.

Премия за рейтинг ПВЗ отражается на Балансе Исполнителя на дату выставления Оценки. Выплата премии происходит только в результате проставления Оценок, равных 4 и 5.",1.0,0.8943733102121961,0.8099999999838
